company,salary_is_predicted,title,created,id,category,adref,location,__CLASS__,redirect_url,description,latitude,longitude,contract_time,salary_max,salary_min,contract_type
"{'display_name': 'OMG Investment + Activation', '__CLASS__': 'Adzuna::API::Response::Company'}",0,Director Data Science (mensch),2025-03-30T21:02:31Z,5119202375,"{'__CLASS__': 'Adzuna::API::Response::Category', 'tag': 'unknown', 'label': 'Unknown'}",eyJhbGciOiJIUzI1NiJ9.eyJpIjoiNTExOTIwMjM3NSIsInMiOiJqc2c4THE1TjhCR3VyTGg5UU1OYlR3In0.TLF9weMgu9cLP2mpU_W1gNKcTohw8FdkEDa7_CwplP8,"{'area': ['Deutschland', 'Hamburg', 'Altona-Altstadt'], 'display_name': 'Altona-Altstadt, Hamburg', '__CLASS__': 'Adzuna::API::Response::Location'}",Adzuna::API::Response::Job,https://www.adzuna.de/details/5119202375?utm_medium=api&utm_source=a4bcf954,"Bei uns sind alle willkommen - unabhängig von Geschlecht, Nationalität, ethnischer und sozialer Herkunft, Religion/Weltanschauung, Behinderung, Alter oder sexueller Orientierung. Wir glauben an eine Kultur des Wissensaustauschs und des gegenseitigen Respekts, die auf dem Wohlbefinden jeder einzelnen Person im Team basiert. Du konzipierst innovative Datenlösungen und leitest datengetriebene Projekte auf Enterprise-Niveau – idealerweise unter Einsatz von Machine Learning und KI. Von der Strategie…",53.54883,9.9477,full_time,,,
"{'__CLASS__': 'Adzuna::API::Response::Company', 'display_name': 'OMG Investment + Activation'}",0,Director Data Science (mensch),2025-03-30T21:29:58Z,5119221769,"{'label': 'Unknown', '__CLASS__': 'Adzuna::API::Response::Category', 'tag': 'unknown'}",eyJhbGciOiJIUzI1NiJ9.eyJzIjoianNnOExxNU44Qkd1ckxoOVFNTmJUdyIsImkiOiI1MTE5MjIxNzY5In0.xTF6v1FGkA4RAJGbkEH12ezgJFjqDazgM35-MWlqCX8,"{'__CLASS__': 'Adzuna::API::Response::Location', 'display_name': 'Friedrichstadt, Düsseldorf', 'area': ['Deutschland', 'Nordrhein-Westfalen', 'Düsseldorf', 'Friedrichstadt']}",Adzuna::API::Response::Job,https://www.adzuna.de/details/5119221769?utm_medium=api&utm_source=a4bcf954,"Bei uns sind alle willkommen - unabhängig von Geschlecht, Nationalität, ethnischer und sozialer Herkunft, Religion/Weltanschauung, Behinderung, Alter oder sexueller Orientierung. Wir glauben an eine Kultur des Wissensaustauschs und des gegenseitigen Respekts, die auf dem Wohlbefinden jeder einzelnen Person im Team basiert. Du konzipierst innovative Datenlösungen und leitest datengetriebene Projekte auf Enterprise-Niveau – idealerweise unter Einsatz von Machine Learning und KI. Von der Strategie…",51.21393,6.78075,full_time,,,
"{'__CLASS__': 'Adzuna::API::Response::Company', 'display_name': 'hachmeister + partner GmbH & Co. KG'}",0,Senior Engineer Machine Learning (m/w/d),2025-06-20T08:10:29Z,5259457604,"{'label': 'Technikerstellen', 'tag': 'engineering-jobs', '__CLASS__': 'Adzuna::API::Response::Category'}",eyJhbGciOiJIUzI1NiJ9.eyJzIjoianNnOExxNU44Qkd1ckxoOVFNTmJUdyIsImkiOiI1MjU5NDU3NjA0In0.X6TVrqgCQnyNxStk3vHevI6ASxNRvNj24XsPvH0dOqg,"{'display_name': 'Bielefeld, Nordrhein-Westfalen', '__CLASS__': 'Adzuna::API::Response::Location', 'area': ['Deutschland', 'Nordrhein-Westfalen', 'Bielefeld']}",Adzuna::API::Response::Job,https://www.adzuna.de/land/ad/5259457604?se=jsg8Lq5N8BGurLh9QMNbTw&utm_medium=api&utm_source=a4bcf954&v=E0FD5930985F058C3DC56EB627645AE622BCB3E0,"hachmeister  partner ist die führende Unternehmensberatung in der Fashion, Sport und Lifestyle Branche. Durch die Vernetzung mit einer Vielzahl von Partnerunternehmen verfügen wir über ein einzigartiges Datenpanel. Dieses bildet die Grundlage unserer Benchmarking Services und Softwarelösungen, die in vielen Kernprozessen der Branche zum Einsatz kommen. Mit unserem Panel werten wir permanent Daten von über 1500 Verkaufspunkten mit einem Jahresumsatz von mehr als 8 Mrd. € aus. Hierzu gehören Kund…",52.021203,8.543293,,,,
"{'display_name': 'LEIFHEIT AG', '__CLASS__': 'Adzuna::API::Response::Company'}",0,Leitung Master Data Management (m/w/d),2025-06-17T20:17:26Z,5255163886,"{'label': 'Unknown', 'tag': 'unknown', '__CLASS__': 'Adzuna::API::Response::Category'}",eyJhbGciOiJIUzI1NiJ9.eyJpIjoiNTI1NTE2Mzg4NiIsInMiOiJqc2c4THE1TjhCR3VyTGg5UU1OYlR3In0.6L1MZ2AN_jpxSQwqpr5a-zy_kmW-_ExBpULEmMiNsF0,"{'area': ['Deutschland', 'Nordrhein-Westfalen', 'Siegen-Wittgenstein (Kreis)', 'Siegen', 'Seelbach'], '__CLASS__': 'Adzuna::API::Response::Location', 'display_name': 'Seelbach, Siegen'}",Adzuna::API::Response::Job,https://www.adzuna.de/land/ad/5255163886?se=jsg8Lq5N8BGurLh9QMNbTw&utm_medium=api&utm_source=a4bcf954&v=228747C21E45C9DB6F0E8E5D1F9EBA747D106234,"Unsere Ideen, die Dein Leben leichter machen: Seit 65 Jahren gehört die Leifheit AG zu den führenden Anbietern von Haushaltswaren in Europa. Mit den Marken Leifheit und Soehnle, zwei der bekanntesten Marken Deutschlands, möchten wir das Leben von Verbrauchern erleichtern. Unsere Geschäftsbereiche sind Reinigung, Wäschepflege, Küchenhelfer, Personen- und Küchenwagen – dabei begeistern wir durch hochwertige und innovative Produkte mit überlegenem Gebrauchsnutzen und funktionalem Design. Rund 1.10…",50.88299,7.96497,,,,
"{'display_name': 'EMSCHERGENOSSENSCHAFT und LIPPEVERBAND', '__CLASS__': 'Adzuna::API::Response::Company'}",0,Gruppenleitung (m/w/d) digitale Transformation,2025-06-17T20:34:35Z,5255326552,"{'__CLASS__': 'Adzuna::API::Response::Category', 'tag': 'consultancy-jobs', 'label': 'Beraterstellen'}",eyJhbGciOiJIUzI1NiJ9.eyJzIjoianNnOExxNU44Qkd1ckxoOVFNTmJUdyIsImkiOiI1MjU1MzI2NTUyIn0.UlwpYtxQ39oAg9y8ChJJtJWAsAZ-xYQuSV8D3j3qk5U,"{'__CLASS__': 'Adzuna::API::Response::Location', 'display_name': 'Essen, Nordrhein-Westfalen', 'area': ['Deutschland', 'Nordrhein-Westfalen', 'Essen']}",Adzuna::API::Response::Job,https://www.adzuna.de/land/ad/5255326552?se=jsg8Lq5N8BGurLh9QMNbTw&utm_medium=api&utm_source=a4bcf954&v=40A62C28C304A84373FE4A1057707BB3DBA6D8F9,"Emschergenossenschaft und Lippeverband – mit gebündelter Kompetenz für das Wasser. Ob Abwasserreinigung, Hochwasserschutz oder die Bewirtschaftung von Grund- und Regenwasser: Mit rund 1.800 Mitarbeitenden verfolgen wir ein gemeinsames Ziel: ökologisch, technisch und gestalterisch überzeugende Lösungen an Emscher und Lippe schaffen. In der Region. Für die Region. Für unsere Abteilung Informationstechnologien suchen wir am Standort Essen zum nächstmöglichen Zeitpunkt in unbefristeter Anstellung e…",51.444823,7.014478,,,,
"{'display_name': 'prenode GmbH', '__CLASS__': 'Adzuna::API::Response::Company'}",0,Praktikum: Data Science und KI,2024-12-10T19:18:43Z,4970710246,"{'label': 'Unknown', '__CLASS__': 'Adzuna::API::Response::Category', 'tag': 'unknown'}",eyJhbGciOiJIUzI1NiJ9.eyJzIjoianNnOExxNU44Qkd1ckxoOVFNTmJUdyIsImkiOiI0OTcwNzEwMjQ2In0.PZA_Ym0Kx14ntbzqQf-fxnHKeFctOil_mFBlOkIOsDw,"{'__CLASS__': 'Adzuna::API::Response::Location', 'display_name': 'Hagsfeld, Karlsruhe', 'area': ['Deutschland', 'Baden-Württemberg', 'Karlsruhe (Kreis)', 'Karlsruhe', 'Hagsfeld']}",Adzuna::API::Response::Job,https://www.adzuna.de/details/4970710246?utm_medium=api&utm_source=a4bcf954,"Deine Aufgaben Sammle wertvolle praktische Erfahrungen in der Anwendung von KI, indem du an spannenden Forschungs- und Kundenprojekten mitwirkst. Nimm an unseren Workshops mit namhaften Kunden teil und unterstütze dabei, kundenspezifische Anforderungen zu identifizieren und Lösungen zu entwickeln. Leite durch fortgeschrittene Analysen und Visualisierungen Erkenntnisse aus Daten ab. Unterstütze bei der Erprobung und Auswahl geeigneter Machine Learning Verfahren. Helfe bei der Implementierung von…",49.03084,8.45882,part_time,,,
"{'__CLASS__': 'Adzuna::API::Response::Company', 'display_name': 'prenode'}",0,Praktikum: Data Science und KI,2024-12-11T12:44:02Z,4971811867,"{'__CLASS__': 'Adzuna::API::Response::Category', 'tag': 'unknown', 'label': 'Unknown'}",eyJhbGciOiJIUzI1NiJ9.eyJzIjoianNnOExxNU44Qkd1ckxoOVFNTmJUdyIsImkiOiI0OTcxODExODY3In0.yydipGTVf3UsnmyzF_rLqO_1KjKDMVjXILaZ8ymEQvE,"{'area': ['Deutschland', 'Baden-Württemberg', 'Karlsruhe (Kreis)', 'Karlsruhe'], '__CLASS__': 'Adzuna::API::Response::Location', 'display_name': 'Karlsruhe, Karlsruhe (Kreis)'}",Adzuna::API::Response::Job,https://www.adzuna.de/details/4971811867?utm_medium=api&utm_source=a4bcf954,"Deine Aufgaben Sammle wertvolle praktische Erfahrungen in der Anwendung von KI, indem du an spannenden Forschungs- und Kundenprojekten mitwirkst. Nimm an unseren Workshops mit namhaften Kunden teil und unterstütze dabei, kundenspezifische Anforderungen zu identifizieren und Lösungen zu entwickeln. Leite durch fortgeschrittene Analysen und Visualisierungen Erkenntnisse aus Daten ab. Unterstütze bei der Erprobung und Auswahl geeigneter Machine Learning Verfahren. Helfe bei der Implementierung von…",49.001249,8.412378,part_time,,,
"{'display_name': 'Mapp Digital Us Llc', '__CLASS__': 'Adzuna::API::Response::Company'}",0,Team Lead Data Science,2024-09-20T13:48:26Z,4870489075,"{'tag': 'unknown', '__CLASS__': 'Adzuna::API::Response::Category', 'label': 'Unknown'}",eyJhbGciOiJIUzI1NiJ9.eyJzIjoianNnOExxNU44Qkd1ckxoOVFNTmJUdyIsImkiOiI0ODcwNDg5MDc1In0.jkPocZOzuGiEe7i-C12GXu8xGj9e8w3XzBqcJnvmHKg,"{'__CLASS__': 'Adzuna::API::Response::Location', 'display_name': 'Berlin, Deutschland', 'area': ['Deutschland', 'Berlin']}",Adzuna::API::Response::Job,https://www.adzuna.de/details/4870489075?utm_medium=api&utm_source=a4bcf954,"INTRODUCTION TO THE COMPANY Webtrekk is one of Europe’s market leaders for Customer Intelligence and Marketing Analytics. Since 2019, we are part of the marketing technology service provider, Mapp, and support marketers and data analysts in understanding and analyzing the behavior of their website and app users across all channels and help to utilize this information specifically for marketing purposes. Our solution, which is based on first-party data, ensures maximum data depth for our custome…",52.507706,13.420806,full_time,,,
"{'display_name': 'niologic', '__CLASS__': 'Adzuna::API::Response::Company'}",0,Trainee Data Science in der Unternehmensberatung,2025-03-13T10:46:40Z,5090920846,"{'__CLASS__': 'Adzuna::API::Response::Category', 'tag': 'consultancy-jobs', 'label': 'Beraterstellen'}",eyJhbGciOiJIUzI1NiJ9.eyJzIjoianNnOExxNU44Qkd1ckxoOVFNTmJUdyIsImkiOiI1MDkwOTIwODQ2In0.F8S5cDAi8lbaoKCkBS8-A0_bcyi3NqIUhEuzYizp9J8,"{'display_name': 'Hürth, Rhein-Erft-Kreis', '__CLASS__': 'Adzuna::API::Response::Location', 'area': ['Deutschland', 'Nordrhein-Westfalen', 'Rhein-Erft-Kreis', 'Hürth']}",Adzuna::API::Response::Job,https://www.adzuna.de/details/5090920846?utm_medium=api&utm_source=a4bcf954,START YOUR CAREER WITH OUR CONSULTING ACTIVITIES IN MACHINE LEARNING! - Bei Niologic bauen wir das führende Beratungsunternehmen für Product Engineering für KI und Location Intelligence in Deutschland auf. Durch die Kombination der Megatrends KI und Location Intelligence wollen wir für unsere Kunden die neuesten Trends in Produktion bringen und ihr tägliches Leben positiv verändern. Entgegen aktueller Branchentrends und mit dem Vertrauen führender Marken im Rücken wollen wir von einem außergewö…,50.87096,6.86811,,,,
"{'__CLASS__': 'Adzuna::API::Response::Company', 'display_name': 'Lidl Stiftung'}",0,Praktikum Data Science in Neckarsulm,2025-05-09T20:37:52Z,5191089945,"{'label': 'Unknown', '__CLASS__': 'Adzuna::API::Response::Category', 'tag': 'unknown'}",eyJhbGciOiJIUzI1NiJ9.eyJzIjoianNnOExxNU44Qkd1ckxoOVFNTmJUdyIsImkiOiI1MTkxMDg5OTQ1In0.m31AsOj-wh5iOdy2Ra080xucF2RrWmdbzNNQRBS0RWA,"{'display_name': 'Deutschland', '__CLASS__': 'Adzuna::API::Response::Location', 'area': ['Deutschland']}",Adzuna::API::Response::Job,https://www.adzuna.de/details/5191089945?utm_medium=api&utm_source=a4bcf954,"Einleitung Eine gute Idee war der Ursprung, ein erfolgreiches Konzept ist das Ergebnis. Qualität zum guten Preis möglichst vielen Menschen anbieten zu können treibt uns an - mittlerweile weltweit, denn wir sind Lidl. Hier ist das berufliche Zuhause vielfältiger Talente. Ob im Einkauf, in der Logistik, im Warengeschäft oder in der IT; ob als Impulsgeber, Gestalter oder Dienstleister der Länder. Wir suchen Anpacker, Durchstarter, Möglichmacher und bieten spannende Aufgaben und Projekte in einem d…",,,full_time,,,
"{'display_name': 'ALDI Nord', '__CLASS__': 'Adzuna::API::Response::Company'}",0,Manager Business Analytics – Procurement (m/w/d),2025-06-06T08:03:08Z,5235769061,"{'tag': 'logistics-warehouse-jobs', '__CLASS__': 'Adzuna::API::Response::Category', 'label': 'Stellen aus Logistik & Lagerhaltung'}",eyJhbGciOiJIUzI1NiJ9.eyJpIjoiNTIzNTc2OTA2MSIsInMiOiJqc2c4THE1TjhCR3VyTGg5UU1OYlR3In0.rXYXNt6b7ZlqmN01oBeGYOUEH1qWZxnIMlTwKPpFm3s,"{'__CLASS__': 'Adzuna::API::Response::Location', 'display_name': 'Essen, Nordrhein-Westfalen', 'area': ['Deutschland', 'Nordrhein-Westfalen', 'Essen']}",Adzuna::API::Response::Job,https://www.adzuna.de/land/ad/5235769061?se=jsg8Lq5N8BGurLh9QMNbTw&utm_medium=api&utm_source=a4bcf954&v=684CFAD80AEE79B2DB1F48CC7A373584D5D1E203,"Die Unternehmensgruppe ALDI Nord ist einer der führenden Lebensmitteleinzelhändler. Mit einer Tradition von über 110 Jahren steht ALDI für die Erfindung des Discount-Prinzips. Unsere Mission ist es, Menschen überall und jederzeit mit dem zu versorgen, was sie für ihr tägliches Leben brauchen: qualitative Produkte zum niedrigen Preis - einfach und schnell. Dazu gehört auch, das Einkaufen für unsere Kundinnen und Kunden so einfach wie möglich zu machen. Dafür geben wir jeden Tag unser Bestes und …",51.444823,7.014478,,,,
"{'__CLASS__': 'Adzuna::API::Response::Company', 'display_name': 'EVAGO Digital GmbH'}",0,Data Engineer/Scientist/Analyst,2025-06-16T08:31:22Z,5252722660,"{'label': 'Unknown', '__CLASS__': 'Adzuna::API::Response::Category', 'tag': 'unknown'}",eyJhbGciOiJIUzI1NiJ9.eyJzIjoianNnOExxNU44Qkd1ckxoOVFNTmJUdyIsImkiOiI1MjUyNzIyNjYwIn0.zDl0-jxy03696GQcAM3iv5yv8IZhVUgEosymOv4my6w,"{'area': ['Deutschland', 'Bayern', 'Fürth (Kreis)', 'Fürth'], 'display_name': 'Fürth, Fürth (Kreis)', '__CLASS__': 'Adzuna::API::Response::Location'}",Adzuna::API::Response::Job,https://www.adzuna.de/land/ad/5252722660?se=jsg8Lq5N8BGurLh9QMNbTw&utm_medium=api&utm_source=a4bcf954&v=EB76061F47723860CFFD1C2F3B3FFB51A69514C0,"About the job Mit über 40 Jahren Erfahrung ist EVAGO einer der größten Anbieter für Eventinfrastruktur. Unsere operativen Unternehmen „MOJO® Rental“ sind in über 30 Ländern der Welt tätig und sind Spezialisten für alles, was vor und hinter den Bühnen der großen Shows der Welt benötigt wird. EVAGO Digital ist das neu Inhouse-Unit um sämtliche Prozesse zu digitalisieren und das E-Commerce-Business zu skalieren. Wir sind ehrgeizig, haben ambitionierte Ziele und sorgen im Hintergrund dafür, dass wi…",49.493698,10.982324,,,,
"{'__CLASS__': 'Adzuna::API::Response::Company', 'display_name': 'BRUNO BADER GmbH + Co. KG'}",0,(Senior) Data Software Engineer / Developer (m/w/d),2025-06-20T08:10:00Z,5259456136,"{'label': 'Unknown', 'tag': 'unknown', '__CLASS__': 'Adzuna::API::Response::Category'}",eyJhbGciOiJIUzI1NiJ9.eyJpIjoiNTI1OTQ1NjEzNiIsInMiOiJqc2c4THE1TjhCR3VyTGg5UU1OYlR3In0.fg0g295EsSxvdtpw3Wlb_dyLq-5AlZZXQ88rbZXWi1A,"{'area': ['Deutschland', 'Baden-Württemberg', 'Pforzheim'], 'display_name': 'Pforzheim, Baden-Württemberg', '__CLASS__': 'Adzuna::API::Response::Location'}",Adzuna::API::Response::Job,https://www.adzuna.de/land/ad/5259456136?se=jsg8Lq5N8BGurLh9QMNbTw&utm_medium=api&utm_source=a4bcf954&v=5FFBD4680EBF0CB3369FAA3AE6637BE50E201D6E,"BADER ist ein Multichannel-Distanzhändler mit über 95-jähriger Geschichte. Familiengeführt in dritter Generation gehört BADER zu den attraktivsten Arbeitgebern der Region. Eine Kultur des Miteinanders sichert den wirtschaftlichen Erfolg in einem Unternehmen mit flachen Hierarchien und kurzen Wegen. BADER wächst und entwickelt sich stetig weiter - deshalb freuen wir uns, wenn auch Du bald unser BADER-Team unterstützt. Hallo, wir sind die Abteilung Data Analytics! Wir bestehen aus fünfzehn Expert…",48.883606,8.697363,,,,
"{'display_name': 'AllDent Zahnzentrum GmbH', '__CLASS__': 'Adzuna::API::Response::Company'}",0,Werkstudent:in im Bereich Marketing (m/w/d),2025-06-08T08:34:36Z,5239822115,"{'label': 'Stellen aus PR, Werbung & Marketing', '__CLASS__': 'Adzuna::API::Response::Category', 'tag': 'pr-advertising-marketing-jobs'}",eyJhbGciOiJIUzI1NiJ9.eyJzIjoianNnOExxNU44Qkd1ckxoOVFNTmJUdyIsImkiOiI1MjM5ODIyMTE1In0.AE5HsX1fJPTVPM4j00kD932NOrwx17xK-wOg4D-Qx-A,"{'display_name': 'München, München (Kreis)', '__CLASS__': 'Adzuna::API::Response::Location', 'area': ['Deutschland', 'Bayern', 'München (Kreis)', 'München']}",Adzuna::API::Response::Job,https://www.adzuna.de/land/ad/5239822115?se=jsg8Lq5N8BGurLh9QMNbTw&utm_medium=api&utm_source=a4bcf954&v=0D59140CF3BAD8610B8317D47B82F106F3CC6E62,"Attraktiver Stundenlohn Flexible Einsatzplanung, abhängig von Deinem Studienplan Zugang zum Rabattportal ""Corporate Benefits"" Arbeit in einem hellen und modernen Büro in München Harmonisches und vertrauensvolles Arbeitsklima in einem freundlichen Team Aufgaben Erstellung von monatlichen Reportings relevanter KPIs für interne und externe Stakeholder Content Management: Unterstützung beim Seiten-Relaunch – Aufbau neuer Seiten, kleinere Textaufträge und strukturelles Testing Unterstützung Social M…",48.137418,11.555737,,,,
"{'display_name': 'LIRA service GmbH', '__CLASS__': 'Adzuna::API::Response::Company'}",0,Informatiker für interne KI-Projekte (m/w/d),2025-06-17T20:37:13Z,5255328267,"{'tag': 'it-jobs', '__CLASS__': 'Adzuna::API::Response::Category', 'label': 'IT-Stellen'}",eyJhbGciOiJIUzI1NiJ9.eyJzIjoianNnOExxNU44Qkd1ckxoOVFNTmJUdyIsImkiOiI1MjU1MzI4MjY3In0.9avDkHoExDvOg6vs2LxjrywvOaCbUqcL-vWyH88Sr8g,"{'area': ['Deutschland', 'Nordrhein-Westfalen', 'Paderborn (Kreis)', 'Paderborn'], 'display_name': 'Paderborn, Paderborn (Kreis)', '__CLASS__': 'Adzuna::API::Response::Location'}",Adzuna::API::Response::Job,https://www.adzuna.de/land/ad/5255328267?se=jsg8Lq5N8BGurLh9QMNbTw&utm_medium=api&utm_source=a4bcf954&v=70BBB520C5D310C6DA06B60DD15DE622E27D11C1,"Die LIRA service GmbH, mit Ihren mittlerweile rund 70 Mitarbeitern, ist exklusiver IT-Dienstleister für die weltweiten Kronospan Standorte. In Sandebeck bzw. in Paderborn findet die Betreuung des hauseigenen ERP Packages mit Kernkomponenten wie Verkaufsabwicklung, Einkaufsprozessen, Produktions-, Lager- und Versandlogistik statt. Dies umfasst Planung, Design, Entwicklung, Test und Betrieb der Software, Support, Datenbankadministration sowie die Netzwerk- und sonstige Informations- und Telekommu…",51.737096,8.753842,,,,
"{'display_name': 'Luxoft Germany', '__CLASS__': 'Adzuna::API::Response::Company'}",0,Senior Data Engineer (m/w/d) - with experience Data Modelling and Data Science  AWS,2025-05-23T06:35:22Z,5211909829,"{'label': 'Unknown', '__CLASS__': 'Adzuna::API::Response::Category', 'tag': 'unknown'}",eyJhbGciOiJIUzI1NiJ9.eyJpIjoiNTIxMTkwOTgyOSIsInMiOiJqc2c4THE1TjhCR3VyTGg5UU1OYlR3In0.bW7MnONicCEmuxOoO3E64hFQ3vnsU9R1uWxwszDEh6o,"{'__CLASS__': 'Adzuna::API::Response::Location', 'display_name': 'Deutschland', 'area': ['Deutschland']}",Adzuna::API::Response::Job,https://www.adzuna.de/land/ad/5211909829?se=jsg8Lq5N8BGurLh9QMNbTw&utm_medium=api&utm_source=a4bcf954&v=F6FC31AF25F6A443DA579C716A5D9B39CC674C89,"Project description In the rapidly evolving landscape of modern mobility and transport services, a significant challenge lies in seamlessly integrating the elements of automotive OEM infrastructure with diverse services of external partners. Luxoft will develop a Cloud platform to exchange, integrate and process data from and to the vehicle, the Mobileye SDS backend, and the MaaS System. The AWS-based solution will be designed by reviewing and improving the current concept in close cooperation …",,,,,,
"{'display_name': 'REWE Group', '__CLASS__': 'Adzuna::API::Response::Company'}",0,(Senior) Data Scientist Analytics (m/w/d),2025-03-18T23:56:35Z,5099803948,"{'label': 'Stellen aus Wissenschaft & Qualitätssicherung', 'tag': 'scientific-qa-jobs', '__CLASS__': 'Adzuna::API::Response::Category'}",eyJhbGciOiJIUzI1NiJ9.eyJzIjoianNnOExxNU44Qkd1ckxoOVFNTmJUdyIsImkiOiI1MDk5ODAzOTQ4In0.T9B9dprUGhLM4060pSEtE2MwDvzMwBjRvn_nmwfmka8,"{'area': ['Deutschland', 'Nordrhein-Westfalen', 'Köln'], '__CLASS__': 'Adzuna::API::Response::Location', 'display_name': 'Köln, Nordrhein-Westfalen'}",Adzuna::API::Response::Job,https://www.adzuna.de/land/ad/5099803948?se=jsg8Lq5N8BGurLh9QMNbTw&utm_medium=api&utm_source=a4bcf954&v=E315CACD4AF23BC36F987AC96F5093E050A3A018,"Aufgaben Profil Wir bieten Ort: 50933 Köln | Vertragsart: Vollzeit, unbefristet | Job-ID: 829295 Was wir zusammen vorhaben: Als Geschäftsbereich Analytics der REWE Group sind wir Teil des Vorstandsressorts Digital & Technology, mit dem wir alle strategischen, analytischen und geschäftsunterstützenden Funktionen innerhalb von Handel Deutschland unter einem Dach zusammenführen. Der Geschäftsbereich verfolgt das Ziel, Advanced Analytics sowie Artificial Intelligence als Fähigkeit und Werttreiber i…",50.940164,6.969972,,,,
"{'__CLASS__': 'Adzuna::API::Response::Company', 'display_name': 'Delivery Hero'}",0,"Senior Manager, Data Science & Insights",2025-06-20T01:42:33Z,5258995565,"{'tag': 'it-jobs', '__CLASS__': 'Adzuna::API::Response::Category', 'label': 'IT-Stellen'}",eyJhbGciOiJIUzI1NiJ9.eyJzIjoianNnOExxNU44Qkd1ckxoOVFNTmJUdyIsImkiOiI1MjU4OTk1NTY1In0.QL6aR0nIWUNYNKlg6QnYBW5ujR7N7jru4tESKaJq1-I,"{'area': ['Deutschland', 'Berlin'], 'display_name': 'Berlin, Deutschland', '__CLASS__': 'Adzuna::API::Response::Location'}",Adzuna::API::Response::Job,https://www.adzuna.de/details/5258995565?utm_medium=api&utm_source=a4bcf954,"Job Description We are on the lookout for a Senior Manager, Data Science & Insights to join the People & Culture team shaping the future of data-driven decision-making at Delivery Hero. You will play a crucial role in enabling our stakeholders to achieve business objectives by bridging the gap between data and actionable insights. You will shape our data strategy, build strong stakeholder relationships, and drive analytics excellence. You will lead a team of up to 7 fostering a culture of excel…",52.507706,13.420806,,,,
"{'__CLASS__': 'Adzuna::API::Response::Company', 'display_name': 'MTU Aero Engines AG'}",0,Werkstudent Data Science / Data Engineering (all genders),2025-04-13T08:27:59Z,5143047914,"{'label': 'Unknown', '__CLASS__': 'Adzuna::API::Response::Category', 'tag': 'unknown'}",eyJhbGciOiJIUzI1NiJ9.eyJpIjoiNTE0MzA0NzkxNCIsInMiOiJqc2c4THE1TjhCR3VyTGg5UU1OYlR3In0.gn_y2w3nUI42YgRijR9DT2cU0CzZk-RRjuTN7VHeqJE,"{'display_name': 'München, München (Kreis)', '__CLASS__': 'Adzuna::API::Response::Location', 'area': ['Deutschland', 'Bayern', 'München (Kreis)', 'München']}",Adzuna::API::Response::Job,https://www.adzuna.de/details/5143047914?utm_medium=api&utm_source=a4bcf954,"UPLIFTYOURFUTURE Wir sind über 13.000. An 19 Standorten weltweit. Jedes dritte Flugzeug fliegt mit unserer Technologie. Immer effizienter, leiser, nachhaltiger. Wir gestalten die Zukunft der Luftfahrt. Was wir noch brauchen? Dich. Unser Team sucht Dich: Werkstudent Data Science / Data Engineering (all genders) in München Kennziffer – WS MUC MCID Bei der Instandhaltung von Flugzeugtriebwerken entstehen eine Vielzahl verschiedenster Daten. Erst wenn diese Informationen aufbereitet, geprüft und zu…",48.137418,11.555737,part_time,,,contract
"{'__CLASS__': 'Adzuna::API::Response::Company', 'display_name': 'MTU Aero Engines AG'}",0,Werkstudent Data Science / Data Engineering (all genders),2025-04-16T21:50:01Z,5148236983,"{'label': 'Stellen aus Fertigung', 'tag': 'manufacturing-jobs', '__CLASS__': 'Adzuna::API::Response::Category'}",eyJhbGciOiJIUzI1NiJ9.eyJzIjoianNnOExxNU44Qkd1ckxoOVFNTmJUdyIsImkiOiI1MTQ4MjM2OTgzIn0.FvcRKwy8vqins3qvS8zlyoFyZb3kV62fAsCPz3b6ltc,"{'area': ['Deutschland', 'Bayern', 'München (Kreis)', 'München', 'Allach-Untermenzing'], 'display_name': 'Allach-Untermenzing, München', '__CLASS__': 'Adzuna::API::Response::Location'}",Adzuna::API::Response::Job,https://www.adzuna.de/details/5148236983?utm_medium=api&utm_source=a4bcf954,"UPLIFT Y OURFUTURE Wir sind über 13.000. An 19 Standorten weltweit. Jedes dritte Flugzeug fliegt mit unserer Technologie. Immer effizienter, leiser, nachhaltiger. Wir gestalten die Zukunft der Luftfahrt. Was wir noch brauchen? Dich. Unser Team in München sucht Dich: Werkstudent Data Science / Data Engineering (all genders) Bei der Instandhaltung von Flugzeugtriebwerken entstehen eine Vielzahl verschiedenster Daten. Erst wenn diese Informationen aufbereitet, geprüft und zusammengeführt sind, kön…",48.18449,11.44811,part_time,,,
"{'__CLASS__': 'Adzuna::API::Response::Company', 'display_name': 'Manpower'}",0,Software Engineer (gn) Data Science,2025-05-23T00:13:06Z,5211608584,"{'label': 'Unknown', '__CLASS__': 'Adzuna::API::Response::Category', 'tag': 'unknown'}",eyJhbGciOiJIUzI1NiJ9.eyJzIjoianNnOExxNU44Qkd1ckxoOVFNTmJUdyIsImkiOiI1MjExNjA4NTg0In0.WtahEDOrxBGLr797v33IVUEGZqAaB3zNVQE0TNGn64Y,"{'area': ['Deutschland', 'Thüringen', 'Jena'], 'display_name': 'Jena, Thüringen', '__CLASS__': 'Adzuna::API::Response::Location'}",Adzuna::API::Response::Job,https://www.adzuna.de/details/5211608584?utm_medium=api&utm_source=a4bcf954,"Software Engineer (gn) Data Science Du suchst einen neuen Job? Dann bist Du hier genau richtig! Wir suchen einen&nbsp; Software Engineer (gn) für den Standort Jena . Kernaufgaben der Stelle: Erstellung von Software für Medizinprodukte mit Fokus auf molekularbiologische Tests, Software für Prüfaufbauten zur Herstellung und Wartung sowie Entwicklung von Medizinprodukten. Unser Angebot: Eine fest kalkulierbare Entlohnung&nbsp; Unbefristeter Arbeitsvertrag Weihnachts- und Urlaubsgeld Schnelle und r…",50.923007,11.589469,,,,
