description,__CLASS__,category,title,company,latitude,id,salary_is_predicted,location,longitude,redirect_url,created,adref,contract_time,salary_max,salary_min,contract_type
"WHAT MAKES US A GREAT PLACE TO WORKWe are proud to be consistently recognized as one of the worlds best places to work. We are currently the 1 ranked consulting firm on Glassdoors Best Places to Work list and have maintained a spot in the top four since the list began in 2009. Extraordinary teams are at the heart of our business strategybut they dont happen by chance. They require intentional focus on bringing together a broad set of backgrounds, cultures, experiences, perspectives, and skills …",Adzuna::API::Response::Job,"{'__CLASS__': 'Adzuna::API::Response::Category', 'tag': 'unknown', 'label': 'Unknown'}",Lead Data Science,"{'__CLASS__': 'Adzuna::API::Response::Company', 'display_name': 'Bain & Company'}",,5347670716,0,"{'__CLASS__': 'Adzuna::API::Response::Location', 'area': ['Deutschland', 'Bayern', 'München (Kreis)', 'München'], 'display_name': 'München, München (Kreis)'}",,https://www.adzuna.de/details/5347670716?utm_medium=api&utm_source=a4bcf954,2025-08-11T10:50:27Z,eyJhbGciOiJIUzI1NiJ9.eyJzIjoiNnVuUkVRU2Q4QkdadmVkSF9sS01QUSIsImkiOiI1MzQ3NjcwNzE2In0.tkvzG0bIRw8fNchSc8abfZQIwHZoKl3r3WLAoM3pRTM,,,,
"DESCRIPTION & REQUIREMENTS We invite current students and recent graduates with up to two years of experience to join our immersive data science internship. It'll offer broad exposure to projects involving machine learning and generative AI. You'll be staffed on one of our case teams and do real work interfacing with clients. If successful in the internship, it may lead to an offer to join us as Data Scientist. This is a unique opportunity to work as an intern data scientist at a top strategy c…",Adzuna::API::Response::Job,"{'tag': 'unknown', '__CLASS__': 'Adzuna::API::Response::Category', 'label': 'Unknown'}","Intern, Data Science","{'display_name': 'Bain & Company', '__CLASS__': 'Adzuna::API::Response::Company'}",,5397482214,0,"{'display_name': 'München, München (Kreis)', 'area': ['Deutschland', 'Bayern', 'München (Kreis)', 'München'], '__CLASS__': 'Adzuna::API::Response::Location'}",,https://www.adzuna.de/details/5397482214?utm_medium=api&utm_source=a4bcf954,2025-09-13T11:13:46Z,eyJhbGciOiJIUzI1NiJ9.eyJzIjoiNnVuUkVRU2Q4QkdadmVkSF9sS01QUSIsImkiOiI1Mzk3NDgyMjE0In0.MOXTbPzUaMLITMpmkoJQvTinBY2Izn5O-aRL9Gdgtfs,,,,
"Deine Aufgaben Werde für 4-6 Monate Teil unseres Daten & KI Teams, unterstütze datenbasierte Analysen und entwickle innovative Automatisierungslösungen. … konkret heißt das: Erhalte Einblicke in Big Data und Machine Learning Technologien Wirke mit bei Datenerhebung, -aufbereitung und explorativer Analyse Entwickle, validiere und pilotiere KI- und Statistik-basierte Lösungen für automatisierte Entscheidungen in Fachabteilungen. Bringe dich in die strategische Definition von Daten- & KI-Themen ei…",Adzuna::API::Response::Job,"{'tag': 'unknown', '__CLASS__': 'Adzuna::API::Response::Category', 'label': 'Unknown'}",Praktikum Data Science,"{'display_name': 'Lidl Stiftung', '__CLASS__': 'Adzuna::API::Response::Company'}",49.18975,5374421750,0,"{'__CLASS__': 'Adzuna::API::Response::Location', 'area': ['Deutschland', 'Baden-Württemberg', 'Heilbronn (Kreis)', 'Neckarsulm'], 'display_name': 'Neckarsulm, Heilbronn (Kreis)'}",9.2274,https://www.adzuna.de/details/5374421750?utm_medium=api&utm_source=a4bcf954,2025-08-29T23:47:41Z,eyJhbGciOiJIUzI1NiJ9.eyJzIjoiNnVuUkVRU2Q4QkdadmVkSF9sS01QUSIsImkiOiI1Mzc0NDIxNzUwIn0.S5Mtcwh-vlfDYXBS18BZlzl8K7asLtBLX5DvZ72IooU,full_time,,,
"Als primärer Digitalisierungspartner der Bundeswehr erbringen wir stabile, sichere und effiziente IT-Services im In- und Ausland, vom Grundbetrieb bis in den einsatznahen Bereich und tragen so zur kontinuierlichen Erhöhung der Führungs- und Einsatzfähigkeit der Bundeswehr bei. Mit über 7.700 Kolleg*innen betreiben und modernisieren wir eine der größten und komplexesten IT-Infrastrukturen in Deutschland. Wir suchen verantwortungsvolle IT-Spezialist*innen, die die Bundeswehr-IT aus Überzeugung in…",Adzuna::API::Response::Job,"{'tag': 'engineering-jobs', '__CLASS__': 'Adzuna::API::Response::Category', 'label': 'Technikerstellen'}",Senior IT Expert DevOps / Platform Engineering (m/w/d),"{'display_name': 'BWI GmbH', '__CLASS__': 'Adzuna::API::Response::Company'}",52.507706,5418982284,0,"{'area': ['Deutschland', 'Berlin'], 'display_name': 'Berlin, Deutschland', '__CLASS__': 'Adzuna::API::Response::Location'}",13.420806,https://www.adzuna.de/land/ad/5418982284?se=6unREQSd8BGZvedH_lKMPQ&utm_medium=api&utm_source=a4bcf954&v=69BB717CDBBC5AB02091342B81733EF689BA40FE,2025-09-28T08:34:08Z,eyJhbGciOiJIUzI1NiJ9.eyJzIjoiNnVuUkVRU2Q4QkdadmVkSF9sS01QUSIsImkiOiI1NDE4OTgyMjg0In0.w_Jc8qJpAumdikRgkFFXkx9cywrEoU9tl673J1_Nvvw,,,,
"adjoe is a leading mobile ad platform developing cutting-edge advertising and monetization solutions that take its app partners’ business to the next level. Part of the applike group ecosystem, adjoe is home to an advanced tech stack , powerful financial backing from Bertelsmann, and a highly motivated workforce to be reckoned with. Meet Your Team: Programamtic Data Science Did you know that in-app ads are sold in a real-time auction before they get rendered in thousands of mobile apps? Dozens …",Adzuna::API::Response::Job,"{'label': 'IT-Stellen', 'tag': 'it-jobs', '__CLASS__': 'Adzuna::API::Response::Category'}",Data Science Lead (Programmatic Data Science) (f/m/d),"{'display_name': 'adjoe GmbH', '__CLASS__': 'Adzuna::API::Response::Company'}",53.557429,5306139116,0,"{'__CLASS__': 'Adzuna::API::Response::Location', 'display_name': 'Hamburg, Deutschland', 'area': ['Deutschland', 'Hamburg']}",9.987297,https://www.adzuna.de/details/5306139116?utm_medium=api&utm_source=a4bcf954,2025-07-16T10:31:31Z,eyJhbGciOiJIUzI1NiJ9.eyJpIjoiNTMwNjEzOTExNiIsInMiOiI2dW5SRVFTZDhCR1p2ZWRIX2xLTVBRIn0.YhvVtpgVTxJxvM-Oz5KYW8GxUpbunhf9gUV1vMN0g68,,,,
"Publicis Media ist das weltweit zweitgrößte Mediaagenturnetzwerk und Teil des französischen Kommunikationskonzerns Publicis Groupe. Als globale Holding lebt Publicis Media durch seine globalen Agenturmarken Zenith, Starcom und Spark Foundry, die das Kundengeschäft in der strategischen Kommunikationsberatung in über 100 Ländern steuern und ständig weiterentwickeln. Darüber hinaus unterstützen bei Publicis Media zentrale Spezialistenteams die Kunden der Agenturen in den Bereichen: Data und Techno…",Adzuna::API::Response::Job,"{'__CLASS__': 'Adzuna::API::Response::Category', 'tag': 'unknown', 'label': 'Unknown'}",Media Application Manager / System Engineer - (m/w/d),"{'__CLASS__': 'Adzuna::API::Response::Company', 'display_name': 'Publicis Media GmbH'}",51.226802,5420227389,0,"{'__CLASS__': 'Adzuna::API::Response::Location', 'display_name': 'Düsseldorf, Nordrhein-Westfalen', 'area': ['Deutschland', 'Nordrhein-Westfalen', 'Düsseldorf']}",6.808387,https://www.adzuna.de/land/ad/5420227389?se=6unREQSd8BGZvedH_lKMPQ&utm_medium=api&utm_source=a4bcf954&v=7D6C55FC7E88D67E128B724EE0BF4AEA9E1F1916,2025-09-29T08:34:20Z,eyJhbGciOiJIUzI1NiJ9.eyJpIjoiNTQyMDIyNzM4OSIsInMiOiI2dW5SRVFTZDhCR1p2ZWRIX2xLTVBRIn0.xcq25XzuC-X4rpHQtTyxiWqqkhmKB-oeTPpW6fiyJjk,,,,
"Das sind wir Daten sind für uns nicht gleich Daten. Du teilst unsere Mission ""Mehr aus Daten rausholen""? Dann bist Du als Newbie oder erfahrenes Data Science Talent bei uns mehr als willkommen! Bei SKOPOS ELEMENTS unterstützen talentierte Data Scientists zukunftsorientierte Unternehmen und Menschen bei ihrem Weg zur Data Driven Company. Als Teil der SKOPOS GROUP sind wir seit 1995 führender Anbieter in der Marktforschung und beschäftigen aktuell über 120 Mitarbeitende. Begleite unser Wachstum u…",Adzuna::API::Response::Job,"{'__CLASS__': 'Adzuna::API::Response::Category', 'tag': 'unknown', 'label': 'Unknown'}",Initiativbewerbung Data Science /BI,"{'__CLASS__': 'Adzuna::API::Response::Company', 'display_name': 'Skopos Group'}",50.87096,4931268614,0,"{'area': ['Deutschland', 'Nordrhein-Westfalen', 'Rhein-Erft-Kreis', 'Hürth'], 'display_name': 'Hürth, Rhein-Erft-Kreis', '__CLASS__': 'Adzuna::API::Response::Location'}",6.86811,https://www.adzuna.de/details/4931268614?utm_medium=api&utm_source=a4bcf954,2024-11-08T12:45:45Z,eyJhbGciOiJIUzI1NiJ9.eyJpIjoiNDkzMTI2ODYxNCIsInMiOiI2dW5SRVFTZDhCR1p2ZWRIX2xLTVBRIn0.v94QlzJOnm3h5FKzrnl7KRyptcHU6HOsUUldhiodLuQ,full_time,,,
"Das sind wir Daten sind für uns nicht gleich Daten. Du teilst unsere Mission ""Mehr aus Daten rausholen""? Dann bist Du als Newbie oder erfahrenes Data Science Talent bei uns mehr als willkommen! Bei SKOPOS ELEMENTS unterstützen talentierte Data Scientists zukunftsorientierte Unternehmen und Menschen bei ihrem Weg zur Data Driven Company. Als Teil der SKOPOS GROUP sind wir seit 1995 führender Anbieter in der Marktforschung und beschäftigen aktuell über 120 Mitarbeitende. Begleite unser Wachstum u…",Adzuna::API::Response::Job,"{'label': 'Unknown', 'tag': 'unknown', '__CLASS__': 'Adzuna::API::Response::Category'}",Initiativbewerbung Data Science /BI,"{'__CLASS__': 'Adzuna::API::Response::Company', 'display_name': 'SKOPOS GROUP'}",50.87096,5416817660,0,"{'__CLASS__': 'Adzuna::API::Response::Location', 'display_name': 'Hürth, Rhein-Erft-Kreis', 'area': ['Deutschland', 'Nordrhein-Westfalen', 'Rhein-Erft-Kreis', 'Hürth']}",6.86811,https://www.adzuna.de/details/5416817660?utm_medium=api&utm_source=a4bcf954,2025-09-27T04:18:22Z,eyJhbGciOiJIUzI1NiJ9.eyJzIjoiNnVuUkVRU2Q4QkdadmVkSF9sS01QUSIsImkiOiI1NDE2ODE3NjYwIn0.oUzoeHrlo5VBUA1_B8JiQyYJR0eSv5mIuzbzpd28vNE,full_time,,,
"Short Facts Join us on our journey : We at Flexa and Entrix are a diverse team of 50, from 12 nationalities, and steadily growing. To drive the smart and sustainable energy future, we are looking for a forward-thinking and experienced Head of Data Science (d/f/m) who shares our vision and values. A pioneering Head of Data Science to lead and grow our Data Science team with innovation, foster talent and teamwork, and drive our offering's growth in alignment with and exceeding Flexa's strategic g…",Adzuna::API::Response::Job,"{'label': 'Unknown', '__CLASS__': 'Adzuna::API::Response::Category', 'tag': 'unknown'}",Head of Data Science,"{'__CLASS__': 'Adzuna::API::Response::Company', 'display_name': 'Flexa'}",48.1476,5180670474,0,"{'display_name': 'Maxvorstadt, München', 'area': ['Deutschland', 'Bayern', 'München (Kreis)', 'München', 'Maxvorstadt'], '__CLASS__': 'Adzuna::API::Response::Location'}",11.56803,https://www.adzuna.de/details/5180670474?utm_medium=api&utm_source=a4bcf954,2025-05-04T21:27:47Z,eyJhbGciOiJIUzI1NiJ9.eyJpIjoiNTE4MDY3MDQ3NCIsInMiOiI2dW5SRVFTZDhCR1p2ZWRIX2xLTVBRIn0.cEE-OMU8v0Ld5QQjjxbrgwW_lZ5MqjeJg_Tr-sgORRY,full_time,140000.0,100000.0,
"About the Role: At Centric, we help some of the world’s most recognized fashion, beauty, and home brands make smarter pricing and inventory decisions with the power of AI. As a (Senior) Data Scientist / Consultant, you’ll combine deep analytical expertise with a consulting mindset — applying advanced data techniques while working directly with clients to turn insights into measurable impact. This role is ideal if you enjoy problem-solving, explaining complex concepts clearly, and collaborating …",Adzuna::API::Response::Job,"{'label': 'IT-Stellen', '__CLASS__': 'Adzuna::API::Response::Category', 'tag': 'it-jobs'}",(Senior) Data Science Consultant,"{'__CLASS__': 'Adzuna::API::Response::Company', 'display_name': 'Centric Software'}",51.226802,5383432819,0,"{'display_name': 'Düsseldorf, Nordrhein-Westfalen', 'area': ['Deutschland', 'Nordrhein-Westfalen', 'Düsseldorf'], '__CLASS__': 'Adzuna::API::Response::Location'}",6.808387,https://www.adzuna.de/details/5383432819?utm_medium=api&utm_source=a4bcf954,2025-09-04T22:25:05Z,eyJhbGciOiJIUzI1NiJ9.eyJzIjoiNnVuUkVRU2Q4QkdadmVkSF9sS01QUSIsImkiOiI1MzgzNDMyODE5In0.NTKbqWkWDOOoqCs0FNLOLSPdLTZW9D4XsRm86bTjAvg,full_time,,,
"INTRODUCTION TO THE COMPANY Webtrekk is one of Europe’s market leaders for Customer Intelligence and Marketing Analytics. Since 2019, we are part of the marketing technology service provider, Mapp, and support marketers and data analysts in understanding and analyzing the behavior of their website and app users across all channels and help to utilize this information specifically for marketing purposes. Our solution, which is based on first-party data, ensures maximum data depth for our custome…",Adzuna::API::Response::Job,"{'tag': 'unknown', '__CLASS__': 'Adzuna::API::Response::Category', 'label': 'Unknown'}",Team Lead Data Science,"{'__CLASS__': 'Adzuna::API::Response::Company', 'display_name': 'Mapp Digital Us Llc'}",52.507706,4870489075,0,"{'display_name': 'Berlin, Deutschland', 'area': ['Deutschland', 'Berlin'], '__CLASS__': 'Adzuna::API::Response::Location'}",13.420806,https://www.adzuna.de/details/4870489075?utm_medium=api&utm_source=a4bcf954,2024-09-20T13:48:26Z,eyJhbGciOiJIUzI1NiJ9.eyJzIjoiNnVuUkVRU2Q4QkdadmVkSF9sS01QUSIsImkiOiI0ODcwNDg5MDc1In0.ezW594yc0E6vBqYBrqQN8SI4IsnGhiUc1h3Foxd46Is,full_time,,,
"Deine Aufgaben Werde für 4-6 Monate Teil unseres Daten & KI Teams, unterstütze datenbasierte Analysen und entwickle innovative Automatisierungslösungen. … konkret heißt das: Erhalte Einblicke in Big Data und Machine Learning Technologien Wirke mit bei Datenerhebung, -aufbereitung und explorativer Analyse Entwickle, validiere und pilotiere KI- und Statistik-basierte Lösungen für automatisierte Entscheidungen in Fachabteilungen. Bringe dich in die strategische Definition von Daten- & KI-Themen ei…",Adzuna::API::Response::Job,"{'label': 'Unknown', 'tag': 'unknown', '__CLASS__': 'Adzuna::API::Response::Category'}",Praktikum Data Science in Neckarsulm,"{'display_name': 'Lidl Stiftung', '__CLASS__': 'Adzuna::API::Response::Company'}",,5373364143,0,"{'area': ['Deutschland'], 'display_name': 'Deutschland', '__CLASS__': 'Adzuna::API::Response::Location'}",,https://www.adzuna.de/details/5373364143?utm_medium=api&utm_source=a4bcf954,2025-08-29T14:57:18Z,eyJhbGciOiJIUzI1NiJ9.eyJzIjoiNnVuUkVRU2Q4QkdadmVkSF9sS01QUSIsImkiOiI1MzczMzY0MTQzIn0.uttAs_aIWh9sn3j6avBGhSordlgJGN8NI5bEThjXM7I,full_time,,,
"Aufgaben Profil Wir bieten Rund 3.500 Kolleginnen und Kollegen haben bei uns bereits ihr berufliches Zuhause gefunden und gestalten das Heute und Morgen der Sparkasse KölnBonn maßgeblich mit. Gerade als traditionsbewusste Arbeitgeberin sind wir uns der Verantwortung für die Zukunft unserer Region bewusst. Steuere, gestalte diese Zukunft mit, und schreib deine Abschlussarbeit– Methodenvergleich: Messung von Marktanteilen im Finanzsektor als Bachelorand/Masterand (m/w/d) bei der Sparkasse KölnBon…",Adzuna::API::Response::Job,"{'tag': 'unknown', '__CLASS__': 'Adzuna::API::Response::Category', 'label': 'Unknown'}",Bachelorand/Masterand – Messung von Marktanteilen im Finanzsektor (m/w/d) bei der Sparkasse KölnBonn,"{'display_name': 'Sparkasse KölnBonn', '__CLASS__': 'Adzuna::API::Response::Company'}",50.940164,5385072050,0,"{'__CLASS__': 'Adzuna::API::Response::Location', 'display_name': 'Köln, Nordrhein-Westfalen', 'area': ['Deutschland', 'Nordrhein-Westfalen', 'Köln']}",6.969972,https://www.adzuna.de/land/ad/5385072050?se=6unREQSd8BGZvedH_lKMPQ&utm_medium=api&utm_source=a4bcf954&v=4FBED92952F0DC3290E1DD30F3AAE5FFCCD7B2E1,2025-09-05T20:15:49Z,eyJhbGciOiJIUzI1NiJ9.eyJpIjoiNTM4NTA3MjA1MCIsInMiOiI2dW5SRVFTZDhCR1p2ZWRIX2xLTVBRIn0.a3vkPm642N82EDnUWnDih6UlovQ4lwuLwNtCkbtPGBc,,,,
"Das Hauptzollamt Bremen sucht am Standort Bremerhaven : Zwei Beschäftigte (m/w/d) im Sachgebiet E – Finanzkontrolle Schwarzarbeit - im Bereich IT- Digitale Forensik bei der Zollverwaltung Entgeltgruppe E 9b TVöD, Besoldungsgruppe A 9g BBesO Im Rahmen einer externen Personalverstärkungsmaßnahme der Zollverwaltung sucht das Hauptzollamt Bremen zwei Beschäftigte (m/w/d) im Sachgebiet E – Finanzkontrolle Schwarzarbeit - Bereich IT - Digitale Forensik - am Standort Barkhausenstraße 60, 27568 Bremerh…",Adzuna::API::Response::Job,"{'tag': 'unknown', '__CLASS__': 'Adzuna::API::Response::Category', 'label': 'Unknown'}",IT-Forensiker*in Finanzkontrolle Schwarzarbeit (m/w/d),"{'__CLASS__': 'Adzuna::API::Response::Company', 'display_name': 'Hauptzollamt Bremen'}",53.548992,5385071927,0,"{'__CLASS__': 'Adzuna::API::Response::Location', 'area': ['Deutschland', 'Bremen', 'Bremerhaven'], 'display_name': 'Bremerhaven, Bremen'}",8.595073,https://www.adzuna.de/land/ad/5385071927?se=6unREQSd8BGZvedH_lKMPQ&utm_medium=api&utm_source=a4bcf954&v=208AD8220D5B553F23F694E222C2FE58F0C15F45,2025-09-05T20:15:48Z,eyJhbGciOiJIUzI1NiJ9.eyJzIjoiNnVuUkVRU2Q4QkdadmVkSF9sS01QUSIsImkiOiI1Mzg1MDcxOTI3In0.g7o4DQRFCe6vDzfvsjmSigxGL9f4Hh1Oow1PSb9_AhE,,,,
"Tagtäglich engagieren sich rund 15‘000 Mitarbeitende im Netzwerk von Valora, um den Menschen unterwegs mit einem umfassenden Foodvenience-Angebot das kleine Glück zu bringen – nah, schnell, praktisch und frisch. Die rund 2‘700 kleinflächigen Verkaufsstellen von Valora befinden sich an Hochfrequenzlagen in der Schweiz, Deutschland, Österreich, Luxemburg und den Niederlanden. Zum Unternehmen gehören unter anderem k kiosk, Brezelkönig, BackWerk, Ditsch, Press & Books, avec, Caffè Spettacolo, Fritt…",Adzuna::API::Response::Job,"{'tag': 'it-jobs', '__CLASS__': 'Adzuna::API::Response::Category', 'label': 'IT-Stellen'}",Senior IT Senior Engineer Fullstack (m/w/d),"{'__CLASS__': 'Adzuna::API::Response::Company', 'display_name': 'Valora Food Service Deutschland GmbH'}",51.444823,5381356886,0,"{'area': ['Deutschland', 'Nordrhein-Westfalen', 'Essen'], 'display_name': 'Essen, Nordrhein-Westfalen', '__CLASS__': 'Adzuna::API::Response::Location'}",7.014478,https://www.adzuna.de/land/ad/5381356886?se=6unREQSd8BGZvedH_lKMPQ&utm_medium=api&utm_source=a4bcf954&v=C70AB454EE53342D9E5B95D91578D4B74A848D95,2025-09-03T20:00:19Z,eyJhbGciOiJIUzI1NiJ9.eyJzIjoiNnVuUkVRU2Q4QkdadmVkSF9sS01QUSIsImkiOiI1MzgxMzU2ODg2In0.OpI6s7KtNryHhq0uM35-UCvJJYoHEOcQ6dErr6RGkXU,,,,
"BRUNATA-METRONA Hamburg ist ein inhaber­geführtes mittelständisches Familien­unter­nehmen und Teil der bundesweit erfolgreichen BRUNATA-METRONA-Gruppe. Als eines der marktführenden Unternehmen stehen wir seit mehr als sechs Jahrzehnten für Know-how und Innovation bei allen Prozessen rund um die Erfassung und Abrechnung von Energie- und Wasserverbrauch. Unsere Mission besteht darin, die nachhaltige und intelligente Nutzung von Immobilien zu ermöglichen. Wir unterstützen und begleiten Eigentümer:…",Adzuna::API::Response::Job,"{'__CLASS__': 'Adzuna::API::Response::Category', 'tag': 'unknown', 'label': 'Unknown'}",Senior Data Management Expert (m/w/d),"{'__CLASS__': 'Adzuna::API::Response::Company', 'display_name': 'BRUNATA Wärmemesser Hagen GmbH & Co. KG'}",53.557429,5379816059,0,"{'__CLASS__': 'Adzuna::API::Response::Location', 'area': ['Deutschland', 'Hamburg'], 'display_name': 'Hamburg, Deutschland'}",9.987297,https://www.adzuna.de/land/ad/5379816059?se=6unREQSd8BGZvedH_lKMPQ&utm_medium=api&utm_source=a4bcf954&v=261983DA21745C711AE2BCC3B40FD749AA4D1D81,2025-09-02T20:00:09Z,eyJhbGciOiJIUzI1NiJ9.eyJpIjoiNTM3OTgxNjA1OSIsInMiOiI2dW5SRVFTZDhCR1p2ZWRIX2xLTVBRIn0.doTjZi0jZJtpnkPGXQASgrB992uekZj0VMAFjV2_7do,,,,
"Bei uns kannst Du erleben, was passiert, wenn zwei große Konzerne ein gemeinsames Ziel verfolgen: Glasfaser Nordwest , das Joint Venture von EWE und Deutsche Telekom, sucht Verstärkung. Sei ab sofort für unseren Standort in Oldenburg dabei – als IT Innovationsmanager (m/w/d) Kennziffer: 12839 Aufgaben Technologie-Scouting: Du identifizierst und bewertest neue Technologien (z. B. GenAI, KI, Automatisierung, Cloud, IoT). Pilotierung & Prototyping: Du bist für die Entwicklung und Umsetzung von Pro…",Adzuna::API::Response::Job,"{'tag': 'it-jobs', '__CLASS__': 'Adzuna::API::Response::Category', 'label': 'IT-Stellen'}",IT Innovationsmanager (m/w/d),"{'display_name': 'Glasfaser NordWest GmbH & Co. KG', '__CLASS__': 'Adzuna::API::Response::Company'}",53.147169,5406498130,0,"{'display_name': 'Oldenburg, Oldenburg (Kreis)', 'area': ['Deutschland', 'Niedersachsen', 'Oldenburg (Kreis)', 'Oldenburg'], '__CLASS__': 'Adzuna::API::Response::Location'}",8.218802,https://www.adzuna.de/land/ad/5406498130?se=6unREQSd8BGZvedH_lKMPQ&utm_medium=api&utm_source=a4bcf954&v=0C930569B2587D2F27282DCBC183004D84053449,2025-09-19T08:25:34Z,eyJhbGciOiJIUzI1NiJ9.eyJzIjoiNnVuUkVRU2Q4QkdadmVkSF9sS01QUSIsImkiOiI1NDA2NDk4MTMwIn0.HOqMapoQT9Xv0MrQQccjuigKLbIXpj4DL0mZqT7PbC4,,,,
"Dein Team Du hast Freude an Innovationen, spannenden Inhalten und kollegialem Teamspirit? Mit unseren Berater:innen wächst du mit deinen Aufgaben und lernst von unseren Expert:innen. Gemeinsam beraten wir unsere deutsch- und englischsprachigen Kunden bei ihren Herausforderungen im Umfeld von Business Intelligence, Planung, Advanced Analytics & Data Science. Wir verbinden höchste Beratungskompetenz mit technischer Expertise. Dabei konzipieren und implementieren wir maßgeschneiderte Lösungen auf …",Adzuna::API::Response::Job,"{'tag': 'other-general-jobs', '__CLASS__': 'Adzuna::API::Response::Category', 'label': 'Sonstige/Allgemeine Stellen'}",Wirtschaftsinformatiker als Trainee Data Engineering SAP / Azure (m/w/d),"{'display_name': 'ISR Information Products AG', '__CLASS__': 'Adzuna::API::Response::Company'}",53.557429,5395896126,0,"{'__CLASS__': 'Adzuna::API::Response::Location', 'area': ['Deutschland', 'Hamburg'], 'display_name': 'Hamburg, Deutschland'}",9.987297,https://www.adzuna.de/land/ad/5395896126?se=6unREQSd8BGZvedH_lKMPQ&utm_medium=api&utm_source=a4bcf954&v=7F665D4F347DC826987E23A375523484965D26A1,2025-09-12T17:34:15Z,eyJhbGciOiJIUzI1NiJ9.eyJpIjoiNTM5NTg5NjEyNiIsInMiOiI2dW5SRVFTZDhCR1p2ZWRIX2xLTVBRIn0.g7g9_UbQryi_M0CFl5Hjoz8hOjSS07KjPI1bLeKybSk,full_time,,,
Wir ermöglichen fundierte Entscheidungen durch die Erhebung und Aufbereitung von über 350 gesetzlich angeordneten Statistiken. Gestalten Sie die Zukunft der Statistik in Bayern aktiv mit und werden Sie Teil eines engagierten Teams. Wir suchen zum nächstmöglichen Zeitpunkt in unserer Dienststelle Fürth eine/einen IT-Fachkoordinatorin / IT-Fachkoordinator (m/w/d) Sie verfügen über tiefe und breite konzeptionelle Kenntnisse im Bereich der Informationstechnologie und sind dabei gleichermaßen in The…,Adzuna::API::Response::Job,"{'label': 'Verwaltungsstellen', '__CLASS__': 'Adzuna::API::Response::Category', 'tag': 'admin-jobs'}",IT-Fachkoordinatorin / IT-Fachkoordinator (m/w/d),"{'__CLASS__': 'Adzuna::API::Response::Company', 'display_name': 'Bayerisches Landesamt für Statistik'}",49.493698,5411875434,0,"{'__CLASS__': 'Adzuna::API::Response::Location', 'display_name': 'Fürth, Fürth (Kreis)', 'area': ['Deutschland', 'Bayern', 'Fürth (Kreis)', 'Fürth']}",10.982324,https://www.adzuna.de/land/ad/5411875434?se=6unREQSd8BGZvedH_lKMPQ&utm_medium=api&utm_source=a4bcf954&v=86CA527904977EE61684D6FB6D8350874C36D184,2025-09-23T08:30:20Z,eyJhbGciOiJIUzI1NiJ9.eyJzIjoiNnVuUkVRU2Q4QkdadmVkSF9sS01QUSIsImkiOiI1NDExODc1NDM0In0.T5HmDFPSv1FKHVs_H16xw9NUqTxRmnhnm4iKxypEOmU,,,,
"Lehmann  Pioneers Digital GmbH ist der Beratungspartner für intelligente datengetriebene Lösungen. Wir liefern Projekte und Dienstleistungen über den gesamten Lebenszyklus, um die Organisation und die Geschäfte unsere Kunden auf die nächste Stufe der digitalen Exzellenz zu bringen. Unser internationales, vielseitiges Team bietet Lösungen von der Beratung bis zur Implementierung in den Bereichen Business Intelligence  Analytics, Big Data  Data Science, Strategy  Architecture Advisory und Process…",Adzuna::API::Response::Job,"{'label': 'Beraterstellen', '__CLASS__': 'Adzuna::API::Response::Category', 'tag': 'consultancy-jobs'}",Projektleiter Middleware (m/w/d),"{'display_name': 'Lehmann + Pioneers Digital GmbH', '__CLASS__': 'Adzuna::API::Response::Company'}",48.69447,5411874358,0,"{'__CLASS__': 'Adzuna::API::Response::Location', 'area': ['Deutschland', 'Baden-Württemberg', 'Esslingen (Kreis)', 'Leinfelden-Echterdingen'], 'display_name': 'Leinfelden-Echterdingen, Esslingen (Kreis)'}",9.14057,https://www.adzuna.de/land/ad/5411874358?se=6unREQSd8BGZvedH_lKMPQ&utm_medium=api&utm_source=a4bcf954&v=7CC1DA0A738CF3DFE445DA71AB0E8F257EC8E60D,2025-09-23T08:29:57Z,eyJhbGciOiJIUzI1NiJ9.eyJzIjoiNnVuUkVRU2Q4QkdadmVkSF9sS01QUSIsImkiOiI1NDExODc0MzU4In0.5XZ_Rguk0J6GfMWYU1bHR2rjuBdoX30u-DPP3De131k,,,,
"Mitarbeiter (m/w/d) für Büromanagement und Social Media – Institut für Medical Data Science Die Medizinische Fakultät ist integraler Bestandteil der Otto-von-Guericke-Universität Magdeburg und wirkt mit dem Universitätsklinikum Magdeburg A. ö. R. in Forschung, Lehre und Krankenversorgung zusammen. Aufgaben Unterstützung des Institutsdirektors in allen organisatorischen Belangen Pflege von Social Media Aktivitäten und Homepage Allgemeine Sekretariatsaufgaben und Vertretung des Chefsekretariats b…",Adzuna::API::Response::Job,"{'tag': 'admin-jobs', '__CLASS__': 'Adzuna::API::Response::Category', 'label': 'Verwaltungsstellen'}",Büromanager / Social Media (m/w/d),"{'display_name': 'Otto-von-Guericke-Universität Magdeburg', '__CLASS__': 'Adzuna::API::Response::Company'}",,5388409768,0,"{'display_name': 'Deutschland', 'area': ['Deutschland'], '__CLASS__': 'Adzuna::API::Response::Location'}",,https://www.adzuna.de/land/ad/5388409768?se=6unREQSd8BGZvedH_lKMPQ&utm_medium=api&utm_source=a4bcf954&v=2012FB90210EBFB7DC26CA53D4B9E9ACCE46C199,2025-09-07T20:07:43Z,eyJhbGciOiJIUzI1NiJ9.eyJzIjoiNnVuUkVRU2Q4QkdadmVkSF9sS01QUSIsImkiOiI1Mzg4NDA5NzY4In0.TCpPynwGj6xyUesr1GmGclytGCIKIrnQMWdGGiyAdOk,,,,
