latitude,__CLASS__,longitude,location,id,adref,redirect_url,category,title,salary_is_predicted,created,company,description,contract_time,salary_min,contract_type,salary_max
49.49349,Adzuna::API::Response::Job,12.17958,"{'display_name': 'Pfreimd, Schwandorf (Kreis)', '__CLASS__': 'Adzuna::API::Response::Location', 'area': ['Deutschland', 'Bayern', 'Schwandorf (Kreis)', 'Pfreimd']}",5293570623,eyJhbGciOiJIUzI1NiJ9.eyJpIjoiNTI5MzU3MDYyMyIsInMiOiJGR19lXzRKZzhCR2VDWWdhX01WVWJRIn0.bn_HSZexLwnQ9X7R9cr-Yxnhyaya1hyrWQvPpdOe2yw,https://www.adzuna.de/land/ad/5293570623?se=FG_e_4Jg8BGeCYga_MVUbQ&utm_medium=api&utm_source=a4bcf954&v=060413607A9C4CDCFB7BFC45447A6D8D2C729EA9,"{'__CLASS__': 'Adzuna::API::Response::Category', 'label': 'IT-Stellen', 'tag': 'it-jobs'}",Dualer Student – Künstliche Intelligenz und Data Science (m/w/d),0,2025-07-09T14:21:55Z,"{'display_name': 'Gerresheimer AG', '__CLASS__': 'Adzuna::API::Response::Company'}","Über Gerresheimer Gerresheimer ist als innovativer System- und Lösungsanbieter der globale Partner der Pharma-, Biotech- und Kosmetikindustrie. Das Unternehmen bietet ein umfassendes Portfolio an pharmazeutischen Primärverpackungen, Verabreichungssystemen für Medikamente und digitalen Lösungen. Gerresheimer sorgt dafür, dass Medikamente sicher zum Patienten gelangen und zuverlässig verabreicht werden können. Mit rund 13.400 Mitarbeitenden, und über 40 Produktionsstandorten in 16 Ländern in Euro…",full_time,,,
49.56892,Adzuna::API::Response::Job,10.88109,"{'display_name': 'Herzogenaurach, Erlangen-Höchstadt (Kreis)', 'area': ['Deutschland', 'Bayern', 'Erlangen-Höchstadt (Kreis)', 'Herzogenaurach'], '__CLASS__': 'Adzuna::API::Response::Location'}",5300825987,eyJhbGciOiJIUzI1NiJ9.eyJpIjoiNTMwMDgyNTk4NyIsInMiOiJGR19lXzRKZzhCR2VDWWdhX01WVWJRIn0.d7dl79fjb8F-c0jBGuz5t56wlfSM4cgsnelype21v-g,https://www.adzuna.de/land/ad/5300825987?se=FG_e_4Jg8BGeCYga_MVUbQ&utm_medium=api&utm_source=a4bcf954&v=A5B1366DC550052C749378A6A59CF4403A5A37FD,"{'__CLASS__': 'Adzuna::API::Response::Category', 'tag': 'unknown', 'label': 'Unknown'}",Duales Studium (DHBW) - Cyber Security (m/w/d) 2026,0,2025-07-13T18:09:06Z,"{'__CLASS__': 'Adzuna::API::Response::Company', 'display_name': 'Schaeffler Technologies AG & Co. KG'}","Du bist technikbegeistert und voller Ideen, mit denen Du die Welt bewegen willst? Dann ist eine Ausbildung oder ein duales Studium bei Schaeffler genau das Richtige für Dich. Ohne unsere Produkte könnten Autos nicht fahren, Maschinen nicht laufen und Flugzeuge nicht fliegen. Als führender Anbieter von Wälzlagern für sämtliche Industrien und wichtiger Partner im internationalen Automobilbau bietet Dir Schaeffler ein hervorragendes Umfeld für Deinen Start in die Berufswelt. Aufgaben Im Überblick:…",,,,
49.577521,Adzuna::API::Response::Job,10.984506,"{'display_name': 'Erlangen, Bayern', 'area': ['Deutschland', 'Bayern', 'Erlangen'], '__CLASS__': 'Adzuna::API::Response::Location'}",5293569053,eyJhbGciOiJIUzI1NiJ9.eyJpIjoiNTI5MzU2OTA1MyIsInMiOiJGR19lXzRKZzhCR2VDWWdhX01WVWJRIn0.3fSqxuFAuOFjP-dyQy6N77Kaz94YD_vFhfqbumAJA8w,https://www.adzuna.de/land/ad/5293569053?se=FG_e_4Jg8BGeCYga_MVUbQ&utm_medium=api&utm_source=a4bcf954&v=C1F3FF5A1B37EF0B5D54C0D24D04CBAF450BD74A,"{'__CLASS__': 'Adzuna::API::Response::Category', 'tag': 'it-jobs', 'label': 'IT-Stellen'}",IT-Ingenieur als Leiter IT Artificial Intelligence / Data Science (m/w/d),0,2025-07-09T14:21:49Z,"{'display_name': 'Friedrich-Alexander-Universität Erlangen-Nürnberg', '__CLASS__': 'Adzuna::API::Response::Company'}",Ihr Arbeitsplatz Das Department Artificial Intelligence in Biomedical Engineering (AIBE) wurde zum 01.05.2020 als sechstes Department der Technischen Fakultät an der Friedrich-Alexander-Universität Erlangen-Nürnberg (FAU) mit einer Schnittstelle zur Medizinischen Fakultät neu gegründet. Die zentrale IT des Departments ist serviceorientiert und effizient aufgestellt. Wir bieten ein attraktives und dynamisches Umfeld mit flachen Hierarchien und Teamgeist. Ihre Aufgaben Fachliche und personelle Le…,full_time,,,
49.577521,Adzuna::API::Response::Job,10.984506,"{'display_name': 'Erlangen, Bayern', 'area': ['Deutschland', 'Bayern', 'Erlangen'], '__CLASS__': 'Adzuna::API::Response::Location'}",5293568886,eyJhbGciOiJIUzI1NiJ9.eyJzIjoiRkdfZV80Smc4QkdlQ1lnYV9NVlViUSIsImkiOiI1MjkzNTY4ODg2In0.-MfrAIwYntX5ws_n9sAuVjVra5TIwF3mhp-8PEv5chA,https://www.adzuna.de/land/ad/5293568886?se=FG_e_4Jg8BGeCYga_MVUbQ&utm_medium=api&utm_source=a4bcf954&v=247292EE7CAB83C561346B92D369D9B99E0BAC12,"{'tag': 'it-jobs', 'label': 'IT-Stellen', '__CLASS__': 'Adzuna::API::Response::Category'}",Head of IT Sicherheit - Data Science in Biomedical Engineering (m/w/d),0,2025-07-09T14:21:49Z,"{'display_name': 'Friedrich-Alexander-Universität Erlangen-Nürnberg', '__CLASS__': 'Adzuna::API::Response::Company'}",Ihr Arbeitsplatz Das Department Artificial Intelligence in Biomedical Engineering (AIBE) wurde zum 01.05.2020 als sechstes Department der Technischen Fakultät an der Friedrich-Alexander-Universität Erlangen-Nürnberg (FAU) mit einer Schnittstelle zur Medizinischen Fakultät neu gegründet. Die zentrale IT des Departments ist serviceorientiert und effizient aufgestellt. Wir bieten ein attraktives und dynamisches Umfeld mit flachen Hierarchien und Teamgeist. Ihre Aufgaben Fachliche und personelle Le…,full_time,,,
47.92595,Adzuna::API::Response::Job,9.25397,"{'__CLASS__': 'Adzuna::API::Response::Location', 'area': ['Deutschland', 'Baden-Württemberg', 'Sigmaringen (Kreis)', 'Pfullendorf'], 'display_name': 'Pfullendorf, Sigmaringen (Kreis)'}",5293572889,eyJhbGciOiJIUzI1NiJ9.eyJzIjoiRkdfZV80Smc4QkdlQ1lnYV9NVlViUSIsImkiOiI1MjkzNTcyODg5In0.BXYpQEoFKDuHgDwBJT7sjb96xYp_wTuO8Wja6kV_Qnc,https://www.adzuna.de/land/ad/5293572889?se=FG_e_4Jg8BGeCYga_MVUbQ&utm_medium=api&utm_source=a4bcf954&v=3DF95CBC23E90807ED3A6FFFEEACBBFC7EC6B227,"{'label': 'IT-Stellen', 'tag': 'it-jobs', '__CLASS__': 'Adzuna::API::Response::Category'}",Bachelor of Science DHBW Data Science & Künstliche Intelligenz (m/w/d),0,2025-07-09T14:22:04Z,"{'__CLASS__': 'Adzuna::API::Response::Company', 'display_name': 'Geberit'}","ZIEL DER POSITION Du möchtest die digitale Zukunft mitgestalten und Daten in wertvolle Erkenntnisse verwandeln? Dann starte dein duales Studium im Bereich Data Science & Künstliche Intelligenz (B.Sc.) an der DHBW – und verbinde Theorie mit spannender Praxis in unserem Unternehmen! HAUPTAUFGABEN​ : Du absolvierst Dein dreijähriges duales Studium mit Theoriephasen an der DHBW Ravensburg und Praxisphasen bei Geberit. : Du lernst, wie man große Datenmengen erfasst, analysiert, verarbeitet und visua…",full_time,,,
51.226802,Adzuna::API::Response::Job,6.808387,"{'display_name': 'Düsseldorf, Nordrhein-Westfalen', '__CLASS__': 'Adzuna::API::Response::Location', 'area': ['Deutschland', 'Nordrhein-Westfalen', 'Düsseldorf']}",5214028043,eyJhbGciOiJIUzI1NiJ9.eyJpIjoiNTIxNDAyODA0MyIsInMiOiJGR19lXzRKZzhCR2VDWWdhX01WVWJRIn0.js3S24_x7puiPVcOFEIqP3cccbP4FqqZEINPsOjf268,https://www.adzuna.de/land/ad/5214028043?se=FG_e_4Jg8BGeCYga_MVUbQ&utm_medium=api&utm_source=a4bcf954&v=241CBDEA64F13B8BB180882A7E0EF14A1BCD64BA,"{'__CLASS__': 'Adzuna::API::Response::Category', 'tag': 'other-general-jobs', 'label': 'Sonstige/Allgemeine Stellen'}",Werkstudent im Bereich Data Science mit Python & Databricks (m/w/d),0,2025-05-24T10:39:51Z,"{'__CLASS__': 'Adzuna::API::Response::Company', 'display_name': 'ARAG SE'}","Weshalb Sie bei uns genau richtig sind? Weil wir für Sie nicht nur viele spannende Aufgaben haben, sondern vor allem eine echte Mission: Wir helfen Menschen! Mit Ihren besonderen Fähigkeiten leisten Sie Ihren Beitrag, dass wir für unsere Kunden da sein können. Wenn mal etwas passiert und wenn möglich, auch schon vorher. Entfalten Sie Ihre Stärken in einem international erfolgreichen Familienunternehmen, in dem Unabhängigkeit, Fairness und Chancengleichheit gemeinsam gelebt werden. Jeden Tag auf…",,,,
,Adzuna::API::Response::Job,,"{'display_name': 'Deutschland', '__CLASS__': 'Adzuna::API::Response::Location', 'area': ['Deutschland']}",5298667615,eyJhbGciOiJIUzI1NiJ9.eyJpIjoiNTI5ODY2NzYxNSIsInMiOiJGR19lXzRKZzhCR2VDWWdhX01WVWJRIn0.CemU9IZC5Y9s1FtWEM-dRms2Ct-Egjfw7aJS1Or2jlY,https://www.adzuna.de/land/ad/5298667615?se=FG_e_4Jg8BGeCYga_MVUbQ&utm_medium=api&utm_source=a4bcf954&v=109CD57D01C02121C9E8D05A462253458C35E5FD,"{'__CLASS__': 'Adzuna::API::Response::Category', 'label': 'Sonstige/Allgemeine Stellen', 'tag': 'other-general-jobs'}",Duales Studium Data Science & Künstliche Intelligenz (B.Sc.) 2026,0,2025-07-12T00:15:32Z,"{'__CLASS__': 'Adzuna::API::Response::Company', 'display_name': 'Deloitte'}","Du machst den Unterschied. Ob im Business Audit & Assurance, Tax & Legal, Consulting oder Advisory. Wir bei Deloitte unterstützen unsere weltweiten Mandanten dabei, sich kontinuierlich weiterzuentwickeln und zu wachsen. Entdecke ein vielfältiges Arbeitsumfeld, das ständig in Bewegung ist und immer um ein Zentrum kreist: dich und dein Know-how. What impact will you make? Du willst mit einem 3-jährigen dualen Studium den Grundstein für deine Karriere legen und vollwertiges Teammitglied im Bereich…",,,,
48.42392,Adzuna::API::Response::Job,7.94837,"{'__CLASS__': 'Adzuna::API::Response::Location', 'area': ['Deutschland', 'Baden-Württemberg', 'Ortenaukreis', 'Offenburg'], 'display_name': 'Offenburg, Ortenaukreis'}",5196437459,eyJhbGciOiJIUzI1NiJ9.eyJpIjoiNTE5NjQzNzQ1OSIsInMiOiJGR19lXzRKZzhCR2VDWWdhX01WVWJRIn0.Uz_vNecZATOWDrZ44QDqREgp5Fb-w0OdLHer683PuUk,https://www.adzuna.de/land/ad/5196437459?se=FG_e_4Jg8BGeCYga_MVUbQ&utm_medium=api&utm_source=a4bcf954&v=F9EEA70ED26AC6CA9B3590233112BDBFE8DFC6DC,"{'label': 'Sonstige/Allgemeine Stellen', 'tag': 'other-general-jobs', '__CLASS__': 'Adzuna::API::Response::Category'}",Business Analyst (m/w/d) - im Team Data Science Solutions,0,2025-05-13T16:26:05Z,"{'display_name': 'Markant Gruppe', '__CLASS__': 'Adzuna::API::Response::Company'}","Die Markant Gruppe ist eines der grössten Dienstleistungsunternehmen in Europa für Handels- und Industriepartner aus dem Food- und Nonfood-Bereich. Unser breites Lösungsportfolio reicht von der Vereinfachung von Datenströmen und Zahlungsabwicklungen über exklusive Finanz- und Versicherungs-Services bis hin zu modernsten Marktforschungstools. Dahinter steckt die Idee: Kunden im operativen Tagesgeschäft zu entlasten, damit sie sich auf ihr Kerngeschäft konzentrieren können. Was noch dahintersteck…",,,,
48.78408,Adzuna::API::Response::Job,10.10558,"{'display_name': 'Oberkochen, Ostalbkreis', '__CLASS__': 'Adzuna::API::Response::Location', 'area': ['Deutschland', 'Baden-Württemberg', 'Ostalbkreis', 'Oberkochen']}",5237404437,eyJhbGciOiJIUzI1NiJ9.eyJzIjoiRkdfZV80Smc4QkdlQ1lnYV9NVlViUSIsImkiOiI1MjM3NDA0NDM3In0.W6RsYY-rmuNqTKt3BizX0a086kuXt2lkCb-irfb7qoM,https://www.adzuna.de/land/ad/5237404437?se=FG_e_4Jg8BGeCYga_MVUbQ&utm_medium=api&utm_source=a4bcf954&v=F1DE0016B75FA1F96EB3FC5B0A445C7CEC4C2E74,"{'__CLASS__': 'Adzuna::API::Response::Category', 'tag': 'other-general-jobs', 'label': 'Sonstige/Allgemeine Stellen'}",Werkstudent Software & Data Science Entwicklung Projektionsoptiken (m/w/x),0,2025-06-07T01:43:41Z,"{'display_name': 'ZEISS', '__CLASS__': 'Adzuna::API::Response::Company'}","Als Studierender (m/w/x) arbeitest Du mit Deinen Kolleginnen und Kollegen auf Augenhöhe und schaffst Dir ideale Voraussetzungen für Deine spätere Karriere. In einem offenen und modernen Umfeld mit zahlreichen Entwicklungs- und Weiterbildungsmöglichkeiten, arbeiten die Mitarbeitenden bei ZEISS in einer Kultur, die von Expertenwissen und Teamgeist geprägt ist. All das wird getragen von der besonderen Eigentümerstruktur und dem langfristigen Ziel der Carl-Zeiss-Stiftung: Wissenschaft und Gesellsch…",,,,
,Adzuna::API::Response::Job,,"{'display_name': 'Deutschland', '__CLASS__': 'Adzuna::API::Response::Location', 'area': ['Deutschland']}",5297187163,eyJhbGciOiJIUzI1NiJ9.eyJpIjoiNTI5NzE4NzE2MyIsInMiOiJGR19lXzRKZzhCR2VDWWdhX01WVWJRIn0.m6wlNePf6FaeChNBRsqNl9Io7tLfmb2-pCSaEKyE_qg,https://www.adzuna.de/land/ad/5297187163?se=FG_e_4Jg8BGeCYga_MVUbQ&utm_medium=api&utm_source=a4bcf954&v=B3B9601AB1A8DC8EC331F485CB8BBC165A63DA33,"{'tag': 'it-jobs', 'label': 'IT-Stellen', '__CLASS__': 'Adzuna::API::Response::Category'}","Juniorprofessur für ""Angewandte Statistik und Data Science"", JP/004/25",0,2025-07-11T04:13:32Z,"{'__CLASS__': 'Adzuna::API::Response::Company', 'display_name': 'Humboldt-Universität zu Berlin'}","Humboldt-Universität zu Berlin - Logo Logo Wirtschaftswissenschaftliche Fakultät An der Wirtschaftswissenschaftlichen Fakultät ist eine Juniorprofessur für ""Angewandte Statistik und Data Science"" zum 01.10.2026 zu besetzen. Diese W1-Stelle ist mit einem Tenure Track auf W3 versehen. Spätestens 15 Monate vor Ablauf der Juniorprofessur wird ein Evaluationsverfahren mit dem Ziel eröffnet, festzustellen, ob die Leistungsanforderungen für eine Berufung auf Lebenszeit erfüllt sind. Von Tenure-Track-P…",,,,
48.0962,Adzuna::API::Response::Job,9.78975,"{'display_name': 'Biberach an der Riß, Biberach (Kreis)', 'area': ['Deutschland', 'Baden-Württemberg', 'Biberach (Kreis)', 'Biberach an der Riß'], '__CLASS__': 'Adzuna::API::Response::Location'}",5277985243,eyJhbGciOiJIUzI1NiJ9.eyJpIjoiNTI3Nzk4NTI0MyIsInMiOiJGR19lXzRKZzhCR2VDWWdhX01WVWJRIn0.BgctA5kOGxDk9dmLxxaQ4grRS6twgQxv4qGiIIqTO8M,https://www.adzuna.de/land/ad/5277985243?se=FG_e_4Jg8BGeCYga_MVUbQ&utm_medium=api&utm_source=a4bcf954&v=3E0AF72611E6BF6BB3D4C8291CC84380C73AD612,"{'__CLASS__': 'Adzuna::API::Response::Category', 'label': 'Unknown', 'tag': 'unknown'}",Duales Studium B. Sc. Data Science und Künstliche Intelligenz in Biberach 2026 - Inklusiver Job   ,0,2025-07-01T18:12:40Z,"{'display_name': 'Boehringer Ingelheim', '__CLASS__': 'Adzuna::API::Response::Company'}","Die Stelle Bewirb Dich jetzt für den Start im September 2026! Du findest Informatik in Kombination mit Künstlicher Intelligenz spannend und interessierst dich für Machine Learning. Du interessierst Dich für Datenmengen - Verarbeitung und Entwicklung von Verfahren der Künstlichen Intelligenz? Dann sind diese guten Voraussetzungen für ein Duales Studium in Data Science und Künstliche Intelligenz. Bei uns hast du die Möglichkeit dein Wissen, das du an der Dualen Hochschule Ravensburg / Friedrichsh…",,,,
49.03084,Adzuna::API::Response::Job,8.45882,"{'display_name': 'Hagsfeld, Karlsruhe', 'area': ['Deutschland', 'Baden-Württemberg', 'Karlsruhe (Kreis)', 'Karlsruhe', 'Hagsfeld'], '__CLASS__': 'Adzuna::API::Response::Location'}",5282606338,eyJhbGciOiJIUzI1NiJ9.eyJzIjoiRkdfZV80Smc4QkdlQ1lnYV9NVlViUSIsImkiOiI1MjgyNjA2MzM4In0.V7HdO4ao4OoAdukWmGzTzWMVD8DVHg5-0M2dLSwd7pQ,https://www.adzuna.de/land/ad/5282606338?se=FG_e_4Jg8BGeCYga_MVUbQ&utm_medium=api&utm_source=a4bcf954&v=A19252C45382A4F89108C39C084C1E649D7965BB,"{'label': 'Stellen aus Wissenschaft & Qualitätssicherung', 'tag': 'scientific-qa-jobs', '__CLASS__': 'Adzuna::API::Response::Category'}",Werkstudent in Backend-Entwicklung und Data Science (m/w/d),0,2025-07-04T00:45:02Z,"{'display_name': 'Knuddels GmbH & Co. KG', '__CLASS__': 'Adzuna::API::Response::Company'}","Wir bei Knuddels haben uns das Ziel gesetzt, soziale Netzwerke wieder wirklich sozial zu machen - mit echter menschlicher Nähe statt bloßen Content-Konsums. In unserer Community soll jedes Mitglied 3 wichtige Menschen für sein echtes Leben finden: Deine Aufgabe ist es, mit Hilfe unserer Daten herauszufinden, welche Menschen zusammenpassen und die richtigen Erkenntnisse zu ziehen, um unsere Vision zu erreichen. Tätigkeiten Du unterstützt unsere Data Scientists dabei, aus unseren Events Erkenntni…",,,,
49.18975,Adzuna::API::Response::Job,9.2274,"{'display_name': 'Neckarsulm, Heilbronn (Kreis)', '__CLASS__': 'Adzuna::API::Response::Location', 'area': ['Deutschland', 'Baden-Württemberg', 'Heilbronn (Kreis)', 'Neckarsulm']}",5295397010,eyJhbGciOiJIUzI1NiJ9.eyJpIjoiNTI5NTM5NzAxMCIsInMiOiJGR19lXzRKZzhCR2VDWWdhX01WVWJRIn0.o0PvIOUGz4HJkxkJoQtkfEiM0EGlXh2bf9BClhjhCSI,https://www.adzuna.de/land/ad/5295397010?se=FG_e_4Jg8BGeCYga_MVUbQ&utm_medium=api&utm_source=a4bcf954&v=BA0FC5E2F599C4A99C3DC4526A59718B97FAF864,"{'__CLASS__': 'Adzuna::API::Response::Category', 'tag': 'it-jobs', 'label': 'IT-Stellen'}",Duales Studium Data Science und Künstliche Intelligenz 2026 (m/w/d),0,2025-07-10T09:42:56Z,"{'__CLASS__': 'Adzuna::API::Response::Company', 'display_name': 'Schwarz IT'}","Duales Studium Data Science und Künstliche Intelligenz 2026 Standort: Neckarsulm Abteilung / Bereich: IT - Einstiegsprogramm Level: Duales Studium Referenznummer: 46062-de_DE Als weltweit agierendes Unternehmen benötigen wir eine IT-Landschaft, die jederzeit reibungslos funktioniert, sich stets auf dem neuesten Stand der Technik befindet und sich an den Bedürfnissen unserer Kunden innerhalb der Unternehmen der Schwarz Gruppe orientiert. An der Schnittstelle zwischen Daten und IT erarbeiten wir …",,,,
51.226802,Adzuna::API::Response::Job,6.808387,"{'display_name': 'Düsseldorf, Nordrhein-Westfalen', '__CLASS__': 'Adzuna::API::Response::Location', 'area': ['Deutschland', 'Nordrhein-Westfalen', 'Düsseldorf']}",5266073190,eyJhbGciOiJIUzI1NiJ9.eyJzIjoiRkdfZV80Smc4QkdlQ1lnYV9NVlViUSIsImkiOiI1MjY2MDczMTkwIn0.Gse4Xyse7s9jIJPuG5hLltg0Wy6m4iUcU5zNTXkeRoY,https://www.adzuna.de/land/ad/5266073190?se=FG_e_4Jg8BGeCYga_MVUbQ&utm_medium=api&utm_source=a4bcf954&v=565BB997EDEC89CBD809781D8A5DF407786F1E15,"{'__CLASS__': 'Adzuna::API::Response::Category', 'label': 'Stellen aus PR, Werbung & Marketing', 'tag': 'pr-advertising-marketing-jobs'}",Data Analyst (m/f/d) Commercial,0,2025-06-24T20:16:34Z,"{'__CLASS__': 'Adzuna::API::Response::Company', 'display_name': 'Stepstone GmbH'}","At The Stepstone Group, we have a simple yet very important mission: The right job for everyone. Using our data, platform, and technology, we create opportunities for jobseekers and companies around the world to find a perfect match in fair and equitable way. With over 20 brands across 30 countries, we strive for fair and unbiased hiring. Join our team of 4,000 employees and be part of reshaping the labour market and becoming the world's leading job platform. Aufgaben We are looking for a Data …",,,,
52.263026,Adzuna::API::Response::Job,10.517347,"{'display_name': 'Braunschweig, Niedersachsen', '__CLASS__': 'Adzuna::API::Response::Location', 'area': ['Deutschland', 'Niedersachsen', 'Braunschweig']}",5287006405,eyJhbGciOiJIUzI1NiJ9.eyJpIjoiNTI4NzAwNjQwNSIsInMiOiJGR19lXzRKZzhCR2VDWWdhX01WVWJRIn0.0YN7Gwl3lB3pdX3uBeRDdRKgWZXT3dreUH0I0xMguQE,https://www.adzuna.de/land/ad/5287006405?se=FG_e_4Jg8BGeCYga_MVUbQ&utm_medium=api&utm_source=a4bcf954&v=B87654921A7112A58C2E1B1A7A441DD4DF3E1905,"{'label': 'Sonstige/Allgemeine Stellen', 'tag': 'other-general-jobs', '__CLASS__': 'Adzuna::API::Response::Category'}",Experte Vertriebsautomation & KI-Integration (m/w/d),0,2025-07-05T09:47:31Z,"{'__CLASS__': 'Adzuna::API::Response::Company', 'display_name': 'Öffentliche Sachversicherung Braunschweig'}","Die Öffentliche Versicherung Braunschweig blickt auf über 270 Jahre Unternehmensgeschichte zurück. Sie ist Marktführer in ihrem Geschäftsgebiet, welches das gesamte ehemalige Braunschweiger Land umfasst. In rund 130 Geschäftsstellen werden in einem der dichtesten Filialnetze Deutschlands circa 350.000 Kunden betreut – und damit nahezu jeder zweite Einwohner der Region. Eine Verantwortung, die bei der Öffentlichen sehr ernst genommen wird: als verlässlicher regionaler Partner, der nah dran ist a…",,,,
49.18975,Adzuna::API::Response::Job,9.2274,"{'display_name': 'Neckarsulm, Heilbronn (Kreis)', '__CLASS__': 'Adzuna::API::Response::Location', 'area': ['Deutschland', 'Baden-Württemberg', 'Heilbronn (Kreis)', 'Neckarsulm']}",5283909835,eyJhbGciOiJIUzI1NiJ9.eyJpIjoiNTI4MzkwOTgzNSIsInMiOiJGR19lXzRKZzhCR2VDWWdhX01WVWJRIn0._PUEgupqaqyWIE1nuEp0RFY02UPCZ__5EoItyfuLHyA,https://www.adzuna.de/land/ad/5283909835?se=FG_e_4Jg8BGeCYga_MVUbQ&utm_medium=api&utm_source=a4bcf954&v=744594D6CAFD87DA20375C1DA24F06F53E4138D0,"{'label': 'Stellen aus Logistik & Lagerhaltung', 'tag': 'logistics-warehouse-jobs', '__CLASS__': 'Adzuna::API::Response::Category'}",Projektleiter Day-Ahead-Prognosen Energiebeschaffung (m/w/d),0,2025-07-04T09:47:53Z,"{'display_name': 'Schwarz Corporate Solutions', '__CLASS__': 'Adzuna::API::Response::Company'}","Du hast Lust auf innovative und nachhaltige Bau- & Immobilienprojekte? Dann bist du bei uns genau richtig. Von Büros, Konferenzräumen sowie Restaurants bis hin zu Wohnungen - Im TeamSCOS planen, bauen und betreuen wir ein großes Portfolio verschiedenster Immobilien – denn Vielfalt ist unsere Stärke! Bei uns kannst du spannende Projekte von Beginn bis zur Umsetzung begleiten und eigene Ideen einbringen. Vom Grundstückskauf über die Planung und dem Bau bis hin zum Facility Management - bei uns ha…",,,,
48.68872,Adzuna::API::Response::Job,8.98349,"{'display_name': 'Böblingen, Böblingen (Kreis)', 'area': ['Deutschland', 'Baden-Württemberg', 'Böblingen (Kreis)', 'Böblingen'], '__CLASS__': 'Adzuna::API::Response::Location'}",5293828903,eyJhbGciOiJIUzI1NiJ9.eyJzIjoiRkdfZV80Smc4QkdlQ1lnYV9NVlViUSIsImkiOiI1MjkzODI4OTAzIn0.WH_n7g-SxE4uVmzHVtjQ0LghSJ6DzdVYfY01IT7HOow,https://www.adzuna.de/land/ad/5293828903?se=FG_e_4Jg8BGeCYga_MVUbQ&utm_medium=api&utm_source=a4bcf954&v=C3F7B574CA0CF5D4603BBACA0B2DA4DA26167D7B,"{'tag': 'consultancy-jobs', 'label': 'Beraterstellen', '__CLASS__': 'Adzuna::API::Response::Category'}",(Senior) Consultant (m/w/d) Managementberatung – Schwerpunkt Artificial Intelligence,0,2025-07-09T18:04:31Z,"{'display_name': 'Star Cooperation GmbH', '__CLASS__': 'Adzuna::API::Response::Company'}","Für den STAR-Bereich Consulting | Böblingen Deine Mission Du bist nicht nur Berater:in, du bist Macher:in. Du verstehst KI nicht nur konzeptionell, sondern kannst sie selbst pilotieren, testen und beim Kunden zum Fliegen bringen. Ob ChatGPT, LLM-Integration oder Custom-AI-Use-Cases – du übernimmst Verantwortung von der Idee bis zum funktionierenden Prototyp. Aufgaben Du entwickelst gemeinsam mit Unternehmen smarte KI-Strategien – von der Vision bis zur produktionsreifen Lösung Du identifizierst…",,,,
53.10403,Adzuna::API::Response::Job,8.786477,"{'display_name': 'Bremen, Deutschland', '__CLASS__': 'Adzuna::API::Response::Location', 'area': ['Deutschland', 'Bremen']}",5300824938,eyJhbGciOiJIUzI1NiJ9.eyJzIjoiRkdfZV80Smc4QkdlQ1lnYV9NVlViUSIsImkiOiI1MzAwODI0OTM4In0.zHs03Na_TJO_o5hUWfhFOfuaf6VOEFWV8YhfbaR-ZPE,https://www.adzuna.de/land/ad/5300824938?se=FG_e_4Jg8BGeCYga_MVUbQ&utm_medium=api&utm_source=a4bcf954&v=5A1DEA92CAA41614DBF969DA5949FD37737E1F7E,"{'__CLASS__': 'Adzuna::API::Response::Category', 'tag': 'manufacturing-jobs', 'label': 'Stellen aus Fertigung'}",Abschlussarbeit: Validierung eines Routingalgorithmus zwischen autonomen Fahrzeugen (m/w/d),0,2025-07-13T18:08:45Z,"{'__CLASS__': 'Adzuna::API::Response::Company', 'display_name': 'TKMS ATLAS ELEKTRONIK GmbH'}","Das ATLAS-Labor (A-LAB) für Studierende und Promovenden beschäftigt sich mit maritimen Technologien von Morgen. In einem Team aus jungen motivierten Mitarbeiterinnen und Mitarbeitern bekommen Sie die Chance, durch Unterstützung und in enger Abstimmung mit unseren Experten, Ihr Forschungs- und Entwicklungsthema voran zu treiben. ATLAS ELEKTRONIK ist ein Unternehmen der thyssenkrupp AG und steht für maritime Sicherheit. Seit Jahrzehnten unterstützen wir als führendes Systemhaus für maritime Elekt…",,,,
51.33968,Adzuna::API::Response::Job,12.3713,"{'display_name': 'Zentrum, Leipzig', '__CLASS__': 'Adzuna::API::Response::Location', 'area': ['Deutschland', 'Sachsen', 'Leipzig (Kreis)', 'Leipzig', 'Zentrum']}",5300278602,eyJhbGciOiJIUzI1NiJ9.eyJzIjoiRkdfZV80Smc4QkdlQ1lnYV9NVlViUSIsImkiOiI1MzAwMjc4NjAyIn0.GtIE31F-TvigWWsv_bs_sKAdmNZX8_lNtO0ooopgXUo,https://www.adzuna.de/land/ad/5300278602?se=FG_e_4Jg8BGeCYga_MVUbQ&utm_medium=api&utm_source=a4bcf954&v=089A0FBCD3F8644765EAA9899562166C02E39D9A,"{'label': 'Sonstige/Allgemeine Stellen', 'tag': 'other-general-jobs', '__CLASS__': 'Adzuna::API::Response::Category'}",Bachelor of Science (m/w/d) in Data Science & Künstliche Intelligenz,0,2025-07-13T00:18:23Z,"{'display_name': 'Porsche Leipzig GmbH', '__CLASS__': 'Adzuna::API::Response::Company'}","UnternehmensprofilKennziffer: J000009143Einstiegsart:Duales StudiumEinsatzort: LeipzigGesellschaft: Porsche Leipzig GmbHIm Jahr 2000 hat Porsche in Leipzig eine zweite Heimat gefunden. Denn die nächste Generation des Macan wird als reinelektrische Variante auf den Markt kommen. 300 Mitarbeiter pro Tag rund 500 Fahrzeuge des Kompakt-SUV Macan sowie der Sportwagenlimousine Panamera.Porsche Leipzig ist mehr als ein Produktionsstandort. Die Performance eines Porsche können Werksabholer, Veranstaltu…",,,,
