description,__CLASS__,company,created,redirect_url,adref,location,category,id,title,salary_is_predicted,longitude,latitude,contract_time,contract_type,salary_max,salary_min
"Bei EY setzen wir alles daran, dass die Welt besser funktioniert. Dafür hinterfragen wir täglich den Status quo und suchen schon heute die Antworten von morgen. Stillstand? Keine Option. Wandel? Sehen wir als Chance und Treiber für Innovation. Wenn du auch so tickst, dann bist du bei uns genau richtig. Wir suchen Macher:innen, die Unternehmen, Entrepreneuren, Privatpersonen und der öffentlichen Hand helfen, über sich hinaus zu wachsen. Das erfordert Zusammenarbeit auf Augenhöhe und das Verlasse…",Adzuna::API::Response::Job,"{'display_name': 'EY Deutschland', '__CLASS__': 'Adzuna::API::Response::Company'}",2025-05-13T22:23:31Z,https://www.adzuna.de/land/ad/5197159587?se=JioE3NpN8BGYr7XIH1J3bQ&utm_medium=api&utm_source=a4bcf954&v=AADA4988ABFD760FD44321CA23706DD19F56CC93,eyJhbGciOiJIUzI1NiJ9.eyJpIjoiNTE5NzE1OTU4NyIsInMiOiJKaW9FM05wTjhCR1lyN1hJSDFKM2JRIn0.y4Xbkx2M6zpmUTxeWp-1N4GNQXimJM04nJY3OebrQ88,"{'__CLASS__': 'Adzuna::API::Response::Location', 'display_name': 'Eschborn, Main-Taunus-Kreis', 'area': ['Deutschland', 'Hessen', 'Main-Taunus-Kreis', 'Eschborn']}","{'__CLASS__': 'Adzuna::API::Response::Category', 'label': 'Sonstige/Allgemeine Stellen', 'tag': 'other-general-jobs'}",5197159587,Praktikant Data Science im Bereich prüfungsnahe Beratung / Quants (Financial Services) (w/m/d),0,,,,,,
"Möchten Sie Ihre Ideen in nutzbringende und sinnvolle Technologien verwandeln? Ob im Bereich Mobility Solutions, Consumer Goods, Industrial Technology oder Energy and Building Technology - mit uns verbessern Sie die Lebensqualität der Menschen auf der ganzen Welt. Willkommen bei Bosch. Die Robert Bosch Elektronik GmbH freut sich auf Ihre Bewerbung! Anstellungsart: Befristet Arbeitszeit: Vollzeit Arbeitsort: Salzgitter Aufgaben Du suchst ein Praktikum in einem dynamischen Fertigungsbereich der E…",Adzuna::API::Response::Job,"{'__CLASS__': 'Adzuna::API::Response::Company', 'display_name': 'Bosch Gruppe'}",2025-06-18T08:09:14Z,https://www.adzuna.de/land/ad/5255834704?se=JioE3NpN8BGYr7XIH1J3bQ&utm_medium=api&utm_source=a4bcf954&v=956A857973E60D516164A636FFC2C9B755C120B6,eyJhbGciOiJIUzI1NiJ9.eyJzIjoiSmlvRTNOcE44QkdZcjdYSUgxSjNiUSIsImkiOiI1MjU1ODM0NzA0In0.KlltSdKXMXfblXHra_w-iFYuJy4Ezv8iun6mqPiFynU,"{'area': ['Deutschland', 'Niedersachsen', 'Salzgitter'], '__CLASS__': 'Adzuna::API::Response::Location', 'display_name': 'Salzgitter, Niedersachsen'}","{'__CLASS__': 'Adzuna::API::Response::Category', 'label': 'Stellen aus Fertigung', 'tag': 'manufacturing-jobs'}",5255834704,"Pflichtpraktikum im Bereich ""Final Assembly""",0,10.373516,52.120502,,,,
"Künstliche Intelligenz ist die Zukunfts- und Schlüsseltechnologie und befähigt uns, die Herausforderungen der nächsten Jahrzehnte zu lösen. Nur wenn die deutsche Wirtschaft eine führende Position in der Wertschöpfung im Bereich KI schafft, kann sie ihre Wettbewerbsfähigkeit halten und nachhaltige und ethische Werte aktiv gestalten. Durch die Zusammenarbeit im Ökosystem gelingt diese Transformation – durch die Bündelung von Ressourcen. IPAI will diese Plattform darstellen. Wir bringen die Wertsc…",Adzuna::API::Response::Job,"{'display_name': 'Schwarz Corporate Solutions', '__CLASS__': 'Adzuna::API::Response::Company'}",2025-06-05T20:09:54Z,https://www.adzuna.de/land/ad/5234826823?se=JioE3NpN8BGYr7XIH1J3bQ&utm_medium=api&utm_source=a4bcf954&v=5CBECF34835745A11DF7C93C155D5F564C99CB19,eyJhbGciOiJIUzI1NiJ9.eyJpIjoiNTIzNDgyNjgyMyIsInMiOiJKaW9FM05wTjhCR1lyN1hJSDFKM2JRIn0.A9L25Ukj9M2jbGAlQMizuKvx5sQSokQcOo-XMfVmQ14,"{'__CLASS__': 'Adzuna::API::Response::Location', 'display_name': 'Heilbronn, Heilbronn (Kreis)', 'area': ['Deutschland', 'Baden-Württemberg', 'Heilbronn (Kreis)', 'Heilbronn']}","{'label': 'Beraterstellen', '__CLASS__': 'Adzuna::API::Response::Category', 'tag': 'consultancy-jobs'}",5234826823,(Senior) Partner Manager IPAI (m/w/d),0,9.209895,49.142335,,,,
"Aufgaben Profil Wir bieten Willkommen in der Harzsparkasse! Die Harzsparkasse zeichnet sich durch eine tiefe Verbundenheit zur Region aus und legt großen Wert darauf, lokale Gemeinschaften zu stärken und zu unterstützen. Sie haben ein gutes Gespür für Zahlen, erkennen Trends in Daten und möchten Ihre Stärken dort einbringen, wo sie wirklich etwas bewegen? Dann sind Sie bei uns genau richtig! Zur Verstärkung unseres Teams suchen wir eine engagierte Persönlichkeit, die das Vertriebscontrolling mi…",Adzuna::API::Response::Job,"{'display_name': 'Harzsparkasse', '__CLASS__': 'Adzuna::API::Response::Company'}",2025-05-30T19:47:57Z,https://www.adzuna.de/land/ad/5223672573?se=JioE3NpN8BGYr7XIH1J3bQ&utm_medium=api&utm_source=a4bcf954&v=53F958EB7C1309A0799A1DEB56D04B8F4E484D60,eyJhbGciOiJIUzI1NiJ9.eyJzIjoiSmlvRTNOcE44QkdZcjdYSUgxSjNiUSIsImkiOiI1MjIzNjcyNTczIn0.4-QfjCLMt-TVax8A7NYzsArSbuxuxW3dmFZT5vFsLHM,"{'area': ['Deutschland', 'Sachsen-Anhalt', 'Harz (Kreis)', 'Wernigerode'], '__CLASS__': 'Adzuna::API::Response::Location', 'display_name': 'Wernigerode, Harz (Kreis)'}","{'tag': 'unknown', 'label': 'Unknown', '__CLASS__': 'Adzuna::API::Response::Category'}",5223672573,Vertriebsdatenmanager (m/w/d),0,10.79078,51.83828,,,,
"Mit über 110.000 Mitarbeitenden in 130 Ländern streben wir danach, einer der Top-5-Kontraktlogistikanbieter zu werden. Wir wachsen stetig – bist Du bereit, mit uns zu wachsen? Unsere Mitarbeitenden sind unser Erfolgsfaktor. Wir fördern ein Arbeitsumfeld, das persönliche Entwicklung und Innovation unterstützt. Für unseren Standort in Frankfurt am Main suchen wir zum nächstmöglichen Zeitpunkt Dich als: HRIS-Expert / Manager – SAP SuccessFactors (m⁠/⁠w⁠/⁠d) Aufgaben Leitung der digitalen HR-Transf…",Adzuna::API::Response::Job,"{'display_name': 'CEVA Logistics GmbH', '__CLASS__': 'Adzuna::API::Response::Company'}",2025-06-12T20:09:22Z,https://www.adzuna.de/land/ad/5246908487?se=JioE3NpN8BGYr7XIH1J3bQ&utm_medium=api&utm_source=a4bcf954&v=D9A7A5B20D0AD02362385393B014F90CA79098BA,eyJhbGciOiJIUzI1NiJ9.eyJpIjoiNTI0NjkwODQ4NyIsInMiOiJKaW9FM05wTjhCR1lyN1hJSDFKM2JRIn0.IPiXzk_0rwFugqgmPZTgk5pXh9Q5YO-NYKJLFnPLeUA,"{'display_name': 'Frankfurt am Main, Hessen', '__CLASS__': 'Adzuna::API::Response::Location', 'area': ['Deutschland', 'Hessen', 'Frankfurt am Main']}","{'tag': 'consultancy-jobs', '__CLASS__': 'Adzuna::API::Response::Category', 'label': 'Beraterstellen'}",5246908487,Wirtschaftsinformatiker / Informatiker als HRIS-Expert / Manager – SAP SuccessFactors (m/w/d),0,8.650578,50.129683,,,,
"Unsere Ideen, die Dein Leben leichter machen: Seit 65 Jahren gehört die Leifheit AG zu den führenden Anbietern von Haushaltswaren in Europa. Mit den Marken Leifheit und Soehnle, zwei der bekanntesten Marken Deutschlands, möchten wir das Leben von Verbrauchern erleichtern. Unsere Geschäftsbereiche sind Reinigung, Wäschepflege, Küchenhelfer, Personen- und Küchenwagen – dabei begeistern wir durch hochwertige und innovative Produkte mit überlegenem Gebrauchsnutzen und funktionalem Design. Rund 1.10…",Adzuna::API::Response::Job,"{'display_name': 'LEIFHEIT AG', '__CLASS__': 'Adzuna::API::Response::Company'}",2025-06-16T20:06:42Z,https://www.adzuna.de/land/ad/5253437689?se=JioE3NpN8BGYr7XIH1J3bQ&utm_medium=api&utm_source=a4bcf954&v=E9F7870BDE539F28C189043580718AE767B83749,eyJhbGciOiJIUzI1NiJ9.eyJpIjoiNTI1MzQzNzY4OSIsInMiOiJKaW9FM05wTjhCR1lyN1hJSDFKM2JRIn0.zQCR82iPWHsUt3vkIBL7Fm_RuVarg3W7WFkruyKd3E8,"{'area': ['Deutschland', 'Nordrhein-Westfalen', 'Siegen-Wittgenstein (Kreis)', 'Siegen', 'Seelbach'], '__CLASS__': 'Adzuna::API::Response::Location', 'display_name': 'Seelbach, Siegen'}","{'label': 'IT-Stellen', '__CLASS__': 'Adzuna::API::Response::Category', 'tag': 'it-jobs'}",5253437689,Master Data & Process Architect (m/w/d),0,7.96497,50.88299,,,,
"Munich Data Science Institute (MDSI) Technische Universität MünchenTUM - Logo IT Systems Administrator (m/f/d) at Munich Data Science Institute The Munich Data Science Institute (MDSI) is an integrative research institute at the Technical University of Munich (TUM). It is interdisciplinary and cross-departmental in the fields of data science, machine learning, and artificial intelligence. The institute acts as a facilitator and multiplier of state-of-the-art data science practices, technologies…",Adzuna::API::Response::Job,"{'display_name': 'Technische Universität München ', '__CLASS__': 'Adzuna::API::Response::Company'}",2025-05-28T02:27:57Z,https://www.adzuna.de/land/ad/5219266918?se=JioE3NpN8BGYr7XIH1J3bQ&utm_medium=api&utm_source=a4bcf954&v=D10C28FD5905112EFA191188E580ED5C4325D69D,eyJhbGciOiJIUzI1NiJ9.eyJzIjoiSmlvRTNOcE44QkdZcjdYSUgxSjNiUSIsImkiOiI1MjE5MjY2OTE4In0.huWmqftSWxKTNfSDaAt0NAAbZEAOZhxTPXdBldeeMy0,"{'display_name': 'Altstadt-Lehel, München', '__CLASS__': 'Adzuna::API::Response::Location', 'area': ['Deutschland', 'Bayern', 'München (Kreis)', 'München', 'Altstadt-Lehel']}","{'tag': 'it-jobs', '__CLASS__': 'Adzuna::API::Response::Category', 'label': 'IT-Stellen'}",5219266918,IT Systems Administrator (m/f/d) at Munich Data Science Institute,0,11.56907,48.14093,,,,
"Willst du wissen, was Unternehmen erfolgreich macht? Direkt mit Entscheidern am Tisch sitzen? Unmittelbar erleben, was dein Können bewirkt? Gemeinsam mit dir bringt RSM Ebner Stolz den Mittelstand voran - in Wirtschaftsprüfung, Steuer-, Rechts- und Unternehmensberatung. Mit über 2.700 Mitarbeitenden sind wir deutschlandweit präsent, weltweit an mehr als 820 Standorten unseres internationalen RSM-Netzwerks vertreten. Unser Erfolg lebt von starken Menschen mit Ecken und Kanten. Deshalb stehen wir…",Adzuna::API::Response::Job,"{'display_name': 'RSM Ebner Stolz', '__CLASS__': 'Adzuna::API::Response::Company'}",2025-06-07T01:56:22Z,https://www.adzuna.de/land/ad/5237444281?se=JioE3NpN8BGYr7XIH1J3bQ&utm_medium=api&utm_source=a4bcf954&v=04D77F590583C79DB44421B161BAD8DF0812C1C0,eyJhbGciOiJIUzI1NiJ9.eyJzIjoiSmlvRTNOcE44QkdZcjdYSUgxSjNiUSIsImkiOiI1MjM3NDQ0MjgxIn0.HI6R1szszEKWLZCxXHWRFfws9bCZSnLSPX5Yuk0JUxs,"{'__CLASS__': 'Adzuna::API::Response::Location', 'display_name': 'Deutschland', 'area': ['Deutschland']}","{'label': 'Sonstige/Allgemeine Stellen', '__CLASS__': 'Adzuna::API::Response::Category', 'tag': 'other-general-jobs'}",5237444281,Duales Studium Wirtschaftsinformatik Data Science (B.Sc.) - Start Oktober 2025 (m/w/d),0,,,,,,
"Über Gerresheimer Gerresheimer ist als innovativer System- und Lösungsanbieter der globale Partner der Pharma-, Biotech- und Kosmetikindustrie. Das Unternehmen bietet ein umfassendes Portfolio an pharmazeutischen Primärverpackungen, Verabreichungssystemen für Medikamente und digitalen Lösungen. Gerresheimer sorgt dafür, dass Medikamente sicher zum Patienten gelangen und zuverlässig verabreicht werden können. Mit rund 13.400 Mitarbeitenden, und über 40 Produktionsstandorten in 16 Ländern in Euro…",Adzuna::API::Response::Job,"{'__CLASS__': 'Adzuna::API::Response::Company', 'display_name': 'Gerresheimer AG'}",2025-06-10T19:33:21Z,https://www.adzuna.de/land/ad/5242909853?se=JioE3NpN8BGYr7XIH1J3bQ&utm_medium=api&utm_source=a4bcf954&v=768F7BF0CB26B9217ACE26E9A70F4211333E08A5,eyJhbGciOiJIUzI1NiJ9.eyJpIjoiNTI0MjkwOTg1MyIsInMiOiJKaW9FM05wTjhCR1lyN1hJSDFKM2JRIn0.bkfQK89htPoFsIkvYGycrvMIP2dDuKY0PPnKecOWAdw,"{'area': ['Deutschland', 'Bayern', 'Schwandorf (Kreis)', 'Pfreimd'], '__CLASS__': 'Adzuna::API::Response::Location', 'display_name': 'Pfreimd, Schwandorf (Kreis)'}","{'label': 'IT-Stellen', '__CLASS__': 'Adzuna::API::Response::Category', 'tag': 'it-jobs'}",5242909853,Duales Studium mit vertiefter Praxis: Bachelor of Science Künstliche Intelligenz und Data Science (m/w/d),0,12.17958,49.49349,full_time,,,
"IQVIA TM – The Human Data Science Company TM – ist ein führender, globaler Anbieter von zukunftsweisender Analytik, Technologielösungen und klinischer Auftragsforschung. IQVIA unterstützt Life-Science-Unternehmen, Verbände, Institutionen, Kostenträger und weitere Akteure im Gesundheitswesen darin, bessere Ergebnisse in der Gesundheitsversorgung zu erzielen. Werde Teil unserer Community  von rund 90.000 Mitarbeiterinnen und Mitarbeitern in über 100 Ländern, die sich dafür einsetzen, das Potenzia…",Adzuna::API::Response::Job,"{'display_name': 'IQVIA Commercial GmbH & Co. OHG', '__CLASS__': 'Adzuna::API::Response::Company'}",2025-06-17T20:37:43Z,https://www.adzuna.de/land/ad/5255329976?se=JioE3NpN8BGYr7XIH1J3bQ&utm_medium=api&utm_source=a4bcf954&v=3D3AC8CA15909798AA3031A47386020BCB90C4B6,eyJhbGciOiJIUzI1NiJ9.eyJzIjoiSmlvRTNOcE44QkdZcjdYSUgxSjNiUSIsImkiOiI1MjU1MzI5OTc2In0.UAh0dMkSarRYgaXOluXZzFBwHT9oujpmLYrs6zrwuIs,"{'__CLASS__': 'Adzuna::API::Response::Location', 'display_name': 'Frankfurt am Main, Hessen', 'area': ['Deutschland', 'Hessen', 'Frankfurt am Main']}","{'tag': 'pr-advertising-marketing-jobs', '__CLASS__': 'Adzuna::API::Response::Category', 'label': 'Stellen aus PR, Werbung & Marketing'}",5255329976,Senior Analytics Insight Specialist (m/w/d),0,8.650578,50.129683,,,,
"Über das Unternehmen Unser Mandant ist eine etablierte, innovationsgetriebene Unternehmensberatung, die führende Unternehmen bei der digitalen und datengetriebenen Transformation begleitet. Über die Rolle Im Zuge des weiteren Wachstums suchen wir eine erfahrene Führungspersönlichkeit mit tiefem technischen Verständnis und strategischem Weitblick im Bereich KI und Generative AI. Verantwortlichkeiten Team Leadership mit Impact: Du übernimmst die disziplinarische Führung eines rund zehnköpfigen Te…",Adzuna::API::Response::Job,"{'display_name': 'Venquis', '__CLASS__': 'Adzuna::API::Response::Company'}",2025-06-13T08:26:46Z,https://www.adzuna.de/land/ad/5247970504?se=JioE3NpN8BGYr7XIH1J3bQ&utm_medium=api&utm_source=a4bcf954&v=380F54E5E82935CD0550E77B1BB25463A53904CF,eyJhbGciOiJIUzI1NiJ9.eyJpIjoiNTI0Nzk3MDUwNCIsInMiOiJKaW9FM05wTjhCR1lyN1hJSDFKM2JRIn0.0XiSwOWVIrX1ISKSdTObB_iq1BIxU52kf0eiSqieIeQ,"{'area': ['Deutschland', 'Bayern'], 'display_name': 'Bayern, Deutschland', '__CLASS__': 'Adzuna::API::Response::Location'}","{'tag': 'it-jobs', 'label': 'IT-Stellen', '__CLASS__': 'Adzuna::API::Response::Category'}",5247970504,Lead Consultant – Generative AI & Data Science (m/w/d),0,,,,,,
"Das ATLAS-Labor (A-LAB) für Studierende und Promovenden beschäftigt sich mit maritimen Technologien von Morgen. In einem Team aus jungen motivierten Mitarbeiterinnen und Mitarbeitern bekommen Sie die Chance, durch Unterstützung und in enger Abstimmung mit unseren Experten, Ihr Forschungs- und Entwicklungsthema voran zu treiben. ATLAS ELEKTRONIK ist ein Unternehmen der thyssenkrupp AG und steht für maritime Sicherheit. Seit Jahrzehnten unterstützen wir als führendes Systemhaus für maritime Elekt…",Adzuna::API::Response::Job,"{'__CLASS__': 'Adzuna::API::Response::Company', 'display_name': 'ATLAS ELEKTRONIK GmbH'}",2025-06-08T20:02:08Z,https://www.adzuna.de/land/ad/5240302085?se=JioE3NpN8BGYr7XIH1J3bQ&utm_medium=api&utm_source=a4bcf954&v=1FD17CACBD6EA71B1CD722015B267E80AF8D46FE,eyJhbGciOiJIUzI1NiJ9.eyJpIjoiNTI0MDMwMjA4NSIsInMiOiJKaW9FM05wTjhCR1lyN1hJSDFKM2JRIn0.cxkQLFF2IVxPMAt93Q7qKrFDnrtV50n_d4DnKa5Ac98,"{'display_name': 'Bremen, Deutschland', '__CLASS__': 'Adzuna::API::Response::Location', 'area': ['Deutschland', 'Bremen']}","{'tag': 'other-general-jobs', 'label': 'Sonstige/Allgemeine Stellen', '__CLASS__': 'Adzuna::API::Response::Category'}",5240302085,Abschlussarbeit: Identifikation und Benchmarking von Suchalgorithmen in maritimer Simulationsumgebung (m/w/d),0,8.786477,53.10403,,,,
"Sich etwas Neues trauen, über sich hinauswachsen und dabei die Grenzen des Machbaren neu deﬁnieren. Genau das ist es, was unsere Mitarbeitenden täglich leben dürfen und sollen. Um mit unseren Innovationen das Tempo vorzugeben und Großartiges zu ermöglichen. Denn hinter jedem erfolgreichen Unternehmen stehen eine ganze Menge faszinierender Menschen. Die Mitarbeitenden von ZEISS arbeiten in einem offenen und modernen Umfeld mit zahlreichen Entwicklungs- und Weiterbildungsmöglichkeiten. Unsere Kul…",Adzuna::API::Response::Job,"{'__CLASS__': 'Adzuna::API::Response::Company', 'display_name': 'ZEISS'}",2025-05-31T07:46:41Z,https://www.adzuna.de/land/ad/5224404669?se=JioE3NpN8BGYr7XIH1J3bQ&utm_medium=api&utm_source=a4bcf954&v=3CD87B79B3CE046035A22E3E79240AF8D970255F,eyJhbGciOiJIUzI1NiJ9.eyJzIjoiSmlvRTNOcE44QkdZcjdYSUgxSjNiUSIsImkiOiI1MjI0NDA0NjY5In0.QNBTkuiGiI92qdhgqOpNcQ9xc78dviRVndJUId4tZtU,"{'area': ['Deutschland', 'Baden-Württemberg', 'Ostalbkreis', 'Oberkochen'], '__CLASS__': 'Adzuna::API::Response::Location', 'display_name': 'Oberkochen, Ostalbkreis'}","{'__CLASS__': 'Adzuna::API::Response::Category', 'label': 'Kundendienststellen', 'tag': 'customer-services-jobs'}",5224404669,Praktikum im Bereich digitale Knowledge Plattform des globalen Service Teams (m/w/x),0,10.10558,48.78408,,,,
"Die Duale Hochschule Schleswig-Holstein (DHSH) bietet als staatlich anerkannte Hochschule für angewandte Wissenschaften in Trägerschaft der Wirtschaftsakademie Schleswig-Holstein an den Studienstandorten Kiel, Lübeck und Flensburg im Zusammenspiel mit der Wirtschaft im Land duale Studiengänge und praxisverbundene Forschung. Sie setzt die Tradition der früheren Berufsakademie fort, aus der heraus sie sich in 2018 zur Dualen Hochschule gewandelt hat. Damit kann die noch junge Hochschule auf knapp…",Adzuna::API::Response::Job,"{'display_name': 'Duale Hochschule Schleswig-Holstein ', '__CLASS__': 'Adzuna::API::Response::Company'}",2025-06-17T08:10:38Z,https://www.adzuna.de/land/ad/5254247590?se=JioE3NpN8BGYr7XIH1J3bQ&utm_medium=api&utm_source=a4bcf954&v=DCB079E31892165FADCD89FABEABAA1973F5B3B2,eyJhbGciOiJIUzI1NiJ9.eyJzIjoiSmlvRTNOcE44QkdZcjdYSUgxSjNiUSIsImkiOiI1MjU0MjQ3NTkwIn0.PgAtu1g1mBsiLckDRiCWhHLeXvSFmmWqghBBi5A1vFI,"{'area': ['Deutschland', 'Schleswig-Holstein', 'Kiel'], 'display_name': 'Kiel, Schleswig-Holstein', '__CLASS__': 'Adzuna::API::Response::Location'}","{'tag': 'other-general-jobs', '__CLASS__': 'Adzuna::API::Response::Category', 'label': 'Sonstige/Allgemeine Stellen'}",5254247590,Duales Studium Wirtschaftsinformatik an der DHSH in Kiel,0,10.137982,54.319658,,,,
"Die Duale Hochschule Baden-Württemberg (DHBW) ist mit rund 33.000 Studierenden an neun Studienakademien und drei Campus sowie dem Center for Advanced Studies die größte Hochschule Baden-Württembergs. Gemeinsam mit 9.000 ausgewählten Unternehmen sowie sozialen und gesundheitsnahen Einrichtungen sorgt die DHBW für einen in Theorie und Praxis exzellent qualifizierten Fach- und Führungskräftenachwuchs in den Bereichen Wirtschaft, Technik, Sozialwesen und Gesundheit. Seit 1. Januar 2023 ist sie Teil…",Adzuna::API::Response::Job,"{'__CLASS__': 'Adzuna::API::Response::Company', 'display_name': 'Duale Hochschule Baden-Württemberg Heilbronn'}",2025-05-27T19:48:08Z,https://www.adzuna.de/land/ad/5218719640?se=JioE3NpN8BGYr7XIH1J3bQ&utm_medium=api&utm_source=a4bcf954&v=818EAE0EBFFC583B306695CFC3D1576E122149BF,eyJhbGciOiJIUzI1NiJ9.eyJpIjoiNTIxODcxOTY0MCIsInMiOiJKaW9FM05wTjhCR1lyN1hJSDFKM2JRIn0.2FO-iH3nj_GB3f77Nq_tvubtiuPeTM5VlXb4p16GUxE,"{'area': ['Deutschland', 'Baden-Württemberg', 'Heilbronn (Kreis)', 'Heilbronn'], '__CLASS__': 'Adzuna::API::Response::Location', 'display_name': 'Heilbronn, Heilbronn (Kreis)'}","{'__CLASS__': 'Adzuna::API::Response::Category', 'label': 'Vertriebsstellen', 'tag': 'sales-jobs'}",5218719640,Vertriebsexpert*in (m/w/d) im Studiengang Wein-Technologie-Management,0,9.209895,49.142335,,,,
"Publicis Media ist das weltweit zweitgrößte Mediaagenturnetzwerk und Teil des französischen Kommunikationskonzerns Publicis Groupe. Als globale Holding lebt Publicis Media durch seine vier globalen Agenturmarken Zenith, Starcom, Mediavest | Spark und Blue 449, die das Kundengeschäft in der strategischen Kommunikationsberatung in über 100 Ländern steuern und stetig weiterentwickeln.Darüber hinaus unterstützen bei Publicis Media zentrale Spezialistenteams die Kunden der Agenturen in den Bereichen…",Adzuna::API::Response::Job,"{'__CLASS__': 'Adzuna::API::Response::Company', 'display_name': 'Publicis Media GmbH'}",2025-06-17T20:17:32Z,https://www.adzuna.de/land/ad/5255165958?se=JioE3NpN8BGYr7XIH1J3bQ&utm_medium=api&utm_source=a4bcf954&v=3F38DD25ACFA70B3A67C26762F9560C38F15BE1B,eyJhbGciOiJIUzI1NiJ9.eyJpIjoiNTI1NTE2NTk1OCIsInMiOiJKaW9FM05wTjhCR1lyN1hJSDFKM2JRIn0.kZA1SvICZ9BxZNqJGSr5Micq7ZnZGQNyTaMd6XnNFh8,"{'display_name': 'Düsseldorf, Nordrhein-Westfalen', '__CLASS__': 'Adzuna::API::Response::Location', 'area': ['Deutschland', 'Nordrhein-Westfalen', 'Düsseldorf']}","{'tag': 'it-jobs', '__CLASS__': 'Adzuna::API::Response::Category', 'label': 'IT-Stellen'}",5255165958,Media Application Consultant / System Engineer - (m/w/d),0,6.808387,51.226802,,,,
"ATLAS ELEKTRONIK ist ein Unternehmen der thyssenkrupp AG und steht für maritime Sicherheit. Seit Jahrzehnten unterstützen wir als führendes Systemhaus für maritime Elektronik Marinen auf der ganzen Welt, die See sicherer zu machen. Unseren Kunden bieten wir ein breites Angebot u. a. an Sonaren und Sensoren, Führungssystemen für unbemannte Unterwasserfahrzeuge, U-Boote und Überwasserschiffe, Minenabwehrsystemen sowie Funk- und Kommunikationsanlage. Aufgaben Analyse einer Vorarbeit zu KI Modellen…",Adzuna::API::Response::Job,"{'__CLASS__': 'Adzuna::API::Response::Company', 'display_name': 'ATLAS ELEKTRONIK GmbH'}",2025-06-08T20:02:13Z,https://www.adzuna.de/land/ad/5240303035?se=JioE3NpN8BGYr7XIH1J3bQ&utm_medium=api&utm_source=a4bcf954&v=3C0AFF444C45A9966AE027D17F7571F344DFA6DF,eyJhbGciOiJIUzI1NiJ9.eyJzIjoiSmlvRTNOcE44QkdZcjdYSUgxSjNiUSIsImkiOiI1MjQwMzAzMDM1In0.St5flA2nq57vHVHWrEVTUydTxV9VoA5NLIdnaPDw-AU,"{'area': ['Deutschland', 'Bremen'], 'display_name': 'Bremen, Deutschland', '__CLASS__': 'Adzuna::API::Response::Location'}","{'label': 'Unknown', '__CLASS__': 'Adzuna::API::Response::Category', 'tag': 'unknown'}",5240303035,Masterarbeit Entwicklung eines intelligenten Superclassifiers zur Optimierung von KI Modellen (m/w/d),0,8.786477,53.10403,,,,
"Mit unserem Sortiment bieten wir Reisenden auf der ganzen Welt, was sie sich wünschen – ob im Duty Free Shop am Flughafen, beim Shopping über den Wolken oder auf dem Kreuzfahrtschiff. Mit der Erfahrung aus 140 Jahren Handel und der Leidenschaft von weltweit mehr als 9.000 Mitarbeiterinnen und Mitarbeitern machen wir das Einkaufen auf Reisen zu einem ganz besonderen Erlebnis. Denn jeder von uns gibt sein Bestes, wenn es um unser Ziel geht: Kunden zu begeistern. Entdecke, was wir gemeinsam erreic…",Adzuna::API::Response::Job,"{'__CLASS__': 'Adzuna::API::Response::Company', 'display_name': 'Gebr. Heinemann SE & Co. KG'}",2025-06-20T08:10:36Z,https://www.adzuna.de/land/ad/5259457834?se=JioE3NpN8BGYr7XIH1J3bQ&utm_medium=api&utm_source=a4bcf954&v=2B0A1080D994A8B95D5EBE469A7B1A888D87E225,eyJhbGciOiJIUzI1NiJ9.eyJpIjoiNTI1OTQ1NzgzNCIsInMiOiJKaW9FM05wTjhCR1lyN1hJSDFKM2JRIn0.3Mh8ebRoUjFuJ03sImgkKTf8_u0PBm-Q1BnNdO1NAxs,"{'__CLASS__': 'Adzuna::API::Response::Location', 'display_name': 'Hamburg, Deutschland', 'area': ['Deutschland', 'Hamburg']}","{'label': 'Stellen aus Wissenschaft & Qualitätssicherung', '__CLASS__': 'Adzuna::API::Response::Category', 'tag': 'scientific-qa-jobs'}",5259457834,Praktikant (m/w/d) Sales Experience – Retail Innovation & Optimierung,0,9.987297,53.557429,,,,
"Du begeisterst dich für die komplexen Zusammenhänge in der IT und arbeitest gerne im Team? Willkommen in der Königsklasse Die Firma ZIEHL-ABEGG SE, mit derzeit über 5.000 Mitarbeitern weltweit, entwickelt, produziert und vertreibt global Ventilatoren, elektrische Spezialmotoren und Regelsysteme für die allgemeine Lufttechnik und Antriebstechnik . klicken sie bewerben, für die volle Stellenbeschreibung",Adzuna::API::Response::Job,"{'__CLASS__': 'Adzuna::API::Response::Company', 'display_name': 'ZIEHL-ABEGG SE'}",2025-06-20T07:35:23Z,https://www.adzuna.de/land/ad/5259402952?se=JioE3NpN8BGYr7XIH1J3bQ&utm_medium=api&utm_source=a4bcf954&v=E3E0670C34B400985BAC02731740EA3519178B44,eyJhbGciOiJIUzI1NiJ9.eyJzIjoiSmlvRTNOcE44QkdZcjdYSUgxSjNiUSIsImkiOiI1MjU5NDAyOTUyIn0.kAZ9bwhCkMCX2VzEQjpr35NXCaucOkPzBSOtcb1sw5I,"{'area': ['Deutschland', 'Baden-Württemberg', 'Ostalbkreis', 'Bopfingen'], 'display_name': 'Bopfingen, Ostalbkreis', '__CLASS__': 'Adzuna::API::Response::Location'}","{'__CLASS__': 'Adzuna::API::Response::Category', 'label': 'Stellen aus Handel & Bau', 'tag': 'trade-construction-jobs'}",5259402952,Duales Studium Data Science Und Künstliche Intelligenz (m/w/d) Ab September 2025,0,10.35393,48.85934,,,,
"Aufgaben Profil Wir bieten Wie mutig sind Sie? Als Hochtechnologieunternehmen für Werkzeugmaschinen und Lasertechnik suchen wir Menschen, die sich neuen Herausforderungen mit frischem Denken und tatkräftigem Handeln stellen. Dafür ermöglichen wir Ihnen die Freiräume, mutige Ideen in unserem Familienunternehmen einzubringen. Gemeinsam mit Ihnen wollen wir die digitale Vernetzung der fertigenden Industrie vorantreiben. Unsere Leidenschaft und der Gestaltungswille machen uns dabei zum Garanten für…",Adzuna::API::Response::Job,"{'__CLASS__': 'Adzuna::API::Response::Company', 'display_name': 'TRUMPF SE + Co. KG'}",2025-06-20T08:09:47Z,https://www.adzuna.de/land/ad/5259455491?se=JioE3NpN8BGYr7XIH1J3bQ&utm_medium=api&utm_source=a4bcf954&v=5052B448AF7DBC20C61588466D399BEEA63BAF45,eyJhbGciOiJIUzI1NiJ9.eyJzIjoiSmlvRTNOcE44QkdZcjdYSUgxSjNiUSIsImkiOiI1MjU5NDU1NDkxIn0.Owt6_kcVgIV-rkXqJMbmpX351bUFbwO7DHtmnTyEUsw,"{'__CLASS__': 'Adzuna::API::Response::Location', 'display_name': 'Ditzingen, Ludwigsburg (Kreis)', 'area': ['Deutschland', 'Baden-Württemberg', 'Ludwigsburg (Kreis)', 'Ditzingen']}","{'tag': 'unknown', '__CLASS__': 'Adzuna::API::Response::Category', 'label': 'Unknown'}",5259455491,Duales Studium Bachelor of Science (B. Sc.) (w/m/d),0,9.06857,48.82434,,,,
