description,id,redirect_url,company,location,longitude,latitude,title,__CLASS__,created,category,adref,salary_is_predicted,contract_time,contract_type,salary_min,salary_max
"UPLIFT Y OURFUTURE Wir sind über 13.000. An 19 Standorten weltweit. Jedes dritte Flugzeug fliegt mit unserer Technologie. Immer effizienter, leiser, nachhaltiger. Wir gestalten die Zukunft der Luftfahrt. Was wir noch brauchen? Dich. Unser Team in München sucht Dich: Werkstudent Data Science / Data Engineering (all genders) Bei der Instandhaltung von Flugzeugtriebwerken entstehen eine Vielzahl verschiedenster Daten. Erst wenn diese Informationen aufbereitet, geprüft und zusammengeführt sind, kön…",5148236983,https://www.adzuna.de/details/5148236983?utm_medium=api&utm_source=a4bcf954,"{'__CLASS__': 'Adzuna::API::Response::Company', 'display_name': 'MTU Aero Engines AG'}","{'area': ['Deutschland', 'Bayern', 'München (Kreis)', 'München', 'Allach-Untermenzing'], 'display_name': 'Allach-Untermenzing, München', '__CLASS__': 'Adzuna::API::Response::Location'}",11.44811,48.18449,Werkstudent Data Science / Data Engineering (all genders),Adzuna::API::Response::Job,2025-04-16T21:50:01Z,"{'label': 'Stellen aus Fertigung', '__CLASS__': 'Adzuna::API::Response::Category', 'tag': 'manufacturing-jobs'}",eyJhbGciOiJIUzI1NiJ9.eyJzIjoiT3BsZFlRYlU4QkdwUm9xNXB1cFRpZyIsImkiOiI1MTQ4MjM2OTgzIn0.OUu3l3PM8vGIMOD5Mjk_PM3UyFBtG8Z6zZiTdR1GPS4,0,part_time,,,
"Unterstützen Sie uns im Rahmen eines Praktikums/einer Abschlussarbeit im Bereich Data Science. Studium/Fachrichtung | Mathematik, Statistik, Data Science, Informatik, Physik oder vglb. Studiengänge Einsatzbereich | Praktikum/Abschlussarbeit im Bereich Data Science Dauer | 3-6 Monate Bestens gefordert | Wir suchen motivierte Studierende, die sich unserem Data Science Team für ein Pflichtpraktikum und/oder eine Bachelor-/Masterarbeit (3-6 Monate) anschließen möchten. Bei uns können Sie praktische…",5299866746,https://www.adzuna.de/details/5299866746?utm_medium=api&utm_source=a4bcf954,"{'__CLASS__': 'Adzuna::API::Response::Company', 'display_name': 'KSB'}","{'area': ['Deutschland', 'Sachsen', 'Bautzen (Kreis)', 'Frankenthal'], '__CLASS__': 'Adzuna::API::Response::Location', 'display_name': 'Frankenthal, Bautzen (Kreis)'}",14.10731,51.13209,Praktikum/Abschlussarbeit im Bereich Data Science,Adzuna::API::Response::Job,2025-07-12T22:07:55Z,"{'__CLASS__': 'Adzuna::API::Response::Category', 'label': 'Unknown', 'tag': 'unknown'}",eyJhbGciOiJIUzI1NiJ9.eyJpIjoiNTI5OTg2Njc0NiIsInMiOiJPcGxkWVFiVThCR3BSb3E1cHVwVGlnIn0.6ybDxC_lG69CeXvodZVoD0TOaPaT-RFoCqxeqEbLOWA,0,,,,
"Praktikum Data Analytics / Data Science Datum: 12.11.2025 Standort: Fellbach, BW, DE, 70736 Unternehmen: STIHL Das ist die Aufgabe Mitwirken im innovativen Big Data Team: Unterstütze andere Fachbereiche durch Expertise in Data Analytics und erhalte Einblicke in Data Science und Data Visualization, um datengetriebene Entscheidungen voranzutreiben Beteiligen an Analytics Projekten: Arbeite interdisziplinär, um Produkte und interne Prozesse durch datengetriebene Insights zu optimieren, mit der Cha…",5493508146,https://www.adzuna.de/details/5493508146?utm_medium=api&utm_source=a4bcf954,"{'__CLASS__': 'Adzuna::API::Response::Company', 'display_name': 'ANDREAS STIHL AG & Co. KG'}","{'area': ['Deutschland', 'Baden-Württemberg', 'Rems-Murr-Kreis', 'Fellbach', 'Schmiden'], '__CLASS__': 'Adzuna::API::Response::Location', 'display_name': 'Schmiden, Fellbach'}",9.26652,48.82807,Praktikum Data Analytics / Data Science,Adzuna::API::Response::Job,2025-11-13T13:12:32Z,"{'__CLASS__': 'Adzuna::API::Response::Category', 'label': 'Stellen aus Buchhaltung & Finanzwesen', 'tag': 'accounting-finance-jobs'}",eyJhbGciOiJIUzI1NiJ9.eyJzIjoiT3BsZFlRYlU4QkdwUm9xNXB1cFRpZyIsImkiOiI1NDkzNTA4MTQ2In0.dpjcn-UEMKnM0S_sB7MFtLACqMAz38q47DiJ1ve6A14,0,,,,
"About Us Hawk is the leading provider of AI-supported anti-money laundering and fraud detection technology. Banks and payment providers globally are using Hawk’s powerful combination of traditional rules and explainable AI to improve the effectiveness of their AML compliance and fraud prevention by identifying more crime while maximizing efficiency by reducing false positives. With our solution, we are playing a vital role in the global fight against Money Laundering, Fraud, or the financing of…",5491885638,https://www.adzuna.de/details/5491885638?utm_medium=api&utm_source=a4bcf954,"{'display_name': 'Hawk', '__CLASS__': 'Adzuna::API::Response::Company'}","{'__CLASS__': 'Adzuna::API::Response::Location', 'display_name': 'Deutschland', 'area': ['Deutschland']}",,,Data Science - Work Student / Intern,Adzuna::API::Response::Job,2025-11-12T13:13:47Z,"{'label': 'Stellen aus PR, Werbung & Marketing', '__CLASS__': 'Adzuna::API::Response::Category', 'tag': 'pr-advertising-marketing-jobs'}",eyJhbGciOiJIUzI1NiJ9.eyJzIjoiT3BsZFlRYlU4QkdwUm9xNXB1cFRpZyIsImkiOiI1NDkxODg1NjM4In0.QjK9D0Zkqgo1-C5eyHpvMmcg-UVr5QlNC6HRog5_jLs,0,full_time,,,
"Who we are Melotech is revolutionizing media and entertainment. We create art through technology for humans to enjoy. In just 18 months, our work has been heard, watched and loved for over 2 billion minutes worldwide. Founded by entrepreneur and investor Soheil Mirpour, we are backed by top VCs Cherry Ventures, Speedinvest and GFC, alongside world-class angels from firms such as Spotify, Blackstone and KKR. What you will do Join us as Data Scientist Intern to bring order to the chaos of culture…",5502240982,https://www.adzuna.de/details/5502240982?utm_medium=api&utm_source=a4bcf954,"{'__CLASS__': 'Adzuna::API::Response::Company', 'display_name': 'Melotech'}","{'area': ['Deutschland', 'Berlin'], 'display_name': 'Berlin, Deutschland', '__CLASS__': 'Adzuna::API::Response::Location'}",13.420806,52.507706,"Data Science Intern, Music & Audio",Adzuna::API::Response::Job,2025-11-18T18:47:23Z,"{'tag': 'unknown', 'label': 'Unknown', '__CLASS__': 'Adzuna::API::Response::Category'}",eyJhbGciOiJIUzI1NiJ9.eyJzIjoiT3BsZFlRYlU4QkdwUm9xNXB1cFRpZyIsImkiOiI1NTAyMjQwOTgyIn0.uRVyloyRyf7cCcyNGUhtZTFuD5YhIqA3OLC_lgs8h44,0,full_time,,,
"Overview The Data Science Consultant provides services that maximize the value of the customer’s business through data-driven insights and enhanced decision support. This role will be responsible for advising the customer and recommending software configuration alternatives and adapting the software that is configured to optimize the solution so that the customer may realize the maximum value from the software. Responsibilities: Perform data analysis to discover patterns, trends and anomalies i…",5520437209,https://www.adzuna.de/details/5520437209?utm_medium=api&utm_source=a4bcf954,"{'display_name': 'Blue Yonder', '__CLASS__': 'Adzuna::API::Response::Company'}","{'area': ['Deutschland', 'Baden-Württemberg', 'Karlsruhe (Kreis)', 'Karlsruhe'], 'display_name': 'Karlsruhe, Karlsruhe (Kreis)', '__CLASS__': 'Adzuna::API::Response::Location'}",8.412378,49.001249,Data Science Consultant - German Language,Adzuna::API::Response::Job,2025-11-30T19:03:26Z,"{'tag': 'consultancy-jobs', 'label': 'Beraterstellen', '__CLASS__': 'Adzuna::API::Response::Category'}",eyJhbGciOiJIUzI1NiJ9.eyJzIjoiT3BsZFlRYlU4QkdwUm9xNXB1cFRpZyIsImkiOiI1NTIwNDM3MjA5In0.7qLvSTT5ZPkHqYzmjbqsBj9iufKDHUdNFd8iItbJSOI,0,full_time,,,
"Die IHK Region Stuttgart nimmt deutschlandweit eine führende Rolle beim Einsatz und der Integration von Künstlicher Intelligenz in der Kammerorganisation ein. Als Gen AI Engineer & Data Scientist heben Sie mit Ihrem Know-how und Ihrer analytischen Kraft ungenutztes Potenzial: Sie treiben politisch relevante KI-Initiativen voran und gewinnen gleichzeitig aus unserem Datenschatz wertvolle strategische Erkenntnisse für Bildung, Beratung und Wirtschaftsförderung. Aufgaben Generative KI für politisc…",5529127151,https://www.adzuna.de/land/ad/5529127151?se=OpldYQbU8BGpRoq5pupTig&utm_medium=api&utm_source=a4bcf954&v=0B548058CC0668960FAFCFAF009E8DFCC819BE66,"{'__CLASS__': 'Adzuna::API::Response::Company', 'display_name': 'IHK Region Stuttgart'}","{'display_name': 'Stuttgart, Baden-Württemberg', '__CLASS__': 'Adzuna::API::Response::Location', 'area': ['Deutschland', 'Baden-Württemberg', 'Stuttgart']}",9.187224,48.776198,Gen AI Engineer & Data Scientist (m/w/d),Adzuna::API::Response::Job,2025-12-05T13:11:48Z,"{'__CLASS__': 'Adzuna::API::Response::Category', 'label': 'IT-Stellen', 'tag': 'it-jobs'}",eyJhbGciOiJIUzI1NiJ9.eyJpIjoiNTUyOTEyNzE1MSIsInMiOiJPcGxkWVFiVThCR3BSb3E1cHVwVGlnIn0.oS_k6ICC9pCYfgTfZ_nViMhMRZrexNj5Zmj05sRzfRQ,0,,,,
"Lufthansa Industry Solutions ist ein Dienstleistungsunternehmen für IT-Beratung und Systemintegration. Die Lufthansa-Tochter unterstützt ihre Kunden bei der digitalen Transformation ihrer Unternehmen. Die Kundenbasis umfasst sowohl Gesellschaften innerhalb des Lufthansa Konzerns als auch mehr als 300 Unternehmen in unterschiedlichen Branchen. Das Unternehmen mit Hauptsitz in Norderstedt beschäftigt über 2.500 Mitarbeiter an mehreren Niederlassungen in Deutschland, Albanien, der Schweiz und den …",5531917211,https://www.adzuna.de/land/ad/5531917211?se=OpldYQbU8BGpRoq5pupTig&utm_medium=api&utm_source=a4bcf954&v=E4E7A71FEF6A197BB7A7A138EC0E4887B672920A,"{'display_name': 'Lufthansa Industry Solutions AS GmbH', '__CLASS__': 'Adzuna::API::Response::Company'}","{'area': ['Deutschland', 'Nordrhein-Westfalen', 'Köln'], 'display_name': 'Köln, Nordrhein-Westfalen', '__CLASS__': 'Adzuna::API::Response::Location'}",6.969972,50.940164,Senior Celonis Consultant (all genders),Adzuna::API::Response::Job,2025-12-07T01:15:39Z,"{'tag': 'consultancy-jobs', '__CLASS__': 'Adzuna::API::Response::Category', 'label': 'Beraterstellen'}",eyJhbGciOiJIUzI1NiJ9.eyJzIjoiT3BsZFlRYlU4QkdwUm9xNXB1cFRpZyIsImkiOiI1NTMxOTE3MjExIn0.0ajfSaWR2UTCeHgJO5S7FD0P299O1WxE-8gfjSi8FWw,0,,,,
"Du hast Lust auf innovative und nachhaltige Bau- & Immobilienprojekte? Dann bist du bei uns genau richtig. Von Büros, Konferenzräumen sowie Restaurants bis hin zu Wohnungen - Im TeamSCOS planen, bauen und betreuen wir ein großes Portfolio verschiedenster Immobilien – denn Vielfalt ist unsere Stärke! Bei uns kannst du spannende Projekte von Beginn bis zur Umsetzung begleiten und eigene Ideen einbringen. Vom Grundstückskauf über die Planung und dem Bau bis hin zum Facility Management - bei uns ha…",5531918712,https://www.adzuna.de/land/ad/5531918712?se=OpldYQbU8BGpRoq5pupTig&utm_medium=api&utm_source=a4bcf954&v=4FC4DAB4A9B63A08028DDD1E476B383D7969CBE2,"{'__CLASS__': 'Adzuna::API::Response::Company', 'display_name': 'Schwarz Corporate Solutions'}","{'display_name': 'Neckarsulm, Heilbronn (Kreis)', '__CLASS__': 'Adzuna::API::Response::Location', 'area': ['Deutschland', 'Baden-Württemberg', 'Heilbronn (Kreis)', 'Neckarsulm']}",9.2274,49.18975,Wechselmanager mit Fokus Stammdatenqualität (m/w/d),Adzuna::API::Response::Job,2025-12-07T01:16:13Z,"{'tag': 'consultancy-jobs', '__CLASS__': 'Adzuna::API::Response::Category', 'label': 'Beraterstellen'}",eyJhbGciOiJIUzI1NiJ9.eyJpIjoiNTUzMTkxODcxMiIsInMiOiJPcGxkWVFiVThCR3BSb3E1cHVwVGlnIn0.vJFh2YSkNjffMM9zbysFKjV181cGNe2NKieCKmYjieI,0,,,,
"Du hast Lust auf innovative und nachhaltige Bau- & Immobilienprojekte? Dann bist du bei uns genau richtig. Von Büros, Konferenzräumen sowie Restaurants bis hin zu Wohnungen - Im TeamSCOS planen, bauen und betreuen wir ein großes Portfolio verschiedenster Immobilien – denn Vielfalt ist unsere Stärke! Bei uns kannst du spannende Projekte von Beginn bis zur Umsetzung begleiten und eigene Ideen einbringen. Vom Grundstückskauf über die Planung und dem Bau bis hin zum Facility Management - bei uns ha…",5531918729,https://www.adzuna.de/land/ad/5531918729?se=OpldYQbU8BGpRoq5pupTig&utm_medium=api&utm_source=a4bcf954&v=728D477D47711E5AE8C3917E52CDB37F1FA41B3F,"{'__CLASS__': 'Adzuna::API::Response::Company', 'display_name': 'Schwarz Corporate Solutions'}","{'display_name': 'Neckarsulm, Heilbronn (Kreis)', '__CLASS__': 'Adzuna::API::Response::Location', 'area': ['Deutschland', 'Baden-Württemberg', 'Heilbronn (Kreis)', 'Neckarsulm']}",9.2274,49.18975,Wechselmanager mit Fokus Zeitreihen Qualität (m/w/d),Adzuna::API::Response::Job,2025-12-07T01:16:13Z,"{'label': 'Beraterstellen', '__CLASS__': 'Adzuna::API::Response::Category', 'tag': 'consultancy-jobs'}",eyJhbGciOiJIUzI1NiJ9.eyJzIjoiT3BsZFlRYlU4QkdwUm9xNXB1cFRpZyIsImkiOiI1NTMxOTE4NzI5In0.IyawXO7L892rLQSXcaFKCZKx9xNCxHVQHNwg7qRSkXA,0,,,,
"Deine Aufgaben Als Teamlead Data bist Du verantwortlich für die strategische und operative Leitung unseres Data-Teams. Du steuerst spannende und innovative Datenprojekte in enger Zusammenarbeit mit unseren Kunden und stellst sicher, dass technologische Lösungen zielgerichtet und effizient umgesetzt werden. In dieser Rolle bist Du nicht nur der fachliche Ansprechpartner, sondern auch die treibende Kraft bei der Gestaltung der Datenarchitektur, der Auswahl der richtigen Tools und der Planung komp…",5516355536,https://www.adzuna.de/details/5516355536?utm_medium=api&utm_source=a4bcf954,"{'display_name': 'Highberg', '__CLASS__': 'Adzuna::API::Response::Company'}","{'__CLASS__': 'Adzuna::API::Response::Location', 'display_name': 'Hamburg, Deutschland', 'area': ['Deutschland', 'Hamburg']}",9.987297,53.557429,Teamlead Data Science und Data Engineering (m/w/d),Adzuna::API::Response::Job,2025-11-27T18:18:18Z,"{'label': 'Beraterstellen', '__CLASS__': 'Adzuna::API::Response::Category', 'tag': 'consultancy-jobs'}",eyJhbGciOiJIUzI1NiJ9.eyJpIjoiNTUxNjM1NTUzNiIsInMiOiJPcGxkWVFiVThCR3BSb3E1cHVwVGlnIn0.hA9jNwQOORUasVcoHT-bheTPSHloOo40Y8wE37_n8Ns,0,full_time,,,
"Deine Aufgaben Als Teamlead Data bist Du verantwortlich für die strategische und operative Leitung unseres Data-Teams. Du steuerst spannende und innovative Datenprojekte in enger Zusammenarbeit mit unseren Kunden und stellst sicher, dass technologische Lösungen zielgerichtet und effizient umgesetzt werden. In dieser Rolle bist Du nicht nur der fachliche Ansprechpartner, sondern auch die treibende Kraft bei der Gestaltung der Datenarchitektur, der Auswahl der richtigen Tools und der Planung komp…",5513908949,https://www.adzuna.de/details/5513908949?utm_medium=api&utm_source=a4bcf954,"{'__CLASS__': 'Adzuna::API::Response::Company', 'display_name': 'Highberg DACH'}","{'display_name': 'HafenCity, Hamburg', '__CLASS__': 'Adzuna::API::Response::Location', 'area': ['Deutschland', 'Hamburg', 'HafenCity']}",9.99333,53.54167,Teamlead Data Science und Data Engineering (m/w/d),Adzuna::API::Response::Job,2025-11-26T00:37:15Z,"{'__CLASS__': 'Adzuna::API::Response::Category', 'label': 'Unknown', 'tag': 'unknown'}",eyJhbGciOiJIUzI1NiJ9.eyJpIjoiNTUxMzkwODk0OSIsInMiOiJPcGxkWVFiVThCR3BSb3E1cHVwVGlnIn0._qm9E7BEKi-DJh8lfo-mQoIqphx0y0zAXjze7fxtClA,0,full_time,,,
"Praktikum Data Analytics / Data Science Datum: 12.11.2025 Standort: Fellbach, BW, DE, 70736 Unternehmen: STIHL Das ist die Aufgabe Mitwirken im innovativen Big Data Team: Unterstütze andere Fachbereiche durch Expertise in Data Analytics und erhalte Einblicke in Data Science und Data Visualization, um datengetriebene Entscheidungen voranzutreiben Beteiligen an Analytics Projekten: Arbeite interdisziplinär, um Produkte und interne Prozesse durch datengetriebene Insights zu optimieren, mit der Cha…",5492668769,https://www.adzuna.de/details/5492668769?utm_medium=api&utm_source=a4bcf954,"{'display_name': 'ANDREAS STIHL AG & Co. KG', '__CLASS__': 'Adzuna::API::Response::Company'}","{'display_name': 'Deutschland', '__CLASS__': 'Adzuna::API::Response::Location', 'area': ['Deutschland']}",,,Praktikum Data Analytics / Data Science in Fellbach,Adzuna::API::Response::Job,2025-11-12T20:43:58Z,"{'__CLASS__': 'Adzuna::API::Response::Category', 'label': 'Stellen aus Buchhaltung & Finanzwesen', 'tag': 'accounting-finance-jobs'}",eyJhbGciOiJIUzI1NiJ9.eyJpIjoiNTQ5MjY2ODc2OSIsInMiOiJPcGxkWVFiVThCR3BSb3E1cHVwVGlnIn0.Jfa3mYKQnQxY57zXFlyBtHCeHeggBVe6k6bvW1iugNM,0,,,,
"Wir bieten dir Flexibles Arbeiten: Mobiles Arbeiten mit vier gemeinsamen Präsenztagen im Monat. Und wenn du magst, bist du natürlich jederzeit öfter im Büro willkommen. So schaffen wir die perfekte Balance aus Freiheit und persönlichem Austausch. Individuelle Arbeitszeitmodelle , die sich an dein Leben anpassen. Gestaltungsfreiraum für deine Ideen und Projekte, mit der Möglichkeit, wirklich etwas zu bewegen. Gezielte Weiterbildungsmöglichkeiten , die wir aktiv fördern. Ein starkes Miteinander i…",5067020798,https://www.adzuna.de/details/5067020798?utm_medium=api&utm_source=a4bcf954,"{'display_name': 'IT-P GmbH', '__CLASS__': 'Adzuna::API::Response::Company'}","{'area': ['Deutschland', 'Niedersachsen', 'Region Hannover (Kreis)', 'Hannover', 'Bult'], 'display_name': 'Bult, Hannover', '__CLASS__': 'Adzuna::API::Response::Location'}",9.77223,52.36489,Data Science Specialist (m/w/d),Adzuna::API::Response::Job,2025-02-28T14:07:24Z,"{'label': 'Unknown', '__CLASS__': 'Adzuna::API::Response::Category', 'tag': 'unknown'}",eyJhbGciOiJIUzI1NiJ9.eyJpIjoiNTA2NzAyMDc5OCIsInMiOiJPcGxkWVFiVThCR3BSb3E1cHVwVGlnIn0.apsl5R-htIHomRGOR8-1TvOo742H4aBq85NNLhX-5I8,0,part_time,,,
"Wir bieten dir Flexibles Arbeiten: Mobiles Arbeiten mit vier gemeinsamen Präsenztagen im Monat. Und wenn du magst, bist du natürlich jederzeit öfter im Büro willkommen. So schaffen wir die perfekte Balance aus Freiheit und persönlichem Austausch. Individuelle Arbeitszeitmodelle , die sich an dein Leben anpassen. Gestaltungsfreiraum für deine Ideen und Projekte, mit der Möglichkeit, wirklich etwas zu bewegen. Gezielte Weiterbildungsmöglichkeiten , die wir aktiv fördern. Ein starkes Miteinander i…",4801220768,https://www.adzuna.de/details/4801220768?utm_medium=api&utm_source=a4bcf954,"{'__CLASS__': 'Adzuna::API::Response::Company', 'display_name': 'IT-P'}","{'display_name': 'Deutschland', '__CLASS__': 'Adzuna::API::Response::Location', 'area': ['Deutschland']}",,,Data Science Specialist (m/w/d),Adzuna::API::Response::Job,2024-07-30T22:45:58Z,"{'__CLASS__': 'Adzuna::API::Response::Category', 'label': 'Stellen aus Logistik & Lagerhaltung', 'tag': 'logistics-warehouse-jobs'}",eyJhbGciOiJIUzI1NiJ9.eyJzIjoiT3BsZFlRYlU4QkdwUm9xNXB1cFRpZyIsImkiOiI0ODAxMjIwNzY4In0.VErrBG12NM4xTwXqHudXyuwBiuz4k2xlMUwlHKkD0J0,0,full_time,,,
Duales Studium Data Science und Künstliche Intelligenz Duales Studium Data Science und Künstliche Intelligenz Karlsruhe vor Ort Work-study program Student/Intern Du interessierst dich für Data Science und Künstliche Intelligenz? Dann starte zum 01.10.2026 dein duales Bachelorstudium bei uns und wende dein theoretisches Wissen aus den Vorlesungen an der DHBW Karlsruhe direkt in praxisnahen Projekten an. Deine Aufgaben: Unterstützung unserer Fachabteilung in spannenden Projekten rund um die Entwi…,5487215435,https://www.adzuna.de/details/5487215435?utm_medium=api&utm_source=a4bcf954,"{'display_name': 'Disy Informationssysteme', '__CLASS__': 'Adzuna::API::Response::Company'}","{'area': ['Deutschland', 'Baden-Württemberg', 'Karlsruhe (Kreis)', 'Karlsruhe', 'Innenstadt-West'], '__CLASS__': 'Adzuna::API::Response::Location', 'display_name': 'Innenstadt-West, Karlsruhe'}",8.39586,49.01216,Duales Studium Data Science und Künstliche Intelligenz,Adzuna::API::Response::Job,2025-11-08T13:40:29Z,"{'tag': 'it-jobs', 'label': 'IT-Stellen', '__CLASS__': 'Adzuna::API::Response::Category'}",eyJhbGciOiJIUzI1NiJ9.eyJpIjoiNTQ4NzIxNTQzNSIsInMiOiJPcGxkWVFiVThCR3BSb3E1cHVwVGlnIn0.qCdWlDpCoYTQ2OSChu8Uk2m9ohgOe4bGs4tDfnJAlV4,0,,,,
"Deine Aufgaben Praktikum bei HIGHBERG in Hamburg: Bei uns heißt es im Praktikum nicht Kaffeekochen, sondern echte Kundenprojekte von Beginn an, gepaart mit Verantwortung und steiler Lernkurve. Neben einem intensiven Einblick in die Medienbranche erwartet Dich aktive Mitarbeit. Unser Umgang im Team lässt Raum für Deine persönliche Entwicklung. Gerne übernehmen wir Dich nach guter Arbeit auch nach dem Praktikum als Data Scientist und bieten Dir weitere spannende Aufgaben und Aufstiegschancen. Zu …",4352591932,https://www.adzuna.de/details/4352591932?utm_medium=api&utm_source=a4bcf954,"{'display_name': 'Highberg DACH', '__CLASS__': 'Adzuna::API::Response::Company'}","{'__CLASS__': 'Adzuna::API::Response::Location', 'display_name': 'HafenCity, Hamburg', 'area': ['Deutschland', 'Hamburg', 'HafenCity']}",9.99333,53.54167,Praktikum: Data Science (w/m/d),Adzuna::API::Response::Job,2023-10-05T13:37:27Z,"{'label': 'Unknown', '__CLASS__': 'Adzuna::API::Response::Category', 'tag': 'unknown'}",eyJhbGciOiJIUzI1NiJ9.eyJpIjoiNDM1MjU5MTkzMiIsInMiOiJPcGxkWVFiVThCR3BSb3E1cHVwVGlnIn0.zreBNP-JSysQyIgSmSMuutqUiI25Sv-B7dUNafHu_Hw,0,full_time,,,
"Deine Aufgaben Praktikum bei HIGHBERG in Hamburg: Bei uns heißt es im Praktikum nicht Kaffeekochen, sondern echte Kundenprojekte von Beginn an, gepaart mit Verantwortung und steiler Lernkurve. Neben einem intensiven Einblick in die Medienbranche erwartet Dich aktive Mitarbeit. Unser Umgang im Team lässt Raum für Deine persönliche Entwicklung. Gerne übernehmen wir Dich nach guter Arbeit auch nach dem Praktikum als Data Scientist und bieten Dir weitere spannende Aufgaben und Aufstiegschancen. Zu …",4931290630,https://www.adzuna.de/details/4931290630?utm_medium=api&utm_source=a4bcf954,"{'__CLASS__': 'Adzuna::API::Response::Company', 'display_name': 'Highberg'}","{'area': ['Deutschland', 'Hamburg'], 'display_name': 'Hamburg, Deutschland', '__CLASS__': 'Adzuna::API::Response::Location'}",9.987297,53.557429,Praktikum: Data Science (w/m/d),Adzuna::API::Response::Job,2024-11-08T12:47:42Z,"{'tag': 'consultancy-jobs', 'label': 'Beraterstellen', '__CLASS__': 'Adzuna::API::Response::Category'}",eyJhbGciOiJIUzI1NiJ9.eyJpIjoiNDkzMTI5MDYzMCIsInMiOiJPcGxkWVFiVThCR3BSb3E1cHVwVGlnIn0.GQ1HW08TEU2a8VLT57t3SPLK7xpkrWDM72S727yVBpg,0,full_time,,,
"At Johnson & Johnson,u202fwe believe health is everything. Our strength in healthcare innovation empowers us to build au202fworld where complex diseases are prevented, treated, and cured,u202fwhere treatments are smarter and less invasive, andu202fsolutions are personal.u202fThrough our expertise in Innovative Medicine and MedTech, we are uniquely positioned to innovate across the full spectrum of healthcare solutions today to deliver the breakthroughs of tomorrow, and profoundly impact health …",5515491006,https://www.adzuna.de/details/5515491006?utm_medium=api&utm_source=a4bcf954,"{'display_name': 'J&J Family of Companies', '__CLASS__': 'Adzuna::API::Response::Company'}","{'__CLASS__': 'Adzuna::API::Response::Location', 'display_name': 'Neuss, Rhein-Kreis Neuss', 'area': ['Deutschland', 'Nordrhein-Westfalen', 'Rhein-Kreis Neuss', 'Neuss']}",6.684807,51.175121,EMEA Data Science Business Product Manager,Adzuna::API::Response::Job,2025-11-27T00:24:49Z,"{'__CLASS__': 'Adzuna::API::Response::Category', 'label': 'Unknown', 'tag': 'unknown'}",eyJhbGciOiJIUzI1NiJ9.eyJpIjoiNTUxNTQ5MTAwNiIsInMiOiJPcGxkWVFiVThCR3BSb3E1cHVwVGlnIn0.Oyjr0dkSJA6G6eBN90txPQVXeqgrbPfnAJPZqYcii6U,0,,,,
"At Johnson & Johnson, we believe health is everything. Our strength in healthcare innovation empowers us to build a world where complex diseases are prevented, treated, and cured, where treatments are smarter and less invasive, and solutions are personal. Through our expertise in Innovative Medicine and MedTech, we are uniquely positioned to innovate across the full spectrum of healthcare solutions today to deliver the breakthroughs of tomorrow, and profoundly impact health for humanity. Learn …",5513517079,https://www.adzuna.de/details/5513517079?utm_medium=api&utm_source=a4bcf954,"{'__CLASS__': 'Adzuna::API::Response::Company', 'display_name': 'Johnson & Johnson'}","{'display_name': 'Deutschland', '__CLASS__': 'Adzuna::API::Response::Location', 'area': ['Deutschland']}",,,EMEA Data Science Business Product Manager,Adzuna::API::Response::Job,2025-11-25T19:53:12Z,"{'tag': 'unknown', 'label': 'Unknown', '__CLASS__': 'Adzuna::API::Response::Category'}",eyJhbGciOiJIUzI1NiJ9.eyJzIjoiT3BsZFlRYlU4QkdwUm9xNXB1cFRpZyIsImkiOiI1NTEzNTE3MDc5In0.xXOtYQC_UYkmrpKArEhsOCOK7noN7laH_naHYm4jLRg,0,full_time,,,
"At Johnson & Johnson,?we believe health is everything. Our strength in healthcare innovation empowers us to build a?world where complex diseases are prevented, treated, and cured,?where treatments are smarter and less invasive, and?solutions are personal.?Through our expertise in Innovative Medicine and MedTech, we are uniquely positioned to innovate across the full spectrum of healthcare solutions today to deliver the breakthroughs of tomorrow, and profoundly impact health for humanity.?Learn …",5513820556,https://www.adzuna.de/details/5513820556?utm_medium=api&utm_source=a4bcf954,"{'display_name': 'J&J Family of Companies', '__CLASS__': 'Adzuna::API::Response::Company'}","{'area': ['Deutschland', 'Nordrhein-Westfalen', 'Rhein-Kreis Neuss', 'Neuss'], 'display_name': 'Neuss, Rhein-Kreis Neuss', '__CLASS__': 'Adzuna::API::Response::Location'}",6.684807,51.175121,EMEA Data Science Business Product Manager,Adzuna::API::Response::Job,2025-11-25T23:53:38Z,"{'tag': 'unknown', '__CLASS__': 'Adzuna::API::Response::Category', 'label': 'Unknown'}",eyJhbGciOiJIUzI1NiJ9.eyJzIjoiT3BsZFlRYlU4QkdwUm9xNXB1cFRpZyIsImkiOiI1NTEzODIwNTU2In0.u8CyaFaNkeqGW_6qYtD4La_30b6nyaUDcbPdjM186QA,0,,,,
