latitude,title,description,__CLASS__,location,category,longitude,redirect_url,created,company,adref,salary_is_predicted,id,contract_time,contract_type,salary_max,salary_min
50.43619,Werkstudent (w/m/d) - Data Science,"1&1 gehört mit über 3.200 Mitarbeitenden und fast 16 Millionen Kundenverträgen zu den führenden Telekommunikationsanbietern in Deutschland. Mit Pioniergeist, ungewöhnlichen Ideen und kreativen Teams haben wir eine führende Marktstellung im Mobilfunk und bei Breitband-Anschlüssen erobert. Durch die Kombination des über 50.000 km langen 1&1 Glasfasernetzes und regionalen Netzen schaffen wir das weitreichendste Glasfasernetz Deutschlands. Außerdem bauen wir das modernste 5G-Netz Europas, auf der B…",Adzuna::API::Response::Job,"{'area': ['Deutschland', 'Rheinland-Pfalz', 'Westerwaldkreis', 'Montabaur'], '__CLASS__': 'Adzuna::API::Response::Location', 'display_name': 'Montabaur, Westerwaldkreis'}","{'__CLASS__': 'Adzuna::API::Response::Category', 'label': 'Stellen aus Wissenschaft & Qualitätssicherung', 'tag': 'scientific-qa-jobs'}",7.83315,https://www.adzuna.de/land/ad/5443355943?se=jP2zeASo8BG2galmFizh3g&utm_medium=api&utm_source=a4bcf954&v=FCBEE00CF575C448C6D6DF0FD407BE0FA95C27B2,2025-10-11T22:06:52Z,"{'display_name': '1&1', '__CLASS__': 'Adzuna::API::Response::Company'}",eyJhbGciOiJIUzI1NiJ9.eyJzIjoialAyemVBU284QkcyZ2FsbUZpemgzZyIsImkiOiI1NDQzMzU1OTQzIn0.TLItHS0g7vCm9zmGtGprc6ro3TEE_vdKTlv6olHzuvA,0,5443355943,,,,
48.876425,Duales Studium Bachelor der Wirtschaftsinformatik - Data Science (m/w/d),"Gestalten Sie mit uns heute schon die Zukunft! Seit über 180 Jahren steht Wolters Kluwer dafür, Arbeitsprozesse mit innovativen Lösungen zu unterstützen und zu erleichtern. Unsere Niederlassungen in mehr als 40 Ländern betreuen Kunden in über 180 Ländern. Im Jahr 2023 verzeichneten wir einen Jahresumsatz von 5,6 Milliarden Euro. Unsere Expertenlösungen vereinen fundiertes Fachwissen mit Technologie, damit unsere Kunden die wichtigsten Herausforderungen meistern können. Für die Umsetzung unserer…",Adzuna::API::Response::Job,"{'display_name': 'Ludwigsburg, Ludwigsburg (Kreis)', '__CLASS__': 'Adzuna::API::Response::Location', 'area': ['Deutschland', 'Baden-Württemberg', 'Ludwigsburg (Kreis)', 'Ludwigsburg']}","{'__CLASS__': 'Adzuna::API::Response::Category', 'tag': 'unknown', 'label': 'Unknown'}",9.198334,https://www.adzuna.de/land/ad/5429928376?se=jP2zeASo8BG2galmFizh3g&utm_medium=api&utm_source=a4bcf954&v=845DEDE359784297833D4E95EA85782A09D5261B,2025-10-03T20:43:25Z,"{'__CLASS__': 'Adzuna::API::Response::Company', 'display_name': 'Wolters Kluwer Tax & Accounting Deutschland GmbH'}",eyJhbGciOiJIUzI1NiJ9.eyJzIjoialAyemVBU284QkcyZ2FsbUZpemgzZyIsImkiOiI1NDI5OTI4Mzc2In0.5OHJ1xn5Il1zR8r9vo-w9cMxOh54rT7rLVBTil7t8zo,0,5429928376,,,,
48.72994,Procurement Specialist (m/w/d) Data Science & AI,"About us Wir sorgen mit unseren Services jeden Tag dafür, dass in der Produktion unserer Kunden auf der ganzen Welt alles rund läuft.Dabei denken wir in Lösungen und optimieren entlang des gesamten Prozesses – von der Planung bis zur Instandhaltung, Modernisierung und Digitalisierung.Als Servicespezialist in der Fertigungsindustrie wissen wir, dass Menschen den Unterschied machen.Respekt, Teamspirit und Vielseitigkeit zeichnen das Arbeiten bei Leadec aus.Auf unsere Arbeit sind wir stolz – über …",Adzuna::API::Response::Job,"{'area': ['Deutschland', 'Baden-Württemberg', 'Stuttgart', 'Vaihingen'], '__CLASS__': 'Adzuna::API::Response::Location', 'display_name': 'Vaihingen, Stuttgart'}","{'label': 'Sonstige/Allgemeine Stellen', 'tag': 'other-general-jobs', '__CLASS__': 'Adzuna::API::Response::Category'}",9.10973,https://www.adzuna.de/land/ad/5431136749?se=jP2zeASo8BG2galmFizh3g&utm_medium=api&utm_source=a4bcf954&v=3126A44DD892E7CD9388605FB13538F25DFF6DD6,2025-10-04T12:32:04Z,"{'display_name': 'Leadec', '__CLASS__': 'Adzuna::API::Response::Company'}",eyJhbGciOiJIUzI1NiJ9.eyJzIjoialAyemVBU284QkcyZ2FsbUZpemgzZyIsImkiOiI1NDMxMTM2NzQ5In0.Vboz5kIgDSfPtfzzbAu5GvLW1NxxXgHWu1XbRRb0qgQ,0,5431136749,full_time,,,
48.776198,DHBW-Studium Bachelor of Science – Wirtschaftsinformatik – Data Science,"WHAT DO YOU DO FOR A LIVING? Als starker Arbeitgeber und attrak­tives Aus­bildungs­unter­nehmen bieten wir dir im Herzen Stuttgarts viel­fältige und spannende Aus­bildungs- und Studien­plätze mit besten Über­nahme­chancen. Für den Studienstart am 1. September 2026 suchen wir am Standort Stuttgart aufge­schlossene und moti­vierte Studierende. DHBW-Studium Bachelor of Science – Wirt­schafts­informatik – Data Science Aufgaben Drei Jahre bei der WGV studieren, dann hast du es geschafft und kannst d…",Adzuna::API::Response::Job,"{'__CLASS__': 'Adzuna::API::Response::Location', 'area': ['Deutschland', 'Baden-Württemberg', 'Stuttgart'], 'display_name': 'Stuttgart, Baden-Württemberg'}","{'tag': 'it-jobs', 'label': 'IT-Stellen', '__CLASS__': 'Adzuna::API::Response::Category'}",9.187224,https://www.adzuna.de/land/ad/5444602593?se=jP2zeASo8BG2galmFizh3g&utm_medium=api&utm_source=a4bcf954&v=F4FB2D6D0CEBB33B747A00B42F887DD14CF7C006,2025-10-12T22:06:54Z,"{'display_name': 'WGV - Württembergische Gemeinde-Versicherung a.G.', '__CLASS__': 'Adzuna::API::Response::Company'}",eyJhbGciOiJIUzI1NiJ9.eyJpIjoiNTQ0NDYwMjU5MyIsInMiOiJqUDJ6ZUFTbzhCRzJnYWxtRml6aDNnIn0.18IgOz_zWxaEz0X20BSpoBkMAIAsn28XXr1dYiCBmT8,0,5444602593,,,,
49.001249,Duales Studium (B.Sc.) – Data Science und Künstliche Intelligenz (m/w/d),"Die VBL mit Sitz in Karlsruhe ist Deutschlands größte Zusatzversorgungseinrichtung für Beschäftigte des öffentlichen Dienstes und betreut circa 5,3 Mio. Versicherte und circa 1,5 Mio. Rentenberechtigte. Sie begeistern sich für Daten, digitale Technologien und intelligente Systeme? Dann verbinden Sie Theorie und Praxis in einem zukunftsweisenden dualen Studium bei der VBL. Ab sofort suchen wir einen Studierenden für 2026. Duales Studium (B.Sc.) – Data Science und Künstliche Intelligenz (m/w/d) A…",Adzuna::API::Response::Job,"{'display_name': 'Karlsruhe, Karlsruhe (Kreis)', 'area': ['Deutschland', 'Baden-Württemberg', 'Karlsruhe (Kreis)', 'Karlsruhe'], '__CLASS__': 'Adzuna::API::Response::Location'}","{'tag': 'unknown', 'label': 'Unknown', '__CLASS__': 'Adzuna::API::Response::Category'}",8.412378,https://www.adzuna.de/land/ad/5432419548?se=jP2zeASo8BG2galmFizh3g&utm_medium=api&utm_source=a4bcf954&v=3A34FAC5F246FF0D836CBE82C3DD1E9597ECFB13,2025-10-05T08:40:06Z,"{'display_name': 'VBL. Versorgungsanstalt des Bundes und der Länder', '__CLASS__': 'Adzuna::API::Response::Company'}",eyJhbGciOiJIUzI1NiJ9.eyJzIjoialAyemVBU284QkcyZ2FsbUZpemgzZyIsImkiOiI1NDMyNDE5NTQ4In0.vLgaScogPNPC2vZSVtaSf6yDnWva0iquN19LqgHtF3Q,0,5432419548,,,,
,"Duales Studium: ""Data Science & künstliche Intelligenz"" (w/m/d), Start 2026","HENSOLDT ist ein führendes Unternehmen der europäischen Verteidigungsindustrie mit globaler Reichweite. Das Unternehmen mit Sitz in Taufkirchen bei München entwickelt Sensor-Komplettlösungen für Verteidigungs- und Sicherheitsanwendungen. Als Technologieführer treibt HENSOLDT die Entwicklung der Verteidigungselektronik und Optronik voran und baut sein Portfolio auf der Grundlage innovativer Ansätze für Datenmanagement, Robotik und Cybersicherheit kontinuierlich aus. Unsere Produkte sind einsetzb…",Adzuna::API::Response::Job,"{'__CLASS__': 'Adzuna::API::Response::Location', 'area': ['Deutschland'], 'display_name': 'Deutschland'}","{'label': 'Unknown', 'tag': 'unknown', '__CLASS__': 'Adzuna::API::Response::Category'}",,https://www.adzuna.de/land/ad/5432420916?se=jP2zeASo8BG2galmFizh3g&utm_medium=api&utm_source=a4bcf954&v=4A355C0939DD2102807518A16D605F4211ED46A6,2025-10-05T08:40:24Z,"{'display_name': 'HENSOLDT', '__CLASS__': 'Adzuna::API::Response::Company'}",eyJhbGciOiJIUzI1NiJ9.eyJzIjoialAyemVBU284QkcyZ2FsbUZpemgzZyIsImkiOiI1NDMyNDIwOTE2In0.nVr4mi_yXMzFS6tdgg3SCO0RrU7l6drtun_pnOvc5Bk,0,5432420916,,,,
48.78408,"Duales Studium – Data Science und Künstliche Intelligenz (m/w/x), Beginn Herbst 2026","Sich etwas Neues trauen, über sich hinauswachsen und dabei die Grenzen des Machbaren neu definieren. Genau das ist es, was unsere Mitarbeitenden täglich leben dürfen und sollen. Um mit unseren Innovationen ein Zeichen zu setzen und Großartiges zu ermöglichen. Denn hinter jedem erfolgreichen Unternehmen stehen eine ganze Menge faszinierende Menschen. In einem offenen und modernen Umfeld mit zahlreichen Entwicklungs- und Weiterbildungsmöglichkeiten, arbeiten die Mitarbeitenden bei ZEISS in einer …",Adzuna::API::Response::Job,"{'display_name': 'Oberkochen, Ostalbkreis', '__CLASS__': 'Adzuna::API::Response::Location', 'area': ['Deutschland', 'Baden-Württemberg', 'Ostalbkreis', 'Oberkochen']}","{'label': 'Unknown', 'tag': 'unknown', '__CLASS__': 'Adzuna::API::Response::Category'}",10.10558,https://www.adzuna.de/land/ad/5427355884?se=jP2zeASo8BG2galmFizh3g&utm_medium=api&utm_source=a4bcf954&v=6B5DA9F9C2848A659B1C18D45B1D8EFD25D19939,2025-10-02T20:38:12Z,"{'display_name': 'ZEISS', '__CLASS__': 'Adzuna::API::Response::Company'}",eyJhbGciOiJIUzI1NiJ9.eyJzIjoialAyemVBU284QkcyZ2FsbUZpemgzZyIsImkiOiI1NDI3MzU1ODg0In0.F6djjyK_9A86EITSxBGpKDMMYLro30bJ1jUbjkw0Ogc,0,5427355884,,,,
50.923007,"Duales Studium – Data Science und Künstliche Intelligenz (m/w/x), Beginn Herbst 2026","Sich etwas Neues trauen, über sich hinauswachsen und dabei die Grenzen des Machbaren neu definieren. Genau das ist es, was unsere Mitarbeitenden täglich leben dürfen und sollen. Um mit unseren Innovationen ein Zeichen zu setzen und Großartiges zu ermöglichen. Denn hinter jedem erfolgreichen Unternehmen stehen eine ganze Menge faszinierende Menschen. In einem offenen und modernen Umfeld mit zahlreichen Entwicklungs- und Weiterbildungsmöglichkeiten, arbeiten die Mitarbeitenden bei ZEISS in einer …",Adzuna::API::Response::Job,"{'display_name': 'Jena, Thüringen', '__CLASS__': 'Adzuna::API::Response::Location', 'area': ['Deutschland', 'Thüringen', 'Jena']}","{'tag': 'unknown', 'label': 'Unknown', '__CLASS__': 'Adzuna::API::Response::Category'}",11.589469,https://www.adzuna.de/land/ad/5436855899?se=jP2zeASo8BG2galmFizh3g&utm_medium=api&utm_source=a4bcf954&v=FDC9302FD225B6E1C97A15EF9A0D63DD18775A66,2025-10-08T08:47:14Z,"{'__CLASS__': 'Adzuna::API::Response::Company', 'display_name': 'ZEISS'}",eyJhbGciOiJIUzI1NiJ9.eyJpIjoiNTQzNjg1NTg5OSIsInMiOiJqUDJ6ZUFTbzhCRzJnYWxtRml6aDNnIn0.ujgQCZXJY3x_6MKzJkK_1ctf_vWQwJtZhDn-O82r078,0,5436855899,,,,
,Duales Bachelor Studium: Wirtschaftsinformatik – Data Science (September 2026 – DHBW Stuttgart),"Duales Bachelor Studium: Wirtschafts­informatik – Data Science (September 2026 – DHBW Stuttgart) Bereich: Ausbildung / Duales Studium Standort: Owen bei Kirchheim / Teck Beschäftigungsart: Duales Studium Über 60 Jahre Erfahrung haben Leuze zum Experten für innovative und effiziente Sensor- und Sicherheits­lösungen in der Automatisierungs­technik gemacht. Heute sorgen wir – rund 1.600 Sensor People weltweit – mit Neugier, Leiden­schaft und Entschlossen­heit für Fort­schritt und Wandel. Unser Ant…",Adzuna::API::Response::Job,"{'__CLASS__': 'Adzuna::API::Response::Location', 'area': ['Deutschland'], 'display_name': 'Deutschland'}","{'label': 'Unknown', 'tag': 'unknown', '__CLASS__': 'Adzuna::API::Response::Category'}",,https://www.adzuna.de/land/ad/5444603012?se=jP2zeASo8BG2galmFizh3g&utm_medium=api&utm_source=a4bcf954&v=7C75156C49A6BBB11E801CD0C2E18CCBD6D0B7B4,2025-10-12T22:07:10Z,"{'display_name': 'Leuze electronic GmbH + Co. KG', '__CLASS__': 'Adzuna::API::Response::Company'}",eyJhbGciOiJIUzI1NiJ9.eyJpIjoiNTQ0NDYwMzAxMiIsInMiOiJqUDJ6ZUFTbzhCRzJnYWxtRml6aDNnIn0.sR--5hB4RD8heKzteblyoszAVRQeWR-odAgCyU0oolA,0,5444603012,,,,
48.42392,Duales Studium zum Bachelor of Science – Data Science & Künstliche Intelligenz 2026 (m/w/d),"Die Markant Gruppe ist eines der grössten Dienstleistungsunternehmen in Europa für Handels- und Industriepartner aus dem Food- und Nonfood-Bereich. Unser breites Lösungsportfolio reicht von der Vereinfachung von Datenströmen und Zahlungsabwicklungen über exklusive Finanz- und Versicherungs-Services bis hin zu modernsten Marktforschungstools. Dahinter steckt die Idee: Kunden im operativen Tagesgeschäft zu entlasten, damit sie sich auf ihr Kerngeschäft konzentrieren können. Was noch dahintersteck…",Adzuna::API::Response::Job,"{'area': ['Deutschland', 'Baden-Württemberg', 'Ortenaukreis', 'Offenburg'], '__CLASS__': 'Adzuna::API::Response::Location', 'display_name': 'Offenburg, Ortenaukreis'}","{'label': 'Unknown', 'tag': 'unknown', '__CLASS__': 'Adzuna::API::Response::Category'}",7.94837,https://www.adzuna.de/land/ad/5427390246?se=jP2zeASo8BG2galmFizh3g&utm_medium=api&utm_source=a4bcf954&v=02E417CDBB360048DED332B10683F1AE0A564A34,2025-10-02T20:39:18Z,"{'__CLASS__': 'Adzuna::API::Response::Company', 'display_name': 'Markant Gruppe'}",eyJhbGciOiJIUzI1NiJ9.eyJpIjoiNTQyNzM5MDI0NiIsInMiOiJqUDJ6ZUFTbzhCRzJnYWxtRml6aDNnIn0.yCfzhQPekgzcsr8E1PpCqTZBsPVdsnTnjTCpFrj3Mz0,0,5427390246,,,,
48.79495,Ausbildung: Bachelor of Science (B.Sc.) Studiengang: Data Science & Künstliche Intelligenz,"Bachelor of Science (B.Sc.) Studiengang: Data Science & Künstliche Intelligenz Ausschreibungs-Nr 2026_322 Ausbildungsbeginn 2026 Standort Schwäbisch Gmünd Aufgaben Gestalte die digitale Zukunft? Mit uns! Data Science & KI sind keine Buzzwords - sie sind der Motor unserer Zeit. Ob smarte Produkte, autonome Systeme oder datengetriebene Entscheidungen: Hier gestaltest du die Technologien, die morgen Alltag sind. Mit deinem dualen Studium bei uns verbindest du Wissen & Praxis: spannende Theorie an …",Adzuna::API::Response::Job,"{'area': ['Deutschland', 'Baden-Württemberg', 'Ostalbkreis', 'Schwäbisch Gmünd'], '__CLASS__': 'Adzuna::API::Response::Location', 'display_name': 'Schwäbisch Gmünd, Ostalbkreis'}","{'tag': 'other-general-jobs', 'label': 'Sonstige/Allgemeine Stellen', '__CLASS__': 'Adzuna::API::Response::Category'}",9.851063,https://www.adzuna.de/land/ad/5427365393?se=jP2zeASo8BG2galmFizh3g&utm_medium=api&utm_source=a4bcf954&v=846DE80256960021B702EE024365A3FBE036F87D,2025-10-02T20:38:28Z,"{'display_name': 'Robert Bosch GmbH', '__CLASS__': 'Adzuna::API::Response::Company'}",eyJhbGciOiJIUzI1NiJ9.eyJzIjoialAyemVBU284QkcyZ2FsbUZpemgzZyIsImkiOiI1NDI3MzY1MzkzIn0.UhqgJSFmcaq_y4T-3qedkXVzK13ieVn3KANTCO-nAxs,0,5427365393,,,,
48.6248,Duales Studium Data Science und Künstliche Intelligenz (B. Sc.) – 2026,"Das Produktportfolio der Groupe SEB umfasst ein breites Spektrum hochwertiger und innovativer Marken. Unter „SEB Professional“ bündeln wir unter anderem die Marken WMF Professional Coffee Machines, Schaerer und Wilbur Curtis und gehören damit zu den weltweit führenden Anbietern professioneller Kaffeemaschinen für unsere Geschäftskunden. Auch bei unseren Endkonsumenten punkten wir mit Qualität und Design: Haushaltsgeräte, Kochgeschirr und Metallwaren der Premiummarke WMF sowie von Rowenta, Tefal…",Adzuna::API::Response::Job,"{'__CLASS__': 'Adzuna::API::Response::Location', 'area': ['Deutschland', 'Baden-Württemberg', 'Göppingen (Kreis)', 'Geislingen an der Steige'], 'display_name': 'Geislingen an der Steige, Göppingen (Kreis)'}","{'__CLASS__': 'Adzuna::API::Response::Category', 'label': 'Unknown', 'tag': 'unknown'}",9.82692,https://www.adzuna.de/land/ad/5427380839?se=jP2zeASo8BG2galmFizh3g&utm_medium=api&utm_source=a4bcf954&v=58A1297932F95BCA40EFBC6F1D1EB38164422DC3,2025-10-02T20:38:57Z,"{'display_name': 'Groupe SEB WMF Shared Services GmbH', '__CLASS__': 'Adzuna::API::Response::Company'}",eyJhbGciOiJIUzI1NiJ9.eyJzIjoialAyemVBU284QkcyZ2FsbUZpemgzZyIsImkiOiI1NDI3MzgwODM5In0.2uwXNBtl8YA_cdF311yudCKYWUhEbX-TXe5KriNN7kU,0,5427380839,,,,
48.383137,Duales Studium Data Science / Künstliche Intelligenz in Kooperation mit der Dualen Hochschule Baden-Württemberg 2026 (m/w/d),"Life is always about becoming… Im Leben geht es darum, sich auf eine Reise zu begeben, um die beste Version unseres zukünftigen Selbst zu werden. Während wir Neues entdecken, stellen wir uns Herausforderungen, meistern sie und wachsen über uns hinaus. Bewerben Sie sich bei Mercedes-Benz und finden Sie den Aufgabenbereich, in dem Sie Ihre Talente individuell entfalten können. Dabei werden Sie von visionären Kolleginnen und Kollegen unterstützt, die Ihren Pioniergeist teilen. Bei uns einzusteigen…",Adzuna::API::Response::Job,"{'display_name': 'Ulm, Baden-Württemberg', 'area': ['Deutschland', 'Baden-Württemberg', 'Ulm'], '__CLASS__': 'Adzuna::API::Response::Location'}","{'__CLASS__': 'Adzuna::API::Response::Category', 'tag': 'unknown', 'label': 'Unknown'}",9.856945,https://www.adzuna.de/land/ad/5427374689?se=jP2zeASo8BG2galmFizh3g&utm_medium=api&utm_source=a4bcf954&v=56F7072D026DCEB0AF94443C2E5E0500DE2E2191,2025-10-02T20:38:46Z,"{'__CLASS__': 'Adzuna::API::Response::Company', 'display_name': 'Mercedes-Benz Tech Innovation'}",eyJhbGciOiJIUzI1NiJ9.eyJpIjoiNTQyNzM3NDY4OSIsInMiOiJqUDJ6ZUFTbzhCRzJnYWxtRml6aDNnIn0.JOgppE-YH1ISPjEKXf7EOICP1cHCCrZZMCKGHBlScyo,0,5427374689,,,,
49.443967,"Duales Studium Bachelor of Science in Data Science und Künstlicher Intelligenz (m/w/d), ab 09/2026","Das ist das Arbeitsumfeld: Bei DATEV arbeitest du nicht nur in einem Team, sondern bist von Anfang an Teil einer Gemeinschaft, die rund 200 Auszubildende und dual Studierende umfasst. Du bist in verschiedene Aufgaben eingebunden, die sowohl herausfordernd als auch abwechslungsreich sind. Gemeinsam sorgen wir für exzellente Kundenberatung und langfristige Geschäftsbeziehungen. Du arbeitest in einem dynamischen und innovativen Umfeld, das neuen Ideen und Weiterentwicklungen stets offen gegenübers…",Adzuna::API::Response::Job,"{'display_name': 'Nürnberg, Bayern', 'area': ['Deutschland', 'Bayern', 'Nürnberg'], '__CLASS__': 'Adzuna::API::Response::Location'}","{'tag': 'it-jobs', 'label': 'IT-Stellen', '__CLASS__': 'Adzuna::API::Response::Category'}",11.083642,https://www.adzuna.de/land/ad/5331000753?se=jP2zeASo8BG2galmFizh3g&utm_medium=api&utm_source=a4bcf954&v=D06BB784CDCAB65AF1288C4E55C766AC1F1D24B5,2025-08-01T03:06:44Z,"{'__CLASS__': 'Adzuna::API::Response::Company', 'display_name': 'Datev eG'}",eyJhbGciOiJIUzI1NiJ9.eyJzIjoialAyemVBU284QkcyZ2FsbUZpemgzZyIsImkiOiI1MzMxMDAwNzUzIn0.vKfRhQ738wBiMhWQUyfWa7WRHtSextGJ1MqUmzSOKv4,0,5331000753,full_time,,,
49.49349,Abiturient für Duales Studium Data Science IoT Plattform (m/w/d),"Unternehmensbeschreibung Gerresheimer ist als innovativer System- und Lösungsanbieter der globale Partner für die Pharma-, Biotech- und Kosmetikbranche. Die Gruppe bietet ein umfassendes Portfolio an Drug-Containment-Lösungen inklusive Verschlüsse und Zubehör, sowie Drug-Delivery-Systemen, Medizinprodukten und Lösungen für die Gesundheitsbranche an. Das Leistungsspektrum umfasst unter anderem digitale Lösungen für die Therapiebegleitung, Medikamentenpumpen, Spritzen, Pens, Autoinjektoren und In…",Adzuna::API::Response::Job,"{'__CLASS__': 'Adzuna::API::Response::Location', 'area': ['Deutschland', 'Bayern', 'Schwandorf (Kreis)', 'Pfreimd'], 'display_name': 'Pfreimd, Schwandorf (Kreis)'}","{'__CLASS__': 'Adzuna::API::Response::Category', 'tag': 'it-jobs', 'label': 'IT-Stellen'}",12.17958,https://www.adzuna.de/land/ad/5349251676?se=jP2zeASo8BG2galmFizh3g&utm_medium=api&utm_source=a4bcf954&v=8D753D5A12484BA5BBC14CC408F6EB37235825F3,2025-08-12T20:35:42Z,"{'__CLASS__': 'Adzuna::API::Response::Company', 'display_name': 'Gerresheimer AG'}",eyJhbGciOiJIUzI1NiJ9.eyJzIjoialAyemVBU284QkcyZ2FsbUZpemgzZyIsImkiOiI1MzQ5MjUxNjc2In0.nFTEtaW-f0wRUEbw9on2bwLbHLA2DSspOJxtDh1fWwE,0,5349251676,full_time,,,
48.137418,Data Science Consultant - Data & AI (f/m/d) - Inklusiver Job   ,"You have a passion for technology and want to make the world a greener place? Join the forefront of energy transition with E.ON's Digital Technology organization, as part of our technology in-house consulting, Expert Services. As a professional services organization, we collaborate closely with our business units, providing pivotal services that accelerate E.ON's ambitious Digital Transformation strategy. If you have a passion for leading the green transition with digital innovation, become a p…",Adzuna::API::Response::Job,"{'display_name': 'München, München (Kreis)', 'area': ['Deutschland', 'Bayern', 'München (Kreis)', 'München'], '__CLASS__': 'Adzuna::API::Response::Location'}","{'tag': 'unknown', 'label': 'Unknown', '__CLASS__': 'Adzuna::API::Response::Category'}",11.555737,https://www.adzuna.de/land/ad/5439613905?se=jP2zeASo8BG2galmFizh3g&utm_medium=api&utm_source=a4bcf954&v=5650B2061F0DAD2DCAE180920E06C5FCECEDADC8,2025-10-09T16:37:22Z,"{'__CLASS__': 'Adzuna::API::Response::Company', 'display_name': 'E.ON'}",eyJhbGciOiJIUzI1NiJ9.eyJpIjoiNTQzOTYxMzkwNSIsInMiOiJqUDJ6ZUFTbzhCRzJnYWxtRml6aDNnIn0.x7_WJgaxitDuOTBWvqfy_XN0B5SVTLrX5uoFQKa4oSc,0,5439613905,,,,
49.21886,"Duales Studium Wirtschaftsinformatik/Data Science (B.Sc.), Campusmodell Germersheim/Stuttgart 2026 (w/m/d)","Life is always about becoming… Im Leben geht es darum, sich auf eine Reise zu begeben, um die beste Version unseres zukünftigen Selbst zu werden. Während wir Neues entdecken, stellen wir uns Herausforderungen, meistern sie und wachsen über uns hinaus. Bewerben Sie sich bei Mercedes-Benz und finden Sie den Aufgabenbereich, in dem Sie Ihre Talente individuell entfalten können. Dabei werden Sie von visionären Kolleginnen und Kollegen unterstützt, die Ihren Pioniergeist teilen. Bei uns einzusteigen…",Adzuna::API::Response::Job,"{'__CLASS__': 'Adzuna::API::Response::Location', 'area': ['Deutschland', 'Rheinland-Pfalz', 'Germersheim (Kreis)', 'Germersheim'], 'display_name': 'Germersheim, Germersheim (Kreis)'}","{'tag': 'unknown', 'label': 'Unknown', '__CLASS__': 'Adzuna::API::Response::Category'}",8.36958,https://www.adzuna.de/land/ad/5433667893?se=jP2zeASo8BG2galmFizh3g&utm_medium=api&utm_source=a4bcf954&v=3E763D4A9CB24D6334B504B1522385142365A6D2,2025-10-06T08:43:04Z,"{'__CLASS__': 'Adzuna::API::Response::Company', 'display_name': 'Mercedes-Benz AG'}",eyJhbGciOiJIUzI1NiJ9.eyJpIjoiNTQzMzY2Nzg5MyIsInMiOiJqUDJ6ZUFTbzhCRzJnYWxtRml6aDNnIn0.Gko2VTGrPIJd48-KzLw1mzN-OCmnAnX0ZmOqKZs-4OI,0,5433667893,,,,
50.129683,Senior Data Science (m/w/d) - Inklusiver Job   ,"Willkommen bei der KfW! Als eine der führenden Förderbanken der Welt stehen wir für die nachhaltige Transformation von Umwelt, Gesellschaft und Unternehmen. Als Impulsgeber wirken wir aktiv an den Themen mit, die die Welt von morgen prägen. Wir fördern Windparks, Infrastruktur-Projekte, Schulen und Krankenhäuser und gestalten damit die Zukunft. Bei uns finden Sie ein vertrauensvolles Arbeitsumfeld, in dem Teamspirit, Vielfalt und Inklusion gelebt werden. Wir fördern Sie, Ihre Ideen und Ihr Enga…",Adzuna::API::Response::Job,"{'__CLASS__': 'Adzuna::API::Response::Location', 'area': ['Deutschland', 'Hessen', 'Frankfurt am Main'], 'display_name': 'Frankfurt am Main, Hessen'}","{'label': 'Unknown', 'tag': 'unknown', '__CLASS__': 'Adzuna::API::Response::Category'}",8.650578,https://www.adzuna.de/land/ad/5406927976?se=jP2zeASo8BG2galmFizh3g&utm_medium=api&utm_source=a4bcf954&v=41F7D5BD463ADD23E618F0A1EA6C950D15FDD70E,2025-09-19T15:16:08Z,"{'display_name': 'KfW Bankengruppe', '__CLASS__': 'Adzuna::API::Response::Company'}",eyJhbGciOiJIUzI1NiJ9.eyJpIjoiNTQwNjkyNzk3NiIsInMiOiJqUDJ6ZUFTbzhCRzJnYWxtRml6aDNnIn0.n2KqAO7UVs5ghAb8JgeImAjsQpNyx1Hx8HjoPkQjqXY,0,5406927976,,,,
52.507706,Senior Data Science (m/w/d) - Inklusiver Job   ,"Willkommen bei der KfW! Als eine der führenden Förderbanken der Welt stehen wir für die nachhaltige Transformation von Umwelt, Gesellschaft und Unternehmen. Als Impulsgeber wirken wir aktiv an den Themen mit, die die Welt von morgen prägen. Wir fördern Windparks, Infrastruktur-Projekte, Schulen und Krankenhäuser und gestalten damit die Zukunft. Bei uns finden Sie ein vertrauensvolles Arbeitsumfeld, in dem Teamspirit, Vielfalt und Inklusion gelebt werden. Wir fördern Sie, Ihre Ideen und Ihr Enga…",Adzuna::API::Response::Job,"{'__CLASS__': 'Adzuna::API::Response::Location', 'area': ['Deutschland', 'Berlin'], 'display_name': 'Berlin, Deutschland'}","{'__CLASS__': 'Adzuna::API::Response::Category', 'tag': 'unknown', 'label': 'Unknown'}",13.420806,https://www.adzuna.de/land/ad/5406928004?se=jP2zeASo8BG2galmFizh3g&utm_medium=api&utm_source=a4bcf954&v=E9C8CB497E616D79AA0EADAAB99757D46A7CB9B4,2025-09-19T15:16:10Z,"{'display_name': 'KfW Bankengruppe', '__CLASS__': 'Adzuna::API::Response::Company'}",eyJhbGciOiJIUzI1NiJ9.eyJpIjoiNTQwNjkyODAwNCIsInMiOiJqUDJ6ZUFTbzhCRzJnYWxtRml6aDNnIn0.85W6ai-4bntR_x8VYgfljDYfNGLMMOGstdgay95y_FE,0,5406928004,,,,
