title,__CLASS__,location,latitude,id,redirect_url,category,company,salary_is_predicted,created,description,longitude,adref,contract_time,salary_max,salary_min,contract_type
Duales Studium Data Science und KI (m/w/d),Adzuna::API::Response::Job,"{'area': ['Deutschland', 'Baden-Württemberg', 'Freiburg im Breisgau'], 'display_name': 'Freiburg im Breisgau, Baden-Württemberg', '__CLASS__': 'Adzuna::API::Response::Location'}",47.999458,5510092387,https://www.adzuna.de/details/5510092387?utm_medium=api&utm_source=a4bcf954,"{'label': 'Unknown', '__CLASS__': 'Adzuna::API::Response::Category', 'tag': 'unknown'}","{'display_name': 'Streck Transportgesellschaft mbH', '__CLASS__': 'Adzuna::API::Response::Company'}",0,2025-11-23T01:16:32Z,"Spannend, vielfältig und immer mit Perspektive: Ein Studium bei Streck Transport ist der perfekte Start in Dein Berufsleben. Profitiere von den Vorteilen eines großen, mittelständischen Unternehmens und erhalte Einblicke in unterschiedlichste Informatikbereiche. Das Studium Data Science und Künstliche Intelligenz ist eine einzigartige, zukunftsweisende Verschmelzung von BWL / Management und Big Data / Machine Learning und bildet die Datenspezialisten von morgen aus. Zum 01.10.2026 bieten wir ei…",7.816286,eyJhbGciOiJIUzI1NiJ9.eyJpIjoiNTUxMDA5MjM4NyIsInMiOiJQc0VOd0FiZjhCRzQzNGFWTEZrV1pRIn0.R6A_o-CiSypSv0ZUn3I_4UTEE4vV-oxqdNRLxXbOV0k,,,,
Werkstudent Business Intelligence & Data Science (m/w/d),Adzuna::API::Response::Job,"{'__CLASS__': 'Adzuna::API::Response::Location', 'area': ['Deutschland', 'Hessen', 'Frankfurt am Main', 'Niederrad'], 'display_name': 'Niederrad, Frankfurt am Main'}",50.0863,5547778746,https://www.adzuna.de/details/5547778746?utm_medium=api&utm_source=a4bcf954,"{'label': 'Unknown', '__CLASS__': 'Adzuna::API::Response::Category', 'tag': 'unknown'}","{'__CLASS__': 'Adzuna::API::Response::Company', 'display_name': 'Eintracht Frankfurt Fußball AG'}",0,2025-12-18T21:32:16Z,"Im Geschäftsfeld „Plattform & Digitales Ökosystem“ ging die Eintracht mit der EintrachtTech GmbH einen einzigartigen Weg – alle zentralen Systeme wurden durch eigene Softwareentwicklung neu kreiert, so dass die Eintracht mittlerweile über eine der besten digitalen Infrastrukturen im europäischen Sport verfügt. Es entstehen rund um das Herzstück unserer Plattformstrategie – die Eintracht-App „mainaqila“ – neue B2C- und B2B-Geschäftsmodelle und Services für die Fans. Zur Unterstützung unserer inn…",8.63833,eyJhbGciOiJIUzI1NiJ9.eyJzIjoiUHNFTndBYmY4Qkc0MzRhVkxGa1daUSIsImkiOiI1NTQ3Nzc4NzQ2In0.cV-vlFWXH_F0zFhJXO6fxQYSFnhlEWgsnLh2cgJS8mA,,,,
DHBW Student Wirtschaftsinformatik - Data Science (m/w/d),Adzuna::API::Response::Job,"{'__CLASS__': 'Adzuna::API::Response::Location', 'display_name': 'Ostfildern, Esslingen (Kreis)', 'area': ['Deutschland', 'Baden-Württemberg', 'Esslingen (Kreis)', 'Ostfildern']}",48.72761,5474044939,https://www.adzuna.de/details/5474044939?utm_medium=api&utm_source=a4bcf954,"{'label': 'Unknown', '__CLASS__': 'Adzuna::API::Response::Category', 'tag': 'unknown'}","{'__CLASS__': 'Adzuna::API::Response::Company', 'display_name': 'Deutsche Automobil Treuhand GmbH'}",0,2025-11-01T06:00:03Z,"Dein Studium bei der DAT: Willkommen in unserem lebendigen Tagesgeschäft. Du arbeitest in verschiedenen Abteilungen rundum IT und Softwareentwicklung und lernst unsere Prozesse kennen. Du trägst Verantwortung für eigene Projekte und stehst in engem Kontakt mit deinem Ausbilder und Experten der Fachabteilungen. Das macht den Studiengang aus: Du bewegst dich gerne in der digitalen Welt und willst genau wissen, was hinter intelligenter Software steckt? Dann ist dieser Studiengang Wirtschaftsinform…",9.24596,eyJhbGciOiJIUzI1NiJ9.eyJzIjoiUHNFTndBYmY4Qkc0MzRhVkxGa1daUSIsImkiOiI1NDc0MDQ0OTM5In0.I9pApc8Ll8i24jN-bh0FPRuHfL_RTNKYGSNjFbqq9kk,,,,
Werkstudent Data Science / Digital Maintenance Solutions (all genders),Adzuna::API::Response::Job,"{'display_name': 'Schulenkamp, Langenhagen', 'area': ['Deutschland', 'Niedersachsen', 'Region Hannover (Kreis)', 'Langenhagen', 'Schulenkamp'], '__CLASS__': 'Adzuna::API::Response::Location'}",52.46704,4931329064,https://www.adzuna.de/details/4931329064?utm_medium=api&utm_source=a4bcf954,"{'__CLASS__': 'Adzuna::API::Response::Category', 'label': 'Stellen aus Fertigung', 'tag': 'manufacturing-jobs'}","{'display_name': 'MTU Maintenance Hannover', '__CLASS__': 'Adzuna::API::Response::Company'}",0,2024-11-08T12:50:26Z,"UPLIFT Y OURFUTURE Wir sind über 13.000. An 19 Standorten weltweit. Jedes dritte Flugzeug fliegt mit unserer Technologie. Immer effizienter, leiser, nachhaltiger. Wir gestalten die Zukunft der Luftfahrt. Was wir noch brauchen? Dich. Unser Team in Hannover-Langenhagen sucht Dich: Werkstudent Data Science / Digital Maintenance Solutions (all genders) Du hast Lust mit Daten, Algorithmen und im komplexen Feld der Luftfahrt zu arbeiten? Du willst dich bei der Entwicklung digitaler Produkte für die T…",9.70266,eyJhbGciOiJIUzI1NiJ9.eyJzIjoiUHNFTndBYmY4Qkc0MzRhVkxGa1daUSIsImkiOiI0OTMxMzI5MDY0In0.SZEdNr_H5yB8JCidGgRblyjebFnaTC3RoMpi3EAsP_E,part_time,,,
B.Sc. Data Science & KI (w/m/d),Adzuna::API::Response::Job,"{'__CLASS__': 'Adzuna::API::Response::Location', 'display_name': 'München, München (Kreis)', 'area': ['Deutschland', 'Bayern', 'München (Kreis)', 'München']}",48.137418,5501661996,https://www.adzuna.de/details/5501661996?utm_medium=api&utm_source=a4bcf954,"{'tag': 'unknown', '__CLASS__': 'Adzuna::API::Response::Category', 'label': 'Unknown'}","{'display_name': 'Atos Information Technology', '__CLASS__': 'Adzuna::API::Response::Company'}",0,2025-11-18T12:41:00Z,"Du liebst IT? Dann gestalte die KI-gestützte digitale Zukunft mit uns! Du möchtest Lösungen für die dringendsten und komplexesten Herausforderungen der digitalen Welt finden und dabei die digitale Transformation mitgestalten? Du möchtest ein Teil eines Weltklasse-Teams sein und bei einem ""next generation Tech Leader"" arbeiten? Dann starte bei uns als Nachwuchstalent in einem der zahlreichen dualen Studiengänge! Entdecke eine offene, multikulturelle Unternehmenskultur mit vielfältigen Entwicklun…",11.555737,eyJhbGciOiJIUzI1NiJ9.eyJpIjoiNTUwMTY2MTk5NiIsInMiOiJQc0VOd0FiZjhCRzQzNGFWTEZrV1pRIn0.09mrkgVNUjFClO12m43gXLrC-3p00YQnrsH3dkr136o,,,,
Procurement Specialist (m/w/d) Data Science & AI,Adzuna::API::Response::Job,"{'__CLASS__': 'Adzuna::API::Response::Location', 'display_name': 'Deutschland', 'area': ['Deutschland']}",,5495521309,https://www.adzuna.de/details/5495521309?utm_medium=api&utm_source=a4bcf954,"{'tag': 'it-jobs', 'label': 'IT-Stellen', '__CLASS__': 'Adzuna::API::Response::Category'}","{'__CLASS__': 'Adzuna::API::Response::Company', 'display_name': 'Leadec Management Central Europe BV & Co. KG'}",0,2025-11-14T12:37:53Z,"Ihr Aufgabenbereich Verantwortung übernehmen: Leitung und Vorantreiben von Initiativen zur digitalen Transformation mit Schwerpunkt Data Science & AI im Bereich Einkauf Europa, die sich auf die Verbesserung der Beschaffungseffizienz, Kosteneinsparungen sowie das Risiko- und Lieferantenmanagement konzentrieren. Analytisch vorgehen: Analyse und Identifizierung von Digitalisierungspotentialen innerhalb der Einkaufsorganisation sowie deren Prozessen. Aufgaben anpacken: Konzeption, Planung, Koordina…",,eyJhbGciOiJIUzI1NiJ9.eyJzIjoiUHNFTndBYmY4Qkc0MzRhVkxGa1daUSIsImkiOiI1NDk1NTIxMzA5In0.m4C2O4CEaW9O8qhnJe3pmh981brqHMg6lP_azdbF1p4,,,,
Procurement Specialist (m/w/d) Data Science & AI,Adzuna::API::Response::Job,"{'__CLASS__': 'Adzuna::API::Response::Location', 'display_name': 'Deutschland', 'area': ['Deutschland']}",,5509088745,https://www.adzuna.de/details/5509088745?utm_medium=api&utm_source=a4bcf954,"{'__CLASS__': 'Adzuna::API::Response::Category', 'label': 'Stellen aus Einzelhandel', 'tag': 'retail-jobs'}","{'__CLASS__': 'Adzuna::API::Response::Company', 'display_name': 'Leadec'}",0,2025-11-22T17:10:45Z,"Ihr Aufgabenbereich Verantwortung ü bernehmen : Leitung und Vorantreiben von Initiativen zur digitalen Transformation mit Schwerpunkt Data Science & AI im Bereich Einkauf Europa, die sich auf die Verbesserung der Beschaffungseffizienz, Kosteneinsparungen sowie das Risiko- und Lieferantenmanagement konzentrieren. Analytisch vorgehen : Analyse und Identifizierung von Digitalisierungspotentialen innerhalb der Einkaufsorganisation sowie deren Prozessen. Aufgaben anpacken: Konzeption, Planung, Koord…",,eyJhbGciOiJIUzI1NiJ9.eyJpIjoiNTUwOTA4ODc0NSIsInMiOiJQc0VOd0FiZjhCRzQzNGFWTEZrV1pRIn0.eI7I82RCW9I1kg-yM7FFNkayGDldM9P5XyT6ZuVMVVg,,,,
Praktikum Associate Consultant Data Science (m/w/d),Adzuna::API::Response::Job,"{'__CLASS__': 'Adzuna::API::Response::Location', 'area': ['Deutschland', 'Nordrhein-Westfalen', 'Bonn'], 'display_name': 'Bonn, Nordrhein-Westfalen'}",50.71942,5510629661,https://www.adzuna.de/details/5510629661?utm_medium=api&utm_source=a4bcf954,"{'label': 'Unknown', '__CLASS__': 'Adzuna::API::Response::Category', 'tag': 'unknown'}","{'display_name': 'Simon-Kucher & Partners', '__CLASS__': 'Adzuna::API::Response::Company'}",0,2025-11-23T18:37:53Z,Praktikum Associate Consultant Data Science (m/w/d) In Deutschland - Berlin| Bonn | Köln Du willst Praxiserfahrung in einer internationalen Unternehmensberatungsammeln? Bei uns kannst du dein Interesse an Wirtschaftsthemen mit deinenanalytischen Fähigkeiten verbinden! Werde für mindestens 10 Wochen Teil einesaußergewöhnlichen Teams. Was uns besonders macht: ein starker Unternehmergeistund jede Menge Gestaltungsfreiheit. Der Advanced Analytics Bereich bei Simon-Kucher konzentriert sich auf dieEn…,7.112412,eyJhbGciOiJIUzI1NiJ9.eyJzIjoiUHNFTndBYmY4Qkc0MzRhVkxGa1daUSIsImkiOiI1NTEwNjI5NjYxIn0.KApay1Wm6lm8e86S0PbKHwPg52OO3aqmaKp1aRkiWug,,,,
Praktikum Associate Consultant Data Science (m/w/d),Adzuna::API::Response::Job,"{'__CLASS__': 'Adzuna::API::Response::Location', 'area': ['Deutschland', 'Berlin'], 'display_name': 'Berlin, Deutschland'}",52.507706,5510629665,https://www.adzuna.de/details/5510629665?utm_medium=api&utm_source=a4bcf954,"{'__CLASS__': 'Adzuna::API::Response::Category', 'label': 'Unknown', 'tag': 'unknown'}","{'__CLASS__': 'Adzuna::API::Response::Company', 'display_name': 'Simon-Kucher & Partners'}",0,2025-11-23T18:37:53Z,Praktikum Associate Consultant Data Science (m/w/d) In Deutschland - Berlin| Bonn | Köln Du willst Praxiserfahrung in einer internationalen Unternehmensberatungsammeln? Bei uns kannst du dein Interesse an Wirtschaftsthemen mit deinenanalytischen Fähigkeiten verbinden! Werde für mindestens 10 Wochen Teil einesaußergewöhnlichen Teams. Was uns besonders macht: ein starker Unternehmergeistund jede Menge Gestaltungsfreiheit. Der Advanced Analytics Bereich bei Simon-Kucher konzentriert sich auf dieEn…,13.420806,eyJhbGciOiJIUzI1NiJ9.eyJpIjoiNTUxMDYyOTY2NSIsInMiOiJQc0VOd0FiZjhCRzQzNGFWTEZrV1pRIn0._sO0vUMIEgWL2PXhnudB0K8Mpsd1nKYyfIItp7CClfg,,,,
Praktikum Associate Consultant Data Science (m/w/d),Adzuna::API::Response::Job,"{'__CLASS__': 'Adzuna::API::Response::Location', 'area': ['Deutschland', 'Nordrhein-Westfalen', 'Köln'], 'display_name': 'Köln, Nordrhein-Westfalen'}",,5510629664,https://www.adzuna.de/details/5510629664?utm_medium=api&utm_source=a4bcf954,"{'label': 'Unknown', '__CLASS__': 'Adzuna::API::Response::Category', 'tag': 'unknown'}","{'display_name': 'Simon-Kucher & Partners', '__CLASS__': 'Adzuna::API::Response::Company'}",0,2025-11-23T18:37:53Z,Praktikum Associate Consultant Data Science (m/w/d) In Deutschland - Berlin| Bonn | Köln Du willst Praxiserfahrung in einer internationalen Unternehmensberatungsammeln? Bei uns kannst du dein Interesse an Wirtschaftsthemen mit deinenanalytischen Fähigkeiten verbinden! Werde für mindestens 10 Wochen Teil einesaußergewöhnlichen Teams. Was uns besonders macht: ein starker Unternehmergeistund jede Menge Gestaltungsfreiheit. Der Advanced Analytics Bereich bei Simon-Kucher konzentriert sich auf dieEn…,,eyJhbGciOiJIUzI1NiJ9.eyJzIjoiUHNFTndBYmY4Qkc0MzRhVkxGa1daUSIsImkiOiI1NTEwNjI5NjY0In0.KRhtkOUPWGqysj3qoaopvGB9Kgqf8DeYO11PUwWN_WY,,,,
Werkstudent Data Science & Künstliche Intelligenz (m/w/d),Adzuna::API::Response::Job,"{'__CLASS__': 'Adzuna::API::Response::Location', 'display_name': 'Haar, München (Kreis)', 'area': ['Deutschland', 'Bayern', 'München (Kreis)', 'Haar']}",48.10954,5351528153,https://www.adzuna.de/details/5351528153?utm_medium=api&utm_source=a4bcf954,"{'tag': 'graduate-jobs', 'label': 'Stellen für Hochschulabsolventen', '__CLASS__': 'Adzuna::API::Response::Category'}","{'__CLASS__': 'Adzuna::API::Response::Company', 'display_name': 'Sopra-Steria'}",0,2025-08-14T00:58:15Z,"Unternehmensbeschreibung Wir sind eine der führenden Management- und Technologieberatungen und verstehen uns als Vordenker*innen. Wir handeln und denken strategisch, sind überzeugend und unterstützen unsere Kunden mit maßgeschneiderten Lösungen, präzisen Prozessen und innovativen Technologien. Weltweit sind wir 52.000 kreative und kluge Köpfe, in Deutschland und Österreich rund 2.700. Gemeinsam gestalten wir mit digitalen Technologien die Zukunft unserer Kunden und die der Gesellschaft. Vielfal…",11.72645,eyJhbGciOiJIUzI1NiJ9.eyJpIjoiNTM1MTUyODE1MyIsInMiOiJQc0VOd0FiZjhCRzQzNGFWTEZrV1pRIn0.odb6eZ6Gai5RnZOQJefmwELUVbapxWdayRKmgbbXv9k,,,,
Duales Studium B.Sc. Wirtschaftsinformatik - Schwerpunkt Data Science,Adzuna::API::Response::Job,"{'display_name': 'Weingarten (Baden), Karlsruhe (Kreis)', 'area': ['Deutschland', 'Baden-Württemberg', 'Karlsruhe (Kreis)', 'Weingarten (Baden)'], '__CLASS__': 'Adzuna::API::Response::Location'}",49.05204,5470875416,https://www.adzuna.de/details/5470875416?utm_medium=api&utm_source=a4bcf954,"{'__CLASS__': 'Adzuna::API::Response::Category', 'label': 'Unknown', 'tag': 'unknown'}","{'__CLASS__': 'Adzuna::API::Response::Company', 'display_name': 'All for One Group SE'}",0,2025-10-30T11:57:00Z,"Wir! Eine eingeschworene Gemeinschaft von über 2.800 Transformations- & Integrationsexperten, New Work Verfechtern, Cybersecurity Spezialisten, Big Data & Business Analysten, IoT Engineers und Consultants rund um Business-IT von SAP, Microsoft und IBM. Als führende Consulting- und IT-Gruppe vereinen wir Strategie- und Managementberatung, Prozessberatung, Branchen-Expertise und Technologie-Know-how in Kombination mit IT-Beratung und -Services unter einem Dach. Wir begleiten und unterstützen mehr…",8.53179,eyJhbGciOiJIUzI1NiJ9.eyJpIjoiNTQ3MDg3NTQxNiIsInMiOiJQc0VOd0FiZjhCRzQzNGFWTEZrV1pRIn0.NfgA7SyC_NFfEmX8NzVmDt3HENaHpLIf9TjdE6BDA60,,,,
Duales Masterstudium Applied Data Science (m/f/d),Adzuna::API::Response::Job,"{'area': ['Deutschland', 'Hamburg'], 'display_name': 'Hamburg, Deutschland', '__CLASS__': 'Adzuna::API::Response::Location'}",53.557429,5542485836,https://www.adzuna.de/details/5542485836?utm_medium=api&utm_source=a4bcf954,"{'label': 'Stellen aus Kreation & Design', '__CLASS__': 'Adzuna::API::Response::Category', 'tag': 'creative-design-jobs'}","{'__CLASS__': 'Adzuna::API::Response::Company', 'display_name': 'CGI'}",0,2025-12-14T21:49:51Z,"Position Description: Duales Masterstudium Applied Data Science (m/f/d) Stellenbeschreibung Du willst Dich dem analytischen Umgang mit Daten stellen und hast dabei gleichzeitig „das große Ganze“ im Unternehmen im Blick? Künstliche Intelligenz, Data Mining, Predictive Analytics und Projektmanagement findest Du spannend? Kein Problem bei CGI! • Breite Karrieremöglichkeiten • Steile Lernkurve in kleinen Teams • Freistellungstage für Präsenzphasen und individuelles Lernen • Attraktives Gehalt sowie…",9.987297,eyJhbGciOiJIUzI1NiJ9.eyJzIjoiUHNFTndBYmY4Qkc0MzRhVkxGa1daUSIsImkiOiI1NTQyNDg1ODM2In0.txWoFwtfWnWOKE6SmU2KbuTobfNyNFDydO-QiTYZPdM,,,,
Duales Masterstudium Applied Data Science (m/f/d),Adzuna::API::Response::Job,"{'__CLASS__': 'Adzuna::API::Response::Location', 'area': ['Deutschland', 'Hamburg', 'Hamburg-Altstadt'], 'display_name': 'Hamburg-Altstadt, Hamburg'}",53.5504,5546721778,https://www.adzuna.de/details/5546721778?utm_medium=api&utm_source=a4bcf954,"{'__CLASS__': 'Adzuna::API::Response::Category', 'label': 'Stellen für Hochschulabsolventen', 'tag': 'graduate-jobs'}","{'__CLASS__': 'Adzuna::API::Response::Company', 'display_name': 'CGI'}",0,2025-12-18T05:42:13Z,"Position Description: Duales Masterstudium Applied Data Science (m/f/d) Stellenbeschreibung Du willst Dich dem analytischen Umgang mit Daten stellen und hast dabei gleichzeitig „das große Ganze“ im Unternehmen im Blick? Künstliche Intelligenz, Data Mining, Predictive Analytics und Projektmanagement findest Du spannend? Kein Problem bei CGI! • Breite Karrieremöglichkeiten • Steile Lernkurve in kleinen Teams • Freistellungstage für Präsenzphasen und individuelles Lernen • Attraktives Gehalt sowie…",9.99417,eyJhbGciOiJIUzI1NiJ9.eyJzIjoiUHNFTndBYmY4Qkc0MzRhVkxGa1daUSIsImkiOiI1NTQ2NzIxNzc4In0.igxp_hmc-CAZ-uiik0WYf_SaR_qRkE0NbQ2X52ELbaw,,,,contract
Duales Studium Data Science und Künstliche Intelligenz mit Start 2026,Adzuna::API::Response::Job,"{'display_name': 'Allach-Untermenzing, München', 'area': ['Deutschland', 'Bayern', 'München (Kreis)', 'München', 'Allach-Untermenzing'], '__CLASS__': 'Adzuna::API::Response::Location'}",48.18449,5284742379,https://www.adzuna.de/details/5284742379?utm_medium=api&utm_source=a4bcf954,"{'label': 'Stellen aus Fertigung', '__CLASS__': 'Adzuna::API::Response::Category', 'tag': 'manufacturing-jobs'}","{'__CLASS__': 'Adzuna::API::Response::Company', 'display_name': 'MTU Aero Engines AG'}",0,2025-07-04T16:14:05Z,"UPLIFT Y OURFUTURE Wir sind mehr als 13.000 Mitarbeiter:innen. An 19 Standorten weltweit. Jedes dritte Flugzeug fliegt mit unserer Technologie. Immer effizienter, leiser, nachhaltiger. Wir gestalten die Zukunft der Luftfahrt. Was wir noch brauchen? Dich. Unsere Ausbildung in München sucht Schülerinnen und Schüler für ein Duales Studium Data Science und Künstliche Intelligenz mit Start 2026 Dieser duale Studiengang bereitet Dich ganz gezielt auf eine spätere Tätigkeit in der Datenanalyse der MTU…",11.44811,eyJhbGciOiJIUzI1NiJ9.eyJzIjoiUHNFTndBYmY4Qkc0MzRhVkxGa1daUSIsImkiOiI1Mjg0NzQyMzc5In0.bauET3o9CKcOkx37F-1oLC95SEdYEABlyDwFnPS8q0c,full_time,,,
Bachelor of Science (B. Sc.) Data Science und KI,Adzuna::API::Response::Job,"{'__CLASS__': 'Adzuna::API::Response::Location', 'area': ['Deutschland', 'Hessen', 'Bergstraße (Kreis)', 'Bensheim'], 'display_name': 'Bensheim, Bergstraße (Kreis)'}",49.67828,5393534665,https://www.adzuna.de/details/5393534665?utm_medium=api&utm_source=a4bcf954,"{'tag': 'unknown', '__CLASS__': 'Adzuna::API::Response::Category', 'label': 'Unknown'}","{'display_name': 'Dentsply Sirona', '__CLASS__': 'Adzuna::API::Response::Company'}",0,2025-09-11T02:53:14Z,"Requistion ID : 67844 Dentsply Sirona ist der weltweit gru00f6u00dfte Anbieter von Dentalprodukten- und technologien und unterstu00fctzt Zahnu00e4rzte und Zahntechniker dabei, eine bessere, schnellere und sicherere Versorgung in allen zahnmedizinischen Bereichen anzubieten. Wir sind stolz darauf, bevorzugter Partner fu00fcr Zahnarztpraxen, Kliniken, Dentallabore und autorisierte Vertriebshu00e4ndler weltweit zu sein. Der Hauptfirmensitz von Dentsply Sirona befindet sich in Charlotte, North Caro…",8.60289,eyJhbGciOiJIUzI1NiJ9.eyJpIjoiNTM5MzUzNDY2NSIsInMiOiJQc0VOd0FiZjhCRzQzNGFWTEZrV1pRIn0.wA43VAY6k7CO5gjLxE5hRX4sVohBfgIJicA9BpQLpcc,,,,
Senior Consultant Data Science - Fokus NLP (alle Geschlechter),Adzuna::API::Response::Job,"{'__CLASS__': 'Adzuna::API::Response::Location', 'area': ['Deutschland', 'Hessen', 'Frankfurt am Main', 'Fechenheim'], 'display_name': 'Fechenheim, Frankfurt am Main'}",50.12595,5056041373,https://www.adzuna.de/details/5056041373?utm_medium=api&utm_source=a4bcf954,"{'tag': 'consultancy-jobs', 'label': 'Beraterstellen', '__CLASS__': 'Adzuna::API::Response::Category'}","{'__CLASS__': 'Adzuna::API::Response::Company', 'display_name': 'statworx'}",0,2025-02-19T12:19:23Z,Über uns statworx ist ein führendes Beratungs- und Entwicklungsunternehmen für Daten und KI mit Sitz in Frankfurt am Main. Wir bieten strategische Beratung für mittelständische Unternehmen und globale Konzerne. Wir entwickeln innovative Daten- & KI-Lösungen für alle Unternehmensbereiche und Tätigkeitsfelder. Wir befähigen Menschen auf allen Kompetenzniveaus mit unseren Daten- & KI-Bildungsformaten. Kurz gesagt: Wir unterstützen Unternehmen bei allen Aspekten der digitalen Transformation – seit …,8.76072,eyJhbGciOiJIUzI1NiJ9.eyJzIjoiUHNFTndBYmY4Qkc0MzRhVkxGa1daUSIsImkiOiI1MDU2MDQxMzczIn0.m5xTXtx7JAcg_rdFVbG5ASKQCk4RZTjhzwBaJodx37I,full_time,,,
(Senior) MLOps Engineer (m/w/d) – Data Science,Adzuna::API::Response::Job,"{'display_name': 'Münster, Nordrhein-Westfalen', 'area': ['Deutschland', 'Nordrhein-Westfalen', 'Münster'], '__CLASS__': 'Adzuna::API::Response::Location'}",51.955292,5445461351,https://www.adzuna.de/details/5445461351?utm_medium=api&utm_source=a4bcf954,"{'__CLASS__': 'Adzuna::API::Response::Category', 'label': 'IT-Stellen', 'tag': 'it-jobs'}","{'display_name': 'flaschenpost', '__CLASS__': 'Adzuna::API::Response::Company'}",0,2025-10-13T14:18:09Z,"Spannend, aufstrebend und verdammt schnell – wir sind flaschenpost! Wir liefern den Wocheneinkauf innerhalb von 120 Minuten zu unseren Kund:innen. Gemeinsam mit über 20.000 Kolleg:innen schaffen wir es, eine komplette Branche neu zu erfinden. Seit unserer Gründung im Jahr 2016 sind wir mittlerweile als Sofortlieferdienst für Getränke und Lebensmittel in nahezu allen Metropolregionen Deutschlands vertreten. Seit 2020 ist die flaschenpost Teil der Oetker-Gruppe. Um unsere Mission zu erfüllen, suc…",7.621504,eyJhbGciOiJIUzI1NiJ9.eyJzIjoiUHNFTndBYmY4Qkc0MzRhVkxGa1daUSIsImkiOiI1NDQ1NDYxMzUxIn0.fmxQL71orrFzhJSS1P1KJ_ugQr8sEcYwFlT-myu3RwU,full_time,,,
Senior Softwareentwickler für Data Science und Datenmanagement (m/w/d),Adzuna::API::Response::Job,"{'display_name': 'Schmallenberg, Hochsauerlandkreis', 'area': ['Deutschland', 'Nordrhein-Westfalen', 'Hochsauerlandkreis', 'Schmallenberg'], '__CLASS__': 'Adzuna::API::Response::Location'}",51.14779,4852907200,https://www.adzuna.de/details/4852907200?utm_medium=api&utm_source=a4bcf954,"{'tag': 'it-jobs', '__CLASS__': 'Adzuna::API::Response::Category', 'label': 'IT-Stellen'}","{'display_name': 'Workwise GmbH', '__CLASS__': 'Adzuna::API::Response::Company'}",0,2024-09-05T12:53:18Z,"Über das Unternehmen Als international operierender Spezialist produziert wir leistungsstarke Präzisionsanlagen. Das bedeutet moderne bestehende und vielfach erprobte Standards zu nutzen, um mit Kunden gemeinsam ein tragendes als auch individuelles Gesamtkonzept zu entwickeln. Wir sind Partner von der ersten Idee, Konzeption, Planung, Projektierung und Abwicklung bis zur Endfertigung, Montage und einem umfangreichen After-Sales-Service. Was bieten wir Ihnen? Spannende Aufgaben im Bereich innova…",8.28561,eyJhbGciOiJIUzI1NiJ9.eyJpIjoiNDg1MjkwNzIwMCIsInMiOiJQc0VOd0FiZjhCRzQzNGFWTEZrV1pRIn0.l7pIRpNYdHq7n7erfCJoSZk_NZe7jRxcKeUJaTDDY5U,full_time,,,
Population and Social Data Science Summer Incubator Program,Adzuna::API::Response::Job,"{'__CLASS__': 'Adzuna::API::Response::Location', 'area': ['Deutschland', 'Mecklenburg-Vorpommern', 'Rostock'], 'display_name': 'Rostock, Mecklenburg-Vorpommern'}",54.132423,5509173581,https://www.adzuna.de/details/5509173581?utm_medium=api&utm_source=a4bcf954,"{'tag': 'social-work-jobs', '__CLASS__': 'Adzuna::API::Response::Category', 'label': 'Stellen aus Sozialarbeit'}","{'display_name': 'Max Planck Institute for Demographic Research', '__CLASS__': 'Adzuna::API::Response::Company'}",0,2025-11-22T17:52:55Z,"The Max Planck Institute for Demographic Research (MPIDR) is inviting applications from qualified and highly motivated students for a Summer Research Visit. The goal of the Population and Social Data Science Summer Incubator Program is to enable discovery by bringing together data scientists and population scientists to work on focused, intensive and collaborative projects of broad societal relevance. For a period of 3 months (June 8th August 21st, 2026) participating students will work in smal…",12.131588,eyJhbGciOiJIUzI1NiJ9.eyJzIjoiUHNFTndBYmY4Qkc0MzRhVkxGa1daUSIsImkiOiI1NTA5MTczNTgxIn0.pgeOQ1dyLltlkb8jkJY_CIeA_qXtqFB93MBrqyjZp2Q,,,,
Werkstudent/in (m/w/d) Data Science / Finance / Billing,Adzuna::API::Response::Job,"{'display_name': 'Düsseldorf, Nordrhein-Westfalen', 'area': ['Deutschland', 'Nordrhein-Westfalen', 'Düsseldorf'], '__CLASS__': 'Adzuna::API::Response::Location'}",51.226802,5537516888,https://www.adzuna.de/details/5537516888?utm_medium=api&utm_source=a4bcf954,"{'label': 'Unknown', '__CLASS__': 'Adzuna::API::Response::Category', 'tag': 'unknown'}","{'display_name': 'ecotel communication ag', '__CLASS__': 'Adzuna::API::Response::Company'}",0,2025-12-11T07:12:25Z,MIT DIR GEMEINSAM: DIE ZUKUNFT BEWEGEN! Du strebst eine Karriere im Bereich Data Science / Finance / Billing an? Dann bist du bei uns genau richtig! Was du bei uns als Werkstudent/in lernen kannst: Mitarbeit im Projekt E-Rechnung / Billing zur Erstellung von PDF-Rechnungen nach ZUGFeRD / Factur-X inklusive eingebettetem XML. Technische Implementierung neuer Funktionen sowie Weiterentwicklung bestehender Komponenten in Python mit SQL auf Oracle und MariaDB / MySQL. Unterstützung bei der Verarbei…,6.808387,eyJhbGciOiJIUzI1NiJ9.eyJpIjoiNTUzNzUxNjg4OCIsInMiOiJQc0VOd0FiZjhCRzQzNGFWTEZrV1pRIn0.Ec7kEu4JXeUJPvUghnxtT9J-gK7qOU_-tVSEyZCoeYs,part_time,,,
