longitude,salary_is_predicted,location,company,title,id,latitude,adref,description,redirect_url,__CLASS__,created,category,contract_time,contract_type,salary_min,salary_max
9.2274,0,"{'display_name': 'Neckarsulm, Heilbronn (Kreis)', '__CLASS__': 'Adzuna::API::Response::Location', 'area': ['Deutschland', 'Baden-Württemberg', 'Heilbronn (Kreis)', 'Neckarsulm']}","{'__CLASS__': 'Adzuna::API::Response::Company', 'display_name': 'Lidl Stiftung & Co. KG'}",Duales Studium Wirtschaftsinformatik - Data Science 2026,5485957394,49.18975,eyJhbGciOiJIUzI1NiJ9.eyJpIjoiNTQ4NTk1NzM5NCIsInMiOiJiR0Q0Rm9iTzhCR3c4WktjV3ZCY0V3In0.wdtCYdf-xWYbGatGALqDKFjA_IZQ4JRuebIj34w4mjg,"Eine gute Idee war der Ursprung, ein erfolgreiches Konzept ist das Ergebnis. Qualität zum guten Preis möglichst vielen Menschen anbieten zu können treibt uns an - mittlerweile weltweit, denn wir sind Lidl. Hier ist das berufliche Zuhause vielfältiger Talente. Ob im Einkauf, in der Logistik, im Warengeschäft oder in der IT; ob als Impulsgeber, Gestalter oder Dienstleister der Länder. Wir suchen Anpacker, Durchstarter, Möglichmacher und bieten spannende Aufgaben und Projekte in einem dynamischen …",https://www.adzuna.de/land/ad/5485957394?se=bGD4FobO8BGw8ZKcWvBcEw&utm_medium=api&utm_source=a4bcf954&v=DD70E69F2197B19F1B6DCB78738B72DA0A6C6F1D,Adzuna::API::Response::Job,2025-11-07T19:45:24Z,"{'tag': 'unknown', '__CLASS__': 'Adzuna::API::Response::Category', 'label': 'Unknown'}",,,,
9.187224,0,"{'display_name': 'Stuttgart, Baden-Württemberg', '__CLASS__': 'Adzuna::API::Response::Location', 'area': ['Deutschland', 'Baden-Württemberg', 'Stuttgart']}","{'__CLASS__': 'Adzuna::API::Response::Company', 'display_name': 'WGV - Württembergische Gemeinde-Versicherung a.G.'}",DHBW-Studium Bachelor of Science – Wirtschaftsinformatik – Data Science,5512400170,48.776198,eyJhbGciOiJIUzI1NiJ9.eyJzIjoiYkdENEZvYk84Qkd3OFpLY1d2QmNFdyIsImkiOiI1NTEyNDAwMTcwIn0.zXB1-85u-PukAifCSVpYxus_COTei1_RfRMzLFQ1-3U,"WHAT DO YOU DO FOR A LIVING? Als starker Arbeitgeber und attrak­tives Aus­bildungs­unter­nehmen bieten wir dir im Herzen Stuttgarts viel­fältige und spannende Aus­bildungs- und Studien­plätze mit besten Über­nahme­chancen. Für den Studienstart am 1. September 2026 suchen wir am Standort Stuttgart aufge­schlossene und moti­vierte Studierende. DHBW-Studium Bachelor of Science – Wirt­schafts­informatik – Data Science Aufgaben Drei Jahre bei der WGV studieren, dann hast du es geschafft und kannst d…",https://www.adzuna.de/land/ad/5512400170?se=bGD4FobO8BGw8ZKcWvBcEw&utm_medium=api&utm_source=a4bcf954&v=E61D8E90A96E71B0FFD0F9530BFF8E45053B0E10,Adzuna::API::Response::Job,2025-11-25T12:57:53Z,"{'tag': 'it-jobs', '__CLASS__': 'Adzuna::API::Response::Category', 'label': 'IT-Stellen'}",,,,
8.412378,0,"{'display_name': 'Karlsruhe, Karlsruhe (Kreis)', 'area': ['Deutschland', 'Baden-Württemberg', 'Karlsruhe (Kreis)', 'Karlsruhe'], '__CLASS__': 'Adzuna::API::Response::Location'}","{'display_name': 'Atruvia AG', '__CLASS__': 'Adzuna::API::Response::Company'}",Duales Studium Data Science & Künstliche Intelligenz B.Sc.,5512404916,49.001249,eyJhbGciOiJIUzI1NiJ9.eyJzIjoiYkdENEZvYk84Qkd3OFpLY1d2QmNFdyIsImkiOiI1NTEyNDA0OTE2In0.eGF42XOXZfbXYVpMIZSlURopSDTzew-f0-MMNBzy76k,Wir sind der Digitalisierungspartner in der genossenschaftlichen FinanzGruppe und vereinen jahrzehntelanges Expertenwissen in Banking und Informationstechnologie. Die speziell auf Banken zugeschnittenen IT-Lösungen und Leistungen reichen vom Rechenzentrumsbetrieb über das Bankverfahren von Atruvia bis hin zur App-Entwicklung. Dabei nutzen wir zukunftsweisende Technologien wie Smart Data und schreiben Prozessoptimierung und Regulatorik groß. Gestalte die Zukunft mit KI – Starte dein Duales Studi…,https://www.adzuna.de/land/ad/5512404916?se=bGD4FobO8BGw8ZKcWvBcEw&utm_medium=api&utm_source=a4bcf954&v=7E1A165FFAEEF7B4F64733A0A82B6A3121733053,Adzuna::API::Response::Job,2025-11-25T12:58:32Z,"{'tag': 'unknown', '__CLASS__': 'Adzuna::API::Response::Category', 'label': 'Unknown'}",,,,
11.083642,0,"{'display_name': 'Nürnberg, Bayern', '__CLASS__': 'Adzuna::API::Response::Location', 'area': ['Deutschland', 'Bayern', 'Nürnberg']}","{'__CLASS__': 'Adzuna::API::Response::Company', 'display_name': 'Datev eG'}",Werkstudent Data Science & Machine Learning (m/w/d),5500312617,49.443967,eyJhbGciOiJIUzI1NiJ9.eyJpIjoiNTUwMDMxMjYxNyIsInMiOiJiR0Q0Rm9iTzhCR3c4WktjV3ZCY0V3In0.QJfJdJjaxCGvk4_M-2TXHyXMuXhg5EaWgO9E6JTFCJ0,"Das ist das Arbeitsumfeld: Das AI Office setzt als strategische Governance-Einheit den Rahmen, um Mehrwerte für unsere Kund:innen durch den Einsatz von Künstlicher Intelligenz (KI)/Machine Learning (ML) zu schaffen. Als Werkstudent (m/w/d) Data Science im AI Office begleitest und unterstützt Du die Mitarbeitenden bei der Beratung und Unterstützung von Workstreams in diesem Kontext, beispielsweise bei der Evaluierung und/oder Umsetzung konkreter Use Cases. Das sind die Aufgaben: Du setzt KI-Idee…",https://www.adzuna.de/land/ad/5500312617?se=bGD4FobO8BGw8ZKcWvBcEw&utm_medium=api&utm_source=a4bcf954&v=60AF68BE5A5A1A528D428332FB5A010940AF9759,Adzuna::API::Response::Job,2025-11-17T14:42:01Z,"{'label': 'IT-Stellen', '__CLASS__': 'Adzuna::API::Response::Category', 'tag': 'it-jobs'}",full_time,,,
9.198334,0,"{'area': ['Deutschland', 'Baden-Württemberg', 'Ludwigsburg (Kreis)', 'Ludwigsburg'], '__CLASS__': 'Adzuna::API::Response::Location', 'display_name': 'Ludwigsburg, Ludwigsburg (Kreis)'}","{'display_name': 'Wolters Kluwer Tax & Accounting Deutschland GmbH', '__CLASS__': 'Adzuna::API::Response::Company'}",Duales Studium Bachelor der Wirtschaftsinformatik - Data Science (m/w/d),5492611596,48.876425,eyJhbGciOiJIUzI1NiJ9.eyJpIjoiNTQ5MjYxMTU5NiIsInMiOiJiR0Q0Rm9iTzhCR3c4WktjV3ZCY0V3In0.72mWUtKKBn5XDCFRnYSnRDtc7ojQFH5Wa6eE5UtTR1I,"Gestalten Sie mit uns heute schon die Zukunft! Seit über 180 Jahren steht Wolters Kluwer dafür, Arbeitsprozesse mit innovativen Lösungen zu unterstützen und zu erleichtern. Unsere Niederlassungen in mehr als 40 Ländern betreuen Kunden in über 180 Ländern. Im Jahr 2023 verzeichneten wir einen Jahresumsatz von 5,6 Milliarden Euro. Unsere Expertenlösungen vereinen fundiertes Fachwissen mit Technologie, damit unsere Kunden die wichtigsten Herausforderungen meistern können. Für die Umsetzung unserer…",https://www.adzuna.de/land/ad/5492611596?se=bGD4FobO8BGw8ZKcWvBcEw&utm_medium=api&utm_source=a4bcf954&v=CDB07FB77F0879684103641B6B6DA051BE7A9379,Adzuna::API::Response::Job,2025-11-12T19:57:46Z,"{'label': 'Unknown', '__CLASS__': 'Adzuna::API::Response::Category', 'tag': 'unknown'}",,,,
9.12661,0,"{'__CLASS__': 'Adzuna::API::Response::Location', 'area': ['Deutschland', 'Baden-Württemberg', 'Heilbronn (Kreis)', 'Leingarten'], 'display_name': 'Leingarten, Heilbronn (Kreis)'}","{'__CLASS__': 'Adzuna::API::Response::Company', 'display_name': 'thyssenkrupp Automotive Body Solutions GmbH'}",Duales Studium - Data Science/KI (m/w/d) 2026,5515527402,49.14383,eyJhbGciOiJIUzI1NiJ9.eyJpIjoiNTUxNTUyNzQwMiIsInMiOiJiR0Q0Rm9iTzhCR3c4WktjV3ZCY0V3In0.g-DQWIAH8L_pS-0Iuk3jDnnqqnLywUta9Dju4fTgyZo,"thyssenkrupp ist ein international aufgestellter Industrie- und Technologiekonzern mit rund 98.000 Beschäftigten. In 47 Ländern erwirtschaftete das Unternehmen im Geschäftsjahr 2023/2024 einen Umsatz von 35 Mrd €. Die Geschäftsaktivitäten sind in fünf Segmenten gebündelt: Automotive Technology, Decarbon Technologies, Materials Services, Steel Europe und Marine Systems. Mit umfassendem Technologie-Know-how entwickeln die Geschäfte innovative Lösungen für die Herausforderungen der Zukunft, vor al…",https://www.adzuna.de/land/ad/5515527402?se=bGD4FobO8BGw8ZKcWvBcEw&utm_medium=api&utm_source=a4bcf954&v=AF4EEDFF1531EE5375224377A65A0F336EB7AC5C,Adzuna::API::Response::Job,2025-11-27T00:39:03Z,"{'label': 'Unknown', '__CLASS__': 'Adzuna::API::Response::Category', 'tag': 'unknown'}",,,,
11.59129,0,"{'__CLASS__': 'Adzuna::API::Response::Location', 'area': ['Deutschland', 'Bayern', 'München (Kreis)', 'München', 'Au-Haidhausen'], 'display_name': 'Au-Haidhausen, München'}","{'__CLASS__': 'Adzuna::API::Response::Company', 'display_name': 'SPARKS University of Applied Sciences'}",Professur für Data Science,5515911716,48.13258,eyJhbGciOiJIUzI1NiJ9.eyJzIjoiYkdENEZvYk84Qkd3OFpLY1d2QmNFdyIsImkiOiI1NTE1OTExNzE2In0.bg7IYLEqc0_4_s9lFIN7slk0ZTO3tZjuI3Kr8oPh2bw,"Zum Wintersemester 2026/27 besetzen wir in Vollzeit oder Teilzeit (mind. 50% Stellenumfang) eine: Professur für Data Science Unsere Professor:innen sind so neugierig wie unsere Studierenden und lernen mit ihnen - nach einem akademischen Konzept, das kollaborativ und kreativ ist. Sie zünden SPARKS, die aus unseren Studierenden breit gebildete Fachkräfte für Marketing­kom­muni­ka­tion machen - und Expert:innen für ein Leben in Zeiten tiefgreifender Veränderungen. Ihr Profil Sie haben ein Hochschu…",https://www.adzuna.de/land/ad/5515911716?se=bGD4FobO8BGw8ZKcWvBcEw&utm_medium=api&utm_source=a4bcf954&v=73617BD5EFD6997AC0B4468EB6312F9B720BE069,Adzuna::API::Response::Job,2025-11-27T09:34:49Z,"{'tag': 'teaching-jobs', '__CLASS__': 'Adzuna::API::Response::Category', 'label': 'Lehrberufe'}",,,,
8.543293,0,"{'display_name': 'Bielefeld, Nordrhein-Westfalen', 'area': ['Deutschland', 'Nordrhein-Westfalen', 'Bielefeld'], '__CLASS__': 'Adzuna::API::Response::Location'}","{'display_name': 'Hochschule Bielefeld', '__CLASS__': 'Adzuna::API::Response::Company'}","W2-Vertretungsprofessur Allgemeine Betriebswirtschaftslehre, insb. Personalmanagement, HR Data Science und KI",5476055617,52.021203,eyJhbGciOiJIUzI1NiJ9.eyJpIjoiNTQ3NjA1NTYxNyIsInMiOiJiR0Q0Rm9iTzhCR3c4WktjV3ZCY0V3In0.Y146xvjdIKJjIfLOzOFrX5yb4dfffAUCprQDXUsJ7Fc,"Die Hochschule Bielefeld (HSBI) mit ihren über 10.000 Studierenden steht für höchste Standards in Lehre, Forschung und Wissenstransfer. Die Fachbereiche Gestaltung, Campus Minden, Ingenieurwissenschaften und Mathematik, Sozialwesen, Wirtschaft und Gesundheit arbeiten interdisziplinär, forschungsbasiert und eng vernetzt. Regionale und internationale Kooperationen sowie gelebte Vielfalt und Nachhaltigkeit prägen die Arbeit an den Standorten Bielefeld, Minden und Gütersloh. Der Fachbereich Wirtsch…",https://www.adzuna.de/land/ad/5476055617?se=bGD4FobO8BGw8ZKcWvBcEw&utm_medium=api&utm_source=a4bcf954&v=CB8C632A79EC598D3A5BD65D849E671BD4459150,Adzuna::API::Response::Job,2025-11-01T21:45:46Z,"{'label': 'Unknown', '__CLASS__': 'Adzuna::API::Response::Category', 'tag': 'unknown'}",,,,
,0,"{'display_name': 'Deutschland', '__CLASS__': 'Adzuna::API::Response::Location', 'area': ['Deutschland']}","{'__CLASS__': 'Adzuna::API::Response::Company', 'display_name': 'Leuze electronic GmbH + Co. KG'}",Duales Bachelor Studium: Wirtschaftsinformatik – Data Science (September 2026 – DHBW Stuttgart),5488728229,,eyJhbGciOiJIUzI1NiJ9.eyJzIjoiYkdENEZvYk84Qkd3OFpLY1d2QmNFdyIsImkiOiI1NDg4NzI4MjI5In0.ojVgqogo1h0A0LIL7RCuiPAkKympVSuk3Xmv_ssaWmA,"Duales Bachelor Studium: Wirtschafts­informatik – Data Science (September 2026 – DHBW Stuttgart) Bereich: Ausbildung / Duales Studium Standort: Owen bei Kirchheim / Teck Beschäftigungsart: Duales Studium Über 60 Jahre Erfahrung haben Leuze zum Experten für innovative und effiziente Sensor- und Sicherheits­lösungen in der Automatisierungs­technik gemacht. Heute sorgen wir – rund 1.600 Sensor People weltweit – mit Neugier, Leiden­schaft und Entschlossen­heit für Fort­schritt und Wandel. Unser Ant…",https://www.adzuna.de/land/ad/5488728229?se=bGD4FobO8BGw8ZKcWvBcEw&utm_medium=api&utm_source=a4bcf954&v=2BB391FE4079E831655247415A62B29D1E2C4027,Adzuna::API::Response::Job,2025-11-09T19:59:54Z,"{'label': 'Unknown', '__CLASS__': 'Adzuna::API::Response::Category', 'tag': 'unknown'}",,,,
,0,"{'area': ['Deutschland'], '__CLASS__': 'Adzuna::API::Response::Location', 'display_name': 'Deutschland'}","{'display_name': 'Swarco AG', '__CLASS__': 'Adzuna::API::Response::Company'}",Schulabsolvent als Dualer Student Künstliche Intelligenz & Data Science (m/w/d),5492336776,,eyJhbGciOiJIUzI1NiJ9.eyJzIjoiYkdENEZvYk84Qkd3OFpLY1d2QmNFdyIsImkiOiI1NDkyMzM2Nzc2In0.0MpJLsHMCmtaGHl00riL7p0rhX-wZyLEuhY-mhYhK7c,"Aufgaben Das primäre Ziel ist die Ausbildung von Informatik-Allroundern (m/w/d) für eine Tätigkeit in der Berufspraxis Die Pflichtfächer decken ein breites fachliches Spektrum ab, eine große Zahl an Modulen mit Wahlmöglichkeit erlaubt die individuelle Vertiefung Während der Praxisphasen erhältst du von uns Projekte und/oder Problemstellungen, die du selbstständig behandelst und natürlich mit Unterstützung löst Das Studium verbindet ein wissenschaftliches Hochschulstudium mit unternehmerischer P…",https://www.adzuna.de/land/ad/5492336776?se=bGD4FobO8BGw8ZKcWvBcEw&utm_medium=api&utm_source=a4bcf954&v=2943AE67898FDE42079E37CFC5F7E390C951177C,Adzuna::API::Response::Job,2025-11-12T15:13:27Z,"{'label': 'IT-Stellen', '__CLASS__': 'Adzuna::API::Response::Category', 'tag': 'it-jobs'}",full_time,,,
7.816286,0,"{'__CLASS__': 'Adzuna::API::Response::Location', 'area': ['Deutschland', 'Baden-Württemberg', 'Freiburg im Breisgau'], 'display_name': 'Freiburg im Breisgau, Baden-Württemberg'}","{'__CLASS__': 'Adzuna::API::Response::Company', 'display_name': 'Haufe Group SE'}",Duales Studium 2026 - Data Science und KI B.Sc. (d/m/w),5466725194,47.999458,eyJhbGciOiJIUzI1NiJ9.eyJpIjoiNTQ2NjcyNTE5NCIsInMiOiJiR0Q0Rm9iTzhCR3c4WktjV3ZCY0V3In0.L8zVWdi21F2NQCghghKOoAV81gQL2E1OBbXpQh1WMn0,"Freiburg im Breisgau ab sofort Wir bilden aus und suchen begeisterte Daten-Enthusiast:innen! KI, Data Engineering, Cloud Computing oder Big Data sollen nicht länger nur theoretische Begriffe sein? Dann ist unser duales Studium mit dem Schwerpunkt Data Science und Künstliche Intelligenz die perfekte Gelegenheit, um deine Fähigkeiten zu entwickeln und in die vielschichtige Welt der Daten einzutauchen. Setze jetzt den Startschuss für deine Karriere ab September 2026 im Studiengang Data Science und…",https://www.adzuna.de/land/ad/5466725194?se=bGD4FobO8BGw8ZKcWvBcEw&utm_medium=api&utm_source=a4bcf954&v=2E265F75D4E76BB298528A5390B9ADF9BE5E0796,Adzuna::API::Response::Job,2025-10-27T21:42:06Z,"{'__CLASS__': 'Adzuna::API::Response::Category', 'tag': 'it-jobs', 'label': 'IT-Stellen'}",full_time,,,
9.96608,0,"{'area': ['Deutschland', 'Niedersachsen', 'Göttingen (Kreis)', 'Göttingen', 'Deppoldshausen'], '__CLASS__': 'Adzuna::API::Response::Location', 'display_name': 'Deppoldshausen, Göttingen'}","{'display_name': 'Deutsches Primatenzentrum GmbH - Leibniz-Institut für Primatenforschung ', '__CLASS__': 'Adzuna::API::Response::Company'}",PhD Candidates in Data Science (m/f/div),5482537336,51.5842,eyJhbGciOiJIUzI1NiJ9.eyJpIjoiNTQ4MjUzNzMzNiIsInMiOiJiR0Q0Rm9iTzhCR3c4WktjV3ZCY0V3In0.XuexgTiqAQ6Ihb3ur2zxfR_AskHBOVLPr6TXp2Fhb2c,"The DPZ's Primate Data Science (PRIDAS) platform seeks to fill several positions for PhD Candidates in Data Science (m/f/div) The central task of the PRIDAS is developing and providing data science support services, processing and analysis methods, as well as management of highly complex multimodal data. Our research with primates involves a combination of neurophysiological, hormonal, pharmacological and genetic data with the recording of gaze direction, motor skills, as well as decision-makin…",https://www.adzuna.de/land/ad/5482537336?se=bGD4FobO8BGw8ZKcWvBcEw&utm_medium=api&utm_source=a4bcf954&v=6294206879D7405F4683BF9727CB61D662DC11C3,Adzuna::API::Response::Job,2025-11-05T19:20:56Z,"{'__CLASS__': 'Adzuna::API::Response::Category', 'tag': 'teaching-jobs', 'label': 'Lehrberufe'}",,,,
11.083642,0,"{'display_name': 'Nürnberg, Bayern', 'area': ['Deutschland', 'Bayern', 'Nürnberg'], '__CLASS__': 'Adzuna::API::Response::Location'}","{'display_name': 'Datev eG', '__CLASS__': 'Adzuna::API::Response::Company'}","Duales Studium Bachelor of Science in Data Science und Künstlicher Intelligenz (m/w/d), ab 09/2026",5331000753,49.443967,eyJhbGciOiJIUzI1NiJ9.eyJzIjoiYkdENEZvYk84Qkd3OFpLY1d2QmNFdyIsImkiOiI1MzMxMDAwNzUzIn0.7C5yA5qehxqRhpKJYjM68k3J2kfbX-3wrcttIsG8B4w,"Das ist das Arbeitsumfeld: Bei DATEV arbeitest du nicht nur in einem Team, sondern bist von Anfang an Teil einer Gemeinschaft, die rund 200 Auszubildende und dual Studierende umfasst. Du bist in verschiedene Aufgaben eingebunden, die sowohl herausfordernd als auch abwechslungsreich sind. Gemeinsam sorgen wir für exzellente Kundenberatung und langfristige Geschäftsbeziehungen. Du arbeitest in einem dynamischen und innovativen Umfeld, das neuen Ideen und Weiterentwicklungen stets offen gegenübers…",https://www.adzuna.de/land/ad/5331000753?se=bGD4FobO8BGw8ZKcWvBcEw&utm_medium=api&utm_source=a4bcf954&v=D06BB784CDCAB65AF1288C4E55C766AC1F1D24B5,Adzuna::API::Response::Job,2025-08-01T03:06:44Z,"{'__CLASS__': 'Adzuna::API::Response::Category', 'tag': 'it-jobs', 'label': 'IT-Stellen'}",full_time,,,
7.112412,0,"{'area': ['Deutschland', 'Nordrhein-Westfalen', 'Bonn'], '__CLASS__': 'Adzuna::API::Response::Location', 'display_name': 'Bonn, Nordrhein-Westfalen'}","{'display_name': 'karriere tutor GmbH ', '__CLASS__': 'Adzuna::API::Response::Company'}",Dozent (w/m/d) für Data Science in Bonn,5505800270,50.71942,eyJhbGciOiJIUzI1NiJ9.eyJzIjoiYkdENEZvYk84Qkd3OFpLY1d2QmNFdyIsImkiOiI1NTA1ODAwMjcwIn0.uDopBoW0RGUwOu5JyEP9kBzOxmOFfZn7TrrrjKErrKw,"Abgeschlossenes Studium im Bereich Informatik, Wirtschaftsinformatik, Statistik, Mathematik, BWL oder eine vergleichbare Qualifikation. Praxiserfahrung in der Daten- und Prozessanalyse mit Methoden- und Frameworkkenntnissen. Interesse an Datenbanken, Datenanalyse und Prozessmodellierung sowie die Fähigkeit, sich schnell in neue Trends einzuarbeiten. Didaktisches Gespür, Freude am Lehren und ausgeprägte kommunikative Stärke. Verhandlungssichere Deutschkenntnisse in Wort und Schrift. Bildung von …",https://www.adzuna.de/land/ad/5505800270?se=bGD4FobO8BGw8ZKcWvBcEw&utm_medium=api&utm_source=a4bcf954&v=37401089AC2976D07F0F9E42F0ECF7232136CF41,Adzuna::API::Response::Job,2025-11-20T19:56:06Z,"{'label': 'Unknown', '__CLASS__': 'Adzuna::API::Response::Category', 'tag': 'unknown'}",,,,
11.589469,0,"{'display_name': 'Jena, Thüringen', 'area': ['Deutschland', 'Thüringen', 'Jena'], '__CLASS__': 'Adzuna::API::Response::Location'}","{'display_name': 'ZEISS', '__CLASS__': 'Adzuna::API::Response::Company'}","Duales Studium – Data Science und Künstliche Intelligenz (m/w/x), Beginn Herbst 2026",5502985988,50.923007,eyJhbGciOiJIUzI1NiJ9.eyJzIjoiYkdENEZvYk84Qkd3OFpLY1d2QmNFdyIsImkiOiI1NTAyOTg1OTg4In0._IVxgT-OALa8hv_0VwaQh_IPoEoaZEXz5GU4LMe2eAg,"Sich etwas Neues trauen, über sich hinauswachsen und dabei die Grenzen des Machbaren neu definieren. Genau das ist es, was unsere Mitarbeitenden täglich leben dürfen und sollen. Um mit unseren Innovationen ein Zeichen zu setzen und Großartiges zu ermöglichen. Denn hinter jedem erfolgreichen Unternehmen stehen eine ganze Menge faszinierende Menschen. In einem offenen und modernen Umfeld mit zahlreichen Entwicklungs- und Weiterbildungsmöglichkeiten, arbeiten die Mitarbeitenden bei ZEISS in einer …",https://www.adzuna.de/land/ad/5502985988?se=bGD4FobO8BGw8ZKcWvBcEw&utm_medium=api&utm_source=a4bcf954&v=47909A93C6829C5138BF76BA2BE6A4A944338327,Adzuna::API::Response::Job,2025-11-19T09:24:42Z,"{'__CLASS__': 'Adzuna::API::Response::Category', 'tag': 'unknown', 'label': 'Unknown'}",,,,
,0,"{'display_name': 'Deutschland', '__CLASS__': 'Adzuna::API::Response::Location', 'area': ['Deutschland']}","{'__CLASS__': 'Adzuna::API::Response::Company', 'display_name': 'Rutronik Elektronische Bauelemente GmbH'}",Duales Studium Data Science & KI - 2026,5470836954,,eyJhbGciOiJIUzI1NiJ9.eyJpIjoiNTQ3MDgzNjk1NCIsInMiOiJiR0Q0Rm9iTzhCR3c4WktjV3ZCY0V3In0.NMpYAruhcJLs97MqoQYs2OZmRz2Cs4T1lv-iTD-HE0A,"Entdecke die Welt der elektronischen Bauelemente! Starte als Teamplayer bei Rutronik! Die Welt der Elektronik ist unser Zuhause. Als eines der weltweit führenden Unternehmen für den Vertrieb elektronischer Bauteile mit mehr als 1.900 Mitarbeitern an über 82 Standorten rund um den Globus suchen wir laufend Verstärkung. Entdecke jetzt die Perspektiven und Chancen, die dir dein Job bei Rutronik bietet und werde Teil unseres Erfolges! Duales Studium Data Science & KI - 2026 Bachelor of Science | DH…",https://www.adzuna.de/land/ad/5470836954?se=bGD4FobO8BGw8ZKcWvBcEw&utm_medium=api&utm_source=a4bcf954&v=E70652E6B5948754343F2422B9EC6385EC0A4CF3,Adzuna::API::Response::Job,2025-10-30T11:48:56Z,"{'__CLASS__': 'Adzuna::API::Response::Category', 'tag': 'unknown', 'label': 'Unknown'}",,,,
,0,"{'area': ['Deutschland'], '__CLASS__': 'Adzuna::API::Response::Location', 'display_name': 'Deutschland'}","{'display_name': ""Ernsting's family"", '__CLASS__': 'Adzuna::API::Response::Company'}",Senior Data Scientist mit Schwerpunkt E-Commerce (m/w/d),5519056647,,eyJhbGciOiJIUzI1NiJ9.eyJzIjoiYkdENEZvYk84Qkd3OFpLY1d2QmNFdyIsImkiOiI1NTE5MDU2NjQ3In0.eZxX_Z-TRE7RRRYX1a4lvP_4ChAhpVd1N2-SU_WPCzI,"Wusstest Du eigentlich schon, dass … wir als nachhaltig agierendes Familienunternehmen mit rund 2.000 Filialen in Deutschland, Österreich und den Niederlanden und einem mehrfach ausgezeichneten Online Shop einer der größten Omnichannel-Anbieter im europäischen Textileinzelhandel sind? Unsere Kundschaft freut sich über ein attraktives Preis-Leistungs-Angebot in den Bereichen Bekleidung und Home-&-Living-Sortimente für die ganze Familie. Dieser Familiengedanke findet sich auch in unserem tägliche…",https://www.adzuna.de/land/ad/5519056647?se=bGD4FobO8BGw8ZKcWvBcEw&utm_medium=api&utm_source=a4bcf954&v=21A1543B96EBD63E6F4D979C672582830758F090,Adzuna::API::Response::Job,2025-11-29T12:57:36Z,"{'label': 'Unknown', '__CLASS__': 'Adzuna::API::Response::Category', 'tag': 'unknown'}",,,,
8.89081,0,"{'area': ['Deutschland', 'Baden-Württemberg', 'Böblingen (Kreis)', 'Nufringen'], '__CLASS__': 'Adzuna::API::Response::Location', 'display_name': 'Nufringen, Böblingen (Kreis)'}","{'__CLASS__': 'Adzuna::API::Response::Company', 'display_name': 'Ensinger GmbH'}",Wirtschaftsinformatik - Data Science / Bachelor of Science (DH),5501662011,48.62307,eyJhbGciOiJIUzI1NiJ9.eyJzIjoiYkdENEZvYk84Qkd3OFpLY1d2QmNFdyIsImkiOiI1NTAxNjYyMDExIn0.XmSyt6b82zpO0c2lYm6gdjb9G9VoML-kMtXCHBhiu5g,Bezeichnung: Wirtschaftsinformatik - Data Science / Bachelor of Science (DH) Eintrittsdatum: 01.10.2026 mit Vorpraktikum ab 01.09.2026 Standort: 71154 Nufringen bei Stuttgart Arbeitszeit: Vollzeit Ausbildungsinhalte: Grundlagen der Informationstechnik Methoden der Informatik Moderne IT-Technologien für die Entwicklung von Software-Systemen kennenlernen und anwenden Anwendung von Künstlicher Intelligenz und Big Data in wirtschaftinformatorischen Kontexten Methoden und Konzepte der Betriebswirtsc…,https://www.adzuna.de/land/ad/5501662011?se=bGD4FobO8BGw8ZKcWvBcEw&utm_medium=api&utm_source=a4bcf954&v=4C96CFAC4A4F7D2EACDCBD04EC98B59646A755AD,Adzuna::API::Response::Job,2025-11-18T12:41:01Z,"{'__CLASS__': 'Adzuna::API::Response::Category', 'tag': 'unknown', 'label': 'Unknown'}",,,,
8.67825,0,"{'__CLASS__': 'Adzuna::API::Response::Location', 'area': ['Deutschland', 'Hessen', 'Gießen (Kreis)', 'Gießen', 'Wieseck'], 'display_name': 'Wieseck, Gießen'}","{'display_name': 'Justus-Liebig-Universität Gießen', '__CLASS__': 'Adzuna::API::Response::Company'}",Wissenschaftliche/r Mitarbeiter/in (m/w/d) mit Forschungsschwerpunkt Data Science & Social Media Analysis,5496116486,50.58401,eyJhbGciOiJIUzI1NiJ9.eyJpIjoiNTQ5NjExNjQ4NiIsInMiOiJiR0Q0Rm9iTzhCR3c4WktjV3ZCY0V3In0.bgEGDB1hVQZUlJjihgeAHJv4yTNVVVrRDU-qL-0LrRg,"Unterstützen Sie uns zum nächstmöglichen Zeitpunkt in Teilzeit (70 %) als Wissenschaftliche/r Mitarbeiter/in (m/w/d) mit Forschungsschwerpunkt Data Science & Social Media Analysis Die Stelle ist in dem drittmittelfinanzierten Projekt: »Community-Based Fact-Checking on Social Media« befristet für zwei Jahre an der Professur für Betriebswirtschaftslehre, insbesondere Data Science und Digitalisierung am Fachbereich Wirtschaftswissenschaften zu besetzen. Bei Vorliegen der tariflichen Voraussetzunge…",https://www.adzuna.de/land/ad/5496116486?se=bGD4FobO8BGw8ZKcWvBcEw&utm_medium=api&utm_source=a4bcf954&v=86E233936EAA020AC7C8A4F9F5B852DEE926D4A6,Adzuna::API::Response::Job,2025-11-14T15:35:32Z,"{'label': 'Lehrberufe', '__CLASS__': 'Adzuna::API::Response::Category', 'tag': 'teaching-jobs'}",,,,
8.235274,0,"{'area': ['Deutschland', 'Baden-Württemberg', 'Baden-Baden'], '__CLASS__': 'Adzuna::API::Response::Location', 'display_name': 'Baden-Baden, Baden-Württemberg'}","{'__CLASS__': 'Adzuna::API::Response::Company', 'display_name': 'Mercedes-Benz Tech Innovation'}",Duales Studium Data Science / Künstliche Intelligenz in Kooperation mit der Dualen Hochschule Baden-Württemberg 2026 (m/w/d),5467591475,48.754667,eyJhbGciOiJIUzI1NiJ9.eyJpIjoiNTQ2NzU5MTQ3NSIsInMiOiJiR0Q0Rm9iTzhCR3c4WktjV3ZCY0V3In0.MeVKaWBPdBrmhfkuXe4h-6ptm5JWYwTzwOEIdC9V9bY,"Life is always about becoming… Im Leben geht es darum, sich auf eine Reise zu begeben, um die beste Version unseres zukünftigen Selbst zu werden. Während wir Neues entdecken, stellen wir uns Herausforderungen, meistern sie und wachsen über uns hinaus. Bewerben Sie sich bei Mercedes-Benz und finden Sie den Aufgabenbereich, in dem Sie Ihre Talente individuell entfalten können. Dabei werden Sie von visionären Kolleginnen und Kollegen unterstützt, die Ihren Pioniergeist teilen. Bei uns einzusteigen…",https://www.adzuna.de/land/ad/5467591475?se=bGD4FobO8BGw8ZKcWvBcEw&utm_medium=api&utm_source=a4bcf954&v=AB797B9F660A55C551EA09BBEB6270DEF68425BB,Adzuna::API::Response::Job,2025-10-28T09:43:36Z,"{'__CLASS__': 'Adzuna::API::Response::Category', 'tag': 'unknown', 'label': 'Unknown'}",,,,
