longitude,created,company,location,description,category,salary_is_predicted,__CLASS__,title,latitude,redirect_url,adref,id,contract_time,salary_min,contract_type,salary_max
13.420806,2025-11-18T18:30:25Z,"{'display_name': 'Simon-Kucher & Partners', '__CLASS__': 'Adzuna::API::Response::Company'}","{'area': ['Deutschland', 'Berlin'], 'display_name': 'Berlin, Deutschland', '__CLASS__': 'Adzuna::API::Response::Location'}","Senior Consultant Data Science (m/w/d) In Deutschland - Berlin| Bonn | Frankfurt/Main | Hamburg | Köln | München Du bistbereit, deine persönliche Entwicklung in den Bereichen Data Science, Analyticsund KI zu fördern? Unser Data Science Team hilft Unternehmen, fundierteEntscheidungen zu treffen und ihr Wachstum voranzutreiben, indem wir Rohdatenin umsetzbare Erkenntnisse verwandeln. WerdePionier der digitalen Transformation und unterstütze uns als (Senior)Consultant – Data Science. Mehr von uns …","{'label': 'Unknown', '__CLASS__': 'Adzuna::API::Response::Category', 'tag': 'unknown'}",0,Adzuna::API::Response::Job,Senior Consultant Data Science (m/w/d),52.507706,https://www.adzuna.de/details/5502168916?utm_medium=api&utm_source=a4bcf954,eyJhbGciOiJIUzI1NiJ9.eyJpIjoiNTUwMjE2ODkxNiIsInMiOiI0aE03ZkFYSjhCR3dCNUZSX1lQRVpBIn0.KMuQaXwFK8irjcpx2jbH6Avvoqcf6ZnpbM0JisSSciE,5502168916,,,,
,2025-11-18T16:29:46Z,"{'display_name': 'Simon-Kucher & Partners', '__CLASS__': 'Adzuna::API::Response::Company'}","{'area': ['Deutschland', 'Hessen', 'Main-Taunus-Kreis', 'Eschborn'], '__CLASS__': 'Adzuna::API::Response::Location', 'display_name': 'Eschborn, Main-Taunus-Kreis'}","Senior Consultant Data Science (m/w/d) In Deutschland - Berlin| Bonn | Frankfurt/Main | Hamburg | Köln | München Du bistbereit, deine persönliche Entwicklung in den Bereichen Data Science, Analyticsund KI zu fördern? Unser Data Science Team hilft Unternehmen, fundierteEntscheidungen zu treffen und ihr Wachstum voranzutreiben, indem wir Rohdatenin umsetzbare Erkenntnisse verwandeln. WerdePionier der digitalen Transformation und unterstütze uns als (Senior)Consultant – Data Science. Mehr von uns …","{'label': 'Unknown', '__CLASS__': 'Adzuna::API::Response::Category', 'tag': 'unknown'}",0,Adzuna::API::Response::Job,Senior Consultant Data Science (m/w/d),,https://www.adzuna.de/details/5501781006?utm_medium=api&utm_source=a4bcf954,eyJhbGciOiJIUzI1NiJ9.eyJpIjoiNTUwMTc4MTAwNiIsInMiOiI0aE03ZkFYSjhCR3dCNUZSX1lQRVpBIn0.kEqN-zlJ1zLFNmArGSq5FurGsCNuyJ4lh1CeMGynJyw,5501781006,,,,
9.987297,2025-11-14T15:13:33Z,"{'display_name': 'Simon-Kucher & Partners', '__CLASS__': 'Adzuna::API::Response::Company'}","{'__CLASS__': 'Adzuna::API::Response::Location', 'display_name': 'Hamburg, Deutschland', 'area': ['Deutschland', 'Hamburg']}","Senior Consultant Data Science (m/w/d) In Deutschland - Berlin| Bonn | Frankfurt/Main | Hamburg | Köln | München Du bistbereit, deine persönliche Entwicklung in den Bereichen Data Science, Analyticsund KI zu fördern? Unser Data Science Team hilft Unternehmen, fundierteEntscheidungen zu treffen und ihr Wachstum voranzutreiben, indem wir Rohdatenin umsetzbare Erkenntnisse verwandeln. WerdePionier der digitalen Transformation und unterstütze uns als (Senior)Consultant – Data Science. Mehr von uns …","{'__CLASS__': 'Adzuna::API::Response::Category', 'label': 'Unknown', 'tag': 'unknown'}",0,Adzuna::API::Response::Job,Senior Consultant Data Science (m/w/d),53.557429,https://www.adzuna.de/details/5496087653?utm_medium=api&utm_source=a4bcf954,eyJhbGciOiJIUzI1NiJ9.eyJzIjoiNGhNN2ZBWEo4Qkd3QjVGUl9ZUEVaQSIsImkiOiI1NDk2MDg3NjUzIn0.jeJLhRejrP3xmKi-vVH52IJ45AdbYQ_T4r8FeoI9CKY,5496087653,,,,
,2025-11-13T15:06:18Z,"{'display_name': 'Simon-Kucher & Partners', '__CLASS__': 'Adzuna::API::Response::Company'}","{'area': ['Deutschland', 'Nordrhein-Westfalen', 'Köln'], '__CLASS__': 'Adzuna::API::Response::Location', 'display_name': 'Köln, Nordrhein-Westfalen'}","Senior Consultant Data Science (m/w/d) In Deutschland - Berlin| Bonn | Frankfurt/Main | Hamburg | Köln | München Du bistbereit, deine persönliche Entwicklung in den Bereichen Data Science, Analyticsund KI zu fördern? Unser Data Science Team hilft Unternehmen, fundierteEntscheidungen zu treffen und ihr Wachstum voranzutreiben, indem wir Rohdatenin umsetzbare Erkenntnisse verwandeln. WerdePionier der digitalen Transformation und unterstütze uns als (Senior)Consultant – Data Science. Mehr von uns …","{'tag': 'unknown', 'label': 'Unknown', '__CLASS__': 'Adzuna::API::Response::Category'}",0,Adzuna::API::Response::Job,Senior Consultant Data Science (m/w/d),,https://www.adzuna.de/details/5493928550?utm_medium=api&utm_source=a4bcf954,eyJhbGciOiJIUzI1NiJ9.eyJpIjoiNTQ5MzkyODU1MCIsInMiOiI0aE03ZkFYSjhCR3dCNUZSX1lQRVpBIn0.TzmD8xSnsCzfxQXMtsJsjyReV_B2E4lBHbE6FHtNRdE,5493928550,,,,
,2025-11-13T15:06:18Z,"{'__CLASS__': 'Adzuna::API::Response::Company', 'display_name': 'Simon-Kucher & Partners'}","{'area': ['Deutschland', 'Bayern', 'München (Kreis)', 'München'], 'display_name': 'München, München (Kreis)', '__CLASS__': 'Adzuna::API::Response::Location'}","Senior Consultant Data Science (m/w/d) In Deutschland - Berlin| Bonn | Frankfurt/Main | Hamburg | Köln | München Du bistbereit, deine persönliche Entwicklung in den Bereichen Data Science, Analyticsund KI zu fördern? Unser Data Science Team hilft Unternehmen, fundierteEntscheidungen zu treffen und ihr Wachstum voranzutreiben, indem wir Rohdatenin umsetzbare Erkenntnisse verwandeln. WerdePionier der digitalen Transformation und unterstütze uns als (Senior)Consultant – Data Science. Mehr von uns …","{'tag': 'unknown', 'label': 'Unknown', '__CLASS__': 'Adzuna::API::Response::Category'}",0,Adzuna::API::Response::Job,Senior Consultant Data Science (m/w/d),,https://www.adzuna.de/details/5493928553?utm_medium=api&utm_source=a4bcf954,eyJhbGciOiJIUzI1NiJ9.eyJpIjoiNTQ5MzkyODU1MyIsInMiOiI0aE03ZkFYSjhCR3dCNUZSX1lQRVpBIn0.zYgH-PXYjtuWpMD4PCK32XvpQ-nLIxxjQqUFnUrAjkc,5493928553,,,,
7.112412,2025-11-14T15:13:33Z,"{'display_name': 'Simon-Kucher & Partners', '__CLASS__': 'Adzuna::API::Response::Company'}","{'area': ['Deutschland', 'Nordrhein-Westfalen', 'Bonn'], 'display_name': 'Bonn, Nordrhein-Westfalen', '__CLASS__': 'Adzuna::API::Response::Location'}","Senior Consultant Data Science (m/w/d) In Deutschland - Berlin| Bonn | Frankfurt/Main | Hamburg | Köln | München Du bistbereit, deine persönliche Entwicklung in den Bereichen Data Science, Analyticsund KI zu fördern? Unser Data Science Team hilft Unternehmen, fundierteEntscheidungen zu treffen und ihr Wachstum voranzutreiben, indem wir Rohdatenin umsetzbare Erkenntnisse verwandeln. WerdePionier der digitalen Transformation und unterstütze uns als (Senior)Consultant – Data Science. Mehr von uns …","{'tag': 'unknown', 'label': 'Unknown', '__CLASS__': 'Adzuna::API::Response::Category'}",0,Adzuna::API::Response::Job,Senior Consultant Data Science (m/w/d),50.71942,https://www.adzuna.de/details/5496087677?utm_medium=api&utm_source=a4bcf954,eyJhbGciOiJIUzI1NiJ9.eyJzIjoiNGhNN2ZBWEo4Qkd3QjVGUl9ZUEVaQSIsImkiOiI1NDk2MDg3Njc3In0.rLLRoShx6YxIIRnYOd5CpVRqeb21_dF2El30gSniac8,5496087677,,,,
11.61114,2025-10-24T03:48:51Z,"{'__CLASS__': 'Adzuna::API::Response::Company', 'display_name': 'NKD Deutschland GmbH'}","{'area': ['Deutschland', 'Bayern', 'Bayreuth (Kreis)', 'Bindlach'], 'display_name': 'Bindlach, Bayreuth (Kreis)', '__CLASS__': 'Adzuna::API::Response::Location'}","Mit ca. 2.200 Filialen in Deutschland, Österreich, Italien, Slowenien, Tschechien, Kroatien und Polen, einem eigenen Onlineshop sowie über 10.000 Mitarbeiterinnen und Mitarbeitern international zählt die NKD-Firmengruppe zu den größten Unternehmen im Textileinzelhandel. Das Angebot reicht von aktueller Mode für die ganze Familie und funktionaler Sportbekleidung über Heimtextilien und saisonale Dekorationsartikel bis hin zu ausgewählten Markensortimenten. Als zukunftsorientiertes Unternehmen set…","{'tag': 'accounting-finance-jobs', '__CLASS__': 'Adzuna::API::Response::Category', 'label': 'Stellen aus Buchhaltung & Finanzwesen'}",0,Adzuna::API::Response::Job,Werkstudent (m/w/d) Data Science Bindlach,49.98086,https://www.adzuna.de/details/5461838063?utm_medium=api&utm_source=a4bcf954,eyJhbGciOiJIUzI1NiJ9.eyJpIjoiNTQ2MTgzODA2MyIsInMiOiI0aE03ZkFYSjhCR3dCNUZSX1lQRVpBIn0.dJ8tCC0qNM8tofcJoF1mwz1O418LCRsQFWCDWVK83Kw,5461838063,,,,
,2025-05-10T21:53:49Z,"{'display_name': 'master-TMS', '__CLASS__': 'Adzuna::API::Response::Company'}","{'area': ['Deutschland'], '__CLASS__': 'Adzuna::API::Response::Location', 'display_name': 'Deutschland'}","In Deutschland - Berlin | Bonn | Frankfurt/Main | Hamburg | Köln | München Du bist bereit, deine persönliche Entwicklung in den Bereichen Data Science, Analytics und KI zu fördern? Unser Data Science Team hilft Unternehmen, fundierte Entscheidungen zu treffen und ihr Wachstum voranzutreiben, indem wir Rohdaten in umsetzbare Erkenntnisse verwandeln. Werde Pionier der digitalen Transformation und unterstütze uns als (Senior) Consultant – Data Science. Mehr von uns für dich: Steile Lernkurve: werd…","{'__CLASS__': 'Adzuna::API::Response::Category', 'label': 'Beraterstellen', 'tag': 'consultancy-jobs'}",0,Adzuna::API::Response::Job,Senior Consultant Data Science (m/w/d),,https://www.adzuna.de/details/5192887633?utm_medium=api&utm_source=a4bcf954,eyJhbGciOiJIUzI1NiJ9.eyJzIjoiNGhNN2ZBWEo4Qkd3QjVGUl9ZUEVaQSIsImkiOiI1MTkyODg3NjMzIn0.hI87cnFYTk6Gcs_2ekQgvjg9Lq7uvzTAzxKj6k8bgCs,5192887633,,,,
8.76072,2025-11-13T12:53:03Z,"{'__CLASS__': 'Adzuna::API::Response::Company', 'display_name': 'statworx'}","{'area': ['Deutschland', 'Hessen', 'Frankfurt am Main', 'Fechenheim'], '__CLASS__': 'Adzuna::API::Response::Location', 'display_name': 'Fechenheim, Frankfurt am Main'}",Über uns statworx ist ein führendes Beratungs- und Entwicklungsunternehmen für Daten und KI mit Sitz in Frankfurt am Main. Wir bieten strategische Beratung für mittelständische Unternehmen und globale Konzerne. Wir entwickeln innovative Daten- & KI-Lösungen für alle Unternehmensbereiche und Tätigkeitsfelder. Wir befähigen Menschen auf allen Kompetenzniveaus mit unseren Daten- & KI-Bildungsformaten. Kurz gesagt: Wir unterstützen Unternehmen bei allen Aspekten der digitalen Transformation – seit …,"{'tag': 'it-jobs', 'label': 'IT-Stellen', '__CLASS__': 'Adzuna::API::Response::Category'}",0,Adzuna::API::Response::Job,Trainee Data Science - Fokus NLP (alle Geschlechter),50.12595,https://www.adzuna.de/details/5493356866?utm_medium=api&utm_source=a4bcf954,eyJhbGciOiJIUzI1NiJ9.eyJpIjoiNTQ5MzM1Njg2NiIsInMiOiI0aE03ZkFYSjhCR3dCNUZSX1lQRVpBIn0._5N20XH1Q8QqsiGD9VOkdFq18mH7ALLAXxcv-yvExuU,5493356866,full_time,,,
,2025-11-17T18:28:39Z,"{'__CLASS__': 'Adzuna::API::Response::Company', 'display_name': 'anacision'}","{'__CLASS__': 'Adzuna::API::Response::Location', 'display_name': 'Deutschland', 'area': ['Deutschland']}","Über uns Wir bei anacision lieben und leben Daten! Wir sind überzeugt, dass künstliche Intelligenz uns dabei hilft, die immer komplexer werdenden Herausforderungen unserer Zeit zu meistern. Um dies zu erreichen, begleiten wir unsere Kunden aus der öffentlichen Verwaltung in Beratungsprojekten von der Ideenfindung bis zur Einführung einer KI-Lösung. Gemeinsam konzipieren wir individuelle KI-Lösungen und implementieren diese. Darüber hinaus unterstützen wir bei der technischen Operationalisierung…","{'label': 'Unknown', '__CLASS__': 'Adzuna::API::Response::Category', 'tag': 'unknown'}",0,Adzuna::API::Response::Job,Werkstudent:in Data Science und KI (m/w/d),,https://www.adzuna.de/details/5500564218?utm_medium=api&utm_source=a4bcf954,eyJhbGciOiJIUzI1NiJ9.eyJpIjoiNTUwMDU2NDIxOCIsInMiOiI0aE03ZkFYSjhCR3dCNUZSX1lQRVpBIn0.cXRTGMU7BsCTgUV6hI_s0ZpH291OT_vJlT4eeU3KhAQ,5500564218,part_time,,,
8.89081,2025-11-18T12:41:01Z,"{'__CLASS__': 'Adzuna::API::Response::Company', 'display_name': 'Ensinger GmbH'}","{'__CLASS__': 'Adzuna::API::Response::Location', 'display_name': 'Nufringen, Böblingen (Kreis)', 'area': ['Deutschland', 'Baden-Württemberg', 'Böblingen (Kreis)', 'Nufringen']}",Bezeichnung: Wirtschaftsinformatik - Data Science / Bachelor of Science (DH) Eintrittsdatum: 01.10.2026 mit Vorpraktikum ab 01.09.2026 Standort: 71154 Nufringen bei Stuttgart Arbeitszeit: Vollzeit Ausbildungsinhalte: Grundlagen der Informationstechnik Methoden der Informatik Moderne IT-Technologien für die Entwicklung von Software-Systemen kennenlernen und anwenden Anwendung von Künstlicher Intelligenz und Big Data in wirtschaftinformatorischen Kontexten Methoden und Konzepte der Betriebswirtsc…,"{'tag': 'unknown', '__CLASS__': 'Adzuna::API::Response::Category', 'label': 'Unknown'}",0,Adzuna::API::Response::Job,Wirtschaftsinformatik - Data Science / Bachelor of Science (DH),48.62307,https://www.adzuna.de/details/5501662011?utm_medium=api&utm_source=a4bcf954,eyJhbGciOiJIUzI1NiJ9.eyJzIjoiNGhNN2ZBWEo4Qkd3QjVGUl9ZUEVaQSIsImkiOiI1NTAxNjYyMDExIn0.GbJ-6BNX93NKxZpc57fHs9ybHGbt9rFHmdEbxxh0EyA,5501662011,,,,
8.650578,2025-11-14T22:47:51Z,"{'display_name': 'Deutsche Bundesbank', '__CLASS__': 'Adzuna::API::Response::Company'}","{'area': ['Deutschland', 'Hessen', 'Frankfurt am Main'], '__CLASS__': 'Adzuna::API::Response::Location', 'display_name': 'Frankfurt am Main, Hessen'}","Unsere Beschäftigten stellen sicher, dass unsere gemeinsame Währung und das europäische Finanzsystem stabil bleiben. Wie ihnen das gelingt? Bei uns haben sie die Zeit, den Freiraum und die Tools, komplexe Finanz- und Wirtschaftsthemen in ihrer Tiefe zu durchdringen und nachhaltige Lösungsvorschläge zu erarbeiten. Sie arbeiten agil, digital und über Grenzen hinweg. In Teams, die keine Vorurteile kennen, sondern gemeinsame Ziele. Werde auch Du Teil von etwas Besonderem und schaffe ein solides Fun…","{'label': 'Unknown', '__CLASS__': 'Adzuna::API::Response::Category', 'tag': 'unknown'}",0,Adzuna::API::Response::Job,"Praktikum Data Science im Bereich Preis-, Immobilienmarkt- und Konjunkturstatistiken",50.129683,https://www.adzuna.de/details/5496755432?utm_medium=api&utm_source=a4bcf954,eyJhbGciOiJIUzI1NiJ9.eyJzIjoiNGhNN2ZBWEo4Qkd3QjVGUl9ZUEVaQSIsImkiOiI1NDk2NzU1NDMyIn0.NjkIZ9M8ND1RyoobPhT95xAnya0No8Qx1d-S-TNLp9I,5496755432,,,,
,2025-08-18T21:58:08Z,"{'__CLASS__': 'Adzuna::API::Response::Company', 'display_name': 'twomynds'}","{'display_name': 'Deutschland', '__CLASS__': 'Adzuna::API::Response::Location', 'area': ['Deutschland']}","Über uns Du willst sehen, wie deine Lösungen direkt Management-Entscheidungen beeinflussen und in echten Use Cases Mehrwert schaffen – bei Unternehmen, die du aus dem Alltag kennst? Willkommen bei twomynds. Wir sind ein dedizierter End-to-End Data & AI Service Provider – strategisch, umsetzungsstark und ergebnisorientiert. Unsere Mission: Ambitionierte Unternehmen befähigen, Data & AI in geschäftskritischen Mehrwert zu verwandeln – mit strategischer Klarheit, technischer Exzellenz und unternehm…","{'label': 'Beraterstellen', '__CLASS__': 'Adzuna::API::Response::Category', 'tag': 'consultancy-jobs'}",0,Adzuna::API::Response::Job,Data Science & Solutions Consultant (m/w/d),,https://www.adzuna.de/details/5357594234?utm_medium=api&utm_source=a4bcf954,eyJhbGciOiJIUzI1NiJ9.eyJpIjoiNTM1NzU5NDIzNCIsInMiOiI0aE03ZkFYSjhCR3dCNUZSX1lQRVpBIn0.NjuPNhPcm25O9fWUmjHTZR_N-h1vlv-aUCJz2nc0GXY,5357594234,,,,
6.81035,2025-09-19T23:32:29Z,"{'display_name': 'DISH Digital Solutions', '__CLASS__': 'Adzuna::API::Response::Company'}","{'display_name': 'Flingern Nord, Düsseldorf', '__CLASS__': 'Adzuna::API::Response::Location', 'area': ['Deutschland', 'Nordrhein-Westfalen', 'Düsseldorf', 'Flingern Nord']}","Your Contribution Data is your playground, and AI is your toolkit. You are driven by the desire to turn complex data into actionable insights and create intelligent solutions that elevate customer and sales experiences. As Head of Data Science , you will lead the charge in shaping how DISH leverages AI and data to transform the HoReCa industry. Your strategic leadership will drive innovation, foster a culture of experimentation, and ensure our digital products are powered by smart, scalable, an…","{'tag': 'hospitality-catering-jobs', 'label': 'Stellen aus Gastronomie & Catering', '__CLASS__': 'Adzuna::API::Response::Category'}",0,Adzuna::API::Response::Job,Head of Data Science (m/f/d),51.23223,https://www.adzuna.de/details/5407304151?utm_medium=api&utm_source=a4bcf954,eyJhbGciOiJIUzI1NiJ9.eyJzIjoiNGhNN2ZBWEo4Qkd3QjVGUl9ZUEVaQSIsImkiOiI1NDA3MzA0MTUxIn0.pCnDIyLdM_M4EevZrVPcLe2OrMuVCOK0_AsW0EwAu1o,5407304151,full_time,,,
11.555737,2025-11-21T22:54:31Z,"{'__CLASS__': 'Adzuna::API::Response::Company', 'display_name': 'GSK'}","{'__CLASS__': 'Adzuna::API::Response::Location', 'display_name': 'München, München (Kreis)', 'area': ['Deutschland', 'Bayern', 'München (Kreis)', 'München']}","Für unser Data & Analytics Team bei ViiV Healthcare am Standort München suchen wir einen Werkstudent (m/w/d) Analytics & Data Science. ViiV Healthcare ist ein unabhängiges, weltweit tätiges pharmazeutisches Unternehmen, das sich zu 100% dem Fortschritt in der Behandlung und Versorgung von Menschen mit HIV verschrieben hat. Es gibt – über unser vielfältiges Engagement in Entwicklung und Vertrieb von antiretroviralen Medikamenten hinaus – viele wichtige Bereiche rund um HIV, in denen wir tätig si…","{'__CLASS__': 'Adzuna::API::Response::Category', 'label': 'Unknown', 'tag': 'unknown'}",0,Adzuna::API::Response::Job,Werkstudent (m/w/d) Analytics & Data Science,48.137418,https://www.adzuna.de/details/5508487107?utm_medium=api&utm_source=a4bcf954,eyJhbGciOiJIUzI1NiJ9.eyJzIjoiNGhNN2ZBWEo4Qkd3QjVGUl9ZUEVaQSIsImkiOiI1NTA4NDg3MTA3In0.fMx8jIfH7Y6XXKxwcB9e_3uyqZPwNqNxREKg15Z7_YE,5508487107,,,,
9.18071,2025-11-16T17:40:51Z,"{'display_name': 'KPMG', '__CLASS__': 'Adzuna::API::Response::Company'}","{'__CLASS__': 'Adzuna::API::Response::Location', 'display_name': 'Mitte, Stuttgart', 'area': ['Deutschland', 'Baden-Württemberg', 'Stuttgart', 'Mitte']}","Senior Consultant Data Science (w/m/d) Job-Nr: 12025 Standorte: Stuttgart Karrierelevel: Berufserfahrene Anstellungsart: Festanstellung Als Senior Consultant Data Science (w/m/d) wirst du Teil eines dynamischen Teams von Data-Experts, die innovative und datengesteuerte Lösungen für unsere Kunden entwickeln. Dabei arbeitest du eng mit erfahrenen Data Scientists zusammen und hast die Möglichkeit, an verschiedenen Projekten und Herausforderungen mitzuwirken. Deine Aufgaben Du bereitest komplexe Da…","{'tag': 'it-jobs', 'label': 'IT-Stellen', '__CLASS__': 'Adzuna::API::Response::Category'}",0,Adzuna::API::Response::Job,Senior Consultant Data Science (w/m/d),48.77713,https://www.adzuna.de/details/5499293823?utm_medium=api&utm_source=a4bcf954,eyJhbGciOiJIUzI1NiJ9.eyJpIjoiNTQ5OTI5MzgyMyIsInMiOiI0aE03ZkFYSjhCR3dCNUZSX1lQRVpBIn0.YzWKTf93Yiy3Q4tGhkX10hGAXmVY4JnyVQZG4nu3iRU,5499293823,,,permanent,
8.45882,2025-11-15T17:50:12Z,"{'__CLASS__': 'Adzuna::API::Response::Company', 'display_name': 'KPMG'}","{'__CLASS__': 'Adzuna::API::Response::Location', 'display_name': 'Hagsfeld, Karlsruhe', 'area': ['Deutschland', 'Baden-Württemberg', 'Karlsruhe (Kreis)', 'Karlsruhe', 'Hagsfeld']}","Senior Consultant Data Science (w/m/d) Job-Nr: 12025 Standorte: Karlsruhe Karrierelevel: Berufserfahrene Anstellungsart: Festanstellung Als Senior Consultant Data Science (w/m/d) wirst du Teil eines dynamischen Teams von Data-Experts, die innovative und datengesteuerte Lösungen für unsere Kunden entwickeln. Dabei arbeitest du eng mit erfahrenen Data Scientists zusammen und hast die Möglichkeit, an verschiedenen Projekten und Herausforderungen mitzuwirken. Deine Aufgaben Du bereitest komplexe Da…","{'__CLASS__': 'Adzuna::API::Response::Category', 'label': 'IT-Stellen', 'tag': 'it-jobs'}",0,Adzuna::API::Response::Job,Senior Consultant Data Science (w/m/d),49.03084,https://www.adzuna.de/details/5497413060?utm_medium=api&utm_source=a4bcf954,eyJhbGciOiJIUzI1NiJ9.eyJzIjoiNGhNN2ZBWEo4Qkd3QjVGUl9ZUEVaQSIsImkiOiI1NDk3NDEzMDYwIn0.u6erX4Cf-WH9abwTuscfVBz6ZOwf9onWneHYumwTROc,5497413060,,,permanent,
6.96191,2025-11-14T14:41:56Z,"{'__CLASS__': 'Adzuna::API::Response::Company', 'display_name': 'KPMG'}","{'__CLASS__': 'Adzuna::API::Response::Location', 'display_name': 'Malstatt, Saarbrücken', 'area': ['Deutschland', 'Saarland', 'Regionalverband Saarbrücken (Kreis)', 'Saarbrücken', 'Malstatt']}","Senior Consultant Data Science (w/m/d) Job-Nr: 12025 Standorte: Saarbrücken Karrierelevel: Berufserfahrene Anstellungsart: Festanstellung Als Senior Consultant Data Science (w/m/d) wirst du Teil eines dynamischen Teams von Data-Experts, die innovative und datengesteuerte Lösungen für unsere Kunden entwickeln. Dabei arbeitest du eng mit erfahrenen Data Scientists zusammen und hast die Möglichkeit, an verschiedenen Projekten und Herausforderungen mitzuwirken. Deine Aufgaben Du bereitest komplexe …","{'label': 'IT-Stellen', '__CLASS__': 'Adzuna::API::Response::Category', 'tag': 'it-jobs'}",0,Adzuna::API::Response::Job,Senior Consultant Data Science (w/m/d),49.253,https://www.adzuna.de/details/5496063595?utm_medium=api&utm_source=a4bcf954,eyJhbGciOiJIUzI1NiJ9.eyJpIjoiNTQ5NjA2MzU5NSIsInMiOiI0aE03ZkFYSjhCR3dCNUZSX1lQRVpBIn0.ODdiQiMGL7YoQ73uK2NYLMHxCIh5Ha1ip-ivdZwNYnk,5496063595,,,permanent,
13.35662,2025-11-14T14:41:56Z,"{'__CLASS__': 'Adzuna::API::Response::Company', 'display_name': 'KPMG'}","{'area': ['Deutschland', 'Berlin', 'Moabit'], 'display_name': 'Moabit, Berlin', '__CLASS__': 'Adzuna::API::Response::Location'}","Senior Consultant Data Science (w/m/d) Job-Nr: 12025 Standorte: Berlin Karrierelevel: Berufserfahrene Anstellungsart: Festanstellung Als Senior Consultant Data Science (w/m/d) wirst du Teil eines dynamischen Teams von Data-Experts, die innovative und datengesteuerte Lösungen für unsere Kunden entwickeln. Dabei arbeitest du eng mit erfahrenen Data Scientists zusammen und hast die Möglichkeit, an verschiedenen Projekten und Herausforderungen mitzuwirken. Deine Aufgaben Du bereitest komplexe Daten…","{'tag': 'it-jobs', 'label': 'IT-Stellen', '__CLASS__': 'Adzuna::API::Response::Category'}",0,Adzuna::API::Response::Job,Senior Consultant Data Science (w/m/d),52.5259,https://www.adzuna.de/details/5496063596?utm_medium=api&utm_source=a4bcf954,eyJhbGciOiJIUzI1NiJ9.eyJpIjoiNTQ5NjA2MzU5NiIsInMiOiI0aE03ZkFYSjhCR3dCNUZSX1lQRVpBIn0.zsqvYSWexMgzWax2_AJwul1nF6-LqqPe7QL0Mmmcp1o,5496063596,,,permanent,
8.56413,2025-11-14T14:41:56Z,"{'display_name': 'KPMG', '__CLASS__': 'Adzuna::API::Response::Company'}","{'__CLASS__': 'Adzuna::API::Response::Location', 'display_name': 'Flughafen, Frankfurt am Main', 'area': ['Deutschland', 'Hessen', 'Frankfurt am Main', 'Flughafen']}","Senior Consultant Data Science (w/m/d) Job-Nr: 12025 Standorte: Frankfurt Karrierelevel: Berufserfahrene Anstellungsart: Festanstellung Als Senior Consultant Data Science (w/m/d) wirst du Teil eines dynamischen Teams von Data-Experts, die innovative und datengesteuerte Lösungen für unsere Kunden entwickeln. Dabei arbeitest du eng mit erfahrenen Data Scientists zusammen und hast die Möglichkeit, an verschiedenen Projekten und Herausforderungen mitzuwirken. Deine Aufgaben Du bereitest komplexe Da…","{'tag': 'it-jobs', 'label': 'IT-Stellen', '__CLASS__': 'Adzuna::API::Response::Category'}",0,Adzuna::API::Response::Job,Senior Consultant Data Science (w/m/d),50.05078,https://www.adzuna.de/details/5496063591?utm_medium=api&utm_source=a4bcf954,eyJhbGciOiJIUzI1NiJ9.eyJzIjoiNGhNN2ZBWEo4Qkd3QjVGUl9ZUEVaQSIsImkiOiI1NDk2MDYzNTkxIn0.v4dm8U_GA2FuqLAgHHEfrG9tGr41CF1V057ll9Qi-Q4,5496063591,,,permanent,
8.50014,2025-11-14T14:41:56Z,"{'__CLASS__': 'Adzuna::API::Response::Company', 'display_name': 'KPMG'}","{'__CLASS__': 'Adzuna::API::Response::Location', 'display_name': 'Neuostheim, Mannheim', 'area': ['Deutschland', 'Baden-Württemberg', 'Mannheim', 'Neuostheim']}","Senior Consultant Data Science (w/m/d) Job-Nr: 12025 Standorte: Mannheim Karrierelevel: Berufserfahrene Anstellungsart: Festanstellung Als Senior Consultant Data Science (w/m/d) wirst du Teil eines dynamischen Teams von Data-Experts, die innovative und datengesteuerte Lösungen für unsere Kunden entwickeln. Dabei arbeitest du eng mit erfahrenen Data Scientists zusammen und hast die Möglichkeit, an verschiedenen Projekten und Herausforderungen mitzuwirken. Deine Aufgaben Du bereitest komplexe Dat…","{'__CLASS__': 'Adzuna::API::Response::Category', 'label': 'IT-Stellen', 'tag': 'it-jobs'}",0,Adzuna::API::Response::Job,Senior Consultant Data Science (w/m/d),49.46856,https://www.adzuna.de/details/5496063593?utm_medium=api&utm_source=a4bcf954,eyJhbGciOiJIUzI1NiJ9.eyJzIjoiNGhNN2ZBWEo4Qkd3QjVGUl9ZUEVaQSIsImkiOiI1NDk2MDYzNTkzIn0.iV4isDEYNeudcee6Lo2hkP7nJjY0__JP-X529f8Mu-I,5496063593,,,permanent,
8.29909,2025-11-14T14:41:56Z,"{'display_name': 'KPMG', '__CLASS__': 'Adzuna::API::Response::Company'}","{'__CLASS__': 'Adzuna::API::Response::Location', 'display_name': 'Mitte, Ulm', 'area': ['Deutschland', 'Baden-Württemberg', 'Ulm', 'Mitte']}","Senior Consultant Data Science (w/m/d) Job-Nr: 12025 Standorte: Ulm Karrierelevel: Berufserfahrene Anstellungsart: Festanstellung Als Senior Consultant Data Science (w/m/d) wirst du Teil eines dynamischen Teams von Data-Experts, die innovative und datengesteuerte Lösungen für unsere Kunden entwickeln. Dabei arbeitest du eng mit erfahrenen Data Scientists zusammen und hast die Möglichkeit, an verschiedenen Projekten und Herausforderungen mitzuwirken. Deine Aufgaben Du bereitest komplexe Daten au…","{'label': 'IT-Stellen', '__CLASS__': 'Adzuna::API::Response::Category', 'tag': 'it-jobs'}",0,Adzuna::API::Response::Job,Senior Consultant Data Science (w/m/d),48.36497,https://www.adzuna.de/details/5496063594?utm_medium=api&utm_source=a4bcf954,eyJhbGciOiJIUzI1NiJ9.eyJzIjoiNGhNN2ZBWEo4Qkd3QjVGUl9ZUEVaQSIsImkiOiI1NDk2MDYzNTk0In0.WJBM0jvSeFbKZTCnoqUTDl3OuNZ_Sb98zIaAV9u_rxk,5496063594,,,permanent,
