company,salary_is_predicted,title,created,id,category,adref,location,__CLASS__,redirect_url,description,latitude,longitude,contract_time,salary_max,salary_min,contract_type
"{'__CLASS__': 'Adzuna::API::Response::Company', 'display_name': 'tesa SE'}",0,Duales Studium Data Science B.Sc. / M.Sc. (m/w/d) | 01.09.2025,2025-06-17T20:39:51Z,5255333380,"{'__CLASS__': 'Adzuna::API::Response::Category', 'label': 'Unknown', 'tag': 'unknown'}",eyJhbGciOiJIUzI1NiJ9.eyJzIjoiQ0VycEs2NU44Qkd3aXBxcVpvZlY0QSIsImkiOiI1MjU1MzMzMzgwIn0.t6Z7s-JuG7JtcaIX6QioaYZfwAbK0aTXA1mLglzFXNE,"{'__CLASS__': 'Adzuna::API::Response::Location', 'area': ['Deutschland', 'Hamburg'], 'display_name': 'Hamburg, Deutschland'}",Adzuna::API::Response::Job,https://www.adzuna.de/land/ad/5255333380?se=CErpK65N8BGwipqqZofV4A&utm_medium=api&utm_source=a4bcf954&v=3D61C105B5A3C19DA2760E8DEB6D4CD770FD1D05,"tesa ist einer der weltweit führenden Hersteller von Klebebandlösungen mit einem Sortiment von mehr als 7.000 verschiedenen Produkten. Mit Leidenschaft für Technologie treiben wir Innovation, Zuverlässigkeit und Nachhaltigkeit voran, um die Zukunft jeden Tag ein Stück besser zu machen. Unsere Lösungen bereichern die Arbeit, Produkte und das Leben in einer Vielzahl von Branchen, zum Beispiel der Automobil- oder Elektronikindustrie, aber auch bei Dir Zuhause. Damit sprechen wir ein breites Indust…",53.557429,9.987297,,,,
"{'display_name': 'Bundesinstitut für Bau-, Stadt- und Raumforschung ', '__CLASS__': 'Adzuna::API::Response::Company'}",0,wissenschaftliche Mitarbeiterinnen/wissenschaftliche Mitarbeiter (w/m/d) mit dem Ziel der Promotion im Bereich Spatial Data Science,2025-05-31T07:51:11Z,5224416326,"{'__CLASS__': 'Adzuna::API::Response::Category', 'tag': 'sales-jobs', 'label': 'Vertriebsstellen'}",eyJhbGciOiJIUzI1NiJ9.eyJpIjoiNTIyNDQxNjMyNiIsInMiOiJDRXJwSzY1TjhCR3dpcHFxWm9mVjRBIn0.VVbcQSd9nnoeTMlGOVBJ6AFD-YvvvRDXb6IuFw257pY,"{'__CLASS__': 'Adzuna::API::Response::Location', 'area': ['Deutschland', 'Nordrhein-Westfalen', 'Bonn'], 'display_name': 'Bonn, Nordrhein-Westfalen'}",Adzuna::API::Response::Job,https://www.adzuna.de/land/ad/5224416326?se=CErpK65N8BGwipqqZofV4A&utm_medium=api&utm_source=a4bcf954&v=25DF889118E9543538931AA9BC8E90C24BC0E885,"Das Bundesinstitut für Bau-, Stadt- und Raumforschung (BBSR) sucht für das Referat RS 1 „Raumentwicklung“ in Bonn zum nächstmöglichen Zeitpunkt befristet für 3 Jahre zwei wissenschaftliche Mitarbeiterinnen / wissenschaftliche Mitarbeiter (w/m/d) mit dem Ziel der Promotion im Bereich Spatial Data Science Knr. S 053-25 Bewerbungsfrist: 03.08.2025 Beschäftigungsdauer: befristet für 3 Jahre Wochenstunden: 39 h Vergütung: E 13 TVöD Arbeitsort: Bonn Das BBSR im Bundesamt für Bauwesen und Raumordnung …",50.71942,7.112412,,,,
"{'__CLASS__': 'Adzuna::API::Response::Company', 'display_name': 'Mercedes-Benz AG'}",0,Full-Stack Data Analytics/Data Science Expert im Competence Center Digital Accelerator (d/m/w/x),2025-04-12T06:57:41Z,5141701156,"{'label': 'Unknown', 'tag': 'unknown', '__CLASS__': 'Adzuna::API::Response::Category'}",eyJhbGciOiJIUzI1NiJ9.eyJzIjoiQ0VycEs2NU44Qkd3aXBxcVpvZlY0QSIsImkiOiI1MTQxNzAxMTU2In0.pQEf-gH-MNuZBudy-RuawSf7YEM3doGVDjBV--TZihQ,"{'__CLASS__': 'Adzuna::API::Response::Location', 'area': ['Deutschland', 'Baden-Württemberg', 'Stuttgart'], 'display_name': 'Stuttgart, Baden-Württemberg'}",Adzuna::API::Response::Job,https://www.adzuna.de/land/ad/5141701156?se=CErpK65N8BGwipqqZofV4A&utm_medium=api&utm_source=a4bcf954&v=196B780ED0383D243C1F8CF660806748DF206A94,"Life is always about becoming… Im Leben geht es darum, sich auf eine Reise zu begeben, um die beste Version unseres zukünftigen Selbst zu werden. Während wir Neues entdecken, stellen wir uns Herausforderungen, meistern sie und wachsen über uns hinaus. Bewerben Sie sich bei Mercedes-Benz und finden Sie den Aufgabenbereich, in dem Sie Ihre Talente individuell entfalten können. Dabei werden Sie von visionären Kolleginnen und Kollegen unterstützt, die Ihren Pioniergeist teilen. Bei uns einzusteigen…",48.776198,9.187224,,,,
"{'__CLASS__': 'Adzuna::API::Response::Company', 'display_name': 'European Central Bank'}",0,Supervision and Data Science Analysts - Inklusiver Job   ,2025-05-30T15:38:52Z,5223446088,"{'label': 'Unknown', 'tag': 'unknown', '__CLASS__': 'Adzuna::API::Response::Category'}",eyJhbGciOiJIUzI1NiJ9.eyJpIjoiNTIyMzQ0NjA4OCIsInMiOiJDRXJwSzY1TjhCR3dpcHFxWm9mVjRBIn0.iGUWw-fF6nO5NXzsaco0lBUj18F6JhaExqSINIe0FEQ,"{'display_name': 'Frankfurt am Main, Hessen', 'area': ['Deutschland', 'Hessen', 'Frankfurt am Main'], '__CLASS__': 'Adzuna::API::Response::Location'}",Adzuna::API::Response::Job,https://www.adzuna.de/land/ad/5223446088?se=CErpK65N8BGwipqqZofV4A&utm_medium=api&utm_source=a4bcf954&v=40D0580A9585FF1ED5C49A1D507A7EC8792E888D,"General Information Type of contract: Fixed-term contract, which may be extended subject to individual performance and organisational needs Who can apply?: EU nationals Salary: E/F (bracket 1 - step 1) full time monthly net salary: €4,869 plus benefits, for further information see Working time: Full time Place of work: Frankfurt am Main, Germany Closing date: 16.06.2025 Your team You will be part of the Banking Supervision Data Division or the Securities and Financial Markets Data Division in t…",50.129683,8.650578,,,,
"{'__CLASS__': 'Adzuna::API::Response::Company', 'display_name': 'Technische Universität München '}",0,IT-Systemadministrator (m/w/d) am Munich Data Science Institute,2025-05-28T10:19:42Z,5219667257,"{'__CLASS__': 'Adzuna::API::Response::Category', 'label': 'Lehrberufe', 'tag': 'teaching-jobs'}",eyJhbGciOiJIUzI1NiJ9.eyJzIjoiQ0VycEs2NU44Qkd3aXBxcVpvZlY0QSIsImkiOiI1MjE5NjY3MjU3In0.3VIDEFdfQKOx6mqGb1JFg1kyLCsc1LrPTniQpPBqepE,"{'display_name': 'Altstadt-Lehel, München', 'area': ['Deutschland', 'Bayern', 'München (Kreis)', 'München', 'Altstadt-Lehel'], '__CLASS__': 'Adzuna::API::Response::Location'}",Adzuna::API::Response::Job,https://www.adzuna.de/land/ad/5219667257?se=CErpK65N8BGwipqqZofV4A&utm_medium=api&utm_source=a4bcf954&v=E236194466FA179F449B7CBBCBA6BF0A56215239,"Munich Data Science Institute (MDSI) Technische Universität MünchenTUM - Logo IT-Systemadministrator (m/w/d) am Munich Data Science Institute Das Munich Data Science Institute (MDSI) ist ein Integratives Forschungsinstitut an der Technischen Universität München (TUM). Es ist interdisziplinär und fachbereichsübergreifend in den Bereichen Data Science, Maschinelles Lernen und Künstliche Intelligenz ausgerichtet. Das Institut fungiert als Vermittler und Multiplikator modernster Data- Science-Prakt…",48.14093,11.56907,,,,
"{'display_name': 'Ruhr-Universität Bochum', '__CLASS__': 'Adzuna::API::Response::Company'}",0,Universitätsprofessur W3 (m/w/d) für Mathematische Statistik und Data Science,2025-06-07T03:33:35Z,5237636034,"{'__CLASS__': 'Adzuna::API::Response::Category', 'label': 'Lehrberufe', 'tag': 'teaching-jobs'}",eyJhbGciOiJIUzI1NiJ9.eyJzIjoiQ0VycEs2NU44Qkd3aXBxcVpvZlY0QSIsImkiOiI1MjM3NjM2MDM0In0.v5dVBEvAfD_zXA67fRYgamSdbx_K7b3DMsKMroWcESo,"{'__CLASS__': 'Adzuna::API::Response::Location', 'display_name': 'Deutschland', 'area': ['Deutschland']}",Adzuna::API::Response::Job,https://www.adzuna.de/land/ad/5237636034?se=CErpK65N8BGwipqqZofV4A&utm_medium=api&utm_source=a4bcf954&v=4CFF414470129F180FB69DAA02AE0764119F36EF,In der Fakultät für Mathematik der RUB ist zum nächstmöglichen Zeitpunkt eine Universitätsprofessur W3 [m/w/d] für Mathematische Statistik und Data Science zu besetzen (vorzeitige Nachfolge Prof. Holger Dette). Die*der zukünftige Stelleninhaber*in soll in Forschung und Lehre das Fachgebiet Mathematische Statistik und Data Science vertreten. Bewerber*innen sollen sowohl in Forschung als auch in Lehre hervorragend qualifiziert sein. Ihr international sichtbares Forschungsprofil soll dabei vorhand…,,,,,,
"{'display_name': 'Mercedes-Benz AG', '__CLASS__': 'Adzuna::API::Response::Company'}",0,Senior Full-Stack Data Analytics/Data Science Expert im Competence Center Digital Accelerator (d/m/w/x),2025-04-12T06:57:42Z,5141701193,"{'__CLASS__': 'Adzuna::API::Response::Category', 'tag': 'scientific-qa-jobs', 'label': 'Stellen aus Wissenschaft & Qualitätssicherung'}",eyJhbGciOiJIUzI1NiJ9.eyJpIjoiNTE0MTcwMTE5MyIsInMiOiJDRXJwSzY1TjhCR3dpcHFxWm9mVjRBIn0.ngWMY3KSf-7ZHdvrtwkvIYhk0R3lCbAqnDCaBkGdrmU,"{'__CLASS__': 'Adzuna::API::Response::Location', 'display_name': 'Stuttgart, Baden-Württemberg', 'area': ['Deutschland', 'Baden-Württemberg', 'Stuttgart']}",Adzuna::API::Response::Job,https://www.adzuna.de/land/ad/5141701193?se=CErpK65N8BGwipqqZofV4A&utm_medium=api&utm_source=a4bcf954&v=AC173C306678BFC9415C57CAF30C677C591D1C25,"Life is always about becoming… Im Leben geht es darum, sich auf eine Reise zu begeben, um die beste Version unseres zukünftigen Selbst zu werden. Während wir Neues entdecken, stellen wir uns Herausforderungen, meistern sie und wachsen über uns hinaus. Bewerben Sie sich bei Mercedes-Benz und finden Sie den Aufgabenbereich, in dem Sie Ihre Talente individuell entfalten können. Dabei werden Sie von visionären Kolleginnen und Kollegen unterstützt, die Ihren Pioniergeist teilen. Bei uns einzusteigen…",48.776198,9.187224,,,,
"{'display_name': 'BRUNO BADER GmbH + Co. KG', '__CLASS__': 'Adzuna::API::Response::Company'}",0,(Senior) Machine Learning Engineer / AI Developer (m/w/d),2025-06-20T08:10:26Z,5259457374,"{'tag': 'it-jobs', 'label': 'IT-Stellen', '__CLASS__': 'Adzuna::API::Response::Category'}",eyJhbGciOiJIUzI1NiJ9.eyJpIjoiNTI1OTQ1NzM3NCIsInMiOiJDRXJwSzY1TjhCR3dpcHFxWm9mVjRBIn0.AgSOyUCXrp7vzM23BqF1YqDh0jmyc0qpdGGEzKxjrYo,"{'__CLASS__': 'Adzuna::API::Response::Location', 'area': ['Deutschland', 'Baden-Württemberg', 'Pforzheim'], 'display_name': 'Pforzheim, Baden-Württemberg'}",Adzuna::API::Response::Job,https://www.adzuna.de/land/ad/5259457374?se=CErpK65N8BGwipqqZofV4A&utm_medium=api&utm_source=a4bcf954&v=F449AE42F99EA8E90BA3AEAC0964FCDC20A0E784,"BADER ist ein Multichannel-Distanzhändler mit über 95-jähriger Geschichte. Familiengeführt in dritter Generation gehört BADER zu den attraktivsten Arbeitgebern der Region. Eine Kultur des Miteinanders sichert den wirtschaftlichen Erfolg in einem Unternehmen mit flachen Hierarchien und kurzen Wegen. BADER wächst und entwickelt sich stetig weiter - deshalb freuen wir uns, wenn auch Du bald unser BADER-Team unterstützt. Hallo, wir sind die Abteilung Data Analytics! Wir bestehen aus fünfzehn Expert…",48.883606,8.697363,,,,
"{'__CLASS__': 'Adzuna::API::Response::Company', 'display_name': 'MSD Deutschland'}",0,Praktikant (m/w/d) Data Science - Inklusiver Job   ,2025-06-07T12:36:49Z,5238511239,"{'label': 'Unknown', 'tag': 'unknown', '__CLASS__': 'Adzuna::API::Response::Category'}",eyJhbGciOiJIUzI1NiJ9.eyJzIjoiQ0VycEs2NU44Qkd3aXBxcVpvZlY0QSIsImkiOiI1MjM4NTExMjM5In0.potHKAIVTxvHs8kg3LC3rCUY58gNBvHpyjabfPPCdBU,"{'area': ['Deutschland', 'Bayern', 'München (Kreis)', 'München'], 'display_name': 'München, München (Kreis)', '__CLASS__': 'Adzuna::API::Response::Location'}",Adzuna::API::Response::Job,https://www.adzuna.de/land/ad/5238511239?se=CErpK65N8BGwipqqZofV4A&utm_medium=api&utm_source=a4bcf954&v=541742D70E734C816DAE2C386262BB4B6A33363F,"Für unsere Abteilung Data Science in München suchen wir ab sofort einen Praktikanten (m/w/d) - ab sofort für mindestens 6 Monate. Unsere Teams im Bereich Digital arbeiten kross-funktional, um Innovationen voranzutreiben. Das Human Health Data Science Team entwickelt Analytics-Lösungen, die die Unternehmensstrategie unterstützen, und ist Hauptansprechpartner für alle Fragen rund um quantitative Analysen. Deine Aufgaben Sammeln, Bereinigen und Vorverarbeiten von Daten für weitere Analysen. Durchf…",48.137418,11.555737,,,,
"{'__CLASS__': 'Adzuna::API::Response::Company', 'display_name': 'STADA Arzneimittel AG'}",0,Senior Business Analyst AI / Data Science (f/m/d),2025-03-26T14:16:31Z,5112144320,"{'tag': 'unknown', 'label': 'Unknown', '__CLASS__': 'Adzuna::API::Response::Category'}",eyJhbGciOiJIUzI1NiJ9.eyJzIjoiQ0VycEs2NU44Qkd3aXBxcVpvZlY0QSIsImkiOiI1MTEyMTQ0MzIwIn0.5pOUYEy5fcDaI70LqTUwbq3dZ8BAPdk5e8KXL0H6W4g,"{'__CLASS__': 'Adzuna::API::Response::Location', 'display_name': 'Bad Vilbel, Wetteraukreis', 'area': ['Deutschland', 'Hessen', 'Wetteraukreis', 'Bad Vilbel']}",Adzuna::API::Response::Job,https://www.adzuna.de/land/ad/5112144320?se=CErpK65N8BGwipqqZofV4A&utm_medium=api&utm_source=a4bcf954&v=63CA97FBE983C0B16427AEFB5B0184434AF4A3DF,"""Caring for People's Health as a Trusted Partner"" - This mission motivates us at STADA every day to improve the health of people worldwide. With our wide range of generics, consumer health products and specialty pharmaceuticals, we offer patients, doctors and pharmacists a wide range of therapeutic options. Around 11,700 employees live our values of Integrity, Entrepreneurship, Agility and One STADA. Together we are on an exciting growth journey and want to successfully shape the future of STAD…",50.17809,8.73553,full_time,,,
"{'__CLASS__': 'Adzuna::API::Response::Company', 'display_name': 'Diehl Defence GmbH & Co. KG'}",0,Praktikant (m/w/d) Data Science,2025-06-13T19:16:06Z,5248888764,"{'label': 'Sonstige/Allgemeine Stellen', 'tag': 'other-general-jobs', '__CLASS__': 'Adzuna::API::Response::Category'}",eyJhbGciOiJIUzI1NiJ9.eyJpIjoiNTI0ODg4ODc2NCIsInMiOiJDRXJwSzY1TjhCR3dpcHFxWm9mVjRBIn0.s1cmcP-Cm7qRO7gBvbY-f2pId_Mm3KU9UyhX49NPvwE,"{'display_name': 'Deutschland', 'area': ['Deutschland'], '__CLASS__': 'Adzuna::API::Response::Location'}",Adzuna::API::Response::Job,https://www.adzuna.de/land/ad/5248888764?se=CErpK65N8BGwipqqZofV4A&utm_medium=api&utm_source=a4bcf954&v=2D9AA6F6BDFAF69DC1317C5678F35DB50DE1C2EC,"Digitale Trans­formation. Nach­haltig­keit. Friedens­sicherung. Spannende Aufgaben, an denen auch wir bei Diehl in unseren fünf Teil­konzernen Metall, Controls, Defence, Aviation und Metering und unsere über 16.000 Mit­arbeiter­innen und Mit­arbeiter mit Hochdruck arbeiten. Entdecke faszinierende Techno­logien und bewirb dich. In einem von Vertrauen und Mut geprägten Familien­unter­nehmen, das beständig und stabil ist – aus Tradition. Für unseren Standort Diehl Defence GmbH & Co. KG in Röthenba…",,,,,,
"{'display_name': 'Kaufland', '__CLASS__': 'Adzuna::API::Response::Company'}",0,Praktikant Data Science (m/w/d),2025-05-28T23:29:42Z,5220848102,"{'__CLASS__': 'Adzuna::API::Response::Category', 'tag': 'other-general-jobs', 'label': 'Sonstige/Allgemeine Stellen'}",eyJhbGciOiJIUzI1NiJ9.eyJzIjoiQ0VycEs2NU44Qkd3aXBxcVpvZlY0QSIsImkiOiI1MjIwODQ4MTAyIn0.czinlNi0Se4bhTv0gAMteAznXmemHf-8Bm6hY3D9l9w,"{'display_name': 'Heilbronn, Heilbronn (Kreis)', 'area': ['Deutschland', 'Baden-Württemberg', 'Heilbronn (Kreis)', 'Heilbronn'], '__CLASS__': 'Adzuna::API::Response::Location'}",Adzuna::API::Response::Job,https://www.adzuna.de/land/ad/5220848102?se=CErpK65N8BGwipqqZofV4A&utm_medium=api&utm_source=a4bcf954&v=A2C99B734B74A77FD100FB820C61753D8F5A4C1B,"Du willst mehr als Uni und möchtest erste Berufseinblicke und Kontakte knüpfen? Dann bist du hier richtig! Als Werkstudent oder Praktikant bei Kaufland gehörst du von Beginn an zu einem starken Team und kannst zeigen, was in dir steckt. Werde auch du Teil von teamkaufland! Wir zählen auf dich: Du unterstützt unser Team bei der Bearbeitung unserer Analytics Use Cases entlang der gesamten Wertschöpfungskette bei Kaufland. Vielfältige Aufgaben? Na klar: Lerne unsere Projekte und Arbeitsweisen währ…",49.142335,9.209895,,,,
"{'display_name': 'itmX GmbH', '__CLASS__': 'Adzuna::API::Response::Company'}",0,KI/ Data Science Consultant (Mensch ),2025-06-10T15:09:46Z,5242666727,"{'label': 'Stellen aus Wissenschaft & Qualitätssicherung', 'tag': 'scientific-qa-jobs', '__CLASS__': 'Adzuna::API::Response::Category'}",eyJhbGciOiJIUzI1NiJ9.eyJzIjoiQ0VycEs2NU44Qkd3aXBxcVpvZlY0QSIsImkiOiI1MjQyNjY2NzI3In0.DxkHf93HKiXpfofPOrhne2Wa1c4DvqQlWftWOzc_tq8,"{'__CLASS__': 'Adzuna::API::Response::Location', 'area': ['Deutschland', 'Baden-Württemberg', 'Pforzheim', 'Brötzingen'], 'display_name': 'Brötzingen, Pforzheim'}",Adzuna::API::Response::Job,https://www.adzuna.de/land/ad/5242666727?se=CErpK65N8BGwipqqZofV4A&utm_medium=api&utm_source=a4bcf954&v=147489E0C114572F20B779A0150473CCB2323FEE,"Bei itmX fokussieren wir uns auf die Geschäftsprozesse in den Bereichen Marketing, Vertrieb, Service und Commerce unter Verwendung der Microsoft Power Platform, Microsoft 365, SAP ERP und unser eigenem Produkt der itmX crm suite. Unser Ziel ist es dabei Microsoft und SAP bestmöglich prozessual sowie funktional zu verbinden. Tätigkeiten Analyse von Geschäftsprozessen und Identifikation von Optimierungspotenzialen durch den Einsatz von KI für Digitalisierungsprojekte Beratung und Unterstützung un…",48.88901,8.66796,,,,
"{'display_name': 'Deutsches Register für hämatopoetische Stammzelltransplantation und Zelltherapie e.V.', '__CLASS__': 'Adzuna::API::Response::Company'}",0,Mitarbeiter (m/w/d) Medizinische Dokumentation / Datenmanagement / Data Science in der Medizin,2025-06-18T15:49:29Z,5256373670,"{'label': 'Unknown', 'tag': 'unknown', '__CLASS__': 'Adzuna::API::Response::Category'}",eyJhbGciOiJIUzI1NiJ9.eyJzIjoiQ0VycEs2NU44Qkd3aXBxcVpvZlY0QSIsImkiOiI1MjU2MzczNjcwIn0.NhxngSBRfCToy4PawjVhtTjGThcBs2neMDnHGuzo6Jw,"{'__CLASS__': 'Adzuna::API::Response::Location', 'area': ['Deutschland', 'Baden-Württemberg', 'Ulm'], 'display_name': 'Ulm, Baden-Württemberg'}",Adzuna::API::Response::Job,https://www.adzuna.de/land/ad/5256373670?se=CErpK65N8BGwipqqZofV4A&utm_medium=api&utm_source=a4bcf954&v=56B8DB5DB86ADAC325F7A94708BDAB89D6790885,"Das Deutsche Register für hämatopoetische Stammzelltransplantation und Zelltherapie e. V. (DRST) ist die nationale Dokumentationszentrale für die Erfassung klinischer Basisdaten aller in Deutschland durchgeführten Blutstammzelltransplantationen und Zelltherapien. Dieser Datenbestand bildet die Grundlage für zahlreiche nationale und internationale klinische Studien. Das DRST unterstützt so die Forschung dabei, Therapien für schwerkranke Patienten zu entwickeln und zu optimieren. Zur Verstärkung …",48.383137,9.856945,,,,
"{'__CLASS__': 'Adzuna::API::Response::Company', 'display_name': 'TRUMPF SE + Co. KG'}",0,Duales Studium Bachelor of Science (B. Sc.) (w/m/d)- Wirtschaftsinformatik - 2026,2025-06-18T20:13:19Z,5256790060,"{'__CLASS__': 'Adzuna::API::Response::Category', 'tag': 'it-jobs', 'label': 'IT-Stellen'}",eyJhbGciOiJIUzI1NiJ9.eyJzIjoiQ0VycEs2NU44Qkd3aXBxcVpvZlY0QSIsImkiOiI1MjU2NzkwMDYwIn0.yIul2OeIRZqyUUa-NBis-15j3Ccj9H2z8pIwnnKNCEw,"{'__CLASS__': 'Adzuna::API::Response::Location', 'display_name': 'Ditzingen, Ludwigsburg (Kreis)', 'area': ['Deutschland', 'Baden-Württemberg', 'Ludwigsburg (Kreis)', 'Ditzingen']}",Adzuna::API::Response::Job,https://www.adzuna.de/land/ad/5256790060?se=CErpK65N8BGwipqqZofV4A&utm_medium=api&utm_source=a4bcf954&v=347CF8D7A495C7B8F70C5638988AE1C7E4F1127E,"Aufgaben Wie mutig sind Sie? Als Hochtechnologieunternehmen für Werkzeugmaschinen und Lasertechnik suchen wir Menschen, die sich neuen Herausforderungen mit frischem Denken und tatkräftigem Handeln stellen. Dafür ermöglichen wir Ihnen die Freiräume, mutige Ideen in unserem Familienunternehmen einzubringen. Gemeinsam mit Ihnen wollen wir die digitale Vernetzung der fertigenden Industrie vorantreiben. Unsere Leidenschaft und der Gestaltungswille machen uns dabei zum Garanten für Innovationskraft …",48.82434,9.06857,,,,
"{'__CLASS__': 'Adzuna::API::Response::Company', 'display_name': 'Technische Universität München '}",0,IT Systems Administrator (m/f/d) at Munich Data Science Institute,2025-05-28T10:19:40Z,5219667241,"{'tag': 'teaching-jobs', 'label': 'Lehrberufe', '__CLASS__': 'Adzuna::API::Response::Category'}",eyJhbGciOiJIUzI1NiJ9.eyJpIjoiNTIxOTY2NzI0MSIsInMiOiJDRXJwSzY1TjhCR3dpcHFxWm9mVjRBIn0.6Da1wcAENDYm1lUCNua7BrFc6ikCEFBptq3Bs4Yy8p8,"{'__CLASS__': 'Adzuna::API::Response::Location', 'display_name': 'Altstadt-Lehel, München', 'area': ['Deutschland', 'Bayern', 'München (Kreis)', 'München', 'Altstadt-Lehel']}",Adzuna::API::Response::Job,https://www.adzuna.de/land/ad/5219667241?se=CErpK65N8BGwipqqZofV4A&utm_medium=api&utm_source=a4bcf954&v=40EC2F27474CCBE942D7A1AB60E02B2BB5C05FDA,"Munich Data Science Institute (MDSI) Technische Universität MünchenTUM - Logo IT Systems Administrator (m/f/d) at Munich Data Science Institute The Munich Data Science Institute (MDSI) is an integrative research institute at the Technical University of Munich (TUM). It is interdisciplinary and cross-departmental in the fields of data science, machine learning, and artificial intelligence. The institute acts as a facilitator and multiplier of state-of-the-art data science practices, technologies…",48.14093,11.56907,,,,
"{'display_name': 'Sparkassen Rating und Risikosysteme GmbH', '__CLASS__': 'Adzuna::API::Response::Company'}",0,Werkstudent (m/w/d) – Risikomanagement | Data Science,2025-06-04T01:37:41Z,5231508793,"{'__CLASS__': 'Adzuna::API::Response::Category', 'label': 'Sonstige/Allgemeine Stellen', 'tag': 'other-general-jobs'}",eyJhbGciOiJIUzI1NiJ9.eyJzIjoiQ0VycEs2NU44Qkd3aXBxcVpvZlY0QSIsImkiOiI1MjMxNTA4NzkzIn0.sVPiuAPMao2zcoX-1HGlKDog018fVRL48gXgiaHgUHM,"{'__CLASS__': 'Adzuna::API::Response::Location', 'display_name': 'Berlin, Deutschland', 'area': ['Deutschland', 'Berlin']}",Adzuna::API::Response::Job,https://www.adzuna.de/land/ad/5231508793?se=CErpK65N8BGwipqqZofV4A&utm_medium=api&utm_source=a4bcf954&v=01D1B373582988AA7B7A2329D39248E93DB969B8,"Die Sparkassen Rating und Risikosysteme (SR) ist der zentrale Dienstleister für Verfahren des Risiko­manage­ments in der Sparkassen-Finanzgruppe. Wir unterstützen die Institute mit Standardlösungen in den Bereichen der Risiko­messung und -steuerung, der regulatorischen Banksteuerung sowie im Vertrieb mit Data-Analytics-Lösungen. Gemeinsam mit unseren Partnern bieten wir den Instituten, von der Konzeption der Verfahren, über deren Weiterentwicklung, IT-Umsetzung und Umsetzungsunterstützung, zent…",52.507706,13.420806,,,,
"{'__CLASS__': 'Adzuna::API::Response::Company', 'display_name': 'Mercedes-Benz Group AG'}",0,Praktikant*in Data Analytics/Data Science (Pflicht-Praktikum),2025-06-18T02:25:02Z,5255547100,"{'tag': 'other-general-jobs', 'label': 'Sonstige/Allgemeine Stellen', '__CLASS__': 'Adzuna::API::Response::Category'}",eyJhbGciOiJIUzI1NiJ9.eyJpIjoiNTI1NTU0NzEwMCIsInMiOiJDRXJwSzY1TjhCR3dpcHFxWm9mVjRBIn0.S4FNx9u85q1N5PyTZRMyo5opIBHXHpB33sEMU21uSRE,"{'__CLASS__': 'Adzuna::API::Response::Location', 'display_name': 'Stuttgart, Baden-Württemberg', 'area': ['Deutschland', 'Baden-Württemberg', 'Stuttgart']}",Adzuna::API::Response::Job,https://www.adzuna.de/land/ad/5255547100?se=CErpK65N8BGwipqqZofV4A&utm_medium=api&utm_source=a4bcf954&v=6A3165EA6EE78B3EAD88E052C6452E1B0B1CC8EB,"Life is always about becoming… Im Leben geht es darum, sich auf eine Reise zu begeben, um die beste Version unseres zukünftigen Selbst zu werden. Während wir Neues entdecken, stellen wir uns Herausforderungen, meistern sie und wachsen über uns hinaus. Bewerben Sie sich bei Mercedes-Benz und finden Sie den Aufgabenbereich, in dem Sie Ihre Talente individuell entfalten können. Dabei werden Sie von visionären Kolleginnen und Kollegen unterstützt, die Ihren Pioniergeist teilen. Bei uns einzusteigen…",48.776198,9.187224,,,,
"{'display_name': 'Siegwerk Druckfarben AG & Co. KGaA', '__CLASS__': 'Adzuna::API::Response::Company'}",0,Working Student Data Science (f/m/d),2025-06-14T01:31:41Z,5249526023,"{'__CLASS__': 'Adzuna::API::Response::Category', 'label': 'Sonstige/Allgemeine Stellen', 'tag': 'other-general-jobs'}",eyJhbGciOiJIUzI1NiJ9.eyJzIjoiQ0VycEs2NU44Qkd3aXBxcVpvZlY0QSIsImkiOiI1MjQ5NTI2MDIzIn0.52PEpUrwRTxDxNl_nJIwClXrWSH3Jw8nOkE9qqw0lnw,"{'display_name': 'Siegburg, Rhein-Sieg-Kreis', 'area': ['Deutschland', 'Nordrhein-Westfalen', 'Rhein-Sieg-Kreis', 'Siegburg'], '__CLASS__': 'Adzuna::API::Response::Location'}",Adzuna::API::Response::Job,https://www.adzuna.de/land/ad/5249526023?se=CErpK65N8BGwipqqZofV4A&utm_medium=api&utm_source=a4bcf954&v=AE08D23AACCFC1FDA0C1F99078BB161D3C4044C8,"Siegwerk is one of the world's leading suppliers of Printing Inks and sustainable packaging solutions. A career here will give you significant flexibility and support in a company focused on making a positive impact in the world. Siegwerk is poised to disrupt the global packaging industry; changing the way packaging is produced and consumed for the benefit of us all. At Siegwerk, you will have everything you need to help make that change. Join us, let's Do it. With Heart. Location: Alfred-Kelle…",50.79877,7.20803,,,,
