description,__CLASS__,category,title,company,latitude,id,salary_is_predicted,location,longitude,redirect_url,created,adref,contract_time,salary_max,salary_min,contract_type
"Senior Consultant Data Science (w/m/d) Job-Nr: 12025 Standorte: Karlsruhe Karrierelevel: Berufserfahrene Anstellungsart: Festanstellung Als Senior Consultant Data Science (w/m/d) wirst du Teil eines dynamischen Teams von Data-Experts, die innovative und datengesteuerte Lösungen für unsere Kunden entwickeln. Dabei arbeitest du eng mit erfahrenen Data Scientists zusammen und hast die Möglichkeit, an verschiedenen Projekten und Herausforderungen mitzuwirken. Deine Aufgaben Du bereitest komplexe Da…",Adzuna::API::Response::Job,"{'label': 'IT-Stellen', 'tag': 'it-jobs', '__CLASS__': 'Adzuna::API::Response::Category'}",Senior Consultant Data Science (w/m/d),"{'__CLASS__': 'Adzuna::API::Response::Company', 'display_name': 'KPMG'}",49.03084,5415760019,0,"{'__CLASS__': 'Adzuna::API::Response::Location', 'display_name': 'Hagsfeld, Karlsruhe', 'area': ['Deutschland', 'Baden-Württemberg', 'Karlsruhe (Kreis)', 'Karlsruhe', 'Hagsfeld']}",8.45882,https://www.adzuna.de/details/5415760019?utm_medium=api&utm_source=a4bcf954,2025-09-26T17:40:49Z,eyJhbGciOiJIUzI1NiJ9.eyJpIjoiNTQxNTc2MDAxOSIsInMiOiJMS09fRkFTZDhCR0xZT053SFFHLW9BIn0.t10B38paawOBXr3k6ogMEFvQfFRNAScr5gnJIngl0vw,,,,permanent
"Senior Consultant Data Science (w/m/d) Job-Nr: 12025 Standorte: Saarbrücken Karrierelevel: Berufserfahrene Anstellungsart: Festanstellung Als Senior Consultant Data Science (w/m/d) wirst du Teil eines dynamischen Teams von Data-Experts, die innovative und datengesteuerte Lösungen für unsere Kunden entwickeln. Dabei arbeitest du eng mit erfahrenen Data Scientists zusammen und hast die Möglichkeit, an verschiedenen Projekten und Herausforderungen mitzuwirken. Deine Aufgaben Du bereitest komplexe …",Adzuna::API::Response::Job,"{'__CLASS__': 'Adzuna::API::Response::Category', 'label': 'IT-Stellen', 'tag': 'it-jobs'}",Senior Consultant Data Science (w/m/d),"{'__CLASS__': 'Adzuna::API::Response::Company', 'display_name': 'KPMG'}",49.253,5415760022,0,"{'area': ['Deutschland', 'Saarland', 'Regionalverband Saarbrücken (Kreis)', 'Saarbrücken', 'Malstatt'], '__CLASS__': 'Adzuna::API::Response::Location', 'display_name': 'Malstatt, Saarbrücken'}",6.96191,https://www.adzuna.de/details/5415760022?utm_medium=api&utm_source=a4bcf954,2025-09-26T17:40:49Z,eyJhbGciOiJIUzI1NiJ9.eyJzIjoiTEtPX0ZBU2Q4QkdMWU9Od0hRRy1vQSIsImkiOiI1NDE1NzYwMDIyIn0.g_xK9lJMTpny-L5pDXBwGcAMygK_WVAENYFzIPs9j2U,,,,permanent
"TL;DR Join GlassDollar as a Data Science / Analytics Intern (f/m/x) and learn how to understand user value and ship tools that actually get used. From scraping real-time market data to building dashboards—you’ll work hands-on with our venture and marketing teams to drive better decisions, faster. What we´re looking for Solid Python skills You’re confident in writing clean scripts and automating data flows. Analytical thinking You can connect dots, question data, and extract what actually matter…",Adzuna::API::Response::Job,"{'tag': 'pr-advertising-marketing-jobs', 'label': 'Stellen aus PR, Werbung & Marketing', '__CLASS__': 'Adzuna::API::Response::Category'}",Data Science / Analytics intern (m/f/d),"{'__CLASS__': 'Adzuna::API::Response::Company', 'display_name': 'GlassDollar'}",52.55114,5397924988,0,"{'display_name': 'Prenzlauer Berg, Berlin', '__CLASS__': 'Adzuna::API::Response::Location', 'area': ['Deutschland', 'Berlin', 'Prenzlauer Berg']}",13.42321,https://www.adzuna.de/details/5397924988?utm_medium=api&utm_source=a4bcf954,2025-09-13T23:39:07Z,eyJhbGciOiJIUzI1NiJ9.eyJzIjoiTEtPX0ZBU2Q4QkdMWU9Od0hRRy1vQSIsImkiOiI1Mzk3OTI0OTg4In0.jDpBsb38OuA4CyZdB93UjTtWTJNc3RmXHFPBbHOcq-Y,part_time,,,
"UPLIFT Y OURFUTURE Wir sind über 13.000. An 19 Standorten weltweit. Jedes dritte Flugzeug fliegt mit unserer Technologie. Immer effizienter, leiser, nachhaltiger. Wir gestalten die Zukunft der Luftfahrt. Was wir noch brauchen? Dich. Unser Team in Hannover-Langenhagen sucht Dich: Werkstudent Data Science - Business Analytics (all genders) STARKE AUFGABEN Mitarbeit bei der Entwicklung und Umsetzung von abteilungsinternen und -übergreifenden Projekten Unterstützung bei der Dokumentation von Abläuf…",Adzuna::API::Response::Job,"{'__CLASS__': 'Adzuna::API::Response::Category', 'tag': 'pr-advertising-marketing-jobs', 'label': 'Stellen aus PR, Werbung & Marketing'}",Werkstudent Data Science - Business Analytics (all genders),"{'__CLASS__': 'Adzuna::API::Response::Company', 'display_name': 'MTU Maintenance Hannover'}",52.46704,4931314072,0,"{'area': ['Deutschland', 'Niedersachsen', 'Region Hannover (Kreis)', 'Langenhagen', 'Schulenkamp'], '__CLASS__': 'Adzuna::API::Response::Location', 'display_name': 'Schulenkamp, Langenhagen'}",9.70266,https://www.adzuna.de/details/4931314072?utm_medium=api&utm_source=a4bcf954,2024-11-08T12:49:30Z,eyJhbGciOiJIUzI1NiJ9.eyJzIjoiTEtPX0ZBU2Q4QkdMWU9Od0hRRy1vQSIsImkiOiI0OTMxMzE0MDcyIn0.gDVEb7tHWLTyJ_61oghla7uA56qK4iNSwAyWpg2gZVw,part_time,,,
"Kennziffer – WS HAN MVOS UPLIFTYOURFUTURE Wir sind über 13.000. An 19 Standorten weltweit. Jedes dritte Flugzeug fliegt mit unserer Technologie. Immer effizienter, leiser, nachhaltiger. Wir gestalten die Zukunft der Luftfahrt. Was wir noch brauchen? Dich. Unser Team in Hannover-Langenhagen sucht dich: Werkstudent Data Science - Business Analytics (all genders) Code - WS HAN MVOS STARKE AUFGABEN Mitarbeit bei der Entwicklung und Umsetzung von abteilungsinternen und -übergreifenden Projekten Unte…",Adzuna::API::Response::Job,"{'tag': 'unknown', 'label': 'Unknown', '__CLASS__': 'Adzuna::API::Response::Category'}",Werkstudent Data Science - Business Analytics (all genders),"{'display_name': 'MTU Aero Engines', '__CLASS__': 'Adzuna::API::Response::Company'}",52.44731,5202238384,0,"{'display_name': 'Langenhagen, Region Hannover (Kreis)', '__CLASS__': 'Adzuna::API::Response::Location', 'area': ['Deutschland', 'Niedersachsen', 'Region Hannover (Kreis)', 'Langenhagen']}",9.73965,https://www.adzuna.de/details/5202238384?utm_medium=api&utm_source=a4bcf954,2025-05-16T20:02:18Z,eyJhbGciOiJIUzI1NiJ9.eyJzIjoiTEtPX0ZBU2Q4QkdMWU9Od0hRRy1vQSIsImkiOiI1MjAyMjM4Mzg0In0.x69YFVW2bCrpJo0VW7n_IQbeXd2CGgOCkjJuz9ybrrE,,,,
"DIE ZEIT ist eines der führenden Angebote für anspruchsvollen Print- und Online-Journalismus in Text und Bild, für aufwendige Datenvisualisierungen und digitales Storytelling. DIE ZEIT steht für die analytische Einordnung des Weltgeschehens, meinungsstarke Kommentare, ein exzellentes visuelles Design sowie reichweitenstarke Podcasts und Videoformate. Zu der gesamten Plattform gehören ein umfassendes Portfolio an Angeboten zur Studien- und Berufsorientierung ( Berufstest , Studium-Interessentest…",Adzuna::API::Response::Job,"{'__CLASS__': 'Adzuna::API::Response::Category', 'tag': 'unknown', 'label': 'Unknown'}",Data Science Solutions Engineer (m/f/d),"{'__CLASS__': 'Adzuna::API::Response::Company', 'display_name': 'ZEIT DIGITAL'}",52.4984,5345925528,0,"{'area': ['Deutschland', 'Berlin', 'Kreuzberg'], '__CLASS__': 'Adzuna::API::Response::Location', 'display_name': 'Kreuzberg, Berlin'}",13.396,https://www.adzuna.de/details/5345925528?utm_medium=api&utm_source=a4bcf954,2025-08-09T22:36:10Z,eyJhbGciOiJIUzI1NiJ9.eyJzIjoiTEtPX0ZBU2Q4QkdMWU9Od0hRRy1vQSIsImkiOiI1MzQ1OTI1NTI4In0.E8NKfKcAvAEovlQ3dKk5lz8L3OdNCMt8Zv0xpf_Y2_Q,full_time,,,
"Werde MIDgestalter:in! Teil von MID zu sein, bedeutet MIDgestalter:in zu sein! Gemeinsam als Team – aktuell 170 Kolleg:innen – brennen wir täglich darauf, den Wandel bei unseren Kunden in zukunftsfähige Mehrwerte zu überführen. Schneller denn je ändern sich durch neue Technologien und Wettbewerb die Randbedingungen für aktuelle Geschäftsmodelle. Um erfolgreich zu sein, sollten IT-Fähigkeiten, -Strukturen, -Assets und -Prozesse mindestens genauso schnell angepasst und weiterentwickelt werden kön…",Adzuna::API::Response::Job,"{'__CLASS__': 'Adzuna::API::Response::Category', 'tag': 'unknown', 'label': 'Unknown'}",Senior Consultant (m/w/d) Data Science,"{'display_name': 'MID GmbH', '__CLASS__': 'Adzuna::API::Response::Company'}",49.44932,5348549890,0,"{'__CLASS__': 'Adzuna::API::Response::Location', 'display_name': 'Gleißbühl, Nürnberg', 'area': ['Deutschland', 'Bayern', 'Nürnberg', 'Gleißbühl']}",11.08475,https://www.adzuna.de/details/5348549890?utm_medium=api&utm_source=a4bcf954,2025-08-12T02:56:27Z,eyJhbGciOiJIUzI1NiJ9.eyJzIjoiTEtPX0ZBU2Q4QkdMWU9Od0hRRy1vQSIsImkiOiI1MzQ4NTQ5ODkwIn0.3kncf3b5vuacTM_nTz8hub14HTaUMmC59WTJ7A7np3s,full_time,,,
"Die Sparkassen Rating und Risikosysteme (SR) ist der zentrale Dienstleister für Verfahren des Risiko­manage­ments in der Sparkassen-Finanzgruppe. Wir unterstützen die Institute mit Standardlösungen in den Bereichen der Risiko­messung und-steuerung, der regulatorischen Banksteuerung sowie im Vertrieb mit Data-Analytics-Lösungen. Gemeinsam mit unseren Partnern bieten wir den Instituten, von der Konzeption der Verfahren, über deren Weiterentwicklung, IT-Umsetzung und Umsetzungsunterstützung, zentr…",Adzuna::API::Response::Job,"{'__CLASS__': 'Adzuna::API::Response::Category', 'tag': 'unknown', 'label': 'Unknown'}",Werkstudent (m/w/d) Risikomanagement / Data Science,"{'display_name': 'S Rating und Risikosysteme GmbH', '__CLASS__': 'Adzuna::API::Response::Company'}",52.52219,5383347480,0,"{'display_name': 'Mitte, Berlin', '__CLASS__': 'Adzuna::API::Response::Location', 'area': ['Deutschland', 'Berlin', 'Mitte']}",13.40933,https://www.adzuna.de/details/5383347480?utm_medium=api&utm_source=a4bcf954,2025-09-04T21:07:49Z,eyJhbGciOiJIUzI1NiJ9.eyJzIjoiTEtPX0ZBU2Q4QkdMWU9Od0hRRy1vQSIsImkiOiI1MzgzMzQ3NDgwIn0.fh6rhM7eNACfY99iQ0p203_BVoPsUePQQuFpFb0gIQc,,,,
"Du willst nicht nur analysieren, sondern mitgestalten? Dann komm in unser Team und unterstütze uns bei der datenbasierten Transformation etablierter Unternehmen im Mittelstand und Konzernumfeld. Wir entwickeln intelligente Lösungen auf Basis von Process Mining, Business Process Management und AI – und setzen diese gemeinsam mit unseren Kund:innen um. Was erwartet dich? Du führst strukturierte Recherchen und Analysen zu aktuellen Trends in Process Mining, Business Process Management und datenget…",Adzuna::API::Response::Job,"{'tag': 'consultancy-jobs', 'label': 'Beraterstellen', '__CLASS__': 'Adzuna::API::Response::Category'}",Werkstudent Process & Data Science (w/m/d),"{'display_name': 'PMMG Process Solutions', '__CLASS__': 'Adzuna::API::Response::Company'}",48.16652,5340542896,0,"{'__CLASS__': 'Adzuna::API::Response::Location', 'display_name': 'Schwabing-Freimann, München', 'area': ['Deutschland', 'Bayern', 'München (Kreis)', 'München', 'Schwabing-Freimann']}",11.59038,https://www.adzuna.de/details/5340542896?utm_medium=api&utm_source=a4bcf954,2025-08-06T22:27:53Z,eyJhbGciOiJIUzI1NiJ9.eyJpIjoiNTM0MDU0Mjg5NiIsInMiOiJMS09fRkFTZDhCR0xZT053SFFHLW9BIn0.8Ofh4IV8yiRB9hh596kd0ynJz6TvLMoJ91dj7EDSXBc,part_time,,,
"Würzburg und die Region bieten ein einzigartiges Zuhause mit besonderer Lebensqualität. Unsere Mitarbeitenden leisten täglich mit viel Energie, Engagement und einem klaren Bekenntnis zu Würzburg, in den verschiedensten Lebensbereichen einen unverzichtbaren Beitrag - persönlich, nah und individuell. Als starker, zuverlässiger Dienstleister gestalten wir die Energie- und Mobilitätswende aktiv mit und tragen tagtäglich zu mehr Nachhaltigkeit in der Region bei. Wir investieren in den Ausbau regiona…",Adzuna::API::Response::Job,"{'tag': 'unknown', 'label': 'Unknown', '__CLASS__': 'Adzuna::API::Response::Category'}",Duales Studium Data Science & Künstliche Intelligenz 2026,"{'__CLASS__': 'Adzuna::API::Response::Company', 'display_name': 'WVV'}",49.748821,5374013188,0,"{'display_name': 'Würzburg (Kreis), Bayern', '__CLASS__': 'Adzuna::API::Response::Location', 'area': ['Deutschland', 'Bayern', 'Würzburg (Kreis)']}",9.920911,https://www.adzuna.de/details/5374013188?utm_medium=api&utm_source=a4bcf954,2025-08-29T22:56:04Z,eyJhbGciOiJIUzI1NiJ9.eyJzIjoiTEtPX0ZBU2Q4QkdMWU9Od0hRRy1vQSIsImkiOiI1Mzc0MDEzMTg4In0.V3kQ1RXuZtndVUv2Ud8xNmubtrRUCqCJxN8lTKRD1ww,full_time,,,
"Deine Aufgaben Datengetriebene Transformation. Prozessintelligenz. Zukunft gestalten. Du willst nicht nur analysieren, sondern mitgestalten? Dann komm in unser Team und unterstütze uns bei der datenbasierten Transformation etablierter Unternehmen im Mittelstand und Konzernumfeld. Wir entwickeln intelligente Lösungen auf Basis von Process Mining, Business Process Management und AI – und setzen diese gemeinsam mit unseren Kund:innen um. Du führst strukturierte Recherchen und Analysen zu aktuellen…",Adzuna::API::Response::Job,"{'__CLASS__': 'Adzuna::API::Response::Category', 'tag': 'consultancy-jobs', 'label': 'Beraterstellen'}",Werkstudent Process & Data Science (w/m/d),"{'display_name': 'PMMG Group', '__CLASS__': 'Adzuna::API::Response::Company'}",48.16652,5258138815,0,"{'display_name': 'Schwabing-Freimann, München', '__CLASS__': 'Adzuna::API::Response::Location', 'area': ['Deutschland', 'Bayern', 'München (Kreis)', 'München', 'Schwabing-Freimann']}",11.59038,https://www.adzuna.de/details/5258138815?utm_medium=api&utm_source=a4bcf954,2025-06-19T15:08:45Z,eyJhbGciOiJIUzI1NiJ9.eyJpIjoiNTI1ODEzODgxNSIsInMiOiJMS09fRkFTZDhCR0xZT053SFFHLW9BIn0.frC2mWQpCJmMAYvAMEIYcveGIM9RR0zHI2ARRUdbSCY,part_time,,,
"Deine Aufgaben Datengetriebene Transformation. Prozessintelligenz. Zukunft gestalten. Du willst nicht nur analysieren, sondern mitgestalten? Dann komm in unser Team und unterstütze uns bei der datenbasierten Transformation etablierter Unternehmen im Mittelstand und Konzernumfeld. Wir entwickeln intelligente Lösungen auf Basis von Process Mining, Business Process Management und AI – und setzen diese gemeinsam mit unseren Kund:innen um. Du führst strukturierte Recherchen und Analysen zu aktuellen…",Adzuna::API::Response::Job,"{'__CLASS__': 'Adzuna::API::Response::Category', 'tag': 'unknown', 'label': 'Unknown'}",Werkstudent Process & Data Science (w/m/d),"{'__CLASS__': 'Adzuna::API::Response::Company', 'display_name': 'PMMG Process Solutions'}",48.16652,5273301446,0,"{'__CLASS__': 'Adzuna::API::Response::Location', 'display_name': 'Schwabing-Freimann, München', 'area': ['Deutschland', 'Bayern', 'München (Kreis)', 'München', 'Schwabing-Freimann']}",11.59038,https://www.adzuna.de/details/5273301446?utm_medium=api&utm_source=a4bcf954,2025-06-28T14:52:14Z,eyJhbGciOiJIUzI1NiJ9.eyJzIjoiTEtPX0ZBU2Q4QkdMWU9Od0hRRy1vQSIsImkiOiI1MjczMzAxNDQ2In0.l6NuavhGS01Wwr0p8zZg4Nt6G4bl0ez2Aq_eJhhpirg,part_time,,,
"WILLKOMMEN IM TEAM Am BASF-Standort in Schwarzheide produzieren wir nicht nur Polyurethangrundprodukte, Schaumstoffe und Lacke, sondern auch technische Kunststoffe, Veredlungschemikalien und Fungizide. So vielseitig wie unsere Produktpalette sind auch die Tätigkeiten, die es braucht, damit die Produkte hergestellt werden - unsere Mitarbeiterinnen und Mitarbeiter arbeiten bei uns am Standort in den unterschiedlichsten Fachdisziplinen zusammen: vom Ingenieurwesen bis hin zur Digitalisierung, von …",Adzuna::API::Response::Job,"{'tag': 'graduate-jobs', 'label': 'Stellen für Hochschulabsolventen', '__CLASS__': 'Adzuna::API::Response::Category'}",Praktikum Data Science in der Digitalisierung (m/w/d),"{'__CLASS__': 'Adzuna::API::Response::Company', 'display_name': 'Basf France'}",51.47465,5062249327,0,"{'area': ['Deutschland', 'Brandenburg', 'Oberspreewald-Lausitz (Kreis)', 'Schwarzheide'], 'display_name': 'Schwarzheide, Oberspreewald-Lausitz (Kreis)', '__CLASS__': 'Adzuna::API::Response::Location'}",13.86232,https://www.adzuna.de/details/5062249327?utm_medium=api&utm_source=a4bcf954,2025-02-24T18:13:01Z,eyJhbGciOiJIUzI1NiJ9.eyJzIjoiTEtPX0ZBU2Q4QkdMWU9Od0hRRy1vQSIsImkiOiI1MDYyMjQ5MzI3In0.G6Q6WeskhO7EM58s-yWJo1V_K1u3dq506bwsT0ofCSc,,,,contract
"Apply now! We are Mercedes-Benz Tech Innovation - but we don't build cars: We define the future with technology. As the largest tech company of Mercedes-Benz Group AG, around 2,500 employees in Ulm, the Stuttgart area, Berlin and Karlsruhe as well as in international tech hubs work on the technology trends of tomorrow's mobility. We are united by our enthusiasm for innovation and the latest technologies - combined with the conviction that individual freedom and personal responsibility are cruci…",Adzuna::API::Response::Job,"{'__CLASS__': 'Adzuna::API::Response::Category', 'label': 'IT-Stellen', 'tag': 'it-jobs'}",Working Student Data Science (m/f/x),"{'display_name': 'Mercedes-Benz Tech Innovation', '__CLASS__': 'Adzuna::API::Response::Company'}",48.776198,5387260450,0,"{'area': ['Deutschland', 'Baden-Württemberg', 'Stuttgart'], 'display_name': 'Stuttgart, Baden-Württemberg', '__CLASS__': 'Adzuna::API::Response::Location'}",9.187224,https://www.adzuna.de/details/5387260450?utm_medium=api&utm_source=a4bcf954,2025-09-06T23:08:40Z,eyJhbGciOiJIUzI1NiJ9.eyJzIjoiTEtPX0ZBU2Q4QkdMWU9Od0hRRy1vQSIsImkiOiI1Mzg3MjYwNDUwIn0.W3PY5JytNj8aT3EOQuX7h_yZgcNxkcUiqjBNSvN1Sk8,part_time,,,
"Die CINTELLIC Consulting Group ist eine der führenden Unternehmensberatungen für das digitale Kundenmanagement. Wir treiben bei DAX-Konzernen und renommierten Mittelständlern die Digitalisierung voran und helfen Umsätze und Erträge zu steigern. Wir arbeiten ergebnisfokussiert und setzen unser exzellentes Know-how im Zusammenspiel von Business, Data und Technology ein. Du findest bei uns karrierestarke Jobs im Consulting in einem Team ohne Ellenbogen. Werde Teil unseres Teams, begleiten aktiv di…",Adzuna::API::Response::Job,"{'__CLASS__': 'Adzuna::API::Response::Category', 'tag': 'consultancy-jobs', 'label': 'Beraterstellen'}",Senior Consultant Data Science (m/w/d),"{'display_name': 'der CINTELLIC Consulting Group', '__CLASS__': 'Adzuna::API::Response::Company'}",,4987114594,0,"{'__CLASS__': 'Adzuna::API::Response::Location', 'display_name': 'Deutschland', 'area': ['Deutschland']}",,https://www.adzuna.de/details/4987114594?utm_medium=api&utm_source=a4bcf954,2024-12-23T12:52:41Z,eyJhbGciOiJIUzI1NiJ9.eyJpIjoiNDk4NzExNDU5NCIsInMiOiJMS09fRkFTZDhCR0xZT053SFFHLW9BIn0.mwEYQ5K3lzRJUzLeeMgiJ8ipgFZdualK_LSD0CdSh1w,full_time,,,
"Dein Aufgabengebiet Lead and mentor a multidisciplinary team of 10 experts (bioinformatics, biomathematics, physics, medicinal chemistry) to foster innovation and scientific excellence Drive initiatives leveraging large-scale internal and external omics datasets in oncology to uncover novel insights (disease mechanisms, targets, biomarkers) Design, optimize, and manage bioinformatics pipelines and high-throughput workflows Ensure data quality, integrity, reproducibility, and compliance with reg…",Adzuna::API::Response::Job,"{'__CLASS__': 'Adzuna::API::Response::Category', 'label': 'Beraterstellen', 'tag': 'consultancy-jobs'}",Director Computational Biology & Data Science (gn) (gn),"{'__CLASS__': 'Adzuna::API::Response::Company', 'display_name': 'Vality One Recruitment GmbH'}",53.557429,5412287434,0,"{'display_name': 'Hamburg, Deutschland', '__CLASS__': 'Adzuna::API::Response::Location', 'area': ['Deutschland', 'Hamburg']}",9.987297,https://www.adzuna.de/details/5412287434?utm_medium=api&utm_source=a4bcf954,2025-09-23T19:53:36Z,eyJhbGciOiJIUzI1NiJ9.eyJpIjoiNTQxMjI4NzQzNCIsInMiOiJMS09fRkFTZDhCR0xZT053SFFHLW9BIn0.6qeGtJ6HTkyHqv_uV5ZTmM-4YI1ftqCs2BQBFKGk3wM,,,,
"Deine Aufgaben Duale Power für die digitale Zukunft: Entfalte dein Potential, indem du dir wirtschaftsinformatisches Fachwissen aneignest und gestalte aktiv den Bereich Logistik mit. … konkret heißt das: Dreijähriges duales Studium ab Herbst 2026 mit Wechsel zwischen der dreimonatigen Theoriephase an der DHBW Heilbronn und der Praxisphase bei der Lidl Stiftung Vermittlung von Methoden und Technologien der Informatik sowie Data Analysis, Big Data und Machine Learning an der DHBW im Vordergrund P…",Adzuna::API::Response::Job,"{'label': 'Stellen aus Logistik & Lagerhaltung', '__CLASS__': 'Adzuna::API::Response::Category', 'tag': 'logistics-warehouse-jobs'}",Duales Studium Wirtschaftsinformatik - Data Science 2026 in Neckarsulm,"{'display_name': 'Lidl Stiftung', '__CLASS__': 'Adzuna::API::Response::Company'}",,5373364141,0,"{'display_name': 'Deutschland', '__CLASS__': 'Adzuna::API::Response::Location', 'area': ['Deutschland']}",,https://www.adzuna.de/details/5373364141?utm_medium=api&utm_source=a4bcf954,2025-08-29T14:57:18Z,eyJhbGciOiJIUzI1NiJ9.eyJpIjoiNTM3MzM2NDE0MSIsInMiOiJFRVlqRmdTZDhCR1kycy1OVGtnS3d3In0.sWPB5qWED07bYsbt7WnF2d_NOQAvGlG_Okt78g4Y49E,full_time,,,
"Weil das intelligente Netz nicht länger warten kann: Bei EWE NETZ betreiben wir sichere und hochmoderne Infrastrukturen für Strom, Wärme, Gas, Telekommunikation sowie Trinkwasser und gewährleisten so die zuverlässige Versorgung unserer Regionen. Werde Teil unserer Mission und wachse mit uns. Aufgaben Oldenburg & remote Start: ab 16. Oktober 2025 Teilzeit (15-18 Std./Woche) Du willst mehr als nur Theorie? Du möchtest mit Daten arbeiten, Lösungen für die Stromnetze der Zukunft entwickeln und die …",Adzuna::API::Response::Job,"{'label': 'Sonstige/Allgemeine Stellen', 'tag': 'other-general-jobs', '__CLASS__': 'Adzuna::API::Response::Category'}",Werkstudent (w/d/m) Bereich Geschäftsfeldentwicklung,"{'display_name': 'EWE NETZ GmbH', '__CLASS__': 'Adzuna::API::Response::Company'}",53.147169,5416111754,0,"{'display_name': 'Oldenburg, Oldenburg (Kreis)', '__CLASS__': 'Adzuna::API::Response::Location', 'area': ['Deutschland', 'Niedersachsen', 'Oldenburg (Kreis)', 'Oldenburg']}",8.218802,https://www.adzuna.de/land/ad/5416111754?se=EEYjFgSd8BGY2s-NTkgKww&utm_medium=api&utm_source=a4bcf954&v=D6046B263746FC770B17C5B2826E6F46FA9C2026,2025-09-26T20:36:29Z,eyJhbGciOiJIUzI1NiJ9.eyJzIjoiRUVZakZnU2Q4QkdZMnMtTlRrZ0t3dyIsImkiOiI1NDE2MTExNzU0In0.IGmemiU5aEoNdDpJX0mq9KXqfA7VrBHBGIv5nYm2NNA,,,,
"Kunden. Gemeinsam. Entwickeln. Die Windhoff Group führt als IT-Dienstleister seit 1997 deutschlandweit Beratungsprojekte bei führenden Großunternehmen durch. Gewinne mit uns Neukunden im gehobenen Mittelstand und Konzernumfeld und werde Teil unseres wachsenden Unternehmens mit derzeit rund 300 Mitarbeitenden! Dich erwartet ein freundschaftliches Miteinander , ein jährliches Weiterbildungsbudget von über 2000 Euro , bis zu 40 Tage Urlaub im Jahr, ein Firmenwagen und vieles mehr! Neben unserer fa…",Adzuna::API::Response::Job,"{'tag': 'sales-jobs', '__CLASS__': 'Adzuna::API::Response::Category', 'label': 'Vertriebsstellen'}",Sales Manager (m/w/d) Data & Analytics,"{'display_name': 'Windhoff Group', '__CLASS__': 'Adzuna::API::Response::Company'}",48.377667,5394355658,0,"{'area': ['Deutschland', 'Bayern', 'Neu-Ulm (Kreis)', 'Neu-Ulm'], '__CLASS__': 'Adzuna::API::Response::Location', 'display_name': 'Neu-Ulm, Neu-Ulm (Kreis)'}",10.046201,https://www.adzuna.de/land/ad/5394355658?se=EEYjFgSd8BGY2s-NTkgKww&utm_medium=api&utm_source=a4bcf954&v=06E4C7197254C7AAD7F07438C190EEAD0818DDF6,2025-09-11T20:08:24Z,eyJhbGciOiJIUzI1NiJ9.eyJzIjoiRUVZakZnU2Q4QkdZMnMtTlRrZ0t3dyIsImkiOiI1Mzk0MzU1NjU4In0.50fTb3G48kb9squrIZCPQOWocT7CBbOaaEfLihTx7ms,,,,
"WILLKOMMEN IM TEAM Wir sind die globale Inhouse Managementberatung der BASF. Unser Schwerpunkt liegt auf strategischen Projekten, mit denen wir wirkungsvoll Veränderungsprozesse vorantreiben. Dabei reicht unser Themenspektrum von Wachstums-, Organisationsentwicklungs- und Effizienzprojekten bis hin zu Akquisitionen und Devestitionen. Wir leben einen starken Teamspirit und fördern aktiv die Karriereentwicklung innerhalb der BASF. AUFGABEN Zum nächstmöglichen Zeitpunkt sind Sie für einen Zeitraum…",Adzuna::API::Response::Job,"{'label': 'Stellen für Hochschulabsolventen', 'tag': 'graduate-jobs', '__CLASS__': 'Adzuna::API::Response::Category'}",Praktikum Management Consulting im Bereich Data Science / Data Analytics (m/w/d),"{'display_name': 'Basf France', '__CLASS__': 'Adzuna::API::Response::Company'}",49.47766,4571173892,0,"{'__CLASS__': 'Adzuna::API::Response::Location', 'display_name': 'Mitte, Ludwigshafen am Rhein', 'area': ['Deutschland', 'Rheinland-Pfalz', 'Ludwigshafen am Rhein', 'Mitte']}",8.43196,https://www.adzuna.de/details/4571173892?utm_medium=api&utm_source=a4bcf954,2024-02-16T11:00:56Z,eyJhbGciOiJIUzI1NiJ9.eyJpIjoiNDU3MTE3Mzg5MiIsInMiOiJFRVlqRmdTZDhCR1kycy1OVGtnS3d3In0.HiCLgi5-w3hPFNqwmTepadfQTiSs9vztuBPNnFPH0HY,,,,contract
"Life is always about becoming… Im Leben geht es darum, sich auf eine Reise zu begeben, um die beste Version unseres zukünftigen Selbst zu werden. Während wir Neues entdecken, stellen wir uns Herausforderungen, meistern sie und wachsen über uns hinaus. Bewerben Sie sich bei Mercedes-Benz und finden Sie den Aufgabenbereich, in dem Sie Ihre Talente individuell entfalten können. Dabei werden Sie von visionären Kolleginnen und Kollegen unterstützt, die Ihren Pioniergeist teilen. Bei uns einzusteigen…",Adzuna::API::Response::Job,"{'tag': 'other-general-jobs', '__CLASS__': 'Adzuna::API::Response::Category', 'label': 'Sonstige/Allgemeine Stellen'}",Student*in für Abschlussarbeit für die Entwicklung eines KI-gestützten Tools zur Generierung von Interieurdesigns,"{'__CLASS__': 'Adzuna::API::Response::Company', 'display_name': 'Mercedes-Benz AG'}",48.720071,5417036530,0,"{'area': ['Deutschland', 'Baden-Württemberg', 'Böblingen (Kreis)', 'Sindelfingen'], 'display_name': 'Sindelfingen, Böblingen (Kreis)', '__CLASS__': 'Adzuna::API::Response::Location'}",9.026231,https://www.adzuna.de/land/ad/5417036530?se=EEYjFgSd8BGY2s-NTkgKww&utm_medium=api&utm_source=a4bcf954&v=E1BC6BD1E59CC4B6A7DD9546EC5CB15E4F92CAD3,2025-09-27T08:32:50Z,eyJhbGciOiJIUzI1NiJ9.eyJzIjoiRUVZakZnU2Q4QkdZMnMtTlRrZ0t3dyIsImkiOiI1NDE3MDM2NTMwIn0.0GWAWv6vNTFHkDXh6p7VFxjbfegwTNEqn8ajh5ngJLM,,,,
