location,description,salary_is_predicted,adref,category,created,id,company,longitude,__CLASS__,title,latitude,redirect_url,contract_time,contract_type,salary_max,salary_min
"{'area': ['Deutschland', 'Sachsen', 'Dresden'], '__CLASS__': 'Adzuna::API::Response::Location', 'display_name': 'Dresden, Sachsen'}","Für den Weltmarkt projektieren und fertigen wir Hochspannungs- und Hochstromprüfsysteme zur Prüfung von Energiekabeln, Hochspannungstransformatoren und weiteren Geräten der elektrischen Energieübertragung. Mit unseren innovativen Produkten und digitalen Lösungen unterstützen wir den Netzausbau für eine nachhaltige Energieversorgung. Wir eröffnen Ihnen als Unternehmen in der REINHAUSEN Gruppe vielfältige Möglichkeiten in einer zukunftsorientierten Branche. HIGHVOLT - where Power meets Passion. F…",0,eyJhbGciOiJIUzI1NiJ9.eyJzIjoiSmpVS3luNUw4QkdZMWJlUC0wc0pxQSIsImkiOiI1MjIwMjYwMDgzIn0.Db8p3Wy3p_DjHH0B9RbgLuej2jbmS2MLYO18HV-8WXM,"{'tag': 'engineering-jobs', '__CLASS__': 'Adzuna::API::Response::Category', 'label': 'Technikerstellen'}",2025-05-28T19:48:24Z,5220260083,"{'__CLASS__': 'Adzuna::API::Response::Company', 'display_name': 'HIGHVOLT Prüftechnik Dresden GmbH'}",13.756452,Adzuna::API::Response::Job,Entwicklungsingenieur (m/w/d) im Bereich Messtechnik / Data Science,51.052725,https://www.adzuna.de/land/ad/5220260083?se=JjUKyn5L8BGY1beP-0sJqA&utm_medium=api&utm_source=a4bcf954&v=944165EBAFFAE24950EE145AF4FE32E936AFC887,,,,
"{'area': ['Deutschland', 'Baden-Württemberg', 'Ostalbkreis', 'Oberkochen'], 'display_name': 'Oberkochen, Ostalbkreis', '__CLASS__': 'Adzuna::API::Response::Location'}","Sich etwas Neues trauen, über sich hinauswachsen und dabei die Grenzen des Machbaren neu definieren. Genau das ist es, was unsere Mitarbeitenden täglich leben dürfen und sollen. Um mit unseren Innovationen ein Zeichen zu setzen und Großartiges zu ermöglichen. Denn hinter jedem erfolgreichen Unternehmen stehen eine ganze Menge faszinierende Menschen. In einem offenen und modernen Umfeld mit zahlreichen Entwicklungs- und Weiterbildungsmöglichkeiten, arbeiten die Mitarbeitenden bei ZEISS in einer …",0,eyJhbGciOiJIUzI1NiJ9.eyJpIjoiNTI1MzQzODQ0NyIsInMiOiJKalVLeW41TDhCR1kxYmVQLTBzSnFBIn0.rE6mNQmByxtwPdwCDOGIR29pijkI1I5BaxLkLVmrNF8,"{'__CLASS__': 'Adzuna::API::Response::Category', 'label': 'Unknown', 'tag': 'unknown'}",2025-06-16T20:06:44Z,5253438447,"{'__CLASS__': 'Adzuna::API::Response::Company', 'display_name': 'ZEISS'}",10.10558,Adzuna::API::Response::Job,"Duales Studium – Data Science und Künstliche Intelligenz (m/w/x), Beginn Herbst 2026",48.78408,https://www.adzuna.de/land/ad/5253438447?se=JjUKyn5L8BGY1beP-0sJqA&utm_medium=api&utm_source=a4bcf954&v=50E2C0D4A1CFCB8642D2088C7A63EF2D13EFBD90,,,,
"{'area': ['Deutschland', 'Niedersachsen', 'Salzgitter'], '__CLASS__': 'Adzuna::API::Response::Location', 'display_name': 'Salzgitter, Niedersachsen'}","Möchten Sie Ihre Ideen in nutzbringende und sinnvolle Technologien verwandeln? Ob im Bereich Mobility Solutions, Consumer Goods, Industrial Technology oder Energy and Building Technology - mit uns verbessern Sie die Lebensqualität der Menschen auf der ganzen Welt. Willkommen bei Bosch. Die Robert Bosch Elektronik GmbH freut sich auf Ihre Bewerbung! Anstellungsart: Befristet Arbeitszeit: Vollzeit Arbeitsort: Salzgitter Aufgaben Wir suchen eine engagierte Persönlichkeit, die Teil unseres Projektt…",0,eyJhbGciOiJIUzI1NiJ9.eyJzIjoiSmpVS3luNUw4QkdZMWJlUC0wc0pxQSIsImkiOiI1MjQwODkwOTg2In0.UE7zjdTSZQUolLiYuGDKgW89U9U88MwVSp1wfgi9ozE,"{'tag': 'scientific-qa-jobs', '__CLASS__': 'Adzuna::API::Response::Category', 'label': 'Stellen aus Wissenschaft & Qualitätssicherung'}",2025-06-09T08:06:40Z,5240890986,"{'__CLASS__': 'Adzuna::API::Response::Company', 'display_name': 'Bosch Gruppe'}",10.373516,Adzuna::API::Response::Job,Pflichtpraktikum in den Bereichen Wasserstoffcampus und energieorientiertes Data Science,52.120502,https://www.adzuna.de/land/ad/5240890986?se=JjUKyn5L8BGY1beP-0sJqA&utm_medium=api&utm_source=a4bcf954&v=C0F8D1DED804AD09C017986B74D27460ED794985,,,,
"{'area': ['Deutschland', 'Bayern', 'Dingolfing-Landau (Kreis)', 'Dingolfing'], 'display_name': 'Dingolfing, Dingolfing-Landau (Kreis)', '__CLASS__': 'Adzuna::API::Response::Location'}","Mit unseren Marken BMW, MINI, Rolls-Royce und BMW Motorrad sind wir einer der weltweit führenden Premium-Hersteller von Automobilen sowie Motorrädern und darüber hinaus Anbieter von Premium-Finanz- und Mobilitätsdienstleistungen. Für den Unternehmensbereich am Standort Dingolfing suchen wir Sie als Dualer Student Data Science & Scientific Computing (w/m/x) Aufgaben Du liebst es, Ursachen für Probleme zu entdecken und Lösungen zu finden und möchtest an Zukunftsthemen arbeiten? Du hast eine Leide…",0,eyJhbGciOiJIUzI1NiJ9.eyJpIjoiNTE4MTY3MjA5NSIsInMiOiJKalVLeW41TDhCR1kxYmVQLTBzSnFBIn0.jdPSdbCscudv-ajaeRNYnZLwChujCygDfswBFY0UFbY,"{'label': 'Unknown', '__CLASS__': 'Adzuna::API::Response::Category', 'tag': 'unknown'}",2025-05-05T19:22:21Z,5181672095,"{'__CLASS__': 'Adzuna::API::Response::Company', 'display_name': 'BMW Group'}",12.49782,Adzuna::API::Response::Job,Dualer Student Data Science & Scientific Computing (w/m/x),48.62848,https://www.adzuna.de/land/ad/5181672095?se=JjUKyn5L8BGY1beP-0sJqA&utm_medium=api&utm_source=a4bcf954&v=51839DCB8391F1AE9399BEA67A993842230B0A9C,,,,
"{'__CLASS__': 'Adzuna::API::Response::Location', 'display_name': 'Neckarsulm, Heilbronn (Kreis)', 'area': ['Deutschland', 'Baden-Württemberg', 'Heilbronn (Kreis)', 'Neckarsulm']}","Eine gute Idee war der Ursprung, ein erfolgreiches Konzept ist das Ergebnis. Qualität zum guten Preis möglichst vielen Menschen anbieten zu können treibt uns an - mittlerweile weltweit, denn wir sind Lidl. Hier ist das berufliche Zuhause vielfältiger Talente. Ob im Einkauf, in der Logistik, im Warengeschäft oder in der IT; ob als Impulsgeber, Gestalter oder Dienstleister der Länder. Wir suchen Anpacker, Durchstarter, Möglichmacher und bieten spannende Aufgaben und Projekte in einem dynamischen …",0,eyJhbGciOiJIUzI1NiJ9.eyJzIjoiSmpVS3luNUw4QkdZMWJlUC0wc0pxQSIsImkiOiI1MTk2NTk5MDcxIn0.D2693AhDiFTD76WY_EhNT_M3afEZTxIslahzJN9zgPk,"{'tag': 'scientific-qa-jobs', 'label': 'Stellen aus Wissenschaft & Qualitätssicherung', '__CLASS__': 'Adzuna::API::Response::Category'}",2025-05-13T19:32:53Z,5196599071,"{'__CLASS__': 'Adzuna::API::Response::Company', 'display_name': 'Lidl Stiftung & Co. KG'}",9.2274,Adzuna::API::Response::Job,Praktikum Data Science,49.18975,https://www.adzuna.de/land/ad/5196599071?se=JjUKyn5L8BGY1beP-0sJqA&utm_medium=api&utm_source=a4bcf954&v=B05D2F43BE90D34C617E73D32CA793E4E1837E9E,,,,
"{'area': ['Deutschland', 'Nordrhein-Westfalen', 'Düsseldorf'], '__CLASS__': 'Adzuna::API::Response::Location', 'display_name': 'Düsseldorf, Nordrhein-Westfalen'}","When travelers are searching for a hotel, we want the obvious choice to be trivago! Our leading metasearch engine is super fast and constantly optimized – enabling millions of travelers to compare hotel prices from hundreds of booking sites and find great deals in just a few clicks. We use cutting-edge technology, real-time auction, and machine learning techniques with petabytes of data to create an experience – time and money saved! In the lively city of Düsseldorf, we seize opportunities to l…",0,eyJhbGciOiJIUzI1NiJ9.eyJpIjoiNTIyMTE5MTIwNyIsInMiOiJKalVLeW41TDhCR1kxYmVQLTBzSnFBIn0.leqvv4RVBI3bDyciSnMMTxOBEHxqkq8dSmVGeG30Aro,"{'tag': 'scientific-qa-jobs', 'label': 'Stellen aus Wissenschaft & Qualitätssicherung', '__CLASS__': 'Adzuna::API::Response::Category'}",2025-05-29T07:53:45Z,5221191207,"{'display_name': 'trivago N.V.', '__CLASS__': 'Adzuna::API::Response::Company'}",6.808387,Adzuna::API::Response::Job,Data Science Lead - Price,51.226802,https://www.adzuna.de/land/ad/5221191207?se=JjUKyn5L8BGY1beP-0sJqA&utm_medium=api&utm_source=a4bcf954&v=98645105F045E80C016B917754C84A02C09FDF07,,,,
"{'display_name': 'Ulm, Baden-Württemberg', '__CLASS__': 'Adzuna::API::Response::Location', 'area': ['Deutschland', 'Baden-Württemberg', 'Ulm']}","Life is always about becoming… Im Leben geht es darum, sich auf eine Reise zu begeben, um die beste Version unseres zukünftigen Selbst zu werden. Während wir Neues entdecken, stellen wir uns Herausforderungen, meistern sie und wachsen über uns hinaus. Bewerben Sie sich bei Mercedes-Benz und finden Sie den Aufgabenbereich, in dem Sie Ihre Talente individuell entfalten können. Dabei werden Sie von visionären Kolleginnen und Kollegen unterstützt, die Ihren Pioniergeist teilen. Bei uns einzusteigen…",0,eyJhbGciOiJIUzI1NiJ9.eyJzIjoiSmpVS3luNUw4QkdZMWJlUC0wc0pxQSIsImkiOiI1MjE5NTE4MTg0In0.njj5l1RgEQncU8JIbnoGbU4zw5jJTlbhMNpQnjQBa64,"{'tag': 'scientific-qa-jobs', 'label': 'Stellen aus Wissenschaft & Qualitätssicherung', '__CLASS__': 'Adzuna::API::Response::Category'}",2025-05-28T07:47:05Z,5219518184,"{'display_name': 'Mercedes-Benz Tech Innovation', '__CLASS__': 'Adzuna::API::Response::Company'}",9.856945,Adzuna::API::Response::Job,Werkstudent Data Science im Bereich Fahrzeugdiagnose (m/w/d),48.383137,https://www.adzuna.de/land/ad/5219518184?se=JjUKyn5L8BGY1beP-0sJqA&utm_medium=api&utm_source=a4bcf954&v=42F75465F5B4BA6EF2DBF8E83732084E63E842C1,,,,
"{'__CLASS__': 'Adzuna::API::Response::Location', 'display_name': 'Sindelfingen, Böblingen (Kreis)', 'area': ['Deutschland', 'Baden-Württemberg', 'Böblingen (Kreis)', 'Sindelfingen']}","Life is always about becoming… Im Leben geht es darum, sich auf eine Reise zu begeben, um die beste Version unseres zukünftigen Selbst zu werden. Während wir Neues entdecken, stellen wir uns Herausforderungen, meistern sie und wachsen über uns hinaus. Bewerben Sie sich bei Mercedes-Benz und finden Sie den Aufgabenbereich, in dem Sie Ihre Talente individuell entfalten können. Dabei werden Sie von visionären Kolleginnen und Kollegen unterstützt, die Ihren Pioniergeist teilen. Bei uns einzusteigen…",0,eyJhbGciOiJIUzI1NiJ9.eyJzIjoiSmpVS3luNUw4QkdZMWJlUC0wc0pxQSIsImkiOiI1MjEzODYwMDI4In0.LKN48-Yw2xF2I7AtrO1M9RzjVu1kjKEvW4TjWDsI__E,"{'tag': 'scientific-qa-jobs', 'label': 'Stellen aus Wissenschaft & Qualitätssicherung', '__CLASS__': 'Adzuna::API::Response::Category'}",2025-05-24T07:39:49Z,5213860028,"{'display_name': 'Mercedes-Benz AG', '__CLASS__': 'Adzuna::API::Response::Company'}",9.026231,Adzuna::API::Response::Job,Praktikant*in Data Analytics/Data Science,48.720071,https://www.adzuna.de/land/ad/5213860028?se=JjUKyn5L8BGY1beP-0sJqA&utm_medium=api&utm_source=a4bcf954&v=A0B67FD174DDEF1EC2CC55A4AC0CAEF7F84AC25F,,,,
"{'area': ['Deutschland', 'Baden-Württemberg', 'Heilbronn (Kreis)', 'Heilbronn'], '__CLASS__': 'Adzuna::API::Response::Location', 'display_name': 'Heilbronn, Heilbronn (Kreis)'}","Du willst mehr als Uni und möchtest erste Berufseinblicke und Kontakte knüpfen? Dann bist du hier richtig! Als Werkstudent oder Praktikant bei Kaufland gehörst du von Beginn an zu einem starken Team und kannst zeigen, was in dir steckt. Werde auch du Teil von teamkaufland! Aufgaben Wir zählen auf dich: Du unterstützt unser Team bei der Bearbeitung unserer Analytics Use Cases entlang der gesamten Wertschöpfungskette bei Kaufland. Vielfältige Aufgaben? Na klar: Lerne unsere Projekte und Arbeitswe…",0,eyJhbGciOiJIUzI1NiJ9.eyJzIjoiSmpVS3luNUw4QkdZMWJlUC0wc0pxQSIsImkiOiI1MjIwMjY0ODg0In0.8BqLVOab5-GJ9DWOGtyYf78PtPUIbA7hpjwhV_G5kc4,"{'tag': 'scientific-qa-jobs', '__CLASS__': 'Adzuna::API::Response::Category', 'label': 'Stellen aus Wissenschaft & Qualitätssicherung'}",2025-05-28T19:50:11Z,5220264884,"{'__CLASS__': 'Adzuna::API::Response::Company', 'display_name': 'Kaufland'}",9.209895,Adzuna::API::Response::Job,Praktikant Data Science (m/w/d),49.142335,https://www.adzuna.de/land/ad/5220264884?se=JjUKyn5L8BGY1beP-0sJqA&utm_medium=api&utm_source=a4bcf954&v=E5D9C0F42BD4B2D101CC5446F52C0F73D1C57AE4,,,,
"{'area': ['Deutschland', 'Nordrhein-Westfalen', 'Düsseldorf', 'Bilk'], '__CLASS__': 'Adzuna::API::Response::Location', 'display_name': 'Bilk, Düsseldorf'}","When travelers are searching for a hotel, we want the obvious choice to be trivago! By comparing prices from major booking sites, we're making it easy for people to find hotels they want at a price they’ll love. In the lively city of Düsseldorf, we seize opportunities to learn everyday, innovate, and make an enduring mark on the travel industry. A career at trivago is a journey designed for people who crave continuous development and want to thrive in a high-performing team. Here you will find …",0,eyJhbGciOiJIUzI1NiJ9.eyJpIjoiNTIxMDU1MDkyMyIsInMiOiJKalVLeW41TDhCR1kxYmVQLTBzSnFBIn0.aFziZ0U90mnrzxCBOktnDCi4mI6MAkx4irUjK4NZ-1w,"{'label': 'Unknown', '__CLASS__': 'Adzuna::API::Response::Category', 'tag': 'unknown'}",2025-05-22T11:45:02Z,5210550923,"{'display_name': 'trivago', '__CLASS__': 'Adzuna::API::Response::Company'}",6.78055,Adzuna::API::Response::Job,Data Science Lead - Price,51.20259,https://www.adzuna.de/land/ad/5210550923?se=JjUKyn5L8BGY1beP-0sJqA&utm_medium=api&utm_source=a4bcf954&v=04BDEBBBCF947A1D4B0320827A6F55746CD3D03B,,,,
"{'area': ['Deutschland', 'Niedersachsen', 'Region Hannover (Kreis)', 'Hannover'], '__CLASS__': 'Adzuna::API::Response::Location', 'display_name': 'Hannover, Region Hannover (Kreis)'}","Hannover Rück – rund 3.900 Mitarbeiter:innen an Standorten auf der ganzen Welt. Unsere Stärke? Connecting Power: Wir verlassen uns auf­einander. Als Rück­versicherer sichern wir Kunden im Schaden­fall ab. Dafür braucht es maß­geschneiderte, innovative Lösungen. Lösungen, die gestern noch gepasst haben, können morgen ver­altet sein. Wir challengen uns und optimieren konti­nuierlich unsere Services, Beratungen und Pro­dukte. All das macht uns zu einer der führenden und profi­tabelsten Rück­versic…",0,eyJhbGciOiJIUzI1NiJ9.eyJpIjoiNTE5NjU5OTAxOCIsInMiOiJKalVLeW41TDhCR1kxYmVQLTBzSnFBIn0.qgYRCFfxeacMCRi9sLSMiTLshystPjWxhw74kl9nlTs,"{'label': 'Unknown', '__CLASS__': 'Adzuna::API::Response::Category', 'tag': 'unknown'}",2025-05-13T19:32:52Z,5196599018,"{'__CLASS__': 'Adzuna::API::Response::Company', 'display_name': 'Hannover Rück SE'}",9.742751,Adzuna::API::Response::Job,Trainee Mathematik Personen-Rückversicherung Fokus Data Science,52.378818,https://www.adzuna.de/land/ad/5196599018?se=JjUKyn5L8BGY1beP-0sJqA&utm_medium=api&utm_source=a4bcf954&v=DF87DEAFDBA82D6A67B5C2B21156D28117C34E72,,,,
"{'area': ['Deutschland', 'Berlin'], '__CLASS__': 'Adzuna::API::Response::Location', 'display_name': 'Berlin, Deutschland'}","Die Sparkassen Rating und Risikosysteme (SR) ist der zentrale Dienstleister für Verfahren des Risiko­manage­ments in der Sparkassen-Finanzgruppe. Wir unterstützen die Institute mit Standardlösungen in den Bereichen der Risiko­messung und -steuerung, der regulatorischen Banksteuerung sowie im Vertrieb mit Data-Analytics-Lösungen. Gemeinsam mit unseren Partnern bieten wir den Instituten, von der Konzeption der Verfahren, über deren Weiterentwicklung, IT-Umsetzung und Umsetzungsunterstützung, zent…",0,eyJhbGciOiJIUzI1NiJ9.eyJzIjoiSmpVS3luNUw4QkdZMWJlUC0wc0pxQSIsImkiOiI1MjMxMzAyNzk5In0.jn-OtdUg1y9kntbhIpvWy5njPZzXbZ0eq7_bRaCCakw,"{'__CLASS__': 'Adzuna::API::Response::Category', 'label': 'Unknown', 'tag': 'unknown'}",2025-06-03T21:40:26Z,5231302799,"{'display_name': 'Sparkassen Rating und Risikosysteme GmbH', '__CLASS__': 'Adzuna::API::Response::Company'}",13.420806,Adzuna::API::Response::Job,Werkstudent (m/w/d) – Risikomanagement | Data Science,52.507706,https://www.adzuna.de/land/ad/5231302799?se=JjUKyn5L8BGY1beP-0sJqA&utm_medium=api&utm_source=a4bcf954&v=325E1FF72791C60121772B37ECDB0E91EEC9666C,,,,
"{'area': ['Deutschland', 'Thüringen', 'Jena'], 'display_name': 'Jena, Thüringen', '__CLASS__': 'Adzuna::API::Response::Location'}","Durch unser weltweites Netzwerk können wir Ihnen attraktive Herausforderungen, außergewöhnliche Karriereperspektiven und die ganze Vielfalt des Engineerings und IT bieten. Allein in der DACH-CZ Region verfügen wir über 40 Niederlassungen, zwei Entwicklungszentren und weltweit 120 Standorte mit mehr als 12.000 Mitarbeitern in über 40 Ländern. Mehr als 45 Jahre international erfolgreich und über 25 Jahre in Deutschland. Stillstand bedeutet für uns Rückschritt - für Sie auch? Dann bewerben Sie sic…",0,eyJhbGciOiJIUzI1NiJ9.eyJzIjoiSmpVS3luNUw4QkdZMWJlUC0wc0pxQSIsImkiOiI1MjExOTcwNjkxIn0.0AaYurt9OxIpDrO3GiHYjupUkiW2bQDupHNIzpL0Phc,"{'tag': 'it-jobs', '__CLASS__': 'Adzuna::API::Response::Category', 'label': 'IT-Stellen'}",2025-05-23T07:38:33Z,5211970691,"{'__CLASS__': 'Adzuna::API::Response::Company', 'display_name': 'Brunel GmbH'}",11.589469,Adzuna::API::Response::Job,Software Ingenieur Data Science (m/w/d),50.923007,https://www.adzuna.de/land/ad/5211970691?se=JjUKyn5L8BGY1beP-0sJqA&utm_medium=api&utm_source=a4bcf954&v=EBDD7BDADC989AAED3EBBEAFDBEFA9EAAD89B807,,,,
"{'__CLASS__': 'Adzuna::API::Response::Location', 'display_name': 'Deutschland', 'area': ['Deutschland']}","Siegwerk is one of the world's leading suppliers of Printing Inks and sustainable packaging solutions. A career here will give you significant flexibility and support in a company focused on making a positive impact in the world. Siegwerk is poised to disrupt the global packaging industry; changing the way packaging is produced and consumed for the benefit of us all. At Siegwerk, you will have everything you need to help make that change. Join us, let's Do it. With Heart. Location: Alfred-Kelle…",0,eyJhbGciOiJIUzI1NiJ9.eyJpIjoiNTI1MDAzMDg1MyIsInMiOiJKalVLeW41TDhCR1kxYmVQLTBzSnFBIn0.vjh8XnzEp8NgEV7SXalUxaMB8r61VW55zn2l6n4zKgM,"{'label': 'Stellen aus Wissenschaft & Qualitätssicherung', '__CLASS__': 'Adzuna::API::Response::Category', 'tag': 'scientific-qa-jobs'}",2025-06-14T08:28:38Z,5250030853,"{'__CLASS__': 'Adzuna::API::Response::Company', 'display_name': 'Siegwerk Druckfarben AG & Co. KGaA'}",,Adzuna::API::Response::Job,Working Student Data Science (f/m/d),,https://www.adzuna.de/land/ad/5250030853?se=JjUKyn5L8BGY1beP-0sJqA&utm_medium=api&utm_source=a4bcf954&v=F5729882F7E2C73F6D44EEC82899D49C121C49FD,,,,
"{'area': ['Deutschland', 'Baden-Württemberg', 'Esslingen (Kreis)', 'Esslingen am Neckar'], 'display_name': 'Esslingen am Neckar, Esslingen (Kreis)', '__CLASS__': 'Adzuna::API::Response::Location'}","Life is always about becoming… Im Leben geht es darum, sich auf eine Reise zu begeben, um die beste Version unseres zukünftigen Selbst zu werden. Während wir Neues entdecken, stellen wir uns Herausforderungen, meistern sie und wachsen über uns hinaus. Bewerben Sie sich bei Mercedes-Benz und finden Sie den Aufgabenbereich, in dem Sie Ihre Talente individuell entfalten können. Dabei werden Sie von visionären Kolleginnen und Kollegen unterstützt, die Ihren Pioniergeist teilen. Bei uns einzusteigen…",0,eyJhbGciOiJIUzI1NiJ9.eyJzIjoiSmpVS3luNUw4QkdZMWJlUC0wc0pxQSIsImkiOiI1MjUyMTk4MjAxIn0.FFcEISBfmE07BqI2vF-Jzza4_oWfC5xa1ypRhMf5gqY,"{'__CLASS__': 'Adzuna::API::Response::Category', 'label': 'Unknown', 'tag': 'unknown'}",2025-06-15T20:17:57Z,5252198201,"{'__CLASS__': 'Adzuna::API::Response::Company', 'display_name': 'Mercedes-Benz Group AG'}",9.315933,Adzuna::API::Response::Job,"Duales Studium Wirtschaftsinformatik/Data Science (B.Sc.), Stuttgart 2026 (w/m/d)",48.745846,https://www.adzuna.de/land/ad/5252198201?se=JjUKyn5L8BGY1beP-0sJqA&utm_medium=api&utm_source=a4bcf954&v=EF5F4733AF12B15C4EEC078D2121AC8BAED8CA05,,,,
"{'display_name': 'Dresden, Sachsen', '__CLASS__': 'Adzuna::API::Response::Location', 'area': ['Deutschland', 'Sachsen', 'Dresden']}",Universitätsklinikum Carl Gustav Carus Dresden Aufgaben Wissenschaftliche*r Mitarbeiter*in (m/w/d) Data Science in der Krebsforschung in der Medizinischen Klinik und Poliklinik I Die Stelle ist zum nächstmöglichen Zeitpunkt in Voll- und Teilzeit für zunächst 24 Monate befristet zu besetzen. Die Vergütung erfolgt nach den Eingruppierungsvorschriften des Tarifvertrages für den öffentlichen Dienst der Länder (TV-L) und ist bei Vorliegen der persönlichen Voraussetzungen in die Entgeltgruppe E13 mög…,0,eyJhbGciOiJIUzI1NiJ9.eyJpIjoiNTI1MTU0NDY0MSIsInMiOiJKalVLeW41TDhCR1kxYmVQLTBzSnFBIn0.UfCJUu3VotK6gOQj6y97WJGVEfM3lAs3BaT-C_uwBrc,"{'tag': 'scientific-qa-jobs', 'label': 'Stellen aus Wissenschaft & Qualitätssicherung', '__CLASS__': 'Adzuna::API::Response::Category'}",2025-06-15T08:32:13Z,5251544641,"{'__CLASS__': 'Adzuna::API::Response::Company', 'display_name': 'Universitätsklinikum Carl Gustav Carus Dresden'}",13.756452,Adzuna::API::Response::Job,Wissenschaftliche*r Mitarbeiter*in (m/w/d) Data Science,51.052725,https://www.adzuna.de/land/ad/5251544641?se=JjUKyn5L8BGY1beP-0sJqA&utm_medium=api&utm_source=a4bcf954&v=1DD344C0A1C805FE39589835F017A3923653F00A,,,,
"{'area': ['Deutschland', 'Schleswig-Holstein', 'Kiel'], 'display_name': 'Kiel, Schleswig-Holstein', '__CLASS__': 'Adzuna::API::Response::Location'}","Über die Wollmilchsau GmbH Moin! Wir sind die Wollmilchsau GmbH, ein inhabergeführtes Software-Unternehmen aus Hamburg. Wir entwickeln den Jobspreader, eine Lösung für Programmatic Job Advertising. Damit unterstützen wir Recruiter dabei, Stellenanzeigen automatisiert und auf CPC-Basis auf Jobsuchmaschinen zu platzieren und bieten neben dem reinen Traffic noch viele Features, die das Recruiting und Personalmarketing unserer Kunden erleichtern und optimieren. Stell dir vor… Du scrollst durch Jobs…",0,eyJhbGciOiJIUzI1NiJ9.eyJzIjoiSmpVS3luNUw4QkdZMWJlUC0wc0pxQSIsImkiOiI1MjQ3MjgxMjUzIn0.Ahw_yduEQtySCWVg9TlE-CZwtIQieG71TzIM-c8QAJc,"{'__CLASS__': 'Adzuna::API::Response::Category', 'label': 'IT-Stellen', 'tag': 'it-jobs'}",2025-06-12T21:49:41Z,5247281253,"{'display_name': 'Wollmilchsau GmbH', '__CLASS__': 'Adzuna::API::Response::Company'}",10.137982,Adzuna::API::Response::Job,Werkstudent Data Science NLP & Jobklassifikation,54.319658,https://www.adzuna.de/land/ad/5247281253?se=JjUKyn5L8BGY1beP-0sJqA&utm_medium=api&utm_source=a4bcf954&v=C5F5F0182D36A18EA09CDC4B271AE7D1ED3C952D,full_time,,,
"{'display_name': 'Lüneburg, Lüneburg (Kreis)', '__CLASS__': 'Adzuna::API::Response::Location', 'area': ['Deutschland', 'Niedersachsen', 'Lüneburg (Kreis)', 'Lüneburg']}","Über die Wollmilchsau GmbH Moin! Wir sind die Wollmilchsau GmbH, ein inhabergeführtes Software-Unternehmen aus Hamburg. Wir entwickeln den Jobspreader, eine Lösung für Programmatic Job Advertising. Damit unterstützen wir Recruiter dabei, Stellenanzeigen automatisiert und auf CPC-Basis auf Jobsuchmaschinen zu platzieren und bieten neben dem reinen Traffic noch viele Features, die das Recruiting und Personalmarketing unserer Kunden erleichtern und optimieren. Stell dir vor… Du scrollst durch Jobs…",0,eyJhbGciOiJIUzI1NiJ9.eyJzIjoiSmpVS3luNUw4QkdZMWJlUC0wc0pxQSIsImkiOiI1MjQ3MjgxMjE3In0._pnFn4SDmhdwArjcjEu2afmnRk0Aqn1bm1ME3lvsuhs,"{'__CLASS__': 'Adzuna::API::Response::Category', 'label': 'IT-Stellen', 'tag': 'it-jobs'}",2025-06-12T21:49:41Z,5247281217,"{'display_name': 'Wollmilchsau GmbH', '__CLASS__': 'Adzuna::API::Response::Company'}",10.406345,Adzuna::API::Response::Job,Werkstudent Data Science NLP & Jobklassifikation,53.24252,https://www.adzuna.de/land/ad/5247281217?se=JjUKyn5L8BGY1beP-0sJqA&utm_medium=api&utm_source=a4bcf954&v=351FE474D54D0EC97742578114548804541D9DF9,full_time,,,
"{'area': ['Deutschland', 'Bayern', 'München (Kreis)', 'München'], '__CLASS__': 'Adzuna::API::Response::Location', 'display_name': 'München, München (Kreis)'}","Über die Wollmilchsau GmbH Moin! Wir sind die Wollmilchsau GmbH, ein inhabergeführtes Software-Unternehmen aus Hamburg. Wir entwickeln den Jobspreader, eine Lösung für Programmatic Job Advertising. Damit unterstützen wir Recruiter dabei, Stellenanzeigen automatisiert und auf CPC-Basis auf Jobsuchmaschinen zu platzieren und bieten neben dem reinen Traffic noch viele Features, die das Recruiting und Personalmarketing unserer Kunden erleichtern und optimieren. Stell dir vor… Du scrollst durch Jobs…",0,eyJhbGciOiJIUzI1NiJ9.eyJpIjoiNTI0NzI4MTIxOCIsInMiOiJKalVLeW41TDhCR1kxYmVQLTBzSnFBIn0.kQ88HMMx2bMZMnnhQvMLtcehekLCiT9u_nQOtzAOBQ4,"{'tag': 'it-jobs', '__CLASS__': 'Adzuna::API::Response::Category', 'label': 'IT-Stellen'}",2025-06-12T21:49:41Z,5247281218,"{'__CLASS__': 'Adzuna::API::Response::Company', 'display_name': 'Wollmilchsau GmbH'}",11.555737,Adzuna::API::Response::Job,Werkstudent Data Science NLP & Jobklassifikation,48.137418,https://www.adzuna.de/land/ad/5247281218?se=JjUKyn5L8BGY1beP-0sJqA&utm_medium=api&utm_source=a4bcf954&v=01F4528B768B3AB1B57D7D4DBC6F75537905264F,full_time,,,
"{'area': ['Deutschland', 'Hamburg'], 'display_name': 'Hamburg, Deutschland', '__CLASS__': 'Adzuna::API::Response::Location'}","Über die Wollmilchsau GmbH Moin! Wir sind die Wollmilchsau GmbH, ein inhabergeführtes Software-Unternehmen aus Hamburg. Wir entwickeln den Jobspreader, eine Lösung für Programmatic Job Advertising. Damit unterstützen wir Recruiter dabei, Stellenanzeigen automatisiert und auf CPC-Basis auf Jobsuchmaschinen zu platzieren und bieten neben dem reinen Traffic noch viele Features, die das Recruiting und Personalmarketing unserer Kunden erleichtern und optimieren. Stell dir vor… Du scrollst durch Jobs…",0,eyJhbGciOiJIUzI1NiJ9.eyJpIjoiNTI0NTU1MTM3MCIsInMiOiJKalVLeW41TDhCR1kxYmVQLTBzSnFBIn0.iqg_1PjMxRQNH_fp0n8-2hKbrZ_hrmXvsrGFwg9spl4,"{'__CLASS__': 'Adzuna::API::Response::Category', 'label': 'IT-Stellen', 'tag': 'it-jobs'}",2025-06-12T01:28:54Z,5245551370,"{'display_name': 'Wollmilchsau GmbH', '__CLASS__': 'Adzuna::API::Response::Company'}",9.987297,Adzuna::API::Response::Job,Werkstudent Data Science NLP & Jobklassifikation,53.557429,https://www.adzuna.de/land/ad/5245551370?se=JjUKyn5L8BGY1beP-0sJqA&utm_medium=api&utm_source=a4bcf954&v=9C49F7B88F8F5F8D013292FFE1F78C119FD24048,full_time,,,
