description,__CLASS__,company,created,redirect_url,adref,location,category,id,title,salary_is_predicted,longitude,latitude,contract_time,contract_type,salary_max,salary_min
"Die Fachhochschule Kufstein Tirol ist international mehrfach ausgezeichnet und laut dem Wirtschaftsmagazin trend im Tirol-Ranking 2022 auf Platz 1 der besten Arbeitgeber:innen. Wir sind eine sich stetig weiterentwickelnde Wissensorganisation. Als Arbeitgeberin bieten wir vielseitige, interessante Aufgaben, ein leistungsförderndes und familienfreundliches Umfeld mit flexiblen Arbeitsbedingungen in einer partnerschaftlich geprägten Kultur. Die FH verfügt bei 2200 Studierenden und 10000 Absolvent:…",Adzuna::API::Response::Job,"{'display_name': 'Fachhochschule Kufstein Tirol Bildungs GmbH', '__CLASS__': 'Adzuna::API::Response::Company'}",2025-06-17T20:17:23Z,https://www.adzuna.de/land/ad/5255162552?se=5EEY2dpN8BGd77fPIx1smA&utm_medium=api&utm_source=a4bcf954&v=8999EFBCA7563AEC600A8674A82FA90785DC87B3,eyJhbGciOiJIUzI1NiJ9.eyJzIjoiNUVFWTJkcE44QkdkNzdmUEl4MXNtQSIsImkiOiI1MjU1MTYyNTUyIn0.4sqq1yaKZF9bb6a8_tI1QHcMLkwE0wHNtcT0hQitnjk,"{'__CLASS__': 'Adzuna::API::Response::Location', 'area': ['Deutschland'], 'display_name': 'Deutschland'}","{'tag': 'consultancy-jobs', '__CLASS__': 'Adzuna::API::Response::Category', 'label': 'Beraterstellen'}",5255162552,Professur (FH) für Data Science mit Option Studiengangsleitung (w/m/d),0,,,,,,
"Du begeisterst dich für die komplexen Zusammenhänge in der IT und arbeitest gerne im Team? Willkommen in der Königsklasse Die Firma ZIEHL-ABEGG SE, mit derzeit über 5.000 Mitarbeitern weltweit, entwickelt, produziert und vertreibt global Ventilatoren, elektrische Spezialmotoren und Regelsysteme für die allgemeine Lufttechnik und Antriebstechnik. Neben dem Hauptsitz in Künzelsau befinden sich weitere süddeutsche Standorte des Unternehmens in Bieringen und Gewerbepark Hohenlohe. Als mittelständis…",Adzuna::API::Response::Job,"{'__CLASS__': 'Adzuna::API::Response::Company', 'display_name': 'ZIEHL-ABEGG SE'}",2025-06-20T08:10:10Z,https://www.adzuna.de/land/ad/5259456833?se=5EEY2dpN8BGd77fPIx1smA&utm_medium=api&utm_source=a4bcf954&v=7D454F40DB3F8BDFAC92C9573484439CD29266C2,eyJhbGciOiJIUzI1NiJ9.eyJpIjoiNTI1OTQ1NjgzMyIsInMiOiI1RUVZMmRwTjhCR2Q3N2ZQSXgxc21BIn0.TlV3ec3J0G5fgpSob9GFLwW6to7QaIjcy1VagptE8KM,"{'display_name': 'Deutschland', '__CLASS__': 'Adzuna::API::Response::Location', 'area': ['Deutschland']}","{'tag': 'unknown', '__CLASS__': 'Adzuna::API::Response::Category', 'label': 'Unknown'}",5259456833,Duales Studium Data Science und Künstliche Intelligenz (m/w/d) ab September 2025,0,,,,,,
"Sich etwas Neues trauen, über sich hinauswachsen und dabei die Grenzen des Machbaren neu definieren. Genau das ist es, was unsere Mitarbeitenden täglich leben dürfen und sollen. Um mit unseren Innovationen ein Zeichen zu setzen und Großartiges zu ermöglichen. Denn hinter jedem erfolgreichen Unternehmen stehen eine ganze Menge faszinierende Menschen. In einem offenen und modernen Umfeld mit zahlreichen Entwicklungs- und Weiterbildungsmöglichkeiten, arbeiten die Mitarbeitenden bei ZEISS in einer …",Adzuna::API::Response::Job,"{'__CLASS__': 'Adzuna::API::Response::Company', 'display_name': 'ZEISS'}",2025-06-17T20:17:09Z,https://www.adzuna.de/land/ad/5255157657?se=5EEY2dpN8BGd77fPIx1smA&utm_medium=api&utm_source=a4bcf954&v=8B7522BAAFFC072ED980160B1A956D88C8C2EE3C,eyJhbGciOiJIUzI1NiJ9.eyJzIjoiNUVFWTJkcE44QkdkNzdmUEl4MXNtQSIsImkiOiI1MjU1MTU3NjU3In0.9L2LhLrrdEDFuhzxivDtDd16i4A8e0k0h4n1LhOCb6w,"{'__CLASS__': 'Adzuna::API::Response::Location', 'area': ['Deutschland', 'Baden-Württemberg', 'Ostalbkreis', 'Oberkochen'], 'display_name': 'Oberkochen, Ostalbkreis'}","{'tag': 'unknown', '__CLASS__': 'Adzuna::API::Response::Category', 'label': 'Unknown'}",5255157657,"Duales Studium – Data Science und Künstliche Intelligenz (m/w/x), Beginn Herbst 2026",0,10.10558,48.78408,,,,
"Möchten Sie Ihre Ideen in nutzbringende und sinnvolle Technologien verwandeln? Ob im Bereich Mobility Solutions, Consumer Goods, Industrial Technology oder Energy and Building Technology - mit uns verbessern Sie die Lebensqualität der Menschen auf der ganzen Welt. Willkommen bei Bosch. Die Robert Bosch Elektronik GmbH freut sich auf Ihre Bewerbung! Anstellungsart: Befristet Arbeitszeit: Vollzeit Arbeitsort: Salzgitter Aufgaben Wir suchen eine engagierte Persönlichkeit, die Teil unseres Projektt…",Adzuna::API::Response::Job,"{'__CLASS__': 'Adzuna::API::Response::Company', 'display_name': 'Bosch Gruppe'}",2025-06-09T08:06:40Z,https://www.adzuna.de/land/ad/5240890986?se=5EEY2dpN8BGd77fPIx1smA&utm_medium=api&utm_source=a4bcf954&v=C0F8D1DED804AD09C017986B74D27460ED794985,eyJhbGciOiJIUzI1NiJ9.eyJzIjoiNUVFWTJkcE44QkdkNzdmUEl4MXNtQSIsImkiOiI1MjQwODkwOTg2In0.kqngF_4iNFwTCuAfeRH3s6o7uf2Y8zGcGmS9EIdEHxk,"{'display_name': 'Salzgitter, Niedersachsen', '__CLASS__': 'Adzuna::API::Response::Location', 'area': ['Deutschland', 'Niedersachsen', 'Salzgitter']}","{'label': 'Stellen aus Wissenschaft & Qualitätssicherung', '__CLASS__': 'Adzuna::API::Response::Category', 'tag': 'scientific-qa-jobs'}",5240890986,Pflichtpraktikum in den Bereichen Wasserstoffcampus und energieorientiertes Data Science,0,10.373516,52.120502,,,,
"Eine gute Idee war der Ursprung, ein erfolgreiches Konzept ist das Ergebnis. Qualität zum guten Preis möglichst vielen Menschen anbieten zu können treibt uns an - mittlerweile weltweit, denn wir sind Lidl. Hier ist das berufliche Zuhause vielfältiger Talente. Ob im Einkauf, in der Logistik, im Warengeschäft oder in der IT; ob als Impulsgeber, Gestalter oder Dienstleister der Länder. Wir suchen Anpacker, Durchstarter, Möglichmacher und bieten spannende Aufgaben und Projekte in einem dynamischen …",Adzuna::API::Response::Job,"{'__CLASS__': 'Adzuna::API::Response::Company', 'display_name': 'Lidl Stiftung & Co. KG'}",2025-05-13T19:32:53Z,https://www.adzuna.de/land/ad/5196599071?se=5EEY2dpN8BGd77fPIx1smA&utm_medium=api&utm_source=a4bcf954&v=B05D2F43BE90D34C617E73D32CA793E4E1837E9E,eyJhbGciOiJIUzI1NiJ9.eyJzIjoiNUVFWTJkcE44QkdkNzdmUEl4MXNtQSIsImkiOiI1MTk2NTk5MDcxIn0.cRBUnmDtaXzJ_7XgSrP3FZVFmT11fU5ZTMYG2CYZ94M,"{'__CLASS__': 'Adzuna::API::Response::Location', 'area': ['Deutschland', 'Baden-Württemberg', 'Heilbronn (Kreis)', 'Neckarsulm'], 'display_name': 'Neckarsulm, Heilbronn (Kreis)'}","{'tag': 'scientific-qa-jobs', '__CLASS__': 'Adzuna::API::Response::Category', 'label': 'Stellen aus Wissenschaft & Qualitätssicherung'}",5196599071,Praktikum Data Science,0,9.2274,49.18975,,,,
"When travelers are searching for a hotel, we want the obvious choice to be trivago! Our leading metasearch engine is super fast and constantly optimized – enabling millions of travelers to compare hotel prices from hundreds of booking sites and find great deals in just a few clicks. We use cutting-edge technology, real-time auction, and machine learning techniques with petabytes of data to create an experience – time and money saved! In the lively city of Düsseldorf, we seize opportunities to l…",Adzuna::API::Response::Job,"{'__CLASS__': 'Adzuna::API::Response::Company', 'display_name': 'trivago N.V.'}",2025-05-29T07:53:45Z,https://www.adzuna.de/land/ad/5221191207?se=5EEY2dpN8BGd77fPIx1smA&utm_medium=api&utm_source=a4bcf954&v=98645105F045E80C016B917754C84A02C09FDF07,eyJhbGciOiJIUzI1NiJ9.eyJpIjoiNTIyMTE5MTIwNyIsInMiOiI1RUVZMmRwTjhCR2Q3N2ZQSXgxc21BIn0.eg0Ob9Vfpp2gy2g0p9I7pAsYR-uqdQCNeUKBPZWdnvU,"{'display_name': 'Düsseldorf, Nordrhein-Westfalen', 'area': ['Deutschland', 'Nordrhein-Westfalen', 'Düsseldorf'], '__CLASS__': 'Adzuna::API::Response::Location'}","{'label': 'Stellen aus Wissenschaft & Qualitätssicherung', '__CLASS__': 'Adzuna::API::Response::Category', 'tag': 'scientific-qa-jobs'}",5221191207,Data Science Lead - Price,0,6.808387,51.226802,,,,
"Als eigenfinanziertes Familienunternehmen sind wir mehr als nur ein ca. 4.700 Standorte umspannendes Filialnetz in 34 Ländern, mehr als ca. 8,7 Mrd. Euro Jahresumsatz und mehr als einer der erfolgreichsten Online-Shops für Schuhe in Europa. Deichmann ist Wegbereiter, Förderer und Arbeitgeber von über 49.000 engagierten Mitarbeiterinnen und Mitarbeitern weltweit. Als nachhaltig expandierendes Unternehmen sind wir seit mehreren Jahrzehnten in der Lage, unseren Mitarbeitern einen sicheren Arbeitsp…",Adzuna::API::Response::Job,"{'display_name': 'Deichmann SE', '__CLASS__': 'Adzuna::API::Response::Company'}",2025-05-20T07:34:57Z,https://www.adzuna.de/land/ad/5207046190?se=5EEY2dpN8BGd77fPIx1smA&utm_medium=api&utm_source=a4bcf954&v=99ABBDD1537458D2EC7E10DBD42B3B5690D3F12E,eyJhbGciOiJIUzI1NiJ9.eyJzIjoiNUVFWTJkcE44QkdkNzdmUEl4MXNtQSIsImkiOiI1MjA3MDQ2MTkwIn0.vGmD1Pu9Px-QiwV978S3XZ1x4sPfE7horjb3gP7A5Tw,"{'area': ['Deutschland', 'Nordrhein-Westfalen', 'Essen'], '__CLASS__': 'Adzuna::API::Response::Location', 'display_name': 'Essen, Nordrhein-Westfalen'}","{'label': 'Unknown', 'tag': 'unknown', '__CLASS__': 'Adzuna::API::Response::Category'}",5207046190,Team Lead Data Science Engineering (m/w/d),0,7.014478,51.444823,,,,
"Für den Weltmarkt projektieren und fertigen wir Hochspannungs- und Hochstromprüfsysteme zur Prüfung von Energiekabeln, Hochspannungstransformatoren und weiteren Geräten der elektrischen Energieübertragung. Mit unseren innovativen Produkten und digitalen Lösungen unterstützen wir den Netzausbau für eine nachhaltige Energieversorgung. Wir eröffnen Ihnen als Unternehmen in der REINHAUSEN Gruppe vielfältige Möglichkeiten in einer zukunftsorientierten Branche. HIGHVOLT - where Power meets Passion. F…",Adzuna::API::Response::Job,"{'__CLASS__': 'Adzuna::API::Response::Company', 'display_name': 'HIGHVOLT Prüftechnik Dresden GmbH'}",2025-06-20T08:10:04Z,https://www.adzuna.de/land/ad/5259456364?se=5EEY2dpN8BGd77fPIx1smA&utm_medium=api&utm_source=a4bcf954&v=CE8D9B408A667807C1CD5BA8E130395827DBE9FE,eyJhbGciOiJIUzI1NiJ9.eyJpIjoiNTI1OTQ1NjM2NCIsInMiOiI1RUVZMmRwTjhCR2Q3N2ZQSXgxc21BIn0.vCUU3zKMM0jGV6f0y8fHkJmBXuTQK4SHCZ4Pb24vedE,"{'__CLASS__': 'Adzuna::API::Response::Location', 'area': ['Deutschland', 'Sachsen', 'Dresden'], 'display_name': 'Dresden, Sachsen'}","{'label': 'Technikerstellen', '__CLASS__': 'Adzuna::API::Response::Category', 'tag': 'engineering-jobs'}",5259456364,Entwicklungsingenieur (m/w/d) im Bereich Messtechnik / Data Science,0,13.756452,51.052725,,,,
"Life is always about becoming… Im Leben geht es darum, sich auf eine Reise zu begeben, um die beste Version unseres zukünftigen Selbst zu werden. Während wir Neues entdecken, stellen wir uns Herausforderungen, meistern sie und wachsen über uns hinaus. Bewerben Sie sich bei Mercedes-Benz und finden Sie den Aufgabenbereich, in dem Sie Ihre Talente individuell entfalten können. Dabei werden Sie von visionären Kolleginnen und Kollegen unterstützt, die Ihren Pioniergeist teilen. Bei uns einzusteigen…",Adzuna::API::Response::Job,"{'__CLASS__': 'Adzuna::API::Response::Company', 'display_name': 'Mercedes-Benz Tech Innovation'}",2025-06-17T20:18:01Z,https://www.adzuna.de/land/ad/5255176901?se=5EEY2dpN8BGd77fPIx1smA&utm_medium=api&utm_source=a4bcf954&v=04DB68A1074178292A3B1B98FFAA9D2491BABE66,eyJhbGciOiJIUzI1NiJ9.eyJpIjoiNTI1NTE3NjkwMSIsInMiOiI1RUVZMmRwTjhCR2Q3N2ZQSXgxc21BIn0.pebxM_JBPXfXyMlVPAEUj81cgG3I1gVumLVVQ50juzA,"{'__CLASS__': 'Adzuna::API::Response::Location', 'area': ['Deutschland', 'Baden-Württemberg', 'Ulm'], 'display_name': 'Ulm, Baden-Württemberg'}","{'tag': 'scientific-qa-jobs', '__CLASS__': 'Adzuna::API::Response::Category', 'label': 'Stellen aus Wissenschaft & Qualitätssicherung'}",5255176901,Werkstudent Data Science im Bereich Fahrzeugdiagnose (m/w/d),0,9.856945,48.383137,,,,
"Life is always about becoming… Im Leben geht es darum, sich auf eine Reise zu begeben, um die beste Version unseres zukünftigen Selbst zu werden. Während wir Neues entdecken, stellen wir uns Herausforderungen, meistern sie und wachsen über uns hinaus. Bewerben Sie sich bei Mercedes-Benz und finden Sie den Aufgabenbereich, in dem Sie Ihre Talente individuell entfalten können. Dabei werden Sie von visionären Kolleginnen und Kollegen unterstützt, die Ihren Pioniergeist teilen. Bei uns einzusteigen…",Adzuna::API::Response::Job,"{'display_name': 'Mercedes-Benz Group AG', '__CLASS__': 'Adzuna::API::Response::Company'}",2025-06-17T20:17:32Z,https://www.adzuna.de/land/ad/5255165929?se=5EEY2dpN8BGd77fPIx1smA&utm_medium=api&utm_source=a4bcf954&v=7FB9DB8FF1444E8A1FCE53928BE7AF3A84FE5ADF,eyJhbGciOiJIUzI1NiJ9.eyJpIjoiNTI1NTE2NTkyOSIsInMiOiI1RUVZMmRwTjhCR2Q3N2ZQSXgxc21BIn0.Xjz7c9Ur_vM7JLuoHkvTrwdy1I633jZDJvI6LYQV3DQ,"{'area': ['Deutschland', 'Baden-Württemberg', 'Esslingen (Kreis)', 'Esslingen am Neckar'], '__CLASS__': 'Adzuna::API::Response::Location', 'display_name': 'Esslingen am Neckar, Esslingen (Kreis)'}","{'label': 'Unknown', '__CLASS__': 'Adzuna::API::Response::Category', 'tag': 'unknown'}",5255165929,"Duales Studium Wirtschaftsinformatik/Data Science (B.Sc.), Stuttgart 2026 (w/m/d)",0,9.315933,48.745846,,,,
"Als Pre-Sales Consultant (m/w/d) für Data Science-, AI- & BI-Lösungen spielst du eine entscheidende Rolle im Verkaufsprozess für unsere Produkte Alan® (Generative KI) und INFONEA® (Advanced Analytics), indem du technische Lösungen mit dem Expertenteam customized und überzeugende Angebote erstellst, die auf die Bedürfnisse der Kunden zugeschnitten sind. Diese Position eignet sich ideal für eine technikaffine Fachkraft mit ausgeprägtem Geschäftssinn, exzellenten Kommunikationsfähigkeiten und eine…",Adzuna::API::Response::Job,"{'display_name': 'Comma Soft AG', '__CLASS__': 'Adzuna::API::Response::Company'}",2025-06-20T08:37:31Z,https://www.adzuna.de/land/ad/5259481001?se=5EEY2dpN8BGd77fPIx1smA&utm_medium=api&utm_source=a4bcf954&v=52C96B38BD4182C39A01B77C6CD02AB03036DFCC,eyJhbGciOiJIUzI1NiJ9.eyJzIjoiNUVFWTJkcE44QkdkNzdmUEl4MXNtQSIsImkiOiI1MjU5NDgxMDAxIn0.XkobC09H3a1-5o-Kl427zzZgqwpMozcRugXPyC120vE,"{'display_name': 'Bonn, Nordrhein-Westfalen', 'area': ['Deutschland', 'Nordrhein-Westfalen', 'Bonn'], '__CLASS__': 'Adzuna::API::Response::Location'}","{'label': 'Vertriebsstellen', '__CLASS__': 'Adzuna::API::Response::Category', 'tag': 'sales-jobs'}",5259481001,"Pre-Sales Consultant (m/w/d) – Data Science, AI & BI",0,7.112412,50.71942,,,,
"Digitale Trans­formation. Nach­haltig­keit. Friedens­sicherung. Spannende Aufgaben, an denen auch wir bei Diehl in unseren fünf Teil­konzernen Metall, Controls, Defence, Aviation und Metering und unsere über 16.000 Mit­arbeiter­innen und Mit­arbeiter mit Hochdruck arbeiten. Entdecke faszinierende Techno­logien und bewirb dich. In einem von Vertrauen und Mut geprägten Familien­unter­nehmen, das beständig und stabil ist – aus Tradition. Für unseren Standort Diehl Defence GmbH & Co. KG in Röthenba…",Adzuna::API::Response::Job,"{'display_name': 'Diehl Defence GmbH & Co. KG', '__CLASS__': 'Adzuna::API::Response::Company'}",2025-06-17T20:34:37Z,https://www.adzuna.de/land/ad/5255326661?se=5EEY2dpN8BGd77fPIx1smA&utm_medium=api&utm_source=a4bcf954&v=06B8B48822FB9358CAC69427E3D19EBC11DC89EE,eyJhbGciOiJIUzI1NiJ9.eyJpIjoiNTI1NTMyNjY2MSIsInMiOiI1RUVZMmRwTjhCR2Q3N2ZQSXgxc21BIn0.cGpaNQv0RO_6Aiwi-GoRxA2m8bSKdlrbfCBSU_JnH1w,"{'display_name': 'Deutschland', 'area': ['Deutschland'], '__CLASS__': 'Adzuna::API::Response::Location'}","{'label': 'Stellen aus Wissenschaft & Qualitätssicherung', '__CLASS__': 'Adzuna::API::Response::Category', 'tag': 'scientific-qa-jobs'}",5255326661,Praktikant (m/w/d) Data Science,0,,,,,,
"Du willst mehr als Uni und möchtest erste Berufseinblicke und Kontakte knüpfen? Dann bist du hier richtig! Als Werkstudent oder Praktikant bei Kaufland gehörst du von Beginn an zu einem starken Team und kannst zeigen, was in dir steckt. Werde auch du Teil von teamkaufland! Aufgaben Wir zählen auf dich: Du unterstützt unser Team bei der Bearbeitung unserer Analytics Use Cases entlang der gesamten Wertschöpfungskette bei Kaufland. Vielfältige Aufgaben? Na klar: Lerne unsere Projekte und Arbeitswe…",Adzuna::API::Response::Job,"{'display_name': 'Kaufland', '__CLASS__': 'Adzuna::API::Response::Company'}",2025-05-28T19:50:11Z,https://www.adzuna.de/land/ad/5220264884?se=5EEY2dpN8BGd77fPIx1smA&utm_medium=api&utm_source=a4bcf954&v=E5D9C0F42BD4B2D101CC5446F52C0F73D1C57AE4,eyJhbGciOiJIUzI1NiJ9.eyJzIjoiNUVFWTJkcE44QkdkNzdmUEl4MXNtQSIsImkiOiI1MjIwMjY0ODg0In0.KkO_KfgLlgJ0CWhnbb33I-1rGUIjtT4LNbUICZWTa4c,"{'display_name': 'Heilbronn, Heilbronn (Kreis)', 'area': ['Deutschland', 'Baden-Württemberg', 'Heilbronn (Kreis)', 'Heilbronn'], '__CLASS__': 'Adzuna::API::Response::Location'}","{'label': 'Stellen aus Wissenschaft & Qualitätssicherung', 'tag': 'scientific-qa-jobs', '__CLASS__': 'Adzuna::API::Response::Category'}",5220264884,Praktikant Data Science (m/w/d),0,9.209895,49.142335,,,,
"When travelers are searching for a hotel, we want the obvious choice to be trivago! By comparing prices from major booking sites, we're making it easy for people to find hotels they want at a price they’ll love. In the lively city of Düsseldorf, we seize opportunities to learn everyday, innovate, and make an enduring mark on the travel industry. A career at trivago is a journey designed for people who crave continuous development and want to thrive in a high-performing team. Here you will find …",Adzuna::API::Response::Job,"{'display_name': 'trivago', '__CLASS__': 'Adzuna::API::Response::Company'}",2025-05-22T11:45:02Z,https://www.adzuna.de/land/ad/5210550923?se=5EEY2dpN8BGd77fPIx1smA&utm_medium=api&utm_source=a4bcf954&v=04BDEBBBCF947A1D4B0320827A6F55746CD3D03B,eyJhbGciOiJIUzI1NiJ9.eyJzIjoiNUVFWTJkcE44QkdkNzdmUEl4MXNtQSIsImkiOiI1MjEwNTUwOTIzIn0.OMefJS3Zp5m96Cuadhh0ikh53aByWK3bHTbY3Z_FfhE,"{'display_name': 'Bilk, Düsseldorf', '__CLASS__': 'Adzuna::API::Response::Location', 'area': ['Deutschland', 'Nordrhein-Westfalen', 'Düsseldorf', 'Bilk']}","{'tag': 'unknown', '__CLASS__': 'Adzuna::API::Response::Category', 'label': 'Unknown'}",5210550923,Data Science Lead - Price,0,6.78055,51.20259,,,,
"Life is always about becoming… Im Leben geht es darum, sich auf eine Reise zu begeben, um die beste Version unseres zukünftigen Selbst zu werden. Während wir Neues entdecken, stellen wir uns Herausforderungen, meistern sie und wachsen über uns hinaus. Bewerben Sie sich bei Mercedes-Benz und finden Sie den Aufgabenbereich, in dem Sie Ihre Talente individuell entfalten können. Dabei werden Sie von visionären Kolleginnen und Kollegen unterstützt, die Ihren Pioniergeist teilen. Bei uns einzusteigen…",Adzuna::API::Response::Job,"{'__CLASS__': 'Adzuna::API::Response::Company', 'display_name': 'Mercedes-Benz Tech Innovation'}",2025-06-09T20:04:47Z,https://www.adzuna.de/land/ad/5241458986?se=5EEY2dpN8BGd77fPIx1smA&utm_medium=api&utm_source=a4bcf954&v=84D8490D2A67047AD09BCC28EC4996CA080A51AA,eyJhbGciOiJIUzI1NiJ9.eyJpIjoiNTI0MTQ1ODk4NiIsInMiOiI1RUVZMmRwTjhCR2Q3N2ZQSXgxc21BIn0.hpAg2hTmlJl_0whA5SFgoUYANKoDxmL2zrOdNW45RrE,"{'display_name': 'Ulm, Baden-Württemberg', '__CLASS__': 'Adzuna::API::Response::Location', 'area': ['Deutschland', 'Baden-Württemberg', 'Ulm']}","{'label': 'Unknown', '__CLASS__': 'Adzuna::API::Response::Category', 'tag': 'unknown'}",5241458986,Duales Studium Data Science / Künstliche Intelligenz in Kooperation mit der Dualen Hochschule Baden-Württemberg 2026 (m/w/d),0,9.856945,48.383137,,,,
"Life is always about becoming… Im Leben geht es darum, sich auf eine Reise zu begeben, um die beste Version unseres zukünftigen Selbst zu werden. Während wir Neues entdecken, stellen wir uns Herausforderungen, meistern sie und wachsen über uns hinaus. Bewerben Sie sich bei Mercedes-Benz und finden Sie den Aufgabenbereich, in dem Sie Ihre Talente individuell entfalten können. Dabei werden Sie von visionären Kolleginnen und Kollegen unterstützt, die Ihren Pioniergeist teilen. Bei uns einzusteigen…",Adzuna::API::Response::Job,"{'__CLASS__': 'Adzuna::API::Response::Company', 'display_name': 'Mercedes-Benz Tech Innovation'}",2025-06-02T19:45:06Z,https://www.adzuna.de/land/ad/5228935038?se=5EEY2dpN8BGd77fPIx1smA&utm_medium=api&utm_source=a4bcf954&v=F31FD94107CC87F14C5D25AE5DE093AA5E4CAB01,eyJhbGciOiJIUzI1NiJ9.eyJzIjoiNUVFWTJkcE44QkdkNzdmUEl4MXNtQSIsImkiOiI1MjI4OTM1MDM4In0.ihsRXETH4O-DA2Y3PFV55uVY0wc0PiXJzAkxOm_cgZ4,"{'area': ['Deutschland', 'Baden-Württemberg', 'Baden-Baden'], '__CLASS__': 'Adzuna::API::Response::Location', 'display_name': 'Baden-Baden, Baden-Württemberg'}","{'label': 'Unknown', '__CLASS__': 'Adzuna::API::Response::Category', 'tag': 'unknown'}",5228935038,Duales Studium Data Science / Künstliche Intelligenz in Kooperation mit der Dualen Hochschule Baden-Württemberg 2026 (m/w/d),0,8.235274,48.754667,,,,
"WE ARE AGAIN AWARDED AS TOP ARBEITGEBER 2025! At AP Sensing, we're building on a success story that began in the garage of Bill Hewlett and Dave Packard. As an independent HP spin-off, we combine over 40 years of technological expertise with a passion for innovation. Together we'll continue to enhance infrastructure, protect people, and safeguard our planet. With a commitment to fiber optic sensing, we value every voice and empower growth. Join us in thinking ahead to create a smarter, safer wo…",Adzuna::API::Response::Job,"{'display_name': 'AP Sensing GmbH', '__CLASS__': 'Adzuna::API::Response::Company'}",2025-06-17T20:34:27Z,https://www.adzuna.de/land/ad/5255325658?se=5EEY2dpN8BGd77fPIx1smA&utm_medium=api&utm_source=a4bcf954&v=6DD9E4E0245F23C4EA1C2CBC583557B9C81755B3,eyJhbGciOiJIUzI1NiJ9.eyJpIjoiNTI1NTMyNTY1OCIsInMiOiI1RUVZMmRwTjhCR2Q3N2ZQSXgxc21BIn0.Y-JqpySdFzloZDWnl_KxiUN9ULYuK851UHkEkxOul9g,"{'__CLASS__': 'Adzuna::API::Response::Location', 'area': ['Deutschland', 'Baden-Württemberg', 'Böblingen (Kreis)', 'Böblingen'], 'display_name': 'Böblingen, Böblingen (Kreis)'}","{'tag': 'scientific-qa-jobs', '__CLASS__': 'Adzuna::API::Response::Category', 'label': 'Stellen aus Wissenschaft & Qualitätssicherung'}",5255325658,Data Science Team Lead (m/f/d),0,,,,,,
"Hannover Rück – rund 3.900 Mitarbeiter:innen an Standorten auf der ganzen Welt. Unsere Stärke? Connecting Power: Wir verlassen uns auf­einander. Als Rück­versicherer sichern wir Kunden im Schaden­fall ab. Dafür braucht es maß­geschneiderte, innovative Lösungen. Lösungen, die gestern noch gepasst haben, können morgen ver­altet sein. Wir challengen uns und optimieren konti­nuierlich unsere Services, Beratungen und Pro­dukte. All das macht uns zu einer der führenden und profi­tabelsten Rück­versic…",Adzuna::API::Response::Job,"{'__CLASS__': 'Adzuna::API::Response::Company', 'display_name': 'Hannover Rück SE'}",2025-05-13T19:32:52Z,https://www.adzuna.de/land/ad/5196599018?se=5EEY2dpN8BGd77fPIx1smA&utm_medium=api&utm_source=a4bcf954&v=DF87DEAFDBA82D6A67B5C2B21156D28117C34E72,eyJhbGciOiJIUzI1NiJ9.eyJzIjoiNUVFWTJkcE44QkdkNzdmUEl4MXNtQSIsImkiOiI1MTk2NTk5MDE4In0.DiOQCyfshD-MDxTX3lizBBRC-aRq_RkzEMOiH5BBQYw,"{'display_name': 'Hannover, Region Hannover (Kreis)', 'area': ['Deutschland', 'Niedersachsen', 'Region Hannover (Kreis)', 'Hannover'], '__CLASS__': 'Adzuna::API::Response::Location'}","{'label': 'Unknown', 'tag': 'unknown', '__CLASS__': 'Adzuna::API::Response::Category'}",5196599018,Trainee Mathematik Personen-Rückversicherung Fokus Data Science,0,9.742751,52.378818,,,,
"Die Sparkassen Rating und Risikosysteme (SR) ist der zentrale Dienstleister für Verfahren des Risiko­manage­ments in der Sparkassen-Finanzgruppe. Wir unterstützen die Institute mit Standardlösungen in den Bereichen der Risiko­messung und -steuerung, der regulatorischen Banksteuerung sowie im Vertrieb mit Data-Analytics-Lösungen. Gemeinsam mit unseren Partnern bieten wir den Instituten, von der Konzeption der Verfahren, über deren Weiterentwicklung, IT-Umsetzung und Umsetzungsunterstützung, zent…",Adzuna::API::Response::Job,"{'display_name': 'Sparkassen Rating und Risikosysteme GmbH', '__CLASS__': 'Adzuna::API::Response::Company'}",2025-06-03T21:40:26Z,https://www.adzuna.de/land/ad/5231302799?se=5EEY2dpN8BGd77fPIx1smA&utm_medium=api&utm_source=a4bcf954&v=325E1FF72791C60121772B37ECDB0E91EEC9666C,eyJhbGciOiJIUzI1NiJ9.eyJzIjoiNUVFWTJkcE44QkdkNzdmUEl4MXNtQSIsImkiOiI1MjMxMzAyNzk5In0.sY_Ut4co84h3hb5UQaXHTHWk9l9jdfmyK2D5cprvKkI,"{'display_name': 'Berlin, Deutschland', 'area': ['Deutschland', 'Berlin'], '__CLASS__': 'Adzuna::API::Response::Location'}","{'label': 'Stellen aus Wissenschaft & Qualitätssicherung', 'tag': 'scientific-qa-jobs', '__CLASS__': 'Adzuna::API::Response::Category'}",5231302799,Werkstudent (m/w/d) – Risikomanagement | Data Science,0,13.420806,52.507706,,,,
"Life is always about becoming… Im Leben geht es darum, sich auf eine Reise zu begeben, um die beste Version unseres zukünftigen Selbst zu werden. Während wir Neues entdecken, stellen wir uns Herausforderungen, meistern sie und wachsen über uns hinaus. Bewerben Sie sich bei Mercedes-Benz und finden Sie den Aufgabenbereich, in dem Sie Ihre Talente individuell entfalten können. Dabei werden Sie von visionären Kolleginnen und Kollegen unterstützt, die Ihren Pioniergeist teilen. Bei uns einzusteigen…",Adzuna::API::Response::Job,"{'__CLASS__': 'Adzuna::API::Response::Company', 'display_name': 'Mercedes-Benz Group AG'}",2025-06-19T20:34:14Z,https://www.adzuna.de/land/ad/5258716704?se=5EEY2dpN8BGd77fPIx1smA&utm_medium=api&utm_source=a4bcf954&v=1705C46EEC6E1CC0D9249B5BC97C2EAC0EB967B3,eyJhbGciOiJIUzI1NiJ9.eyJpIjoiNTI1ODcxNjcwNCIsInMiOiI1RUVZMmRwTjhCR2Q3N2ZQSXgxc21BIn0.nHb1VxL7pKG3ZbJXYT4VtAGGKFl9mhISINS5UsBqYmY,"{'display_name': 'Stuttgart, Baden-Württemberg', 'area': ['Deutschland', 'Baden-Württemberg', 'Stuttgart'], '__CLASS__': 'Adzuna::API::Response::Location'}","{'__CLASS__': 'Adzuna::API::Response::Category', 'tag': 'scientific-qa-jobs', 'label': 'Stellen aus Wissenschaft & Qualitätssicherung'}",5258716704,Praktikant*in Data Analytics/Data Science (Pflicht-Praktikum),0,9.187224,48.776198,,,,
