latitude,__CLASS__,longitude,location,id,adref,redirect_url,category,title,salary_is_predicted,created,company,description,contract_time,salary_min,contract_type,salary_max
48.1476,Adzuna::API::Response::Job,11.56803,"{'display_name': 'Maxvorstadt, München', '__CLASS__': 'Adzuna::API::Response::Location', 'area': ['Deutschland', 'Bayern', 'München (Kreis)', 'München', 'Maxvorstadt']}",5291811358,eyJhbGciOiJIUzI1NiJ9.eyJpIjoiNTI5MTgxMTM1OCIsInMiOiJSdDI0QW9OZzhCR2VDWWdhX01WVWJRIn0.UA3ng3Ul516qSUz9cx6vpXmCBUDJmH2Oi_uG2SaHhbw,https://www.adzuna.de/details/5291811358?utm_medium=api&utm_source=a4bcf954,"{'__CLASS__': 'Adzuna::API::Response::Category', 'label': 'Unknown', 'tag': 'unknown'}",Data Science Manager (d/f/m),0,2025-07-08T15:58:35Z,"{'display_name': 'Entrix', '__CLASS__': 'Adzuna::API::Response::Company'}","Short Facts Join us on our journey: To drive the smart and sustainable energy future, we are looking for a Data Science Manager (d/f/m) to oversee strategic tech initiatives from development through to successful execution. Location: Munich, Germany Employment Type: Full-time Salary Range: € 115.000 - 135.000  competitive VSOP package Working Mode: In office setup Language Requirement: C1 Level English Your Responsibilities Lead, coach, and support a growing team of Data Scientists and Data Eng…",full_time,115000.0,,135000.0
53.557429,Adzuna::API::Response::Job,9.987297,"{'display_name': 'Hamburg, Deutschland', 'area': ['Deutschland', 'Hamburg'], '__CLASS__': 'Adzuna::API::Response::Location'}",4801213177,eyJhbGciOiJIUzI1NiJ9.eyJzIjoiUnQyNEFvTmc4QkdlQ1lnYV9NVlViUSIsImkiOiI0ODAxMjEzMTc3In0.DzwKCLEj2QIHXlEMydKHczCW30U32jRc0gz3qES8Ngk,https://www.adzuna.de/details/4801213177?utm_medium=api&utm_source=a4bcf954,"{'__CLASS__': 'Adzuna::API::Response::Category', 'label': 'Unknown', 'tag': 'unknown'}",Lead Data Science/Business Intelligence (gn),0,2024-07-30T22:44:26Z,"{'display_name': 'workidentity', '__CLASS__': 'Adzuna::API::Response::Company'}","Einleitung Für eines unserer Partnerunternehmen im Hamburg suchen wir Dichals Lead Data Science/Business Intelligence (gn) Deine Aufgaben In dieser Funktion übernimmst bzw. steuerst Du sämtliche BI- Prozesse Du baust ein Datenteam auf (In-App-Retentionsoptimierung, Kampagnenverteilungsoptimierung) Du erstellst, analysierst und kommunizierst Berichte und Statistiken Du verwandelst wiederkehrende Analysen in KPIs und Dashboard-Ansichten Du analysierst Daten aus verschiedenen Quellen (Redshift, Sp…",full_time,,,
52.13979,Adzuna::API::Response::Job,10.31683,"{'display_name': 'Bruchmachtersen, Salzgitter', 'area': ['Deutschland', 'Niedersachsen', 'Salzgitter', 'Bruchmachtersen'], '__CLASS__': 'Adzuna::API::Response::Location'}",5287870210,eyJhbGciOiJIUzI1NiJ9.eyJzIjoiUnQyNEFvTmc4QkdlQ1lnYV9NVlViUSIsImkiOiI1Mjg3ODcwMjEwIn0.sPIw_PKbP4acR3AcOlFkQo2n1wOHMr_dJzMlrCzpx4g,https://www.adzuna.de/details/5287870210?utm_medium=api&utm_source=a4bcf954,"{'label': 'Unknown', 'tag': 'unknown', '__CLASS__': 'Adzuna::API::Response::Category'}",Pflichtpraktikum in den Bereichen Wasserstoffcampus und energieorientiertes Data Science,0,2025-07-05T17:17:26Z,"{'__CLASS__': 'Adzuna::API::Response::Company', 'display_name': 'Robert Bosch Elektronik GmbH'}","Pflichtpraktikum in den Bereichen Wasserstoffcampus und energieorientiertes Data Science John-F.-Kennedy-Straße 43-53, 38228 Salzgitter, Deutschland Praktikant/in Robert Bosch Elektronik GmbH Unternehmensbeschreibung Bei Bosch gestalten wir Zukunft mit hochwertigen Technologien und Dienstleistungen, die Begeisterung wecken und das Leben der Menschen verbessern. Unser Versprechen an unsere Mitarbeiterinnen und Mitarbeiter steht dabei felsenfest: Wir wachsen gemeinsam, haben Freude an unserer Arb…",,,contract,
47.6881,Adzuna::API::Response::Job,9.1484,"{'display_name': 'Fürstenberg, Konstanz', 'area': ['Deutschland', 'Baden-Württemberg', 'Konstanz (Kreis)', 'Konstanz', 'Fürstenberg'], '__CLASS__': 'Adzuna::API::Response::Location'}",5150487114,eyJhbGciOiJIUzI1NiJ9.eyJzIjoiUnQyNEFvTmc4QkdlQ1lnYV9NVlViUSIsImkiOiI1MTUwNDg3MTE0In0.uzxJtjGfyQ9JT1Yp3ROAzDHb2a4w-6CsAkOB8kpjllY,https://www.adzuna.de/details/5150487114?utm_medium=api&utm_source=a4bcf954,"{'label': 'Stellen aus PR, Werbung & Marketing', 'tag': 'pr-advertising-marketing-jobs', '__CLASS__': 'Adzuna::API::Response::Category'}",Praktikant (m/w/d) Data Science,0,2025-04-17T21:35:56Z,"{'__CLASS__': 'Adzuna::API::Response::Company', 'display_name': 'Südkurier'}","Praktikant (m/w/d) Data Science ab 01.09.2025 Konstanz befristet Pflichtpraktikum WIR BIETEN DIR Mitarbeit an zukunftsorientierten Projekten eines modernen Medienhauses Strukturierte Einarbeitung und persönliche Betreuung während des Praktikums Eine Praktikumsvergütung (750 EUR brutto / Monat), Urlaubsanspruch (bis zu 10 Tage), flexible Arbeitszeitgestaltung inkl. mobiles Arbeiten und vielfältige Weiterbildungsangebote Werde Teil einer Community von Praktikanten und nutze die Möglichkeit des Ne…",,,contract,
,Adzuna::API::Response::Job,,"{'display_name': 'Deutschland', '__CLASS__': 'Adzuna::API::Response::Location', 'area': ['Deutschland']}",5287385557,eyJhbGciOiJIUzI1NiJ9.eyJzIjoiUnQyNEFvTmc4QkdlQ1lnYV9NVlViUSIsImkiOiI1Mjg3Mzg1NTU3In0.aSo6cI-m_E2Fb5Bt83Sfim2cAJttEjVSXS-68lBrU14,https://www.adzuna.de/details/5287385557?utm_medium=api&utm_source=a4bcf954,"{'__CLASS__': 'Adzuna::API::Response::Category', 'tag': 'unknown', 'label': 'Unknown'}",Werkstudent:in Data Science (m/w/d),0,2025-07-05T16:00:42Z,"{'__CLASS__': 'Adzuna::API::Response::Company', 'display_name': 'Mineral Minds Karriere'}","Für unseren Standort in Stuttgart suchen wir zum nächstmöglichen Zeitpunkt eine:n Werkstudent:in im Bereich der Data Science. Hast Du Bock? Wir sind ein Technologieunternehmen, das die Bau- und Entsorgungsbranche deutschlandweit digitalisiert. Unser Ziel ist es, die Kreislaufwirtschaft in der Baubranche zu stärken und so einen Beitrag zur Nachhaltigkeit in diesem Sektor zu leisten. Dafür bieten wir eine unabhängige digitale Plattform für die Ver- und Entsorgung von mineralischen Baustoffen, die…",,,,
,Adzuna::API::Response::Job,,"{'area': ['Deutschland', 'Baden-Württemberg', 'Karlsruhe (Kreis)'], '__CLASS__': 'Adzuna::API::Response::Location', 'display_name': 'Karlsruhe (Kreis), Baden-Württemberg'}",5183863620,eyJhbGciOiJIUzI1NiJ9.eyJpIjoiNTE4Mzg2MzYyMCIsInMiOiJSdDI0QW9OZzhCR2VDWWdhX01WVWJRIn0.t1buiZR39AAJaop_Xxp4RRp5WvKxuqBdiv9UV-VpQUA,https://www.adzuna.de/details/5183863620?utm_medium=api&utm_source=a4bcf954,"{'__CLASS__': 'Adzuna::API::Response::Category', 'tag': 'unknown', 'label': 'Unknown'}",Duales Studium Data Science und Künstliche Intelligenz,0,2025-05-06T21:43:49Z,"{'display_name': 'Atruvia', '__CLASS__': 'Adzuna::API::Response::Company'}","Responsibilities Die Softwareentwicklung ist einer der wichtigsten Bereiche bei Atruvia. Als Kompetenzzentrum für bankfachliche IT-Lösungen realisieren wir jedes Jahr über 200 Softwareprojekte, die unseren Kunden mehr Effizienz und Flexibilität im Kerngeschäft einbringen. Mit unseren smarten (analytischen) Lösungen erarbeiten wir gemeinsam mit unseren Kunden innovative Produkte - nach dem Motto “Wir machen das Leben leichter mit KI”. Aufgaben Du entwickelst maßgeschneiderte Data-Science und KI-…",,,,
48.137418,Adzuna::API::Response::Job,11.555737,"{'display_name': 'München, München (Kreis)', 'area': ['Deutschland', 'Bayern', 'München (Kreis)', 'München'], '__CLASS__': 'Adzuna::API::Response::Location'}",5224878981,eyJhbGciOiJIUzI1NiJ9.eyJzIjoiUnQyNEFvTmc4QkdlQ1lnYV9NVlViUSIsImkiOiI1MjI0ODc4OTgxIn0.W_O48uGjvCsbEqD1CVGj6VlLMR9Y8U7HMUkhWGNOVEg,https://www.adzuna.de/details/5224878981?utm_medium=api&utm_source=a4bcf954,"{'__CLASS__': 'Adzuna::API::Response::Category', 'tag': 'unknown', 'label': 'Unknown'}",Werkstudent:in (w/m/d) Data Science,0,2025-05-31T14:09:24Z,"{'__CLASS__': 'Adzuna::API::Response::Company', 'display_name': 'Finanztip Verbraucherinformation'}","Wir suchen Verstärkung Du hast Lust auf Daten, die wirklich was bewegen? Dann unterstütze uns als Werkstudent:in im Bereich Data Science dabei, Nutzerverhalten zu analysieren, personalisierte Empfehlungen zu entwickeln und smarte Datenmodelle für unsere App aufzubauen. Deine Aufgaben Als Teil unseres Shared Services-Team bist du mitten im Geschehen und tauchst tief in unsere User- und Business-Daten ein. Du lieferst Insights, die was bewegen – und sorgst mit deinen Analysen dafür, dass wir unse…",part_time,,,
48.13258,Adzuna::API::Response::Job,11.59129,"{'area': ['Deutschland', 'Bayern', 'München (Kreis)', 'München', 'Au-Haidhausen'], '__CLASS__': 'Adzuna::API::Response::Location', 'display_name': 'Au-Haidhausen, München'}",5219543387,eyJhbGciOiJIUzI1NiJ9.eyJpIjoiNTIxOTU0MzM4NyIsInMiOiJSdDI0QW9OZzhCR2VDWWdhX01WVWJRIn0.y3TCiv2GmSCOiu1dkAjwrrmSViiuPOK1qp7zbduaELE,https://www.adzuna.de/details/5219543387?utm_medium=api&utm_source=a4bcf954,"{'__CLASS__': 'Adzuna::API::Response::Category', 'tag': 'unknown', 'label': 'Unknown'}",Werkstudent:in (w/m/d) Data Science,0,2025-05-28T08:20:36Z,"{'__CLASS__': 'Adzuna::API::Response::Company', 'display_name': 'Finanztip Verbraucherinformation GmbH'}","Wir suchen Verstärkung Du hast Lust auf Daten, die wirklich was bewegen? Dann unterstütze uns als Werkstudent:in im Bereich Data Science dabei, Nutzerverhalten zu analysieren, personalisierte Empfehlungen zu entwickeln und smarte Datenmodelle für unsere App aufzubauen. Deine Aufgaben Als Teil unseres Shared Services-Team bist du mitten im Geschehen und tauchst tief in unsere User- und Business-Daten ein. Du lieferst Insights, die was bewegen – und sorgst mit deinen Analysen dafür, dass wir unse…",part_time,,,
51.12633,Adzuna::API::Response::Job,10.47716,"{'display_name': 'Ginseldorf, Capelle', '__CLASS__': 'Adzuna::API::Response::Location', 'area': ['Deutschland', 'Hessen', 'Marburg-Biedenkopf (Kreis)', 'Capelle', 'Ginseldorf']}",5301704894,eyJhbGciOiJIUzI1NiJ9.eyJzIjoiUnQyNEFvTmc4QkdlQ1lnYV9NVlViUSIsImkiOiI1MzAxNzA0ODk0In0.DwYgF5MIiZI12QdZsGvScUc_rjaZJQ1epnS5fhr93Ms,https://www.adzuna.de/details/5301704894?utm_medium=api&utm_source=a4bcf954,"{'tag': 'unknown', 'label': 'Unknown', '__CLASS__': 'Adzuna::API::Response::Category'}",DHBW Studium - Data Science und Künstliche Intelligenz,0,2025-07-14T08:31:13Z,"{'display_name': 'Liebherr-International Deutschland GmbH', '__CLASS__': 'Adzuna::API::Response::Company'}","Das erwartet dich Studierende beschäftigen sich neben den Grundlagen der Informatik und Wirtschaftsinformatik mit den Kerninhalten von Data Science. Dies beinhaltet etwa Cloud Computing, Big Data, Machine Learning und Projektmanagement. Zur Vertiefung werden zwei Wahloptionen ab dem viertenSemester angeboten, um fachliche Spezialisierungen zu ermöglichen: – Data Engineering und Data Analytics– Künstliche Intelligenz und Intelligence Engineering Typisch für die Tätigkeit von Data Scientists sind…",,,,
48.0962,Adzuna::API::Response::Job,9.78975,"{'__CLASS__': 'Adzuna::API::Response::Location', 'area': ['Deutschland', 'Baden-Württemberg', 'Biberach (Kreis)', 'Biberach an der Riß'], 'display_name': 'Biberach an der Riß, Biberach (Kreis)'}",5301702783,eyJhbGciOiJIUzI1NiJ9.eyJzIjoiUnQyNEFvTmc4QkdlQ1lnYV9NVlViUSIsImkiOiI1MzAxNzAyNzgzIn0.qQTWXAUgUhpgv9zLGwz-RrHOn1ioSdr5bfKpQnpol8k,https://www.adzuna.de/details/5301702783?utm_medium=api&utm_source=a4bcf954,"{'label': 'Unknown', 'tag': 'unknown', '__CLASS__': 'Adzuna::API::Response::Category'}",DHBW Studium - Data Science und Künstliche Intelligenz,0,2025-07-14T08:30:33Z,"{'__CLASS__': 'Adzuna::API::Response::Company', 'display_name': 'Liebherr-International Deutschland GmbH'}","Das erwartet dich Studierende beschäftigen sich neben den Grundlagen der Informatik und Wirtschaftsinformatik mit den Kerninhalten von Data Science. Dies beinhaltet etwa Cloud Computing, Big Data, Machine Learning und Projektmanagement. Zur Vertiefung werden zwei Wahloptionen ab dem vierten Semester angeboten, um fachliche Spezialisierungen zu ermöglichen: – Data Engineering und Data Analytics – Künstliche Intelligenz und Intelligence Engineering Typisch für die Tätigkeit von Data Scientists si…",,,,
,Adzuna::API::Response::Job,,"{'area': ['Deutschland', 'Bayern', 'München (Kreis)', 'München'], '__CLASS__': 'Adzuna::API::Response::Location', 'display_name': 'München, München (Kreis)'}",5297752511,eyJhbGciOiJIUzI1NiJ9.eyJzIjoiUnQyNEFvTmc4QkdlQ1lnYV9NVlViUSIsImkiOiI1Mjk3NzUyNTExIn0.dUMr2-VkiNSjotlTmHX61HmMrBmjdISIUYNpTsX_NY4,https://www.adzuna.de/details/5297752511?utm_medium=api&utm_source=a4bcf954,"{'__CLASS__': 'Adzuna::API::Response::Category', 'tag': 'it-jobs', 'label': 'IT-Stellen'}",Consultant* - Data Analytics & Data Science - Capco,0,2025-07-11T15:24:58Z,"{'__CLASS__': 'Adzuna::API::Response::Company', 'display_name': 'Capco'}","Als globale Unternehmensberatung mit Fokus auf die Finanzdienstleistungsbranche kombinieren wir bei Capco innovatives Denken mit einzigartigem Know-How. So divers wie unsere Mitarbeiter*, sind auch unsere Lösungen, die wir unseren Kunden anbieten. Bringe Dich ein und setze Deine Ideen bei Capco in die Tat um als… Senior Consultant/Manager* - Data Analytics In Frankfurt am Main, Düsseldorf, München, Berlin oder Wien Deine Capco Benefits Du bist uns wichtig! Daher bekommst Du einen persönlichen C…",,,,
48.91786,Adzuna::API::Response::Job,8.665,"{'display_name': 'Nordweststadt, Pforzheim', 'area': ['Deutschland', 'Baden-Württemberg', 'Pforzheim', 'Nordweststadt'], '__CLASS__': 'Adzuna::API::Response::Location'}",5255858169,eyJhbGciOiJIUzI1NiJ9.eyJzIjoiUnQyNEFvTmc4QkdlQ1lnYV9NVlViUSIsImkiOiI1MjU1ODU4MTY5In0.aSBlrxf4RI0BDYbYs6bjQf1zZxYM8jDPiRJPZZPAWyA,https://www.adzuna.de/details/5255858169?utm_medium=api&utm_source=a4bcf954,"{'__CLASS__': 'Adzuna::API::Response::Category', 'tag': 'unknown', 'label': 'Unknown'}",Duales Studium Data Science & KI - 2026,0,2025-06-18T08:33:11Z,"{'display_name': 'Rutronik Elektronische Bauelemente GmbH', '__CLASS__': 'Adzuna::API::Response::Company'}","Entdecke die Welt der elektronischen Bauelemente! ___ Starte als Teamplayer bei Rutronik! Die Welt der Elektronik ist unser Zuhause. Als eines der weltweit führenden Unternehmen für den Vertrieb elektronischer Bauteile mit mehr als 1.900 Mitarbeitern an über 82 Standorten rund um den Globus suchen wir laufend Verstärkung. Entdecke jetzt die Perspektiven und Chancen, die dir dein Job bei Rutronik bietet und werde Teil unseres Erfolges! Unser Angebot an dich: Zukunftssicherer Arbeitgeber : Förder…",full_time,,,
50.555835,Adzuna::API::Response::Job,7.468007,"{'__CLASS__': 'Adzuna::API::Response::Location', 'area': ['Deutschland', 'Rheinland-Pfalz', 'Neuwied (Kreis)'], 'display_name': 'Neuwied (Kreis), Rheinland-Pfalz'}",5071820094,eyJhbGciOiJIUzI1NiJ9.eyJzIjoiUnQyNEFvTmc4QkdlQ1lnYV9NVlViUSIsImkiOiI1MDcxODIwMDk0In0.021H-tblD096G3Rvjxz4Y9zlZGaA6icIePq2TRP07lw,https://www.adzuna.de/details/5071820094?utm_medium=api&utm_source=a4bcf954,"{'tag': 'unknown', 'label': 'Unknown', '__CLASS__': 'Adzuna::API::Response::Category'}",Technician Data Science (m/w/d),0,2025-03-03T12:30:04Z,"{'__CLASS__': 'Adzuna::API::Response::Company', 'display_name': 'Lohmann & Co. KG'}","Willkommen im (K)leben Wir freuen uns, dass Sie sich für Lohmann, den Spezialisten für Klebelösungen, interessieren. Unsere Erfolgsgeschichte begann bereits vor über 170 Jahren. Ein familiengeführtes Unternehmen mit sozialer Verantwortung sind wir noch heute. Und wir sind stolz darauf, für unsere Kunden ein verlässlicher Partner mit zukunftsweisenden Technologien zu sein. An unserer Firmenzentrale in Neuwied produzieren wir High-Tech-Klebebänder für die Industrie im engen Verbund mit unseren ru…",full_time,,,
49.1416,Adzuna::API::Response::Job,9.22208,"{'__CLASS__': 'Adzuna::API::Response::Location', 'area': ['Deutschland', 'Baden-Württemberg', 'Heilbronn (Kreis)', 'Heilbronn', 'Böckingen'], 'display_name': 'Böckingen, Heilbronn'}",5285176172,eyJhbGciOiJIUzI1NiJ9.eyJzIjoiUnQyNEFvTmc4QkdlQ1lnYV9NVlViUSIsImkiOiI1Mjg1MTc2MTcyIn0.u7Zdk2h2aSCK9oRTR064x6SWkkPLebz8eIgxlQE8Ur0,https://www.adzuna.de/details/5285176172?utm_medium=api&utm_source=a4bcf954,"{'tag': 'graduate-jobs', 'label': 'Stellen für Hochschulabsolventen', '__CLASS__': 'Adzuna::API::Response::Category'}",Praktikant Data Science (m/w/d),0,2025-07-04T17:29:45Z,"{'display_name': 'Kaufland', '__CLASS__': 'Adzuna::API::Response::Company'}","Du willst mehr als Uni und möchtest erste Berufseinblicke und Kontakte knüpfen? Dann bist du hier richtig! Als Werkstudent oder Praktikant bei Kaufland gehörst du von Beginn an zu einem starken Team und kannst zeigen, was in dir steckt. Werde auch du Teil von teamkaufland! Deine Aufgaben Wir zählen auf dich: Du unterstützt unser Team bei der Bearbeitung unserer Analytics Use Cases entlang der gesamten Wertschöpfungskette bei Kaufland. Vielfältige Aufgaben? Na klar: Lerne unsere Projekte und Arb…",,,,
49.18975,Adzuna::API::Response::Job,9.2274,"{'__CLASS__': 'Adzuna::API::Response::Location', 'area': ['Deutschland', 'Baden-Württemberg', 'Heilbronn (Kreis)', 'Neckarsulm'], 'display_name': 'Neckarsulm, Heilbronn (Kreis)'}",5301295983,eyJhbGciOiJIUzI1NiJ9.eyJpIjoiNTMwMTI5NTk4MyIsInMiOiJSdDI0QW9OZzhCR2VDWWdhX01WVWJRIn0.ArzzSrA970npzd0_Sb597c7Om16ejPHBWwTswqt_vK8,https://www.adzuna.de/details/5301295983?utm_medium=api&utm_source=a4bcf954,"{'__CLASS__': 'Adzuna::API::Response::Category', 'label': 'Stellen aus Logistik & Lagerhaltung', 'tag': 'logistics-warehouse-jobs'}",Duales Studium Wirtschaftsinformatik - Data Science 2026,0,2025-07-13T23:07:48Z,"{'display_name': 'Lidl Stiftung', '__CLASS__': 'Adzuna::API::Response::Company'}","Einleitung Eine gute Idee war der Ursprung, ein erfolgreiches Konzept ist das Ergebnis. Qualität zum guten Preis möglichst vielen Menschen anbieten zu können treibt uns an - mittlerweile weltweit, denn wir sind Lidl. Hier ist das berufliche Zuhause vielfältiger Talente. Ob im Einkauf, in der Logistik, im Warengeschäft oder in der IT; ob als Impulsgeber, Gestalter oder Dienstleister der Länder. Wir suchen Anpacker, Durchstarter, Möglichmacher und bieten spannende Aufgaben und Projekte in einem d…",full_time,,,
51.226802,Adzuna::API::Response::Job,6.808387,"{'display_name': 'Düsseldorf, Nordrhein-Westfalen', 'area': ['Deutschland', 'Nordrhein-Westfalen', 'Düsseldorf'], '__CLASS__': 'Adzuna::API::Response::Location'}",5300826250,eyJhbGciOiJIUzI1NiJ9.eyJzIjoiUnQyNEFvTmc4QkdlQ1lnYV9NVlViUSIsImkiOiI1MzAwODI2MjUwIn0.biFJSJCxcbLVYimbcEQdMOXXYa0njfQ5MvF4ZyFO1ek,https://www.adzuna.de/land/ad/5300826250?se=Rt24AoNg8BGeCYga_MVUbQ&utm_medium=api&utm_source=a4bcf954&v=079227B7C5DF3F2417E135D2D75EFFC515061420,"{'__CLASS__': 'Adzuna::API::Response::Category', 'tag': 'it-jobs', 'label': 'IT-Stellen'}",KI Manager Technologie (m/w/d),0,2025-07-13T18:09:19Z,"{'display_name': 'Deutsche Apotheker- und Ärztebank eG - apoBank', '__CLASS__': 'Adzuna::API::Response::Company'}","Bei der apoBank fördern wir Existenzen, realisieren zukunftsweisende Projekte und sind ein starker und zuverlässiger Partner für den deutschen Gesundheitsmarkt. Wir sind die größte Bank für alle akademischen Heilberuflerinnen und Heilberufler in Deutschland. Meistere mit uns die spannenden Herausforderungen eines hochdynamischen Marktes und finde passende finanzielle Lösungen für unsere besonderen Kundinnen und Kunden. Steige bei der apoBank ein und entwickle dich persönlich und beruflich weite…",,,,
49.97586,Adzuna::API::Response::Job,8.06555,"{'display_name': 'Ingelheim am Rhein, Mainz-Bingen (Kreis)', '__CLASS__': 'Adzuna::API::Response::Location', 'area': ['Deutschland', 'Rheinland-Pfalz', 'Mainz-Bingen (Kreis)', 'Ingelheim am Rhein']}",5299534182,eyJhbGciOiJIUzI1NiJ9.eyJpIjoiNTI5OTUzNDE4MiIsInMiOiJSdDI0QW9OZzhCR2VDWWdhX01WVWJRIn0.k8d5dK0V4UYIJ8rZJmkrzEiNsMqviKWfKwp29iaNabs,https://www.adzuna.de/land/ad/5299534182?se=Rt24AoNg8BGeCYga_MVUbQ&utm_medium=api&utm_source=a4bcf954&v=77E69B267DF5CC23A3A518B0E8A50FA31B2E2382,"{'__CLASS__': 'Adzuna::API::Response::Category', 'label': 'Unknown', 'tag': 'unknown'}",Senior Legal Operations Manager,0,2025-07-12T18:09:32Z,"{'__CLASS__': 'Adzuna::API::Response::Company', 'display_name': 'Boehringer Ingelheim'}","At Boehringer Ingelheim we develop breakthrough therapies that improve the lives of both humans and animals. Founded in 1885 and family-owned ever since, Boehringer Ingelheim takes a long-term perspective. Now, we are powered by 52,000 employees globally who nurture a diverse, collaborative and inclusive culture. We believe that if we have talented and ambitious people who are passionate about innovation, there is no limit to what we can achieve. The Position As Senior Legal Operations Manager …",,,,
51.955292,Adzuna::API::Response::Job,7.621504,"{'display_name': 'Münster, Nordrhein-Westfalen', '__CLASS__': 'Adzuna::API::Response::Location', 'area': ['Deutschland', 'Nordrhein-Westfalen', 'Münster']}",5291522539,eyJhbGciOiJIUzI1NiJ9.eyJzIjoiUnQyNEFvTmc4QkdlQ1lnYV9NVlViUSIsImkiOiI1MjkxNTIyNTM5In0.T4rIep1fpHYBue-Cdlm0mfsCHeplzBn8KH26n6alo9c,https://www.adzuna.de/land/ad/5291522539?se=Rt24AoNg8BGeCYga_MVUbQ&utm_medium=api&utm_source=a4bcf954&v=09982E1D4C918FD0A884EBD87538B9E9BCC5C714,"{'label': 'Stellen aus Buchhaltung & Finanzwesen', 'tag': 'accounting-finance-jobs', '__CLASS__': 'Adzuna::API::Response::Category'}",Account Executive B2B (m/w/d) bei Modelyzr in Münster,0,2025-07-08T09:49:21Z,"{'__CLASS__': 'Adzuna::API::Response::Company', 'display_name': 'Modelyzr GmbH'}","Modelyzr – Die KI-Plattform für datengetriebenes Wachstum Modelyzr ist ein innovatives Softwareunternehmen aus Deutschland mit über zehn Jahren Erfahrung im Bereich Market Intelligence. Die Plattform hilft B2B-Unternehmen weltweit dabei, ihre Go-to-Market-Strategien datengestützt zu planen, Wachstumschancen schneller zu erkennen und ihre Ressourcen präziser einzusetzen. Als Market AI Platform vereint Modelyzr moderne Machine-Learning-Methoden, Marktmodellierung und Echtzeit-Analysen in einer ei…",,,,
48.883606,Adzuna::API::Response::Job,8.697363,"{'__CLASS__': 'Adzuna::API::Response::Location', 'area': ['Deutschland', 'Baden-Württemberg', 'Pforzheim'], 'display_name': 'Pforzheim, Baden-Württemberg'}",5263279779,eyJhbGciOiJIUzI1NiJ9.eyJpIjoiNTI2MzI3OTc3OSIsInMiOiJSdDI0QW9OZzhCR2VDWWdhX01WVWJRIn0.yh112Iqpr87npkEpVLNV5LHuqsW09d2o16P4z-kH4Qg,https://www.adzuna.de/land/ad/5263279779?se=Rt24AoNg8BGeCYga_MVUbQ&utm_medium=api&utm_source=a4bcf954&v=C73B808C399C858636B44C7F3E0E720209CD4159,"{'label': 'Unknown', 'tag': 'unknown', '__CLASS__': 'Adzuna::API::Response::Category'}",(Senior) Data / Business Analyst (m/w/d),0,2025-06-22T20:44:32Z,"{'display_name': 'BRUNO BADER GmbH + Co. KG', '__CLASS__': 'Adzuna::API::Response::Company'}","BADER ist ein Multichannel-Distanzhändler mit über 95-jähriger Geschichte. Familiengeführt in dritter Generation gehört BADER zu den attraktivsten Arbeitgebern der Region. Eine Kultur des Miteinanders sichert den wirtschaftlichen Erfolg in einem Unternehmen mit flachen Hierarchien und kurzen Wegen. BADER wächst und entwickelt sich stetig weiter - deshalb freuen wir uns, wenn auch Du bald unser BADER-Team unterstützt. Hallo, wir sind die Abteilung Data Analytics! Wir bestehen aus fünfzehn Expert…",,,,
50.940164,Adzuna::API::Response::Job,6.969972,"{'__CLASS__': 'Adzuna::API::Response::Location', 'area': ['Deutschland', 'Nordrhein-Westfalen', 'Köln'], 'display_name': 'Köln, Nordrhein-Westfalen'}",5245206630,eyJhbGciOiJIUzI1NiJ9.eyJzIjoiUnQyNEFvTmc4QkdlQ1lnYV9NVlViUSIsImkiOiI1MjQ1MjA2NjMwIn0.DQoLobBf6kePfgctRuTTnWfsqiWQfowE1fITruQ3aKA,https://www.adzuna.de/land/ad/5245206630?se=Rt24AoNg8BGeCYga_MVUbQ&utm_medium=api&utm_source=a4bcf954&v=A8A113283CEC22411F9E22C38E51B8C66B7C4CBB,"{'label': 'Stellen aus Wissenschaft & Qualitätssicherung', 'tag': 'scientific-qa-jobs', '__CLASS__': 'Adzuna::API::Response::Category'}",Data Scientist*,0,2025-06-11T20:28:05Z,"{'display_name': 'Gothaer Konzern', '__CLASS__': 'Adzuna::API::Response::Company'}","Willkommen bei der BarmeniaGothaer Authentisch. Echt. Unverstellt. So sind wir. Und so kannst du bei uns jederzeit sein. Als Versicherungsverein auf Gegenseitigkeit wissen wir seit über 200 Jahren, welche Kraft und Dynamik der gemeinschaftliche Zusammenhalt erzeugt. Er inspiriert uns bis heute, mutig neue Wege zu gehen. Freu dich auf einen Mix aus individuellen Freiheiten, vielfältigen Arbeitgeberleistungen und einer starken Gemeinschaft, auf die du jederzeit zählen kannst. Entdecke jetzt den J…",,,,
51.504967,Adzuna::API::Response::Job,7.464954,"{'__CLASS__': 'Adzuna::API::Response::Location', 'area': ['Deutschland', 'Nordrhein-Westfalen', 'Dortmund'], 'display_name': 'Dortmund, Nordrhein-Westfalen'}",5278384557,eyJhbGciOiJIUzI1NiJ9.eyJzIjoiaXFJNkJJTmc4QkdQMXZTbmJUY1F3QSIsImkiOiI1Mjc4Mzg0NTU3In0.8-4TJG1WgxPH9ZGsRyx7ybaPFzxwnmoUq89x99m8O_g,https://www.adzuna.de/land/ad/5278384557?se=iqI6BINg8BGP1vSnbTcQwA&utm_medium=api&utm_source=a4bcf954&v=C654FB7074B9293B85DBA0BFED5AB88B03533CD2,"{'tag': 'scientific-qa-jobs', 'label': 'Stellen aus Wissenschaft & Qualitätssicherung', '__CLASS__': 'Adzuna::API::Response::Category'}",Data Scientist - Schwerpunkt KI (w/m/d),0,2025-07-01T21:45:32Z,"{'__CLASS__': 'Adzuna::API::Response::Company', 'display_name': 'WILO SE'}","Die Welt ist im Wandel. Globale Megatrends wie Urbanisierung, Wasserknappheit und Klimawandel erfordern neue Ideen, Per­spek­tiven und Wege – die WILO Gruppe beschreitet sie. Unser Leitsatz: PIONEERING FOR YOU. Gegründet und ansässig in Dortmund, sind wir ein multinationaler Technologiekonzern und Pionier der Pumpenindustrie. Als Premiumanbieter für Gebäude­technik, Wasserwirtschaft und Industrie sind wir den Trends von morgen bereits voraus. Rund 9.000 Mitarbeiter verfolgen welt­weit unsere Na…",,,,
