created,description,adref,company,salary_is_predicted,redirect_url,__CLASS__,latitude,title,location,category,longitude,id,contract_time,salary_max,salary_min,contract_type
2026-01-12T02:26:42Z,"Eine gute Idee war der Ursprung, ein erfolgreiches Konzept ist das Ergebnis. Qualität zum guten Preis möglichst vielen Menschen anbieten zu können treibt uns an - mittlerweile weltweit, denn wir sind Lidl. Hier ist das berufliche Zuhause vielfältiger Talente. Ob im Einkauf, in der Logistik, im Warengeschäft oder in der IT; ob als Impulsgeber, Gestalter oder Dienstleister der Länder. Wir suchen Anpacker, Durchstarter, Möglichmacher und bieten spannende Aufgaben und Projekte in einem dynamischen …",eyJhbGciOiJIUzI1NiJ9.eyJpIjoiNTU4MDA2NDY4OSIsInMiOiJ2T0w1OW9mNjhCR1FYNGxlOFNPekZBIn0.TZvatYgh2PB-mOwNM9WxzO9SmKZClT9_IItpXeMQEk0,"{'__CLASS__': 'Adzuna::API::Response::Company', 'display_name': 'Lidl Stiftung & Co. KG'}",0,https://www.adzuna.de/land/ad/5580064689?se=vOL59of68BGQX4le8SOzFA&utm_medium=api&utm_source=a4bcf954&v=CE15D5B1CD55E6EF31FA4DA539B67AB836DBE9F1,Adzuna::API::Response::Job,49.18975,Duales Studium Wirtschaftsinformatik - Data Science 2026,"{'display_name': 'Neckarsulm, Heilbronn (Kreis)', 'area': ['Deutschland', 'Baden-Württemberg', 'Heilbronn (Kreis)', 'Neckarsulm'], '__CLASS__': 'Adzuna::API::Response::Location'}","{'tag': 'unknown', 'label': 'Unknown', '__CLASS__': 'Adzuna::API::Response::Category'}",9.2274,5580064689,,,,
2026-01-12T02:26:24Z,"Die ALH Gruppe zählt zu den bedeutenden Versicherungs- und Finanzdienst­leistungsunternehmen in Deutschland. Rund 3.000 Mitarbeiterinnen und Mitarbeiter bilden das Fundament für unseren Erfolg und sorgen täglich für erstklassigen Service, individuelle Beratung und die langfristige Zufriedenheit unserer Kunden. Aufgaben Innovative Technologien vorantreiben und betriebswirtschaftliche Zusammenhänge optimieren – als Absolvent (m/w/d) des Studiengangs Wirtschaftsinformatik (B.Sc.) weißt du wie´s ge…",eyJhbGciOiJIUzI1NiJ9.eyJzIjoidk9MNTlvZjY4QkdRWDRsZThTT3pGQSIsImkiOiI1NTgwMDY0MzU0In0.da2hb3reGOPnFlh1VOkYETIgYHhemH6EPoM1JuuR8X8,"{'__CLASS__': 'Adzuna::API::Response::Company', 'display_name': 'ALH Gruppe'}",0,https://www.adzuna.de/land/ad/5580064354?se=vOL59of68BGQX4le8SOzFA&utm_medium=api&utm_source=a4bcf954&v=2EEDF1EF612B34EC59922B39CE575F6368D2E183,Adzuna::API::Response::Job,48.776198,Duales Studium Wirtschaftsinformatik – Data Science (B.Sc.),"{'__CLASS__': 'Adzuna::API::Response::Location', 'area': ['Deutschland', 'Baden-Württemberg', 'Stuttgart'], 'display_name': 'Stuttgart, Baden-Württemberg'}","{'tag': 'unknown', 'label': 'Unknown', '__CLASS__': 'Adzuna::API::Response::Category'}",9.187224,5580064354,,,,
2026-01-18T14:30:08Z,Wir sind der Digitalisierungspartner in der genossenschaftlichen FinanzGruppe und vereinen jahrzehntelanges Expertenwissen in Banking und Informationstechnologie. Die speziell auf Banken zugeschnittenen IT-Lösungen und Leistungen reichen vom Rechenzentrumsbetrieb über das Bankverfahren von Atruvia bis hin zur App-Entwicklung. Dabei nutzen wir zukunftsweisende Technologien wie Smart Data und schreiben Prozessoptimierung und Regulatorik groß. Gestalte die Zukunft mit KI – Starte dein Duales Studi…,eyJhbGciOiJIUzI1NiJ9.eyJpIjoiNTU5MDM4NDczMyIsInMiOiJ2T0w1OW9mNjhCR1FYNGxlOFNPekZBIn0.5NAFvzgJ109Z9CiPRV-7EHrHXr1WFHgaNOOi6raNxRg,"{'display_name': 'Atruvia AG', '__CLASS__': 'Adzuna::API::Response::Company'}",0,https://www.adzuna.de/land/ad/5590384733?se=vOL59of68BGQX4le8SOzFA&utm_medium=api&utm_source=a4bcf954&v=BB106DEC81D27587501E4178F426681058E6AF00,Adzuna::API::Response::Job,49.001249,Duales Studium Data Science & Künstliche Intelligenz B.Sc.,"{'display_name': 'Karlsruhe, Karlsruhe (Kreis)', 'area': ['Deutschland', 'Baden-Württemberg', 'Karlsruhe (Kreis)', 'Karlsruhe'], '__CLASS__': 'Adzuna::API::Response::Location'}","{'tag': 'unknown', 'label': 'Unknown', '__CLASS__': 'Adzuna::API::Response::Category'}",8.412378,5590384733,,,,
2026-01-21T14:32:59Z,"Als Student arbeitest Du mit Deinen Kolleginnen und Kollegen auf Augenhöhe und schaffst ideale Voraussetzungen für Deine spätere Karriere. Sich etwas Neues trauen, über sich hinauswachsen und dabei die Grenzen des Machbaren neu deﬁnieren. Genau das ist es, was unsere Mitarbeitenden täglich leben dürfen und sollen. Um mit unseren Innovationen das Tempo vorzugeben und Großartiges zu ermöglichen. Denn hinter jedem erfolgreichen Unternehmen stehen eine ganze Menge faszinierender Menschen. Die Mitar…",eyJhbGciOiJIUzI1NiJ9.eyJzIjoidk9MNTlvZjY4QkdRWDRsZThTT3pGQSIsImkiOiI1NTkzOTI0MjU2In0.zWGpV4NwLtZrcXzalBtOpN8Q91MUrbqDj0KodG5VJ5Y,"{'display_name': 'ZEISS', '__CLASS__': 'Adzuna::API::Response::Company'}",0,https://www.adzuna.de/land/ad/5593924256?se=vOL59of68BGQX4le8SOzFA&utm_medium=api&utm_source=a4bcf954&v=AAAC87DA5767C2B47EED19529F9FB1A6A76C7DE8,Adzuna::API::Response::Job,48.78408,Abschlussarbeit Data Science / Mechanikdesign (m/w/x),"{'display_name': 'Oberkochen, Ostalbkreis', 'area': ['Deutschland', 'Baden-Württemberg', 'Ostalbkreis', 'Oberkochen'], '__CLASS__': 'Adzuna::API::Response::Location'}","{'tag': 'other-general-jobs', 'label': 'Sonstige/Allgemeine Stellen', '__CLASS__': 'Adzuna::API::Response::Category'}",10.10558,5593924256,,,,
2026-01-18T14:30:01Z,"Duales Studium Wirtschaftsinformatik-Data Science, Studienbeginn 2026 (m/w/d) Trelleborg is a world leader in engineered polymer solutions for almost every industry on the planet. And we are where we are because our talents brought us here. By specializing in the polymer engineering that makes innovation and application possible, Trelleborg works closely with leading industry brands to accelerate their performance, drive their business forward—and along the way, shape the industry and progress …",eyJhbGciOiJIUzI1NiJ9.eyJzIjoidk9MNTlvZjY4QkdRWDRsZThTT3pGQSIsImkiOiI1NTkwMzg0NTM1In0._RMWvVROY6i_Xbihna18NeQgTvTeH7J81uBl29Fr1Kg,"{'__CLASS__': 'Adzuna::API::Response::Company', 'display_name': 'Trelleborg Sealing Solutions Germany GmbH'}",0,https://www.adzuna.de/land/ad/5590384535?se=vOL59of68BGQX4le8SOzFA&utm_medium=api&utm_source=a4bcf954&v=7FC70AD183E4145B0A9E7DEE1D66BC6D9B1563C5,Adzuna::API::Response::Job,48.776198,"Duales Studium Wirtschaftsinformatik-Data Science, Studienbeginn 2026 (m/w/d)","{'display_name': 'Stuttgart, Baden-Württemberg', 'area': ['Deutschland', 'Baden-Württemberg', 'Stuttgart'], '__CLASS__': 'Adzuna::API::Response::Location'}","{'tag': 'unknown', '__CLASS__': 'Adzuna::API::Response::Category', 'label': 'Unknown'}",9.187224,5590384535,,,,
2026-01-07T02:24:01Z,"Die ITSCare mit Sitz in Frankfurt a.M. und zentralem Unternehmensstandort in Stuttgart ist 100% Tochter von drei AOKs. Als Dienstleister sind wir mit ca. 700 qualifizierten Mitarbeitenden verantwortlich für die Verarbeitung und Speicherung der Sozialdaten von ca. 7,5 Millionen Versicherten. Als Spezialist für Netzwerke, Hardware, Software, Telekommunikation und Rechenzentrumsbetrieb stehen wir für Leistungen und Services von höchster Güte. Du möchtest an der Weiterentwicklung eines kompetenten …",eyJhbGciOiJIUzI1NiJ9.eyJzIjoidk9MNTlvZjY4QkdRWDRsZThTT3pGQSIsImkiOiI1NTcwODAxNjgzIn0.fGHEX0cwzISTYl0_7hDOdrJHnHpmzzd0gdK3aX8UvUg,"{'__CLASS__': 'Adzuna::API::Response::Company', 'display_name': 'ITSCare-IT-Services für den Gesundheitsmarkt GbR'}",0,https://www.adzuna.de/land/ad/5570801683?se=vOL59of68BGQX4le8SOzFA&utm_medium=api&utm_source=a4bcf954&v=C225A1F96111EBD582F9F60814ADDFED0300EA96,Adzuna::API::Response::Job,48.776198,Duales Studium Wirtschaftsinformatik - Data Science (B.Sc.) (m/w/d),"{'__CLASS__': 'Adzuna::API::Response::Location', 'area': ['Deutschland', 'Baden-Württemberg', 'Stuttgart'], 'display_name': 'Stuttgart, Baden-Württemberg'}","{'tag': 'unknown', 'label': 'Unknown', '__CLASS__': 'Adzuna::API::Response::Category'}",9.187224,5570801683,,,,
2026-01-25T14:44:44Z,"Wegweisende Ideen, höchste Qualitätsansprüche, maximaler Kundennutzen: Rund um den Globus setzen wir mit über 4.700 Mitarbeiterinnen und Mitarbeitern Maßstäbe. Unser Handeln wird weltweit bestimmt von unserem Leitbild und unseren Werten – innovativ, eigenverantwortlich und seriös. Kern unseres fischerProzessSystems (fPS) ist es, in allen Unternehmensbereichen Prozesse ständig weiter zu verbessern, diese an den Bedürfnissen unserer Kunden auszurichten, Verschwendung zu vermeiden und wertschöpfen…",eyJhbGciOiJIUzI1NiJ9.eyJzIjoidk9MNTlvZjY4QkdRWDRsZThTT3pGQSIsImkiOiI1NjAwMDY5MjAwIn0.gZD1YaxQZ5W5WS1HaM2zwKu21i4YfO1cConJHbz2Q7o,"{'display_name': 'fischerwerke GmbH & Co. KG', '__CLASS__': 'Adzuna::API::Response::Company'}",0,https://www.adzuna.de/land/ad/5600069200?se=vOL59of68BGQX4le8SOzFA&utm_medium=api&utm_source=a4bcf954&v=005442C438C4F2C8F6BEA4DA64C363D28A97D8B0,Adzuna::API::Response::Job,,Duales Studium Data Science und Künstliche Intelligenz (B.Sc.) – Start Herbst 2026,"{'display_name': 'Deutschland', 'area': ['Deutschland'], '__CLASS__': 'Adzuna::API::Response::Location'}","{'tag': 'unknown', '__CLASS__': 'Adzuna::API::Response::Category', 'label': 'Unknown'}",,5600069200,,,,
2026-01-12T02:26:08Z,"HENSOLDT ist ein führendes Unternehmen der europäischen Verteidigungsindustrie mit globaler Reichweite. Das Unternehmen mit Sitz in Taufkirchen bei München entwickelt Sensor-Komplettlösungen für Verteidigungs- und Sicherheitsanwendungen. Als Technologieführer treibt HENSOLDT die Entwicklung der Verteidigungselektronik und Optronik voran und baut sein Portfolio auf der Grundlage innovativer Ansätze für Datenmanagement, Robotik und Cybersicherheit kontinuierlich aus. Unsere Produkte sind einsetzb…",eyJhbGciOiJIUzI1NiJ9.eyJpIjoiNTU4MDA2Mzg3MCIsInMiOiJ2T0w1OW9mNjhCR1FYNGxlOFNPekZBIn0.Xu4firQi6E5l21Vgglsqp93PUg227y0TxBMaBYNqwOY,"{'display_name': 'HENSOLDT', '__CLASS__': 'Adzuna::API::Response::Company'}",0,https://www.adzuna.de/land/ad/5580063870?se=vOL59of68BGQX4le8SOzFA&utm_medium=api&utm_source=a4bcf954&v=A75A69E40CE700A321A509006160716F89F15B61,Adzuna::API::Response::Job,,"Duales Studium: ""Data Science & künstliche Intelligenz"" (w/m/d), Start 2026","{'__CLASS__': 'Adzuna::API::Response::Location', 'area': ['Deutschland'], 'display_name': 'Deutschland'}","{'__CLASS__': 'Adzuna::API::Response::Category', 'label': 'Unknown', 'tag': 'unknown'}",,5580063870,,,,
2026-01-24T14:34:57Z,"Die S-Management Services GmbH ist ein Unternehmen der Sparkassen-Finanzgruppe und Partner für Business-Lösungen im Firmenkunden- und Immobiliengeschäft sowie im Formular- und Nachhaltigkeitsmanagement. Ihre Expertise ist es, Lösungen vom Konzept bis zur Umsetzung zu gestalten und in bestehende Business-Prozesse und IT-Landschaften sinnvoll zu integrieren. Mit Kopf, Herz und Hand ist die S-Management Services der BusinessMöglichMacher in der DSV-Gruppe, dem zentralen Dienstleister der Sparkasse…",eyJhbGciOiJIUzI1NiJ9.eyJpIjoiNTU5ODczMzMyMiIsInMiOiJ2T0w1OW9mNjhCR1FYNGxlOFNPekZBIn0.fxIFE3KuRgcSRakFqu_mIAiJlCWLftpMpDMaJrNHJNU,"{'__CLASS__': 'Adzuna::API::Response::Company', 'display_name': 'S-Management Services GmbH - Ein Unternehmen der DSV-Gruppe'}",0,https://www.adzuna.de/land/ad/5598733322?se=vOL59of68BGQX4le8SOzFA&utm_medium=api&utm_source=a4bcf954&v=FE6449DFBF746A531E967D969B70398A3696C013,Adzuna::API::Response::Job,48.776198,IT-Architekt mit Schwerpunkt Data Science (m/w/d),"{'area': ['Deutschland', 'Baden-Württemberg', 'Stuttgart'], 'display_name': 'Stuttgart, Baden-Württemberg', '__CLASS__': 'Adzuna::API::Response::Location'}","{'tag': 'it-jobs', 'label': 'IT-Stellen', '__CLASS__': 'Adzuna::API::Response::Category'}",9.187224,5598733322,,,,
2026-01-07T02:23:38Z,"WHAT DO YOU DO FOR A LIVING? Als starker Arbeitgeber und attrak­tives Aus­bildungs­unter­nehmen bieten wir dir im Herzen Stuttgarts viel­fältige und spannende Aus­bildungs- und Studien­plätze mit besten Über­nahme­chancen. Für den Studienstart am 1. September 2026 suchen wir am Standort Stuttgart aufge­schlossene und moti­vierte Studierende. DHBW-Studium Bachelor of Science – Wirt­schafts­informatik – Data Science Aufgaben Drei Jahre bei der WGV studieren, dann hast du es geschafft und kannst d…",eyJhbGciOiJIUzI1NiJ9.eyJpIjoiNTU3MDc5ODUxNiIsInMiOiJ2T0w1OW9mNjhCR1FYNGxlOFNPekZBIn0.3HFndf07ZiBD0KcGteupmwN3Py43kp4npGJULA-XXDY,"{'display_name': 'WGV - Württembergische Gemeinde-Versicherung a.G.', '__CLASS__': 'Adzuna::API::Response::Company'}",0,https://www.adzuna.de/land/ad/5570798516?se=vOL59of68BGQX4le8SOzFA&utm_medium=api&utm_source=a4bcf954&v=03D91ADE3C0AEC40AE2A5BC6D19095317BA0BB69,Adzuna::API::Response::Job,48.776198,DHBW-Studium Bachelor of Science – Wirtschaftsinformatik – Data Science,"{'display_name': 'Stuttgart, Baden-Württemberg', 'area': ['Deutschland', 'Baden-Württemberg', 'Stuttgart'], '__CLASS__': 'Adzuna::API::Response::Location'}","{'tag': 'it-jobs', 'label': 'IT-Stellen', '__CLASS__': 'Adzuna::API::Response::Category'}",9.187224,5570798516,,,,
2026-01-14T02:27:13Z,"Life is always about becoming… Im Leben geht es darum, sich auf eine Reise zu begeben, um die beste Version unseres zukünftigen Selbst zu werden. Während wir Neues entdecken, stellen wir uns Herausforderungen, meistern sie und wachsen über uns hinaus. Bewerben Sie sich bei Mercedes-Benz und finden Sie den Aufgabenbereich, in dem Sie Ihre Talente individuell entfalten können. Dabei werden Sie von visionären Kolleginnen und Kollegen unterstützt, die Ihren Pioniergeist teilen. Bei uns einzusteigen…",eyJhbGciOiJIUzI1NiJ9.eyJpIjoiNTU4MzM2MTMxMiIsInMiOiJ2T0w1OW9mNjhCR1FYNGxlOFNPekZBIn0.ky0sQv29Zqdvdae8JpYW_KOltuALaLc1SUZjWfNgMeE,"{'display_name': 'Mercedes-Benz Group AG', '__CLASS__': 'Adzuna::API::Response::Company'}",0,https://www.adzuna.de/land/ad/5583361312?se=vOL59of68BGQX4le8SOzFA&utm_medium=api&utm_source=a4bcf954&v=B88026D034394EB687F95F0E685F7AC448E862CA,Adzuna::API::Response::Job,48.745846,"Duales Studium Wirtschaftsinformatik/Data Science (B.Sc.), Stuttgart 2026 (w/m/d)","{'area': ['Deutschland', 'Baden-Württemberg', 'Esslingen (Kreis)', 'Esslingen am Neckar'], 'display_name': 'Esslingen am Neckar, Esslingen (Kreis)', '__CLASS__': 'Adzuna::API::Response::Location'}","{'tag': 'unknown', '__CLASS__': 'Adzuna::API::Response::Category', 'label': 'Unknown'}",9.315933,5583361312,,,,
2026-01-23T14:47:35Z,"We are seeking a technically skilled leader to join our dynamic Data Science department at AUTO1 Group Technology. As part of our disruptive approach in the used car market, our team leverages cutting-edge technology to gather and analyze data, optimizing our platforms and processes. AUTO1 Group is Europe's leading digital automotive platform. We revolutionize the used car market with our well-known brands Autohero, wirkaufendeinauto.de, and AUTO1.com. Aufgaben Collaborate closely with your tea…",eyJhbGciOiJIUzI1NiJ9.eyJpIjoiNTU5NzEzMzk1MyIsInMiOiJ2T0w1OW9mNjhCR1FYNGxlOFNPekZBIn0.Vvcq9F2WMelEQ8i48ZOcurpTfQ7l7XdsvjjzwgZ2O8Y,"{'__CLASS__': 'Adzuna::API::Response::Company', 'display_name': 'AUTO1 Group'}",0,https://www.adzuna.de/land/ad/5597133953?se=vOL59of68BGQX4le8SOzFA&utm_medium=api&utm_source=a4bcf954&v=4A5EE11DACEB607E5F5DC002B607A7DB1CBA97EE,Adzuna::API::Response::Job,52.507706,Team Lead Data Science (f/m/x),"{'area': ['Deutschland', 'Berlin'], 'display_name': 'Berlin, Deutschland', '__CLASS__': 'Adzuna::API::Response::Location'}","{'tag': 'unknown', 'label': 'Unknown', '__CLASS__': 'Adzuna::API::Response::Category'}",13.420806,5597133953,,,,
2026-01-12T14:26:50Z,"Die Markant Gruppe ist eines der grössten Dienstleistungsunternehmen in Europa für Handels- und Industriepartner aus dem Food- und Nonfood-Bereich. Unser breites Lösungsportfolio reicht von der Vereinfachung von Datenströmen und Zahlungsabwicklungen über exklusive Finanz- und Versicherungs-Services bis hin zu modernsten Marktforschungstools. Dahinter steckt die Idee: Kunden im operativen Tagesgeschäft zu entlasten, damit sie sich auf ihr Kerngeschäft konzentrieren können. Was noch dahintersteck…",eyJhbGciOiJIUzI1NiJ9.eyJpIjoiNTU4MDQzMTE3NyIsInMiOiJ2T0w1OW9mNjhCR1FYNGxlOFNPekZBIn0.O7AoTqraf7lG_TYtNQIsqCBTRwN5KXMRpyFqz5uymi0,"{'display_name': 'Markant Gruppe', '__CLASS__': 'Adzuna::API::Response::Company'}",0,https://www.adzuna.de/land/ad/5580431177?se=vOL59of68BGQX4le8SOzFA&utm_medium=api&utm_source=a4bcf954&v=2E6B8F51946A46E66D952E85E2EB207E293F04E3,Adzuna::API::Response::Job,48.42392,Duales Studium zum Bachelor of Science – Data Science & Künstliche Intelligenz 2026 (m/w/d),"{'area': ['Deutschland', 'Baden-Württemberg', 'Ortenaukreis', 'Offenburg'], 'display_name': 'Offenburg, Ortenaukreis', '__CLASS__': 'Adzuna::API::Response::Location'}","{'tag': 'unknown', 'label': 'Unknown', '__CLASS__': 'Adzuna::API::Response::Category'}",7.94837,5580431177,,,,
2026-01-07T02:23:54Z,"Bachelor of Science (B.Sc.) Studiengang: Data Science & Künstliche Intelligenz Ausschreibungs-Nr 2026_322 Ausbildungsbeginn 2026 Standort Schwäbisch Gmünd Aufgaben Gestalte die digitale Zukunft? Mit uns! Data Science & KI sind keine Buzzwords - sie sind der Motor unserer Zeit. Ob smarte Produkte, autonome Systeme oder datengetriebene Entscheidungen: Hier gestaltest du die Technologien, die morgen Alltag sind. Mit deinem dualen Studium bei uns verbindest du Wissen & Praxis: spannende Theorie an …",eyJhbGciOiJIUzI1NiJ9.eyJzIjoidk9MNTlvZjY4QkdRWDRsZThTT3pGQSIsImkiOiI1NTcwODAwNzE3In0.Jv-RV8F77qr37wr4vF1krbDbTgPodRKWR9PZ3nmpaIo,"{'__CLASS__': 'Adzuna::API::Response::Company', 'display_name': 'Robert Bosch GmbH'}",0,https://www.adzuna.de/land/ad/5570800717?se=vOL59of68BGQX4le8SOzFA&utm_medium=api&utm_source=a4bcf954&v=10567BA4E922CF91251F0783E06D2C07D35A6252,Adzuna::API::Response::Job,48.79495,Ausbildung: Bachelor of Science (B.Sc.) Studiengang: Data Science & Künstliche Intelligenz,"{'__CLASS__': 'Adzuna::API::Response::Location', 'display_name': 'Schwäbisch Gmünd, Ostalbkreis', 'area': ['Deutschland', 'Baden-Württemberg', 'Ostalbkreis', 'Schwäbisch Gmünd']}","{'tag': 'other-general-jobs', '__CLASS__': 'Adzuna::API::Response::Category', 'label': 'Sonstige/Allgemeine Stellen'}",9.851063,5570800717,,,,
2026-01-20T02:42:14Z,"Sich etwas Neues trauen, über sich hinauswachsen und dabei die Grenzen des Machbaren neu definieren. Genau das ist es, was unsere Mitarbeitenden täglich leben dürfen und sollen. Um mit unseren Innovationen ein Zeichen zu setzen und Großartiges zu ermöglichen. Denn hinter jedem erfolgreichen Unternehmen stehen eine ganze Menge faszinierende Menschen. In einem offenen und modernen Umfeld mit zahlreichen Entwicklungs- und Weiterbildungsmöglichkeiten, arbeiten die Mitarbeitenden bei ZEISS in einer …",eyJhbGciOiJIUzI1NiJ9.eyJpIjoiNTU5MTkwMjE2MSIsInMiOiJ2T0w1OW9mNjhCR1FYNGxlOFNPekZBIn0.Xk3ZG345uDbsVnhV8VNYJsYh1jByO_MTYJHr6qSiFME,"{'__CLASS__': 'Adzuna::API::Response::Company', 'display_name': 'ZEISS'}",0,https://www.adzuna.de/land/ad/5591902161?se=vOL59of68BGQX4le8SOzFA&utm_medium=api&utm_source=a4bcf954&v=FA80ED1E8488B7D435AE7199C573D781B18EAB41,Adzuna::API::Response::Job,50.923007,"Duales Studium – Data Science und Künstliche Intelligenz (m/w/x), Beginn Herbst 2026","{'display_name': 'Jena, Thüringen', 'area': ['Deutschland', 'Thüringen', 'Jena'], '__CLASS__': 'Adzuna::API::Response::Location'}","{'label': 'Unknown', '__CLASS__': 'Adzuna::API::Response::Category', 'tag': 'unknown'}",11.589469,5591902161,,,,
2026-01-21T14:45:42Z,"Teil von MID zu sein, bedeutet MIDgestalter:in zu sein! Gemeinsam als Team – aktuell 170 Kolleg:innen – brennen wir täglich darauf, den Wandel bei unseren Kunden in zukunftsfähige Mehrwerte zu überführen. Schneller denn je ändern sich durch neue Technologien und Wettbewerb die Randbedingungen für aktuelle Geschäftsmodelle. Um erfolgreich zu sein, sollten IT-Fähigkeiten, -Strukturen, -Assets und -Prozesse mindestens genauso schnell angepasst und weiterentwickelt werden können. Und genau hier set…",eyJhbGciOiJIUzI1NiJ9.eyJpIjoiNTU5MzkzODY3MSIsInMiOiJ2T0w1OW9mNjhCR1FYNGxlOFNPekZBIn0.dw8ftokrPuSW3thM6d9vUMwFe0-gc1AvwvAN_8cptyI,"{'__CLASS__': 'Adzuna::API::Response::Company', 'display_name': 'MID GmbH'}",0,https://www.adzuna.de/land/ad/5593938671?se=vOL59of68BGQX4le8SOzFA&utm_medium=api&utm_source=a4bcf954&v=2811E3A9CF67E65E616B8A08979AF74874EA6335,Adzuna::API::Response::Job,49.443967,Senior Consultant (m/w/d) Data Science / Künstliche Intelligenz / AI,"{'__CLASS__': 'Adzuna::API::Response::Location', 'display_name': 'Nürnberg, Bayern', 'area': ['Deutschland', 'Bayern', 'Nürnberg']}","{'__CLASS__': 'Adzuna::API::Response::Category', 'label': 'IT-Stellen', 'tag': 'it-jobs'}",11.083642,5593938671,,,,
2026-01-14T14:28:30Z,"Wir sind MAINGAU – ein ambitioniertes Energie- und Techunternehmen mit klarem Fokus auf technologiegetriebene Lösungen für die Energiewelt von morgen. Mehr als 1.000.000 Kundenbeziehungen europaweit und ein Umsatz von 1,3 Milliarden Euro in 2024 machen uns zu einem der am schnellsten wachsenden Energieunternehmen Deutschlands. Neben dem Strom- und Gasvertrieb bieten wir vielfältige Produkte in den Bereichen E-Mobilität, Internet und Mobilfunk und betreiben einen Onlineshop. An unserem Standort …",eyJhbGciOiJIUzI1NiJ9.eyJpIjoiNTU4NDAxMjk1MyIsInMiOiJ2T0w1OW9mNjhCR1FYNGxlOFNPekZBIn0.9U067t3qMAowjr9tVuQXakOAaMKy41E9ZQLZtWXEAMs,"{'__CLASS__': 'Adzuna::API::Response::Company', 'display_name': 'MAINGAU Energie GmbH'}",0,https://www.adzuna.de/land/ad/5584012953?se=vOL59of68BGQX4le8SOzFA&utm_medium=api&utm_source=a4bcf954&v=ACCBF5148DC598B23BC9CD2FE03EB0AF4FF533C8,Adzuna::API::Response::Job,50.08229,Duales Studium Bachelor of Science (B.Sc.) Data Science und Künstliche Intelligenz,"{'area': ['Deutschland', 'Hessen', 'Offenbach (Kreis)', 'Obertshausen'], 'display_name': 'Obertshausen, Offenbach (Kreis)', '__CLASS__': 'Adzuna::API::Response::Location'}","{'tag': 'unknown', '__CLASS__': 'Adzuna::API::Response::Category', 'label': 'Unknown'}",8.86518,5584012953,,,,
2026-01-15T02:29:48Z,"Life is always about becoming… Im Leben geht es darum, sich auf eine Reise zu begeben, um die beste Version unseres zukünftigen Selbst zu werden. Während wir Neues entdecken, stellen wir uns Herausforderungen, meistern sie und wachsen über uns hinaus. Bewerben Sie sich bei Mercedes-Benz und finden Sie den Aufgabenbereich, in dem Sie Ihre Talente individuell entfalten können. Dabei werden Sie von visionären Kolleginnen und Kollegen unterstützt, die Ihren Pioniergeist teilen. Bei uns einzusteigen…",eyJhbGciOiJIUzI1NiJ9.eyJzIjoidk9MNTlvZjY4QkdRWDRsZThTT3pGQSIsImkiOiI1NTg1NDUzMjM0In0.NJhkz-C9pdTFIyFjFVzHnNJJ2t4f8YnVnElDI4MQe6E,"{'display_name': 'Mercedes-Benz Customer Solutions GmbH', '__CLASS__': 'Adzuna::API::Response::Company'}",0,https://www.adzuna.de/land/ad/5585453234?se=vOL59of68BGQX4le8SOzFA&utm_medium=api&utm_source=a4bcf954&v=2DD167B3E21BDE33DD1177D9A9DCF138C97CE2B8,Adzuna::API::Response::Job,48.776198,"Duales Studium Wirtschaftsinformatik - Vertiefung Data Science, Bachelor of Science, Mercedes-Benz Customer Solutions GmbH, Stuttgart Vaihingen, Studienbeginn 1. Oktober 2026 (m/w/d)","{'__CLASS__': 'Adzuna::API::Response::Location', 'display_name': 'Stuttgart, Baden-Württemberg', 'area': ['Deutschland', 'Baden-Württemberg', 'Stuttgart']}","{'__CLASS__': 'Adzuna::API::Response::Category', 'label': 'Unknown', 'tag': 'unknown'}",9.187224,5585453234,,,,
2026-01-21T18:16:03Z,"An der Fakultät für Informatik und Elektrotechnik ist zum nächstmöglichen Zeitpunkt – vorbehaltlich haushaltsrechtlicher Regelungen – die W3-Professur für Data Engineering for Data Science zu besetzen. Daten sind essentiell in der modernen Gesellschaft und ein wichtiger Baustein in vielen Geschäftsmodellen. Data Science, die sich auf die systematische Gewinnung von Erkenntnissen und Wissen aus großen Datenbeständen und Rohdaten konzentriert, ist für jede wirtschaftliche, staatliche und wissensc…",eyJhbGciOiJIUzI1NiJ9.eyJzIjoidk9MNTlvZjY4QkdRWDRsZThTT3pGQSIsImkiOiI1NTk0MDgyMTEwIn0.r0MmRrezpCstF-ZOAyXEN3WYZimpx01xYFKhcNf0AjU,"{'__CLASS__': 'Adzuna::API::Response::Company', 'display_name': 'Universität Rostock'}",0,https://www.adzuna.de/land/ad/5594082110?se=vOL59of68BGQX4le8SOzFA&utm_medium=api&utm_source=a4bcf954&v=8251AA5915FB842C51521546D7B7612D1CDC1052,Adzuna::API::Response::Job,54.03683,W3-Professur für Data Engineering for Data Science,"{'__CLASS__': 'Adzuna::API::Response::Location', 'display_name': 'Biestow, Rostock', 'area': ['Deutschland', 'Mecklenburg-Vorpommern', 'Rostock', 'Biestow']}","{'tag': 'teaching-jobs', '__CLASS__': 'Adzuna::API::Response::Category', 'label': 'Lehrberufe'}",12.12967,5594082110,,,,
2025-08-12T20:35:42Z,"Unternehmensbeschreibung Gerresheimer ist als innovativer System- und Lösungsanbieter der globale Partner für die Pharma-, Biotech- und Kosmetikbranche. Die Gruppe bietet ein umfassendes Portfolio an Drug-Containment-Lösungen inklusive Verschlüsse und Zubehör, sowie Drug-Delivery-Systemen, Medizinprodukten und Lösungen für die Gesundheitsbranche an. Das Leistungsspektrum umfasst unter anderem digitale Lösungen für die Therapiebegleitung, Medikamentenpumpen, Spritzen, Pens, Autoinjektoren und In…",eyJhbGciOiJIUzI1NiJ9.eyJzIjoidk9MNTlvZjY4QkdRWDRsZThTT3pGQSIsImkiOiI1MzQ5MjUxNjc2In0.PDpCnwFYzFgl_KOW7lGrP26rqPaOUwD4XiGk2oY-DGs,"{'__CLASS__': 'Adzuna::API::Response::Company', 'display_name': 'Gerresheimer AG'}",0,https://www.adzuna.de/land/ad/5349251676?se=vOL59of68BGQX4le8SOzFA&utm_medium=api&utm_source=a4bcf954&v=8D753D5A12484BA5BBC14CC408F6EB37235825F3,Adzuna::API::Response::Job,49.49349,Abiturient für Duales Studium Data Science IoT Plattform (m/w/d),"{'__CLASS__': 'Adzuna::API::Response::Location', 'area': ['Deutschland', 'Bayern', 'Schwandorf (Kreis)', 'Pfreimd'], 'display_name': 'Pfreimd, Schwandorf (Kreis)'}","{'tag': 'it-jobs', '__CLASS__': 'Adzuna::API::Response::Category', 'label': 'IT-Stellen'}",12.17958,5349251676,full_time,,,
