created,title,adref,category,redirect_url,location,company,longitude,id,latitude,__CLASS__,description,salary_is_predicted,contract_time,salary_max,salary_min,contract_type
2026-03-26T15:13:44Z,Duales Studium - Data Science und Künstliche Intelligenz,eyJhbGciOiJIUzI1NiJ9.eyJpIjoiNTY3OTI4MTk5NSIsInMiOiJhQzk5X3hZMzhSRzN1cmZyQmdmOWZnIn0.go8NMRjl-voPjim7TwAlpXVYTVSdwOrrhUGeOrlrlYg,"{'__CLASS__': 'Adzuna::API::Response::Category', 'tag': 'unknown', 'label': 'Unknown'}",https://www.adzuna.de/land/ad/5679281995?se=aC99_xY38RG3urfrBgf9fg&utm_medium=api&utm_source=a4bcf954&v=978FE26E4547D136B9274FF9F6A6808603AD356F,"{'area': ['Deutschland', 'Bayern', 'München (Kreis)', 'Grünwald'], 'display_name': 'Grünwald, München (Kreis)', '__CLASS__': 'Adzuna::API::Response::Location'}","{'__CLASS__': 'Adzuna::API::Response::Company', 'display_name': 'RTL2 Fernsehen GmbH & Co. KG'}",11.52226,5679281995,48.03972,Adzuna::API::Response::Job,"Über RTLZWEI Überraschend, unangepasst, optimistisch und ganz nah dran: Das ist RTLZWEI. Hier erlebt das Publikum das Leben in all seinen Facetten. Als „Home of Reality“ zeigt der Sender Dokumentationen, Reportagen und Doku-Soaps, faszinierende Menschen und bewegende Schicksale. Mit einer konsequenten Multichannel-Strategie steigen die Reichweiten in den digitalen Kanälen stetig an. Exklusive Inhalte werden unter anderem auch im Streaming-Dienst RTL angeboten. Studieren und gleichzeitig Praxise…",0,,,,
2026-03-28T15:19:53Z,Duales Studium Data Science und Künstliche Intelligenz (m/w/d),eyJhbGciOiJIUzI1NiJ9.eyJzIjoiYUM5OV94WTM4UkczdXJmckJnZjlmZyIsImkiOiI1NjgxNDA4MDI0In0.kmuKGx60JCAaQB5_mZdzcW5Zu2AbLH72q06gostZr1M,"{'__CLASS__': 'Adzuna::API::Response::Category', 'label': 'Unknown', 'tag': 'unknown'}",https://www.adzuna.de/land/ad/5681408024?se=aC99_xY38RG3urfrBgf9fg&utm_medium=api&utm_source=a4bcf954&v=A1DD0E6D97748FF0A4B273EE6DE584BD00A0FE4F,"{'__CLASS__': 'Adzuna::API::Response::Location', 'display_name': 'Bessenbach, Aschaffenburg (Kreis)', 'area': ['Deutschland', 'Bayern', 'Aschaffenburg (Kreis)', 'Bessenbach']}","{'__CLASS__': 'Adzuna::API::Response::Company', 'display_name': 'SAF-HOLLAND GmbH'}",9.24812,5681408024,49.9599,Adzuna::API::Response::Job,"SAF-HOLLAND ist ein international führender Hersteller von fahrwerksbezogenen Baugruppen und Komponenten für Trailer, LKW und Busse. Auf sechs Kontinenten beschäftigt SAF-HOLLAND rund 6.000 engagierte Mitarbeitende. Die Produktpalette umfasst unter anderem Achs- und Federungssysteme für Trailer sowie Sattelkupplungen und Kupplungssysteme für LKW, Anhänger und Sattelauflieger als auch Brems- und EBS-Systeme. SAF-HOLLAND entwickelt innovative Produkte zur Erhöhung der Effizienz, Sicherheit und Um…",0,,,,
2026-04-02T04:21:00Z,Duales Studium zum Bachelor of Science – Data Science & Künstliche Intelligenz 2027 (m/w/d),eyJhbGciOiJIUzI1NiJ9.eyJpIjoiNTY4NjcyNTUyMCIsInMiOiJhQzk5X3hZMzhSRzN1cmZyQmdmOWZnIn0.P6GR5LZx-aXeUqiG1xplslkvpi3lkcfBj0XvdyKXBWE,"{'__CLASS__': 'Adzuna::API::Response::Category', 'label': 'Unknown', 'tag': 'unknown'}",https://www.adzuna.de/land/ad/5686725520?se=aC99_xY38RG3urfrBgf9fg&utm_medium=api&utm_source=a4bcf954&v=5214F60BA29B8358C0343E25F6FC201B4BFFB255,"{'area': ['Deutschland', 'Baden-Württemberg', 'Ortenaukreis', 'Offenburg'], '__CLASS__': 'Adzuna::API::Response::Location', 'display_name': 'Offenburg, Ortenaukreis'}","{'display_name': 'Markant Gruppe', '__CLASS__': 'Adzuna::API::Response::Company'}",7.94837,5686725520,48.42392,Adzuna::API::Response::Job,"Die Markant Gruppe ist eines der grössten Dienstleistungsunternehmen in Europa für Handels- und Industriepartner aus dem Food- und Nonfood-Bereich. Unser breites Lösungsportfolio reicht von der Vereinfachung von Datenströmen und Zahlungsabwicklungen über exklusive Finanz- und Versicherungs-Services bis hin zu modernsten Marktforschungstools. Dahinter steckt die Idee: Kunden im operativen Tagesgeschäft zu entlasten, damit sie sich auf ihr Kerngeschäft konzentrieren können. Was noch dahintersteck…",0,,,,
2026-04-11T16:21:15Z,DHBW-Studium Bachelor of Science – Wirtschaftsinformatik – Data Science,eyJhbGciOiJIUzI1NiJ9.eyJzIjoiYUM5OV94WTM4UkczdXJmckJnZjlmZyIsImkiOiI1Njk2NzM3Nzc3In0.coLstLqVKWEh9wQgM-IcCB3wyit4WrphdFdv9MhJdFM,"{'tag': 'it-jobs', 'label': 'IT-Stellen', '__CLASS__': 'Adzuna::API::Response::Category'}",https://www.adzuna.de/land/ad/5696737777?se=aC99_xY38RG3urfrBgf9fg&utm_medium=api&utm_source=a4bcf954&v=F36423B14A325C29EA26AAE8A1C6107D446202C5,"{'__CLASS__': 'Adzuna::API::Response::Location', 'display_name': 'Stuttgart, Baden-Württemberg', 'area': ['Deutschland', 'Baden-Württemberg', 'Stuttgart']}","{'__CLASS__': 'Adzuna::API::Response::Company', 'display_name': 'WGV - Württembergische Gemeinde-Versicherung a.G.'}",9.187224,5696737777,48.776198,Adzuna::API::Response::Job,DHBW-Studium Bachelor of Science – Wirt­schafts­informatik – Data Science Als starker Arbeitgeber und attrak­tives Aus­bildungs­unter­nehmen bieten wir viel­fältige und spannende Aus­bildungs- und Studien­plätze mit besten Über­nahme­chancen. Bereit für ein echt spannendes und abwechslungsreiches Studium? Wir machen dich fit für deine Zukunft in einer modernen Versicherung. Für den Studienstart am 01.09.2026 in Stuttgart suchen wir aufgeschlossene und motivierte Studierende. Aufgaben Drei Jahre…,0,,,,
2026-04-03T04:23:53Z,HR Controller (m/w/d) mit Schwerpunkt Data Science,eyJhbGciOiJIUzI1NiJ9.eyJpIjoiNTY4ODE3NDA1MyIsInMiOiJhQzk5X3hZMzhSRzN1cmZyQmdmOWZnIn0.9DO8MDvi7yrTjyY8THjraI7VLxa37lRCNQOoucxEkf8,"{'label': 'Unknown', 'tag': 'unknown', '__CLASS__': 'Adzuna::API::Response::Category'}",https://www.adzuna.de/land/ad/5688174053?se=aC99_xY38RG3urfrBgf9fg&utm_medium=api&utm_source=a4bcf954&v=DEBD320A4512BF84D46B780621CED64AA0A9A44F,"{'area': ['Deutschland'], 'display_name': 'Deutschland', '__CLASS__': 'Adzuna::API::Response::Location'}","{'__CLASS__': 'Adzuna::API::Response::Company', 'display_name': 'Dirk Rossmann GmbH'}",,5688174053,,Adzuna::API::Response::Job,"Unsere Unternehmenszentrale in Burgwedel bei Hannover – Hier arbeiten rund 3.000 Mitarbeitende mit vollem Einsatz daran, die Zukunft von ROSSMANN zu gestalten. Heute wissen, was uns morgen verbindet! Unser Human Resources Fachbereich besteht aus engagierten Bereichen mit vielen fantastischen Expertenteams und zählt über 300 Mitarbeitende: Ob HR Management, HR Service, Learning & Development, Talent Acquisition & Employer Branding, HR Start Up oder HR Tech, Analytics & Projects – alle Teams arbe…",0,,,,
2026-03-24T05:57:12Z,Praktikum (m|w|d) im Bereich Data Science & Process Improvement,eyJhbGciOiJIUzI1NiJ9.eyJpIjoiNTY3NjU1Mzg0MCIsInMiOiJhQzk5X3hZMzhSRzN1cmZyQmdmOWZnIn0.2P7aq0NtMMaoLltQZ50DVB0qWn7AJceoggWoASl53jU,"{'tag': 'it-jobs', 'label': 'IT-Stellen', '__CLASS__': 'Adzuna::API::Response::Category'}",https://www.adzuna.de/land/ad/5676553840?se=aC99_xY38RG3urfrBgf9fg&utm_medium=api&utm_source=a4bcf954&v=FB102C31A21812BD560A0E435BBC783F4DA54E88,"{'display_name': 'Crailsheim, Schwäbisch Hall (Kreis)', '__CLASS__': 'Adzuna::API::Response::Location', 'area': ['Deutschland', 'Baden-Württemberg', 'Schwäbisch Hall (Kreis)', 'Crailsheim']}","{'__CLASS__': 'Adzuna::API::Response::Company', 'display_name': 'Voith SE & Co. KG'}",10.07197,5676553840,49.13436,Adzuna::API::Response::Job,"Über die Voith Group Die Voith Group ist ein weltweit agierender Technologiekonzern. Mit seinem breiten Portfolio aus Anlagen, Produkten, Serviceleistungen und digitalen Anwendungen setzt Voith Maßstäbe in den Märkten Energie, Papier, Rohstoffe und Transport & Automotive. Gegründet 1867 ist Voith heute mit rund 22.000 Mitarbeiterinnen und Mitarbeitern, 5,2 Milliarden Euro Umsatz und Standorten in über 60 Ländern der Welt eines der großen Familienunternehmen Europas . Unterstütze die Voith Group…",0,full_time,,,
2026-04-08T12:40:42Z,Junior Consultant Analytics Data Science (m/w/d),eyJhbGciOiJIUzI1NiJ9.eyJzIjoiYUM5OV94WTM4UkczdXJmckJnZjlmZyIsImkiOiI1NjkzMDQ3NDU2In0.z-q9C1xb8K810lmVls2xQCV3q79bfGrBUmgBD_sNgCg,"{'tag': 'unknown', 'label': 'Unknown', '__CLASS__': 'Adzuna::API::Response::Category'}",https://www.adzuna.de/land/ad/5693047456?se=aC99_xY38RG3urfrBgf9fg&utm_medium=api&utm_source=a4bcf954&v=9352D51F46000961DCB48290162075ADF565AF48,"{'__CLASS__': 'Adzuna::API::Response::Location', 'display_name': 'Hamburg, Deutschland', 'area': ['Deutschland', 'Hamburg']}","{'display_name': 'ISR Information Products AG', '__CLASS__': 'Adzuna::API::Response::Company'}",9.987297,5693047456,53.557429,Adzuna::API::Response::Job,"Dein Team Du hast Freude an Innovationen, spannenden Inhalten und kollegialem Teamspirit? Mit unseren Berater:innen wächst du mit deinen Aufgaben und lernst von unseren Expert:innen. Gemeinsam beraten wir unsere deutsch- und englischsprachigen Kunden bei ihren Herausforderungen im Umfeld von Business Intelligence, Planung, Advanced Analytics & Data Science. Wir verbinden höchste Beratungskompetenz mit technischer Expertise. Dabei konzipieren und implementieren wir maßgeschneiderte Lösungen auf …",0,full_time,,,
2025-11-12T15:13:27Z,Schulabsolvent als Dualer Student Künstliche Intelligenz & Data Science (m/w/d),eyJhbGciOiJIUzI1NiJ9.eyJpIjoiNTQ5MjMzNjc3NiIsInMiOiJhQzk5X3hZMzhSRzN1cmZyQmdmOWZnIn0.dMQr6NAR1XkfEeKe8QpjDRfxi8I-9_AajIRSMf9ZEkw,"{'label': 'IT-Stellen', 'tag': 'it-jobs', '__CLASS__': 'Adzuna::API::Response::Category'}",https://www.adzuna.de/land/ad/5492336776?se=aC99_xY38RG3urfrBgf9fg&utm_medium=api&utm_source=a4bcf954&v=2943AE67898FDE42079E37CFC5F7E390C951177C,"{'area': ['Deutschland'], '__CLASS__': 'Adzuna::API::Response::Location', 'display_name': 'Deutschland'}","{'__CLASS__': 'Adzuna::API::Response::Company', 'display_name': 'Swarco AG'}",,5492336776,,Adzuna::API::Response::Job,"Aufgaben Das primäre Ziel ist die Ausbildung von Informatik-Allroundern (m/w/d) für eine Tätigkeit in der Berufspraxis Die Pflichtfächer decken ein breites fachliches Spektrum ab, eine große Zahl an Modulen mit Wahlmöglichkeit erlaubt die individuelle Vertiefung Während der Praxisphasen erhältst du von uns Projekte und/oder Problemstellungen, die du selbstständig behandelst und natürlich mit Unterstützung löst Das Studium verbindet ein wissenschaftliches Hochschulstudium mit unternehmerischer P…",0,full_time,,,
2026-04-12T04:37:58Z,AI Experte - KI-Strategie / Change-Management / Data Science (m/w/d),eyJhbGciOiJIUzI1NiJ9.eyJpIjoiNTY5NzE5MzExMyIsInMiOiJhQzk5X3hZMzhSRzN1cmZyQmdmOWZnIn0.YLf73pfpQq1AYl-6xizY4sq_O0XqhHuayD2prZFhRq4,"{'label': 'Sonstige/Allgemeine Stellen', 'tag': 'other-general-jobs', '__CLASS__': 'Adzuna::API::Response::Category'}",https://www.adzuna.de/land/ad/5697193113?se=aC99_xY38RG3urfrBgf9fg&utm_medium=api&utm_source=a4bcf954&v=822B2626B8C769B8D5DA5A9C3A908C3D0EF5BD2A,"{'display_name': 'Teltow, Potsdam-Mittelmark (Kreis)', '__CLASS__': 'Adzuna::API::Response::Location', 'area': ['Deutschland', 'Brandenburg', 'Potsdam-Mittelmark (Kreis)', 'Teltow']}","{'__CLASS__': 'Adzuna::API::Response::Company', 'display_name': 'Workwise GmbH'}",13.26532,5697193113,52.40101,Adzuna::API::Response::Job,"Über HOSCH Gebäudeautomation Hast du schon einmal daran gedacht, wie eine umweltfreundliche und wirtschaftliche Lösung für Gebäudeautomation aussehen könnte? Genau das treiben wir an - Projekte für moderne Systeme, die Komfort und Energieeffizienz vereinen. Deine Expertise in Technik und Innovation könnte genau hier den Unterschied machen. Mit Aufgaben in Projektierung, Software Engineering oder Schaltanlagenbau wirst du Teil eines Teams, das sich für eine nachhaltigere Zukunft einsetzt. Hier e…",0,full_time,,,
2026-03-22T16:16:24Z,Duales Studium Wirtschaftsinformatik - Data Science 2026,eyJhbGciOiJIUzI1NiJ9.eyJzIjoiYUM5OV94WTM4UkczdXJmckJnZjlmZyIsImkiOiI1Njc1MjQ1NzI1In0.CzruyRXdhb_tngi5I7ohzVuGoactRfkyMbzWBQZnbCc,"{'tag': 'unknown', 'label': 'Unknown', '__CLASS__': 'Adzuna::API::Response::Category'}",https://www.adzuna.de/land/ad/5675245725?se=aC99_xY38RG3urfrBgf9fg&utm_medium=api&utm_source=a4bcf954&v=4629D9F38CDDC3FFEEAF30D8DAE0D9FDCD671DE4,"{'area': ['Deutschland', 'Baden-Württemberg', 'Heilbronn (Kreis)', 'Neckarsulm'], 'display_name': 'Neckarsulm, Heilbronn (Kreis)', '__CLASS__': 'Adzuna::API::Response::Location'}","{'__CLASS__': 'Adzuna::API::Response::Company', 'display_name': 'Lidl'}",9.2274,5675245725,49.18975,Adzuna::API::Response::Job,"Einleitung Eine gute Idee war der Ursprung, ein erfolgreiches Konzept ist das Ergebnis. Qualitt zum guten Preis mglichst vielen Menschen anbieten zu knnen treibt uns an - mittlerweile weltweit, denn wir sind Lidl. Hier ist das berufliche Zuhause vielfltiger Talente. Ob im Einkauf, in der Logistik, im Warengeschft oder in der IT; ob als Impulsgeber, Gestalter oder Dienstleister der Lnder. Wir suchen Anpacker, Durchstarter, Mglichmacher und bieten spannende Aufgaben und Projekte in einem dynamisc…",0,,,,
2026-03-26T05:36:49Z,Werkstudent*in IT/Data Sciences - Sommersemesterferien 2026 - Inklusiver Job   ,eyJhbGciOiJIUzI1NiJ9.eyJzIjoiYUM5OV94WTM4UkczdXJmckJnZjlmZyIsImkiOiI1Njc4ODU0ODAyIn0.o2VNdsetL-Q1VpVlFR8B0TDsOMw0aFwrIjHJ0LNL3u8,"{'tag': 'unknown', 'label': 'Unknown', '__CLASS__': 'Adzuna::API::Response::Category'}",https://www.adzuna.de/land/ad/5678854802?se=aC99_xY38RG3urfrBgf9fg&utm_medium=api&utm_source=a4bcf954&v=0B6E800BF3FF4836EBB8A0BE7FF1EE103E8B1AA2,"{'__CLASS__': 'Adzuna::API::Response::Location', 'display_name': 'Frankfurt am Main, Hessen', 'area': ['Deutschland', 'Hessen', 'Frankfurt am Main']}","{'display_name': 'Sanofi-Aventis Deutschland GmbH', '__CLASS__': 'Adzuna::API::Response::Company'}",8.650578,5678854802,50.129683,Adzuna::API::Response::Job,"Für unseren Entwicklungs-, Produktions- und Fertigungsstandort Frankfurt am Main suchen wir innerhalb der vorlesungsfreien Zeiten für unseren Bereich IT/Data Sciences Werkstudenten*innen in Vollzeit (37,5 Stunden/Woche). Ihre Aufgaben Im Rahmen Ihrer Tätigkeit unterstützen Sie, unter Einhaltung geltender Regularien,bei einfachen Labortätigkeiten sowiebei administrativen Arbeiten. Sieunterstützen bei der Datenpflege, indemSie bei der Überprüfung großer biologischer Datensätze helfen und erledige…",0,,,,
2026-03-31T16:10:20Z,Werkstudent:in (d/m/w) - Data Science - Inklusiver Job   ,eyJhbGciOiJIUzI1NiJ9.eyJpIjoiNTY4NDE1OTEzNyIsInMiOiJhQzk5X3hZMzhSRzN1cmZyQmdmOWZnIn0.xDPMEcrYzPOn3KcTFA4fRzht2m_cJioXrrRxH5M7arU,"{'tag': 'unknown', 'label': 'Unknown', '__CLASS__': 'Adzuna::API::Response::Category'}",https://www.adzuna.de/land/ad/5684159137?se=aC99_xY38RG3urfrBgf9fg&utm_medium=api&utm_source=a4bcf954&v=B91A8BBF6DAA328F6C69DA8457111256F383F260,"{'area': ['Deutschland', 'Baden-Württemberg', 'Freiburg im Breisgau'], 'display_name': 'Freiburg im Breisgau, Baden-Württemberg', '__CLASS__': 'Adzuna::API::Response::Location'}","{'display_name': 'Haufe Group', '__CLASS__': 'Adzuna::API::Response::Company'}",7.816286,5684159137,47.999458,Adzuna::API::Response::Job,"""Ich halte den Laden am Laufen! Und zwar 450.000-fach!"" Wer kann das schon von sich und seinem Beruf sagen? Was traumhaft klingt, wird für Dich wahr. Indem Du Dich Lexware anschließt - dem Marktführer für Cloud-Software-Lösungen für Kleinunternehmen und Selbstständige. Mit cleveren Produkten halten wir über 450.000 Klein- und Kleinstunternehmen in Deutschland den Rücken frei. Dazu brauchen wir zum nächstmöglichen Zeitpunkt deine Unterstützung als Werkstudent:in (d/m/w) im Bereich Data Science a…",0,,,,
2026-04-11T21:53:24Z,AI Experte - KI-Strategie / Change-Management / Data Science (m/w/d),eyJhbGciOiJIUzI1NiJ9.eyJpIjoiNTY5NjgwNzUwNyIsInMiOiJhQzk5X3hZMzhSRzN1cmZyQmdmOWZnIn0.QjoWAsEGICtOtxTxbfkAeEbnsklEgwQlVx7whfRy7ek,"{'tag': 'other-general-jobs', 'label': 'Sonstige/Allgemeine Stellen', '__CLASS__': 'Adzuna::API::Response::Category'}",https://www.adzuna.de/land/ad/5696807507?se=aC99_xY38RG3urfrBgf9fg&utm_medium=api&utm_source=a4bcf954&v=29FF7D0E5C0C7A06522B54FC4E4720CA4BBA51AE,"{'area': ['Deutschland', 'Hamburg', 'Neustadt'], 'display_name': 'Neustadt, Hamburg', '__CLASS__': 'Adzuna::API::Response::Location'}","{'display_name': 'Workwise GmbH', '__CLASS__': 'Adzuna::API::Response::Company'}",9.98553,5696807507,53.55197,Adzuna::API::Response::Job,"Über HOSCH Gebäudeautomation Hast du schon einmal daran gedacht, wie eine umweltfreundliche und wirtschaftliche Lösung für Gebäudeautomation aussehen könnte? Genau das treiben wir an - Projekte für moderne Systeme, die Komfort und Energieeffizienz vereinen. Deine Expertise in Technik und Innovation könnte genau hier den Unterschied machen. Mit Aufgaben in Projektierung, Software Engineering oder Schaltanlagenbau wirst du Teil eines Teams, das sich für eine nachhaltigere Zukunft einsetzt. Hier e…",0,,,,
2025-11-18T12:41:01Z,Wirtschaftsinformatik - Data Science / Bachelor of Science (DH),eyJhbGciOiJIUzI1NiJ9.eyJpIjoiNTUwMTY2MjAxMSIsInMiOiJhQzk5X3hZMzhSRzN1cmZyQmdmOWZnIn0.-M12noP8mNDVDODOiYwOs36Ea5ydAJ6zQcu90CvJFjg,"{'__CLASS__': 'Adzuna::API::Response::Category', 'label': 'Unknown', 'tag': 'unknown'}",https://www.adzuna.de/land/ad/5501662011?se=aC99_xY38RG3urfrBgf9fg&utm_medium=api&utm_source=a4bcf954&v=4C96CFAC4A4F7D2EACDCBD04EC98B59646A755AD,"{'display_name': 'Nufringen, Böblingen (Kreis)', '__CLASS__': 'Adzuna::API::Response::Location', 'area': ['Deutschland', 'Baden-Württemberg', 'Böblingen (Kreis)', 'Nufringen']}","{'display_name': 'Ensinger GmbH', '__CLASS__': 'Adzuna::API::Response::Company'}",8.89081,5501662011,48.62307,Adzuna::API::Response::Job,Bezeichnung: Wirtschaftsinformatik - Data Science / Bachelor of Science (DH) Eintrittsdatum: 01.10.2026 mit Vorpraktikum ab 01.09.2026 Standort: 71154 Nufringen bei Stuttgart Arbeitszeit: Vollzeit Ausbildungsinhalte: Grundlagen der Informationstechnik Methoden der Informatik Moderne IT-Technologien für die Entwicklung von Software-Systemen kennenlernen und anwenden Anwendung von Künstlicher Intelligenz und Big Data in wirtschaftinformatorischen Kontexten Methoden und Konzepte der Betriebswirtsc…,0,,,,
2026-02-26T13:04:40Z,Duales Studium Wirtschaftsinformatik / Data Science (B. Sc.),eyJhbGciOiJIUzI1NiJ9.eyJzIjoiYUM5OV94WTM4UkczdXJmckJnZjlmZyIsImkiOiI1NjQ2MTQxODMyIn0.84W5Z-54Ew89PohvVPC1tGugoikoHejfSs_AYIJmQYs,"{'__CLASS__': 'Adzuna::API::Response::Category', 'label': 'Unknown', 'tag': 'unknown'}",https://www.adzuna.de/land/ad/5646141832?se=aC99_xY38RG3urfrBgf9fg&utm_medium=api&utm_source=a4bcf954&v=01ED0A0F0E58FF1C4B07B21CF33F0F2714119C6A,"{'area': ['Deutschland', 'Baden-Württemberg', 'Stuttgart'], 'display_name': 'Stuttgart, Baden-Württemberg', '__CLASS__': 'Adzuna::API::Response::Location'}","{'display_name': 'Netze BW GmbH', '__CLASS__': 'Adzuna::API::Response::Company'}",9.187224,5646141832,48.776198,Adzuna::API::Response::Job,"Vernetze mit uns die Welt von morgen. Du hast Lust, deine Tatkraft bei uns einzubringen und dadurch deine eigene Zukunft und die aller Menschen sicherer und lebenswerter zu machen? Wir freuen uns darauf, dich dabei tatkräftig zu unterstützen – und gemeinsam mit dir neue und zuverlässige Verbindungen für die Energieversorgung von morgen zu schaffen. Du@Netze BW Du denkst gerne analytisch und gleichzeitig kreativ? IT macht dir am meisten Spaß, wenn du mit ihr innovative Lösungen mit praktischem M…",0,,,,
2026-03-12T14:26:06Z,Duales Studium (DHBW) Data Science und Knstliche Intelligenz,eyJhbGciOiJIUzI1NiJ9.eyJzIjoiYUM5OV94WTM4UkczdXJmckJnZjlmZyIsImkiOiI1NjYyMzYyNDExIn0.IkjPo07swp46DjUlX-dIUKrE5OEwLXu3Gx7fr64kgEo,"{'__CLASS__': 'Adzuna::API::Response::Category', 'label': 'Unknown', 'tag': 'unknown'}",https://www.adzuna.de/land/ad/5662362411?se=aC99_xY38RG3urfrBgf9fg&utm_medium=api&utm_source=a4bcf954&v=82AD559586C5423855CCD3379724449C53A4FED5,"{'area': ['Deutschland', 'Baden-Württemberg', 'Ravensburg (Kreis)'], 'display_name': 'Ravensburg (Kreis), Baden-Württemberg', '__CLASS__': 'Adzuna::API::Response::Location'}","{'__CLASS__': 'Adzuna::API::Response::Company', 'display_name': 'EBZ SE'}",9.667396,5662362411,47.839602,Adzuna::API::Response::Job,"Dieser Studiengang bereitet Dich darauf vor, den digitalen Wandel in Unternehmen voranzutreiben und aktiv mitzugestalten. Dazu werden Grundlagen der Informatik und der Wirtschaftsinformatik mit Kerninhalten der Data Science kombiniert. Themen wie Cloud Computing, Big Data, Visual Analytics und AI spielen hier eine große Rolle. Du lernst den Umgang und die Interpretation von großen Datenmengen, deren Darstellung, und das Training von AI-Modellen. Deine Ideen und Projekte kannst du dabei direkt i…",0,,,,
2026-04-11T13:42:48Z,Internship - Bioprocess Data Science and Causal AI - Inklusiver Job   ,eyJhbGciOiJIUzI1NiJ9.eyJzIjoiYUM5OV94WTM4UkczdXJmckJnZjlmZyIsImkiOiI1Njk2NjQ0ODAwIn0._X2dOr6dh_SF4GEhRGeY0TpfhODrvVBuHhVKSmqeKnk,"{'label': 'Unknown', 'tag': 'unknown', '__CLASS__': 'Adzuna::API::Response::Category'}",https://www.adzuna.de/land/ad/5696644800?se=aC99_xY38RG3urfrBgf9fg&utm_medium=api&utm_source=a4bcf954&v=85D9EA2637E366A980DABB0ECA91D5C66E689FC3,"{'area': ['Deutschland', 'Baden-Württemberg', 'Biberach (Kreis)', 'Biberach an der Riß'], '__CLASS__': 'Adzuna::API::Response::Location', 'display_name': 'Biberach an der Riß, Biberach (Kreis)'}","{'display_name': 'Boehringer Ingelheim', '__CLASS__': 'Adzuna::API::Response::Company'}",9.78975,5696644800,48.0962,Adzuna::API::Response::Job,"The Position As the world leader in the production of innovative medicines, we at Boehringer Ingelheim offer you the opportunity to get to know the many tasks of digital Bioprocess Development. You will support us in developing Digital Twins for large-scale mammalian cell culture manufacturing, where we use time-course data from online sensors and offline metabolite measurements to predict process dynamics. Apply now for an internship in Biberach! As the world leader in the production of innova…",0,,,,
2026-04-05T16:19:43Z,Wissenschaftliche/r Mitarbeiter/in (w/m/d) - Optimierung nachhaltiger Supply Chains,eyJhbGciOiJIUzI1NiJ9.eyJpIjoiNTY5MDY1MzQ0MCIsInMiOiJhQzk5X3hZMzhSRzN1cmZyQmdmOWZnIn0.YvwonhvqeWBmwcfoGl2453XfAZyJARIxv19fZDKHtXA,"{'tag': 'scientific-qa-jobs', 'label': 'Stellen aus Wissenschaft & Qualitätssicherung', '__CLASS__': 'Adzuna::API::Response::Category'}",https://www.adzuna.de/land/ad/5690653440?se=aC99_xY38RG3urfrBgf9fg&utm_medium=api&utm_source=a4bcf954&v=7F3637A7E55C76B377C8DA7272215B942F95DD91,"{'area': ['Deutschland', 'Nordrhein-Westfalen', 'Aachen (Kreis)', 'Aachen'], '__CLASS__': 'Adzuna::API::Response::Location', 'display_name': 'Aachen, Aachen (Kreis)'}","{'__CLASS__': 'Adzuna::API::Response::Company', 'display_name': 'RWTH Aachen University'}",6.089788,5690653440,50.773914,Adzuna::API::Response::Job,"Der Lehrstuhl für Operations Management, unter der Leitung von Univ.-Prof. Dr. Grit Walther, ist an der Fakultät für Wirtschaftswissenschaften der RWTH Aachen University angesiedelt. Die Forschungsschwerpunkte des Lehrstuhls für Operations Management liegen in der anwendungsorientierten, techno-ökonomischen Analyse, Modellierung und Bewertung von Logistik- und Produktionssystemen sowie Wertschöpfungsketten. In den drei Forschungsbereichen „Circular Economy“, „Sustainable Mobility“ und „Renewabl…",0,,,,
2026-03-20T05:05:58Z,Senior Fullstack Engineer Data Science AI (w/m/d),eyJhbGciOiJIUzI1NiJ9.eyJzIjoiYUM5OV94WTM4UkczdXJmckJnZjlmZyIsImkiOiI1NjcyNzM1MzE0In0.qxywNQ5cw26yxwcyIH3SdEZzxJYk6Mih1vMzmkYeTOc,"{'tag': 'it-jobs', 'label': 'IT-Stellen', '__CLASS__': 'Adzuna::API::Response::Category'}",https://www.adzuna.de/land/ad/5672735314?se=aC99_xY38RG3urfrBgf9fg&utm_medium=api&utm_source=a4bcf954&v=51A844DD88BE8626561A7B3FF047B50F2216D6A6,"{'area': ['Deutschland', 'Bayern', 'Bad Tölz-Wolfratshausen (Kreis)', 'Wolfratshausen'], 'display_name': 'Wolfratshausen, Bad Tölz-Wolfratshausen (Kreis)', '__CLASS__': 'Adzuna::API::Response::Location'}","{'display_name': 'TÜV SÜD AG', '__CLASS__': 'Adzuna::API::Response::Company'}",11.41791,5672735314,47.91392,Adzuna::API::Response::Job,"Innovationen bringen tiefgreifende Veränderungen mit sich und beeinflussen unser Leben in vielfältiger Weise. Bei TÜV SÜD sind wir in hohem Maße bestrebt, ein wichtiger Teil dieser Entwicklung und des Fortschritts zu sein. Wir sind von Anfang an dabei und begleiten diesen Prozess. Wir sorgen für eine sichere und nachhaltige Zukunft und schaffen Vertrauen in neue Technologien. Wir beraten, wir prüfen, wir zertifizieren. Für die Sicherheit von Menschen und der Gesellschaft fordern wir uns jeden T…",0,full_time,,,
2026-03-20T05:05:58Z,Senior Fullstack Engineer Data Science AI (w/m/d),eyJhbGciOiJIUzI1NiJ9.eyJpIjoiNTY3MjczNTMyOCIsInMiOiJhQzk5X3hZMzhSRzN1cmZyQmdmOWZnIn0.d_b7aeqXoxZvRgv8vkPo5ywXpJuva8Zc7nTu2gfWNkM,"{'__CLASS__': 'Adzuna::API::Response::Category', 'tag': 'it-jobs', 'label': 'IT-Stellen'}",https://www.adzuna.de/land/ad/5672735328?se=aC99_xY38RG3urfrBgf9fg&utm_medium=api&utm_source=a4bcf954&v=E9282118464706BDF9BA8A8FEBA1A9F7AC0C29BE,"{'area': ['Deutschland', 'Bayern', 'Landsberg am Lech (Kreis)', 'Landsberg am Lech'], 'display_name': 'Landsberg am Lech, Landsberg am Lech (Kreis)', '__CLASS__': 'Adzuna::API::Response::Location'}","{'display_name': 'TÜV SÜD AG', '__CLASS__': 'Adzuna::API::Response::Company'}",10.88248,5672735328,48.04792,Adzuna::API::Response::Job,"Innovationen bringen tiefgreifende Veränderungen mit sich und beeinflussen unser Leben in vielfältiger Weise. Bei TÜV SÜD sind wir in hohem Maße bestrebt, ein wichtiger Teil dieser Entwicklung und des Fortschritts zu sein. Wir sind von Anfang an dabei und begleiten diesen Prozess. Wir sorgen für eine sichere und nachhaltige Zukunft und schaffen Vertrauen in neue Technologien. Wir beraten, wir prüfen, wir zertifizieren. Für die Sicherheit von Menschen und der Gesellschaft fordern wir uns jeden T…",0,full_time,,,
