company,salary_is_predicted,title,created,id,category,adref,location,__CLASS__,redirect_url,description,latitude,longitude,contract_time,salary_max,salary_min,contract_type
"{'__CLASS__': 'Adzuna::API::Response::Company', 'display_name': 'Fachhochschule Kufstein Tirol Bildungs GmbH'}",0,Professur (FH) für Data Science mit Option Studiengangsleitung (w/m/d),2025-06-17T20:17:23Z,5255162552,"{'label': 'Beraterstellen', '__CLASS__': 'Adzuna::API::Response::Category', 'tag': 'consultancy-jobs'}",eyJhbGciOiJIUzI1NiJ9.eyJzIjoiVks2eUtxNU44QkdadXRCZUFLX3F5dyIsImkiOiI1MjU1MTYyNTUyIn0.eUc2pD_Wis2s1pbkpfEeu5YeUlA3TyaQNyFb0Qh1dBk,"{'__CLASS__': 'Adzuna::API::Response::Location', 'display_name': 'Deutschland', 'area': ['Deutschland']}",Adzuna::API::Response::Job,https://www.adzuna.de/land/ad/5255162552?se=VK6yKq5N8BGZutBeAK_qyw&utm_medium=api&utm_source=a4bcf954&v=8999EFBCA7563AEC600A8674A82FA90785DC87B3,"Die Fachhochschule Kufstein Tirol ist international mehrfach ausgezeichnet und laut dem Wirtschaftsmagazin trend im Tirol-Ranking 2022 auf Platz 1 der besten Arbeitgeber:innen. Wir sind eine sich stetig weiterentwickelnde Wissensorganisation. Als Arbeitgeberin bieten wir vielseitige, interessante Aufgaben, ein leistungsförderndes und familienfreundliches Umfeld mit flexiblen Arbeitsbedingungen in einer partnerschaftlich geprägten Kultur. Die FH verfügt bei 2200 Studierenden und 10000 Absolvent:…",,,,,,
"{'__CLASS__': 'Adzuna::API::Response::Company', 'display_name': 'ZIEHL-ABEGG SE'}",0,Duales Studium Data Science und Künstliche Intelligenz (m/w/d) ab September 2025,2025-06-20T08:10:10Z,5259456833,"{'tag': 'unknown', 'label': 'Unknown', '__CLASS__': 'Adzuna::API::Response::Category'}",eyJhbGciOiJIUzI1NiJ9.eyJzIjoiVks2eUtxNU44QkdadXRCZUFLX3F5dyIsImkiOiI1MjU5NDU2ODMzIn0.n2yqVkHf7D-D9KxSOKdE0aLCgY4Ul8rKew0UhymbdSY,"{'area': ['Deutschland'], 'display_name': 'Deutschland', '__CLASS__': 'Adzuna::API::Response::Location'}",Adzuna::API::Response::Job,https://www.adzuna.de/land/ad/5259456833?se=VK6yKq5N8BGZutBeAK_qyw&utm_medium=api&utm_source=a4bcf954&v=7D454F40DB3F8BDFAC92C9573484439CD29266C2,"Du begeisterst dich für die komplexen Zusammenhänge in der IT und arbeitest gerne im Team? Willkommen in der Königsklasse Die Firma ZIEHL-ABEGG SE, mit derzeit über 5.000 Mitarbeitern weltweit, entwickelt, produziert und vertreibt global Ventilatoren, elektrische Spezialmotoren und Regelsysteme für die allgemeine Lufttechnik und Antriebstechnik. Neben dem Hauptsitz in Künzelsau befinden sich weitere süddeutsche Standorte des Unternehmens in Bieringen und Gewerbepark Hohenlohe. Als mittelständis…",,,,,,
"{'display_name': 'ZEISS', '__CLASS__': 'Adzuna::API::Response::Company'}",0,"Duales Studium – Data Science und Künstliche Intelligenz (m/w/x), Beginn Herbst 2026",2025-06-17T20:17:09Z,5255157657,"{'__CLASS__': 'Adzuna::API::Response::Category', 'label': 'Unknown', 'tag': 'unknown'}",eyJhbGciOiJIUzI1NiJ9.eyJpIjoiNTI1NTE1NzY1NyIsInMiOiJWSzZ5S3E1TjhCR1p1dEJlQUtfcXl3In0.91-gUMXBc_FPwRNnLhHEGe0Rtyj_iotDYTpxhdgEoT0,"{'area': ['Deutschland', 'Baden-Württemberg', 'Ostalbkreis', 'Oberkochen'], '__CLASS__': 'Adzuna::API::Response::Location', 'display_name': 'Oberkochen, Ostalbkreis'}",Adzuna::API::Response::Job,https://www.adzuna.de/land/ad/5255157657?se=VK6yKq5N8BGZutBeAK_qyw&utm_medium=api&utm_source=a4bcf954&v=8B7522BAAFFC072ED980160B1A956D88C8C2EE3C,"Sich etwas Neues trauen, über sich hinauswachsen und dabei die Grenzen des Machbaren neu definieren. Genau das ist es, was unsere Mitarbeitenden täglich leben dürfen und sollen. Um mit unseren Innovationen ein Zeichen zu setzen und Großartiges zu ermöglichen. Denn hinter jedem erfolgreichen Unternehmen stehen eine ganze Menge faszinierende Menschen. In einem offenen und modernen Umfeld mit zahlreichen Entwicklungs- und Weiterbildungsmöglichkeiten, arbeiten die Mitarbeitenden bei ZEISS in einer …",48.78408,10.10558,,,,
"{'__CLASS__': 'Adzuna::API::Response::Company', 'display_name': 'Bosch Gruppe'}",0,Pflichtpraktikum in den Bereichen Wasserstoffcampus und energieorientiertes Data Science,2025-06-09T08:06:40Z,5240890986,"{'label': 'Stellen aus Wissenschaft & Qualitätssicherung', '__CLASS__': 'Adzuna::API::Response::Category', 'tag': 'scientific-qa-jobs'}",eyJhbGciOiJIUzI1NiJ9.eyJzIjoiVks2eUtxNU44QkdadXRCZUFLX3F5dyIsImkiOiI1MjQwODkwOTg2In0.7O4MwhQfBXviH4YyDM6SvHhMslvaUW3RJgs4jmBm9yU,"{'area': ['Deutschland', 'Niedersachsen', 'Salzgitter'], '__CLASS__': 'Adzuna::API::Response::Location', 'display_name': 'Salzgitter, Niedersachsen'}",Adzuna::API::Response::Job,https://www.adzuna.de/land/ad/5240890986?se=VK6yKq5N8BGZutBeAK_qyw&utm_medium=api&utm_source=a4bcf954&v=C0F8D1DED804AD09C017986B74D27460ED794985,"Möchten Sie Ihre Ideen in nutzbringende und sinnvolle Technologien verwandeln? Ob im Bereich Mobility Solutions, Consumer Goods, Industrial Technology oder Energy and Building Technology - mit uns verbessern Sie die Lebensqualität der Menschen auf der ganzen Welt. Willkommen bei Bosch. Die Robert Bosch Elektronik GmbH freut sich auf Ihre Bewerbung! Anstellungsart: Befristet Arbeitszeit: Vollzeit Arbeitsort: Salzgitter Aufgaben Wir suchen eine engagierte Persönlichkeit, die Teil unseres Projektt…",52.120502,10.373516,,,,
"{'display_name': 'Lidl Stiftung & Co. KG', '__CLASS__': 'Adzuna::API::Response::Company'}",0,Praktikum Data Science,2025-05-13T19:32:53Z,5196599071,"{'label': 'Stellen aus Wissenschaft & Qualitätssicherung', '__CLASS__': 'Adzuna::API::Response::Category', 'tag': 'scientific-qa-jobs'}",eyJhbGciOiJIUzI1NiJ9.eyJpIjoiNTE5NjU5OTA3MSIsInMiOiJWSzZ5S3E1TjhCR1p1dEJlQUtfcXl3In0.I9RKAy-tqOHoe8pPP3NMwCM2XR88oWzVrNM0xE0Cruk,"{'area': ['Deutschland', 'Baden-Württemberg', 'Heilbronn (Kreis)', 'Neckarsulm'], 'display_name': 'Neckarsulm, Heilbronn (Kreis)', '__CLASS__': 'Adzuna::API::Response::Location'}",Adzuna::API::Response::Job,https://www.adzuna.de/land/ad/5196599071?se=VK6yKq5N8BGZutBeAK_qyw&utm_medium=api&utm_source=a4bcf954&v=B05D2F43BE90D34C617E73D32CA793E4E1837E9E,"Eine gute Idee war der Ursprung, ein erfolgreiches Konzept ist das Ergebnis. Qualität zum guten Preis möglichst vielen Menschen anbieten zu können treibt uns an - mittlerweile weltweit, denn wir sind Lidl. Hier ist das berufliche Zuhause vielfältiger Talente. Ob im Einkauf, in der Logistik, im Warengeschäft oder in der IT; ob als Impulsgeber, Gestalter oder Dienstleister der Länder. Wir suchen Anpacker, Durchstarter, Möglichmacher und bieten spannende Aufgaben und Projekte in einem dynamischen …",49.18975,9.2274,,,,
"{'__CLASS__': 'Adzuna::API::Response::Company', 'display_name': 'trivago N.V.'}",0,Data Science Lead - Price,2025-05-29T07:53:45Z,5221191207,"{'label': 'Stellen aus Wissenschaft & Qualitätssicherung', '__CLASS__': 'Adzuna::API::Response::Category', 'tag': 'scientific-qa-jobs'}",eyJhbGciOiJIUzI1NiJ9.eyJzIjoiVks2eUtxNU44QkdadXRCZUFLX3F5dyIsImkiOiI1MjIxMTkxMjA3In0.tvSE3i6Wuo-m1q5II3fcG-h4wVROwRg15XanjDiXVhQ,"{'area': ['Deutschland', 'Nordrhein-Westfalen', 'Düsseldorf'], 'display_name': 'Düsseldorf, Nordrhein-Westfalen', '__CLASS__': 'Adzuna::API::Response::Location'}",Adzuna::API::Response::Job,https://www.adzuna.de/land/ad/5221191207?se=VK6yKq5N8BGZutBeAK_qyw&utm_medium=api&utm_source=a4bcf954&v=98645105F045E80C016B917754C84A02C09FDF07,"When travelers are searching for a hotel, we want the obvious choice to be trivago! Our leading metasearch engine is super fast and constantly optimized – enabling millions of travelers to compare hotel prices from hundreds of booking sites and find great deals in just a few clicks. We use cutting-edge technology, real-time auction, and machine learning techniques with petabytes of data to create an experience – time and money saved! In the lively city of Düsseldorf, we seize opportunities to l…",51.226802,6.808387,,,,
"{'__CLASS__': 'Adzuna::API::Response::Company', 'display_name': 'Deichmann SE'}",0,Team Lead Data Science Engineering (m/w/d),2025-05-20T07:34:57Z,5207046190,"{'__CLASS__': 'Adzuna::API::Response::Category', 'label': 'Unknown', 'tag': 'unknown'}",eyJhbGciOiJIUzI1NiJ9.eyJzIjoiVks2eUtxNU44QkdadXRCZUFLX3F5dyIsImkiOiI1MjA3MDQ2MTkwIn0.d5egaUwNS_eIc6bpgxY3OeKyoQ904RpjAeBajpEQ4l8,"{'area': ['Deutschland', 'Nordrhein-Westfalen', 'Essen'], 'display_name': 'Essen, Nordrhein-Westfalen', '__CLASS__': 'Adzuna::API::Response::Location'}",Adzuna::API::Response::Job,https://www.adzuna.de/land/ad/5207046190?se=VK6yKq5N8BGZutBeAK_qyw&utm_medium=api&utm_source=a4bcf954&v=99ABBDD1537458D2EC7E10DBD42B3B5690D3F12E,"Als eigenfinanziertes Familienunternehmen sind wir mehr als nur ein ca. 4.700 Standorte umspannendes Filialnetz in 34 Ländern, mehr als ca. 8,7 Mrd. Euro Jahresumsatz und mehr als einer der erfolgreichsten Online-Shops für Schuhe in Europa. Deichmann ist Wegbereiter, Förderer und Arbeitgeber von über 49.000 engagierten Mitarbeiterinnen und Mitarbeitern weltweit. Als nachhaltig expandierendes Unternehmen sind wir seit mehreren Jahrzehnten in der Lage, unseren Mitarbeitern einen sicheren Arbeitsp…",51.444823,7.014478,,,,
"{'display_name': 'HIGHVOLT Prüftechnik Dresden GmbH', '__CLASS__': 'Adzuna::API::Response::Company'}",0,Entwicklungsingenieur (m/w/d) im Bereich Messtechnik / Data Science,2025-06-20T08:10:04Z,5259456364,"{'label': 'Technikerstellen', '__CLASS__': 'Adzuna::API::Response::Category', 'tag': 'engineering-jobs'}",eyJhbGciOiJIUzI1NiJ9.eyJpIjoiNTI1OTQ1NjM2NCIsInMiOiJWSzZ5S3E1TjhCR1p1dEJlQUtfcXl3In0.Es2cSvUv934zvPAJRLAT-bo_OUdisAOu9XN-OWKQ_98,"{'area': ['Deutschland', 'Sachsen', 'Dresden'], 'display_name': 'Dresden, Sachsen', '__CLASS__': 'Adzuna::API::Response::Location'}",Adzuna::API::Response::Job,https://www.adzuna.de/land/ad/5259456364?se=VK6yKq5N8BGZutBeAK_qyw&utm_medium=api&utm_source=a4bcf954&v=CE8D9B408A667807C1CD5BA8E130395827DBE9FE,"Für den Weltmarkt projektieren und fertigen wir Hochspannungs- und Hochstromprüfsysteme zur Prüfung von Energiekabeln, Hochspannungstransformatoren und weiteren Geräten der elektrischen Energieübertragung. Mit unseren innovativen Produkten und digitalen Lösungen unterstützen wir den Netzausbau für eine nachhaltige Energieversorgung. Wir eröffnen Ihnen als Unternehmen in der REINHAUSEN Gruppe vielfältige Möglichkeiten in einer zukunftsorientierten Branche. HIGHVOLT - where Power meets Passion. F…",51.052725,13.756452,,,,
"{'__CLASS__': 'Adzuna::API::Response::Company', 'display_name': 'Mercedes-Benz Tech Innovation'}",0,Werkstudent Data Science im Bereich Fahrzeugdiagnose (m/w/d),2025-06-17T20:18:01Z,5255176901,"{'label': 'Stellen aus Wissenschaft & Qualitätssicherung', '__CLASS__': 'Adzuna::API::Response::Category', 'tag': 'scientific-qa-jobs'}",eyJhbGciOiJIUzI1NiJ9.eyJzIjoiVks2eUtxNU44QkdadXRCZUFLX3F5dyIsImkiOiI1MjU1MTc2OTAxIn0.2mWDyLJHwP-AtTlVq2tCjxT_Rt8MSDtPQQfn18NNsDg,"{'display_name': 'Ulm, Baden-Württemberg', '__CLASS__': 'Adzuna::API::Response::Location', 'area': ['Deutschland', 'Baden-Württemberg', 'Ulm']}",Adzuna::API::Response::Job,https://www.adzuna.de/land/ad/5255176901?se=VK6yKq5N8BGZutBeAK_qyw&utm_medium=api&utm_source=a4bcf954&v=04DB68A1074178292A3B1B98FFAA9D2491BABE66,"Life is always about becoming… Im Leben geht es darum, sich auf eine Reise zu begeben, um die beste Version unseres zukünftigen Selbst zu werden. Während wir Neues entdecken, stellen wir uns Herausforderungen, meistern sie und wachsen über uns hinaus. Bewerben Sie sich bei Mercedes-Benz und finden Sie den Aufgabenbereich, in dem Sie Ihre Talente individuell entfalten können. Dabei werden Sie von visionären Kolleginnen und Kollegen unterstützt, die Ihren Pioniergeist teilen. Bei uns einzusteigen…",48.383137,9.856945,,,,
"{'display_name': 'Mercedes-Benz Group AG', '__CLASS__': 'Adzuna::API::Response::Company'}",0,"Duales Studium Wirtschaftsinformatik/Data Science (B.Sc.), Stuttgart 2026 (w/m/d)",2025-06-17T20:17:32Z,5255165929,"{'__CLASS__': 'Adzuna::API::Response::Category', 'label': 'Unknown', 'tag': 'unknown'}",eyJhbGciOiJIUzI1NiJ9.eyJpIjoiNTI1NTE2NTkyOSIsInMiOiJWSzZ5S3E1TjhCR1p1dEJlQUtfcXl3In0.QO_GJEpSobCSMJq8slR6pLbbDKTOkY65XA0cJLXtBhY,"{'area': ['Deutschland', 'Baden-Württemberg', 'Esslingen (Kreis)', 'Esslingen am Neckar'], '__CLASS__': 'Adzuna::API::Response::Location', 'display_name': 'Esslingen am Neckar, Esslingen (Kreis)'}",Adzuna::API::Response::Job,https://www.adzuna.de/land/ad/5255165929?se=VK6yKq5N8BGZutBeAK_qyw&utm_medium=api&utm_source=a4bcf954&v=7FB9DB8FF1444E8A1FCE53928BE7AF3A84FE5ADF,"Life is always about becoming… Im Leben geht es darum, sich auf eine Reise zu begeben, um die beste Version unseres zukünftigen Selbst zu werden. Während wir Neues entdecken, stellen wir uns Herausforderungen, meistern sie und wachsen über uns hinaus. Bewerben Sie sich bei Mercedes-Benz und finden Sie den Aufgabenbereich, in dem Sie Ihre Talente individuell entfalten können. Dabei werden Sie von visionären Kolleginnen und Kollegen unterstützt, die Ihren Pioniergeist teilen. Bei uns einzusteigen…",48.745846,9.315933,,,,
"{'__CLASS__': 'Adzuna::API::Response::Company', 'display_name': 'Comma Soft AG'}",0,"Pre-Sales Consultant (m/w/d) – Data Science, AI & BI",2025-06-20T08:37:31Z,5259481001,"{'tag': 'sales-jobs', '__CLASS__': 'Adzuna::API::Response::Category', 'label': 'Vertriebsstellen'}",eyJhbGciOiJIUzI1NiJ9.eyJpIjoiNTI1OTQ4MTAwMSIsInMiOiJWSzZ5S3E1TjhCR1p1dEJlQUtfcXl3In0.St_2b10h_MSy6ZVdnenx4w5J3_gViLPpq6L7qVnTF1g,"{'area': ['Deutschland', 'Nordrhein-Westfalen', 'Bonn'], 'display_name': 'Bonn, Nordrhein-Westfalen', '__CLASS__': 'Adzuna::API::Response::Location'}",Adzuna::API::Response::Job,https://www.adzuna.de/land/ad/5259481001?se=VK6yKq5N8BGZutBeAK_qyw&utm_medium=api&utm_source=a4bcf954&v=52C96B38BD4182C39A01B77C6CD02AB03036DFCC,"Als Pre-Sales Consultant (m/w/d) für Data Science-, AI- & BI-Lösungen spielst du eine entscheidende Rolle im Verkaufsprozess für unsere Produkte Alan® (Generative KI) und INFONEA® (Advanced Analytics), indem du technische Lösungen mit dem Expertenteam customized und überzeugende Angebote erstellst, die auf die Bedürfnisse der Kunden zugeschnitten sind. Diese Position eignet sich ideal für eine technikaffine Fachkraft mit ausgeprägtem Geschäftssinn, exzellenten Kommunikationsfähigkeiten und eine…",50.71942,7.112412,,,,
"{'display_name': 'Diehl Defence GmbH & Co. KG', '__CLASS__': 'Adzuna::API::Response::Company'}",0,Praktikant (m/w/d) Data Science,2025-06-17T20:34:37Z,5255326661,"{'__CLASS__': 'Adzuna::API::Response::Category', 'label': 'Stellen aus Wissenschaft & Qualitätssicherung', 'tag': 'scientific-qa-jobs'}",eyJhbGciOiJIUzI1NiJ9.eyJzIjoiVks2eUtxNU44QkdadXRCZUFLX3F5dyIsImkiOiI1MjU1MzI2NjYxIn0.cOuclakUiIicDReLTHuKz4-E_PWDL-5u70_V1rdHyIM,"{'area': ['Deutschland'], 'display_name': 'Deutschland', '__CLASS__': 'Adzuna::API::Response::Location'}",Adzuna::API::Response::Job,https://www.adzuna.de/land/ad/5255326661?se=VK6yKq5N8BGZutBeAK_qyw&utm_medium=api&utm_source=a4bcf954&v=06B8B48822FB9358CAC69427E3D19EBC11DC89EE,"Digitale Trans­formation. Nach­haltig­keit. Friedens­sicherung. Spannende Aufgaben, an denen auch wir bei Diehl in unseren fünf Teil­konzernen Metall, Controls, Defence, Aviation und Metering und unsere über 16.000 Mit­arbeiter­innen und Mit­arbeiter mit Hochdruck arbeiten. Entdecke faszinierende Techno­logien und bewirb dich. In einem von Vertrauen und Mut geprägten Familien­unter­nehmen, das beständig und stabil ist – aus Tradition. Für unseren Standort Diehl Defence GmbH & Co. KG in Röthenba…",,,,,,
"{'__CLASS__': 'Adzuna::API::Response::Company', 'display_name': 'Kaufland'}",0,Praktikant Data Science (m/w/d),2025-05-28T19:50:11Z,5220264884,"{'label': 'Stellen aus Wissenschaft & Qualitätssicherung', '__CLASS__': 'Adzuna::API::Response::Category', 'tag': 'scientific-qa-jobs'}",eyJhbGciOiJIUzI1NiJ9.eyJzIjoiVks2eUtxNU44QkdadXRCZUFLX3F5dyIsImkiOiI1MjIwMjY0ODg0In0.fFw-Lge5CPik4BcStsrcl0p141-ox4kj00D6_a9wPwU,"{'area': ['Deutschland', 'Baden-Württemberg', 'Heilbronn (Kreis)', 'Heilbronn'], 'display_name': 'Heilbronn, Heilbronn (Kreis)', '__CLASS__': 'Adzuna::API::Response::Location'}",Adzuna::API::Response::Job,https://www.adzuna.de/land/ad/5220264884?se=VK6yKq5N8BGZutBeAK_qyw&utm_medium=api&utm_source=a4bcf954&v=E5D9C0F42BD4B2D101CC5446F52C0F73D1C57AE4,"Du willst mehr als Uni und möchtest erste Berufseinblicke und Kontakte knüpfen? Dann bist du hier richtig! Als Werkstudent oder Praktikant bei Kaufland gehörst du von Beginn an zu einem starken Team und kannst zeigen, was in dir steckt. Werde auch du Teil von teamkaufland! Aufgaben Wir zählen auf dich: Du unterstützt unser Team bei der Bearbeitung unserer Analytics Use Cases entlang der gesamten Wertschöpfungskette bei Kaufland. Vielfältige Aufgaben? Na klar: Lerne unsere Projekte und Arbeitswe…",49.142335,9.209895,,,,
"{'__CLASS__': 'Adzuna::API::Response::Company', 'display_name': 'trivago'}",0,Data Science Lead - Price,2025-05-22T11:45:02Z,5210550923,"{'tag': 'unknown', 'label': 'Unknown', '__CLASS__': 'Adzuna::API::Response::Category'}",eyJhbGciOiJIUzI1NiJ9.eyJpIjoiNTIxMDU1MDkyMyIsInMiOiJWSzZ5S3E1TjhCR1p1dEJlQUtfcXl3In0.uqDKW4aV2GYPaxJvTtnBSBo9WTNgsom_9ifDB1aDqyM,"{'area': ['Deutschland', 'Nordrhein-Westfalen', 'Düsseldorf', 'Bilk'], '__CLASS__': 'Adzuna::API::Response::Location', 'display_name': 'Bilk, Düsseldorf'}",Adzuna::API::Response::Job,https://www.adzuna.de/land/ad/5210550923?se=VK6yKq5N8BGZutBeAK_qyw&utm_medium=api&utm_source=a4bcf954&v=04BDEBBBCF947A1D4B0320827A6F55746CD3D03B,"When travelers are searching for a hotel, we want the obvious choice to be trivago! By comparing prices from major booking sites, we're making it easy for people to find hotels they want at a price they’ll love. In the lively city of Düsseldorf, we seize opportunities to learn everyday, innovate, and make an enduring mark on the travel industry. A career at trivago is a journey designed for people who crave continuous development and want to thrive in a high-performing team. Here you will find …",51.20259,6.78055,,,,
"{'__CLASS__': 'Adzuna::API::Response::Company', 'display_name': 'Mercedes-Benz Tech Innovation'}",0,Duales Studium Data Science / Künstliche Intelligenz in Kooperation mit der Dualen Hochschule Baden-Württemberg 2026 (m/w/d),2025-06-09T20:04:47Z,5241458986,"{'__CLASS__': 'Adzuna::API::Response::Category', 'label': 'Unknown', 'tag': 'unknown'}",eyJhbGciOiJIUzI1NiJ9.eyJpIjoiNTI0MTQ1ODk4NiIsInMiOiJWSzZ5S3E1TjhCR1p1dEJlQUtfcXl3In0.ZcvocFd2zSDe40awC0lHZKvOqJ2HH46as8iCuVzxN7M,"{'area': ['Deutschland', 'Baden-Württemberg', 'Ulm'], '__CLASS__': 'Adzuna::API::Response::Location', 'display_name': 'Ulm, Baden-Württemberg'}",Adzuna::API::Response::Job,https://www.adzuna.de/land/ad/5241458986?se=VK6yKq5N8BGZutBeAK_qyw&utm_medium=api&utm_source=a4bcf954&v=84D8490D2A67047AD09BCC28EC4996CA080A51AA,"Life is always about becoming… Im Leben geht es darum, sich auf eine Reise zu begeben, um die beste Version unseres zukünftigen Selbst zu werden. Während wir Neues entdecken, stellen wir uns Herausforderungen, meistern sie und wachsen über uns hinaus. Bewerben Sie sich bei Mercedes-Benz und finden Sie den Aufgabenbereich, in dem Sie Ihre Talente individuell entfalten können. Dabei werden Sie von visionären Kolleginnen und Kollegen unterstützt, die Ihren Pioniergeist teilen. Bei uns einzusteigen…",48.383137,9.856945,,,,
"{'__CLASS__': 'Adzuna::API::Response::Company', 'display_name': 'Mercedes-Benz Tech Innovation'}",0,Duales Studium Data Science / Künstliche Intelligenz in Kooperation mit der Dualen Hochschule Baden-Württemberg 2026 (m/w/d),2025-06-02T19:45:06Z,5228935038,"{'tag': 'unknown', '__CLASS__': 'Adzuna::API::Response::Category', 'label': 'Unknown'}",eyJhbGciOiJIUzI1NiJ9.eyJzIjoiVks2eUtxNU44QkdadXRCZUFLX3F5dyIsImkiOiI1MjI4OTM1MDM4In0.Nan5KlvqNX_hLZzC0KbsPsx_fiHm7v1TttXdkhqgiI8,"{'__CLASS__': 'Adzuna::API::Response::Location', 'display_name': 'Baden-Baden, Baden-Württemberg', 'area': ['Deutschland', 'Baden-Württemberg', 'Baden-Baden']}",Adzuna::API::Response::Job,https://www.adzuna.de/land/ad/5228935038?se=VK6yKq5N8BGZutBeAK_qyw&utm_medium=api&utm_source=a4bcf954&v=F31FD94107CC87F14C5D25AE5DE093AA5E4CAB01,"Life is always about becoming… Im Leben geht es darum, sich auf eine Reise zu begeben, um die beste Version unseres zukünftigen Selbst zu werden. Während wir Neues entdecken, stellen wir uns Herausforderungen, meistern sie und wachsen über uns hinaus. Bewerben Sie sich bei Mercedes-Benz und finden Sie den Aufgabenbereich, in dem Sie Ihre Talente individuell entfalten können. Dabei werden Sie von visionären Kolleginnen und Kollegen unterstützt, die Ihren Pioniergeist teilen. Bei uns einzusteigen…",48.754667,8.235274,,,,
"{'__CLASS__': 'Adzuna::API::Response::Company', 'display_name': 'Adolf Würth GmbH & Co. KG'}",0,Duales Studium Wirtschaftsinformatik - Data Science,2025-05-26T18:15:38Z,5217005619,"{'tag': 'hospitality-catering-jobs', '__CLASS__': 'Adzuna::API::Response::Category', 'label': 'Stellen aus Gastronomie & Catering'}",eyJhbGciOiJIUzI1NiJ9.eyJpIjoiNTIxNzAwNTYxOSIsInMiOiJWSzZ5S3E1TjhCR1p1dEJlQUtfcXl3In0.yP45n8r0JpV9T_y1C7aEeYav20Fu9snAe8nPITYDc9M,"{'area': ['Deutschland', 'Baden-Württemberg', 'Hohenlohekreis', 'Künzelsau'], '__CLASS__': 'Adzuna::API::Response::Location', 'display_name': 'Künzelsau, Hohenlohekreis'}",Adzuna::API::Response::Job,https://www.adzuna.de/land/ad/5217005619?se=VK6yKq5N8BGZutBeAK_qyw&utm_medium=api&utm_source=a4bcf954&v=E70C953D35BA5CCF99D063CC6F22C80378CDBC79,"Zeit für deine Zukunft. Zeit für Würth. Bewirb dich jetzt auf ein duales Studium Wirtschaftsinformatik - Data Science! Das bieten wir dir: ✓ Ein familiäres und herzliches Arbeitsklima sowie gemeinsame Aktivitäten (z. B. Azubi-Skiausfahrt, Sportturniere) ✓ Enges Mentoring und begleitende Seminare für eine individuelle Weiterentwicklung ✓ Soziale und internationale Ausbildungsbausteine und Projekte (z.B. Auslandspraktikum) ✓ Eine faire Vergütung und viele Zusatzleistungen (z.B. Chance auf das Azu…",49.27945,9.68788,full_time,,,
"{'display_name': 'itmX GmbH', '__CLASS__': 'Adzuna::API::Response::Company'}",0,KI/ Data Science Consultant (Mensch*),2025-06-03T23:02:47Z,5231414188,"{'tag': 'unknown', 'label': 'Unknown', '__CLASS__': 'Adzuna::API::Response::Category'}",eyJhbGciOiJIUzI1NiJ9.eyJpIjoiNTIzMTQxNDE4OCIsInMiOiJWSzZ5S3E1TjhCR1p1dEJlQUtfcXl3In0.tsn2DH20iJf1lG1T-90LkwdF0G5ZFz44eXOF561XRrI,"{'area': ['Deutschland', 'Baden-Württemberg', 'Pforzheim'], '__CLASS__': 'Adzuna::API::Response::Location', 'display_name': 'Pforzheim, Baden-Württemberg'}",Adzuna::API::Response::Job,https://www.adzuna.de/land/ad/5231414188?se=VK6yKq5N8BGZutBeAK_qyw&utm_medium=api&utm_source=a4bcf954&v=BF10B2630B7E490C0083E62C4693E422FE6532EB,"Bei itmX fokussieren wir uns auf die Geschäftsprozesse in den Bereichen Marketing, Vertrieb, Service und Commerce unter Verwendung der Microsoft Power Platform, Microsoft 365, SAP ERP und unser eigenem Produkt der itmX crm suite. Unser Ziel ist es dabei Microsoft und SAP bestmöglich prozessual sowie funktional zu verbinden. Tätigkeiten Analyse von Geschäftsprozessen und Identifikation von Optimierungspotenzialen durch den Einsatz von KI für Digitalisierungsprojekte Beratung und Unterstützung un…",48.883606,8.697363,,,,
"{'display_name': 'AP Sensing GmbH', '__CLASS__': 'Adzuna::API::Response::Company'}",0,Data Science Team Lead (m/f/d),2025-06-17T20:34:27Z,5255325658,"{'__CLASS__': 'Adzuna::API::Response::Category', 'label': 'Stellen aus Wissenschaft & Qualitätssicherung', 'tag': 'scientific-qa-jobs'}",eyJhbGciOiJIUzI1NiJ9.eyJzIjoiVks2eUtxNU44QkdadXRCZUFLX3F5dyIsImkiOiI1MjU1MzI1NjU4In0.RUYdHwqCBhBa6IEDtRbrD1dagwyaV9Vd_Ejaiwnqv0w,"{'__CLASS__': 'Adzuna::API::Response::Location', 'display_name': 'Böblingen, Böblingen (Kreis)', 'area': ['Deutschland', 'Baden-Württemberg', 'Böblingen (Kreis)', 'Böblingen']}",Adzuna::API::Response::Job,https://www.adzuna.de/land/ad/5255325658?se=VK6yKq5N8BGZutBeAK_qyw&utm_medium=api&utm_source=a4bcf954&v=6DD9E4E0245F23C4EA1C2CBC583557B9C81755B3,"WE ARE AGAIN AWARDED AS TOP ARBEITGEBER 2025! At AP Sensing, we're building on a success story that began in the garage of Bill Hewlett and Dave Packard. As an independent HP spin-off, we combine over 40 years of technological expertise with a passion for innovation. Together we'll continue to enhance infrastructure, protect people, and safeguard our planet. With a commitment to fiber optic sensing, we value every voice and empower growth. Join us in thinking ahead to create a smarter, safer wo…",,,,,,
"{'__CLASS__': 'Adzuna::API::Response::Company', 'display_name': 'Hannover Rück SE'}",0,Trainee Mathematik Personen-Rückversicherung Fokus Data Science,2025-05-13T19:32:52Z,5196599018,"{'tag': 'unknown', 'label': 'Unknown', '__CLASS__': 'Adzuna::API::Response::Category'}",eyJhbGciOiJIUzI1NiJ9.eyJzIjoiVks2eUtxNU44QkdadXRCZUFLX3F5dyIsImkiOiI1MTk2NTk5MDE4In0.oRYotmhsQyPv5xN_quad1a8Lna3I34sVgJFDiq5gACg,"{'area': ['Deutschland', 'Niedersachsen', 'Region Hannover (Kreis)', 'Hannover'], 'display_name': 'Hannover, Region Hannover (Kreis)', '__CLASS__': 'Adzuna::API::Response::Location'}",Adzuna::API::Response::Job,https://www.adzuna.de/land/ad/5196599018?se=VK6yKq5N8BGZutBeAK_qyw&utm_medium=api&utm_source=a4bcf954&v=DF87DEAFDBA82D6A67B5C2B21156D28117C34E72,"Hannover Rück – rund 3.900 Mitarbeiter:innen an Standorten auf der ganzen Welt. Unsere Stärke? Connecting Power: Wir verlassen uns auf­einander. Als Rück­versicherer sichern wir Kunden im Schaden­fall ab. Dafür braucht es maß­geschneiderte, innovative Lösungen. Lösungen, die gestern noch gepasst haben, können morgen ver­altet sein. Wir challengen uns und optimieren konti­nuierlich unsere Services, Beratungen und Pro­dukte. All das macht uns zu einer der führenden und profi­tabelsten Rück­versic…",52.378818,9.742751,,,,
