longitude,created,company,location,description,category,salary_is_predicted,__CLASS__,title,latitude,redirect_url,adref,id,contract_time,salary_min,contract_type,salary_max
8.650578,2025-09-27T04:11:20Z,"{'display_name': 'Sanofi Group', '__CLASS__': 'Adzuna::API::Response::Company'}","{'__CLASS__': 'Adzuna::API::Response::Location', 'area': ['Deutschland', 'Hessen', 'Frankfurt am Main'], 'display_name': 'Frankfurt am Main, Hessen'}","Fu00fcr unseren Entwicklungs-, Produktions- und Fertigungsstandort Frankfurt am Main suchen wir innerhalb der vorlesungsfreien Zeiten eine*n Werkstudent*in im Bereich IT/Data Sciences in Vollzeit (37,5 Stunden/Woche). Ihre Aufgaben Im Rahmen Ihrer Tu00e4tigkeit unterstu00fctzen Sie, unter Einhaltung geltender Regularien, bei einfachen Labortu00e4tigkeiten sowie bei administrativen Arbeiten. Sie unterstu00fctzen bei der Datenpflege, indem Sie bei der u00dcberpru00fcfung grou00dfer biologischer D…","{'__CLASS__': 'Adzuna::API::Response::Category', 'tag': 'unknown', 'label': 'Unknown'}",0,Adzuna::API::Response::Job,Werkstudent*in im Bereich IT/Data Sciences - Winter Semesterferien 2026,50.129683,https://www.adzuna.de/details/5416782363?utm_medium=api&utm_source=a4bcf954,eyJhbGciOiJIUzI1NiJ9.eyJzIjoiWXM1UGZRWEo4QkdZU2ZkT1IyRDVhUSIsImkiOiI1NDE2NzgyMzYzIn0.G72OzcXT871Mct9bbQnnQuU4q3cHqW9pywQCsBHqglE,5416782363,,,,
8.38979,2025-11-15T19:06:05Z,"{'display_name': 'Atruvia AG', '__CLASS__': 'Adzuna::API::Response::Company'}","{'display_name': 'Innenstadt, Karlsruhe', 'area': ['Deutschland', 'Baden-Württemberg', 'Karlsruhe (Kreis)', 'Karlsruhe', 'Innenstadt'], '__CLASS__': 'Adzuna::API::Response::Location'}",Über Atruvia Wir sind der Digitalisierungspartner in der genossenschaftlichen FinanzGruppe und vereinen jahrzehntelanges Expertenwissen in Banking und Informationstechnologie. Die speziell auf Banken zugeschnittenen IT-Lösungen und Leistungen reichen vom Rechenzentrumsbetrieb über das Bankverfahren von Atruvia bis hin zur App-Entwicklung. Dabei nutzen wir zukunftsweisende Technologien wie Smart Data und schreiben Prozessoptimierung und Regulatorik groß. Gestalte die Zukunft mit KI – Starte dein…,"{'tag': 'unknown', 'label': 'Unknown', '__CLASS__': 'Adzuna::API::Response::Category'}",0,Adzuna::API::Response::Job,Duales Studium Data Science & Künstliche Intelligenz B.Sc.,49.01336,https://www.adzuna.de/details/5497892496?utm_medium=api&utm_source=a4bcf954,eyJhbGciOiJIUzI1NiJ9.eyJpIjoiNTQ5Nzg5MjQ5NiIsInMiOiJZczVQZlFYSjhCR1lTZmRPUjJENWFRIn0.4tvTpVjAXD9vn4yoD3L3OzGkiCJHNELzWJqHkeBOMTM,5497892496,,,,
9.24596,2025-11-01T06:00:03Z,"{'__CLASS__': 'Adzuna::API::Response::Company', 'display_name': 'Deutsche Automobil Treuhand GmbH'}","{'__CLASS__': 'Adzuna::API::Response::Location', 'display_name': 'Ostfildern, Esslingen (Kreis)', 'area': ['Deutschland', 'Baden-Württemberg', 'Esslingen (Kreis)', 'Ostfildern']}","Dein Studium bei der DAT: Willkommen in unserem lebendigen Tagesgeschäft. Du arbeitest in verschiedenen Abteilungen rundum IT und Softwareentwicklung und lernst unsere Prozesse kennen. Du trägst Verantwortung für eigene Projekte und stehst in engem Kontakt mit deinem Ausbilder und Experten der Fachabteilungen. Das macht den Studiengang aus: Du bewegst dich gerne in der digitalen Welt und willst genau wissen, was hinter intelligenter Software steckt? Dann ist dieser Studiengang Wirtschaftsinform…","{'__CLASS__': 'Adzuna::API::Response::Category', 'label': 'Unknown', 'tag': 'unknown'}",0,Adzuna::API::Response::Job,DHBW Student Wirtschaftsinformatik - Data Science (m/w/d),48.72761,https://www.adzuna.de/details/5474044939?utm_medium=api&utm_source=a4bcf954,eyJhbGciOiJIUzI1NiJ9.eyJpIjoiNTQ3NDA0NDkzOSIsInMiOiJZczVQZlFYSjhCR1lTZmRPUjJENWFRIn0.eKEOq9ElmpwNcqDFsBZQpko2xcH0hs_aeyuMM3kAe5k,5474044939,,,,
9.70266,2024-11-08T12:50:26Z,"{'__CLASS__': 'Adzuna::API::Response::Company', 'display_name': 'MTU Maintenance Hannover'}","{'__CLASS__': 'Adzuna::API::Response::Location', 'display_name': 'Schulenkamp, Langenhagen', 'area': ['Deutschland', 'Niedersachsen', 'Region Hannover (Kreis)', 'Langenhagen', 'Schulenkamp']}","UPLIFT Y OURFUTURE Wir sind über 13.000. An 19 Standorten weltweit. Jedes dritte Flugzeug fliegt mit unserer Technologie. Immer effizienter, leiser, nachhaltiger. Wir gestalten die Zukunft der Luftfahrt. Was wir noch brauchen? Dich. Unser Team in Hannover-Langenhagen sucht Dich: Werkstudent Data Science / Digital Maintenance Solutions (all genders) Du hast Lust mit Daten, Algorithmen und im komplexen Feld der Luftfahrt zu arbeiten? Du willst dich bei der Entwicklung digitaler Produkte für die T…","{'tag': 'manufacturing-jobs', 'label': 'Stellen aus Fertigung', '__CLASS__': 'Adzuna::API::Response::Category'}",0,Adzuna::API::Response::Job,Werkstudent Data Science / Digital Maintenance Solutions (all genders),52.46704,https://www.adzuna.de/details/4931329064?utm_medium=api&utm_source=a4bcf954,eyJhbGciOiJIUzI1NiJ9.eyJpIjoiNDkzMTMyOTA2NCIsInMiOiJZczVQZlFYSjhCR1lTZmRPUjJENWFRIn0.MVSSihOgtucdhCfGkIM0A2ZtsnaxnMMDl5rP_ADm2tA,4931329064,part_time,,,
9.73965,2025-05-16T20:02:18Z,"{'__CLASS__': 'Adzuna::API::Response::Company', 'display_name': 'MTU Aero Engines'}","{'__CLASS__': 'Adzuna::API::Response::Location', 'area': ['Deutschland', 'Niedersachsen', 'Region Hannover (Kreis)', 'Langenhagen'], 'display_name': 'Langenhagen, Region Hannover (Kreis)'}","Kennziffer – WS HAN MVX UPLIFTYOURFUTURE Wir sind über 13.000. An 19 Standorten weltweit. Jedes dritte Flugzeug fliegt mit unserer Technologie. Immer effizienter, leiser, nachhaltiger. Wir gestalten die Zukunft der Luftfahrt. Was wir noch brauchen? Dich. Unser Team in Hannover-Langenhagen sucht dich: Werkstudent Data Science / Digital Maintenance Solutions (all genders) Code - WS HAN MVX Du hast Lust mit Daten, Algorithmen und im komplexen Feld der Luftfahrt zu arbeiten? Du willst dich bei der …","{'__CLASS__': 'Adzuna::API::Response::Category', 'tag': 'unknown', 'label': 'Unknown'}",0,Adzuna::API::Response::Job,Werkstudent Data Science / Digital Maintenance Solutions (all genders),52.44731,https://www.adzuna.de/details/5202238408?utm_medium=api&utm_source=a4bcf954,eyJhbGciOiJIUzI1NiJ9.eyJzIjoiWXM1UGZRWEo4QkdZU2ZkT1IyRDVhUSIsImkiOiI1MjAyMjM4NDA4In0.6hp4yRfr4znp21LLnzVFk0v2fHac4fkafBLR7yzNu_s,5202238408,,,,
11.555737,2025-11-18T12:41:00Z,"{'display_name': 'Atos Information Technology', '__CLASS__': 'Adzuna::API::Response::Company'}","{'__CLASS__': 'Adzuna::API::Response::Location', 'area': ['Deutschland', 'Bayern', 'München (Kreis)', 'München'], 'display_name': 'München, München (Kreis)'}","Du liebst IT? Dann gestalte die KI-gestützte digitale Zukunft mit uns! Du möchtest Lösungen für die dringendsten und komplexesten Herausforderungen der digitalen Welt finden und dabei die digitale Transformation mitgestalten? Du möchtest ein Teil eines Weltklasse-Teams sein und bei einem ""next generation Tech Leader"" arbeiten? Dann starte bei uns als Nachwuchstalent in einem der zahlreichen dualen Studiengänge! Entdecke eine offene, multikulturelle Unternehmenskultur mit vielfältigen Entwicklun…","{'label': 'Unknown', 'tag': 'unknown', '__CLASS__': 'Adzuna::API::Response::Category'}",0,Adzuna::API::Response::Job,B.Sc. Data Science & KI (w/m/d),48.137418,https://www.adzuna.de/details/5501661996?utm_medium=api&utm_source=a4bcf954,eyJhbGciOiJIUzI1NiJ9.eyJpIjoiNTUwMTY2MTk5NiIsInMiOiJZczVQZlFYSjhCR1lTZmRPUjJENWFRIn0.XYrVzHbAWTE6L1ltSWdHsrYyEgNYQtPdqXxgk8meu9Y,5501661996,,,,
,2025-08-23T23:36:54Z,"{'display_name': 'The MITRE Corporation', '__CLASS__': 'Adzuna::API::Response::Company'}","{'display_name': 'Deutschland', 'area': ['Deutschland'], '__CLASS__': 'Adzuna::API::Response::Location'}","Why choose between doing meaningful work and having a fulfilling life? At MITRE, you can have both. That's because MITRE people are committed to tackling our nation's toughest challenges-and we're committed to the long-term well-being of our employees. MITRE is different from most technology companies. We are a not-for-profit corporation chartered to work for the public interest, with no commercial conflicts to influence what we do. The R&D centers we operate for the government create lasting i…","{'tag': 'unknown', 'label': 'Unknown', '__CLASS__': 'Adzuna::API::Response::Category'}",0,Adzuna::API::Response::Job,"Internships in Data Science, Math, Statistics or Operations Research",,https://www.adzuna.de/details/5365995442?utm_medium=api&utm_source=a4bcf954,eyJhbGciOiJIUzI1NiJ9.eyJpIjoiNTM2NTk5NTQ0MiIsInMiOiJZczVQZlFYSjhCR1lTZmRPUjJENWFRIn0.oH9hjI2khB4fzl0ai1BLVA52f2obWU6ti7cWSlulkbU,5365995442,,,,
,2025-11-14T12:37:53Z,"{'__CLASS__': 'Adzuna::API::Response::Company', 'display_name': 'Leadec Management Central Europe BV & Co. KG'}","{'__CLASS__': 'Adzuna::API::Response::Location', 'area': ['Deutschland'], 'display_name': 'Deutschland'}","Ihr Aufgabenbereich Verantwortung übernehmen: Leitung und Vorantreiben von Initiativen zur digitalen Transformation mit Schwerpunkt Data Science & AI im Bereich Einkauf Europa, die sich auf die Verbesserung der Beschaffungseffizienz, Kosteneinsparungen sowie das Risiko- und Lieferantenmanagement konzentrieren. Analytisch vorgehen: Analyse und Identifizierung von Digitalisierungspotentialen innerhalb der Einkaufsorganisation sowie deren Prozessen. Aufgaben anpacken: Konzeption, Planung, Koordina…","{'label': 'IT-Stellen', 'tag': 'it-jobs', '__CLASS__': 'Adzuna::API::Response::Category'}",0,Adzuna::API::Response::Job,Procurement Specialist (m/w/d) Data Science & AI,,https://www.adzuna.de/details/5495521309?utm_medium=api&utm_source=a4bcf954,eyJhbGciOiJIUzI1NiJ9.eyJpIjoiNTQ5NTUyMTMwOSIsInMiOiJZczVQZlFYSjhCR1lTZmRPUjJENWFRIn0.4yiARXFbJ5MqH6i7TwGxVPwA0E17XE2OpTw97q6hq3o,5495521309,,,,
,2025-11-22T17:10:45Z,"{'__CLASS__': 'Adzuna::API::Response::Company', 'display_name': 'Leadec'}","{'__CLASS__': 'Adzuna::API::Response::Location', 'area': ['Deutschland'], 'display_name': 'Deutschland'}","Ihr Aufgabenbereich Verantwortung ü bernehmen : Leitung und Vorantreiben von Initiativen zur digitalen Transformation mit Schwerpunkt Data Science & AI im Bereich Einkauf Europa, die sich auf die Verbesserung der Beschaffungseffizienz, Kosteneinsparungen sowie das Risiko- und Lieferantenmanagement konzentrieren. Analytisch vorgehen : Analyse und Identifizierung von Digitalisierungspotentialen innerhalb der Einkaufsorganisation sowie deren Prozessen. Aufgaben anpacken: Konzeption, Planung, Koord…","{'tag': 'retail-jobs', 'label': 'Stellen aus Einzelhandel', '__CLASS__': 'Adzuna::API::Response::Category'}",0,Adzuna::API::Response::Job,Procurement Specialist (m/w/d) Data Science & AI,,https://www.adzuna.de/details/5509088745?utm_medium=api&utm_source=a4bcf954,eyJhbGciOiJIUzI1NiJ9.eyJzIjoiWXM1UGZRWEo4QkdZU2ZkT1IyRDVhUSIsImkiOiI1NTA5MDg4NzQ1In0.ATPmDR4SPqx4cikK8raUErtau4SS3SQFLTzTmjPJyU4,5509088745,,,,
13.420806,2025-11-23T18:37:53Z,"{'display_name': 'Simon-Kucher & Partners', '__CLASS__': 'Adzuna::API::Response::Company'}","{'area': ['Deutschland', 'Berlin'], 'display_name': 'Berlin, Deutschland', '__CLASS__': 'Adzuna::API::Response::Location'}",Praktikum Associate Consultant Data Science (m/w/d) In Deutschland - Berlin| Bonn | Köln Du willst Praxiserfahrung in einer internationalen Unternehmensberatungsammeln? Bei uns kannst du dein Interesse an Wirtschaftsthemen mit deinenanalytischen Fähigkeiten verbinden! Werde für mindestens 10 Wochen Teil einesaußergewöhnlichen Teams. Was uns besonders macht: ein starker Unternehmergeistund jede Menge Gestaltungsfreiheit. Der Advanced Analytics Bereich bei Simon-Kucher konzentriert sich auf dieEn…,"{'__CLASS__': 'Adzuna::API::Response::Category', 'tag': 'unknown', 'label': 'Unknown'}",0,Adzuna::API::Response::Job,Praktikum Associate Consultant Data Science (m/w/d),52.507706,https://www.adzuna.de/details/5510629665?utm_medium=api&utm_source=a4bcf954,eyJhbGciOiJIUzI1NiJ9.eyJpIjoiNTUxMDYyOTY2NSIsInMiOiJZczVQZlFYSjhCR1lTZmRPUjJENWFRIn0.PvEsytTkUiC3x0XDSie7_u8SXQbs7WLtPVrRkyZH1I0,5510629665,,,,
7.112412,2025-11-23T18:37:53Z,"{'display_name': 'Simon-Kucher & Partners', '__CLASS__': 'Adzuna::API::Response::Company'}","{'display_name': 'Bonn, Nordrhein-Westfalen', 'area': ['Deutschland', 'Nordrhein-Westfalen', 'Bonn'], '__CLASS__': 'Adzuna::API::Response::Location'}",Praktikum Associate Consultant Data Science (m/w/d) In Deutschland - Berlin| Bonn | Köln Du willst Praxiserfahrung in einer internationalen Unternehmensberatungsammeln? Bei uns kannst du dein Interesse an Wirtschaftsthemen mit deinenanalytischen Fähigkeiten verbinden! Werde für mindestens 10 Wochen Teil einesaußergewöhnlichen Teams. Was uns besonders macht: ein starker Unternehmergeistund jede Menge Gestaltungsfreiheit. Der Advanced Analytics Bereich bei Simon-Kucher konzentriert sich auf dieEn…,"{'tag': 'unknown', 'label': 'Unknown', '__CLASS__': 'Adzuna::API::Response::Category'}",0,Adzuna::API::Response::Job,Praktikum Associate Consultant Data Science (m/w/d),50.71942,https://www.adzuna.de/details/5510629661?utm_medium=api&utm_source=a4bcf954,eyJhbGciOiJIUzI1NiJ9.eyJpIjoiNTUxMDYyOTY2MSIsInMiOiJZczVQZlFYSjhCR1lTZmRPUjJENWFRIn0.26-kEKqmuMY4ZS6tWpZ9fvrMbht3XeCyerZsmyJsvGI,5510629661,,,,
,2025-11-23T18:37:53Z,"{'display_name': 'Simon-Kucher & Partners', '__CLASS__': 'Adzuna::API::Response::Company'}","{'__CLASS__': 'Adzuna::API::Response::Location', 'area': ['Deutschland', 'Nordrhein-Westfalen', 'Köln'], 'display_name': 'Köln, Nordrhein-Westfalen'}",Praktikum Associate Consultant Data Science (m/w/d) In Deutschland - Berlin| Bonn | Köln Du willst Praxiserfahrung in einer internationalen Unternehmensberatungsammeln? Bei uns kannst du dein Interesse an Wirtschaftsthemen mit deinenanalytischen Fähigkeiten verbinden! Werde für mindestens 10 Wochen Teil einesaußergewöhnlichen Teams. Was uns besonders macht: ein starker Unternehmergeistund jede Menge Gestaltungsfreiheit. Der Advanced Analytics Bereich bei Simon-Kucher konzentriert sich auf dieEn…,"{'label': 'Unknown', 'tag': 'unknown', '__CLASS__': 'Adzuna::API::Response::Category'}",0,Adzuna::API::Response::Job,Praktikum Associate Consultant Data Science (m/w/d),,https://www.adzuna.de/details/5510629664?utm_medium=api&utm_source=a4bcf954,eyJhbGciOiJIUzI1NiJ9.eyJpIjoiNTUxMDYyOTY2NCIsInMiOiJZczVQZlFYSjhCR1lTZmRPUjJENWFRIn0.RRekBEeINLCgLhbLXd-ECnnw7F0dmtIAXtCPzsmNDtA,5510629664,,,,
11.72645,2025-08-14T00:58:15Z,"{'__CLASS__': 'Adzuna::API::Response::Company', 'display_name': 'Sopra-Steria'}","{'__CLASS__': 'Adzuna::API::Response::Location', 'display_name': 'Haar, München (Kreis)', 'area': ['Deutschland', 'Bayern', 'München (Kreis)', 'Haar']}","Unternehmensbeschreibung Wir sind eine der führenden Management- und Technologieberatungen und verstehen uns als Vordenker*innen. Wir handeln und denken strategisch, sind überzeugend und unterstützen unsere Kunden mit maßgeschneiderten Lösungen, präzisen Prozessen und innovativen Technologien. Weltweit sind wir 52.000 kreative und kluge Köpfe, in Deutschland und Österreich rund 2.700. Gemeinsam gestalten wir mit digitalen Technologien die Zukunft unserer Kunden und die der Gesellschaft. Vielfal…","{'label': 'Stellen für Hochschulabsolventen', 'tag': 'graduate-jobs', '__CLASS__': 'Adzuna::API::Response::Category'}",0,Adzuna::API::Response::Job,Werkstudent Data Science & Künstliche Intelligenz (m/w/d),48.10954,https://www.adzuna.de/details/5351528153?utm_medium=api&utm_source=a4bcf954,eyJhbGciOiJIUzI1NiJ9.eyJpIjoiNTM1MTUyODE1MyIsInMiOiJZczVQZlFYSjhCR1lTZmRPUjJENWFRIn0.Z8l1fJzREyEZpHS6V3weH-R_VqJcHLb6-ECcKV7jQVs,5351528153,,,,
8.53179,2025-10-30T11:57:00Z,"{'__CLASS__': 'Adzuna::API::Response::Company', 'display_name': 'All for One Group SE'}","{'display_name': 'Weingarten (Baden), Karlsruhe (Kreis)', 'area': ['Deutschland', 'Baden-Württemberg', 'Karlsruhe (Kreis)', 'Weingarten (Baden)'], '__CLASS__': 'Adzuna::API::Response::Location'}","Wir! Eine eingeschworene Gemeinschaft von über 2.800 Transformations- & Integrationsexperten, New Work Verfechtern, Cybersecurity Spezialisten, Big Data & Business Analysten, IoT Engineers und Consultants rund um Business-IT von SAP, Microsoft und IBM. Als führende Consulting- und IT-Gruppe vereinen wir Strategie- und Managementberatung, Prozessberatung, Branchen-Expertise und Technologie-Know-how in Kombination mit IT-Beratung und -Services unter einem Dach. Wir begleiten und unterstützen mehr…","{'label': 'Unknown', 'tag': 'unknown', '__CLASS__': 'Adzuna::API::Response::Category'}",0,Adzuna::API::Response::Job,Duales Studium B.Sc. Wirtschaftsinformatik - Schwerpunkt Data Science,49.05204,https://www.adzuna.de/details/5470875416?utm_medium=api&utm_source=a4bcf954,eyJhbGciOiJIUzI1NiJ9.eyJpIjoiNTQ3MDg3NTQxNiIsInMiOiJZczVQZlFYSjhCR1lTZmRPUjJENWFRIn0.Lw1XCd6x1xG8RVF9mFLOLOop8YfxueKwYbXLF5JHZ2M,5470875416,,,,
11.44811,2025-07-04T16:14:05Z,"{'display_name': 'MTU Aero Engines AG', '__CLASS__': 'Adzuna::API::Response::Company'}","{'area': ['Deutschland', 'Bayern', 'München (Kreis)', 'München', 'Allach-Untermenzing'], '__CLASS__': 'Adzuna::API::Response::Location', 'display_name': 'Allach-Untermenzing, München'}","UPLIFT Y OURFUTURE Wir sind mehr als 13.000 Mitarbeiter:innen. An 19 Standorten weltweit. Jedes dritte Flugzeug fliegt mit unserer Technologie. Immer effizienter, leiser, nachhaltiger. Wir gestalten die Zukunft der Luftfahrt. Was wir noch brauchen? Dich. Unsere Ausbildung in München sucht Schülerinnen und Schüler für ein Duales Studium Data Science und Künstliche Intelligenz mit Start 2026 Dieser duale Studiengang bereitet Dich ganz gezielt auf eine spätere Tätigkeit in der Datenanalyse der MTU…","{'tag': 'manufacturing-jobs', '__CLASS__': 'Adzuna::API::Response::Category', 'label': 'Stellen aus Fertigung'}",0,Adzuna::API::Response::Job,Duales Studium Data Science und Künstliche Intelligenz mit Start 2026,48.18449,https://www.adzuna.de/details/5284742379?utm_medium=api&utm_source=a4bcf954,eyJhbGciOiJIUzI1NiJ9.eyJzIjoiQm5pWGZnWEo4Qkd3QjVGUl9ZUEVaQSIsImkiOiI1Mjg0NzQyMzc5In0.UlXVFEBkSROobAzAGQd2YuOpQLYCcD4KP_56kIFmtSk,5284742379,full_time,,,
8.60289,2024-01-03T20:47:04Z,"{'display_name': 'Dentsply Sirona', '__CLASS__': 'Adzuna::API::Response::Company'}","{'display_name': 'Bensheim, Bergstraße (Kreis)', '__CLASS__': 'Adzuna::API::Response::Location', 'area': ['Deutschland', 'Hessen', 'Bergstraße (Kreis)', 'Bensheim']}","Requistion ID : 67844 Dentsply Sirona ist der weltweit größte Anbieter von Dentalprodukten- und technologien und unterstützt Zahnärzte und Zahntechniker dabei, eine bessere, schnellere und sicherere Versorgung in allen zahnmedizinischen Bereichen anzubieten. Wir sind stolz darauf, bevorzugter Partner für Zahnarztpraxen, Kliniken, Dentallabore und autorisierte Vertriebshändler weltweit zu sein. Der Hauptfirmensitz von Dentsply Sirona befindet sich in Charlotte, North Carolina. So fortschrittlich…","{'tag': 'unknown', 'label': 'Unknown', '__CLASS__': 'Adzuna::API::Response::Category'}",0,Adzuna::API::Response::Job,Bachelor of Science (B. Sc.) Data Science und KI,49.67828,https://www.adzuna.de/details/4508854671?utm_medium=api&utm_source=a4bcf954,eyJhbGciOiJIUzI1NiJ9.eyJzIjoiQm5pWGZnWEo4Qkd3QjVGUl9ZUEVaQSIsImkiOiI0NTA4ODU0NjcxIn0.0IzYfdC12zG4HQW_XQsVlshO75XPQRuZS7WDh0-4kuo,4508854671,,,,
8.60289,2025-09-11T02:53:14Z,"{'__CLASS__': 'Adzuna::API::Response::Company', 'display_name': 'Dentsply Sirona'}","{'display_name': 'Bensheim, Bergstraße (Kreis)', '__CLASS__': 'Adzuna::API::Response::Location', 'area': ['Deutschland', 'Hessen', 'Bergstraße (Kreis)', 'Bensheim']}","Requistion ID : 67844 Dentsply Sirona ist der weltweit gru00f6u00dfte Anbieter von Dentalprodukten- und technologien und unterstu00fctzt Zahnu00e4rzte und Zahntechniker dabei, eine bessere, schnellere und sicherere Versorgung in allen zahnmedizinischen Bereichen anzubieten. Wir sind stolz darauf, bevorzugter Partner fu00fcr Zahnarztpraxen, Kliniken, Dentallabore und autorisierte Vertriebshu00e4ndler weltweit zu sein. Der Hauptfirmensitz von Dentsply Sirona befindet sich in Charlotte, North Caro…","{'label': 'Unknown', '__CLASS__': 'Adzuna::API::Response::Category', 'tag': 'unknown'}",0,Adzuna::API::Response::Job,Bachelor of Science (B. Sc.) Data Science und KI,49.67828,https://www.adzuna.de/details/5393534665?utm_medium=api&utm_source=a4bcf954,eyJhbGciOiJIUzI1NiJ9.eyJzIjoiQm5pWGZnWEo4Qkd3QjVGUl9ZUEVaQSIsImkiOiI1MzkzNTM0NjY1In0.Vc30VVe1SmqU5F3dVB__9FrasrKXbTScD0Fbyi5twvU,5393534665,,,,
8.650578,2025-11-13T08:24:41Z,"{'__CLASS__': 'Adzuna::API::Response::Company', 'display_name': 'Deutsche Bundesbank'}","{'area': ['Deutschland', 'Hessen', 'Frankfurt am Main'], '__CLASS__': 'Adzuna::API::Response::Location', 'display_name': 'Frankfurt am Main, Hessen'}","Unsere Beschäftigten stellen sicher, dass unsere gemeinsame Währung und das europäische Finanzsystem stabil bleiben. Wie ihnen das gelingt? Bei uns haben sie die Zeit, den Freiraum und die Tools, komplexe Finanz- und Wirtschaftsthemen in ihrer Tiefe zu durchdringen und nachhaltige Lösungsvorschläge zu erarbeiten. Sie arbeiten agil, digital und über Grenzen hinweg. In Teams, die keine Vorurteile kennen, sondern gemeinsame Ziele. Werde auch Du Teil von etwas Besonderem und schaffe ein solides Fun…","{'__CLASS__': 'Adzuna::API::Response::Category', 'label': 'Unknown', 'tag': 'unknown'}",0,Adzuna::API::Response::Job,"Praktikum Data Science im Bereich Preis-, Immobilienmarkt- und Konjunkturstatistiken - Inklusiver Job   ",50.129683,https://www.adzuna.de/details/5493154961?utm_medium=api&utm_source=a4bcf954,eyJhbGciOiJIUzI1NiJ9.eyJzIjoiQm5pWGZnWEo4Qkd3QjVGUl9ZUEVaQSIsImkiOiI1NDkzMTU0OTYxIn0.cP5RJgqOGDMVYHhUzgyUMCpCU9pNWd2IqXNCeHtuI_U,5493154961,,,,
11.555737,2025-11-20T20:08:35Z,"{'__CLASS__': 'Adzuna::API::Response::Company', 'display_name': 'GSK'}","{'display_name': 'München, München (Kreis)', '__CLASS__': 'Adzuna::API::Response::Location', 'area': ['Deutschland', 'Bayern', 'München (Kreis)', 'München']}","Für unser Data & Analytics Team bei ViiV Healthcare am Standort München suchen wir einen Werkstudent (m/w/d) Analytics & Data Science. ViiV Healthcare ist ein unabhängiges, weltweit tätiges pharmazeutisches Unternehmen, das sich zu 100% dem Fortschritt in der Behandlung und Versorgung von Menschen mit HIV verschrieben hat. Es gibt – über unser vielfältiges Engagement in Entwicklung und Vertrieb von antiretroviralen Medikamenten hinaus – viele wichtige Bereiche rund um HIV, in denen wir tätig si…","{'label': 'Unknown', '__CLASS__': 'Adzuna::API::Response::Category', 'tag': 'unknown'}",0,Adzuna::API::Response::Job,Werkstudent (m/w/d) Analytics & Data Science - Inklusiver Job   ,48.137418,https://www.adzuna.de/details/5505810688?utm_medium=api&utm_source=a4bcf954,eyJhbGciOiJIUzI1NiJ9.eyJpIjoiNTUwNTgxMDY4OCIsInMiOiJCbmlYZmdYSjhCR3dCNUZSX1lQRVpBIn0.TGyY9BKs5psgYffnMBt6m8H2Sfqqw34ItMvSxDmRW2k,5505810688,,,,
,2025-11-13T12:44:54Z,"{'__CLASS__': 'Adzuna::API::Response::Company', 'display_name': 'twomynds'}","{'area': ['Deutschland'], 'display_name': 'Deutschland', '__CLASS__': 'Adzuna::API::Response::Location'}","Über uns Du willst sehen, wie deine Lösungen direkt Management-Entscheidungen beeinflussen und in echten Use Cases Mehrwert schaffen – bei Unternehmen, die du aus dem Alltag kennst? Willkommen bei twomynds. Wir sind ein dedizierter End-to-End Data & AI Service Provider – strategisch, umsetzungsstark und ergebnisorientiert. Unsere Mission: Ambitionierte Unternehmen befähigen, Data & AI in geschäftskritischen Mehrwert zu verwandeln – mit strategischer Klarheit, technischer Exzellenz und unternehm…","{'__CLASS__': 'Adzuna::API::Response::Category', 'label': 'Beraterstellen', 'tag': 'consultancy-jobs'}",0,Adzuna::API::Response::Job,Senior Data Science & Solutions Consultant (m/w/d),,https://www.adzuna.de/details/5493348628?utm_medium=api&utm_source=a4bcf954,eyJhbGciOiJIUzI1NiJ9.eyJzIjoiQm5pWGZnWEo4Qkd3QjVGUl9ZUEVaQSIsImkiOiI1NDkzMzQ4NjI4In0.vPsodoqj9-nAK7HBC7wARIz5febYvnkJywGw6N3hzVs,5493348628,,,,
8.76072,2025-02-19T12:19:23Z,"{'__CLASS__': 'Adzuna::API::Response::Company', 'display_name': 'statworx'}","{'__CLASS__': 'Adzuna::API::Response::Location', 'display_name': 'Fechenheim, Frankfurt am Main', 'area': ['Deutschland', 'Hessen', 'Frankfurt am Main', 'Fechenheim']}",Über uns statworx ist ein führendes Beratungs- und Entwicklungsunternehmen für Daten und KI mit Sitz in Frankfurt am Main. Wir bieten strategische Beratung für mittelständische Unternehmen und globale Konzerne. Wir entwickeln innovative Daten- & KI-Lösungen für alle Unternehmensbereiche und Tätigkeitsfelder. Wir befähigen Menschen auf allen Kompetenzniveaus mit unseren Daten- & KI-Bildungsformaten. Kurz gesagt: Wir unterstützen Unternehmen bei allen Aspekten der digitalen Transformation – seit …,"{'label': 'Beraterstellen', '__CLASS__': 'Adzuna::API::Response::Category', 'tag': 'consultancy-jobs'}",0,Adzuna::API::Response::Job,Senior Consultant Data Science - Fokus NLP (Alle Geschlechter),50.12595,https://www.adzuna.de/details/5056041373?utm_medium=api&utm_source=a4bcf954,eyJhbGciOiJIUzI1NiJ9.eyJpIjoiNTA1NjA0MTM3MyIsInMiOiJCbmlYZmdYSjhCR3dCNUZSX1lQRVpBIn0.xUzrbO89H6U09HsNWl7gEopxXlJGmmeLgKgx8EUpHCc,5056041373,full_time,,,
