location,description,salary_is_predicted,adref,category,created,id,company,longitude,__CLASS__,title,latitude,redirect_url,contract_time,contract_type,salary_max,salary_min
"{'area': ['Deutschland'], 'display_name': 'Deutschland', '__CLASS__': 'Adzuna::API::Response::Location'}","At eBay, we're more than a global ecommerce leader — we’re changing the way the world shops and sells. Our platform empowers millions of buyers and sellers in more than 190 markets around the world. We’re committed to pushing boundaries and leaving our mark as we reinvent the future of ecommerce for enthusiasts. Our customers are our compass, authenticity thrives, bold ideas are welcome, and everyone can bring their unique selves to work — every day. We're in this together, sustaining the futur…",0,eyJhbGciOiJIUzI1NiJ9.eyJzIjoiT0hURXpYNUw4QkdZMWJlUC0wc0pxQSIsImkiOiI1MjUwNDY4MDMyIn0.IfQhFReVbtj9Xrg_cGIF1DfsXnYY3fpfLn_9glvJWg8,"{'__CLASS__': 'Adzuna::API::Response::Category', 'label': 'Unknown', 'tag': 'unknown'}",2025-06-14T14:28:29Z,5250468032,"{'display_name': 'eBay Group Services', '__CLASS__': 'Adzuna::API::Response::Company'}",,Adzuna::API::Response::Job,Senior Data Science Analyst,,https://www.adzuna.de/details/5250468032?utm_medium=api&utm_source=a4bcf954,full_time,,,
"{'area': ['Deutschland', 'Hamburg', 'Altona-Altstadt'], '__CLASS__': 'Adzuna::API::Response::Location', 'display_name': 'Altona-Altstadt, Hamburg'}","Bei uns sind alle willkommen - unabhängig von Geschlecht, Nationalität, ethnischer und sozialer Herkunft, Religion/Weltanschauung, Behinderung, Alter oder sexueller Orientierung. Wir glauben an eine Kultur des Wissensaustauschs und des gegenseitigen Respekts, die auf dem Wohlbefinden jeder einzelnen Person im Team basiert. Du konzipierst innovative Datenlösungen und leitest datengetriebene Projekte auf Enterprise-Niveau – idealerweise unter Einsatz von Machine Learning und KI. Von der Strategie…",0,eyJhbGciOiJIUzI1NiJ9.eyJzIjoiT0hURXpYNUw4QkdZMWJlUC0wc0pxQSIsImkiOiI1MTE5MjAyMzc1In0.4gv_ImNiFd3Nj9xiSBMe_T7CMR-3TSDHTunUCjNeibM,"{'tag': 'unknown', 'label': 'Unknown', '__CLASS__': 'Adzuna::API::Response::Category'}",2025-03-30T21:02:31Z,5119202375,"{'__CLASS__': 'Adzuna::API::Response::Company', 'display_name': 'OMG Investment + Activation'}",9.9477,Adzuna::API::Response::Job,Director Data Science (mensch),53.54883,https://www.adzuna.de/details/5119202375?utm_medium=api&utm_source=a4bcf954,full_time,,,
"{'__CLASS__': 'Adzuna::API::Response::Location', 'display_name': 'Friedrichstadt, Düsseldorf', 'area': ['Deutschland', 'Nordrhein-Westfalen', 'Düsseldorf', 'Friedrichstadt']}","Bei uns sind alle willkommen - unabhängig von Geschlecht, Nationalität, ethnischer und sozialer Herkunft, Religion/Weltanschauung, Behinderung, Alter oder sexueller Orientierung. Wir glauben an eine Kultur des Wissensaustauschs und des gegenseitigen Respekts, die auf dem Wohlbefinden jeder einzelnen Person im Team basiert. Du konzipierst innovative Datenlösungen und leitest datengetriebene Projekte auf Enterprise-Niveau – idealerweise unter Einsatz von Machine Learning und KI. Von der Strategie…",0,eyJhbGciOiJIUzI1NiJ9.eyJpIjoiNTExOTIyMTc2OSIsInMiOiJPSFRFelg1TDhCR1kxYmVQLTBzSnFBIn0.va7LOhQezJxtpu3RC-e5vVFDbTox_6tHux5Tk89Yqjs,"{'__CLASS__': 'Adzuna::API::Response::Category', 'label': 'Unknown', 'tag': 'unknown'}",2025-03-30T21:29:58Z,5119221769,"{'display_name': 'OMG Investment + Activation', '__CLASS__': 'Adzuna::API::Response::Company'}",6.78075,Adzuna::API::Response::Job,Director Data Science (mensch),51.21393,https://www.adzuna.de/details/5119221769?utm_medium=api&utm_source=a4bcf954,full_time,,,
"{'area': ['Deutschland', 'Baden-Württemberg', 'Karlsruhe (Kreis)', 'Karlsruhe', 'Hagsfeld'], 'display_name': 'Hagsfeld, Karlsruhe', '__CLASS__': 'Adzuna::API::Response::Location'}","Deine Aufgaben Sammle wertvolle praktische Erfahrungen in der Anwendung von KI, indem du an spannenden Forschungs- und Kundenprojekten mitwirkst. Nimm an unseren Workshops mit namhaften Kunden teil und unterstütze dabei, kundenspezifische Anforderungen zu identifizieren und Lösungen zu entwickeln. Leite durch fortgeschrittene Analysen und Visualisierungen Erkenntnisse aus Daten ab. Unterstütze bei der Erprobung und Auswahl geeigneter Machine Learning Verfahren. Helfe bei der Implementierung von…",0,eyJhbGciOiJIUzI1NiJ9.eyJpIjoiNDk3MDcxMDI0NiIsInMiOiJPSFRFelg1TDhCR1kxYmVQLTBzSnFBIn0.L06CgzwBYQNtPl0jAhd5z4pOMDzDSq9GHxbzK3M-fyM,"{'label': 'Unknown', '__CLASS__': 'Adzuna::API::Response::Category', 'tag': 'unknown'}",2024-12-10T19:18:43Z,4970710246,"{'__CLASS__': 'Adzuna::API::Response::Company', 'display_name': 'prenode GmbH'}",8.45882,Adzuna::API::Response::Job,Praktikum: Data Science und KI,49.03084,https://www.adzuna.de/details/4970710246?utm_medium=api&utm_source=a4bcf954,part_time,,,
"{'area': ['Deutschland', 'Baden-Württemberg', 'Karlsruhe (Kreis)', 'Karlsruhe'], 'display_name': 'Karlsruhe, Karlsruhe (Kreis)', '__CLASS__': 'Adzuna::API::Response::Location'}","Deine Aufgaben Sammle wertvolle praktische Erfahrungen in der Anwendung von KI, indem du an spannenden Forschungs- und Kundenprojekten mitwirkst. Nimm an unseren Workshops mit namhaften Kunden teil und unterstütze dabei, kundenspezifische Anforderungen zu identifizieren und Lösungen zu entwickeln. Leite durch fortgeschrittene Analysen und Visualisierungen Erkenntnisse aus Daten ab. Unterstütze bei der Erprobung und Auswahl geeigneter Machine Learning Verfahren. Helfe bei der Implementierung von…",0,eyJhbGciOiJIUzI1NiJ9.eyJpIjoiNDk3MTgxMTg2NyIsInMiOiJPSFRFelg1TDhCR1kxYmVQLTBzSnFBIn0.k76A4cAL5YreCqxFM7HvQCAbJrBlCuzZ3cCmYWSAFZA,"{'label': 'Unknown', '__CLASS__': 'Adzuna::API::Response::Category', 'tag': 'unknown'}",2024-12-11T12:44:02Z,4971811867,"{'__CLASS__': 'Adzuna::API::Response::Company', 'display_name': 'prenode'}",8.412378,Adzuna::API::Response::Job,Praktikum: Data Science und KI,49.001249,https://www.adzuna.de/details/4971811867?utm_medium=api&utm_source=a4bcf954,part_time,,,
"{'area': ['Deutschland', 'Berlin'], '__CLASS__': 'Adzuna::API::Response::Location', 'display_name': 'Berlin, Deutschland'}","INTRODUCTION TO THE COMPANY Webtrekk is one of Europe’s market leaders for Customer Intelligence and Marketing Analytics. Since 2019, we are part of the marketing technology service provider, Mapp, and support marketers and data analysts in understanding and analyzing the behavior of their website and app users across all channels and help to utilize this information specifically for marketing purposes. Our solution, which is based on first-party data, ensures maximum data depth for our custome…",0,eyJhbGciOiJIUzI1NiJ9.eyJzIjoiT0hURXpYNUw4QkdZMWJlUC0wc0pxQSIsImkiOiI0ODcwNDg5MDc1In0.JJ59fNaKN1Z7LYeFgR4cmXKDvmIVqzkb73RevB9Ybj8,"{'__CLASS__': 'Adzuna::API::Response::Category', 'label': 'Unknown', 'tag': 'unknown'}",2024-09-20T13:48:26Z,4870489075,"{'display_name': 'Mapp Digital Us Llc', '__CLASS__': 'Adzuna::API::Response::Company'}",13.420806,Adzuna::API::Response::Job,Team Lead Data Science,52.507706,https://www.adzuna.de/details/4870489075?utm_medium=api&utm_source=a4bcf954,full_time,,,
"{'area': ['Deutschland', 'Nordrhein-Westfalen', 'Rhein-Erft-Kreis', 'Hürth'], 'display_name': 'Hürth, Rhein-Erft-Kreis', '__CLASS__': 'Adzuna::API::Response::Location'}",START YOUR CAREER WITH OUR CONSULTING ACTIVITIES IN MACHINE LEARNING! - Bei Niologic bauen wir das führende Beratungsunternehmen für Product Engineering für KI und Location Intelligence in Deutschland auf. Durch die Kombination der Megatrends KI und Location Intelligence wollen wir für unsere Kunden die neuesten Trends in Produktion bringen und ihr tägliches Leben positiv verändern. Entgegen aktueller Branchentrends und mit dem Vertrauen führender Marken im Rücken wollen wir von einem außergewö…,0,eyJhbGciOiJIUzI1NiJ9.eyJpIjoiNTA5MDkyMDg0NiIsInMiOiJPSFRFelg1TDhCR1kxYmVQLTBzSnFBIn0.8Rk7Quy7iUkeqPKzwQif7G8FAxJDSB2Ay-iraXNtpLY,"{'tag': 'consultancy-jobs', 'label': 'Beraterstellen', '__CLASS__': 'Adzuna::API::Response::Category'}",2025-03-13T10:46:40Z,5090920846,"{'display_name': 'niologic', '__CLASS__': 'Adzuna::API::Response::Company'}",6.86811,Adzuna::API::Response::Job,Trainee Data Science in der Unternehmensberatung,50.87096,https://www.adzuna.de/details/5090920846?utm_medium=api&utm_source=a4bcf954,,,,
"{'__CLASS__': 'Adzuna::API::Response::Location', 'display_name': 'Düsseldorf, Nordrhein-Westfalen', 'area': ['Deutschland', 'Nordrhein-Westfalen', 'Düsseldorf']}","Hallo, wir sind die Coding Giants  Unsere Mission ist es, junge Talente zu fördern und ihnen zu zeigen, dass die Welt der Programmierung und IT faszinierend und für alle zugänglich ist! Im Rahmen dieser Mission unterrichten wir Kinder und Jugendliche online in verschiedenen Programmiersprachen und mehr. Dabei unterstützen wir sie beim Aufbau von Zukunftskompetenzen – und das alles unter der Anleitung außergewöhnlicher Trainer! Aufgaben  Wir suchen Dich! Du unterstützt gerne Kinder und Jugendlic…",0,eyJhbGciOiJIUzI1NiJ9.eyJpIjoiNTI0Mzg4NzA5OCIsInMiOiJPSFRFelg1TDhCR1kxYmVQLTBzSnFBIn0.NLnTzOyg-rmxfBf6d8cEPhDUgRi2Eu66aoYifnSuH-w,"{'__CLASS__': 'Adzuna::API::Response::Category', 'label': 'Unknown', 'tag': 'unknown'}",2025-06-11T08:27:00Z,5243887098,"{'__CLASS__': 'Adzuna::API::Response::Company', 'display_name': 'Coding Giants'}",6.808387,Adzuna::API::Response::Job,Programmiertutorin,51.226802,https://www.adzuna.de/land/ad/5243887098?se=OHTEzX5L8BGY1beP-0sJqA&utm_medium=api&utm_source=a4bcf954&v=39C4C18B6085DF4B953F2EA839A11F4FAD58977A,,,,
"{'area': ['Deutschland', 'Nordrhein-Westfalen', 'Dortmund'], 'display_name': 'Dortmund, Nordrhein-Westfalen', '__CLASS__': 'Adzuna::API::Response::Location'}","Amprion verbindet. Unser Übertragungsnetz transportiert Strom für 29 Millionen Menschen in einem Gebiet von der Nordsee bis zu den Alpen. Dort wird ein Drittel der deutschen Wirtschaftsleistung erzeugt. Unsere Leitungen sind Lebensadern der Gesellschaft. Wir halten unser Netz stabil und sicher - und bereiten den Weg für die Energiewende: Wir bauen unser Netz aus und arbeiten an neuen Ideen für ein klimaverträgliches, sicheres und effizientes Energiesystem. Aufgaben IHRE AUFGABEN Datenproduktman…",0,eyJhbGciOiJIUzI1NiJ9.eyJzIjoiT0hURXpYNUw4QkdZMWJlUC0wc0pxQSIsImkiOiI1MjQ3OTcyMjk3In0.v2h9or1jhDObxKpn2OWyJ0I0gDKpzIqzViXpeRr-we8,"{'tag': 'other-general-jobs', '__CLASS__': 'Adzuna::API::Response::Category', 'label': 'Sonstige/Allgemeine Stellen'}",2025-06-13T08:27:46Z,5247972297,"{'display_name': 'Amprion GmbH', '__CLASS__': 'Adzuna::API::Response::Company'}",7.464954,Adzuna::API::Response::Job,Referent Data Governance (w/m/d),51.504967,https://www.adzuna.de/land/ad/5247972297?se=OHTEzX5L8BGY1beP-0sJqA&utm_medium=api&utm_source=a4bcf954&v=D8EAEC14A2DBDC22EAC367833D3BF4B6713F733F,,,,
"{'display_name': 'Hannover, Region Hannover (Kreis)', '__CLASS__': 'Adzuna::API::Response::Location', 'area': ['Deutschland', 'Niedersachsen', 'Region Hannover (Kreis)', 'Hannover']}","Du möchtest deine Talente entfalten, deine Stärken beweisen, deine Ideen einbringen? Als ein führender europäischer Anbieter von Finanz- und Vorsorgelösungen unterstützen wir mit Leidenschaft Menschen, finanziell für sich zu sorgen – ein Leben lang. Das Know-how und die Leidenschaft unserer Mitarbeitenden ist dabei die Grundlage unserer Erfolge. Deshalb fördern und unterstützen wir auch dich individuell und bedarfsgerecht sowohl in deiner persönlichen als auch bei deiner beruflichen Entwicklung…",0,eyJhbGciOiJIUzI1NiJ9.eyJzIjoiT0hURXpYNUw4QkdZMWJlUC0wc0pxQSIsImkiOiI1MjE3MDY5NDIzIn0.MJhbvsZkqhaVN5vscRK85ovT8Wiu2ny9UqYhOQHt6Y8,"{'label': 'Vertriebsstellen', '__CLASS__': 'Adzuna::API::Response::Category', 'tag': 'sales-jobs'}",2025-05-26T19:39:21Z,5217069423,"{'__CLASS__': 'Adzuna::API::Response::Company', 'display_name': 'Swiss Life Deutschland Holding GmbH'}",9.742751,Adzuna::API::Response::Job,Mitarbeiter (m/w/d) Vertriebscontrolling,52.378818,https://www.adzuna.de/land/ad/5217069423?se=OHTEzX5L8BGY1beP-0sJqA&utm_medium=api&utm_source=a4bcf954&v=2C16BDA536169D7489D9D97094E9C0E5F9A63AB9,,,,
"{'area': ['Deutschland'], 'display_name': 'Deutschland', '__CLASS__': 'Adzuna::API::Response::Location'}","Project description In the rapidly evolving landscape of modern mobility and transport services, a significant challenge lies in seamlessly integrating the elements of automotive OEM infrastructure with diverse services of external partners. Luxoft will develop a Cloud platform to exchange, integrate and process data from and to the vehicle, the Mobileye SDS backend, and the MaaS System. The AWS-based solution will be designed by reviewing and improving the current concept in close cooperation …",0,eyJhbGciOiJIUzI1NiJ9.eyJpIjoiNTIxMTkwOTgyOSIsInMiOiJPSFRFelg1TDhCR1kxYmVQLTBzSnFBIn0.HI9h2ZQREkllAdrgTDWF_ioKbiPEwqGE7GniI3srjBk,"{'tag': 'unknown', 'label': 'Unknown', '__CLASS__': 'Adzuna::API::Response::Category'}",2025-05-23T06:35:22Z,5211909829,"{'__CLASS__': 'Adzuna::API::Response::Company', 'display_name': 'Luxoft Germany'}",,Adzuna::API::Response::Job,Senior Data Engineer (m/w/d) - with experience Data Modelling and Data Science  AWS,,https://www.adzuna.de/land/ad/5211909829?se=OHTEzX5L8BGY1beP-0sJqA&utm_medium=api&utm_source=a4bcf954&v=F6FC31AF25F6A443DA579C716A5D9B39CC674C89,,,,
"{'area': ['Deutschland', 'Nordrhein-Westfalen', 'Essen'], 'display_name': 'Essen, Nordrhein-Westfalen', '__CLASS__': 'Adzuna::API::Response::Location'}","Die Unternehmensgruppe ALDI Nord ist einer der führenden Lebensmitteleinzelhändler. Mit einer Tradition von über 110 Jahren steht ALDI für die Erfindung des Discount-Prinzips. Unsere Mission ist es, Menschen überall und jederzeit mit dem zu versorgen, was sie für ihr tägliches Leben brauchen: qualitative Produkte zum niedrigen Preis - einfach und schnell. Dazu gehört auch, das Einkaufen für unsere Kundinnen und Kunden so einfach wie möglich zu machen. Dafür geben wir jeden Tag unser Bestes und …",0,eyJhbGciOiJIUzI1NiJ9.eyJzIjoiT0hURXpYNUw4QkdZMWJlUC0wc0pxQSIsImkiOiI1MjM1NzY5MDYxIn0.8_bzPzYKsp_gCYIbMSU_rcY953Fw7iwYcMgaHuj_8v8,"{'tag': 'pr-advertising-marketing-jobs', 'label': 'Stellen aus PR, Werbung & Marketing', '__CLASS__': 'Adzuna::API::Response::Category'}",2025-06-06T08:03:08Z,5235769061,"{'__CLASS__': 'Adzuna::API::Response::Company', 'display_name': 'ALDI Nord'}",7.014478,Adzuna::API::Response::Job,Manager Business Analytics – Procurement (m/w/d),51.444823,https://www.adzuna.de/land/ad/5235769061?se=OHTEzX5L8BGY1beP-0sJqA&utm_medium=api&utm_source=a4bcf954&v=684CFAD80AEE79B2DB1F48CC7A373584D5D1E203,,,,
"{'area': ['Deutschland', 'Sachsen', 'Leipzig (Kreis)', 'Leipzig'], 'display_name': 'Leipzig, Leipzig (Kreis)', '__CLASS__': 'Adzuna::API::Response::Location'}","IQVIA TM – The Human Data Science Company TM – ist ein führender, globaler Anbieter von zukunftsweisender Analytik, Technologielösungen und klinischer Auftragsforschung. IQVIA unterstützt Life-Science-Unternehmen, Verbände, Institutionen, Kostenträger und weitere Akteure im Gesundheitswesen darin, bessere Ergebnisse in der Gesundheitsversorgung zu erzielen. Werden Sie Teil unserer Community  von rund 90.000 Mitarbeiterinnen und Mitarbeitern in über 100 Ländern, die sich dafür einsetzen, das Pot…",0,eyJhbGciOiJIUzI1NiJ9.eyJzIjoiT0hURXpYNUw4QkdZMWJlUC0wc0pxQSIsImkiOiI1MjM5ODQ0MTk2In0.Rff-BLEXTbvthuWQ3dpDwcR8zeaLNiZ7Ue80Lyp61kg,"{'tag': 'accounting-finance-jobs', '__CLASS__': 'Adzuna::API::Response::Category', 'label': 'Stellen aus Buchhaltung & Finanzwesen'}",2025-06-08T09:22:07Z,5239844196,"{'__CLASS__': 'Adzuna::API::Response::Company', 'display_name': 'IQVIA Commercial GmbH & Co. OHG'}",12.373598,Adzuna::API::Response::Job,Payroll Spezialist / Mitarbeiter in der Entgeltabrechnung (m/w/d) Pharma & Healthcare,51.339254,https://www.adzuna.de/land/ad/5239844196?se=OHTEzX5L8BGY1beP-0sJqA&utm_medium=api&utm_source=a4bcf954&v=3346B9509FCA6F2A7E4EE3BAFAF5026524869514,,,,
"{'__CLASS__': 'Adzuna::API::Response::Location', 'display_name': 'Deutschland', 'area': ['Deutschland']}","IQVIA – The Human Data Science Company – ist ein führender, globaler Anbieter von zukunftsweisender Analytik, Technologielösungen und klinischer Auftragsforschung. IQVIA unterstützt Life Science Unternehmen, Verbände, Institutionen, Kostenträger und weitere Akteure im Gesundheitswesen darin, bessere Ergebnisse in der Gesundheitsversorgung zu erzielen. Werden Sie Teil unserer Community von rund 86.000 Mitarbeiterinnen und Mitarbeitern in über 100 Ländern, die sich dafür einsetzen, das Potenzial …",0,eyJhbGciOiJIUzI1NiJ9.eyJzIjoiT0hURXpYNUw4QkdZMWJlUC0wc0pxQSIsImkiOiI1MjQyMTU0NTUxIn0.jHBa0apNe3jTbgJaFEdgIep5OZhcRHpx2Yl8KzFcl78,"{'label': 'Stellen aus Gesundheitswesen & Pflege', '__CLASS__': 'Adzuna::API::Response::Category', 'tag': 'healthcare-nursing-jobs'}",2025-06-10T08:24:23Z,5242154551,"{'display_name': 'IQVIA CSMS GmbH', '__CLASS__': 'Adzuna::API::Response::Company'}",,Adzuna::API::Response::Job,Field Nurse/Study Nurse (m/w/d) - bundesweit in Wohnortnähe flexibel in Voll- und Teilzeit,,https://www.adzuna.de/land/ad/5242154551?se=OHTEzX5L8BGY1beP-0sJqA&utm_medium=api&utm_source=a4bcf954&v=1E2532D31DB1923B9D59F922DB8A9080E2FBC045,,,,
"{'__CLASS__': 'Adzuna::API::Response::Location', 'display_name': 'Fürth, Fürth (Kreis)', 'area': ['Deutschland', 'Bayern', 'Fürth (Kreis)', 'Fürth']}","About the job Mit über 40 Jahren Erfahrung ist EVAGO einer der größten Anbieter für Eventinfrastruktur. Unsere operativen Unternehmen „MOJO® Rental“ sind in über 30 Ländern der Welt tätig und sind Spezialisten für alles, was vor und hinter den Bühnen der großen Shows der Welt benötigt wird. EVAGO Digital ist das neu Inhouse-Unit um sämtliche Prozesse zu digitalisieren und das E-Commerce-Business zu skalieren. Wir sind ehrgeizig, haben ambitionierte Ziele und sorgen im Hintergrund dafür, dass wi…",0,eyJhbGciOiJIUzI1NiJ9.eyJzIjoiT0hURXpYNUw4QkdZMWJlUC0wc0pxQSIsImkiOiI1MjUyNzIyNjYwIn0.K5CwLlJIjh5sSVaUXEnha1ARw8dgraEr_5RpN_S8pY4,"{'tag': 'unknown', 'label': 'Unknown', '__CLASS__': 'Adzuna::API::Response::Category'}",2025-06-16T08:31:22Z,5252722660,"{'display_name': 'EVAGO Digital GmbH', '__CLASS__': 'Adzuna::API::Response::Company'}",10.982324,Adzuna::API::Response::Job,Data Engineer/Scientist/Analyst,49.493698,https://www.adzuna.de/land/ad/5252722660?se=OHTEzX5L8BGY1beP-0sJqA&utm_medium=api&utm_source=a4bcf954&v=EB76061F47723860CFFD1C2F3B3FFB51A69514C0,,,,
"{'__CLASS__': 'Adzuna::API::Response::Location', 'display_name': 'Sindelfingen, Böblingen (Kreis)', 'area': ['Deutschland', 'Baden-Württemberg', 'Böblingen (Kreis)', 'Sindelfingen']}","Life is always about becoming… Im Leben geht es darum, sich auf eine Reise zu begeben, um die beste Version unseres zukünftigen Selbst zu werden. Während wir Neues entdecken, stellen wir uns Herausforderungen, meistern sie und wachsen über uns hinaus. Bewerben Sie sich bei Mercedes-Benz und finden Sie den Aufgabenbereich, in dem Sie Ihre Talente individuell entfalten können. Dabei werden Sie von visionären Kolleginnen und Kollegen unterstützt, die Ihren Pioniergeist teilen. Bei uns einzusteigen…",0,eyJhbGciOiJIUzI1NiJ9.eyJzIjoiT0hURXpYNUw4QkdZMWJlUC0wc0pxQSIsImkiOiI1MjQ2MDMwNTYxIn0.Op7qVWxbpx5x6Mj01uyPvMVvc4ilOQNYevH3kbqj7mw,"{'tag': 'unknown', 'label': 'Unknown', '__CLASS__': 'Adzuna::API::Response::Category'}",2025-06-12T08:17:41Z,5246030561,"{'__CLASS__': 'Adzuna::API::Response::Company', 'display_name': 'Mercedes-Benz AG'}",9.026231,Adzuna::API::Response::Job,Werkstudent*in E/E-Systemintegration - Data Engineering und Analytics,48.720071,https://www.adzuna.de/land/ad/5246030561?se=OHTEzX5L8BGY1beP-0sJqA&utm_medium=api&utm_source=a4bcf954&v=B78E5A67A60FBD72F5EAB862287B5416C48B36C8,,,,
"{'area': ['Deutschland', 'Bayern', 'München (Kreis)', 'München'], '__CLASS__': 'Adzuna::API::Response::Location', 'display_name': 'München, München (Kreis)'}","Attraktiver Stundenlohn Flexible Einsatzplanung, abhängig von Deinem Studienplan Zugang zum Rabattportal ""Corporate Benefits"" Arbeit in einem hellen und modernen Büro in München Harmonisches und vertrauensvolles Arbeitsklima in einem freundlichen Team Aufgaben Erstellung von monatlichen Reportings relevanter KPIs für interne und externe Stakeholder Content Management: Unterstützung beim Seiten-Relaunch – Aufbau neuer Seiten, kleinere Textaufträge und strukturelles Testing Unterstützung Social M…",0,eyJhbGciOiJIUzI1NiJ9.eyJzIjoiT0hURXpYNUw4QkdZMWJlUC0wc0pxQSIsImkiOiI1MjM5ODIyMTE1In0.RVlTD_27jKhuBmjONVql5--_JRXQFxmMhcgoctIlYTc,"{'tag': 'pr-advertising-marketing-jobs', 'label': 'Stellen aus PR, Werbung & Marketing', '__CLASS__': 'Adzuna::API::Response::Category'}",2025-06-08T08:34:36Z,5239822115,"{'__CLASS__': 'Adzuna::API::Response::Company', 'display_name': 'AllDent Zahnzentrum GmbH'}",11.555737,Adzuna::API::Response::Job,Werkstudent:in im Bereich Marketing (m/w/d),48.137418,https://www.adzuna.de/land/ad/5239822115?se=OHTEzX5L8BGY1beP-0sJqA&utm_medium=api&utm_source=a4bcf954&v=0D59140CF3BAD8610B8317D47B82F106F3CC6E62,,,,
"{'area': ['Deutschland', 'Nordrhein-Westfalen', 'Paderborn (Kreis)', 'Paderborn'], 'display_name': 'Paderborn, Paderborn (Kreis)', '__CLASS__': 'Adzuna::API::Response::Location'}","Die LIRA service GmbH, mit Ihren mittlerweile rund 70 Mitarbeitern, ist exklusiver IT-Dienstleister für die weltweiten Kronospan Standorte. In Sandebeck bzw. in Paderborn findet die Betreuung des hauseigenen ERP Packages mit Kernkomponenten wie Verkaufsabwicklung, Einkaufsprozessen, Produktions-, Lager- und Versandlogistik statt. Dies umfasst Planung, Design, Entwicklung, Test und Betrieb der Software, Support, Datenbankadministration sowie die Netzwerk- und sonstige Informations- und Telekommu…",0,eyJhbGciOiJIUzI1NiJ9.eyJpIjoiNTI0MDg5MDk2NyIsInMiOiJPSFRFelg1TDhCR1kxYmVQLTBzSnFBIn0.shu9W9GKZQcsb7YaWf2Ze0s9i2328EwAxQH5K2pPiTM,"{'tag': 'it-jobs', 'label': 'IT-Stellen', '__CLASS__': 'Adzuna::API::Response::Category'}",2025-06-09T08:06:40Z,5240890967,"{'__CLASS__': 'Adzuna::API::Response::Company', 'display_name': 'LIRA service GmbH'}",8.753842,Adzuna::API::Response::Job,Informatiker für interne KI-Projekte (m/w/d),51.737096,https://www.adzuna.de/land/ad/5240890967?se=OHTEzX5L8BGY1beP-0sJqA&utm_medium=api&utm_source=a4bcf954&v=CFC05A834CC4E83146DB51A66D434CC1A50C754D,,,,
"{'area': ['Deutschland', 'Nordrhein-Westfalen', 'Essen'], 'display_name': 'Essen, Nordrhein-Westfalen', '__CLASS__': 'Adzuna::API::Response::Location'}","NOWEDA ist ein vollversorgendes pharmazeutisches Großhandelsunternehmen mit 20 Niederlassungen in Deutschland sowie Beteiligungen an Unternehmen in Luxemburg und in der Schweiz. Eigentümer und Mitglieder der genossenschaftlich organisierten NOWEDA sind mehr als 9 300 Apothekerinnen und Apotheker. Mit einem Gesamtumsatz von 9,9 Milliarden Euro ist NOWEDA eines der großen deutschen Handelsunternehmen. Hauptsitz der Genossenschaft ist Essen. NOWEDA stellt ihren Mitglieder-Apotheken, und damit den …",0,eyJhbGciOiJIUzI1NiJ9.eyJzIjoiT0hURXpYNUw4QkdZMWJlUC0wc0pxQSIsImkiOiI1MjUzNTI1ODYxIn0.bpAdYdYexM8WtXdwqZtOp9BCI-rjkAKSI3VRuPTsWV4,"{'tag': 'it-jobs', '__CLASS__': 'Adzuna::API::Response::Category', 'label': 'IT-Stellen'}",2025-06-16T20:29:15Z,5253525861,"{'display_name': 'NOWEDA Apothekergenossenschaft eG', '__CLASS__': 'Adzuna::API::Response::Company'}",7.014478,Adzuna::API::Response::Job,Informatiker / Data Scientist / Mathematiker als KI-Experte (m/w/d) IT Künstliche Intelligenz Chatboots,51.444823,https://www.adzuna.de/land/ad/5253525861?se=OHTEzX5L8BGY1beP-0sJqA&utm_medium=api&utm_source=a4bcf954&v=C6731CFBA5AD579F8BA0D544E1336B8DCADF1A4D,,,,
"{'__CLASS__': 'Adzuna::API::Response::Location', 'display_name': 'Köln, Nordrhein-Westfalen', 'area': ['Deutschland', 'Nordrhein-Westfalen', 'Köln']}","Aufgaben Profil Wir bieten Ort: 50933 Köln | Vertragsart: Vollzeit, unbefristet | Job-ID: 829295 Was wir zusammen vorhaben: Als Geschäftsbereich Analytics der REWE Group sind wir Teil des Vorstandsressorts Digital & Technology, mit dem wir alle strategischen, analytischen und geschäftsunterstützenden Funktionen innerhalb von Handel Deutschland unter einem Dach zusammenführen. Der Geschäftsbereich verfolgt das Ziel, Advanced Analytics sowie Artificial Intelligence als Fähigkeit und Werttreiber i…",0,eyJhbGciOiJIUzI1NiJ9.eyJzIjoiT0hURXpYNUw4QkdZMWJlUC0wc0pxQSIsImkiOiI1MDk5ODAzOTQ4In0._GqeQljwzBWTz5tyQs8EYZb7tTzBXbhLO-kumosl6Bo,"{'__CLASS__': 'Adzuna::API::Response::Category', 'label': 'Stellen aus Wissenschaft & Qualitätssicherung', 'tag': 'scientific-qa-jobs'}",2025-03-18T23:56:35Z,5099803948,"{'display_name': 'REWE Group', '__CLASS__': 'Adzuna::API::Response::Company'}",6.969972,Adzuna::API::Response::Job,(Senior) Data Scientist Analytics (m/w/d),50.940164,https://www.adzuna.de/land/ad/5099803948?se=OHTEzX5L8BGY1beP-0sJqA&utm_medium=api&utm_source=a4bcf954&v=E315CACD4AF23BC36F987AC96F5093E050A3A018,,,,
