location,description,salary_is_predicted,adref,category,created,id,company,longitude,__CLASS__,title,latitude,redirect_url,contract_time,contract_type,salary_max,salary_min
"{'display_name': 'Herzogenaurach, Erlangen-Höchstadt (Kreis)', '__CLASS__': 'Adzuna::API::Response::Location', 'area': ['Deutschland', 'Bayern', 'Erlangen-Höchstadt (Kreis)', 'Herzogenaurach']}","Schaeffler - das ist die Faszination eines internationalen Technologie-Konzerns, verbunden mit der Kultur eines Familienunternehmens. Als Partner aller bedeutenden Automobilhersteller sowie zahlreicher Kunden im Industriebereich bieten wir Ihnen viel Raum für Ihre persönliche Entfaltung. Grundvoraussetzung für die Erstellung einer Abschlussarbeit ist der Nachweis der Immatrikulation. Diese Stelle ist ab sofort zu besetzen. Aufgaben Mitarbeit bei Spezifikation der notwendigen Daten für die GenAI…",0,eyJhbGciOiJIUzI1NiJ9.eyJzIjoiSlAxenpINUw4QkdoZnJwcDhKWTdyZyIsImkiOiI1MjA3MDQyMjM1In0.i6iAB8yZvsThA6cuXKSsOQvPcVSUFNnVtPioAAJEJDo,"{'tag': 'unknown', '__CLASS__': 'Adzuna::API::Response::Category', 'label': 'Unknown'}",2025-05-20T07:32:46Z,5207042235,"{'display_name': 'Schaeffler Technologies AG & Co. KG', '__CLASS__': 'Adzuna::API::Response::Company'}",10.88109,Adzuna::API::Response::Job,Abschlussarbeit zum Thema Generative KI und Datenmanagement in der Fabrikplanung (m/w/d),49.56892,https://www.adzuna.de/land/ad/5207042235?se=JP1zzH5L8BGhfrpp8JY7rg&utm_medium=api&utm_source=a4bcf954&v=25C378CE833917931AE9A13F708545DA60ADACF9,,,,
"{'area': ['Deutschland', 'Baden-Württemberg', 'Böblingen (Kreis)', 'Sindelfingen', 'Flugfeld'], 'display_name': 'Flugfeld, Sindelfingen', '__CLASS__': 'Adzuna::API::Response::Location'}","Our Company WE ARE AGAIN AWARDED AS TOP ARBEITGEBER 2025! At AP Sensing, we’re building on a success story that began in the garage of Bill Hewlett and Dave Packard. As an independent HP spin-off, we combine over 40 years of technological expertise with a passion for innovation. Together we’ll continue to enhance infrastructure, protect people, and safeguard our planet. With a commitment to fiber optic sensing, we value every voice and empower growth. Join us in thinking ahead to create a smart…",0,eyJhbGciOiJIUzI1NiJ9.eyJpIjoiNTI1MTYxMzg0NSIsInMiOiJKUDF6ekg1TDhCR2hmcnBwOEpZN3JnIn0.wos9j2SVP1u-WPWb0MEF_I_RMZoY8yh-OENKwJKypb4,"{'__CLASS__': 'Adzuna::API::Response::Category', 'tag': 'unknown', 'label': 'Unknown'}",2025-06-15T10:38:15Z,5251613845,"{'display_name': 'AP Sensing', '__CLASS__': 'Adzuna::API::Response::Company'}",9.01525,Adzuna::API::Response::Job,Data Science Team Lead (m/f/d),48.68567,https://www.adzuna.de/land/ad/5251613845?se=JP1zzH5L8BGhfrpp8JY7rg&utm_medium=api&utm_source=a4bcf954&v=ADB6518EE77EE4F3D6C858ABB735DEF5DB2CB7C4,,,,
"{'area': ['Deutschland', 'Bayern', 'München (Kreis)', 'München', 'Altstadt-Lehel'], '__CLASS__': 'Adzuna::API::Response::Location', 'display_name': 'Altstadt-Lehel, München'}","Wir alle haben als Kinder davon geträumt, Großes zu bewirken ob als gute Feen, Stars im Rampenlicht oder Weltraumreisende im All. Höchste Zeit, dass diese Träume wahr werden! Dein Traumschiff? Die BayernLB! Bei uns steuern wir einer blühenden Zukunft entgegen und kämpfen als Fortschrittsfinanzierer für die Welt von morgen. Unsere Feenflügel und Raumanzüge haben wir abgelegt. Nicht aber unsere Ziele. Denen sind wir näher denn je. Als Spezialbank fokussieren wir uns auf ausgesuchte Zukunftssektor…",0,eyJhbGciOiJIUzI1NiJ9.eyJzIjoiSlAxenpINUw4QkdoZnJwcDhKWTdyZyIsImkiOiI1MTg1MDgwNjI5In0.x_IyRuUlOd6lYwaS13ptEoxBkIkIC5lAhcPdIpJFVVM,"{'__CLASS__': 'Adzuna::API::Response::Category', 'tag': 'graduate-jobs', 'label': 'Stellen für Hochschulabsolventen'}",2025-05-07T13:28:21Z,5185080629,"{'display_name': 'Bayerische Landesbank', '__CLASS__': 'Adzuna::API::Response::Company'}",11.56907,Adzuna::API::Response::Job,Hochschule München: Duales Studium Data Science und Scientific Computing (B.Sc.) 2025,48.14093,https://www.adzuna.de/land/ad/5185080629?se=JP1zzH5L8BGhfrpp8JY7rg&utm_medium=api&utm_source=a4bcf954&v=7CB47C65BE7AF9A2FAB285F34DB0213AAA1C9D4F,,,,
"{'__CLASS__': 'Adzuna::API::Response::Location', 'display_name': 'Deutschland', 'area': ['Deutschland']}","Als unabhängige, internationale Managementberatung begegnen wir täglich spannenden Aufgaben und Kunden. Durch individuelle Stärken und Talente sowie umfassende Expertise wachsen wir über uns hinaus. Wir nehmen Herausforderungen an – als Team auf Augenhöhe. Freundschaftlich und mit Humor. Successfully together! That's Horváth. Praktikum. Weiter gedacht. Du bist nicht nur Teil unseres Teams, sondern startest auch direkt inhaltlich in unseren anspruchsvollen Entwicklungsprojekten und Lösungen im S…",0,eyJhbGciOiJIUzI1NiJ9.eyJpIjoiNTIyMDg0ODI5OCIsInMiOiJKUDF6ekg1TDhCR2hmcnBwOEpZN3JnIn0.8F3gZGIZWn3GQrU3VXkb4DMQ1raZ7ctjSaIqq8jdfzg,"{'__CLASS__': 'Adzuna::API::Response::Category', 'tag': 'other-general-jobs', 'label': 'Sonstige/Allgemeine Stellen'}",2025-05-28T23:30:13Z,5220848298,"{'display_name': 'Horváth', '__CLASS__': 'Adzuna::API::Response::Company'}",,Adzuna::API::Response::Job,Praktikum als Fellow Consultant (w/m/d) Steering Lab - Schwerpunkt Data Science,,https://www.adzuna.de/land/ad/5220848298?se=JP1zzH5L8BGhfrpp8JY7rg&utm_medium=api&utm_source=a4bcf954&v=FB41CF4DC95E40ED33DD6B75B0D240873738767D,,,,
"{'display_name': 'München, München (Kreis)', '__CLASS__': 'Adzuna::API::Response::Location', 'area': ['Deutschland', 'Bayern', 'München (Kreis)', 'München']}","DIE ZUKUNFT IST, WAS DU DARAUS MACHST. BMW GROUP STIPENDIATENPROGRAMM FASTLANE. Stipendiat Fastlane Programm (w/m/x). Stellenreferenz: 156953 Aufgaben Du arbeitest in unseren engagierten Teams an innovativen und nachhaltigen Technologien, die die Zukunft der Mobilität gestalten. Du sammelst Praxiserfahrungen in Zukunftsbereichen wie Data Analytics, Cloud Technologies, Cyber Security, Automatisiertes Fahren, Elektromobilität oder Smart Production. Dabei erhältst du Einblicke in spannende Projekt…",0,eyJhbGciOiJIUzI1NiJ9.eyJpIjoiNTE3NjYyMjg1NyIsInMiOiJKUDF6ekg1TDhCR2hmcnBwOEpZN3JnIn0.82B_UTape7Z68QYRdoMJt689fhL-LF7wootXdGPRjM8,"{'tag': 'unknown', '__CLASS__': 'Adzuna::API::Response::Category', 'label': 'Unknown'}",2025-05-02T19:16:59Z,5176622857,"{'__CLASS__': 'Adzuna::API::Response::Company', 'display_name': 'BMW Group'}",11.555737,Adzuna::API::Response::Job,Stipendiat Fastlane Programm (w/m/x) Future Mobility,48.137418,https://www.adzuna.de/land/ad/5176622857?se=JP1zzH5L8BGhfrpp8JY7rg&utm_medium=api&utm_source=a4bcf954&v=374FD051856C709825C57AA14AB20EBC41618D9D,,,,
"{'display_name': 'Altstadt-Lehel, München', '__CLASS__': 'Adzuna::API::Response::Location', 'area': ['Deutschland', 'Bayern', 'München (Kreis)', 'München', 'Altstadt-Lehel']}","Munich Data Science Institute (MDSI) Technische Universität MünchenTUM - Logo IT-Systemadministrator (m/w/d) am Munich Data Science Institute Das Munich Data Science Institute (MDSI) ist ein Integratives Forschungsinstitut an der Technischen Universität München (TUM). Es ist interdisziplinär und fachbereichsübergreifend in den Bereichen Data Science, Maschinelles Lernen und Künstliche Intelligenz ausgerichtet. Das Institut fungiert als Vermittler und Multiplikator modernster Data- Science-Prakt…",0,eyJhbGciOiJIUzI1NiJ9.eyJzIjoiSlAxenpINUw4QkdoZnJwcDhKWTdyZyIsImkiOiI1MjE5MjY3MTg5In0.l7Ds-G4V9SJIsJ3SH0plWc45ap1YSAFzFYjd_Q5hmfQ,"{'tag': 'engineering-jobs', '__CLASS__': 'Adzuna::API::Response::Category', 'label': 'Technikerstellen'}",2025-05-28T02:28:39Z,5219267189,"{'__CLASS__': 'Adzuna::API::Response::Company', 'display_name': 'Technische Universität München '}",11.56907,Adzuna::API::Response::Job,IT-Systemadministrator (m/w/d) am Munich Data Science Institute,48.14093,https://www.adzuna.de/land/ad/5219267189?se=JP1zzH5L8BGhfrpp8JY7rg&utm_medium=api&utm_source=a4bcf954&v=1CD0C460EB4916EF54EFCB064056402D33A9D244,,,,
"{'area': ['Deutschland', 'Baden-Württemberg', 'Stuttgart'], 'display_name': 'Stuttgart, Baden-Württemberg', '__CLASS__': 'Adzuna::API::Response::Location'}","Die NVBW – Nahverkehrsgesellschaft Baden-Württemberg mbH unterstützt das Ministerium für Verkehr Baden-Württemberg dabei, das Land zum Wegbereiter einer modernen und nachhaltigen Mobilität der Zukunft zu machen. Um dieser Herausforderung gewachsen zu sein, beschäftigen wir Expertinnen und Experten in den Bereichen Angebotsplanung und Infrastrukturentwicklung, Recht, Marketing/Erlöse/Vertrieb, Projekt- und Qualitätsmanagement sowie Neue und Digitale Mobilität. Kommen Sie zu uns und gestalten Sie…",0,eyJhbGciOiJIUzI1NiJ9.eyJpIjoiNTIwNzY5MTE1MSIsInMiOiJKUDF6ekg1TDhCR2hmcnBwOEpZN3JnIn0.EXYOtrBUs36uLlkU0acnY1DRgqFe30lMnEAQqkYK37I,"{'tag': 'unknown', '__CLASS__': 'Adzuna::API::Response::Category', 'label': 'Unknown'}",2025-05-20T19:34:07Z,5207691151,"{'display_name': 'NVBW - Nahverkehrsgesellschaft Baden-Württemberg mbH', '__CLASS__': 'Adzuna::API::Response::Company'}",9.187224,Adzuna::API::Response::Job,Werkstudent:in (m/w/d) im Team Förderprogramme / Standardisierte Bewertung / Finanzcontrolling,48.776198,https://www.adzuna.de/land/ad/5207691151?se=JP1zzH5L8BGhfrpp8JY7rg&utm_medium=api&utm_source=a4bcf954&v=31939BE2E21C4DCEED4CB46BE8B8EA1A9A558136,,,,
"{'area': ['Deutschland', 'Nordrhein-Westfalen', 'Bochum', 'Innenstadt'], 'display_name': 'Innenstadt, Bochum', '__CLASS__': 'Adzuna::API::Response::Location'}",In der Fakultät für Mathematik der RUB ist zum nächstmöglichen Zeitpunkt eine Universitätsprofessur W3 m/w/d für Mathematische Statistik und Data Science zu besetzen (vorzeitige Nachfolge Prof. Holger Dette). Die der zukünftige Stelleninhaber in soll in Forschung und Lehre das Fachgebiet Mathematische Statistik und Data Science vertreten. Bewerber innen sollen sowohl in Forschung als auch in Lehre hervorragend qualifiziert sein. Ihr international sichtbares Forschungsprofil soll dabei vorhanden…,0,eyJhbGciOiJIUzI1NiJ9.eyJpIjoiNTIzNjk3OTI1MiIsInMiOiJKUDF6ekg1TDhCR2hmcnBwOEpZN3JnIn0.0WBFV1uNxcnY2uIHzlvH5kJW2LnRufVS_g_3KamP9ck,"{'__CLASS__': 'Adzuna::API::Response::Category', 'tag': 'scientific-qa-jobs', 'label': 'Stellen aus Wissenschaft & Qualitätssicherung'}",2025-06-06T23:16:42Z,5236979252,"{'__CLASS__': 'Adzuna::API::Response::Company', 'display_name': 'Ruhr-Universität Bochum'}",7.22121,Adzuna::API::Response::Job,Universitätsprofessur W3 (m/w/d) für Mathematische Statistik und Data Science,51.48218,https://www.adzuna.de/land/ad/5236979252?se=JP1zzH5L8BGhfrpp8JY7rg&utm_medium=api&utm_source=a4bcf954&v=456109C4716B60CDACEC9DAE59252559F50E46F1,,,,
"{'area': ['Deutschland', 'Bayern', 'München (Kreis)', 'München'], '__CLASS__': 'Adzuna::API::Response::Location', 'display_name': 'München, München (Kreis)'}","Zu besetzen ab: 01.09.2025 Dein Arbeitsumfeld Wir bei MAN Truck & Bus sind Teil eines starken internationalen Teams und einer der führenden europäischen Nutzfahrzeughersteller und Anbieter von Transportlösungen. Zusammen mit den Marken Scania, Volkswagen Truck & Bus und International gehören wir zur TRATON GROUP. Als Teil dieses Verbundes stehen wir vor großen Herausforderungen: Unsere Fahrzeuge werden immer autonomer und vernetzter, um emissionsärmer unterwegs zu sein. Dafür arbeiten wir an na…",0,eyJhbGciOiJIUzI1NiJ9.eyJpIjoiNTI0MTQ1NDI1NCIsInMiOiJKUDF6ekg1TDhCR2hmcnBwOEpZN3JnIn0.7BPdlbyWOVEP4A7wRSy4JzKnxvJtXj-MaH5wPwqTqDc,"{'label': 'Unknown', 'tag': 'unknown', '__CLASS__': 'Adzuna::API::Response::Category'}",2025-06-09T20:04:04Z,5241454254,"{'__CLASS__': 'Adzuna::API::Response::Company', 'display_name': 'MAN Truck & Bus Group'}",11.555737,Adzuna::API::Response::Job,Thesisverfasser im Bereich Flottenanalyse Nutzung elektrische Fahrzeuge (w/m/d),48.137418,https://www.adzuna.de/land/ad/5241454254?se=JP1zzH5L8BGhfrpp8JY7rg&utm_medium=api&utm_source=a4bcf954&v=F1CE20848C53B5BD4F9004D591925C5AA02EE2BE,,,,
"{'area': ['Deutschland', 'Baden-Württemberg', 'Karlsruhe (Kreis)', 'Ettlingen'], '__CLASS__': 'Adzuna::API::Response::Location', 'display_name': 'Ettlingen, Karlsruhe (Kreis)'}","Wir übernehmen Verantwortung für das nachhaltige Management von Energie und Wasser und leisten damit unseren Beitrag zur Energiewende. Durch Data Science machen wir Daten zu nutzbaren Informationen und helfen unseren Kunden, neue zukunftsfähige Geschäftsfelder in der Energiebranche zu erschließen. Der Geschäftsbereich Digital Platform Services konzentriert sich auf den Aufbau eines IT Service- und Cybersecurity-Portfolios sowie die Entwicklung und Bereitstellung einer sicheren digitalen Plattfo…",0,eyJhbGciOiJIUzI1NiJ9.eyJzIjoiSlAxenpINUw4QkdoZnJwcDhKWTdyZyIsImkiOiI1MjIxMTgyNDYxIn0.-0V9MFj_KV7P3BYaXQ8LAR_Mtr--NeLUM2JcEvSus-c,"{'label': 'IT-Stellen', 'tag': 'it-jobs', '__CLASS__': 'Adzuna::API::Response::Category'}",2025-05-29T07:49:20Z,5221182461,"{'display_name': 'VIVAVIS AG', '__CLASS__': 'Adzuna::API::Response::Company'}",8.40934,Adzuna::API::Response::Job,Lead Architect – IT Platform (m/w/d),48.943,https://www.adzuna.de/land/ad/5221182461?se=JP1zzH5L8BGhfrpp8JY7rg&utm_medium=api&utm_source=a4bcf954&v=D6F5C5161B2AD73C891099CCFA64CD9F528A7295,,,,
"{'__CLASS__': 'Adzuna::API::Response::Location', 'display_name': 'Darmstadt, Hessen', 'area': ['Deutschland', 'Hessen', 'Darmstadt']}","„Sinnvoll für Mensch und Erde“ zu handeln ist unsere tägliche Motivation. Nicht nur beim Entwickeln und Verkaufen unserer Alnatura Bio-Produkte - auch in der Art und Weise, wie wir bei Alnatura zusammenarbeiten. Unsere Wertekultur ist auf ganzheitliches Denken, kundenorientiertes Handeln und Selbstverantwortung ausgelegt. Werde ein Teil unserer Alnatura Arbeitsgemeinschaft in unserem IT Bereich. In Vollzeit (40 Std. / Woche) Aufgaben Du entwickelst und setzt Data Analytics & AI-Strategien um, d…",0,eyJhbGciOiJIUzI1NiJ9.eyJpIjoiNTI1NDI0MzYwMCIsInMiOiJKUDF6ekg1TDhCR2hmcnBwOEpZN3JnIn0.ynHrRsOk6xjNTdUyFcX9-3FK_Vd1rk7IaJ9wt-Dqiww,"{'label': 'Unknown', '__CLASS__': 'Adzuna::API::Response::Category', 'tag': 'unknown'}",2025-06-17T08:07:27Z,5254243600,"{'__CLASS__': 'Adzuna::API::Response::Company', 'display_name': 'Alnatura Produktions- und Handels GmbH'}",8.656595,Adzuna::API::Response::Job,Senior Data Analytics & AI Specialist*,49.877672,https://www.adzuna.de/land/ad/5254243600?se=JP1zzH5L8BGhfrpp8JY7rg&utm_medium=api&utm_source=a4bcf954&v=13ABBBBAD9FBA08992E7D50A30F1110CFDFC104A,,,,
"{'area': ['Deutschland', 'Hamburg'], '__CLASS__': 'Adzuna::API::Response::Location', 'display_name': 'Hamburg, Deutschland'}","Du brennst für Data Science, Machine Learning und Large Language Models und möchtest Dein Wissen in die Praxis umsetzen? Dann bist Du bei CHECK24 genau richtig! In unserer internen BI- und Data-Science-Community arbeiten wir standortübergreifend zusammen, um das bestmögliche Kundenerlebnis zu schaffen und unsere Vergleichsplattform kontinuierlich zu optimieren. Wir suchen Dich als Data-Science-Talent mit einem exzellenten Hochschulabschluss in Data Science, Statistik, Mathematik, Informatik ode…",0,eyJhbGciOiJIUzI1NiJ9.eyJzIjoiSlAxenpINUw4QkdoZnJwcDhKWTdyZyIsImkiOiI1MTY5OTU1OTU3In0.A4wyNnTM06bza0Yl6T-kGhEZTJbquNNGo0OTfljwc84,"{'tag': 'scientific-qa-jobs', '__CLASS__': 'Adzuna::API::Response::Category', 'label': 'Stellen aus Wissenschaft & Qualitätssicherung'}",2025-04-30T07:14:06Z,5169955957,"{'display_name': 'CHECK24', '__CLASS__': 'Adzuna::API::Response::Company'}",9.987297,Adzuna::API::Response::Job,(Senior) Data Scientist (m/w/d) InsurTech,53.557429,https://www.adzuna.de/land/ad/5169955957?se=JP1zzH5L8BGhfrpp8JY7rg&utm_medium=api&utm_source=a4bcf954&v=E677514D6EDD1617B44BF920A497677AD1112E70,,,,
"{'area': ['Deutschland'], '__CLASS__': 'Adzuna::API::Response::Location', 'display_name': 'Deutschland'}","Du begeisterst dich für die komplexen Zusammenhänge in der IT und arbeitest gerne im Team? Willkommen in der Königsklasse Die Firma ZIEHL-ABEGG SE, mit derzeit über 5.000 Mitarbeitern weltweit, entwickelt, produziert und vertreibt global Ventilatoren, elektrische Spezialmotoren und Regelsysteme für die allgemeine Lufttechnik und Antriebstechnik. Neben dem Hauptsitz in Künzelsau befinden sich weitere süddeutsche Standorte des Unternehmens in Bieringen und Gewerbepark Hohenlohe. Als mittelständis…",0,eyJhbGciOiJIUzI1NiJ9.eyJzIjoiSlAxenpINUw4QkdoZnJwcDhKWTdyZyIsImkiOiI1MjUzMzcyOTc4In0.KhJes_Mh8BZbpuR45qmwu2Bms8LsWQuLwUzXd5En9MA,"{'label': 'Sonstige/Allgemeine Stellen', '__CLASS__': 'Adzuna::API::Response::Category', 'tag': 'other-general-jobs'}",2025-06-16T19:35:59Z,5253372978,"{'__CLASS__': 'Adzuna::API::Response::Company', 'display_name': 'ZIEHL-ABEGG SE'}",,Adzuna::API::Response::Job,Duales Studium Data Science und Künstliche Intelligenz (m/w/d) ab September 2025,,https://www.adzuna.de/land/ad/5253372978?se=JP1zzH5L8BGhfrpp8JY7rg&utm_medium=api&utm_source=a4bcf954&v=D808B1DF0BA57C3C25EDE59F86A64B71B2DC203C,,,,
"{'area': ['Deutschland', 'Hessen', 'Main-Taunus-Kreis', 'Eschborn'], 'display_name': 'Eschborn, Main-Taunus-Kreis', '__CLASS__': 'Adzuna::API::Response::Location'}","Bei EY setzen wir alles daran, dass die Welt besser funktioniert. Dafür hinterfragen wir täglich den Status quo und suchen schon heute die Antworten von morgen. Stillstand? Keine Option. Wandel? Sehen wir als Chance und Treiber für Innovation. Wenn du auch so tickst, dann bist du bei uns genau richtig. Wir suchen Macher:innen, die Unternehmen, Entrepreneuren, Privatpersonen und der öffentlichen Hand helfen, über sich hinaus zu wachsen. Das erfordert Zusammenarbeit auf Augenhöhe und das Verlasse…",0,eyJhbGciOiJIUzI1NiJ9.eyJpIjoiNTE5NzE1OTU4NyIsInMiOiJKUDF6ekg1TDhCR2hmcnBwOEpZN3JnIn0.sY9DP0fzkKgCjUBwJI4hMTfZ0KwGplC8nHXMOqOMsg0,"{'__CLASS__': 'Adzuna::API::Response::Category', 'tag': 'other-general-jobs', 'label': 'Sonstige/Allgemeine Stellen'}",2025-05-13T22:23:31Z,5197159587,"{'__CLASS__': 'Adzuna::API::Response::Company', 'display_name': 'EY Deutschland'}",,Adzuna::API::Response::Job,Praktikant Data Science im Bereich prüfungsnahe Beratung / Quants (Financial Services) (w/m/d),,https://www.adzuna.de/land/ad/5197159587?se=JP1zzH5L8BGhfrpp8JY7rg&utm_medium=api&utm_source=a4bcf954&v=AADA4988ABFD760FD44321CA23706DD19F56CC93,,,,
"{'display_name': 'Berlin, Deutschland', '__CLASS__': 'Adzuna::API::Response::Location', 'area': ['Deutschland', 'Berlin']}","ProBioGen ist ein international agierendes BioTech-Unternehmen mit Sitz in Berlin-Weißensee, das sich durch jahrelange Erfahrung auf die Entwicklung und Herstellung biopharmazeutischer Wirk- und Impfstoffe spezialisiert hat. Über 270 Mitarbeitende tragen täglich mit ihrer kreativen und sorgfältigen Arbeit zur Etablierung neuer Therapieentwicklungen in der Medizin und bahnbrechender Innovationen weltweit bei. Mit unserer Forschung unterstützen wir die Entwicklung wirksamer und sicherer medizinis…",0,eyJhbGciOiJIUzI1NiJ9.eyJzIjoiSlAxenpINUw4QkdoZnJwcDhKWTdyZyIsImkiOiI1MjQ4OTI5NDEwIn0.5ImR7Kb1Qg2yoZ7qv3Sk1YIUteAF2tEb-vIsdk7_xeg,"{'label': 'Unknown', '__CLASS__': 'Adzuna::API::Response::Category', 'tag': 'unknown'}",2025-06-13T20:10:42Z,5248929410,"{'__CLASS__': 'Adzuna::API::Response::Company', 'display_name': 'ProBioGen AG'}",13.420806,Adzuna::API::Response::Job,Student im Bereich Data Management (m/w/d),52.507706,https://www.adzuna.de/land/ad/5248929410?se=JP1zzH5L8BGhfrpp8JY7rg&utm_medium=api&utm_source=a4bcf954&v=02280C71FD3A37E00EC278DDD042D2E9E8CEF772,,,,
"{'__CLASS__': 'Adzuna::API::Response::Location', 'display_name': 'Oberkochen, Ostalbkreis', 'area': ['Deutschland', 'Baden-Württemberg', 'Ostalbkreis', 'Oberkochen']}","Als Studierender (m/w/x) arbeitest Du mit Deinen Kolleginnen und Kollegen auf Augenhöhe und schaffst Dir ideale Voraussetzungen für Deine spätere Karriere. In einem offenen und modernen Umfeld mit zahlreichen Entwicklungs- und Weiterbildungsmöglichkeiten, arbeiten die Mitarbeitenden bei ZEISS in einer Kultur, die von Expertenwissen und Teamgeist geprägt ist. All das wird getragen von der besonderen Eigentümerstruktur und dem langfristigen Ziel der Carl-Zeiss-Stiftung: Wissenschaft und Gesellsch…",0,eyJhbGciOiJIUzI1NiJ9.eyJzIjoiSlAxenpINUw4QkdoZnJwcDhKWTdyZyIsImkiOiI1MjIxMTg2NTYxIn0.KvMl81cB0smyPau6GfO_acQJDh9s4WDCV92J1qm2He8,"{'tag': 'other-general-jobs', '__CLASS__': 'Adzuna::API::Response::Category', 'label': 'Sonstige/Allgemeine Stellen'}",2025-05-29T07:51:16Z,5221186561,"{'display_name': 'ZEISS', '__CLASS__': 'Adzuna::API::Response::Company'}",10.10558,Adzuna::API::Response::Job,Praktikum technische Zuverlässigkeit und Fielddatascience (m/w/x),48.78408,https://www.adzuna.de/land/ad/5221186561?se=JP1zzH5L8BGhfrpp8JY7rg&utm_medium=api&utm_source=a4bcf954&v=D14FA1BACD2023C2920448CF9D027DC67BD9E575,,,,
"{'area': ['Deutschland', 'Nordrhein-Westfalen', 'Köln'], 'display_name': 'Köln, Nordrhein-Westfalen', '__CLASS__': 'Adzuna::API::Response::Location'}","Meyerthole Siems Kohlruss (MSK) ist eine aktuarielle Beratungsgesellschaft mit Sitz in Köln und seit 1998 im deutschsprachigen Raum für Schaden- und Unfallversicherer tätig. Unsere Schwerpunkte liegen auf abwechslungsreichen Aufgaben aus den Bereichen Data Science, Telematik, Pricing, Naturgefahren, Bilanzbewertung, Rückversicherung und Solvency II. Zu unseren Mandaten zählen mehr als 100 Versicherer und Rückversicherer sowie InsurTechs. Kreativität und Teamarbeit haben einen hohen Stellenwert …",0,eyJhbGciOiJIUzI1NiJ9.eyJzIjoiSlAxenpINUw4QkdoZnJwcDhKWTdyZyIsImkiOiI1MjQzMTM2NTg0In0.1UgnkijTU1CsZuNJqZyivuSew5uFQltNKRt1SHRX3PY,"{'label': 'Beraterstellen', 'tag': 'consultancy-jobs', '__CLASS__': 'Adzuna::API::Response::Category'}",2025-06-10T20:30:35Z,5243136584,"{'display_name': 'Meyerthole Siems Kohlruss Ges. für aktuarielle Beratung mbH', '__CLASS__': 'Adzuna::API::Response::Company'}",6.969972,Adzuna::API::Response::Job,Datenexperte aktuarielles Data Management (d/m/w),50.940164,https://www.adzuna.de/land/ad/5243136584?se=JP1zzH5L8BGhfrpp8JY7rg&utm_medium=api&utm_source=a4bcf954&v=EF0FF23C0EB64BED35836BCA6D428B1BF3B119BF,,,,
"{'area': ['Deutschland', 'Hessen', 'Frankfurt am Main'], '__CLASS__': 'Adzuna::API::Response::Location', 'display_name': 'Frankfurt am Main, Hessen'}","IQVIA TM – The Human Data Science Company TM – ist ein führender, globaler Anbieter von zukunftsweisender Analytik, Technologielösungen und klinischer Auftragsforschung. IQVIA unterstützt Life-Science-Unternehmen, Verbände, Institutionen, Kostenträger und weitere Akteure im Gesundheitswesen darin, bessere Ergebnisse in der Gesundheitsversorgung zu erzielen. Werde Teil unserer Community  von rund 90.000 Mitarbeiterinnen und Mitarbeitern in über 100 Ländern, die sich dafür einsetzen, das Potenzia…",0,eyJhbGciOiJIUzI1NiJ9.eyJpIjoiNTI1MzUyNTIyOSIsInMiOiJKUDF6ekg1TDhCR2hmcnBwOEpZN3JnIn0.NJIRvuD5ij61itSw0Xzlj7tFWyNuABcLmLgs-yc-BvY,"{'label': 'Verwaltungsstellen', 'tag': 'admin-jobs', '__CLASS__': 'Adzuna::API::Response::Category'}",2025-06-16T20:28:37Z,5253525229,"{'__CLASS__': 'Adzuna::API::Response::Company', 'display_name': 'IQVIA Commercial GmbH & Co. OHG'}",8.650578,Adzuna::API::Response::Job,Office Management im Sales-Sekretariat (m/w/d),50.129683,https://www.adzuna.de/land/ad/5253525229?se=JP1zzH5L8BGhfrpp8JY7rg&utm_medium=api&utm_source=a4bcf954&v=3243596214D28F5660AF2F6DA8F0A63CB1159529,,,,
"{'__CLASS__': 'Adzuna::API::Response::Location', 'display_name': 'Heilbronn, Heilbronn (Kreis)', 'area': ['Deutschland', 'Baden-Württemberg', 'Heilbronn (Kreis)', 'Heilbronn']}","Künstliche Intelligenz ist die Zukunfts- und Schlüsseltechnologie und befähigt uns, die Herausforderungen der nächsten Jahrzehnte zu lösen. Nur wenn die deutsche Wirtschaft eine führende Position in der Wertschöpfung im Bereich KI schafft, kann sie ihre Wettbewerbsfähigkeit halten und nachhaltige und ethische Werte aktiv gestalten. Durch die Zusammenarbeit im Ökosystem gelingt diese Transformation – durch die Bündelung von Ressourcen. IPAI will diese Plattform darstellen. Wir bringen die Wertsc…",0,eyJhbGciOiJIUzI1NiJ9.eyJpIjoiNTIzNDgyNjgyMyIsInMiOiJKUDF6ekg1TDhCR2hmcnBwOEpZN3JnIn0.sjdDuZNvCVuHcLnYnxeXOoRecrCudjBe9ux6SmZ1z9E,"{'label': 'Beraterstellen', '__CLASS__': 'Adzuna::API::Response::Category', 'tag': 'consultancy-jobs'}",2025-06-05T20:09:54Z,5234826823,"{'__CLASS__': 'Adzuna::API::Response::Company', 'display_name': 'Schwarz Corporate Solutions'}",9.209895,Adzuna::API::Response::Job,(Senior) Partner Manager IPAI (m/w/d),49.142335,https://www.adzuna.de/land/ad/5234826823?se=JP1zzH5L8BGhfrpp8JY7rg&utm_medium=api&utm_source=a4bcf954&v=5CBECF34835745A11DF7C93C155D5F564C99CB19,,,,
"{'__CLASS__': 'Adzuna::API::Response::Location', 'display_name': 'Wernigerode, Harz (Kreis)', 'area': ['Deutschland', 'Sachsen-Anhalt', 'Harz (Kreis)', 'Wernigerode']}","Aufgaben Profil Wir bieten Willkommen in der Harzsparkasse! Die Harzsparkasse zeichnet sich durch eine tiefe Verbundenheit zur Region aus und legt großen Wert darauf, lokale Gemeinschaften zu stärken und zu unterstützen. Sie haben ein gutes Gespür für Zahlen, erkennen Trends in Daten und möchten Ihre Stärken dort einbringen, wo sie wirklich etwas bewegen? Dann sind Sie bei uns genau richtig! Zur Verstärkung unseres Teams suchen wir eine engagierte Persönlichkeit, die das Vertriebscontrolling mi…",0,eyJhbGciOiJIUzI1NiJ9.eyJzIjoiSlAxenpINUw4QkdoZnJwcDhKWTdyZyIsImkiOiI1MjIzNjcyNTczIn0.4kozGxEYC6Mi0gGBQhpS__MoskpvuE1PaBgS4jxrT2s,"{'tag': 'unknown', '__CLASS__': 'Adzuna::API::Response::Category', 'label': 'Unknown'}",2025-05-30T19:47:57Z,5223672573,"{'display_name': 'Harzsparkasse', '__CLASS__': 'Adzuna::API::Response::Company'}",10.79078,Adzuna::API::Response::Job,Vertriebsdatenmanager (m/w/d),51.83828,https://www.adzuna.de/land/ad/5223672573?se=JP1zzH5L8BGhfrpp8JY7rg&utm_medium=api&utm_source=a4bcf954&v=53F958EB7C1309A0799A1DEB56D04B8F4E484D60,,,,
