latitude,title,description,__CLASS__,location,category,longitude,redirect_url,created,company,adref,salary_is_predicted,id,contract_time,contract_type,salary_max,salary_min
53.550256,Duales Studium zum Bachelor of Science in Wirtschaftsinformatik KI & Data Science inkl. Ausbildung zum Fachinformatiker Anwendungsentwicklung (m/w/d),"Sorge gemeinsam mit uns für die digitale Zukunftsfähigkeit der Bundeswehr. Als primärer Digitalisierungspartner der Bundeswehr erbringen wir stabile, sichere und effiziente IT-Services im In- und Ausland, vom Grundbetrieb bis in den einsatznahen Bereich und tragen so zur kontinuierlichen Erhöhung der Führungs- und Einsatzfähigkeit der Bundeswehr bei. Mit über 7.700 Kolleg*innen betreiben und modernisieren wir eine der größten und komplexesten IT-Infrastrukturen in Deutschland. Wir suchen verant…",Adzuna::API::Response::Job,"{'__CLASS__': 'Adzuna::API::Response::Location', 'area': ['Deutschland', 'Niedersachsen', 'Wilhelmshaven'], 'display_name': 'Wilhelmshaven, Niedersachsen'}","{'label': 'IT-Stellen', 'tag': 'it-jobs', '__CLASS__': 'Adzuna::API::Response::Category'}",8.087806,https://www.adzuna.de/land/ad/5401453241?se=NvMhegSo8BG2galmFizh3g&utm_medium=api&utm_source=a4bcf954&v=D56DE622B34175A89F05AB891FF790F16C90B9FF,2025-09-16T15:52:04Z,"{'__CLASS__': 'Adzuna::API::Response::Company', 'display_name': 'BWI GmbH'}",eyJhbGciOiJIUzI1NiJ9.eyJpIjoiNTQwMTQ1MzI0MSIsInMiOiJOdk1oZWdTbzhCRzJnYWxtRml6aDNnIn0.y08n5MVPu2sOWFWnwGgl_t1yBVK2I8hFGA7V574nDrY,0,5401453241,full_time,,,
51.339254,Duales Studium zum Bachelor of Science in Wirtschaftsinformatik KI & Data Science inkl. Ausbildung zum Fachinformatiker Systemintegration (m/w/d),"Sorge gemeinsam mit uns für die digitale Zukunftsfähigkeit der Bundeswehr. Als primärer Digitalisierungspartner der Bundeswehr erbringen wir stabile, sichere und effiziente IT-Services im In- und Ausland, vom Grundbetrieb bis in den einsatznahen Bereich und tragen so zur kontinuierlichen Erhöhung der Führungs- und Einsatzfähigkeit der Bundeswehr bei. Mit über 7.700 Kolleg*innen betreiben und modernisieren wir eine der größten und komplexesten IT-Infrastrukturen in Deutschland. Wir suchen verant…",Adzuna::API::Response::Job,"{'area': ['Deutschland', 'Sachsen', 'Leipzig (Kreis)', 'Leipzig'], '__CLASS__': 'Adzuna::API::Response::Location', 'display_name': 'Leipzig, Leipzig (Kreis)'}","{'label': 'IT-Stellen', 'tag': 'it-jobs', '__CLASS__': 'Adzuna::API::Response::Category'}",12.373598,https://www.adzuna.de/land/ad/5401453294?se=NvMhegSo8BG2galmFizh3g&utm_medium=api&utm_source=a4bcf954&v=4C3F27ADD01D926D23C721053F0F1EB03F8AB590,2025-09-16T15:52:05Z,"{'__CLASS__': 'Adzuna::API::Response::Company', 'display_name': 'BWI GmbH'}",eyJhbGciOiJIUzI1NiJ9.eyJpIjoiNTQwMTQ1MzI5NCIsInMiOiJOdk1oZWdTbzhCRzJnYWxtRml6aDNnIn0.dyni4sCd7VcUQ8bukR8PThCvgRMW54VBCvsQINPXWCc,0,5401453294,full_time,,,
50.129683,Duales Studium zum Bachelor of Science in Wirtschaftsinformatik KI & Data Science inkl. Ausbildung zum Fachinformatiker Systemintegration (m/w/d),"Sorge gemeinsam mit uns für die digitale Zukunftsfähigkeit der Bundeswehr. Als primärer Digitalisierungspartner der Bundeswehr erbringen wir stabile, sichere und effiziente IT-Services im In- und Ausland, vom Grundbetrieb bis in den einsatznahen Bereich und tragen so zur kontinuierlichen Erhöhung der Führungs- und Einsatzfähigkeit der Bundeswehr bei. Mit über 7.700 Kolleg*innen betreiben und modernisieren wir eine der größten und komplexesten IT-Infrastrukturen in Deutschland. Wir suchen verant…",Adzuna::API::Response::Job,"{'__CLASS__': 'Adzuna::API::Response::Location', 'area': ['Deutschland', 'Hessen', 'Frankfurt am Main'], 'display_name': 'Frankfurt am Main, Hessen'}","{'tag': 'it-jobs', 'label': 'IT-Stellen', '__CLASS__': 'Adzuna::API::Response::Category'}",8.650578,https://www.adzuna.de/land/ad/5401453218?se=NvMhegSo8BG2galmFizh3g&utm_medium=api&utm_source=a4bcf954&v=BFBE1CA6CB48B2B26BF37716ADD4CCAEDE3BBE1A,2025-09-16T15:52:04Z,"{'__CLASS__': 'Adzuna::API::Response::Company', 'display_name': 'BWI GmbH'}",eyJhbGciOiJIUzI1NiJ9.eyJzIjoiTnZNaGVnU284QkcyZ2FsbUZpemgzZyIsImkiOiI1NDAxNDUzMjE4In0.6hP3v0cUQu82UdjXkY2vLJ50L7rSQ2LElXT9WOV7RVQ,0,5401453218,full_time,,,
48.18449,Werkstudent Data Science / Data Engineering (all genders),"UPLIFT Y OURFUTURE Wir sind über 13.000. An 19 Standorten weltweit. Jedes dritte Flugzeug fliegt mit unserer Technologie. Immer effizienter, leiser, nachhaltiger. Wir gestalten die Zukunft der Luftfahrt. Was wir noch brauchen? Dich. Unser Team in München sucht Dich: Werkstudent Data Science / Data Engineering (all genders) Bei der Instandhaltung von Flugzeugtriebwerken entstehen eine Vielzahl verschiedenster Daten. Erst wenn diese Informationen aufbereitet, geprüft und zusammengeführt sind, kön…",Adzuna::API::Response::Job,"{'area': ['Deutschland', 'Bayern', 'München (Kreis)', 'München', 'Allach-Untermenzing'], '__CLASS__': 'Adzuna::API::Response::Location', 'display_name': 'Allach-Untermenzing, München'}","{'label': 'Stellen aus Fertigung', 'tag': 'manufacturing-jobs', '__CLASS__': 'Adzuna::API::Response::Category'}",11.44811,https://www.adzuna.de/details/5148236983?utm_medium=api&utm_source=a4bcf954,2025-04-16T21:50:01Z,"{'__CLASS__': 'Adzuna::API::Response::Company', 'display_name': 'MTU Aero Engines AG'}",eyJhbGciOiJIUzI1NiJ9.eyJpIjoiNTE0ODIzNjk4MyIsInMiOiJOdk1oZWdTbzhCRzJnYWxtRml6aDNnIn0.FqBeIuUWFuDa_mLFLA0ZVN2JRYmwVTgkDBMx3nB30zQ,0,5148236983,part_time,,,
51.444823,Abteilungsleitung (m/w/d) Application & Data Intelligence,"Seit mehr als 50 Jahren bietet GNS zuverlässige und effiziente Lösungen zur Entsorgung nuklearer Abfälle und Reststoffe während Betrieb, Stilllegung und Rückbau von Kernkraftwerken und kerntechnischen Einrichtungen an. Die GNS-Gruppe ist Spezialist für die Entsorgung hochradioaktiver Abfälle und abgebrannter Brennelemente aus Kernreaktoren ebenso wie für die sichere Verarbeitung, Verpackung und Lagerung der durch den Betrieb von Kernkraftwerken anfallenden schwach- und mittelradioaktiven Abfäll…",Adzuna::API::Response::Job,"{'display_name': 'Essen, Nordrhein-Westfalen', 'area': ['Deutschland', 'Nordrhein-Westfalen', 'Essen'], '__CLASS__': 'Adzuna::API::Response::Location'}","{'label': 'Beraterstellen', 'tag': 'consultancy-jobs', '__CLASS__': 'Adzuna::API::Response::Category'}",7.014478,https://www.adzuna.de/land/ad/5443356214?se=NvMhegSo8BG2galmFizh3g&utm_medium=api&utm_source=a4bcf954&v=ADC1166B901351EDC6C75FC54071B6317C1D3E76,2025-10-11T22:06:55Z,"{'display_name': 'GNS Gesellschaft für Nuklear-Service mbH', '__CLASS__': 'Adzuna::API::Response::Company'}",eyJhbGciOiJIUzI1NiJ9.eyJzIjoiTnZNaGVnU284QkcyZ2FsbUZpemgzZyIsImkiOiI1NDQzMzU2MjE0In0.fnpqn-D_Wg8IfUP7mv65j9ejRFoR1PWAQD9ULLn_juA,0,5443356214,,,,
51.13209,Praktikum/Abschlussarbeit im Bereich Data Science,"Unterstützen Sie uns im Rahmen eines Praktikums/einer Abschlussarbeit im Bereich Data Science. Studium/Fachrichtung | Mathematik, Statistik, Data Science, Informatik, Physik oder vglb. Studiengänge Einsatzbereich | Praktikum/Abschlussarbeit im Bereich Data Science Dauer | 3-6 Monate Bestens gefordert | Wir suchen motivierte Studierende, die sich unserem Data Science Team für ein Pflichtpraktikum und/oder eine Bachelor-/Masterarbeit (3-6 Monate) anschließen möchten. Bei uns können Sie praktische…",Adzuna::API::Response::Job,"{'display_name': 'Frankenthal, Bautzen (Kreis)', '__CLASS__': 'Adzuna::API::Response::Location', 'area': ['Deutschland', 'Sachsen', 'Bautzen (Kreis)', 'Frankenthal']}","{'__CLASS__': 'Adzuna::API::Response::Category', 'tag': 'unknown', 'label': 'Unknown'}",14.10731,https://www.adzuna.de/details/5299866746?utm_medium=api&utm_source=a4bcf954,2025-07-12T22:07:55Z,"{'__CLASS__': 'Adzuna::API::Response::Company', 'display_name': 'KSB'}",eyJhbGciOiJIUzI1NiJ9.eyJpIjoiNTI5OTg2Njc0NiIsInMiOiJOdk1oZWdTbzhCRzJnYWxtRml6aDNnIn0.FltkUjVaTsSh24hUC-wc-d1k3LYReRC-OlamXsoFpEE,0,5299866746,,,,
53.52837,Bachelor-/Masterarbeit: Data Science/Informatik,"„Evaluierung und Proof of Concept von Google BigQuery als Data-Lake-Lösung für Business Intelligence in der Logistik“ Google BigQuery ist eine leistungsstarke, cloudbasierte Data-Warehouse- und Data-Lake-Lösung. Sie ermöglicht es, große Datenmengen zentral zu speichern, mit SQL-Abfragen zu analysieren und für Business Intelligence nutzbar zu machen. Für NORDFROST eröffnet sich dadurch die Chance, Daten aus unserem Transportmanagementsystem (WinSped) und weiteren Anwendungen für Controlling, Pro…",Adzuna::API::Response::Job,"{'__CLASS__': 'Adzuna::API::Response::Location', 'area': ['Deutschland', 'Niedersachsen', 'Friesland (Kreis)', 'Schortens'], 'display_name': 'Schortens, Friesland (Kreis)'}","{'tag': 'unknown', 'label': 'Unknown', '__CLASS__': 'Adzuna::API::Response::Category'}",7.9473,https://www.adzuna.de/details/5372314900?utm_medium=api&utm_source=a4bcf954,2025-08-28T22:57:24Z,"{'display_name': 'NORDFROST & Co. KG', '__CLASS__': 'Adzuna::API::Response::Company'}",eyJhbGciOiJIUzI1NiJ9.eyJpIjoiNTM3MjMxNDkwMCIsInMiOiJOdk1oZWdTbzhCRzJnYWxtRml6aDNnIn0.bU6fZ-LrUYJleJ8CVIv_l1AsZ-Ujnoyju7Gp1jieOMs,0,5372314900,part_time,,,
51.226802,Product Analytics Manager (m/w/d),"Stepstone is a leading online job board in Germany, dedicated to connecting job seekers with their ideal employment opportunities. As a major player in the German job market, we play a key role in facilitating millions of job placements across various sectors and industries. We are proud to be part of The Stepstone Group, a global expert in job-tech platforms. Being part of a global team allows us to leverage cutting-edge technology, data, and industry expertise to enhance our services and cont…",Adzuna::API::Response::Job,"{'display_name': 'Düsseldorf, Nordrhein-Westfalen', 'area': ['Deutschland', 'Nordrhein-Westfalen', 'Düsseldorf'], '__CLASS__': 'Adzuna::API::Response::Location'}","{'label': 'Stellen aus PR, Werbung & Marketing', 'tag': 'pr-advertising-marketing-jobs', '__CLASS__': 'Adzuna::API::Response::Category'}",6.808387,https://www.adzuna.de/land/ad/5427381442?se=NvMhegSo8BG2galmFizh3g&utm_medium=api&utm_source=a4bcf954&v=9991F072B3415D0AFE0D58302591646C8F0861CF,2025-10-02T20:38:59Z,"{'display_name': 'Stepstone GmbH', '__CLASS__': 'Adzuna::API::Response::Company'}",eyJhbGciOiJIUzI1NiJ9.eyJpIjoiNTQyNzM4MTQ0MiIsInMiOiJOdk1oZWdTbzhCRzJnYWxtRml6aDNnIn0.4ZkWW6VAwUvao9UDsVQphZfu7T6MEJ8TPEB_J7gvjTc,0,5427381442,,,,
53.557429,IT-Projektleiter (m/w/d) – Schwerpunkt Künstliche Intelligenz in der Immobilienwirtschaft,"Die Intreal Solutions GmbH ist ein innovatives IT-Dienstleistungsunternehmen mit Sitz in Hamburg. Wir unterstützen unsere Kunden in der Immobilienwirtschaft bei der Digitalisierung ihrer Prozesse und setzen dabei modernste Technologien ein. Ein besonderer Fokus liegt auf der Entwicklung und Implementierung von Lösungen im Bereich Künstliche Intelligenz (KI), um datengetriebene Entscheidungen und effiziente Abläufe in der Immobilienbranche zu ermöglichen. Aufgaben Leitung und Koordination von KI…",Adzuna::API::Response::Job,"{'__CLASS__': 'Adzuna::API::Response::Location', 'area': ['Deutschland', 'Hamburg'], 'display_name': 'Hamburg, Deutschland'}","{'__CLASS__': 'Adzuna::API::Response::Category', 'label': 'IT-Stellen', 'tag': 'it-jobs'}",9.987297,https://www.adzuna.de/land/ad/5441652698?se=NvMhegSo8BG2galmFizh3g&utm_medium=api&utm_source=a4bcf954&v=6D8297E5F60849BAA4B3671A66BA0191C0A67983,2025-10-10T21:56:28Z,"{'__CLASS__': 'Adzuna::API::Response::Company', 'display_name': 'IntReal Solutions GmbH'}",eyJhbGciOiJIUzI1NiJ9.eyJzIjoiTnZNaGVnU284QkcyZ2FsbUZpemgzZyIsImkiOiI1NDQxNjUyNjk4In0.AIEP-kDLvfHMVp27kW5Pdj_xCAms4yQe23NGBVt56g0,0,5441652698,,,,
49.05856,Systemadministrator / Systemadministratorin (m/w/d) mit dem Schwerpunkt Compute Cluster Aufbau und Administration in Forschung und Lehre in Vollzeit / Teilzeit,"Informatik und Data Science Systemadministrator / Systemadministratorin (m/w/d) mit dem Schwerpunkt Compute Cluster Aufbau und Administration in Forschung und Lehre Die Fakultät für Informatik und Data Science der Universität Regensburg bündelt Forschung und Lehre in den Bereichen Informatik, Data Science und Künstliche Intelligenz an der Universität Regensburg. Eckpunkte Beginn: 01.01.2026 Umfang: Vollzeit, Teilzeit 40 Stunden / Woche Vergütung: TV-L bis E13 Befristung: unbefristet Wir bieten:…",Adzuna::API::Response::Job,"{'area': ['Deutschland', 'Bayern', 'Regensburg (Kreis)', 'Wenzenbach'], '__CLASS__': 'Adzuna::API::Response::Location', 'display_name': 'Wenzenbach, Regensburg (Kreis)'}","{'label': 'IT-Stellen', 'tag': 'it-jobs', '__CLASS__': 'Adzuna::API::Response::Category'}",12.20687,https://www.adzuna.de/land/ad/5432553208?se=NvMhegSo8BG2galmFizh3g&utm_medium=api&utm_source=a4bcf954&v=4213C21067EE04F25E222B9A28EC83489FFB5C17,2025-10-05T11:22:02Z,"{'__CLASS__': 'Adzuna::API::Response::Company', 'display_name': 'Universität Regensburg'}",eyJhbGciOiJIUzI1NiJ9.eyJzIjoiTnZNaGVnU284QkcyZ2FsbUZpemgzZyIsImkiOiI1NDMyNTUzMjA4In0._KSTJozdWBy46j_wZsoFrfnma5O35ayNFqsukzCQ1CI,0,5432553208,,,,
49.18975,Wechselmanager mit Fokus Zeitreihen Qualität (m/w/d),"Du hast Lust auf innovative und nachhaltige Bau- & Immobilienprojekte? Dann bist du bei uns genau richtig. Von Büros, Konferenzräumen sowie Restaurants bis hin zu Wohnungen - Im TeamSCOS planen, bauen und betreuen wir ein großes Portfolio verschiedenster Immobilien – denn Vielfalt ist unsere Stärke! Bei uns kannst du spannende Projekte von Beginn bis zur Umsetzung begleiten und eigene Ideen einbringen. Vom Grundstückskauf über die Planung und dem Bau bis hin zum Facility Management - bei uns ha…",Adzuna::API::Response::Job,"{'__CLASS__': 'Adzuna::API::Response::Location', 'area': ['Deutschland', 'Baden-Württemberg', 'Heilbronn (Kreis)', 'Neckarsulm'], 'display_name': 'Neckarsulm, Heilbronn (Kreis)'}","{'tag': 'consultancy-jobs', 'label': 'Beraterstellen', '__CLASS__': 'Adzuna::API::Response::Category'}",9.2274,https://www.adzuna.de/land/ad/5427364267?se=NvMhegSo8BG2galmFizh3g&utm_medium=api&utm_source=a4bcf954&v=176D1C6656BA13F5504F6B07913B132D9CF48CB3,2025-10-02T20:38:26Z,"{'__CLASS__': 'Adzuna::API::Response::Company', 'display_name': 'Schwarz Corporate Solutions'}",eyJhbGciOiJIUzI1NiJ9.eyJzIjoiTnZNaGVnU284QkcyZ2FsbUZpemgzZyIsImkiOiI1NDI3MzY0MjY3In0.zGivXqgTVKBs_p-PGf7qqV2Yym1N65T0TdLHpsfW8jQ,0,5427364267,,,,
49.18975,Wechselmanager mit Fokus Stammdatenqualität (m/w/d),"Du hast Lust auf innovative und nachhaltige Bau- & Immobilienprojekte? Dann bist du bei uns genau richtig. Von Büros, Konferenzräumen sowie Restaurants bis hin zu Wohnungen - Im TeamSCOS planen, bauen und betreuen wir ein großes Portfolio verschiedenster Immobilien – denn Vielfalt ist unsere Stärke! Bei uns kannst du spannende Projekte von Beginn bis zur Umsetzung begleiten und eigene Ideen einbringen. Vom Grundstückskauf über die Planung und dem Bau bis hin zum Facility Management - bei uns ha…",Adzuna::API::Response::Job,"{'display_name': 'Neckarsulm, Heilbronn (Kreis)', '__CLASS__': 'Adzuna::API::Response::Location', 'area': ['Deutschland', 'Baden-Württemberg', 'Heilbronn (Kreis)', 'Neckarsulm']}","{'__CLASS__': 'Adzuna::API::Response::Category', 'label': 'Beraterstellen', 'tag': 'consultancy-jobs'}",9.2274,https://www.adzuna.de/land/ad/5427363454?se=NvMhegSo8BG2galmFizh3g&utm_medium=api&utm_source=a4bcf954&v=3261587C24F81CB71A4067A2E3F600EEA28CC786,2025-10-02T20:38:25Z,"{'display_name': 'Schwarz Corporate Solutions', '__CLASS__': 'Adzuna::API::Response::Company'}",eyJhbGciOiJIUzI1NiJ9.eyJzIjoiTnZNaGVnU284QkcyZ2FsbUZpemgzZyIsImkiOiI1NDI3MzYzNDU0In0.EpJWUiQ4BRElOsACXrET-b6YXYieBxMGHdpO7iiDmeY,0,5427363454,,,,
48.776198,Teamleiter (m/w/d) Data Science,"Firmenprofil ???? Standort: Region Stuttgart ???? Branche: Technologie / Infrastruktur / F&E ???? Anstellung: Vollzeit, unbefristet ???? Teamgröße: 8 Data Scientists ???? Für ein innovatives Unternehmen mit Fokus auf Forschung und Entwicklung im Bereich Infrastruktur Unser Mandant ist ein forschungsgetriebenes Technologieunternehmen aus dem Raum Stuttgart, das sich auf die Entwicklung intelligenter, datenbasierter Lösungen für komplexe Infrastrukturprojekte spezialisiert hat. Mit hoher Investit…",Adzuna::API::Response::Job,"{'__CLASS__': 'Adzuna::API::Response::Location', 'area': ['Deutschland', 'Baden-Württemberg', 'Stuttgart'], 'display_name': 'Stuttgart, Baden-Württemberg'}","{'__CLASS__': 'Adzuna::API::Response::Category', 'label': 'Unknown', 'tag': 'unknown'}",9.187224,https://www.adzuna.de/details/5356753049?utm_medium=api&utm_source=a4bcf954,2025-08-17T23:13:34Z,"{'__CLASS__': 'Adzuna::API::Response::Company', 'display_name': 'Skalbach'}",eyJhbGciOiJIUzI1NiJ9.eyJzIjoiTnZNaGVnU284QkcyZ2FsbUZpemgzZyIsImkiOiI1MzU2NzUzMDQ5In0.q-q7F6pm-Otu_qg1wXnhQxEnOtJ5sx8EFluyoPqAZdU,0,5356753049,full_time,,,
52.36489,Data Science Specialist (m/w/d),"Wir bieten dir Flexibles Arbeiten: Mobiles Arbeiten mit vier gemeinsamen Präsenztagen im Monat. Und wenn du magst, bist du natürlich jederzeit öfter im Büro willkommen. So schaffen wir die perfekte Balance aus Freiheit und persönlichem Austausch. Individuelle Arbeitszeitmodelle , die sich an dein Leben anpassen. Gestaltungsfreiraum für deine Ideen und Projekte, mit der Möglichkeit, wirklich etwas zu bewegen. Gezielte Weiterbildungsmöglichkeiten , die wir aktiv fördern. Ein starkes Miteinander i…",Adzuna::API::Response::Job,"{'display_name': 'Bult, Hannover', 'area': ['Deutschland', 'Niedersachsen', 'Region Hannover (Kreis)', 'Hannover', 'Bult'], '__CLASS__': 'Adzuna::API::Response::Location'}","{'label': 'Unknown', 'tag': 'unknown', '__CLASS__': 'Adzuna::API::Response::Category'}",9.77223,https://www.adzuna.de/details/5067020798?utm_medium=api&utm_source=a4bcf954,2025-02-28T14:07:24Z,"{'__CLASS__': 'Adzuna::API::Response::Company', 'display_name': 'IT-P GmbH'}",eyJhbGciOiJIUzI1NiJ9.eyJzIjoiTnZNaGVnU284QkcyZ2FsbUZpemgzZyIsImkiOiI1MDY3MDIwNzk4In0.uzv5EzjE7HMZWIShYwQojoHT7RZJ5-q7Xn1j-yR06Z4,0,5067020798,part_time,,,
,Data Science Specialist (m/w/d),"Wir bieten dir Flexibles Arbeiten: Mobiles Arbeiten mit vier gemeinsamen Präsenztagen im Monat. Und wenn du magst, bist du natürlich jederzeit öfter im Büro willkommen. So schaffen wir die perfekte Balance aus Freiheit und persönlichem Austausch. Individuelle Arbeitszeitmodelle , die sich an dein Leben anpassen. Gestaltungsfreiraum für deine Ideen und Projekte, mit der Möglichkeit, wirklich etwas zu bewegen. Gezielte Weiterbildungsmöglichkeiten , die wir aktiv fördern. Ein starkes Miteinander i…",Adzuna::API::Response::Job,"{'display_name': 'Deutschland', 'area': ['Deutschland'], '__CLASS__': 'Adzuna::API::Response::Location'}","{'__CLASS__': 'Adzuna::API::Response::Category', 'tag': 'unknown', 'label': 'Unknown'}",,https://www.adzuna.de/details/4801220768?utm_medium=api&utm_source=a4bcf954,2024-07-30T22:45:58Z,"{'display_name': 'IT-P', '__CLASS__': 'Adzuna::API::Response::Company'}",eyJhbGciOiJIUzI1NiJ9.eyJzIjoiTnZNaGVnU284QkcyZ2FsbUZpemgzZyIsImkiOiI0ODAxMjIwNzY4In0.gAiBCTjSNhl4v2S7bKYCbpNy3lZMx5Y1mKD_51KVwH4,0,4801220768,full_time,,,
53.54167,Praktikum: Data Science (w/m/d),"Deine Aufgaben Praktikum bei HIGHBERG in Hamburg: Bei uns heißt es im Praktikum nicht Kaffeekochen, sondern echte Kundenprojekte von Beginn an, gepaart mit Verantwortung und steiler Lernkurve. Neben einem intensiven Einblick in die Medienbranche erwartet Dich aktive Mitarbeit. Unser Umgang im Team lässt Raum für Deine persönliche Entwicklung. Gerne übernehmen wir Dich nach guter Arbeit auch nach dem Praktikum als Data Scientist und bieten Dir weitere spannende Aufgaben und Aufstiegschancen. Zu …",Adzuna::API::Response::Job,"{'display_name': 'HafenCity, Hamburg', '__CLASS__': 'Adzuna::API::Response::Location', 'area': ['Deutschland', 'Hamburg', 'HafenCity']}","{'__CLASS__': 'Adzuna::API::Response::Category', 'tag': 'unknown', 'label': 'Unknown'}",9.99333,https://www.adzuna.de/details/4352591932?utm_medium=api&utm_source=a4bcf954,2023-10-05T13:37:27Z,"{'__CLASS__': 'Adzuna::API::Response::Company', 'display_name': 'Highberg DACH'}",eyJhbGciOiJIUzI1NiJ9.eyJpIjoiNDM1MjU5MTkzMiIsInMiOiJOdk1oZWdTbzhCRzJnYWxtRml6aDNnIn0.p-e-LYehVdcchcgsG4TmEX6EO2MBG7WyJQ4kByObl1A,0,4352591932,full_time,,,
53.557429,Praktikum: Data Science (w/m/d),"Deine Aufgaben Praktikum bei HIGHBERG in Hamburg: Bei uns heißt es im Praktikum nicht Kaffeekochen, sondern echte Kundenprojekte von Beginn an, gepaart mit Verantwortung und steiler Lernkurve. Neben einem intensiven Einblick in die Medienbranche erwartet Dich aktive Mitarbeit. Unser Umgang im Team lässt Raum für Deine persönliche Entwicklung. Gerne übernehmen wir Dich nach guter Arbeit auch nach dem Praktikum als Data Scientist und bieten Dir weitere spannende Aufgaben und Aufstiegschancen. Zu …",Adzuna::API::Response::Job,"{'__CLASS__': 'Adzuna::API::Response::Location', 'area': ['Deutschland', 'Hamburg'], 'display_name': 'Hamburg, Deutschland'}","{'__CLASS__': 'Adzuna::API::Response::Category', 'tag': 'consultancy-jobs', 'label': 'Beraterstellen'}",9.987297,https://www.adzuna.de/details/4931290630?utm_medium=api&utm_source=a4bcf954,2024-11-08T12:47:42Z,"{'__CLASS__': 'Adzuna::API::Response::Company', 'display_name': 'Highberg'}",eyJhbGciOiJIUzI1NiJ9.eyJzIjoiTnZNaGVnU284QkcyZ2FsbUZpemgzZyIsImkiOiI0OTMxMjkwNjMwIn0.Q9cD4U2SAxyEblvIEYY1Nb5XGDgKGo2rGvEs1sI06BM,0,4931290630,full_time,,,
50.91404,Data Science und KI (m/w/d),Data Science und KI (m/w/d) B.Sc. - 09599 Freiberg - Arbeitszeit: Vollzeit - Position: Duales Studium - Bildungsgrad Mindestvoraussetzung: Abitur - Beschäftigungsbeginn: 01.10.2025,Adzuna::API::Response::Job,"{'display_name': 'Freiberg, Mittelsachsen (Kreis)', 'area': ['Deutschland', 'Sachsen', 'Mittelsachsen (Kreis)', 'Freiberg'], '__CLASS__': 'Adzuna::API::Response::Location'}","{'__CLASS__': 'Adzuna::API::Response::Category', 'tag': 'other-general-jobs', 'label': 'Sonstige/Allgemeine Stellen'}",13.33722,https://www.adzuna.de/details/5430520134?utm_medium=api&utm_source=a4bcf954,2025-10-04T01:36:15Z,"{'display_name': 'Siltronic AG, Werk Freiberg', '__CLASS__': 'Adzuna::API::Response::Company'}",eyJhbGciOiJIUzI1NiJ9.eyJpIjoiNTQzMDUyMDEzNCIsInMiOiJOdk1oZWdTbzhCRzJnYWxtRml6aDNnIn0.eJXSLqXM_yI87PhjXGfOrv0tn4ZsMBJNukxCo9coy8s,0,5430520134,,,,
50.129683,Senior Data Science (m/w/d),"Willkommen bei der KfW! Als eine der führenden Förderbanken der Welt stehen wir für die nachhaltige Transformation von Umwelt, Gesellschaft und Unternehmen. Als Impulsgeber wirken wir aktiv an den Themen mit, die die Welt von morgen prägen. Wir fördern Windparks, Infrastruktur-Projekte, Schulen und Krankenhäuser und gestalten damit die Zukunft. Bei uns finden Sie ein vertrauensvolles Arbeitsumfeld, in dem Teamspirit, Vielfalt und Inklusion gelebt werden. Wir fördern Sie, Ihre Ideen und Ihr Enga…",Adzuna::API::Response::Job,"{'display_name': 'Frankfurt am Main, Hessen', '__CLASS__': 'Adzuna::API::Response::Location', 'area': ['Deutschland', 'Hessen', 'Frankfurt am Main']}","{'__CLASS__': 'Adzuna::API::Response::Category', 'label': 'Unknown', 'tag': 'unknown'}",8.650578,https://www.adzuna.de/details/5408460508?utm_medium=api&utm_source=a4bcf954,2025-09-20T15:15:07Z,"{'display_name': 'KfW Bankengruppe', '__CLASS__': 'Adzuna::API::Response::Company'}",eyJhbGciOiJIUzI1NiJ9.eyJpIjoiNTQwODQ2MDUwOCIsInMiOiJOdk1oZWdTbzhCRzJnYWxtRml6aDNnIn0.pS785n4t3kRnx5BnVF3k8K-racgBOkuSBc913HeAG_g,0,5408460508,,,,
52.507706,Senior Data Science (m/w/d),"Willkommen bei der KfW! Als eine der führenden Förderbanken der Welt stehen wir für die nachhaltige Transformation von Umwelt, Gesellschaft und Unternehmen. Als Impulsgeber wirken wir aktiv an den Themen mit, die die Welt von morgen prägen. Wir fördern Windparks, Infrastruktur-Projekte, Schulen und Krankenhäuser und gestalten damit die Zukunft. Bei uns finden Sie ein vertrauensvolles Arbeitsumfeld, in dem Teamspirit, Vielfalt und Inklusion gelebt werden. Wir fördern Sie, Ihre Ideen und Ihr Enga…",Adzuna::API::Response::Job,"{'area': ['Deutschland', 'Berlin'], '__CLASS__': 'Adzuna::API::Response::Location', 'display_name': 'Berlin, Deutschland'}","{'__CLASS__': 'Adzuna::API::Response::Category', 'tag': 'unknown', 'label': 'Unknown'}",13.420806,https://www.adzuna.de/details/5408460711?utm_medium=api&utm_source=a4bcf954,2025-09-20T15:15:37Z,"{'display_name': 'KfW Bankengruppe', '__CLASS__': 'Adzuna::API::Response::Company'}",eyJhbGciOiJIUzI1NiJ9.eyJzIjoiTnZNaGVnU284QkcyZ2FsbUZpemgzZyIsImkiOiI1NDA4NDYwNzExIn0.0cP4dfHELojWb2SM-Z70VH16OkswPiOzZCI6yEXPTqI,0,5408460711,,,,
53.557429,Data Science Lead (f/m/d),"adjoe is redefining the future of mobile ads. Join us. Meet Your Team: Playtime Data Science The Playtime Data Science team powers adjoe’s rewarded ad unit, connecting over 200 million users with personalized game offers – at a rate of 2 billion requests per day. We develop deep learning models that predict user preferences, match games to players, and dynamically adjust pricing to ensure value for users, advertisers, and monetizers. Our infrastructure supports model training and batch inferenc…",Adzuna::API::Response::Job,"{'display_name': 'Hamburg, Deutschland', '__CLASS__': 'Adzuna::API::Response::Location', 'area': ['Deutschland', 'Hamburg']}","{'__CLASS__': 'Adzuna::API::Response::Category', 'label': 'Unknown', 'tag': 'unknown'}",9.987297,https://www.adzuna.de/details/5183905825?utm_medium=api&utm_source=a4bcf954,2025-05-06T21:58:43Z,"{'__CLASS__': 'Adzuna::API::Response::Company', 'display_name': 'applike group'}",eyJhbGciOiJIUzI1NiJ9.eyJzIjoiTnZNaGVnU284QkcyZ2FsbUZpemgzZyIsImkiOiI1MTgzOTA1ODI1In0.ckTKGli11kswm7zHR0URr7ehIabTe8-G9ph-jnWSRhc,0,5183905825,full_time,,,
