company,salary_is_predicted,title,created,id,category,adref,location,__CLASS__,redirect_url,description,latitude,longitude,contract_time,salary_max,salary_min,contract_type
"{'__CLASS__': 'Adzuna::API::Response::Company', 'display_name': 'Meyerthole Siems Kohlruss Ges. für aktuarielle Beratung mbH'}",0,Mathematiker/Aktuar (d/m/w) Data Science/Pricing/Risikomanagement/Solvency II,2025-05-13T16:29:00Z,5196440045,"{'__CLASS__': 'Adzuna::API::Response::Category', 'tag': 'other-general-jobs', 'label': 'Sonstige/Allgemeine Stellen'}",eyJhbGciOiJIUzI1NiJ9.eyJpIjoiNTE5NjQ0MDA0NSIsInMiOiJydXdYTGE1TjhCR3dpcHFxWm9mVjRBIn0.JtSe9EbFBEfjMqBLSuEyKOBFPE4Vz6Ua3nz5Vonxtps,"{'area': ['Deutschland', 'Nordrhein-Westfalen', 'Köln', 'Altstadt-Süd'], 'display_name': 'Altstadt-Süd, Köln', '__CLASS__': 'Adzuna::API::Response::Location'}",Adzuna::API::Response::Job,https://www.adzuna.de/land/ad/5196440045?se=ruwXLa5N8BGwipqqZofV4A&utm_medium=api&utm_source=a4bcf954&v=F3DC9D4FE8472A1B057B54B3603AD14A26F5A5D9,"Meyerthole Siems Kohlruss (MSK) ist eine aktuarielle Beratungsgesellschaft mit Sitz in Köln und seit 1998 im deutschsprachigen Raum für Schaden- und Unfallversicherer tätig. Unsere Schwerpunkte liegen auf abwechslungsreichen Aufgaben aus den Bereichen Data Science, Telematik, Pricing, Naturgefahren, Bilanzbewertung, Rückversicherung und Solvency II. Zu unseren Mandaten zählen mehr als 80 Versicherer und Rückversicherer sowie InsurTechs. Kreativität und Teamarbeit haben einen hohen Stellenwert b…",50.93355,6.9594,,,,
"{'__CLASS__': 'Adzuna::API::Response::Company', 'display_name': 'Horváth'}",0,Praktikum als Fellow Consultant (w/m/d) Steering Lab - Schwerpunkt Data Science,2025-05-28T23:30:13Z,5220848298,"{'__CLASS__': 'Adzuna::API::Response::Category', 'tag': 'other-general-jobs', 'label': 'Sonstige/Allgemeine Stellen'}",eyJhbGciOiJIUzI1NiJ9.eyJpIjoiNTIyMDg0ODI5OCIsInMiOiJydXdYTGE1TjhCR3dpcHFxWm9mVjRBIn0.0Gr9yG1dOLAPboC57NfFnW3CkEOF_pq2BReUyrYXNJc,"{'area': ['Deutschland'], 'display_name': 'Deutschland', '__CLASS__': 'Adzuna::API::Response::Location'}",Adzuna::API::Response::Job,https://www.adzuna.de/land/ad/5220848298?se=ruwXLa5N8BGwipqqZofV4A&utm_medium=api&utm_source=a4bcf954&v=FB41CF4DC95E40ED33DD6B75B0D240873738767D,"Als unabhängige, internationale Managementberatung begegnen wir täglich spannenden Aufgaben und Kunden. Durch individuelle Stärken und Talente sowie umfassende Expertise wachsen wir über uns hinaus. Wir nehmen Herausforderungen an – als Team auf Augenhöhe. Freundschaftlich und mit Humor. Successfully together! That's Horváth. Praktikum. Weiter gedacht. Du bist nicht nur Teil unseres Teams, sondern startest auch direkt inhaltlich in unseren anspruchsvollen Entwicklungsprojekten und Lösungen im S…",,,,,,
"{'display_name': 'IQVIA Commercial GmbH & Co. OHG', '__CLASS__': 'Adzuna::API::Response::Company'}",0,Payroll Spezialist / Mitarbeiter in der Entgeltabrechnung (m/w/d) Pharma & Healthcare,2025-06-17T20:34:22Z,5255325434,"{'label': 'Stellen aus Buchhaltung & Finanzwesen', 'tag': 'accounting-finance-jobs', '__CLASS__': 'Adzuna::API::Response::Category'}",eyJhbGciOiJIUzI1NiJ9.eyJpIjoiNTI1NTMyNTQzNCIsInMiOiJydXdYTGE1TjhCR3dpcHFxWm9mVjRBIn0.ZhjoiPm-9BxUy_9524zDbga_urnoriuAkWBljj1VaIs,"{'area': ['Deutschland', 'Sachsen', 'Leipzig (Kreis)', 'Leipzig'], 'display_name': 'Leipzig, Leipzig (Kreis)', '__CLASS__': 'Adzuna::API::Response::Location'}",Adzuna::API::Response::Job,https://www.adzuna.de/land/ad/5255325434?se=ruwXLa5N8BGwipqqZofV4A&utm_medium=api&utm_source=a4bcf954&v=AC3AAF5479CA0DE43402C917A9D706779331E1A1,"IQVIA TM – The Human Data Science Company TM – ist ein führender, globaler Anbieter von zukunftsweisender Analytik, Technologielösungen und klinischer Auftragsforschung. IQVIA unterstützt Life-Science-Unternehmen, Verbände, Institutionen, Kostenträger und weitere Akteure im Gesundheitswesen darin, bessere Ergebnisse in der Gesundheitsversorgung zu erzielen. Werden Sie Teil unserer Community  von rund 90.000 Mitarbeiterinnen und Mitarbeitern in über 100 Ländern, die sich dafür einsetzen, das Pot…",51.339254,12.373598,,,,
"{'__CLASS__': 'Adzuna::API::Response::Company', 'display_name': 'VIVAVIS AG'}",0,Lead Architect – IT Platform (m/w/d),2025-05-29T07:49:20Z,5221182461,"{'tag': 'it-jobs', 'label': 'IT-Stellen', '__CLASS__': 'Adzuna::API::Response::Category'}",eyJhbGciOiJIUzI1NiJ9.eyJpIjoiNTIyMTE4MjQ2MSIsInMiOiJydXdYTGE1TjhCR3dpcHFxWm9mVjRBIn0.lj_j7ICxxRo3zqeI7XfSx_23rRTLM8hoCIAB9xRHsRQ,"{'__CLASS__': 'Adzuna::API::Response::Location', 'display_name': 'Ettlingen, Karlsruhe (Kreis)', 'area': ['Deutschland', 'Baden-Württemberg', 'Karlsruhe (Kreis)', 'Ettlingen']}",Adzuna::API::Response::Job,https://www.adzuna.de/land/ad/5221182461?se=ruwXLa5N8BGwipqqZofV4A&utm_medium=api&utm_source=a4bcf954&v=D6F5C5161B2AD73C891099CCFA64CD9F528A7295,"Wir übernehmen Verantwortung für das nachhaltige Management von Energie und Wasser und leisten damit unseren Beitrag zur Energiewende. Durch Data Science machen wir Daten zu nutzbaren Informationen und helfen unseren Kunden, neue zukunftsfähige Geschäftsfelder in der Energiebranche zu erschließen. Der Geschäftsbereich Digital Platform Services konzentriert sich auf den Aufbau eines IT Service- und Cybersecurity-Portfolios sowie die Entwicklung und Bereitstellung einer sicheren digitalen Plattfo…",48.943,8.40934,,,,
"{'__CLASS__': 'Adzuna::API::Response::Company', 'display_name': 'MAN Truck & Bus Group'}",0,Thesisverfasser im Bereich Flottenanalyse Nutzung elektrische Fahrzeuge (w/m/d),2025-06-17T20:17:41Z,5255169309,"{'__CLASS__': 'Adzuna::API::Response::Category', 'tag': 'unknown', 'label': 'Unknown'}",eyJhbGciOiJIUzI1NiJ9.eyJpIjoiNTI1NTE2OTMwOSIsInMiOiJydXdYTGE1TjhCR3dpcHFxWm9mVjRBIn0.UR85Rx0wFpIxISSfPT5OLNEJgD5lUYA0lWQ6nY19IWU,"{'__CLASS__': 'Adzuna::API::Response::Location', 'area': ['Deutschland', 'Bayern', 'München (Kreis)', 'München'], 'display_name': 'München, München (Kreis)'}",Adzuna::API::Response::Job,https://www.adzuna.de/land/ad/5255169309?se=ruwXLa5N8BGwipqqZofV4A&utm_medium=api&utm_source=a4bcf954&v=7CD49B1938B611471D031080679BC7B1B36E81BF,"Zu besetzen ab: 01.09.2025 Dein Arbeitsumfeld Wir bei MAN Truck & Bus sind Teil eines starken internationalen Teams und einer der führenden europäischen Nutzfahrzeughersteller und Anbieter von Transportlösungen. Zusammen mit den Marken Scania, Volkswagen Truck & Bus und International gehören wir zur TRATON GROUP. Als Teil dieses Verbundes stehen wir vor großen Herausforderungen: Unsere Fahrzeuge werden immer autonomer und vernetzter, um emissionsärmer unterwegs zu sein. Dafür arbeiten wir an na…",48.137418,11.555737,,,,
"{'display_name': 'CHECK24', '__CLASS__': 'Adzuna::API::Response::Company'}",0,(Senior) Data Scientist (m/w/d) InsurTech,2025-04-30T07:14:06Z,5169955957,"{'label': 'Stellen aus Wissenschaft & Qualitätssicherung', 'tag': 'scientific-qa-jobs', '__CLASS__': 'Adzuna::API::Response::Category'}",eyJhbGciOiJIUzI1NiJ9.eyJpIjoiNTE2OTk1NTk1NyIsInMiOiJydXdYTGE1TjhCR3dpcHFxWm9mVjRBIn0.gs6JBz5dg6fEeaMyAvmS4i_A76D8gcScglixzSwrC2o,"{'display_name': 'Hamburg, Deutschland', 'area': ['Deutschland', 'Hamburg'], '__CLASS__': 'Adzuna::API::Response::Location'}",Adzuna::API::Response::Job,https://www.adzuna.de/land/ad/5169955957?se=ruwXLa5N8BGwipqqZofV4A&utm_medium=api&utm_source=a4bcf954&v=E677514D6EDD1617B44BF920A497677AD1112E70,"Du brennst für Data Science, Machine Learning und Large Language Models und möchtest Dein Wissen in die Praxis umsetzen? Dann bist Du bei CHECK24 genau richtig! In unserer internen BI- und Data-Science-Community arbeiten wir standortübergreifend zusammen, um das bestmögliche Kundenerlebnis zu schaffen und unsere Vergleichsplattform kontinuierlich zu optimieren. Wir suchen Dich als Data-Science-Talent mit einem exzellenten Hochschulabschluss in Data Science, Statistik, Mathematik, Informatik ode…",53.557429,9.987297,,,,
"{'display_name': 'ZEISS', '__CLASS__': 'Adzuna::API::Response::Company'}",0,Praktikum technische Zuverlässigkeit und Fielddatascience (m/w/x),2025-06-17T20:37:30Z,5255329339,"{'label': 'Sonstige/Allgemeine Stellen', 'tag': 'other-general-jobs', '__CLASS__': 'Adzuna::API::Response::Category'}",eyJhbGciOiJIUzI1NiJ9.eyJzIjoicnV3WExhNU44Qkd3aXBxcVpvZlY0QSIsImkiOiI1MjU1MzI5MzM5In0.f2fSd305wNeMzn_6WbJ9a45EI_3XH43R6r-WqqI-31o,"{'__CLASS__': 'Adzuna::API::Response::Location', 'area': ['Deutschland', 'Baden-Württemberg', 'Ostalbkreis', 'Oberkochen'], 'display_name': 'Oberkochen, Ostalbkreis'}",Adzuna::API::Response::Job,https://www.adzuna.de/land/ad/5255329339?se=ruwXLa5N8BGwipqqZofV4A&utm_medium=api&utm_source=a4bcf954&v=71987DA33BE36759ECA8450F0519A32A5702BB65,"Als Studierender (m/w/x) arbeitest Du mit Deinen Kolleginnen und Kollegen auf Augenhöhe und schaffst Dir ideale Voraussetzungen für Deine spätere Karriere. In einem offenen und modernen Umfeld mit zahlreichen Entwicklungs- und Weiterbildungsmöglichkeiten, arbeiten die Mitarbeitenden bei ZEISS in einer Kultur, die von Expertenwissen und Teamgeist geprägt ist. All das wird getragen von der besonderen Eigentümerstruktur und dem langfristigen Ziel der Carl-Zeiss-Stiftung: Wissenschaft und Gesellsch…",48.78408,10.10558,,,,
"{'display_name': 'EY Deutschland', '__CLASS__': 'Adzuna::API::Response::Company'}",0,Praktikant Data Science im Bereich prüfungsnahe Beratung / Quants (Financial Services) (w/m/d),2025-05-13T22:23:31Z,5197159587,"{'__CLASS__': 'Adzuna::API::Response::Category', 'label': 'Sonstige/Allgemeine Stellen', 'tag': 'other-general-jobs'}",eyJhbGciOiJIUzI1NiJ9.eyJzIjoicnV3WExhNU44Qkd3aXBxcVpvZlY0QSIsImkiOiI1MTk3MTU5NTg3In0.5yPnT902RwikRIfql8T-0cnO5QTezz2yVOtEi9aYRdY,"{'area': ['Deutschland', 'Hessen', 'Main-Taunus-Kreis', 'Eschborn'], 'display_name': 'Eschborn, Main-Taunus-Kreis', '__CLASS__': 'Adzuna::API::Response::Location'}",Adzuna::API::Response::Job,https://www.adzuna.de/land/ad/5197159587?se=ruwXLa5N8BGwipqqZofV4A&utm_medium=api&utm_source=a4bcf954&v=AADA4988ABFD760FD44321CA23706DD19F56CC93,"Bei EY setzen wir alles daran, dass die Welt besser funktioniert. Dafür hinterfragen wir täglich den Status quo und suchen schon heute die Antworten von morgen. Stillstand? Keine Option. Wandel? Sehen wir als Chance und Treiber für Innovation. Wenn du auch so tickst, dann bist du bei uns genau richtig. Wir suchen Macher:innen, die Unternehmen, Entrepreneuren, Privatpersonen und der öffentlichen Hand helfen, über sich hinaus zu wachsen. Das erfordert Zusammenarbeit auf Augenhöhe und das Verlasse…",,,,,,
"{'__CLASS__': 'Adzuna::API::Response::Company', 'display_name': 'Bosch Gruppe'}",0,"Pflichtpraktikum im Bereich ""Final Assembly""",2025-06-18T08:09:14Z,5255834704,"{'__CLASS__': 'Adzuna::API::Response::Category', 'tag': 'manufacturing-jobs', 'label': 'Stellen aus Fertigung'}",eyJhbGciOiJIUzI1NiJ9.eyJzIjoicnV3WExhNU44Qkd3aXBxcVpvZlY0QSIsImkiOiI1MjU1ODM0NzA0In0.paHo7wb_Q14_0GOhphQv-nqVbswCTea9X5kCTeNDIaQ,"{'area': ['Deutschland', 'Niedersachsen', 'Salzgitter'], 'display_name': 'Salzgitter, Niedersachsen', '__CLASS__': 'Adzuna::API::Response::Location'}",Adzuna::API::Response::Job,https://www.adzuna.de/land/ad/5255834704?se=ruwXLa5N8BGwipqqZofV4A&utm_medium=api&utm_source=a4bcf954&v=956A857973E60D516164A636FFC2C9B755C120B6,"Möchten Sie Ihre Ideen in nutzbringende und sinnvolle Technologien verwandeln? Ob im Bereich Mobility Solutions, Consumer Goods, Industrial Technology oder Energy and Building Technology - mit uns verbessern Sie die Lebensqualität der Menschen auf der ganzen Welt. Willkommen bei Bosch. Die Robert Bosch Elektronik GmbH freut sich auf Ihre Bewerbung! Anstellungsart: Befristet Arbeitszeit: Vollzeit Arbeitsort: Salzgitter Aufgaben Du suchst ein Praktikum in einem dynamischen Fertigungsbereich der E…",52.120502,10.373516,,,,
"{'__CLASS__': 'Adzuna::API::Response::Company', 'display_name': 'Technische Universität München '}",0,IT Systems Administrator (m/f/d) at Munich Data Science Institute,2025-05-28T02:27:57Z,5219266918,"{'tag': 'it-jobs', 'label': 'IT-Stellen', '__CLASS__': 'Adzuna::API::Response::Category'}",eyJhbGciOiJIUzI1NiJ9.eyJzIjoicnV3WExhNU44Qkd3aXBxcVpvZlY0QSIsImkiOiI1MjE5MjY2OTE4In0.Xgqm6QCPA4grEB1wq4ilyBWXBJuRS3VM6UbUyvjcQx4,"{'display_name': 'Altstadt-Lehel, München', 'area': ['Deutschland', 'Bayern', 'München (Kreis)', 'München', 'Altstadt-Lehel'], '__CLASS__': 'Adzuna::API::Response::Location'}",Adzuna::API::Response::Job,https://www.adzuna.de/land/ad/5219266918?se=ruwXLa5N8BGwipqqZofV4A&utm_medium=api&utm_source=a4bcf954&v=D10C28FD5905112EFA191188E580ED5C4325D69D,"Munich Data Science Institute (MDSI) Technische Universität MünchenTUM - Logo IT Systems Administrator (m/f/d) at Munich Data Science Institute The Munich Data Science Institute (MDSI) is an integrative research institute at the Technical University of Munich (TUM). It is interdisciplinary and cross-departmental in the fields of data science, machine learning, and artificial intelligence. The institute acts as a facilitator and multiplier of state-of-the-art data science practices, technologies…",48.14093,11.56907,,,,
"{'display_name': 'Schwarz Corporate Solutions', '__CLASS__': 'Adzuna::API::Response::Company'}",0,(Senior) Partner Manager IPAI (m/w/d),2025-06-05T20:09:54Z,5234826823,"{'__CLASS__': 'Adzuna::API::Response::Category', 'tag': 'consultancy-jobs', 'label': 'Beraterstellen'}",eyJhbGciOiJIUzI1NiJ9.eyJzIjoicnV3WExhNU44Qkd3aXBxcVpvZlY0QSIsImkiOiI1MjM0ODI2ODIzIn0.t2E1UFp2944w1w8OVXggMMYFvkiWZ7wUNBQaUTptgDc,"{'area': ['Deutschland', 'Baden-Württemberg', 'Heilbronn (Kreis)', 'Heilbronn'], 'display_name': 'Heilbronn, Heilbronn (Kreis)', '__CLASS__': 'Adzuna::API::Response::Location'}",Adzuna::API::Response::Job,https://www.adzuna.de/land/ad/5234826823?se=ruwXLa5N8BGwipqqZofV4A&utm_medium=api&utm_source=a4bcf954&v=5CBECF34835745A11DF7C93C155D5F564C99CB19,"Künstliche Intelligenz ist die Zukunfts- und Schlüsseltechnologie und befähigt uns, die Herausforderungen der nächsten Jahrzehnte zu lösen. Nur wenn die deutsche Wirtschaft eine führende Position in der Wertschöpfung im Bereich KI schafft, kann sie ihre Wettbewerbsfähigkeit halten und nachhaltige und ethische Werte aktiv gestalten. Durch die Zusammenarbeit im Ökosystem gelingt diese Transformation – durch die Bündelung von Ressourcen. IPAI will diese Plattform darstellen. Wir bringen die Wertsc…",49.142335,9.209895,,,,
"{'display_name': 'Harzsparkasse', '__CLASS__': 'Adzuna::API::Response::Company'}",0,Vertriebsdatenmanager (m/w/d),2025-05-30T19:47:57Z,5223672573,"{'__CLASS__': 'Adzuna::API::Response::Category', 'tag': 'unknown', 'label': 'Unknown'}",eyJhbGciOiJIUzI1NiJ9.eyJzIjoicnV3WExhNU44Qkd3aXBxcVpvZlY0QSIsImkiOiI1MjIzNjcyNTczIn0.UH2eQsJGlciiCtynquh3Mgq25LawRW0XR3iDghINPq0,"{'display_name': 'Wernigerode, Harz (Kreis)', 'area': ['Deutschland', 'Sachsen-Anhalt', 'Harz (Kreis)', 'Wernigerode'], '__CLASS__': 'Adzuna::API::Response::Location'}",Adzuna::API::Response::Job,https://www.adzuna.de/land/ad/5223672573?se=ruwXLa5N8BGwipqqZofV4A&utm_medium=api&utm_source=a4bcf954&v=53F958EB7C1309A0799A1DEB56D04B8F4E484D60,"Aufgaben Profil Wir bieten Willkommen in der Harzsparkasse! Die Harzsparkasse zeichnet sich durch eine tiefe Verbundenheit zur Region aus und legt großen Wert darauf, lokale Gemeinschaften zu stärken und zu unterstützen. Sie haben ein gutes Gespür für Zahlen, erkennen Trends in Daten und möchten Ihre Stärken dort einbringen, wo sie wirklich etwas bewegen? Dann sind Sie bei uns genau richtig! Zur Verstärkung unseres Teams suchen wir eine engagierte Persönlichkeit, die das Vertriebscontrolling mi…",51.83828,10.79078,,,,
"{'__CLASS__': 'Adzuna::API::Response::Company', 'display_name': 'CEVA Logistics GmbH'}",0,Wirtschaftsinformatiker / Informatiker als HRIS-Expert / Manager – SAP SuccessFactors (m/w/d),2025-06-12T20:09:22Z,5246908487,"{'__CLASS__': 'Adzuna::API::Response::Category', 'tag': 'consultancy-jobs', 'label': 'Beraterstellen'}",eyJhbGciOiJIUzI1NiJ9.eyJzIjoicnV3WExhNU44Qkd3aXBxcVpvZlY0QSIsImkiOiI1MjQ2OTA4NDg3In0.Urlc3uioJIdRUnVfteG06m792vGGBcdzvzSLavwvuoQ,"{'area': ['Deutschland', 'Hessen', 'Frankfurt am Main'], 'display_name': 'Frankfurt am Main, Hessen', '__CLASS__': 'Adzuna::API::Response::Location'}",Adzuna::API::Response::Job,https://www.adzuna.de/land/ad/5246908487?se=ruwXLa5N8BGwipqqZofV4A&utm_medium=api&utm_source=a4bcf954&v=D9A7A5B20D0AD02362385393B014F90CA79098BA,"Mit über 110.000 Mitarbeitenden in 130 Ländern streben wir danach, einer der Top-5-Kontraktlogistikanbieter zu werden. Wir wachsen stetig – bist Du bereit, mit uns zu wachsen? Unsere Mitarbeitenden sind unser Erfolgsfaktor. Wir fördern ein Arbeitsumfeld, das persönliche Entwicklung und Innovation unterstützt. Für unseren Standort in Frankfurt am Main suchen wir zum nächstmöglichen Zeitpunkt Dich als: HRIS-Expert / Manager – SAP SuccessFactors (m⁠/⁠w⁠/⁠d) Aufgaben Leitung der digitalen HR-Transf…",50.129683,8.650578,,,,
"{'__CLASS__': 'Adzuna::API::Response::Company', 'display_name': 'LEIFHEIT AG'}",0,Master Data & Process Architect (m/w/d),2025-06-16T20:06:42Z,5253437689,"{'__CLASS__': 'Adzuna::API::Response::Category', 'label': 'IT-Stellen', 'tag': 'it-jobs'}",eyJhbGciOiJIUzI1NiJ9.eyJpIjoiNTI1MzQzNzY4OSIsInMiOiJydXdYTGE1TjhCR3dpcHFxWm9mVjRBIn0.6IvhNBzMJAhXXY7GL_BEk9-5cBQarBWZ5-c5JsHC_YQ,"{'__CLASS__': 'Adzuna::API::Response::Location', 'area': ['Deutschland', 'Nordrhein-Westfalen', 'Siegen-Wittgenstein (Kreis)', 'Siegen', 'Seelbach'], 'display_name': 'Seelbach, Siegen'}",Adzuna::API::Response::Job,https://www.adzuna.de/land/ad/5253437689?se=ruwXLa5N8BGwipqqZofV4A&utm_medium=api&utm_source=a4bcf954&v=E9F7870BDE539F28C189043580718AE767B83749,"Unsere Ideen, die Dein Leben leichter machen: Seit 65 Jahren gehört die Leifheit AG zu den führenden Anbietern von Haushaltswaren in Europa. Mit den Marken Leifheit und Soehnle, zwei der bekanntesten Marken Deutschlands, möchten wir das Leben von Verbrauchern erleichtern. Unsere Geschäftsbereiche sind Reinigung, Wäschepflege, Küchenhelfer, Personen- und Küchenwagen – dabei begeistern wir durch hochwertige und innovative Produkte mit überlegenem Gebrauchsnutzen und funktionalem Design. Rund 1.10…",50.88299,7.96497,,,,
"{'__CLASS__': 'Adzuna::API::Response::Company', 'display_name': 'RSM Ebner Stolz'}",0,Duales Studium Wirtschaftsinformatik Data Science (B.Sc.) - Start Oktober 2025 (m/w/d),2025-06-07T01:56:22Z,5237444281,"{'__CLASS__': 'Adzuna::API::Response::Category', 'tag': 'other-general-jobs', 'label': 'Sonstige/Allgemeine Stellen'}",eyJhbGciOiJIUzI1NiJ9.eyJzIjoicnV3WExhNU44Qkd3aXBxcVpvZlY0QSIsImkiOiI1MjM3NDQ0MjgxIn0.CjsMdbP3rQmwDR0Ir04vxIuTot9mghi3IthnJjBJlH4,"{'__CLASS__': 'Adzuna::API::Response::Location', 'area': ['Deutschland'], 'display_name': 'Deutschland'}",Adzuna::API::Response::Job,https://www.adzuna.de/land/ad/5237444281?se=ruwXLa5N8BGwipqqZofV4A&utm_medium=api&utm_source=a4bcf954&v=04D77F590583C79DB44421B161BAD8DF0812C1C0,"Willst du wissen, was Unternehmen erfolgreich macht? Direkt mit Entscheidern am Tisch sitzen? Unmittelbar erleben, was dein Können bewirkt? Gemeinsam mit dir bringt RSM Ebner Stolz den Mittelstand voran - in Wirtschaftsprüfung, Steuer-, Rechts- und Unternehmensberatung. Mit über 2.700 Mitarbeitenden sind wir deutschlandweit präsent, weltweit an mehr als 820 Standorten unseres internationalen RSM-Netzwerks vertreten. Unser Erfolg lebt von starken Menschen mit Ecken und Kanten. Deshalb stehen wir…",,,,,,
"{'display_name': 'Gerresheimer AG', '__CLASS__': 'Adzuna::API::Response::Company'}",0,Duales Studium mit vertiefter Praxis: Bachelor of Science Künstliche Intelligenz und Data Science (m/w/d),2025-06-10T19:33:21Z,5242909853,"{'__CLASS__': 'Adzuna::API::Response::Category', 'tag': 'it-jobs', 'label': 'IT-Stellen'}",eyJhbGciOiJIUzI1NiJ9.eyJpIjoiNTI0MjkwOTg1MyIsInMiOiJydXdYTGE1TjhCR3dpcHFxWm9mVjRBIn0.rIF7ntJ26ZIFwcJbr9IOUMDCEBozOyjn7c2_NWEUAFg,"{'__CLASS__': 'Adzuna::API::Response::Location', 'area': ['Deutschland', 'Bayern', 'Schwandorf (Kreis)', 'Pfreimd'], 'display_name': 'Pfreimd, Schwandorf (Kreis)'}",Adzuna::API::Response::Job,https://www.adzuna.de/land/ad/5242909853?se=ruwXLa5N8BGwipqqZofV4A&utm_medium=api&utm_source=a4bcf954&v=768F7BF0CB26B9217ACE26E9A70F4211333E08A5,"Über Gerresheimer Gerresheimer ist als innovativer System- und Lösungsanbieter der globale Partner der Pharma-, Biotech- und Kosmetikindustrie. Das Unternehmen bietet ein umfassendes Portfolio an pharmazeutischen Primärverpackungen, Verabreichungssystemen für Medikamente und digitalen Lösungen. Gerresheimer sorgt dafür, dass Medikamente sicher zum Patienten gelangen und zuverlässig verabreicht werden können. Mit rund 13.400 Mitarbeitenden, und über 40 Produktionsstandorten in 16 Ländern in Euro…",49.49349,12.17958,full_time,,,
"{'display_name': 'IQVIA Commercial GmbH & Co. OHG', '__CLASS__': 'Adzuna::API::Response::Company'}",0,Senior Analytics Insight Specialist (m/w/d),2025-06-17T20:37:43Z,5255329976,"{'__CLASS__': 'Adzuna::API::Response::Category', 'tag': 'pr-advertising-marketing-jobs', 'label': 'Stellen aus PR, Werbung & Marketing'}",eyJhbGciOiJIUzI1NiJ9.eyJzIjoicnV3WExhNU44Qkd3aXBxcVpvZlY0QSIsImkiOiI1MjU1MzI5OTc2In0.v9OjNwvvv-hC67IT_dwpsofo7b7P16O7rU4U0TOBFD0,"{'display_name': 'Frankfurt am Main, Hessen', 'area': ['Deutschland', 'Hessen', 'Frankfurt am Main'], '__CLASS__': 'Adzuna::API::Response::Location'}",Adzuna::API::Response::Job,https://www.adzuna.de/land/ad/5255329976?se=ruwXLa5N8BGwipqqZofV4A&utm_medium=api&utm_source=a4bcf954&v=3D3AC8CA15909798AA3031A47386020BCB90C4B6,"IQVIA TM – The Human Data Science Company TM – ist ein führender, globaler Anbieter von zukunftsweisender Analytik, Technologielösungen und klinischer Auftragsforschung. IQVIA unterstützt Life-Science-Unternehmen, Verbände, Institutionen, Kostenträger und weitere Akteure im Gesundheitswesen darin, bessere Ergebnisse in der Gesundheitsversorgung zu erzielen. Werde Teil unserer Community  von rund 90.000 Mitarbeiterinnen und Mitarbeitern in über 100 Ländern, die sich dafür einsetzen, das Potenzia…",50.129683,8.650578,,,,
"{'__CLASS__': 'Adzuna::API::Response::Company', 'display_name': 'Venquis'}",0,Lead Consultant – Generative AI & Data Science (m/w/d),2025-06-13T08:26:46Z,5247970504,"{'tag': 'it-jobs', 'label': 'IT-Stellen', '__CLASS__': 'Adzuna::API::Response::Category'}",eyJhbGciOiJIUzI1NiJ9.eyJzIjoicnV3WExhNU44Qkd3aXBxcVpvZlY0QSIsImkiOiI1MjQ3OTcwNTA0In0.BrBSb4VYeu9clVf-ucCJzYjPooGgllNewYYa2zex6ZI,"{'display_name': 'Bayern, Deutschland', 'area': ['Deutschland', 'Bayern'], '__CLASS__': 'Adzuna::API::Response::Location'}",Adzuna::API::Response::Job,https://www.adzuna.de/land/ad/5247970504?se=ruwXLa5N8BGwipqqZofV4A&utm_medium=api&utm_source=a4bcf954&v=380F54E5E82935CD0550E77B1BB25463A53904CF,"Über das Unternehmen Unser Mandant ist eine etablierte, innovationsgetriebene Unternehmensberatung, die führende Unternehmen bei der digitalen und datengetriebenen Transformation begleitet. Über die Rolle Im Zuge des weiteren Wachstums suchen wir eine erfahrene Führungspersönlichkeit mit tiefem technischen Verständnis und strategischem Weitblick im Bereich KI und Generative AI. Verantwortlichkeiten Team Leadership mit Impact: Du übernimmst die disziplinarische Führung eines rund zehnköpfigen Te…",,,,,,
"{'display_name': 'ATLAS ELEKTRONIK GmbH', '__CLASS__': 'Adzuna::API::Response::Company'}",0,Abschlussarbeit: Identifikation und Benchmarking von Suchalgorithmen in maritimer Simulationsumgebung (m/w/d),2025-06-08T20:02:08Z,5240302085,"{'label': 'Sonstige/Allgemeine Stellen', 'tag': 'other-general-jobs', '__CLASS__': 'Adzuna::API::Response::Category'}",eyJhbGciOiJIUzI1NiJ9.eyJpIjoiNTI0MDMwMjA4NSIsInMiOiJydXdYTGE1TjhCR3dpcHFxWm9mVjRBIn0.S8WAxfkpw70iR0Y0FMNM3yf0p-sBlVXvTzqiREg_-Gw,"{'__CLASS__': 'Adzuna::API::Response::Location', 'area': ['Deutschland', 'Bremen'], 'display_name': 'Bremen, Deutschland'}",Adzuna::API::Response::Job,https://www.adzuna.de/land/ad/5240302085?se=ruwXLa5N8BGwipqqZofV4A&utm_medium=api&utm_source=a4bcf954&v=1FD17CACBD6EA71B1CD722015B267E80AF8D46FE,"Das ATLAS-Labor (A-LAB) für Studierende und Promovenden beschäftigt sich mit maritimen Technologien von Morgen. In einem Team aus jungen motivierten Mitarbeiterinnen und Mitarbeitern bekommen Sie die Chance, durch Unterstützung und in enger Abstimmung mit unseren Experten, Ihr Forschungs- und Entwicklungsthema voran zu treiben. ATLAS ELEKTRONIK ist ein Unternehmen der thyssenkrupp AG und steht für maritime Sicherheit. Seit Jahrzehnten unterstützen wir als führendes Systemhaus für maritime Elekt…",53.10403,8.786477,,,,
"{'display_name': 'ZEISS', '__CLASS__': 'Adzuna::API::Response::Company'}",0,Praktikum im Bereich digitale Knowledge Plattform des globalen Service Teams (m/w/x),2025-05-31T07:46:41Z,5224404669,"{'__CLASS__': 'Adzuna::API::Response::Category', 'label': 'Kundendienststellen', 'tag': 'customer-services-jobs'}",eyJhbGciOiJIUzI1NiJ9.eyJpIjoiNTIyNDQwNDY2OSIsInMiOiJydXdYTGE1TjhCR3dpcHFxWm9mVjRBIn0.-wGB4OG1d-OhKak_rT9lvS-rULk9wNlHfWjXTFyWdnI,"{'__CLASS__': 'Adzuna::API::Response::Location', 'area': ['Deutschland', 'Baden-Württemberg', 'Ostalbkreis', 'Oberkochen'], 'display_name': 'Oberkochen, Ostalbkreis'}",Adzuna::API::Response::Job,https://www.adzuna.de/land/ad/5224404669?se=ruwXLa5N8BGwipqqZofV4A&utm_medium=api&utm_source=a4bcf954&v=3CD87B79B3CE046035A22E3E79240AF8D970255F,"Sich etwas Neues trauen, über sich hinauswachsen und dabei die Grenzen des Machbaren neu deﬁnieren. Genau das ist es, was unsere Mitarbeitenden täglich leben dürfen und sollen. Um mit unseren Innovationen das Tempo vorzugeben und Großartiges zu ermöglichen. Denn hinter jedem erfolgreichen Unternehmen stehen eine ganze Menge faszinierender Menschen. Die Mitarbeitenden von ZEISS arbeiten in einem offenen und modernen Umfeld mit zahlreichen Entwicklungs- und Weiterbildungsmöglichkeiten. Unsere Kul…",48.78408,10.10558,,,,
