title,__CLASS__,location,latitude,id,redirect_url,category,company,salary_is_predicted,created,description,longitude,adref,contract_time,salary_max,salary_min,contract_type
Duales Studium Wirtschaftsinformatik - Data Science 2026,Adzuna::API::Response::Job,"{'__CLASS__': 'Adzuna::API::Response::Location', 'display_name': 'Neckarsulm, Heilbronn (Kreis)', 'area': ['Deutschland', 'Baden-Württemberg', 'Heilbronn (Kreis)', 'Neckarsulm']}",49.18975,5548026116,https://www.adzuna.de/land/ad/5548026116?se=jiSavAbf8BG434aVLFkWZQ&utm_medium=api&utm_source=a4bcf954&v=41DA62D993B44B9FEB8847AABCB7D4124FE0CAAB,"{'tag': 'unknown', 'label': 'Unknown', '__CLASS__': 'Adzuna::API::Response::Category'}","{'__CLASS__': 'Adzuna::API::Response::Company', 'display_name': 'Lidl Stiftung & Co. KG'}",0,2025-12-19T02:02:51Z,"Eine gute Idee war der Ursprung, ein erfolgreiches Konzept ist das Ergebnis. Qualität zum guten Preis möglichst vielen Menschen anbieten zu können treibt uns an - mittlerweile weltweit, denn wir sind Lidl. Hier ist das berufliche Zuhause vielfältiger Talente. Ob im Einkauf, in der Logistik, im Warengeschäft oder in der IT; ob als Impulsgeber, Gestalter oder Dienstleister der Länder. Wir suchen Anpacker, Durchstarter, Möglichmacher und bieten spannende Aufgaben und Projekte in einem dynamischen …",9.2274,eyJhbGciOiJIUzI1NiJ9.eyJpIjoiNTU0ODAyNjExNiIsInMiOiJqaVNhdkFiZjhCRzQzNGFWTEZrV1pRIn0.fF_6ARTTwpZXh5picB_dxSLkL7PFXOvB4y0DMIvLDRM,,,,
Duales Studium Wirtschaftsinformatik – Data Science (B.Sc.),Adzuna::API::Response::Job,"{'__CLASS__': 'Adzuna::API::Response::Location', 'display_name': 'Stuttgart, Baden-Württemberg', 'area': ['Deutschland', 'Baden-Württemberg', 'Stuttgart']}",48.776198,5548460370,https://www.adzuna.de/land/ad/5548460370?se=jiSavAbf8BG434aVLFkWZQ&utm_medium=api&utm_source=a4bcf954&v=4AB0FB39A63354DA71F8E9978F4BFFD65C5C2B87,"{'tag': 'unknown', '__CLASS__': 'Adzuna::API::Response::Category', 'label': 'Unknown'}","{'display_name': 'ALH Gruppe', '__CLASS__': 'Adzuna::API::Response::Company'}",0,2025-12-19T14:03:05Z,"Die ALH Gruppe zählt zu den bedeutenden Versicherungs- und Finanzdienst­leistungsunternehmen in Deutschland. Rund 3.000 Mitarbeiterinnen und Mitarbeiter bilden das Fundament für unseren Erfolg und sorgen täglich für erstklassigen Service, individuelle Beratung und die langfristige Zufriedenheit unserer Kunden. Aufgaben Innovative Technologien vorantreiben und betriebswirtschaftliche Zusammenhänge optimieren – als Absolvent (m/w/d) des Studiengangs Wirtschaftsinformatik (B.Sc.) weißt du wie´s ge…",9.187224,eyJhbGciOiJIUzI1NiJ9.eyJpIjoiNTU0ODQ2MDM3MCIsInMiOiJqaVNhdkFiZjhCRzQzNGFWTEZrV1pRIn0.sud_opjmil7WUunn7-TFG7aBEEK8orxlPU3ixpicdWs,,,,
Duales Studium Data Science & Künstliche Intelligenz B.Sc.,Adzuna::API::Response::Job,"{'area': ['Deutschland', 'Baden-Württemberg', 'Karlsruhe (Kreis)', 'Karlsruhe'], 'display_name': 'Karlsruhe, Karlsruhe (Kreis)', '__CLASS__': 'Adzuna::API::Response::Location'}",49.001249,5547014836,https://www.adzuna.de/land/ad/5547014836?se=jiSavAbf8BG434aVLFkWZQ&utm_medium=api&utm_source=a4bcf954&v=9A40BB6289DF563EBCA1961334F112E532AFA62C,"{'label': 'Unknown', '__CLASS__': 'Adzuna::API::Response::Category', 'tag': 'unknown'}","{'__CLASS__': 'Adzuna::API::Response::Company', 'display_name': 'Atruvia AG'}",0,2025-12-18T13:41:15Z,Wir sind der Digitalisierungspartner in der genossenschaftlichen FinanzGruppe und vereinen jahrzehntelanges Expertenwissen in Banking und Informationstechnologie. Die speziell auf Banken zugeschnittenen IT-Lösungen und Leistungen reichen vom Rechenzentrumsbetrieb über das Bankverfahren von Atruvia bis hin zur App-Entwicklung. Dabei nutzen wir zukunftsweisende Technologien wie Smart Data und schreiben Prozessoptimierung und Regulatorik groß. Gestalte die Zukunft mit KI – Starte dein Duales Studi…,8.412378,eyJhbGciOiJIUzI1NiJ9.eyJzIjoiamlTYXZBYmY4Qkc0MzRhVkxGa1daUSIsImkiOiI1NTQ3MDE0ODM2In0.eukt-NlniA2c8Ot8AkwJh5pXrbLjg4CL0rVB3OxyZyc,,,,
DHBW-Studium Bachelor of Science – Wirtschaftsinformatik – Data Science,Adzuna::API::Response::Job,"{'area': ['Deutschland', 'Baden-Württemberg', 'Stuttgart'], 'display_name': 'Stuttgart, Baden-Württemberg', '__CLASS__': 'Adzuna::API::Response::Location'}",48.776198,5548460449,https://www.adzuna.de/land/ad/5548460449?se=jiSavAbf8BG434aVLFkWZQ&utm_medium=api&utm_source=a4bcf954&v=38E5DC5B715492B65AE40C68A710C6569519CE8C,"{'label': 'IT-Stellen', '__CLASS__': 'Adzuna::API::Response::Category', 'tag': 'it-jobs'}","{'display_name': 'WGV - Württembergische Gemeinde-Versicherung a.G.', '__CLASS__': 'Adzuna::API::Response::Company'}",0,2025-12-19T14:03:07Z,"WHAT DO YOU DO FOR A LIVING? Als starker Arbeitgeber und attrak­tives Aus­bildungs­unter­nehmen bieten wir dir im Herzen Stuttgarts viel­fältige und spannende Aus­bildungs- und Studien­plätze mit besten Über­nahme­chancen. Für den Studienstart am 1. September 2026 suchen wir am Standort Stuttgart aufge­schlossene und moti­vierte Studierende. DHBW-Studium Bachelor of Science – Wirt­schafts­informatik – Data Science Aufgaben Drei Jahre bei der WGV studieren, dann hast du es geschafft und kannst d…",9.187224,eyJhbGciOiJIUzI1NiJ9.eyJzIjoiamlTYXZBYmY4Qkc0MzRhVkxGa1daUSIsImkiOiI1NTQ4NDYwNDQ5In0.w_OzOpHuUOZeJelTPV9rioGs0XegpsJSocI32cshqiQ,,,,
Professur für Data Science,Adzuna::API::Response::Job,"{'__CLASS__': 'Adzuna::API::Response::Location', 'area': ['Deutschland', 'Bayern', 'München (Kreis)', 'München', 'Au-Haidhausen'], 'display_name': 'Au-Haidhausen, München'}",48.13258,5515911716,https://www.adzuna.de/land/ad/5515911716?se=jiSavAbf8BG434aVLFkWZQ&utm_medium=api&utm_source=a4bcf954&v=73617BD5EFD6997AC0B4468EB6312F9B720BE069,"{'label': 'Lehrberufe', '__CLASS__': 'Adzuna::API::Response::Category', 'tag': 'teaching-jobs'}","{'__CLASS__': 'Adzuna::API::Response::Company', 'display_name': 'SPARKS University of Applied Sciences'}",0,2025-11-27T09:34:49Z,"Zum Wintersemester 2026/27 besetzen wir in Vollzeit oder Teilzeit (mind. 50% Stellenumfang) eine: Professur für Data Science Unsere Professor:innen sind so neugierig wie unsere Studierenden und lernen mit ihnen - nach einem akademischen Konzept, das kollaborativ und kreativ ist. Sie zünden SPARKS, die aus unseren Studierenden breit gebildete Fachkräfte für Marketing­kom­muni­ka­tion machen - und Expert:innen für ein Leben in Zeiten tiefgreifender Veränderungen. Ihr Profil Sie haben ein Hochschu…",11.59129,eyJhbGciOiJIUzI1NiJ9.eyJpIjoiNTUxNTkxMTcxNiIsInMiOiJqaVNhdkFiZjhCRzQzNGFWTEZrV1pRIn0.5pOLahXiA4Iywsi6TZpTktJyjqAb43sO-WjQ0vREnR4,,,,
Werkstudent Data Science (m/w/d),Adzuna::API::Response::Job,"{'__CLASS__': 'Adzuna::API::Response::Location', 'display_name': 'Osnabrück, Osnabrück (Kreis)', 'area': ['Deutschland', 'Niedersachsen', 'Osnabrück (Kreis)', 'Osnabrück']}",52.274227,5548035754,https://www.adzuna.de/land/ad/5548035754?se=jiSavAbf8BG434aVLFkWZQ&utm_medium=api&utm_source=a4bcf954&v=EF60532EF2EA8C550B537C0DD2D819CC330362FB,"{'tag': 'it-jobs', '__CLASS__': 'Adzuna::API::Response::Category', 'label': 'IT-Stellen'}","{'__CLASS__': 'Adzuna::API::Response::Company', 'display_name': 'Westnetz GmbH'}",0,2025-12-19T02:13:59Z,"Du. Mit uns? Du. Mit uns? Für unser Team Digitalisierung, Standort Dortmund , Essen, Münster, Osnabrück oder anderer Westnetz-Standort, suchen wir zum nächstmöglichen Zeitpunkt engagierte Verstärkung. Deine Arbeit sollte sinnstiftend sein und Du willst Dich mit all Deinen Facetten einbringen? Dann bist Du bei uns richtig. Wie Du bist, was Du fühlst: Wir sehen Dich. Die , eine 100-prozentige Tochter der Westenergie AG, ist der größte Verteilnetzbetreiber Deutschlands. Mit über 6.000 Mitarbeiter*…",8.055137,eyJhbGciOiJIUzI1NiJ9.eyJpIjoiNTU0ODAzNTc1NCIsInMiOiJqaVNhdkFiZjhCRzQzNGFWTEZrV1pRIn0.hEkl_G5hFzz82zeHpkLoc_F5gc5dDn7-_OM9jYIucSE,full_time,,,
Werkstudent Data Science (m/w/d),Adzuna::API::Response::Job,"{'__CLASS__': 'Adzuna::API::Response::Location', 'display_name': 'Dortmund, Nordrhein-Westfalen', 'area': ['Deutschland', 'Nordrhein-Westfalen', 'Dortmund']}",51.504967,5548035758,https://www.adzuna.de/land/ad/5548035758?se=jiSavAbf8BG434aVLFkWZQ&utm_medium=api&utm_source=a4bcf954&v=47B126FD155569552EE7C3D6824997B82A3C28F4,"{'tag': 'it-jobs', '__CLASS__': 'Adzuna::API::Response::Category', 'label': 'IT-Stellen'}","{'display_name': 'Westnetz GmbH', '__CLASS__': 'Adzuna::API::Response::Company'}",0,2025-12-19T02:13:59Z,"Du. Mit uns? Du. Mit uns? Für unser Team Digitalisierung, Standort Dortmund , Essen, Münster, Osnabrück oder anderer Westnetz-Standort, suchen wir zum nächstmöglichen Zeitpunkt engagierte Verstärkung. Deine Arbeit sollte sinnstiftend sein und Du willst Dich mit all Deinen Facetten einbringen? Dann bist Du bei uns richtig. Wie Du bist, was Du fühlst: Wir sehen Dich. Die , eine 100-prozentige Tochter der Westenergie AG, ist der größte Verteilnetzbetreiber Deutschlands. Mit über 6.000 Mitarbeiter*…",7.464954,eyJhbGciOiJIUzI1NiJ9.eyJzIjoiamlTYXZBYmY4Qkc0MzRhVkxGa1daUSIsImkiOiI1NTQ4MDM1NzU4In0.rT5iRrXnA48mybGFvcc2p9YVRmWLbtLs0KJaVkJE-5I,full_time,,,
Werkstudent Data Science (m/w/d),Adzuna::API::Response::Job,"{'area': ['Deutschland', 'Nordrhein-Westfalen', 'Münster'], 'display_name': 'Münster, Nordrhein-Westfalen', '__CLASS__': 'Adzuna::API::Response::Location'}",51.955292,5548035753,https://www.adzuna.de/land/ad/5548035753?se=jiSavAbf8BG434aVLFkWZQ&utm_medium=api&utm_source=a4bcf954&v=134DD650632144EF4E53E004B2BE2D2ED799DEF8,"{'tag': 'it-jobs', 'label': 'IT-Stellen', '__CLASS__': 'Adzuna::API::Response::Category'}","{'__CLASS__': 'Adzuna::API::Response::Company', 'display_name': 'Westnetz GmbH'}",0,2025-12-19T02:13:59Z,"Du. Mit uns? Du. Mit uns? Für unser Team Digitalisierung, Standort Dortmund , Essen, Münster, Osnabrück oder anderer Westnetz-Standort, suchen wir zum nächstmöglichen Zeitpunkt engagierte Verstärkung. Deine Arbeit sollte sinnstiftend sein und Du willst Dich mit all Deinen Facetten einbringen? Dann bist Du bei uns richtig. Wie Du bist, was Du fühlst: Wir sehen Dich. Die , eine 100-prozentige Tochter der Westenergie AG, ist der größte Verteilnetzbetreiber Deutschlands. Mit über 6.000 Mitarbeiter*…",7.621504,eyJhbGciOiJIUzI1NiJ9.eyJzIjoiamlTYXZBYmY4Qkc0MzRhVkxGa1daUSIsImkiOiI1NTQ4MDM1NzUzIn0.89lZ-lAQInAljZPlaG0XB-Fyyp53PgngtVss5qBJoBY,full_time,,,
Werkstudent Data Science (m/w/d),Adzuna::API::Response::Job,"{'area': ['Deutschland', 'Nordrhein-Westfalen', 'Essen'], 'display_name': 'Essen, Nordrhein-Westfalen', '__CLASS__': 'Adzuna::API::Response::Location'}",51.444823,5548035757,https://www.adzuna.de/land/ad/5548035757?se=jiSavAbf8BG434aVLFkWZQ&utm_medium=api&utm_source=a4bcf954&v=1F88ABE16C5694C5BCEDF103E8969391139E666E,"{'__CLASS__': 'Adzuna::API::Response::Category', 'label': 'IT-Stellen', 'tag': 'it-jobs'}","{'display_name': 'Westnetz GmbH', '__CLASS__': 'Adzuna::API::Response::Company'}",0,2025-12-19T02:13:59Z,"Du. Mit uns? Du. Mit uns? Für unser Team Digitalisierung, Standort Dortmund , Essen, Münster, Osnabrück oder anderer Westnetz-Standort, suchen wir zum nächstmöglichen Zeitpunkt engagierte Verstärkung. Deine Arbeit sollte sinnstiftend sein und Du willst Dich mit all Deinen Facetten einbringen? Dann bist Du bei uns richtig. Wie Du bist, was Du fühlst: Wir sehen Dich. Die , eine 100-prozentige Tochter der Westenergie AG, ist der größte Verteilnetzbetreiber Deutschlands. Mit über 6.000 Mitarbeiter*…",7.014478,eyJhbGciOiJIUzI1NiJ9.eyJpIjoiNTU0ODAzNTc1NyIsInMiOiJqaVNhdkFiZjhCRzQzNGFWTEZrV1pRIn0.z6KpAuAvDdgDu8OuCkoPTRpYXXkXtk2fBrVRJCz-06I,full_time,,,
Duales Studium 2026 - Data Science und KI B.Sc. (d/m/w),Adzuna::API::Response::Job,"{'display_name': 'Freiburg im Breisgau, Baden-Württemberg', 'area': ['Deutschland', 'Baden-Württemberg', 'Freiburg im Breisgau'], '__CLASS__': 'Adzuna::API::Response::Location'}",47.999458,5466725194,https://www.adzuna.de/land/ad/5466725194?se=jiSavAbf8BG434aVLFkWZQ&utm_medium=api&utm_source=a4bcf954&v=2E265F75D4E76BB298528A5390B9ADF9BE5E0796,"{'tag': 'it-jobs', 'label': 'IT-Stellen', '__CLASS__': 'Adzuna::API::Response::Category'}","{'__CLASS__': 'Adzuna::API::Response::Company', 'display_name': 'Haufe Group SE'}",0,2025-10-27T21:42:06Z,"Freiburg im Breisgau ab sofort Wir bilden aus und suchen begeisterte Daten-Enthusiast:innen! KI, Data Engineering, Cloud Computing oder Big Data sollen nicht länger nur theoretische Begriffe sein? Dann ist unser duales Studium mit dem Schwerpunkt Data Science und Künstliche Intelligenz die perfekte Gelegenheit, um deine Fähigkeiten zu entwickeln und in die vielschichtige Welt der Daten einzutauchen. Setze jetzt den Startschuss für deine Karriere ab September 2026 im Studiengang Data Science und…",7.816286,eyJhbGciOiJIUzI1NiJ9.eyJzIjoiamlTYXZBYmY4Qkc0MzRhVkxGa1daUSIsImkiOiI1NDY2NzI1MTk0In0.7vH3dzEwhiXZtEOhOOSn0SlOxLR7HaWO0cqWoWvnZlM,full_time,,,
Student Data Science als Werkstudent - Entwicklung & Automatisierung / Power BI (m/w/d),Adzuna::API::Response::Job,"{'area': ['Deutschland', 'Baden-Württemberg', 'Heidenheim (Kreis)'], 'display_name': 'Heidenheim (Kreis), Baden-Württemberg', '__CLASS__': 'Adzuna::API::Response::Location'}",48.67025,5522265370,https://www.adzuna.de/land/ad/5522265370?se=jiSavAbf8BG434aVLFkWZQ&utm_medium=api&utm_source=a4bcf954&v=4B2778BF3CB3A9E0159F412FDDF74B7D36BD0D7A,"{'tag': 'it-jobs', '__CLASS__': 'Adzuna::API::Response::Category', 'label': 'IT-Stellen'}","{'__CLASS__': 'Adzuna::API::Response::Company', 'display_name': 'PAUL HARTMANN AG'}",0,2025-12-01T20:02:58Z,"Bei HARTMANN geht es uns darum, zu helfen , zu pflegen , zu schützen und zu wachsen . Wir unterstützen Fachkräfte im Gesundheitswesen, damit sie sich auf das konzentrieren können, was wirklich wichtig ist: das Leben der Menschen positiv zu beeinflussen. Wir realisieren Lösungen, die einen echten Beitrag leisten. Und mit Deinem Engagement kannst Du jeden Tag in Deinem Job wachsen. Bei HARTMANN glauben wir an den Unterschied, den Du bewirken kannst. Verstärke unser Team als Werkstudent (m/w/d) In…",10.181654,eyJhbGciOiJIUzI1NiJ9.eyJpIjoiNTUyMjI2NTM3MCIsInMiOiJqaVNhdkFiZjhCRzQzNGFWTEZrV1pRIn0.54cCd75RG7h0bjbSXt6d2MfAEpBB_h8dIdzLqxIm1qE,full_time,,,
Schulabsolvent als Dualer Student Künstliche Intelligenz & Data Science (m/w/d),Adzuna::API::Response::Job,"{'__CLASS__': 'Adzuna::API::Response::Location', 'display_name': 'Deutschland', 'area': ['Deutschland']}",,5492336776,https://www.adzuna.de/land/ad/5492336776?se=jiSavAbf8BG434aVLFkWZQ&utm_medium=api&utm_source=a4bcf954&v=2943AE67898FDE42079E37CFC5F7E390C951177C,"{'label': 'IT-Stellen', '__CLASS__': 'Adzuna::API::Response::Category', 'tag': 'it-jobs'}","{'display_name': 'Swarco AG', '__CLASS__': 'Adzuna::API::Response::Company'}",0,2025-11-12T15:13:27Z,"Aufgaben Das primäre Ziel ist die Ausbildung von Informatik-Allroundern (m/w/d) für eine Tätigkeit in der Berufspraxis Die Pflichtfächer decken ein breites fachliches Spektrum ab, eine große Zahl an Modulen mit Wahlmöglichkeit erlaubt die individuelle Vertiefung Während der Praxisphasen erhältst du von uns Projekte und/oder Problemstellungen, die du selbstständig behandelst und natürlich mit Unterstützung löst Das Studium verbindet ein wissenschaftliches Hochschulstudium mit unternehmerischer P…",,eyJhbGciOiJIUzI1NiJ9.eyJpIjoiNTQ5MjMzNjc3NiIsInMiOiJqaVNhdkFiZjhCRzQzNGFWTEZrV1pRIn0.DFBZZdUacbF791wzgnQg6UameQEktZiZuIRKkpACi-A,full_time,,,
Duales Studium Wirtschaftsinformatik - Data Science 2026,Adzuna::API::Response::Job,"{'area': ['Deutschland', 'Baden-Württemberg', 'Heilbronn (Kreis)', 'Neckarsulm'], 'display_name': 'Neckarsulm, Heilbronn (Kreis)', '__CLASS__': 'Adzuna::API::Response::Location'}",49.18975,5548107233,https://www.adzuna.de/land/ad/5548107233?se=jiSavAbf8BG434aVLFkWZQ&utm_medium=api&utm_source=a4bcf954&v=2DB274CD3DAAA49A7A73E9770CA034AC97B175B5,"{'tag': 'other-general-jobs', 'label': 'Sonstige/Allgemeine Stellen', '__CLASS__': 'Adzuna::API::Response::Category'}","{'__CLASS__': 'Adzuna::API::Response::Company', 'display_name': 'Lidl Stiftung & Co. KG'}",0,2025-12-19T04:17:30Z,"Eine gute Idee war der Ursprung, ein erfolgreiches Konzept ist das Ergebnis. Qualität zum guten Preis möglichst vielen Menschen anbieten zu können treibt uns an - mittlerweile weltweit, denn wir sind Lidl. Hier ist das berufliche Zuhause vielfältiger Talente. Ob im Einkauf, in der Logistik, im Warengeschäft oder in der IT; ob als Impulsgeber, Gestalter oder Dienstleister der Länder. Wir suchen Anpacker, Durchstarter, Möglichmacher und bieten spannende Aufgaben und Projekte in einem dynamischen …",9.2274,eyJhbGciOiJIUzI1NiJ9.eyJpIjoiNTU0ODEwNzIzMyIsInMiOiJqaVNhdkFiZjhCRzQzNGFWTEZrV1pRIn0.D_xnUzThXKuuzvFjwHV6tEG9lOccyD0thwyal8AWPMo,full_time,,,
Duales Studium Wirtschaftsinformatik – Data Science (B.Sc.),Adzuna::API::Response::Job,"{'__CLASS__': 'Adzuna::API::Response::Location', 'display_name': 'Degerloch, Stuttgart', 'area': ['Deutschland', 'Baden-Württemberg', 'Stuttgart', 'Degerloch']}",48.74475,5548513287,https://www.adzuna.de/land/ad/5548513287?se=jiSavAbf8BG434aVLFkWZQ&utm_medium=api&utm_source=a4bcf954&v=5A695BC26F1D292210A5E77AE0BC4D4B3E41DAC1,"{'__CLASS__': 'Adzuna::API::Response::Category', 'label': 'Sonstige/Allgemeine Stellen', 'tag': 'other-general-jobs'}","{'display_name': 'ALH Gruppe', '__CLASS__': 'Adzuna::API::Response::Company'}",0,2025-12-19T16:09:50Z,"Die ALH Gruppe zählt zu den bedeutenden Versicherungs- und Finanzdienst­leistungsunternehmen in Deutschland. Rund 3.000 Mitarbeiterinnen und Mitarbeiter bilden das Fundament für unseren Erfolg und sorgen täglich für erstklassigen Service, individuelle Beratung und die langfristige Zufriedenheit unserer Kunden. Innovative Technologien vorantreiben und betriebswirtschaftliche Zusammenhänge optimieren – als Absolvent (m/w/d) des Studiengangs Wirtschaftsinformatik (B.Sc.) weißt du wie´s geht! Denn …",9.16896,eyJhbGciOiJIUzI1NiJ9.eyJzIjoiamlTYXZBYmY4Qkc0MzRhVkxGa1daUSIsImkiOiI1NTQ4NTEzMjg3In0._hgHWvMGqwlk1WeypwXEcAjW8_BV8hAnXnAfaPuZGM4,full_time,,,
Data Science Consultant,Adzuna::API::Response::Job,"{'area': ['Deutschland'], 'display_name': 'Deutschland', '__CLASS__': 'Adzuna::API::Response::Location'}",,5536157056,https://www.adzuna.de/land/ad/5536157056?se=jiSavAbf8BG434aVLFkWZQ&utm_medium=api&utm_source=a4bcf954&v=03C1CE5A264A72678B26D67FB3446C0FFBBD32A8,"{'label': 'Unknown', '__CLASS__': 'Adzuna::API::Response::Category', 'tag': 'unknown'}","{'display_name': 'Blue Yonder', '__CLASS__': 'Adzuna::API::Response::Company'}",0,2025-12-10T16:39:31Z,"Overview The Data Science Consultant provides services that maximize the value of the customer’s business through data-driven insights and enhanced decision support. This role will be responsible for advising the customer and recommending software configuration alternatives and adapting the software that is configured to optimize the solution so that the customer may realize the maximum value from the software. Responsibilities: Perform data analysis to discover patterns, trends and anomalies i…",,eyJhbGciOiJIUzI1NiJ9.eyJpIjoiNTUzNjE1NzA1NiIsInMiOiJqaVNhdkFiZjhCRzQzNGFWTEZrV1pRIn0.rQtC3hugcnvM-32V6dkXgohOK95RCKLMVUwXs3i3GmE,,,,
Duales Studium Data Science & Künstliche Intelligenz B.Sc.,Adzuna::API::Response::Job,"{'area': ['Deutschland', 'Baden-Württemberg', 'Karlsruhe (Kreis)', 'Karlsruhe'], 'display_name': 'Karlsruhe, Karlsruhe (Kreis)', '__CLASS__': 'Adzuna::API::Response::Location'}",49.001249,5547789711,https://www.adzuna.de/land/ad/5547789711?se=jiSavAbf8BG434aVLFkWZQ&utm_medium=api&utm_source=a4bcf954&v=452A58FEBF9F040A3BE7A5E84602AB995A25A16D,"{'tag': 'other-general-jobs', 'label': 'Sonstige/Allgemeine Stellen', '__CLASS__': 'Adzuna::API::Response::Category'}","{'__CLASS__': 'Adzuna::API::Response::Company', 'display_name': 'Atruvia AG'}",0,2025-12-18T21:49:52Z,Wir sind der Digitalisierungspartner in der genossenschaftlichen FinanzGruppe und vereinen jahrzehntelanges Expertenwissen in Banking und Informationstechnologie. Die speziell auf Banken zugeschnittenen IT-Lösungen und Leistungen reichen vom Rechenzentrumsbetrieb über das Bankverfahren von Atruvia bis hin zur App-Entwicklung. Dabei nutzen wir zukunftsweisende Technologien wie Smart Data und schreiben Prozessoptimierung und Regulatorik groß. Gestalte die Zukunft mit KI – Starte dein Duales Studi…,8.412378,eyJhbGciOiJIUzI1NiJ9.eyJzIjoiamlTYXZBYmY4Qkc0MzRhVkxGa1daUSIsImkiOiI1NTQ3Nzg5NzExIn0.glpZtCkDrcvoy7LZ6XRIjZzT5IN1IjZSHhBr8UegYEk,full_time,,,
DHBW-Studium Bachelor of Science – Wirtschaftsinformatik – Data Science,Adzuna::API::Response::Job,"{'__CLASS__': 'Adzuna::API::Response::Location', 'display_name': 'Stuttgart, Baden-Württemberg', 'area': ['Deutschland', 'Baden-Württemberg', 'Stuttgart']}",48.776198,5548517532,https://www.adzuna.de/land/ad/5548517532?se=jiSavAbf8BG434aVLFkWZQ&utm_medium=api&utm_source=a4bcf954&v=604A3B6DD016EF6A49A22415A7577B8B5BE0DCE4,"{'tag': 'other-general-jobs', 'label': 'Sonstige/Allgemeine Stellen', '__CLASS__': 'Adzuna::API::Response::Category'}","{'display_name': 'WGV - Württembergische Gemeinde-Versicherung a.G.', '__CLASS__': 'Adzuna::API::Response::Company'}",0,2025-12-19T16:10:58Z,"WHAT DO YOU DO FOR A LIVING? Als starker Arbeitgeber und attrak­tives Aus­bildungs­unter­nehmen bieten wir dir im Herzen Stuttgarts viel­fältige und spannende Aus­bildungs- und Studien­plätze mit besten Über­nahme­chancen. Für den Studienstart am 1. September 2026 suchen wir am Standort Stuttgart aufge­schlossene und moti­vierte Studierende. DHBW-Studium Bachelor of Science – Wirt­schafts­informatik – Data Science Drei Jahre bei der WGV studieren, dann hast du es geschafft und kannst deine Karr…",9.187224,eyJhbGciOiJIUzI1NiJ9.eyJzIjoiamlTYXZBYmY4Qkc0MzRhVkxGa1daUSIsImkiOiI1NTQ4NTE3NTMyIn0.xqZa17oqAUjR2ysiQJZPw9ZTaZAG4VC59QZqlsaMAPU,full_time,,,
Lecturer Data Science Current Topics (m/f/d),Adzuna::API::Response::Job,"{'__CLASS__': 'Adzuna::API::Response::Location', 'display_name': 'Berlin, Deutschland', 'area': ['Deutschland', 'Berlin']}",52.507706,5549469984,https://www.adzuna.de/land/ad/5549469984?se=jiSavAbf8BG434aVLFkWZQ&utm_medium=api&utm_source=a4bcf954&v=E73A3B2B7920E1DFCCE21E091A8785653981A354,"{'tag': 'other-general-jobs', 'label': 'Sonstige/Allgemeine Stellen', '__CLASS__': 'Adzuna::API::Response::Category'}","{'__CLASS__': 'Adzuna::API::Response::Company', 'display_name': 'IU Internationale Hochschule'}",0,2025-12-20T04:03:43Z,"IU INTERNATIONAL UNIVERSITY - MyStudium – Because teaching is not just a job, it's a statement. You don't just want to teach, you want to make a difference? Then start at Germany's largest university and shape the future of teaching with us - in an environment that focuses on your professional and personal needs. Contribute to our academic world at our campus in Berlin as a freelance lecturer in MyStudium with 48 teaching units starting on 01.04.2026 . Your tasks You teach fundamental knowledge…",13.420806,eyJhbGciOiJIUzI1NiJ9.eyJpIjoiNTU0OTQ2OTk4NCIsInMiOiJqaVNhdkFiZjhCRzQzNGFWTEZrV1pRIn0.amv_yYDLxiUaBx2O-HHcQ9zKtYfvOdNY-ASnMLikoh8,part_time,,,
Wissenschaftlicher Mitarbeiter - Mathematik & Data Science - Grundschullehramt (m/w/d),Adzuna::API::Response::Job,"{'area': ['Deutschland', 'Bayern', 'Erlangen'], 'display_name': 'Erlangen, Bayern', '__CLASS__': 'Adzuna::API::Response::Location'}",49.577521,5522265656,https://www.adzuna.de/land/ad/5522265656?se=jiSavAbf8BG434aVLFkWZQ&utm_medium=api&utm_source=a4bcf954&v=89ABBD7C9951FEAB2ADD38D2B9CB085E0EA88B6E,"{'__CLASS__': 'Adzuna::API::Response::Category', 'label': 'Unknown', 'tag': 'unknown'}","{'__CLASS__': 'Adzuna::API::Response::Company', 'display_name': 'Friedrich-Alexander-Universität Erlangen-Nürnberg'}",0,2025-12-01T20:02:59Z,"Ihr Arbeitsplatz Das Department Mathematik an der Naturwissenschaftlichen Fakultät der Friedrich-Alexander-Universität Erlangen-Nürnberg (FAU) widmet sich der Forschung und Lehre in der gesamten Breite der mathematischen Disziplinen. Die Studiengänge Data Science, Mathematik, Technomathematik, Wirtschaftsmathematik und Computational and Applied Mathematics sind hier verankert. Ihre Aufgaben Sie sind zuständig für das organisatorische, fachliche und studiengangsspezifische Tagesgeschäft für die …",10.984506,eyJhbGciOiJIUzI1NiJ9.eyJpIjoiNTUyMjI2NTY1NiIsInMiOiJqaVNhdkFiZjhCRzQzNGFWTEZrV1pRIn0.w66qQi_czKoKV_Be5V7Ig8lQ0cv-Pej6ZQ1qRPoxURI,full_time,,,
Wissenschaftlicher Mitarbeiter - Betreuung Abschlussarbeiten Mathematik / Data Science (m/w/d),Adzuna::API::Response::Job,"{'display_name': 'Erlangen, Bayern', 'area': ['Deutschland', 'Bayern', 'Erlangen'], '__CLASS__': 'Adzuna::API::Response::Location'}",49.577521,5522265658,https://www.adzuna.de/land/ad/5522265658?se=jiSavAbf8BG434aVLFkWZQ&utm_medium=api&utm_source=a4bcf954&v=C712671EC12C02AEF88693A7A1DD91F5C8BB43BB,"{'tag': 'unknown', '__CLASS__': 'Adzuna::API::Response::Category', 'label': 'Unknown'}","{'__CLASS__': 'Adzuna::API::Response::Company', 'display_name': 'Friedrich-Alexander-Universität Erlangen-Nürnberg'}",0,2025-12-01T20:02:59Z,"Ihr Arbeitsplatz Das Department Mathematik an der Naturwissenschaftlichen Fakultät der Friedrich-Alexander-Universität Erlangen-Nürnberg (FAU) widmet sich der Forschung und Lehre in der gesamten Breite der mathematischen Disziplinen. Die Studiengänge Data Science, Mathematik, Technomathematik, Wirtschaftsmathematik und Computational and Applied Mathematics sind hier verankert. Ihre Aufgaben Sie sind zuständig für das organisatorische, fachliche und studiengangsspezifische Tagesgeschäft für die …",10.984506,eyJhbGciOiJIUzI1NiJ9.eyJpIjoiNTUyMjI2NTY1OCIsInMiOiJqaVNhdkFiZjhCRzQzNGFWTEZrV1pRIn0.cezZtHucVmZkjIvuZAFlilVzDAsChc4MIgZ0oKtVhG0,full_time,,,
