description,__CLASS__,category,title,company,latitude,id,salary_is_predicted,location,longitude,redirect_url,created,adref,contract_time,salary_max,salary_min,contract_type
Wir suchen Verstärkung für unser Team Test und Engineering innerhalb des Zentralen Bereichs Konstruktion am Standort Mindelheim für das Sommersemester 2026. Analyse kritischer Bearbeitungsprozesse durch umfangreiche Prozessdatenanalysen und den Einsatz von Maschine Learning Identifikation von Mustern und Zusammenhängen in großen Datensätzen zur Optimierung von Fertigungsabläufen Entwicklung und Implementierung von Prädiktionsmodellen zur vorausschauenden Wartung von Maschinenkomponenten Analyse…,Adzuna::API::Response::Job,"{'tag': 'unknown', 'label': 'Unknown', '__CLASS__': 'Adzuna::API::Response::Category'}",Praktikum Data Science (m/w/d),"{'__CLASS__': 'Adzuna::API::Response::Company', 'display_name': 'GROB-WERKE & Co. KG'}",48.03693,5346994579,0,"{'display_name': 'Mindelheim, Unterallgäu (Kreis)', '__CLASS__': 'Adzuna::API::Response::Location', 'area': ['Deutschland', 'Bayern', 'Unterallgäu (Kreis)', 'Mindelheim']}",10.49959,https://www.adzuna.de/details/5346994579?utm_medium=api&utm_source=a4bcf954,2025-08-10T22:52:16Z,eyJhbGciOiJIUzI1NiJ9.eyJzIjoiNEJWRkV3U2Q4QkdMWU9Od0hRRy1vQSIsImkiOiI1MzQ2OTk0NTc5In0.Rj7aWLf1mEMz3MW6sBxoycyWNUGgI6lbWCpG3NwjeR0,,,,contract
"The Position As a Post Doctoral Data Scientist, you will work at the forefront of data-driven research in drug discovery and shape how the global Drug Discovery Sciences (gDDS) department makes key decisions when developing new medicines. Join the Data and Digital Sciences team and collaborate with an inter-disciplinary group of experts in data science, drug discovery, and our Research DMPK functions including PK/PD modelling and in-vitro ADME. You will apply your data analytical expertise to a…",Adzuna::API::Response::Job,"{'__CLASS__': 'Adzuna::API::Response::Category', 'label': 'Unknown', 'tag': 'unknown'}",Post Doc - Data Science in Drug Discovery,"{'display_name': 'Boehringer Ingelheim', '__CLASS__': 'Adzuna::API::Response::Company'}",49.19277,5402241418,0,"{'area': ['Deutschland', 'Baden-Württemberg', 'Heilbronn (Kreis)', 'Heilbronn', 'Biberach'], 'display_name': 'Biberach, Heilbronn', '__CLASS__': 'Adzuna::API::Response::Location'}",9.14146,https://www.adzuna.de/details/5402241418?utm_medium=api&utm_source=a4bcf954,2025-09-17T00:48:19Z,eyJhbGciOiJIUzI1NiJ9.eyJpIjoiNTQwMjI0MTQxOCIsInMiOiI0QlZGRXdTZDhCR0xZT053SFFHLW9BIn0.99gicftO0_bEfhvi6AkkIM6C9fj9PPVXiV8i_YAKHZE,,,,
"The Position As a Post Doctoral Data Scientist, you will work at the forefront of data-driven research in drug discovery and shape how the global Drug Discovery Sciences (gDDS) department makes key decisions when developing new medicines. Join the Data and Digital Sciences team and collaborate with an inter-disciplinary group of experts in data science, drug discovery, and our Research DMPK functions including PK/PD modelling and in-vitro ADME. You will apply your data analytical expertise to a…",Adzuna::API::Response::Job,"{'__CLASS__': 'Adzuna::API::Response::Category', 'label': 'Unknown', 'tag': 'unknown'}",Post Doc - Data Science in Drug Discovery,"{'__CLASS__': 'Adzuna::API::Response::Company', 'display_name': 'Boehringer Ingelheim'}",49.19277,5404343799,0,"{'__CLASS__': 'Adzuna::API::Response::Location', 'display_name': 'Biberach, Heilbronn', 'area': ['Deutschland', 'Baden-Württemberg', 'Heilbronn (Kreis)', 'Heilbronn', 'Biberach']}",9.14146,https://www.adzuna.de/details/5404343799?utm_medium=api&utm_source=a4bcf954,2025-09-18T04:00:17Z,eyJhbGciOiJIUzI1NiJ9.eyJzIjoiNEJWRkV3U2Q4QkdMWU9Od0hRRy1vQSIsImkiOiI1NDA0MzQzNzk5In0.LAuj5x6xcuHxDYZeJr0ZyV-JzJCGsnFiBYqn575dRIA,,,,
"The Position As a Post Doctoral Data Scientist, you will work at the forefront of data-driven research in drug discovery and shape how the global Drug Discovery Sciences (gDDS) department makes key decisions when developing new medicines. Join the Data and Digital Sciences team and collaborate with an inter-disciplinary group of experts in data science, drug discovery, and our Research DMPK functions including PK/PD modelling and in-vitro ADME. You will apply your data analytical expertise to a…",Adzuna::API::Response::Job,"{'label': 'Unknown', 'tag': 'unknown', '__CLASS__': 'Adzuna::API::Response::Category'}",Post Doc - Data Science in Drug Discovery,"{'display_name': 'Boehringer Ingelheim', '__CLASS__': 'Adzuna::API::Response::Company'}",48.0962,5404839253,0,"{'area': ['Deutschland', 'Baden-Württemberg', 'Biberach (Kreis)', 'Biberach an der Riß'], '__CLASS__': 'Adzuna::API::Response::Location', 'display_name': 'Biberach an der Riß, Biberach (Kreis)'}",9.78975,https://www.adzuna.de/details/5404839253?utm_medium=api&utm_source=a4bcf954,2025-09-18T15:11:26Z,eyJhbGciOiJIUzI1NiJ9.eyJzIjoiNEJWRkV3U2Q4QkdMWU9Od0hRRy1vQSIsImkiOiI1NDA0ODM5MjUzIn0.yAi9HaLbQjDWyST7LFzua_Xqo8QAObSeOZxauZ8MJvU,,,,
"Lead Data Science & AI (all genders) Bei Exxeta fordern wir das traditionelle Konzept von Beratung und Tech heraus. Über 1200 Kolleg:innen an verschiedenen Standorten schaffen jeden Tag gemeinsam digitale Lösungen, verändern Märkte und Mindsets – angetrieben von unserer Leidenschaft für Technologie, unserem Teamspirit und dem Drang, echten Impact zu schaffen. Hightech with a heartbeat eben. Unsere Kund:innen setzen auf uns als Entwicklungspartner:innen für Data- und AI-Lösungen. Als sales-affin…",Adzuna::API::Response::Job,"{'tag': 'unknown', 'label': 'Unknown', '__CLASS__': 'Adzuna::API::Response::Category'}",Lead Data Science & AI (all genders),"{'__CLASS__': 'Adzuna::API::Response::Company', 'display_name': 'Exxeta'}",49.01216,5407905488,0,"{'area': ['Deutschland', 'Baden-Württemberg', 'Karlsruhe (Kreis)', 'Karlsruhe', 'Innenstadt-West'], '__CLASS__': 'Adzuna::API::Response::Location', 'display_name': 'Innenstadt-West, Karlsruhe'}",8.39586,https://www.adzuna.de/details/5407905488?utm_medium=api&utm_source=a4bcf954,2025-09-20T02:31:31Z,eyJhbGciOiJIUzI1NiJ9.eyJzIjoiNEJWRkV3U2Q4QkdMWU9Od0hRRy1vQSIsImkiOiI1NDA3OTA1NDg4In0.eoL-FqWWC07RyN1TP2xSLUCSXjUuyQXt7440q7G92uA,,,,
"Lead Data Science & AI (all genders) Bei Exxeta fordern wir das traditionelle Konzept von Beratung und Tech heraus. Über 1200 Kolleg:innen an verschiedenen Standorten schaffen jeden Tag gemeinsam digitale Lösungen, verändern Märkte und Mindsets – angetrieben von unserer Leidenschaft für Technologie, unserem Teamspirit und dem Drang, echten Impact zu schaffen. Hightech with a heartbeat eben. Unsere Kund:innen setzen auf uns als Entwicklungspartner:innen für Data- und AI-Lösungen. Als sales-affin…",Adzuna::API::Response::Job,"{'__CLASS__': 'Adzuna::API::Response::Category', 'label': 'Unknown', 'tag': 'unknown'}",Lead Data Science & AI (all genders),"{'__CLASS__': 'Adzuna::API::Response::Company', 'display_name': 'Exxeta'}",52.55114,5407905487,0,"{'display_name': 'Prenzlauer Berg, Berlin', '__CLASS__': 'Adzuna::API::Response::Location', 'area': ['Deutschland', 'Berlin', 'Prenzlauer Berg']}",13.42321,https://www.adzuna.de/details/5407905487?utm_medium=api&utm_source=a4bcf954,2025-09-20T02:31:31Z,eyJhbGciOiJIUzI1NiJ9.eyJzIjoiNEJWRkV3U2Q4QkdMWU9Od0hRRy1vQSIsImkiOiI1NDA3OTA1NDg3In0.yuYsVLLGcU57CIriBIfO11SMOTPEf554OlNgJLtBr48,,,,
"Lead Data Science & AI (all genders) Bei Exxeta fordern wir das traditionelle Konzept von Beratung und Tech heraus. Über 1200 Kolleg:innen an verschiedenen Standorten schaffen jeden Tag gemeinsam digitale Lösungen, verändern Märkte und Mindsets – angetrieben von unserer Leidenschaft für Technologie, unserem Teamspirit und dem Drang, echten Impact zu schaffen. Hightech with a heartbeat eben. Unsere Kund:innen setzen auf uns als Entwicklungspartner:innen für Data- und AI-Lösungen. Als sales-affin…",Adzuna::API::Response::Job,"{'__CLASS__': 'Adzuna::API::Response::Category', 'label': 'Unknown', 'tag': 'unknown'}",Lead Data Science & AI (all genders),"{'display_name': 'Exxeta', '__CLASS__': 'Adzuna::API::Response::Company'}",49.46856,5407905486,0,"{'area': ['Deutschland', 'Baden-Württemberg', 'Mannheim', 'Neuostheim'], '__CLASS__': 'Adzuna::API::Response::Location', 'display_name': 'Neuostheim, Mannheim'}",8.50014,https://www.adzuna.de/details/5407905486?utm_medium=api&utm_source=a4bcf954,2025-09-20T02:31:31Z,eyJhbGciOiJIUzI1NiJ9.eyJzIjoiNEJWRkV3U2Q4QkdMWU9Od0hRRy1vQSIsImkiOiI1NDA3OTA1NDg2In0._ZncyLN5D1I8HN4RP8eSCk8wNkcWxps9lynWrbHMgR4,,,,
"Einleitung Für eines unserer Partnerunternehmen im Hamburg suchen wir Dichals Lead Data Science/Business Intelligence (gn) Deine Aufgaben In dieser Funktion übernimmst bzw. steuerst Du sämtliche BI- Prozesse Du baust ein Datenteam auf (In-App-Retentionsoptimierung, Kampagnenverteilungsoptimierung) Du erstellst, analysierst und kommunizierst Berichte und Statistiken Du verwandelst wiederkehrende Analysen in KPIs und Dashboard-Ansichten Du analysierst Daten aus verschiedenen Quellen (Redshift, Sp…",Adzuna::API::Response::Job,"{'__CLASS__': 'Adzuna::API::Response::Category', 'label': 'Unknown', 'tag': 'unknown'}",Lead Data Science/Business Intelligence (gn),"{'__CLASS__': 'Adzuna::API::Response::Company', 'display_name': 'workidentity'}",53.557429,4801213177,0,"{'__CLASS__': 'Adzuna::API::Response::Location', 'display_name': 'Hamburg, Deutschland', 'area': ['Deutschland', 'Hamburg']}",9.987297,https://www.adzuna.de/details/4801213177?utm_medium=api&utm_source=a4bcf954,2024-07-30T22:44:26Z,eyJhbGciOiJIUzI1NiJ9.eyJpIjoiNDgwMTIxMzE3NyIsInMiOiI0QlZGRXdTZDhCR0xZT053SFFHLW9BIn0.1o8foUE5GBajEz8-0suvinISIwUAWmlYZBXWvXTEdOI,full_time,,,
"Short Facts Join us on our mission to build Europe’s largest virtual power plant. Flexa is at the forefront of enabling a smart and sustainable energy future. To drive this vision forward, we are looking for an experienced and forward-thinking Data Science Manager (d/f/m) to lead and grow our Data Science team. You will play a key role in shaping our algorithmic strategy, fostering technical excellence, and scaling a high-impact team, all while pushing the boundaries of what’s possible in energ…",Adzuna::API::Response::Job,"{'tag': 'unknown', 'label': 'Unknown', '__CLASS__': 'Adzuna::API::Response::Category'}",Data Science Manager (d/m/f),"{'__CLASS__': 'Adzuna::API::Response::Company', 'display_name': 'Flexa'}",48.1476,5392871886,0,"{'area': ['Deutschland', 'Bayern', 'München (Kreis)', 'München', 'Maxvorstadt'], 'display_name': 'Maxvorstadt, München', '__CLASS__': 'Adzuna::API::Response::Location'}",11.56803,https://www.adzuna.de/details/5392871886?utm_medium=api&utm_source=a4bcf954,2025-09-10T22:38:45Z,eyJhbGciOiJIUzI1NiJ9.eyJzIjoiNEJWRkV3U2Q4QkdMWU9Od0hRRy1vQSIsImkiOiI1MzkyODcxODg2In0.43o5AtG03ReXEJlW8r1esTeC053_esEBdWyIeDm5NZc,full_time,135000.0,115000.0,
"bluquist und Du! Liebst du es, psychologische Konzepte in die Praxis zu bringen? Begeistert es dich, Assessments zu entwickeln, Daten zu analysieren und mit psychometrischen Methoden fundierte Erkenntnisse zu gewinnen? Hast du Spaß daran, mit Daten, KI und Dashboards zu arbeiten, um die Zukunft der Personalarbeit aktiv mitzugestalten? Wenn du diese Fragen mit „Ja“ beantworten kannst, dann freuen wir uns, wenn du dich uns als Psychometrics & Data Science Specialist (all genders) anschließt. Komm…",Adzuna::API::Response::Job,"{'__CLASS__': 'Adzuna::API::Response::Category', 'label': 'Unknown', 'tag': 'unknown'}",Psychometrics & Data Science Specialist (all genders),"{'__CLASS__': 'Adzuna::API::Response::Company', 'display_name': 'bluquist'}",,5408728914,0,"{'display_name': 'Deutschland', '__CLASS__': 'Adzuna::API::Response::Location', 'area': ['Deutschland']}",,https://www.adzuna.de/details/5408728914?utm_medium=api&utm_source=a4bcf954,2025-09-21T00:11:49Z,eyJhbGciOiJIUzI1NiJ9.eyJpIjoiNTQwODcyODkxNCIsInMiOiI0QlZGRXdTZDhCR0xZT053SFFHLW9BIn0.ptgsnoG8t1KMvxZLzR8xzk6w_utguTkCf-F79M6zYkE,part_time,,,
"Pflichtpraktikum in den Bereichen Wasserstoffcampus und energieorientiertes Data Science John-F.-Kennedy-Straße 43-53, 38228 Salzgitter, Deutschland Praktikant/in Robert Bosch Elektronik GmbH Unternehmensbeschreibung Bei Bosch gestalten wir Zukunft mit hochwertigen Technologien und Dienstleistungen, die Begeisterung wecken und das Leben der Menschen verbessern. Unser Versprechen an unsere Mitarbeiterinnen und Mitarbeiter steht dabei felsenfest: Wir wachsen gemeinsam, haben Freude an unserer Arb…",Adzuna::API::Response::Job,"{'__CLASS__': 'Adzuna::API::Response::Category', 'label': 'Unknown', 'tag': 'unknown'}",Pflichtpraktikum in den Bereichen Wasserstoffcampus und energieorientiertes Data Science,"{'__CLASS__': 'Adzuna::API::Response::Company', 'display_name': 'Robert Bosch Elektronik GmbH'}",52.13979,5399934247,0,"{'__CLASS__': 'Adzuna::API::Response::Location', 'display_name': 'Bruchmachtersen, Salzgitter', 'area': ['Deutschland', 'Niedersachsen', 'Salzgitter', 'Bruchmachtersen']}",10.31683,https://www.adzuna.de/details/5399934247?utm_medium=api&utm_source=a4bcf954,2025-09-15T06:42:17Z,eyJhbGciOiJIUzI1NiJ9.eyJzIjoiNEJWRkV3U2Q4QkdMWU9Od0hRRy1vQSIsImkiOiI1Mzk5OTM0MjQ3In0.giZH4WFAzG7CDGa8O828lnr_Q_BiGYnVl2rHNWC1pWQ,,,,contract
"Short Facts Join us on our journey: To drive the smart and sustainable energy future, we are looking for a Data Science Manager (d/f/m) to oversee strategic tech initiatives from development through to successful execution. Location: Munich, Germany Employment Type: Full-time Salary Range: € 115.000 - 135.000  competitive VSOP package Working Mode: In office setup Language Requirement: C1 Level English Your Responsibilities Lead, coach, and support a growing team of Data Scientists and Data Eng…",Adzuna::API::Response::Job,"{'__CLASS__': 'Adzuna::API::Response::Category', 'label': 'Unknown', 'tag': 'unknown'}",Data Science Manager (d/f/m),"{'__CLASS__': 'Adzuna::API::Response::Company', 'display_name': 'Entrix'}",48.1476,5408723740,0,"{'area': ['Deutschland', 'Bayern', 'München (Kreis)', 'München', 'Maxvorstadt'], '__CLASS__': 'Adzuna::API::Response::Location', 'display_name': 'Maxvorstadt, München'}",11.56803,https://www.adzuna.de/details/5408723740?utm_medium=api&utm_source=a4bcf954,2025-09-20T23:55:09Z,eyJhbGciOiJIUzI1NiJ9.eyJpIjoiNTQwODcyMzc0MCIsInMiOiI0QlZGRXdTZDhCR0xZT053SFFHLW9BIn0.XH8eUwrjzs7gS8eFnu2l56CvFJYR0u94UkBYZiGN4OI,full_time,135000.0,115000.0,
"Für unseren Standort in Stuttgart suchen wir zum nächstmöglichen Zeitpunkt eine:n Werkstudent:in im Bereich der Data Science. Hast Du Bock? Wir sind ein Technologieunternehmen, das die Bau- und Entsorgungsbranche deutschlandweit digitalisiert. Unser Ziel ist es, die Kreislaufwirtschaft in der Baubranche zu stärken und so einen Beitrag zur Nachhaltigkeit in diesem Sektor zu leisten. Dafür bieten wir eine unabhängige digitale Plattform für die Ver- und Entsorgung von mineralischen Baustoffen, die…",Adzuna::API::Response::Job,"{'label': 'Unknown', 'tag': 'unknown', '__CLASS__': 'Adzuna::API::Response::Category'}",Werkstudent:in Data Science (m/w/d),"{'display_name': 'Mineral Minds Karriere', '__CLASS__': 'Adzuna::API::Response::Company'}",,5367862279,0,"{'area': ['Deutschland'], 'display_name': 'Deutschland', '__CLASS__': 'Adzuna::API::Response::Location'}",,https://www.adzuna.de/details/5367862279?utm_medium=api&utm_source=a4bcf954,2025-08-25T22:47:23Z,eyJhbGciOiJIUzI1NiJ9.eyJpIjoiNTM2Nzg2MjI3OSIsInMiOiI0QlZGRXdTZDhCR0xZT053SFFHLW9BIn0.bAgERxxDuTjaqbU47wLkB6OQMRIig72GxmsgStK5HqU,,,,
"Responsibilities Die Softwareentwicklung ist einer der wichtigsten Bereiche bei Atruvia. Als Kompetenzzentrum für bankfachliche IT-Lösungen realisieren wir jedes Jahr über 200 Softwareprojekte, die unseren Kunden mehr Effizienz und Flexibilität im Kerngeschäft einbringen. Mit unseren smarten (analytischen) Lösungen erarbeiten wir gemeinsam mit unseren Kunden innovative Produkte - nach dem Motto “Wir machen das Leben leichter mit KI”. Aufgaben Du entwickelst maßgeschneiderte Data-Science und KI-…",Adzuna::API::Response::Job,"{'tag': 'unknown', 'label': 'Unknown', '__CLASS__': 'Adzuna::API::Response::Category'}",Duales Studium Data Science und Künstliche Intelligenz,"{'display_name': 'Atruvia', '__CLASS__': 'Adzuna::API::Response::Company'}",,5183863620,0,"{'display_name': 'Karlsruhe (Kreis), Baden-Württemberg', '__CLASS__': 'Adzuna::API::Response::Location', 'area': ['Deutschland', 'Baden-Württemberg', 'Karlsruhe (Kreis)']}",,https://www.adzuna.de/details/5183863620?utm_medium=api&utm_source=a4bcf954,2025-05-06T21:43:49Z,eyJhbGciOiJIUzI1NiJ9.eyJzIjoiNEJWRkV3U2Q4QkdMWU9Od0hRRy1vQSIsImkiOiI1MTgzODYzNjIwIn0.-mH-oyK_lP4N76-dsSuUXaIIN5j_5WlzHjYqqjpCSiw,,,,
"General Information Type of contract: Fixed-term contract, which may be extended subject to individual performance and organisational needs Who can apply?: EU nationals Salary: F/G (bracket 1 - step 1) full time monthly net salary: €5,743 plus benefits, for further information see Role specialisation: Data Science Working time: Full time Place of work: Frankfurt am Main, Germany Closing date: 30.09.2025 Your team You will be part of the Language Services Analytics Team in the Language Services …",Adzuna::API::Response::Job,"{'__CLASS__': 'Adzuna::API::Response::Category', 'tag': 'unknown', 'label': 'Unknown'}",Data Science Expert - Language Support & Innovation,"{'__CLASS__': 'Adzuna::API::Response::Company', 'display_name': 'European Central Bank'}",50.129683,5395847699,0,"{'area': ['Deutschland', 'Hessen', 'Frankfurt am Main'], '__CLASS__': 'Adzuna::API::Response::Location', 'display_name': 'Frankfurt am Main, Hessen'}",8.650578,https://www.adzuna.de/details/5395847699?utm_medium=api&utm_source=a4bcf954,2025-09-12T14:59:20Z,eyJhbGciOiJIUzI1NiJ9.eyJzIjoiNEJWRkV3U2Q4QkdMWU9Od0hRRy1vQSIsImkiOiI1Mzk1ODQ3Njk5In0.PcggcU09N_8ete3U3k8zbkuc9TQUtgJV2Lx3hhXOfa8,,,,
"Werkstudent für Data Science (m/w/d) Bremen, Deutschland — TKMS ATLAS ELEKTRONIK GmbH Vertragsart : Teilzeit , Befristet Einstiegslevel : Studienjob Home Office : Hybrid Einsatzbereich : Ingenieurwesen und Forschung Status : Laufende Rekrutierung, Eintrittsdatum flexibel Veröffentlichung : 27.08.2025 Stellen-ID : DE_RS_17188 Aufgaben Du beschäftigst Dich mit der Erstellung verschiedener Skripte, welche zur Unterstützung der Mitarbeitenden der TKMS ATLAS prozessual benötigt werden. Es sollen die…",Adzuna::API::Response::Job,"{'tag': 'unknown', 'label': 'Unknown', '__CLASS__': 'Adzuna::API::Response::Category'}",Werkstudent für Data Science (m/w/d),"{'display_name': 'TKMS ATLAS ELEKTRONIK GmbH', '__CLASS__': 'Adzuna::API::Response::Company'}",53.06422,5370542927,0,"{'area': ['Deutschland', 'Bremen', 'Hemelingen'], 'display_name': 'Hemelingen, Bremen', '__CLASS__': 'Adzuna::API::Response::Location'}",8.86949,https://www.adzuna.de/details/5370542927?utm_medium=api&utm_source=a4bcf954,2025-08-27T21:03:18Z,eyJhbGciOiJIUzI1NiJ9.eyJpIjoiNTM3MDU0MjkyNyIsInMiOiI0QlZGRXdTZDhCR0xZT053SFFHLW9BIn0.ntiUkD4-YW7iE9qSIEWgI5FUp8kZ5g18NsaJ7EV4DMY,,,,
"Einleitung Mit YEARS revolutionieren wir das Gesundheitssystem, indem wir den Schwerpunkt von reaktiver Behandlung auf proaktive Prävention verlagern. Über unser eigenes High End Health Center bieten wir Ganzkörperscreenings an, die von Ultraschall aller Organe, über hunderte Blutmarker bis zu Genetik und neurokognitiven Testungen reichen. Gleichzeitig errichten wir durch die standardisierte Daten- und Bioprobensammlung die Basis für unsere ambitionierten Vorhaben im Bereich der Altersforschung…",Adzuna::API::Response::Job,"{'tag': 'unknown', 'label': 'Unknown', '__CLASS__': 'Adzuna::API::Response::Category'}",Werkstudent (m/w/x) Data Science,"{'display_name': 'YEARS', '__CLASS__': 'Adzuna::API::Response::Company'}",52.51115,5418653405,0,"{'__CLASS__': 'Adzuna::API::Response::Location', 'display_name': 'Charlottenburg, Berlin', 'area': ['Deutschland', 'Berlin', 'Charlottenburg']}",13.30147,https://www.adzuna.de/details/5418653405?utm_medium=api&utm_source=a4bcf954,2025-09-28T04:09:34Z,eyJhbGciOiJIUzI1NiJ9.eyJzIjoiNEJWRkV3U2Q4QkdMWU9Od0hRRy1vQSIsImkiOiI1NDE4NjUzNDA1In0.bnSkudnTwD4aH8gEpILqfcfu52WxZcwigb2bhbgvFZw,part_time,20.0,18.0,
"General Information Type of contract: Traineeship Who can apply?: EU nationals eligible for our traineeship programme Grant: The trainee grant is €1,170 per month plus an accommodation allowance (see further information section) Working time: Full time Place of work: Frankfurt am Main, Germany Closing date: 26.09.2025 Your team You will be part of the Directorate General Statistics. Our Directorate General has over 300 staff working to strengthen Europe by supporting ECB decision-making with hi…",Adzuna::API::Response::Job,"{'__CLASS__': 'Adzuna::API::Response::Category', 'tag': 'unknown', 'label': 'Unknown'}",Traineeship in Statistics and Data Science - Inklusiver Job   ,"{'__CLASS__': 'Adzuna::API::Response::Company', 'display_name': 'European Central Bank'}",50.129683,5394106616,0,"{'area': ['Deutschland', 'Hessen', 'Frankfurt am Main'], '__CLASS__': 'Adzuna::API::Response::Location', 'display_name': 'Frankfurt am Main, Hessen'}",8.650578,https://www.adzuna.de/details/5394106616?utm_medium=api&utm_source=a4bcf954,2025-09-11T14:59:00Z,eyJhbGciOiJIUzI1NiJ9.eyJpIjoiNTM5NDEwNjYxNiIsInMiOiI0QlZGRXdTZDhCR0xZT053SFFHLW9BIn0.VyndwbnVIuKEni2Ft8zPSKZ2FmEH8lVmNk0ZyyDwB1M,,,,
"Eine gute Idee war der Ursprung, ein erfolgreiches Konzept ist das Ergebnis. Qualität zum guten Preis möglichst vielen Menschen anbieten zu können treibt uns an - mittlerweile weltweit, denn wir sind Lidl. Hier ist das berufliche Zuhause vielfältiger Talente. Ob im Einkauf, in der Logistik, im Warengeschäft oder in der IT; ob als Impulsgeber, Gestalter oder Dienstleister der Länder . click apply for full job details",Adzuna::API::Response::Job,"{'label': 'Stellen aus Handel & Bau', 'tag': 'trade-construction-jobs', '__CLASS__': 'Adzuna::API::Response::Category'}",Duales Studium Wirtschaftsinformatik - Data Science 2026,"{'display_name': 'Lidl Stiftung & Co. KG', '__CLASS__': 'Adzuna::API::Response::Company'}",49.18975,5418491490,0,"{'area': ['Deutschland', 'Baden-Württemberg', 'Heilbronn (Kreis)', 'Neckarsulm'], 'display_name': 'Neckarsulm, Heilbronn (Kreis)', '__CLASS__': 'Adzuna::API::Response::Location'}",9.2274,https://www.adzuna.de/details/5418491490?utm_medium=api&utm_source=a4bcf954,2025-09-28T00:36:01Z,eyJhbGciOiJIUzI1NiJ9.eyJzIjoiNEJWRkV3U2Q4QkdMWU9Od0hRRy1vQSIsImkiOiI1NDE4NDkxNDkwIn0.EGNjOrsCPNYiEPDTQetWBwklS8ngx9gWpwjdvcqZXtc,,,,
"Deine Aufgaben Duale Power für die digitale Zukunft: Entfalte dein Potential, indem du dir wirtschaftsinformatisches Fachwissen aneignest und gestalte aktiv den Bereich Logistik mit. … konkret heißt das: Dreijähriges duales Studium ab Herbst 2026 mit Wechsel zwischen der dreimonatigen Theoriephase an der DHBW Heilbronn und der Praxisphase bei der Lidl Stiftung Vermittlung von Methoden und Technologien der Informatik sowie Data Analysis, Big Data und Machine Learning an der DHBW im Vordergrund P…",Adzuna::API::Response::Job,"{'__CLASS__': 'Adzuna::API::Response::Category', 'label': 'Stellen aus Logistik & Lagerhaltung', 'tag': 'logistics-warehouse-jobs'}",Duales Studium Wirtschaftsinformatik - Data Science 2026,"{'display_name': 'Lidl Stiftung', '__CLASS__': 'Adzuna::API::Response::Company'}",49.18975,5374421813,0,"{'__CLASS__': 'Adzuna::API::Response::Location', 'display_name': 'Neckarsulm, Heilbronn (Kreis)', 'area': ['Deutschland', 'Baden-Württemberg', 'Heilbronn (Kreis)', 'Neckarsulm']}",9.2274,https://www.adzuna.de/details/5374421813?utm_medium=api&utm_source=a4bcf954,2025-08-29T23:47:41Z,eyJhbGciOiJIUzI1NiJ9.eyJpIjoiNTM3NDQyMTgxMyIsInMiOiI0QlZGRXdTZDhCR0xZT053SFFHLW9BIn0.0ELN9CrE2FKvUey8pdah5EvXgjkFf3RNVzAfOssaEwk,full_time,,,
"Du hast deine ersten Semester geschafft und möchtest Dein theoretisches Wissen nun gern in spannenden Praxisprojekten anwenden? Bei uns wirst Du direkt in die Mandats- und Projektarbeit mit eingebunden und schnupperst so echte Praxisluft in einem interessanten Aufgabengebiet. Knüpfe schon jetzt wertvolle Kontakte, die deinen späteren Einstieg in die Berufswelt deutlich erleichtern können. Für einen Zeitraum von 6 Monaten suchen wir Praktikant (W/M/D) Data Science & Artificial Intelligence in Be…",Adzuna::API::Response::Job,"{'label': 'Beraterstellen', 'tag': 'consultancy-jobs', '__CLASS__': 'Adzuna::API::Response::Category'}",Praktikant Data Science / Data Engineering im Bereich Risk Advisory Services,"{'__CLASS__': 'Adzuna::API::Response::Company', 'display_name': 'BRL Risk Consulting GmbH & Co. KG'}",51.46121,5398324658,0,"{'area': ['Deutschland', 'Nordrhein-Westfalen', 'Essen', 'Altendorf'], 'display_name': 'Altendorf, Essen', '__CLASS__': 'Adzuna::API::Response::Location'}",6.96735,https://www.adzuna.de/details/5398324658?utm_medium=api&utm_source=a4bcf954,2025-09-14T00:16:01Z,eyJhbGciOiJIUzI1NiJ9.eyJpIjoiNTM5ODMyNDY1OCIsInMiOiI0QlZGRXdTZDhCR0xZT053SFFHLW9BIn0.gbW5l_gKmhu-eBv1zXeMpPxGV1LuOiG8EuWZS2WmVpE,,,,
