description,__CLASS__,company,created,redirect_url,adref,location,category,id,title,salary_is_predicted,longitude,latitude,contract_time,contract_type,salary_max,salary_min
"Munich Data Science Institute (MDSI) Technische Universität MünchenTUM - Logo IT-Systemadministrator (m/w/d) am Munich Data Science Institute Das Munich Data Science Institute (MDSI) ist ein Integratives Forschungsinstitut an der Technischen Universität München (TUM). Es ist interdisziplinär und fachbereichsübergreifend in den Bereichen Data Science, Maschinelles Lernen und Künstliche Intelligenz ausgerichtet. Das Institut fungiert als Vermittler und Multiplikator modernster Data- Science-Prakt…",Adzuna::API::Response::Job,"{'__CLASS__': 'Adzuna::API::Response::Company', 'display_name': 'Technische Universität München '}",2025-05-28T10:19:42Z,https://www.adzuna.de/land/ad/5219667257?se=-jJl2tpN8BG_Ctxhj4VHjg&utm_medium=api&utm_source=a4bcf954&v=E236194466FA179F449B7CBBCBA6BF0A56215239,eyJhbGciOiJIUzI1NiJ9.eyJzIjoiLWpKbDJ0cE44QkdfQ3R4aGo0VkhqZyIsImkiOiI1MjE5NjY3MjU3In0.Q_K3GPv1cmdvc5l6wqYcjbtn5KG0S3yNkvHaCGlQQ9g,"{'display_name': 'Altstadt-Lehel, München', '__CLASS__': 'Adzuna::API::Response::Location', 'area': ['Deutschland', 'Bayern', 'München (Kreis)', 'München', 'Altstadt-Lehel']}","{'label': 'Lehrberufe', 'tag': 'teaching-jobs', '__CLASS__': 'Adzuna::API::Response::Category'}",5219667257,IT-Systemadministrator (m/w/d) am Munich Data Science Institute,0,11.56907,48.14093,,,,
In der Fakultät für Mathematik der RUB ist zum nächstmöglichen Zeitpunkt eine Universitätsprofessur W3 [m/w/d] für Mathematische Statistik und Data Science zu besetzen (vorzeitige Nachfolge Prof. Holger Dette). Die*der zukünftige Stelleninhaber*in soll in Forschung und Lehre das Fachgebiet Mathematische Statistik und Data Science vertreten. Bewerber*innen sollen sowohl in Forschung als auch in Lehre hervorragend qualifiziert sein. Ihr international sichtbares Forschungsprofil soll dabei vorhand…,Adzuna::API::Response::Job,"{'__CLASS__': 'Adzuna::API::Response::Company', 'display_name': 'Ruhr-Universität Bochum'}",2025-06-07T03:33:35Z,https://www.adzuna.de/land/ad/5237636034?se=-jJl2tpN8BG_Ctxhj4VHjg&utm_medium=api&utm_source=a4bcf954&v=4CFF414470129F180FB69DAA02AE0764119F36EF,eyJhbGciOiJIUzI1NiJ9.eyJzIjoiLWpKbDJ0cE44QkdfQ3R4aGo0VkhqZyIsImkiOiI1MjM3NjM2MDM0In0.lUXVMS9wCoxEvbsP_5M-deF7RH3_ipKUcjlEJ8gZjDg,"{'area': ['Deutschland'], '__CLASS__': 'Adzuna::API::Response::Location', 'display_name': 'Deutschland'}","{'label': 'Lehrberufe', 'tag': 'teaching-jobs', '__CLASS__': 'Adzuna::API::Response::Category'}",5237636034,Universitätsprofessur W3 (m/w/d) für Mathematische Statistik und Data Science,0,,,,,,
"Life is always about becoming… Im Leben geht es darum, sich auf eine Reise zu begeben, um die beste Version unseres zukünftigen Selbst zu werden. Während wir Neues entdecken, stellen wir uns Herausforderungen, meistern sie und wachsen über uns hinaus. Bewerben Sie sich bei Mercedes-Benz und finden Sie den Aufgabenbereich, in dem Sie Ihre Talente individuell entfalten können. Dabei werden Sie von visionären Kolleginnen und Kollegen unterstützt, die Ihren Pioniergeist teilen. Bei uns einzusteigen…",Adzuna::API::Response::Job,"{'__CLASS__': 'Adzuna::API::Response::Company', 'display_name': 'Mercedes-Benz AG'}",2025-04-12T06:57:42Z,https://www.adzuna.de/land/ad/5141701193?se=-jJl2tpN8BG_Ctxhj4VHjg&utm_medium=api&utm_source=a4bcf954&v=AC173C306678BFC9415C57CAF30C677C591D1C25,eyJhbGciOiJIUzI1NiJ9.eyJpIjoiNTE0MTcwMTE5MyIsInMiOiItakpsMnRwTjhCR19DdHhoajRWSGpnIn0.RSEhQC0W7Ntj9SJf5rhzs28e_QSYAg25g8Y9Wh5V00E,"{'area': ['Deutschland', 'Baden-Württemberg', 'Stuttgart'], '__CLASS__': 'Adzuna::API::Response::Location', 'display_name': 'Stuttgart, Baden-Württemberg'}","{'__CLASS__': 'Adzuna::API::Response::Category', 'label': 'Stellen aus Wissenschaft & Qualitätssicherung', 'tag': 'scientific-qa-jobs'}",5141701193,Senior Full-Stack Data Analytics/Data Science Expert im Competence Center Digital Accelerator (d/m/w/x),0,9.187224,48.776198,,,,
"BADER ist ein Multichannel-Distanzhändler mit über 95-jähriger Geschichte. Familiengeführt in dritter Generation gehört BADER zu den attraktivsten Arbeitgebern der Region. Eine Kultur des Miteinanders sichert den wirtschaftlichen Erfolg in einem Unternehmen mit flachen Hierarchien und kurzen Wegen. BADER wächst und entwickelt sich stetig weiter - deshalb freuen wir uns, wenn auch Du bald unser BADER-Team unterstützt. Hallo, wir sind die Abteilung Data Analytics! Wir bestehen aus fünfzehn Expert…",Adzuna::API::Response::Job,"{'__CLASS__': 'Adzuna::API::Response::Company', 'display_name': 'BRUNO BADER GmbH + Co. KG'}",2025-06-20T08:10:26Z,https://www.adzuna.de/land/ad/5259457374?se=-jJl2tpN8BG_Ctxhj4VHjg&utm_medium=api&utm_source=a4bcf954&v=F449AE42F99EA8E90BA3AEAC0964FCDC20A0E784,eyJhbGciOiJIUzI1NiJ9.eyJpIjoiNTI1OTQ1NzM3NCIsInMiOiItakpsMnRwTjhCR19DdHhoajRWSGpnIn0.iOcI5jGVmaMWZoM5yRdFHhRI_89bmvYfcubwm-M5RLI,"{'area': ['Deutschland', 'Baden-Württemberg', 'Pforzheim'], '__CLASS__': 'Adzuna::API::Response::Location', 'display_name': 'Pforzheim, Baden-Württemberg'}","{'tag': 'it-jobs', 'label': 'IT-Stellen', '__CLASS__': 'Adzuna::API::Response::Category'}",5259457374,(Senior) Machine Learning Engineer / AI Developer (m/w/d),0,8.697363,48.883606,,,,
"""Caring for People's Health as a Trusted Partner"" - This mission motivates us at STADA every day to improve the health of people worldwide. With our wide range of generics, consumer health products and specialty pharmaceuticals, we offer patients, doctors and pharmacists a wide range of therapeutic options. Around 11,700 employees live our values of Integrity, Entrepreneurship, Agility and One STADA. Together we are on an exciting growth journey and want to successfully shape the future of STAD…",Adzuna::API::Response::Job,"{'__CLASS__': 'Adzuna::API::Response::Company', 'display_name': 'STADA Arzneimittel AG'}",2025-03-26T14:16:31Z,https://www.adzuna.de/land/ad/5112144320?se=-jJl2tpN8BG_Ctxhj4VHjg&utm_medium=api&utm_source=a4bcf954&v=63CA97FBE983C0B16427AEFB5B0184434AF4A3DF,eyJhbGciOiJIUzI1NiJ9.eyJpIjoiNTExMjE0NDMyMCIsInMiOiItakpsMnRwTjhCR19DdHhoajRWSGpnIn0.wJb37IUL8iwGYFRoh-5sgmOjcYHaDXFbx87ynE_Aikk,"{'area': ['Deutschland', 'Hessen', 'Wetteraukreis', 'Bad Vilbel'], '__CLASS__': 'Adzuna::API::Response::Location', 'display_name': 'Bad Vilbel, Wetteraukreis'}","{'__CLASS__': 'Adzuna::API::Response::Category', 'tag': 'unknown', 'label': 'Unknown'}",5112144320,Senior Business Analyst AI / Data Science (f/m/d),0,8.73553,50.17809,full_time,,,
"Digitale Trans­formation. Nach­haltig­keit. Friedens­sicherung. Spannende Aufgaben, an denen auch wir bei Diehl in unseren fünf Teil­konzernen Metall, Controls, Defence, Aviation und Metering und unsere über 16.000 Mit­arbeiter­innen und Mit­arbeiter mit Hochdruck arbeiten. Entdecke faszinierende Techno­logien und bewirb dich. In einem von Vertrauen und Mut geprägten Familien­unter­nehmen, das beständig und stabil ist – aus Tradition. Für unseren Standort Diehl Defence GmbH & Co. KG in Röthenba…",Adzuna::API::Response::Job,"{'display_name': 'Diehl Defence GmbH & Co. KG', '__CLASS__': 'Adzuna::API::Response::Company'}",2025-06-13T19:16:06Z,https://www.adzuna.de/land/ad/5248888764?se=-jJl2tpN8BG_Ctxhj4VHjg&utm_medium=api&utm_source=a4bcf954&v=2D9AA6F6BDFAF69DC1317C5678F35DB50DE1C2EC,eyJhbGciOiJIUzI1NiJ9.eyJpIjoiNTI0ODg4ODc2NCIsInMiOiItakpsMnRwTjhCR19DdHhoajRWSGpnIn0.DomZr0xrvLTGYpJMGFF0f02iLvBTr1_-ktEf5zYOxIM,"{'display_name': 'Deutschland', 'area': ['Deutschland'], '__CLASS__': 'Adzuna::API::Response::Location'}","{'label': 'Sonstige/Allgemeine Stellen', 'tag': 'other-general-jobs', '__CLASS__': 'Adzuna::API::Response::Category'}",5248888764,Praktikant (m/w/d) Data Science,0,,,,,,
"Du willst mehr als Uni und möchtest erste Berufseinblicke und Kontakte knüpfen? Dann bist du hier richtig! Als Werkstudent oder Praktikant bei Kaufland gehörst du von Beginn an zu einem starken Team und kannst zeigen, was in dir steckt. Werde auch du Teil von teamkaufland! Wir zählen auf dich: Du unterstützt unser Team bei der Bearbeitung unserer Analytics Use Cases entlang der gesamten Wertschöpfungskette bei Kaufland. Vielfältige Aufgaben? Na klar: Lerne unsere Projekte und Arbeitsweisen währ…",Adzuna::API::Response::Job,"{'display_name': 'Kaufland', '__CLASS__': 'Adzuna::API::Response::Company'}",2025-05-28T23:29:42Z,https://www.adzuna.de/land/ad/5220848102?se=-jJl2tpN8BG_Ctxhj4VHjg&utm_medium=api&utm_source=a4bcf954&v=A2C99B734B74A77FD100FB820C61753D8F5A4C1B,eyJhbGciOiJIUzI1NiJ9.eyJpIjoiNTIyMDg0ODEwMiIsInMiOiItakpsMnRwTjhCR19DdHhoajRWSGpnIn0.mmCfMwZH6-EaQL7KXnoUZ6W_IKpVAPFDSk_phBKajMg,"{'display_name': 'Heilbronn, Heilbronn (Kreis)', 'area': ['Deutschland', 'Baden-Württemberg', 'Heilbronn (Kreis)', 'Heilbronn'], '__CLASS__': 'Adzuna::API::Response::Location'}","{'label': 'Sonstige/Allgemeine Stellen', 'tag': 'other-general-jobs', '__CLASS__': 'Adzuna::API::Response::Category'}",5220848102,Praktikant Data Science (m/w/d),0,9.209895,49.142335,,,,
"Bei itmX fokussieren wir uns auf die Geschäftsprozesse in den Bereichen Marketing, Vertrieb, Service und Commerce unter Verwendung der Microsoft Power Platform, Microsoft 365, SAP ERP und unser eigenem Produkt der itmX crm suite. Unser Ziel ist es dabei Microsoft und SAP bestmöglich prozessual sowie funktional zu verbinden. Tätigkeiten Analyse von Geschäftsprozessen und Identifikation von Optimierungspotenzialen durch den Einsatz von KI für Digitalisierungsprojekte Beratung und Unterstützung un…",Adzuna::API::Response::Job,"{'display_name': 'itmX GmbH', '__CLASS__': 'Adzuna::API::Response::Company'}",2025-06-10T15:09:46Z,https://www.adzuna.de/land/ad/5242666727?se=-jJl2tpN8BG_Ctxhj4VHjg&utm_medium=api&utm_source=a4bcf954&v=147489E0C114572F20B779A0150473CCB2323FEE,eyJhbGciOiJIUzI1NiJ9.eyJzIjoiLWpKbDJ0cE44QkdfQ3R4aGo0VkhqZyIsImkiOiI1MjQyNjY2NzI3In0._NY_fxu3Od6qBSVcsSGCc8fBpZhNr98-SdgH6Gklvac,"{'area': ['Deutschland', 'Baden-Württemberg', 'Pforzheim', 'Brötzingen'], '__CLASS__': 'Adzuna::API::Response::Location', 'display_name': 'Brötzingen, Pforzheim'}","{'tag': 'scientific-qa-jobs', 'label': 'Stellen aus Wissenschaft & Qualitätssicherung', '__CLASS__': 'Adzuna::API::Response::Category'}",5242666727,KI/ Data Science Consultant (Mensch ),0,8.66796,48.88901,,,,
"Das Deutsche Register für hämatopoetische Stammzelltransplantation und Zelltherapie e. V. (DRST) ist die nationale Dokumentationszentrale für die Erfassung klinischer Basisdaten aller in Deutschland durchgeführten Blutstammzelltransplantationen und Zelltherapien. Dieser Datenbestand bildet die Grundlage für zahlreiche nationale und internationale klinische Studien. Das DRST unterstützt so die Forschung dabei, Therapien für schwerkranke Patienten zu entwickeln und zu optimieren. Zur Verstärkung …",Adzuna::API::Response::Job,"{'__CLASS__': 'Adzuna::API::Response::Company', 'display_name': 'Deutsches Register für hämatopoetische Stammzelltransplantation und Zelltherapie e.V.'}",2025-06-18T15:49:29Z,https://www.adzuna.de/land/ad/5256373670?se=-jJl2tpN8BG_Ctxhj4VHjg&utm_medium=api&utm_source=a4bcf954&v=56B8DB5DB86ADAC325F7A94708BDAB89D6790885,eyJhbGciOiJIUzI1NiJ9.eyJpIjoiNTI1NjM3MzY3MCIsInMiOiItakpsMnRwTjhCR19DdHhoajRWSGpnIn0.J7I_SuclEcxQ5tY4YRtNKV-6DjK97cLD8rAbRX18AO8,"{'display_name': 'Ulm, Baden-Württemberg', 'area': ['Deutschland', 'Baden-Württemberg', 'Ulm'], '__CLASS__': 'Adzuna::API::Response::Location'}","{'label': 'Unknown', 'tag': 'unknown', '__CLASS__': 'Adzuna::API::Response::Category'}",5256373670,Mitarbeiter (m/w/d) Medizinische Dokumentation / Datenmanagement / Data Science in der Medizin,0,9.856945,48.383137,,,,
"Aufgaben Wie mutig sind Sie? Als Hochtechnologieunternehmen für Werkzeugmaschinen und Lasertechnik suchen wir Menschen, die sich neuen Herausforderungen mit frischem Denken und tatkräftigem Handeln stellen. Dafür ermöglichen wir Ihnen die Freiräume, mutige Ideen in unserem Familienunternehmen einzubringen. Gemeinsam mit Ihnen wollen wir die digitale Vernetzung der fertigenden Industrie vorantreiben. Unsere Leidenschaft und der Gestaltungswille machen uns dabei zum Garanten für Innovationskraft …",Adzuna::API::Response::Job,"{'__CLASS__': 'Adzuna::API::Response::Company', 'display_name': 'TRUMPF SE + Co. KG'}",2025-06-18T20:13:19Z,https://www.adzuna.de/land/ad/5256790060?se=-jJl2tpN8BG_Ctxhj4VHjg&utm_medium=api&utm_source=a4bcf954&v=347CF8D7A495C7B8F70C5638988AE1C7E4F1127E,eyJhbGciOiJIUzI1NiJ9.eyJzIjoiLWpKbDJ0cE44QkdfQ3R4aGo0VkhqZyIsImkiOiI1MjU2NzkwMDYwIn0.Kc4hRej-fy-qaii1Gi-MIELfBaNL5-k8DTnTafENpkQ,"{'display_name': 'Ditzingen, Ludwigsburg (Kreis)', 'area': ['Deutschland', 'Baden-Württemberg', 'Ludwigsburg (Kreis)', 'Ditzingen'], '__CLASS__': 'Adzuna::API::Response::Location'}","{'__CLASS__': 'Adzuna::API::Response::Category', 'label': 'IT-Stellen', 'tag': 'it-jobs'}",5256790060,Duales Studium Bachelor of Science (B. Sc.) (w/m/d)- Wirtschaftsinformatik - 2026,0,9.06857,48.82434,,,,
"Munich Data Science Institute (MDSI) Technische Universität MünchenTUM - Logo IT Systems Administrator (m/f/d) at Munich Data Science Institute The Munich Data Science Institute (MDSI) is an integrative research institute at the Technical University of Munich (TUM). It is interdisciplinary and cross-departmental in the fields of data science, machine learning, and artificial intelligence. The institute acts as a facilitator and multiplier of state-of-the-art data science practices, technologies…",Adzuna::API::Response::Job,"{'display_name': 'Technische Universität München ', '__CLASS__': 'Adzuna::API::Response::Company'}",2025-05-28T10:19:40Z,https://www.adzuna.de/land/ad/5219667241?se=-jJl2tpN8BG_Ctxhj4VHjg&utm_medium=api&utm_source=a4bcf954&v=40EC2F27474CCBE942D7A1AB60E02B2BB5C05FDA,eyJhbGciOiJIUzI1NiJ9.eyJpIjoiNTIxOTY2NzI0MSIsInMiOiItakpsMnRwTjhCR19DdHhoajRWSGpnIn0.DLJfTThwtPJ1Yj6KhEhZn_asFJ_S9kHzZzpXAxdrsi8,"{'area': ['Deutschland', 'Bayern', 'München (Kreis)', 'München', 'Altstadt-Lehel'], '__CLASS__': 'Adzuna::API::Response::Location', 'display_name': 'Altstadt-Lehel, München'}","{'__CLASS__': 'Adzuna::API::Response::Category', 'label': 'Lehrberufe', 'tag': 'teaching-jobs'}",5219667241,IT Systems Administrator (m/f/d) at Munich Data Science Institute,0,11.56907,48.14093,,,,
"Die Sparkassen Rating und Risikosysteme (SR) ist der zentrale Dienstleister für Verfahren des Risiko­manage­ments in der Sparkassen-Finanzgruppe. Wir unterstützen die Institute mit Standardlösungen in den Bereichen der Risiko­messung und -steuerung, der regulatorischen Banksteuerung sowie im Vertrieb mit Data-Analytics-Lösungen. Gemeinsam mit unseren Partnern bieten wir den Instituten, von der Konzeption der Verfahren, über deren Weiterentwicklung, IT-Umsetzung und Umsetzungsunterstützung, zent…",Adzuna::API::Response::Job,"{'display_name': 'Sparkassen Rating und Risikosysteme GmbH', '__CLASS__': 'Adzuna::API::Response::Company'}",2025-06-04T01:37:41Z,https://www.adzuna.de/land/ad/5231508793?se=-jJl2tpN8BG_Ctxhj4VHjg&utm_medium=api&utm_source=a4bcf954&v=01D1B373582988AA7B7A2329D39248E93DB969B8,eyJhbGciOiJIUzI1NiJ9.eyJzIjoiLWpKbDJ0cE44QkdfQ3R4aGo0VkhqZyIsImkiOiI1MjMxNTA4NzkzIn0.5OpADDWG1p2fxK4P5m5T5u0jh43Kmxu-rg8lLlD24cI,"{'display_name': 'Berlin, Deutschland', 'area': ['Deutschland', 'Berlin'], '__CLASS__': 'Adzuna::API::Response::Location'}","{'__CLASS__': 'Adzuna::API::Response::Category', 'label': 'Sonstige/Allgemeine Stellen', 'tag': 'other-general-jobs'}",5231508793,Werkstudent (m/w/d) – Risikomanagement | Data Science,0,13.420806,52.507706,,,,
"Life is always about becoming… Im Leben geht es darum, sich auf eine Reise zu begeben, um die beste Version unseres zukünftigen Selbst zu werden. Während wir Neues entdecken, stellen wir uns Herausforderungen, meistern sie und wachsen über uns hinaus. Bewerben Sie sich bei Mercedes-Benz und finden Sie den Aufgabenbereich, in dem Sie Ihre Talente individuell entfalten können. Dabei werden Sie von visionären Kolleginnen und Kollegen unterstützt, die Ihren Pioniergeist teilen. Bei uns einzusteigen…",Adzuna::API::Response::Job,"{'display_name': 'Mercedes-Benz Group AG', '__CLASS__': 'Adzuna::API::Response::Company'}",2025-06-18T02:25:02Z,https://www.adzuna.de/land/ad/5255547100?se=-jJl2tpN8BG_Ctxhj4VHjg&utm_medium=api&utm_source=a4bcf954&v=6A3165EA6EE78B3EAD88E052C6452E1B0B1CC8EB,eyJhbGciOiJIUzI1NiJ9.eyJpIjoiNTI1NTU0NzEwMCIsInMiOiItakpsMnRwTjhCR19DdHhoajRWSGpnIn0._m1WAOI2PhHym4SKiusE1pB3BB1NxUEJvDFeuyS0izw,"{'__CLASS__': 'Adzuna::API::Response::Location', 'area': ['Deutschland', 'Baden-Württemberg', 'Stuttgart'], 'display_name': 'Stuttgart, Baden-Württemberg'}","{'label': 'Sonstige/Allgemeine Stellen', 'tag': 'other-general-jobs', '__CLASS__': 'Adzuna::API::Response::Category'}",5255547100,Praktikant*in Data Analytics/Data Science (Pflicht-Praktikum),0,9.187224,48.776198,,,,
"Siegwerk is one of the world's leading suppliers of Printing Inks and sustainable packaging solutions. A career here will give you significant flexibility and support in a company focused on making a positive impact in the world. Siegwerk is poised to disrupt the global packaging industry; changing the way packaging is produced and consumed for the benefit of us all. At Siegwerk, you will have everything you need to help make that change. Join us, let's Do it. With Heart. Location: Alfred-Kelle…",Adzuna::API::Response::Job,"{'__CLASS__': 'Adzuna::API::Response::Company', 'display_name': 'Siegwerk Druckfarben AG & Co. KGaA'}",2025-06-14T01:31:41Z,https://www.adzuna.de/land/ad/5249526023?se=-jJl2tpN8BG_Ctxhj4VHjg&utm_medium=api&utm_source=a4bcf954&v=AE08D23AACCFC1FDA0C1F99078BB161D3C4044C8,eyJhbGciOiJIUzI1NiJ9.eyJzIjoiLWpKbDJ0cE44QkdfQ3R4aGo0VkhqZyIsImkiOiI1MjQ5NTI2MDIzIn0.-u1zmFwYp2wowO4wIDI9tQDzqxU0iZtmaubYQ2JGnjk,"{'display_name': 'Siegburg, Rhein-Sieg-Kreis', 'area': ['Deutschland', 'Nordrhein-Westfalen', 'Rhein-Sieg-Kreis', 'Siegburg'], '__CLASS__': 'Adzuna::API::Response::Location'}","{'label': 'Sonstige/Allgemeine Stellen', 'tag': 'other-general-jobs', '__CLASS__': 'Adzuna::API::Response::Category'}",5249526023,Working Student Data Science (f/m/d),0,7.20803,50.79877,,,,
"„Besser Studieren“ ist das gelebte Motto der Jade Hochschule. In über 60 innovativen Studiengängen an den Studienorten Wilhelms­haven, Oldenburg und Elsfleth bilden wir über 6.000 Studierende wissenschaftlich und praxisnah aus. Über 170 Professorinnen und Professoren sowie ca. 400 Mitarbeitende engagieren sich im Sinne des Leitbildes unserer Hochschule: innovativ, kompetent, kooperativ, vielfältig und zugewandt. Die Gewinnung qualifizierter Beschäftigter ist dabei eine zentrale Voraussetzung fü…",Adzuna::API::Response::Job,"{'display_name': 'Jade Hochschule Wilhelmshaven/Oldenburg/Elsfleth', '__CLASS__': 'Adzuna::API::Response::Company'}",2025-06-17T20:17:50Z,https://www.adzuna.de/land/ad/5255172935?se=-jJl2tpN8BG_Ctxhj4VHjg&utm_medium=api&utm_source=a4bcf954&v=AD6004D32BCA355BF22BAF0B32BC0457F67FED8D,eyJhbGciOiJIUzI1NiJ9.eyJpIjoiNTI1NTE3MjkzNSIsInMiOiItakpsMnRwTjhCR19DdHhoajRWSGpnIn0.EiUpRIE-9aA_9E__hDL2WRcu8hiiZbsss70FZq1A_CU,"{'display_name': 'Oldenburg, Oldenburg (Kreis)', 'area': ['Deutschland', 'Niedersachsen', 'Oldenburg (Kreis)', 'Oldenburg'], '__CLASS__': 'Adzuna::API::Response::Location'}","{'label': 'Beraterstellen', 'tag': 'consultancy-jobs', '__CLASS__': 'Adzuna::API::Response::Category'}",5255172935,Wissenschaftliche_r Mitarbeiter_in (w/m/d) im Projekt EIKO‑Bau („Effiziente Systeme und KI‑basierte Methoden zur Optimierung von Beschleunigungspotenzialen in der Vorhaben­zulassung“),0,8.218802,53.147169,,,,
"Life is always about becoming… Im Leben geht es darum, sich auf eine Reise zu begeben, um die beste Version unseres zukünftigen Selbst zu werden. Während wir Neues entdecken, stellen wir uns Herausforderungen, meistern sie und wachsen über uns hinaus. Bewerben Sie sich bei Mercedes-Benz und finden Sie den Aufgabenbereich, in dem Sie Ihre Talente individuell entfalten können. Dabei werden Sie von visionären Kolleginnen und Kollegen unterstützt, die Ihren Pioniergeist teilen. Bei uns einzusteigen…",Adzuna::API::Response::Job,"{'display_name': 'Mercedes-Benz AG', '__CLASS__': 'Adzuna::API::Response::Company'}",2025-06-01T07:45:53Z,https://www.adzuna.de/land/ad/5225839511?se=-jJl2tpN8BG_Ctxhj4VHjg&utm_medium=api&utm_source=a4bcf954&v=BD0FD0B6C0715A0AF372DDD97DDBAA3545C72B77,eyJhbGciOiJIUzI1NiJ9.eyJzIjoiLWpKbDJ0cE44QkdfQ3R4aGo0VkhqZyIsImkiOiI1MjI1ODM5NTExIn0.AGc_prQETxhBQvQwIIkLVWvTPJeUhMKvUJsOtJT0sFQ,"{'display_name': 'Sindelfingen, Böblingen (Kreis)', 'area': ['Deutschland', 'Baden-Württemberg', 'Böblingen (Kreis)', 'Sindelfingen'], '__CLASS__': 'Adzuna::API::Response::Location'}","{'__CLASS__': 'Adzuna::API::Response::Category', 'label': 'Sonstige/Allgemeine Stellen', 'tag': 'other-general-jobs'}",5225839511,Student*in für Abschlussarbeit HV-Technologie & Kontaktierung,0,9.026231,48.720071,,,,
"Werkstudent Aktuariat Leben / Data Science (m/w/d) Risikoschutz, Vorsorge, Kunst, Oldtimer: Wir sind in den unterschiedlichsten Versicherungssparten top aufgestellt. Immer nah am Menschen, persönlich und digital. Unser Team führt Tradition und Moderne zusammen – mit höchster Servicequalität und am liebsten mit dir als Verstärkung. Wir freuen uns auf deine Bewerbung – &Los. Als Werkstudent (m/w/d) durch die Auswertung sowie Analyse versicherungstechnischer Daten fundierte Entscheidungsgrundlagen…",Adzuna::API::Response::Job,"{'display_name': 'Helvetia Schweizerische Versicherungsgesellschaft AG', '__CLASS__': 'Adzuna::API::Response::Company'}",2025-06-18T02:17:03Z,https://www.adzuna.de/land/ad/5255537281?se=-jJl2tpN8BG_Ctxhj4VHjg&utm_medium=api&utm_source=a4bcf954&v=D34D7D2315A666886B5706DDF702BBDFDEF79461,eyJhbGciOiJIUzI1NiJ9.eyJpIjoiNTI1NTUzNzI4MSIsInMiOiItakpsMnRwTjhCR19DdHhoajRWSGpnIn0.Nh0FvC2d7SpEq4MS6rTJmUFLU0aofsAFEvS2KB9aIdg,"{'__CLASS__': 'Adzuna::API::Response::Location', 'area': ['Deutschland', 'Hessen', 'Frankfurt am Main', 'Altstadt'], 'display_name': 'Altstadt, Frankfurt am Main'}","{'tag': 'other-general-jobs', 'label': 'Sonstige/Allgemeine Stellen', '__CLASS__': 'Adzuna::API::Response::Category'}",5255537281,Werkstudent Aktuariat Leben / Data Science (m/w/d),0,8.68432,50.11218,,,,
Universitätsklinikum Carl Gustav Carus Dresden Wissenschaftliche*r Mitarbeiter*in (m/w/d) Data Science in der Krebsforschung in der Medizinischen Klinik und Poliklinik I Die Stelle ist zum nächstmöglichen Zeitpunkt in Voll- und Teilzeit für zunächst 24 Monate befristet zu besetzen. Die Vergütung erfolgt nach den Eingruppierungsvorschriften des Tarifvertrages für den öffentlichen Dienst der Länder (TV-L) und ist bei Vorliegen der persönlichen Voraussetzungen in die Entgeltgruppe E13 möglich. Sie…,Adzuna::API::Response::Job,"{'__CLASS__': 'Adzuna::API::Response::Company', 'display_name': 'Universitätsklinikum Carl Gustav Carus Dresden'}",2025-06-14T01:50:46Z,https://www.adzuna.de/land/ad/5249542330?se=-jJl2tpN8BG_Ctxhj4VHjg&utm_medium=api&utm_source=a4bcf954&v=21CCF9CAD118337564756CD9568AFF9123330454,eyJhbGciOiJIUzI1NiJ9.eyJzIjoiLWpKbDJ0cE44QkdfQ3R4aGo0VkhqZyIsImkiOiI1MjQ5NTQyMzMwIn0.rKNFmZgCaIGrGvxwmf4jZqZC0g3UKB-XM5Kj0G4L2Qw,"{'area': ['Deutschland', 'Sachsen', 'Dresden'], '__CLASS__': 'Adzuna::API::Response::Location', 'display_name': 'Dresden, Sachsen'}","{'__CLASS__': 'Adzuna::API::Response::Category', 'label': 'Sonstige/Allgemeine Stellen', 'tag': 'other-general-jobs'}",5249542330,Wissenschaftliche*r Mitarbeiter*in (m/w/d) Data Science,0,13.756452,51.052725,,,,
"Du arbeitest gerne im Team? Du bist interessiert an innovativen Technologien? Du möchtest Verantwortung übernehmen und etwas bewegen? Dann bieten wir dir bei Kuraray den richtigen Rahmen für die Entfaltung deiner Persönlichkeit. Als weltweit tätiges, dynamisch wachsendes Unternehmen der Spezialchemie mit japanischen Wurzeln zählen wir zu den größten Anbietern von Polymeren und synthetischen Mikrofasern und sind international führend in der Entwicklung und Anwendung innovativer Hochleistungsmate…",Adzuna::API::Response::Job,"{'display_name': 'Kuraray Europe GmbH', '__CLASS__': 'Adzuna::API::Response::Company'}",2025-06-16T20:06:45Z,https://www.adzuna.de/land/ad/5253438961?se=-jJl2tpN8BG_Ctxhj4VHjg&utm_medium=api&utm_source=a4bcf954&v=DC51350BB64050FEC7FE63AA3D3FD34F164357AD,eyJhbGciOiJIUzI1NiJ9.eyJzIjoiLWpKbDJ0cE44QkdfQ3R4aGo0VkhqZyIsImkiOiI1MjUzNDM4OTYxIn0.LiGjdZIDOFjP5iBNsX5_EKfX5jk7vexZ_Hai87byx4U,"{'display_name': 'Hattersheim am Main, Main-Taunus-Kreis', 'area': ['Deutschland', 'Hessen', 'Main-Taunus-Kreis', 'Hattersheim am Main'], '__CLASS__': 'Adzuna::API::Response::Location'}","{'tag': 'consultancy-jobs', 'label': 'Beraterstellen', '__CLASS__': 'Adzuna::API::Response::Category'}",5253438961,Senior Manager Decision Intelligence (m/w/d),0,8.48668,50.06929,,,,
