created,description,adref,company,salary_is_predicted,redirect_url,__CLASS__,latitude,title,location,category,longitude,id,contract_time,salary_max,salary_min,contract_type
2026-01-23T22:09:26Z,"Manager Data Science (m/f/d) In Germany - Berlin| Bonn | Cologne | Frankfurt/Main | Hamburg | Munich Helpbusinesses make informed decisions and drive growth by transforming raw datainto actionable insights. Ready to boost your personal development in datascience, analytics, and AI? Become a pioneer of the digital transformation andsupport us as a Manager in Data Science-focused consulting. What makes us special: Advance your career with exciting professional opportunities in our thriving compan…",eyJhbGciOiJIUzI1NiJ9.eyJpIjoiNTU5Nzg3ODM4MSIsInMiOiI4a0owLW9mNjhCR1FYNGxlOFNPekZBIn0.aiqIQQQWLd2MjTNDaNeczWHYyJx2pYyxp958Ixz7N5U,"{'display_name': 'Simon-Kucher & Partners', '__CLASS__': 'Adzuna::API::Response::Company'}",0,https://www.adzuna.de/details/5597878381?utm_medium=api&utm_source=a4bcf954,Adzuna::API::Response::Job,,Manager Data Science (m/f/d),"{'__CLASS__': 'Adzuna::API::Response::Location', 'area': ['Deutschland', 'Bayern', 'München (Kreis)', 'München'], 'display_name': 'München, München (Kreis)'}","{'__CLASS__': 'Adzuna::API::Response::Category', 'label': 'Unknown', 'tag': 'unknown'}",,5597878381,,,,
2026-01-23T22:09:26Z,"Manager Data Science (m/f/d) In Germany - Berlin| Bonn | Cologne | Frankfurt/Main | Hamburg | Munich Helpbusinesses make informed decisions and drive growth by transforming raw datainto actionable insights. Ready to boost your personal development in datascience, analytics, and AI? Become a pioneer of the digital transformation andsupport us as a Manager in Data Science-focused consulting. What makes us special: Advance your career with exciting professional opportunities in our thriving compan…",eyJhbGciOiJIUzI1NiJ9.eyJpIjoiNTU5Nzg3ODM3OSIsInMiOiI4a0owLW9mNjhCR1FYNGxlOFNPekZBIn0.bBnu0yJPJDy_5CMrtyeGR2Sd39-y7WtSPkrTVsccPb4,"{'display_name': 'Simon-Kucher & Partners', '__CLASS__': 'Adzuna::API::Response::Company'}",0,https://www.adzuna.de/details/5597878379?utm_medium=api&utm_source=a4bcf954,Adzuna::API::Response::Job,50.71942,Manager Data Science (m/f/d),"{'__CLASS__': 'Adzuna::API::Response::Location', 'display_name': 'Bonn, Nordrhein-Westfalen', 'area': ['Deutschland', 'Nordrhein-Westfalen', 'Bonn']}","{'__CLASS__': 'Adzuna::API::Response::Category', 'label': 'Unknown', 'tag': 'unknown'}",7.112412,5597878379,,,,
2026-01-09T21:06:00Z,"Manager Data Science (m/f/d) In Germany - Berlin| Bonn | Cologne | Frankfurt/Main | Hamburg | Munich Helpbusinesses make informed decisions and drive growth by transforming raw datainto actionable insights. Ready to boost your personal development in datascience, analytics, and AI? Become a pioneer of the digital transformation andsupport us as a Manager in Data Science-focused consulting. What makes us special: Advance your career with exciting professional opportunities in our thriving compan…",eyJhbGciOiJIUzI1NiJ9.eyJzIjoiOGtKMC1vZjY4QkdRWDRsZThTT3pGQSIsImkiOiI1NTc2NzE5Nzg2In0.1LWsfjf93VsezIFsYvvE3-UHq78Q-Q5LdHBvzT-U8oE,"{'__CLASS__': 'Adzuna::API::Response::Company', 'display_name': 'Simon-Kucher & Partners'}",0,https://www.adzuna.de/details/5576719786?utm_medium=api&utm_source=a4bcf954,Adzuna::API::Response::Job,,Manager Data Science (m/f/d),"{'area': ['Deutschland', 'Hessen', 'Main-Taunus-Kreis', 'Eschborn'], 'display_name': 'Eschborn, Main-Taunus-Kreis', '__CLASS__': 'Adzuna::API::Response::Location'}","{'__CLASS__': 'Adzuna::API::Response::Category', 'label': 'Unknown', 'tag': 'unknown'}",,5576719786,,,,
2025-12-25T20:49:29Z,"Manager Data Science (m/f/d) In Germany - Berlin| Bonn | Cologne | Frankfurt/Main | Hamburg | Munich Helpbusinesses make informed decisions and drive growth by transforming raw datainto actionable insights. Ready to boost your personal development in datascience, analytics, and AI? Become a pioneer of the digital transformation andsupport us as a Manager in Data Science-focused consulting. What makes us special: Advance your career with exciting professional opportunities in our thriving compan…",eyJhbGciOiJIUzI1NiJ9.eyJzIjoiOGtKMC1vZjY4QkdRWDRsZThTT3pGQSIsImkiOiI1NTU1ODAxNzQyIn0.l4oPIZz_tB8uh6BJjRgnEhDfxBcxcnp77kpFA8qiMMk,"{'__CLASS__': 'Adzuna::API::Response::Company', 'display_name': 'Simon-Kucher & Partners'}",0,https://www.adzuna.de/details/5555801742?utm_medium=api&utm_source=a4bcf954,Adzuna::API::Response::Job,53.557429,Manager Data Science (m/f/d),"{'display_name': 'Hamburg, Deutschland', 'area': ['Deutschland', 'Hamburg'], '__CLASS__': 'Adzuna::API::Response::Location'}","{'label': 'Unknown', '__CLASS__': 'Adzuna::API::Response::Category', 'tag': 'unknown'}",9.987297,5555801742,,,,
2025-10-30T11:48:56Z,"Entdecke die Welt der elektronischen Bauelemente! Starte als Teamplayer bei Rutronik! Die Welt der Elektronik ist unser Zuhause. Als eines der weltweit führenden Unternehmen für den Vertrieb elektronischer Bauteile mit mehr als 1.900 Mitarbeitern an über 82 Standorten rund um den Globus suchen wir laufend Verstärkung. Entdecke jetzt die Perspektiven und Chancen, die dir dein Job bei Rutronik bietet und werde Teil unseres Erfolges! Duales Studium Data Science & KI - 2026 Bachelor of Science | DH…",eyJhbGciOiJIUzI1NiJ9.eyJpIjoiNTQ3MDgzNjk1NCIsInMiOiI4a0owLW9mNjhCR1FYNGxlOFNPekZBIn0.tMARmjwONiBwCRVK-x5CEJR3VL03ChQXVEKldEO11uY,"{'__CLASS__': 'Adzuna::API::Response::Company', 'display_name': 'Rutronik Elektronische Bauelemente GmbH'}",0,https://www.adzuna.de/details/5470836954?utm_medium=api&utm_source=a4bcf954,Adzuna::API::Response::Job,,Duales Studium Data Science & KI - 2026,"{'area': ['Deutschland'], 'display_name': 'Deutschland', '__CLASS__': 'Adzuna::API::Response::Location'}","{'tag': 'unknown', '__CLASS__': 'Adzuna::API::Response::Category', 'label': 'Unknown'}",,5470836954,,,,
2025-12-02T04:12:40Z,"Der Verband der Privaten Krankenversicherung e.V. gehört zu den Spitzenverbänden der deutschen Wirtschaft und vertritt die Interessen der Privaten Krankenversicherung und seiner Mitgliedsunternehmen. Wir sind im Geschäftsbereich Mathematik/Statistik zuständig für die Erstellung und Auswertung von Statistiken und die Kalkulation von Branchentarifen für die private Kranken- und Pflegeversicherung. Mit Hilfe der erhobenen Daten analysieren wir die Entwicklung der Branche , zeigen Ursachen für die …",eyJhbGciOiJIUzI1NiJ9.eyJzIjoiOGtKMC1vZjY4QkdRWDRsZThTT3pGQSIsImkiOiI1NTIzNDUwNzgwIn0.zoPgHjMmM0-yMa2oi0HPU-UO7r9Axf6bxVtW2depoRQ,{'__CLASS__': 'Adzuna::API::Response::Company'},0,https://www.adzuna.de/details/5523450780?utm_medium=api&utm_source=a4bcf954,Adzuna::API::Response::Job,50.940164,Mathematiker / Data Science (w/m/div.),"{'__CLASS__': 'Adzuna::API::Response::Location', 'display_name': 'Köln, Nordrhein-Westfalen', 'area': ['Deutschland', 'Nordrhein-Westfalen', 'Köln']}","{'tag': 'unknown', '__CLASS__': 'Adzuna::API::Response::Category', 'label': 'Unknown'}",6.969972,5523450780,full_time,,,
2025-12-01T20:34:49Z,"Der Verband der Privaten Krankenversicherung e.V. gehört zu den Spitzenverbänden der deutschen Wirtschaft und vertritt die Interessen der Privaten Krankenversicherung und seiner Mitgliedsunternehmen. Wir sind im Geschäftsbereich Mathematik/Statistik zuständig für die Erstellung und Auswertung von Statistiken und die Kalkulation von Branchentarifen für die private Kranken- und Pflegeversicherung. Mit Hilfe der erhobenen Daten analysieren wir dieEntwicklung der Branche, zeigen Ursachen für die je…",eyJhbGciOiJIUzI1NiJ9.eyJpIjoiNTUyMjQxNDMzMSIsInMiOiI4a0owLW9mNjhCR1FYNGxlOFNPekZBIn0.hh9pjjHOPoJwxxjN_7B42uqF-H6FU8uBc5LEuvef9WU,"{'display_name': 'PKV Verband der Privaten Krankenversicherung e. V.', '__CLASS__': 'Adzuna::API::Response::Company'}",0,https://www.adzuna.de/details/5522414331?utm_medium=api&utm_source=a4bcf954,Adzuna::API::Response::Job,50.93917,Mathematiker / Data Science (w/m/div.),"{'area': ['Deutschland', 'Nordrhein-Westfalen', 'Köln', 'Altstadt-Nord'], 'display_name': 'Altstadt-Nord, Köln', '__CLASS__': 'Adzuna::API::Response::Location'}","{'tag': 'unknown', 'label': 'Unknown', '__CLASS__': 'Adzuna::API::Response::Category'}",6.95684,5522414331,,,,
2026-01-24T21:29:12Z,"We are Billie, the leading provider of Buy Now, Pay Later (BNPL) payment methods for businesses, offering B2B companies innovative digital payment services and modern checkout solutions. We are to create a new standard for business payments and have made it our mission to simplify the purchasing experience for all businesses making it a tool for growth. Our solutions are based on proprietary, machine-learning-supported risk models, fully digitized processes and a highly scalable tech platform. …",eyJhbGciOiJIUzI1NiJ9.eyJpIjoiNTU5OTM4MTA3OSIsInMiOiI4a0owLW9mNjhCR1FYNGxlOFNPekZBIn0.gYwmVTJRFQA5x5jZU9Hrwaim3Vuk7L2xA0nu5HHhKCU,"{'__CLASS__': 'Adzuna::API::Response::Company', 'display_name': 'Billie'}",0,https://www.adzuna.de/details/5599381079?utm_medium=api&utm_source=a4bcf954,Adzuna::API::Response::Job,52.507706,Data Science Manager (w/m/d),"{'__CLASS__': 'Adzuna::API::Response::Location', 'display_name': 'Berlin, Deutschland', 'area': ['Deutschland', 'Berlin']}","{'label': 'Stellen aus PR, Werbung & Marketing', '__CLASS__': 'Adzuna::API::Response::Category', 'tag': 'pr-advertising-marketing-jobs'}",13.420806,5599381079,full_time,,,
2026-01-23T15:28:27Z,"Das Leibniz-Institut für Analytische Wissenschaften - ISAS - e.V. entwickelt Analyseverfahren für die Gesundheitsforschung. Mit seinen Innovationen trägt es dazu bei, die Prävention, Frühdiagnose und Therapie von beispielsweise Herz-Kreislauf-Erkrankungen oder Krebs zu verbessern. Ziel des Instituts ist es, die personalisierte Therapie voranzutreiben. Dafür kombiniert das ISAS Wissen aus Biologie, Chemie, Informatik, Medizin, Pharmakologie und Physik. Das ISAS ist Mitglied der Leibniz-Gemeinsch…",eyJhbGciOiJIUzI1NiJ9.eyJzIjoiOGtKMC1vZjY4QkdRWDRsZThTT3pGQSIsImkiOiI1NTk3MTQyMjM2In0.meQQMvuYlgIv3tbQR2cyzajBpi25MIKsn90NDv_u808,"{'__CLASS__': 'Adzuna::API::Response::Company', 'display_name': 'Leibniz-Institut für Analytische Wissenschaften - ISAS - e. V.'}",0,https://www.adzuna.de/details/5597142236?utm_medium=api&utm_source=a4bcf954,Adzuna::API::Response::Job,51.48532,Doktorand Data Science (m/w/d),"{'__CLASS__': 'Adzuna::API::Response::Location', 'area': ['Deutschland', 'Nordrhein-Westfalen', 'Dortmund', 'Brünninghausen'], 'display_name': 'Brünninghausen, Dortmund'}","{'tag': 'unknown', 'label': 'Unknown', '__CLASS__': 'Adzuna::API::Response::Category'}",7.45995,5597142236,,,,
2025-12-26T21:24:10Z,"Description Are you looking to kick off your career journey? Do you like the idea of joining the European PayTech? If so, you are at the right place! Our Graduate Program offers you the chance to create your unique career path within our diverse international team, operating in more than 25 countries. Rotate among different departments, learn from experienced professionals, and make a difference by working on real business cases. About the Program Our Graduate Program is more than a learning pa…",eyJhbGciOiJIUzI1NiJ9.eyJpIjoiNTU1NjkyMDA3MSIsInMiOiI4a0owLW9mNjhCR1FYNGxlOFNPekZBIn0.MJnq8LHIjlH4ZwEuymxSXosjT26jyO0nHkIcJfmAWL8,"{'__CLASS__': 'Adzuna::API::Response::Company', 'display_name': 'Nexi Group'}",0,https://www.adzuna.de/details/5556920071?utm_medium=api&utm_source=a4bcf954,Adzuna::API::Response::Job,,Graduate Program Data Science & Analytics - Germany,"{'area': ['Deutschland'], 'display_name': 'Deutschland', '__CLASS__': 'Adzuna::API::Response::Location'}","{'tag': 'pr-advertising-marketing-jobs', 'label': 'Stellen aus PR, Werbung & Marketing', '__CLASS__': 'Adzuna::API::Response::Category'}",,5556920071,full_time,,,
2026-01-09T20:35:59Z,"Siltronic ist einer der weltweit größten Hersteller für Wafer aus Reinstsilizium und Partner vieler führender Chip-Hersteller mit rund 4.300 Mitarbeitenden und Produktionsstätten in Europa, Asien und den USA. Wir entwickeln und fertigen Wafer mit einem Durchmesser von bis zu 300 mm. Diese sind die Grundlage der modernen Mikro- und Nanoelektronik. In einem 3-jährigen Dualen Studium werden Theorie und Praxis gekonnt verbunden. Das hoch qualifizierende Studium wird durch breit gefächerte Praxisein…",eyJhbGciOiJIUzI1NiJ9.eyJzIjoiOGtKMC1vZjY4QkdRWDRsZThTT3pGQSIsImkiOiI1NTc2NjkwMTIxIn0.Jg-g4gnfUTiicV4P55XyUDdRBKEkg9u4FgYBCbktUA8,"{'display_name': 'Siltronic AG', '__CLASS__': 'Adzuna::API::Response::Company'}",0,https://www.adzuna.de/details/5576690121?utm_medium=api&utm_source=a4bcf954,Adzuna::API::Response::Job,50.91404,Duales Studium Data Science und Künstliche Intelligenz,"{'__CLASS__': 'Adzuna::API::Response::Location', 'display_name': 'Freiberg, Mittelsachsen (Kreis)', 'area': ['Deutschland', 'Sachsen', 'Mittelsachsen (Kreis)', 'Freiberg']}","{'tag': 'unknown', '__CLASS__': 'Adzuna::API::Response::Category', 'label': 'Unknown'}",13.33722,5576690121,full_time,,,
2026-01-02T20:58:32Z,"Du willst mehr als Uni und möchtest erste Berufseinblicke und Kontakte knüpfen? Dann bist du hier richtig! Als Werkstudent oder Praktikant bei Kaufland gehörst du von Beginn an zu einem starken Team und kannst zeigen, was in dir steckt. Werde auch du Teil von teamkaufland! Das erwartet dich bei uns Wir zählen auf dich: Du unterstützt unser Team bei der Bearbeitung unserer Analytics Use Cases entlang der gesamten Wertschöpfungskette bei Kaufland. Vielfältige Aufgaben? Na klar: Lerne unsere Proje…",eyJhbGciOiJIUzI1NiJ9.eyJzIjoiOGtKMC1vZjY4QkdRWDRsZThTT3pGQSIsImkiOiI1NTY1MjA4NzcxIn0.88OmiKM0xH6PGZswI9lJljwRL_VOce2AIBFV0G6SDFA,"{'__CLASS__': 'Adzuna::API::Response::Company', 'display_name': 'Kaufland'}",0,https://www.adzuna.de/details/5565208771?utm_medium=api&utm_source=a4bcf954,Adzuna::API::Response::Job,49.1416,Praktikant Data Science (m/w/d),"{'__CLASS__': 'Adzuna::API::Response::Location', 'area': ['Deutschland', 'Baden-Württemberg', 'Heilbronn (Kreis)', 'Heilbronn', 'Böckingen'], 'display_name': 'Böckingen, Heilbronn'}","{'label': 'IT-Stellen', '__CLASS__': 'Adzuna::API::Response::Category', 'tag': 'it-jobs'}",9.22208,5565208771,,,,
2025-12-19T04:17:30Z,"Eine gute Idee war der Ursprung, ein erfolgreiches Konzept ist das Ergebnis. Qualität zum guten Preis möglichst vielen Menschen anbieten zu können treibt uns an - mittlerweile weltweit, denn wir sind Lidl. Hier ist das berufliche Zuhause vielfältiger Talente. Ob im Einkauf, in der Logistik, im Warengeschäft oder in der IT; ob als Impulsgeber, Gestalter oder Dienstleister der Länder. Wir suchen Anpacker, Durchstarter, Möglichmacher und bieten spannende Aufgaben und Projekte in einem dynamischen …",eyJhbGciOiJIUzI1NiJ9.eyJpIjoiNTU0ODEwNzIzMyIsInMiOiI4a0owLW9mNjhCR1FYNGxlOFNPekZBIn0.LR-1phE0p7VHQ8BSJQGqXhrKzzkb5mjMaUEdCQRAp8A,"{'display_name': 'Lidl Stiftung & Co. KG', '__CLASS__': 'Adzuna::API::Response::Company'}",0,https://www.adzuna.de/details/5548107233?utm_medium=api&utm_source=a4bcf954,Adzuna::API::Response::Job,49.18975,Duales Studium Wirtschaftsinformatik - Data Science 2026,"{'__CLASS__': 'Adzuna::API::Response::Location', 'display_name': 'Neckarsulm, Heilbronn (Kreis)', 'area': ['Deutschland', 'Baden-Württemberg', 'Heilbronn (Kreis)', 'Neckarsulm']}","{'tag': 'other-general-jobs', '__CLASS__': 'Adzuna::API::Response::Category', 'label': 'Sonstige/Allgemeine Stellen'}",9.2274,5548107233,full_time,,,
2026-01-20T02:47:42Z,"TKMS ATLAS ELEKTRONIK ist ein Unternehmen der TKMS Gruppe. Seit Jahrzehnten unterstützen wir Marinen auf der ganzen Welt dabei, die Meere sicherer zu machen. Unseren Kunden bieten wir umfassende Lösungen in Sensorik und Elektronik. Vom Sonar über unbemannte Fahrzeuge und Minenabwehrsystemen bis hin zu Kommunikationsanlagen. Alles aus einer Hand. Bereit mit den Besten zu arbeiten? Werde Teil unseres Teams aus mehr als 8.500 Kolleginnen und Kollegen bei TKMS. Als wachsendes Marineunternehmen biet…",eyJhbGciOiJIUzI1NiJ9.eyJpIjoiNTU5MTkzMTk0NCIsInMiOiI4a0owLW9mNjhCR1FYNGxlOFNPekZBIn0.06sbIFbhrU8DFB22zVf4y3hAFEJi_67bbY44MANTP1Y,"{'display_name': 'TKMS ATLAS ELEKTRONIK GmbH', '__CLASS__': 'Adzuna::API::Response::Company'}",0,https://www.adzuna.de/land/ad/5591931944?se=8kJ0-of68BGQX4le8SOzFA&utm_medium=api&utm_source=a4bcf954&v=0F8FB07487FE19BB98FFE3EF473FD8460037AFC1,Adzuna::API::Response::Job,53.10403,Pflichtpraktikum/Abschlussarbeit im Bereich KI: Innovative Bildrekonstruktion für maritime Anwendungen (m/w/d),"{'__CLASS__': 'Adzuna::API::Response::Location', 'area': ['Deutschland', 'Bremen'], 'display_name': 'Bremen, Deutschland'}","{'tag': 'it-jobs', '__CLASS__': 'Adzuna::API::Response::Category', 'label': 'IT-Stellen'}",8.786477,5591931944,,,,
2026-01-25T14:52:36Z,"Neue Wege gehen. Aber nie vergessen wo man herkommt. Löwenstein Medical Technology ist ein mittelständisches Unternehmen unter dem Dach der international aufgestellten Löwenstein Gruppe. Als Kompetenzträger für respiratorische Diagnostik und Therapie entwickeln und produzieren wir in Deutschland hochwertige Medizinprodukte „Made in Germany“ für den weltweiten Einsatz in der Schlaf- und Beatmungsmedizin. Wir investieren in Mitarbeiter, die unsere zentralen Werte Eigenverantwortung, Begeisterung,…",eyJhbGciOiJIUzI1NiJ9.eyJzIjoiOGtKMC1vZjY4QkdRWDRsZThTT3pGQSIsImkiOiI1NjAwMDc1NjQ3In0.G-ku01njlcqWaT03bNmz4e-3jLfG5KrR4rSzszFcYuw,"{'__CLASS__': 'Adzuna::API::Response::Company', 'display_name': 'Löwenstein Medical Technology GmbH + Co. KG'}",0,https://www.adzuna.de/land/ad/5600075647?se=8kJ0-of68BGQX4le8SOzFA&utm_medium=api&utm_source=a4bcf954&v=222E59A73C31767E597A7D1653215F3C37117595,Adzuna::API::Response::Job,49.001249,Senior Data Analyst (m/w/d),"{'__CLASS__': 'Adzuna::API::Response::Location', 'area': ['Deutschland', 'Baden-Württemberg', 'Karlsruhe (Kreis)', 'Karlsruhe'], 'display_name': 'Karlsruhe, Karlsruhe (Kreis)'}","{'tag': 'scientific-qa-jobs', '__CLASS__': 'Adzuna::API::Response::Category', 'label': 'Stellen aus Wissenschaft & Qualitätssicherung'}",8.412378,5600075647,,,,
2026-01-23T14:35:06Z,"Das Team ""Content Structure Core"" ist die zentrale Anlaufstelle, wenn es um Content-Strukturen und Metadaten geht. Als interdisziplinäres Team bündeln wir unser Know-how aus unterschiedlichen Fachbereichen, um gemeinsam an einem Ziel zu arbeiten: Ein überzeugendes Produkterlebnis für unsere Kund:innen zu schaffen. Unsere Mission? Wir optimieren und harmonisieren Content-Strukturen, damit aktuelle Technologien wie KI und Legal Tech das volle Potenzial unserer Fachinhalte entfalten können. Dabei …",eyJhbGciOiJIUzI1NiJ9.eyJpIjoiNTU5NzEyNjI4MyIsInMiOiI4a0owLW9mNjhCR1FYNGxlOFNPekZBIn0.8DBsYhNemzrXR1pMWfJZMZcsqwMw_lXreWrE1MD1IYo,"{'__CLASS__': 'Adzuna::API::Response::Company', 'display_name': 'Haufe Group SE'}",0,https://www.adzuna.de/land/ad/5597126283?se=8kJ0-of68BGQX4le8SOzFA&utm_medium=api&utm_source=a4bcf954&v=DD8AAB9EF88ED85F837339E4DFD568376DE2BAE6,Adzuna::API::Response::Job,47.999458,Metadaten Manager:in (d/m/w),"{'display_name': 'Freiburg im Breisgau, Baden-Württemberg', 'area': ['Deutschland', 'Baden-Württemberg', 'Freiburg im Breisgau'], '__CLASS__': 'Adzuna::API::Response::Location'}","{'__CLASS__': 'Adzuna::API::Response::Category', 'label': 'Unknown', 'tag': 'unknown'}",7.816286,5597126283,,,,
2026-01-14T14:28:00Z,"Aufgaben emetriq, Teil der Deutschen Telekom AG, bietet datengetriebene Online-Advertising-Lösungen und setzt sich für fairen Datenzugang als Treibstoff für Innovation und Vielfalt ein. Mit unserer Expertise und Technologiekompetenz steigern wir die Präzision und Relevanz von Online-Werbung. Als Initiatoren des größten kollaborativen Datenpools in Deutschland vereinen wir über 100 Data- und Mediaexperten. Zur Verstärkung unseres Data-Teams suchen wir zum Sommer- oder Wintersemester 2026 einen d…",eyJhbGciOiJIUzI1NiJ9.eyJzIjoiOGtKMC1vZjY4QkdRWDRsZThTT3pGQSIsImkiOiI1NTg0MDA5MjYxIn0.PcIa9iaeKT2dCWPZ696zt4TZBS56NSFmD8g9ThRYLIo,"{'__CLASS__': 'Adzuna::API::Response::Company', 'display_name': 'emetriq GmbH'}",0,https://www.adzuna.de/land/ad/5584009261?se=8kJ0-of68BGQX4le8SOzFA&utm_medium=api&utm_source=a4bcf954&v=7B259465EE3EA7DF80F6D48074276BCF49958529,Adzuna::API::Response::Job,53.557429,Duales Masterstudium Informatik (M.Sc.) // Master in Kooperation mit FH Wedel (m/w/d),"{'__CLASS__': 'Adzuna::API::Response::Location', 'area': ['Deutschland', 'Hamburg'], 'display_name': 'Hamburg, Deutschland'}","{'label': 'IT-Stellen', '__CLASS__': 'Adzuna::API::Response::Category', 'tag': 'it-jobs'}",9.987297,5584009261,,,,
2025-11-20T17:58:31Z,"Praktikum Data Science / Data Analytics & BI (w/m/d) Job-ID: 11385 Standorte: Stuttgart Karrierelevel: Studierende Anstellungsart: Praktikum Begleite KPMG bei den zukünftigen Herausforderungen unserer Kund:innen. Begeistere auch Du Dich für die Vielfalt unserer Fragestellungen - und mach gemeinsam mit uns den Unterschied. Unterstütze Dein Team von Data-Expert:innen, die innovativen und datengesteuerten Lösungen für unsere Kund:innen zu entwickeln. Deine Aufgaben Du willst Big Data in Smart Data…",eyJhbGciOiJIUzI1NiJ9.eyJpIjoiNTUwNTMzNjgzNyIsInMiOiI4a0owLW9mNjhCR1FYNGxlOFNPekZBIn0.XI8jqnxmEX-bnIe4W8TE6EDPaUlP-TlCaK6-lGy3_Kc,"{'__CLASS__': 'Adzuna::API::Response::Company', 'display_name': 'KPMG'}",0,https://www.adzuna.de/details/5505336837?utm_medium=api&utm_source=a4bcf954,Adzuna::API::Response::Job,48.77713,Praktikum Data Science / Data Analytics & BI (w/m/d),"{'__CLASS__': 'Adzuna::API::Response::Location', 'area': ['Deutschland', 'Baden-Württemberg', 'Stuttgart', 'Mitte'], 'display_name': 'Mitte, Stuttgart'}","{'label': 'Unknown', '__CLASS__': 'Adzuna::API::Response::Category', 'tag': 'unknown'}",9.18071,5505336837,,,,contract
2025-11-20T17:58:31Z,"Praktikum Data Science / Data Analytics & BI (w/m/d) Job-ID: 11385 Standorte: Ulm Karrierelevel: Studierende Anstellungsart: Praktikum Begleite KPMG bei den zukünftigen Herausforderungen unserer Kund:innen. Begeistere auch Du Dich für die Vielfalt unserer Fragestellungen - und mach gemeinsam mit uns den Unterschied. Unterstütze Dein Team von Data-Expert:innen, die innovativen und datengesteuerten Lösungen für unsere Kund:innen zu entwickeln. Deine Aufgaben Du willst Big Data in Smart Data verwa…",eyJhbGciOiJIUzI1NiJ9.eyJpIjoiNTUwNTMzNjgyNiIsInMiOiI4a0owLW9mNjhCR1FYNGxlOFNPekZBIn0.HlKBYms11NfZy8d8jU59Nb3ykEez2hvUltl4cYgSiFg,"{'display_name': 'KPMG', '__CLASS__': 'Adzuna::API::Response::Company'}",0,https://www.adzuna.de/details/5505336826?utm_medium=api&utm_source=a4bcf954,Adzuna::API::Response::Job,48.36497,Praktikum Data Science / Data Analytics & BI (w/m/d),"{'__CLASS__': 'Adzuna::API::Response::Location', 'display_name': 'Mitte, Ulm', 'area': ['Deutschland', 'Baden-Württemberg', 'Ulm', 'Mitte']}","{'label': 'Unknown', '__CLASS__': 'Adzuna::API::Response::Category', 'tag': 'unknown'}",8.29909,5505336826,,,,contract
2025-11-20T17:58:31Z,"Praktikum Data Science / Data Analytics & BI (w/m/d) Job-ID: 11385 Standorte: Saarbrücken Karrierelevel: Studierende Anstellungsart: Praktikum Begleite KPMG bei den zukünftigen Herausforderungen unserer Kund:innen. Begeistere auch Du Dich für die Vielfalt unserer Fragestellungen - und mach gemeinsam mit uns den Unterschied. Unterstütze Dein Team von Data-Expert:innen, die innovativen und datengesteuerten Lösungen für unsere Kund:innen zu entwickeln. Deine Aufgaben Du willst Big Data in Smart Da…",eyJhbGciOiJIUzI1NiJ9.eyJzIjoiOGtKMC1vZjY4QkdRWDRsZThTT3pGQSIsImkiOiI1NTA1MzM2ODI5In0.hfmcoOu0S-44t7GoUTY0kT84GyqfUmpSGYZq1VXBsQg,"{'display_name': 'KPMG', '__CLASS__': 'Adzuna::API::Response::Company'}",0,https://www.adzuna.de/details/5505336829?utm_medium=api&utm_source=a4bcf954,Adzuna::API::Response::Job,49.253,Praktikum Data Science / Data Analytics & BI (w/m/d),"{'__CLASS__': 'Adzuna::API::Response::Location', 'display_name': 'Malstatt, Saarbrücken', 'area': ['Deutschland', 'Saarland', 'Regionalverband Saarbrücken (Kreis)', 'Saarbrücken', 'Malstatt']}","{'label': 'Unknown', '__CLASS__': 'Adzuna::API::Response::Category', 'tag': 'unknown'}",6.96191,5505336829,,,,contract
2025-11-20T17:58:31Z,"Praktikum Data Science / Data Analytics & BI (w/m/d) Job-ID: 11385 Standorte: Karlsruhe Karrierelevel: Studierende Anstellungsart: Praktikum Begleite KPMG bei den zukünftigen Herausforderungen unserer Kund:innen. Begeistere auch Du Dich für die Vielfalt unserer Fragestellungen - und mach gemeinsam mit uns den Unterschied. Unterstütze Dein Team von Data-Expert:innen, die innovativen und datengesteuerten Lösungen für unsere Kund:innen zu entwickeln. Deine Aufgaben Du willst Big Data in Smart Data…",eyJhbGciOiJIUzI1NiJ9.eyJpIjoiNTUwNTMzNjgzMSIsInMiOiI4a0owLW9mNjhCR1FYNGxlOFNPekZBIn0.yXNDYJ8sXZ5mXgdPLy5pUlWI6qKVbCtfgUZ3nLjiHJM,"{'__CLASS__': 'Adzuna::API::Response::Company', 'display_name': 'KPMG'}",0,https://www.adzuna.de/details/5505336831?utm_medium=api&utm_source=a4bcf954,Adzuna::API::Response::Job,49.03084,Praktikum Data Science / Data Analytics & BI (w/m/d),"{'__CLASS__': 'Adzuna::API::Response::Location', 'area': ['Deutschland', 'Baden-Württemberg', 'Karlsruhe (Kreis)', 'Karlsruhe', 'Hagsfeld'], 'display_name': 'Hagsfeld, Karlsruhe'}","{'tag': 'unknown', '__CLASS__': 'Adzuna::API::Response::Category', 'label': 'Unknown'}",8.45882,5505336831,,,,contract
