description,id,redirect_url,company,location,longitude,latitude,title,__CLASS__,created,category,adref,salary_is_predicted,contract_time,contract_type,salary_min,salary_max
"Die Liebherr-Digital Development Center GmbH entwickelt am Standort Ulm digitale Lösungen für die gesamte Firmengruppe Liebherr. Unser passioniertes Team aus den Bereichen Software Development, Engineering und Data Science arbeitet gemeinsam an verschiedensten Projekten aus der gesamten Liebherr-Produktwelt. Unsere Mission: einzigartige digitale Erlebnisse schaffen! IT-Koordinator - Schwerpunkt Softwareteams (m/w/d) Job-ID 80051 Aufgaben Aufbau und Administration der IT-Infrastruktur für Softwa…",5506065652,https://www.adzuna.de/land/ad/5506065652?se=Joi4YgbU8BGHxf2R3H6SRA&utm_medium=api&utm_source=a4bcf954&v=56699D65608C50155B089375FD30B3304530FBEB,"{'__CLASS__': 'Adzuna::API::Response::Company', 'display_name': 'Liebherr-Digital Development Center GmbH'}","{'area': ['Deutschland', 'Baden-Württemberg', 'Ulm'], 'display_name': 'Ulm, Baden-Württemberg', '__CLASS__': 'Adzuna::API::Response::Location'}",9.856945,48.383137,IT-Koordinator - Schwerpunkt Softwareteams (m/w/d),Adzuna::API::Response::Job,2025-11-20T21:36:09Z,"{'tag': 'unknown', 'label': 'Unknown', '__CLASS__': 'Adzuna::API::Response::Category'}",eyJhbGciOiJIUzI1NiJ9.eyJzIjoiSm9pNFlnYlU4QkdIeGYyUjNINlNSQSIsImkiOiI1NTA2MDY1NjUyIn0.YbqlBO9nVRgnGjqcsEFPPutp3gpZt0qRZrMAuy0lIlk,0,,,,
"Unser Kunde ist ein erfolgreicher Player im Bereich Sensorik und Verarbeitung von Daten mit Sitz in der Region Stuttgart und hat uns als Personalberater und -vermittler mit der Besetzung der Position des Teamleiter Data Science und KI (m/w/d) betraut. Das ist zukünftig Ihr Job *Du steuerst die Entwicklung produktionsreifer KI-Anwendungen und bringst diese erfolgreich zur Marktreife. *Du förderst eine Kultur der technischen Sorgfalt durch strukturierte Code-Reviews, MLOps-Best-Practices und mode…",5305415610,https://www.adzuna.de/details/5305415610?utm_medium=api&utm_source=a4bcf954,"{'__CLASS__': 'Adzuna::API::Response::Company', 'display_name': 'FERCHAU GmbH'}","{'display_name': 'Leinfelden-Echterdingen, Esslingen (Kreis)', 'area': ['Deutschland', 'Baden-Württemberg', 'Esslingen (Kreis)', 'Leinfelden-Echterdingen'], '__CLASS__': 'Adzuna::API::Response::Location'}",9.14057,48.69447,Teamleiter Data Science und KI (m/w/d),Adzuna::API::Response::Job,2025-07-16T02:55:47Z,"{'__CLASS__': 'Adzuna::API::Response::Category', 'label': 'Unknown', 'tag': 'unknown'}",eyJhbGciOiJIUzI1NiJ9.eyJpIjoiNTMwNTQxNTYxMCIsInMiOiJKb2k0WWdiVThCR0h4ZjJSM0g2U1JBIn0.v-vKnbW0IQyGDiaE-gqnSHzdi3KdoArB5ZB1mxgRu3s,0,,,,
"Team Lead Data Science (f/m/x) Company Description We are seeking a technically skilled leader to join our dynamic Data Science department at AUTO1 Group Technology. As part of our disruptive approach in the used car market, our team leverages cutting-edge technology to gather and analyze data, optimizing our platforms and processes. AUTO1 Group is Europe's leading digital automotive platform. We revolutionize the used car market with our well-known brands Autohero, wirkaufendeinauto.de, and AU…",5529214531,https://www.adzuna.de/details/5529214531?utm_medium=api&utm_source=a4bcf954,"{'display_name': 'AUTO1 Global Services SE & Co. KG', '__CLASS__': 'Adzuna::API::Response::Company'}","{'area': ['Deutschland', 'Berlin'], 'display_name': 'Berlin, Deutschland', '__CLASS__': 'Adzuna::API::Response::Location'}",13.420806,52.507706,Team Lead Data Science (f/m/x),Adzuna::API::Response::Job,2025-12-05T16:11:18Z,"{'__CLASS__': 'Adzuna::API::Response::Category', 'tag': 'it-jobs', 'label': 'IT-Stellen'}",eyJhbGciOiJIUzI1NiJ9.eyJpIjoiNTUyOTIxNDUzMSIsInMiOiJKb2k0WWdiVThCR0h4ZjJSM0g2U1JBIn0.MakoV4B2I-PelI6jIVNSnu1LtEjTmE9c-_TWlWXb554,0,full_time,,,
"Dein Berufsbild: Du möchtest irgendwas mit Mathe machen und findest die Wirtschaftswelt spannend? Dann entscheide dich für ein Studium in Data Science und Künstliche Intelligenz und hol alles aus den Daten heraus. Data Science und Künstliche Intelligenz Spezialisten (w/m/d) sind die Schnittstelle zwischen IT und Business. Sie beherrschen die verschiedenen Technologien, bewerten deren Potenziale und wissen, wie man sie technisch umsetzt. In deinem dualen Studium erlernst du die Grundlagen, Konze…",5503309319,https://www.adzuna.de/details/5503309319?utm_medium=api&utm_source=a4bcf954,"{'__CLASS__': 'Adzuna::API::Response::Company', 'display_name': 'Siemens AG'}","{'display_name': 'Frankfurt am Main, Hessen', 'area': ['Deutschland', 'Hessen', 'Frankfurt am Main'], '__CLASS__': 'Adzuna::API::Response::Location'}",8.650578,50.129683,: Data Science und Künstliche Intelligenz (B.Sc.) 2026,Adzuna::API::Response::Job,2025-11-19T17:56:25Z,"{'label': 'Unknown', 'tag': 'unknown', '__CLASS__': 'Adzuna::API::Response::Category'}",eyJhbGciOiJIUzI1NiJ9.eyJzIjoiSm9pNFlnYlU4QkdIeGYyUjNINlNSQSIsImkiOiI1NTAzMzA5MzE5In0.IR_OxcK2WAFKH31MsvLgqY5nd7b7XuwjzWWpzXfEyI0,0,,contract,,
"Willkommen bei der KfW! Als eine der führenden Förderbanken der Welt stehen wir für die nachhaltige Transformation von Umwelt, Gesellschaft und Unternehmen. Als Impulsgeber wirken wir aktiv an den Themen mit, die die Welt von morgen prägen. Wir fördern Windparks, Infrastruktur-Projekte, Schulen und Krankenhäuser und gestalten damit die Zukunft. Bei uns finden Sie ein vertrauensvolles Arbeitsumfeld, in dem Teamspirit, Vielfalt und Inklusion gelebt werden. Wir fördern Sie, Ihre Ideen und Ihr Enga…",5496539940,https://www.adzuna.de/details/5496539940?utm_medium=api&utm_source=a4bcf954,"{'__CLASS__': 'Adzuna::API::Response::Company', 'display_name': 'KfW Bankengruppe'}","{'__CLASS__': 'Adzuna::API::Response::Location', 'display_name': 'Frankfurt am Main, Hessen', 'area': ['Deutschland', 'Hessen', 'Frankfurt am Main']}",8.650578,50.129683,Senior Data Science (m/w/d) - Inklusiver Job   ,Adzuna::API::Response::Job,2025-11-14T19:25:36Z,"{'__CLASS__': 'Adzuna::API::Response::Category', 'label': 'Unknown', 'tag': 'unknown'}",eyJhbGciOiJIUzI1NiJ9.eyJpIjoiNTQ5NjUzOTk0MCIsInMiOiJKb2k0WWdiVThCR0h4ZjJSM0g2U1JBIn0.xNQcJJfBX77zNxHj66LfZw0Pfky5V6zoJ8__q31NH30,0,,,,
"Senior Consultant Data Science (m/w/d) In Deutschland - Berlin| Bonn | Frankfurt/Main | Hamburg | Köln | München Du bistbereit, deine persönliche Entwicklung in den Bereichen Data Science, Analyticsund KI zu fördern? Unser Data Science Team hilft Unternehmen, fundierteEntscheidungen zu treffen und ihr Wachstum voranzutreiben, indem wir Rohdatenin umsetzbare Erkenntnisse verwandeln. WerdePionier der digitalen Transformation und unterstütze uns als (Senior)Consultant – Data Science. Mehr von uns …",5502168916,https://www.adzuna.de/details/5502168916?utm_medium=api&utm_source=a4bcf954,"{'display_name': 'Simon-Kucher & Partners', '__CLASS__': 'Adzuna::API::Response::Company'}","{'__CLASS__': 'Adzuna::API::Response::Location', 'display_name': 'Berlin, Deutschland', 'area': ['Deutschland', 'Berlin']}",13.420806,52.507706,Senior Consultant Data Science (m/w/d),Adzuna::API::Response::Job,2025-11-18T18:30:25Z,"{'__CLASS__': 'Adzuna::API::Response::Category', 'tag': 'unknown', 'label': 'Unknown'}",eyJhbGciOiJIUzI1NiJ9.eyJzIjoiSm9pNFlnYlU4QkdIeGYyUjNINlNSQSIsImkiOiI1NTAyMTY4OTE2In0.jI7OenXbMlkU5HNZt26jZaFdq8rB7gu5Z5cFfU7uDjg,0,,,,
"Senior Consultant Data Science (m/w/d) In Deutschland - Berlin| Bonn | Frankfurt/Main | Hamburg | Köln | München Du bistbereit, deine persönliche Entwicklung in den Bereichen Data Science, Analyticsund KI zu fördern? Unser Data Science Team hilft Unternehmen, fundierteEntscheidungen zu treffen und ihr Wachstum voranzutreiben, indem wir Rohdatenin umsetzbare Erkenntnisse verwandeln. WerdePionier der digitalen Transformation und unterstütze uns als (Senior)Consultant – Data Science. Mehr von uns …",5493928553,https://www.adzuna.de/details/5493928553?utm_medium=api&utm_source=a4bcf954,"{'__CLASS__': 'Adzuna::API::Response::Company', 'display_name': 'Simon-Kucher & Partners'}","{'__CLASS__': 'Adzuna::API::Response::Location', 'area': ['Deutschland', 'Bayern', 'München (Kreis)', 'München'], 'display_name': 'München, München (Kreis)'}",,,Senior Consultant Data Science (m/w/d),Adzuna::API::Response::Job,2025-11-13T15:06:18Z,"{'__CLASS__': 'Adzuna::API::Response::Category', 'label': 'Unknown', 'tag': 'unknown'}",eyJhbGciOiJIUzI1NiJ9.eyJpIjoiNTQ5MzkyODU1MyIsInMiOiJKb2k0WWdiVThCR0h4ZjJSM0g2U1JBIn0.LKPMMDrep5CNDHUhkXf-6knz-1m3GGyxQPzDJE9BVXc,0,,,,
"Senior Consultant Data Science (m/w/d) In Deutschland - Berlin| Bonn | Frankfurt/Main | Hamburg | Köln | München Du bistbereit, deine persönliche Entwicklung in den Bereichen Data Science, Analyticsund KI zu fördern? Unser Data Science Team hilft Unternehmen, fundierteEntscheidungen zu treffen und ihr Wachstum voranzutreiben, indem wir Rohdatenin umsetzbare Erkenntnisse verwandeln. WerdePionier der digitalen Transformation und unterstütze uns als (Senior)Consultant – Data Science. Mehr von uns …",5501781006,https://www.adzuna.de/details/5501781006?utm_medium=api&utm_source=a4bcf954,"{'display_name': 'Simon-Kucher & Partners', '__CLASS__': 'Adzuna::API::Response::Company'}","{'display_name': 'Eschborn, Main-Taunus-Kreis', 'area': ['Deutschland', 'Hessen', 'Main-Taunus-Kreis', 'Eschborn'], '__CLASS__': 'Adzuna::API::Response::Location'}",,,Senior Consultant Data Science (m/w/d),Adzuna::API::Response::Job,2025-11-18T16:29:46Z,"{'__CLASS__': 'Adzuna::API::Response::Category', 'label': 'Unknown', 'tag': 'unknown'}",eyJhbGciOiJIUzI1NiJ9.eyJzIjoiSm9pNFlnYlU4QkdIeGYyUjNINlNSQSIsImkiOiI1NTAxNzgxMDA2In0.GqZhilMrnXPdafaX2vyjvOX34zybA9i9AIpHMyCTkHE,0,,,,
"Senior Consultant Data Science (m/w/d) In Deutschland - Berlin| Bonn | Frankfurt/Main | Hamburg | Köln | München Du bistbereit, deine persönliche Entwicklung in den Bereichen Data Science, Analyticsund KI zu fördern? Unser Data Science Team hilft Unternehmen, fundierteEntscheidungen zu treffen und ihr Wachstum voranzutreiben, indem wir Rohdatenin umsetzbare Erkenntnisse verwandeln. WerdePionier der digitalen Transformation und unterstütze uns als (Senior)Consultant – Data Science. Mehr von uns …",5496087653,https://www.adzuna.de/details/5496087653?utm_medium=api&utm_source=a4bcf954,"{'__CLASS__': 'Adzuna::API::Response::Company', 'display_name': 'Simon-Kucher & Partners'}","{'__CLASS__': 'Adzuna::API::Response::Location', 'area': ['Deutschland', 'Hamburg'], 'display_name': 'Hamburg, Deutschland'}",9.987297,53.557429,Senior Consultant Data Science (m/w/d),Adzuna::API::Response::Job,2025-11-14T15:13:33Z,"{'label': 'Unknown', 'tag': 'unknown', '__CLASS__': 'Adzuna::API::Response::Category'}",eyJhbGciOiJIUzI1NiJ9.eyJpIjoiNTQ5NjA4NzY1MyIsInMiOiJKb2k0WWdiVThCR0h4ZjJSM0g2U1JBIn0.qGbt8H5CZ-362ZlCZlIyYk0Uj9JP0g_1saNlcYVrthA,0,,,,
"Senior Consultant Data Science (m/w/d) In Deutschland - Berlin| Bonn | Frankfurt/Main | Hamburg | Köln | München Du bistbereit, deine persönliche Entwicklung in den Bereichen Data Science, Analyticsund KI zu fördern? Unser Data Science Team hilft Unternehmen, fundierteEntscheidungen zu treffen und ihr Wachstum voranzutreiben, indem wir Rohdatenin umsetzbare Erkenntnisse verwandeln. WerdePionier der digitalen Transformation und unterstütze uns als (Senior)Consultant – Data Science. Mehr von uns …",5496087677,https://www.adzuna.de/details/5496087677?utm_medium=api&utm_source=a4bcf954,"{'__CLASS__': 'Adzuna::API::Response::Company', 'display_name': 'Simon-Kucher & Partners'}","{'__CLASS__': 'Adzuna::API::Response::Location', 'area': ['Deutschland', 'Nordrhein-Westfalen', 'Bonn'], 'display_name': 'Bonn, Nordrhein-Westfalen'}",7.112412,50.71942,Senior Consultant Data Science (m/w/d),Adzuna::API::Response::Job,2025-11-14T15:13:33Z,"{'__CLASS__': 'Adzuna::API::Response::Category', 'label': 'Unknown', 'tag': 'unknown'}",eyJhbGciOiJIUzI1NiJ9.eyJzIjoiSm9pNFlnYlU4QkdIeGYyUjNINlNSQSIsImkiOiI1NDk2MDg3Njc3In0.igjuWme1sNdj3WByuINSI150tBJn8xjfluXCVhnl1Uo,0,,,,
"Senior Consultant Data Science (m/w/d) In Deutschland - Berlin| Bonn | Frankfurt/Main | Hamburg | Köln | München Du bistbereit, deine persönliche Entwicklung in den Bereichen Data Science, Analyticsund KI zu fördern? Unser Data Science Team hilft Unternehmen, fundierteEntscheidungen zu treffen und ihr Wachstum voranzutreiben, indem wir Rohdatenin umsetzbare Erkenntnisse verwandeln. WerdePionier der digitalen Transformation und unterstütze uns als (Senior)Consultant – Data Science. Mehr von uns …",5493928550,https://www.adzuna.de/details/5493928550?utm_medium=api&utm_source=a4bcf954,"{'display_name': 'Simon-Kucher & Partners', '__CLASS__': 'Adzuna::API::Response::Company'}","{'area': ['Deutschland', 'Nordrhein-Westfalen', 'Köln'], 'display_name': 'Köln, Nordrhein-Westfalen', '__CLASS__': 'Adzuna::API::Response::Location'}",,,Senior Consultant Data Science (m/w/d),Adzuna::API::Response::Job,2025-11-13T15:06:18Z,"{'__CLASS__': 'Adzuna::API::Response::Category', 'label': 'Unknown', 'tag': 'unknown'}",eyJhbGciOiJIUzI1NiJ9.eyJzIjoiSm9pNFlnYlU4QkdIeGYyUjNINlNSQSIsImkiOiI1NDkzOTI4NTUwIn0.SzI5uM2k1M_JAEibDzZxnsCbqnzsQm6MqlvKY5TbIcY,0,,,,
"Mit ca. 2.200 Filialen in Deutschland, Österreich, Italien, Slowenien, Tschechien, Kroatien und Polen, einem eigenen Onlineshop sowie über 10.000 Mitarbeiterinnen und Mitarbeitern international zählt die NKD-Firmengruppe zu den größten Unternehmen im Textileinzelhandel. Das Angebot reicht von aktueller Mode für die ganze Familie und funktionaler Sportbekleidung über Heimtextilien und saisonale Dekorationsartikel bis hin zu ausgewählten Markensortimenten. Als zukunftsorientiertes Unternehmen set…",5461838063,https://www.adzuna.de/details/5461838063?utm_medium=api&utm_source=a4bcf954,"{'display_name': 'NKD Deutschland GmbH', '__CLASS__': 'Adzuna::API::Response::Company'}","{'display_name': 'Bindlach, Bayreuth (Kreis)', 'area': ['Deutschland', 'Bayern', 'Bayreuth (Kreis)', 'Bindlach'], '__CLASS__': 'Adzuna::API::Response::Location'}",11.61114,49.98086,Werkstudent (m/w/d) Data Science Bindlach,Adzuna::API::Response::Job,2025-10-24T03:48:51Z,"{'__CLASS__': 'Adzuna::API::Response::Category', 'tag': 'accounting-finance-jobs', 'label': 'Stellen aus Buchhaltung & Finanzwesen'}",eyJhbGciOiJIUzI1NiJ9.eyJzIjoiSm9pNFlnYlU4QkdIeGYyUjNINlNSQSIsImkiOiI1NDYxODM4MDYzIn0.Rcd1NknOQ-ETtUGF7U6vikGWuTmeM1LBOwVNNKUOhxw,0,,,,
"In Deutschland - Berlin | Bonn | Frankfurt/Main | Hamburg | Köln | München Du bist bereit, deine persönliche Entwicklung in den Bereichen Data Science, Analytics und KI zu fördern? Unser Data Science Team hilft Unternehmen, fundierte Entscheidungen zu treffen und ihr Wachstum voranzutreiben, indem wir Rohdaten in umsetzbare Erkenntnisse verwandeln. Werde Pionier der digitalen Transformation und unterstütze uns als (Senior) Consultant – Data Science. Mehr von uns für dich: Steile Lernkurve: werd…",5192887633,https://www.adzuna.de/details/5192887633?utm_medium=api&utm_source=a4bcf954,"{'display_name': 'master-TMS', '__CLASS__': 'Adzuna::API::Response::Company'}","{'display_name': 'Deutschland', 'area': ['Deutschland'], '__CLASS__': 'Adzuna::API::Response::Location'}",,,Senior Consultant Data Science (m/w/d),Adzuna::API::Response::Job,2025-05-10T21:53:49Z,"{'__CLASS__': 'Adzuna::API::Response::Category', 'tag': 'consultancy-jobs', 'label': 'Beraterstellen'}",eyJhbGciOiJIUzI1NiJ9.eyJzIjoiSm9pNFlnYlU4QkdIeGYyUjNINlNSQSIsImkiOiI1MTkyODg3NjMzIn0.Xd6-JQjb4X1Mj4WDMq6nPFCnCgnw-7zALELSD9mrATQ,0,,,,
Über uns statworx ist ein führendes Beratungs- und Entwicklungsunternehmen für Daten und KI mit Sitz in Frankfurt am Main. Wir bieten strategische Beratung für mittelständische Unternehmen und globale Konzerne. Wir entwickeln innovative Daten- & KI-Lösungen für alle Unternehmensbereiche und Tätigkeitsfelder. Wir befähigen Menschen auf allen Kompetenzniveaus mit unseren Daten- & KI-Bildungsformaten. Kurz gesagt: Wir unterstützen Unternehmen bei allen Aspekten der digitalen Transformation – seit …,5493356866,https://www.adzuna.de/details/5493356866?utm_medium=api&utm_source=a4bcf954,"{'__CLASS__': 'Adzuna::API::Response::Company', 'display_name': 'statworx'}","{'__CLASS__': 'Adzuna::API::Response::Location', 'display_name': 'Fechenheim, Frankfurt am Main', 'area': ['Deutschland', 'Hessen', 'Frankfurt am Main', 'Fechenheim']}",8.76072,50.12595,Trainee Data Science - Fokus NLP (alle Geschlechter),Adzuna::API::Response::Job,2025-11-13T12:53:03Z,"{'tag': 'it-jobs', 'label': 'IT-Stellen', '__CLASS__': 'Adzuna::API::Response::Category'}",eyJhbGciOiJIUzI1NiJ9.eyJpIjoiNTQ5MzM1Njg2NiIsInMiOiJKb2k0WWdiVThCR0h4ZjJSM0g2U1JBIn0.pzpordZsEjnX0CmJbFzPZQY91No43oXfFSQB3-snHGE,0,full_time,,,
"Sind Sie bereit, Teil eines Unternehmens zu werden, das die Lagerhaltung weltweit revolutioniert? Element Logic ist derzeit auf der Suche nach einem Werkstudent (m/w/d) Data Science / Automation , der Herausforderungen in einem internationalen Umfeld sucht! Unser Data Science-Team entwickelt gemeinsam mit unserem Orchestration-Team innovative Softwarelösungen zur Optimierung hochautomatisierter Lager. Wir nutzen modernste Methoden aus den Bereichen Data Science, Machine Learning und fortgeschri…",5524137640,https://www.adzuna.de/details/5524137640?utm_medium=api&utm_source=a4bcf954,"{'display_name': 'Element Logic', '__CLASS__': 'Adzuna::API::Response::Company'}","{'area': ['Deutschland', 'Baden-Württemberg', 'Esslingen (Kreis)', 'Leinfelden-Echterdingen'], 'display_name': 'Leinfelden-Echterdingen, Esslingen (Kreis)', '__CLASS__': 'Adzuna::API::Response::Location'}",9.14057,48.69447,Werkstudent (w/m/d) Data Science / Automation,Adzuna::API::Response::Job,2025-12-02T18:02:35Z,"{'tag': 'unknown', 'label': 'Unknown', '__CLASS__': 'Adzuna::API::Response::Category'}",eyJhbGciOiJIUzI1NiJ9.eyJzIjoiSm9pNFlnYlU4QkdIeGYyUjNINlNSQSIsImkiOiI1NTI0MTM3NjQwIn0.itNhI69HfdvU3N8nuomjoqkcEN8rPG1DsXln4ud7aOE,0,,,,
Bezeichnung: Wirtschaftsinformatik - Data Science / Bachelor of Science (DH) Eintrittsdatum: 01.10.2026 mit Vorpraktikum ab 01.09.2026 Standort: 71154 Nufringen bei Stuttgart Arbeitszeit: Vollzeit Ausbildungsinhalte: Grundlagen der Informationstechnik Methoden der Informatik Moderne IT-Technologien für die Entwicklung von Software-Systemen kennenlernen und anwenden Anwendung von Künstlicher Intelligenz und Big Data in wirtschaftinformatorischen Kontexten Methoden und Konzepte der Betriebswirtsc…,5501662011,https://www.adzuna.de/land/ad/5501662011?se=Joi4YgbU8BGHxf2R3H6SRA&utm_medium=api&utm_source=a4bcf954&v=4C96CFAC4A4F7D2EACDCBD04EC98B59646A755AD,"{'display_name': 'Ensinger GmbH', '__CLASS__': 'Adzuna::API::Response::Company'}","{'__CLASS__': 'Adzuna::API::Response::Location', 'display_name': 'Nufringen, Böblingen (Kreis)', 'area': ['Deutschland', 'Baden-Württemberg', 'Böblingen (Kreis)', 'Nufringen']}",8.89081,48.62307,Wirtschaftsinformatik - Data Science / Bachelor of Science (DH),Adzuna::API::Response::Job,2025-11-18T12:41:01Z,"{'tag': 'unknown', 'label': 'Unknown', '__CLASS__': 'Adzuna::API::Response::Category'}",eyJhbGciOiJIUzI1NiJ9.eyJpIjoiNTUwMTY2MjAxMSIsInMiOiJKb2k0WWdiVThCR0h4ZjJSM0g2U1JBIn0.pqW8ZrFvo4YohJtx-3mundvNAHBX0z4pMkWnw2WK-ZU,0,,,,
"Deine Aufgaben Analyse und Aufbereitung von Kundendaten zur Auslegung und Optimierung unserer Shuttle-Lagersysteme Entwicklung systematischer Datenpipelines für wiederkehrende Analysen (z. B. Kundendaten, Bestands- und Bewegungsdaten, Leistungsdaten) Unterstützung bei der Modellierung von Auslegungsszenarien und Performance-Berechnungen Mitarbeit beim Aufbau interner Tools für automatisierte Datenanalysen und Entscheidungsunterstützung Datenvisualisierung und Erstellung klarer, interpretierbare…",5529744479,https://www.adzuna.de/details/5529744479?utm_medium=api&utm_source=a4bcf954,"{'__CLASS__': 'Adzuna::API::Response::Company', 'display_name': 'advastore SE'}","{'display_name': 'Deutschland', '__CLASS__': 'Adzuna::API::Response::Location', 'area': ['Deutschland']}",,,Werkstudent (m/w/d) - Data Science & Analytics,Adzuna::API::Response::Job,2025-12-05T19:09:13Z,"{'tag': 'logistics-warehouse-jobs', 'label': 'Stellen aus Logistik & Lagerhaltung', '__CLASS__': 'Adzuna::API::Response::Category'}",eyJhbGciOiJIUzI1NiJ9.eyJpIjoiNTUyOTc0NDQ3OSIsInMiOiJxT0FFWkFiVThCRzJ2SmRSejZHUGZnIn0.TdmYK1tu2QbFcsOEXyJdy94egFaiwIKeuDSZxFpLn40,0,part_time,,,
"Senior Consultant Data Science (w/m/d) Job-Nr: 12025 Standorte: Karlsruhe Karrierelevel: Berufserfahrene Anstellungsart: Festanstellung Als Senior Consultant Data Science (w/m/d) wirst du Teil eines dynamischen Teams von Data-Experts, die innovative und datengesteuerte Lösungen für unsere Kunden entwickeln. Dabei arbeitest du eng mit erfahrenen Data Scientists zusammen und hast die Möglichkeit, an verschiedenen Projekten und Herausforderungen mitzuwirken. Deine Aufgaben Du bereitest komplexe Da…",5497413060,https://www.adzuna.de/details/5497413060?utm_medium=api&utm_source=a4bcf954,"{'__CLASS__': 'Adzuna::API::Response::Company', 'display_name': 'KPMG'}","{'__CLASS__': 'Adzuna::API::Response::Location', 'display_name': 'Hagsfeld, Karlsruhe', 'area': ['Deutschland', 'Baden-Württemberg', 'Karlsruhe (Kreis)', 'Karlsruhe', 'Hagsfeld']}",8.45882,49.03084,Senior Consultant Data Science (w/m/d),Adzuna::API::Response::Job,2025-11-15T17:50:12Z,"{'label': 'IT-Stellen', 'tag': 'it-jobs', '__CLASS__': 'Adzuna::API::Response::Category'}",eyJhbGciOiJIUzI1NiJ9.eyJpIjoiNTQ5NzQxMzA2MCIsInMiOiJxT0FFWkFiVThCRzJ2SmRSejZHUGZnIn0.60zQSsffdI3fSJ-2upu5K6wrdsy-_VTudour27OzBTA,0,,permanent,,
"Senior Consultant Data Science (w/m/d) Job-Nr: 12025 Standorte: Stuttgart Karrierelevel: Berufserfahrene Anstellungsart: Festanstellung Als Senior Consultant Data Science (w/m/d) wirst du Teil eines dynamischen Teams von Data-Experts, die innovative und datengesteuerte Lösungen für unsere Kunden entwickeln. Dabei arbeitest du eng mit erfahrenen Data Scientists zusammen und hast die Möglichkeit, an verschiedenen Projekten und Herausforderungen mitzuwirken. Deine Aufgaben Du bereitest komplexe Da…",5499293823,https://www.adzuna.de/details/5499293823?utm_medium=api&utm_source=a4bcf954,"{'display_name': 'KPMG', '__CLASS__': 'Adzuna::API::Response::Company'}","{'area': ['Deutschland', 'Baden-Württemberg', 'Stuttgart', 'Mitte'], '__CLASS__': 'Adzuna::API::Response::Location', 'display_name': 'Mitte, Stuttgart'}",9.18071,48.77713,Senior Consultant Data Science (w/m/d),Adzuna::API::Response::Job,2025-11-16T17:40:51Z,"{'label': 'IT-Stellen', 'tag': 'it-jobs', '__CLASS__': 'Adzuna::API::Response::Category'}",eyJhbGciOiJIUzI1NiJ9.eyJzIjoicU9BRVpBYlU4QkcydkpkUno2R1BmZyIsImkiOiI1NDk5MjkzODIzIn0.XibxPbEpdmxqZmbzXP673j8zE5hbEQYxUJAUAknKWSQ,0,,permanent,,
"Senior Consultant Data Science (w/m/d) Job-Nr: 12025 Standorte: Mannheim Karrierelevel: Berufserfahrene Anstellungsart: Festanstellung Als Senior Consultant Data Science (w/m/d) wirst du Teil eines dynamischen Teams von Data-Experts, die innovative und datengesteuerte Lösungen für unsere Kunden entwickeln. Dabei arbeitest du eng mit erfahrenen Data Scientists zusammen und hast die Möglichkeit, an verschiedenen Projekten und Herausforderungen mitzuwirken. Deine Aufgaben Du bereitest komplexe Dat…",5496063593,https://www.adzuna.de/details/5496063593?utm_medium=api&utm_source=a4bcf954,"{'display_name': 'KPMG', '__CLASS__': 'Adzuna::API::Response::Company'}","{'__CLASS__': 'Adzuna::API::Response::Location', 'display_name': 'Neuostheim, Mannheim', 'area': ['Deutschland', 'Baden-Württemberg', 'Mannheim', 'Neuostheim']}",8.50014,49.46856,Senior Consultant Data Science (w/m/d),Adzuna::API::Response::Job,2025-11-14T14:41:56Z,"{'label': 'IT-Stellen', 'tag': 'it-jobs', '__CLASS__': 'Adzuna::API::Response::Category'}",eyJhbGciOiJIUzI1NiJ9.eyJpIjoiNTQ5NjA2MzU5MyIsInMiOiJxT0FFWkFiVThCRzJ2SmRSejZHUGZnIn0.OfkMZk2igxyGd0ZTjGqxYumAfNpEKlTv_5mKCRua2LY,0,,permanent,,
"Senior Consultant Data Science (w/m/d) Job-Nr: 12025 Standorte: Mainz Karrierelevel: Berufserfahrene Anstellungsart: Festanstellung Als Senior Consultant Data Science (w/m/d) wirst du Teil eines dynamischen Teams von Data-Experts, die innovative und datengesteuerte Lösungen für unsere Kunden entwickeln. Dabei arbeitest du eng mit erfahrenen Data Scientists zusammen und hast die Möglichkeit, an verschiedenen Projekten und Herausforderungen mitzuwirken. Deine Aufgaben Du bereitest komplexe Daten …",5496063592,https://www.adzuna.de/details/5496063592?utm_medium=api&utm_source=a4bcf954,"{'__CLASS__': 'Adzuna::API::Response::Company', 'display_name': 'KPMG'}","{'display_name': 'Oberstadt, Mainz', '__CLASS__': 'Adzuna::API::Response::Location', 'area': ['Deutschland', 'Rheinland-Pfalz', 'Mainz', 'Oberstadt']}",8.26743,49.99512,Senior Consultant Data Science (w/m/d),Adzuna::API::Response::Job,2025-11-14T14:41:56Z,"{'label': 'IT-Stellen', 'tag': 'it-jobs', '__CLASS__': 'Adzuna::API::Response::Category'}",eyJhbGciOiJIUzI1NiJ9.eyJpIjoiNTQ5NjA2MzU5MiIsInMiOiJxT0FFWkFiVThCRzJ2SmRSejZHUGZnIn0.-yXqL7pbeJRX8FZmg_PtrkGNfjKZW4a0J8HL_NEcY5w,0,,permanent,,
